-1	misscarlybaker it s my birthday tomorrow 42 years of age please can i have a tweet it would mean the world x
-1	hollywood_wife it s my birthday tomorrow 42 years of age please can i have a tweet it would mean the world x
-1	jacquiryland it s my birthday tomorrow 42 years of age please can i have a tweet it would mean the world x
-1	realkathylloyd it s my birthday tomorrow 42 years of age please can i have a tweet it would mean the world x
-1	why be afraid of tomorrow when today is all we have elizabeth the golden age 2007
-1	starting tomorrow i can say that i m seeing age of ultron next week that makes me much http t co r2ejx8vq6r http t co waaxlmb6c7
-1	starting tomorrow i can say that i m seeing age of ultron next week that makes me much happier than it should
-1	rt donhertzfeldt world of tomorrow features the voice of the brilliant juliapott in her first acting role opposite my niece age 4 htt
-1	why be afraid of tomorrow when today is all we have elizabeth the golden age 2007
-1	room94 i m babysitting 2 kids under the age of 5 for 3 hours during the day tomorrow wish me luck as it could go horribly wrong oxox
-1	rt unicornland12 may someone please take me to the age of ultron premiere tomorrow pretty please
-1	leiburtonaherne so true plus there s a new trailer for ant man tomorrow and age of ultron http t co r2ejx8vq6r http t co rcnuu2tjud
-1	leiburtonaherne so true plus there s a new trailer for ant man tomorrow and age of ultron is only 11 days away
-1	photo i am beyond excited to attend the world premiere of avengers age of ultron tomorrow and i ll be http t co gcfwjqnqct
-1	i am beyond excited to attend the world premiere of avengers age of ultron tomorrow and i ll be https t co 0ch3hsiij8
-1	i want to go to the world premier of the avengers age of ultron tomorrow watch http t co r2ejx8vq6r http t co xspnejltqd
-1	i want to go to the world premier of the avengers age of ultron tomorrow
-1	life goes on come of age time rolls on whipe these eyes yesterday laughs tomorrow cries
-1	see you tomorrow in tallinn cinema kino supernova at 7pm http t co 5ojo5hhit3
-1	rt unicornland12 may someone please take me to the age of ultron premiere tomorrow pretty please
-1	may someone please take me to the age of ultron premiere tomorrow pretty please
-1	new pr today bench 205kg 451lbs deadlift 260kg 573lbs weight 75kg age 17 videos up tomorrow so proud of myself
-1	celebrating the last few hours of the age i am now before tomorrow day3 birthdayweekend
-1	marvel if anyone has an extra two tickets to watch the age of ultron at the premier tomorrow i want to go http t co jooo9k91cd
-1	for the first time the cast of avengers ageofultron will be on jimmykimmellive tomorrow monday 4 13 http t co ranmp5pnno
-1	can t believe i m gonna be a brace face at the age of 22 tomorrow fuckk gotta do what ya gotta do nicejibs
-1	tomorrow 13th april 2015 the kabaka of buganda is making 60 years of age type here your birthday messages to him
-1	i m at the point of age where today i think i m fine tomorrow i ll think i m fat the next day i ll think i m ugly and the cycle continues
-1	mingna hey love is the cast of agents of shield going to the avengers age of ultron premiere tomorrow
-1	tomorrow is a good day avengers age of ultron has its world premiere plus game of thrones season 5 airs in the uk
-1	rt hehehiddles age of ultron premiere tomorrow
-1	you re invited tomorrow 11am mindfulness in the age of twitter by judithvalente heartland_cc in ccb room 1406 http t co iwyrric1ji
-1	rt hehehiddles age of ultron premiere tomorrow
-1	rt marvelheaven in one day tomorrow watch the marvel s avengers age of ultron hollywood p http t co swxv02q7ix
-1	in one day tomorrow watch the marvel s avengers age of ultron hollywood p http t co r2ejx8vq6r http t co mfwtj5ghok
-1	in one day tomorrow watch the marvel s avengers age of ultron hollywood p http t co swxv02q7ix
-1	rt hehehiddles age of ultron premiere tomorrow
-1	rt hehehiddles age of ultron premiere tomorrow
-1	11 days left until age of ultron i ll start my mcu marathon rewatch tomorrow night
-1	rt hehehiddles age of ultron premiere tomorrow
-1	rt hehehiddles age of ultron premiere tomorrow
-1	rt hehehiddles age of ultron premiere tomorrow
-1	rt hehehiddles age of ultron premiere tomorrow watch http t co r2ejx8vq6r http t co pp2u2scbfr
-1	rt hehehiddles age of ultron premiere tomorrow watch http t co r2ejx8vq6r http t co tplyay5mf5
-1	rt hehehiddles age of ultron premiere tomorrow watch http t co r2ejx8vq6r http t co exuuj83kae
-1	rt hehehiddles age of ultron premiere tomorrow
-1	rt hehehiddles age of ultron premiere tomorrow
-1	rt hehehiddles age of ultron premiere tomorrow
-1	age of ultron premiere tomorrow holy shit
-1	rt hehehiddles age of ultron premiere tomorrow
-1	rt hehehiddles age of ultron premiere tomorrow
-1	rt hehehiddles age of ultron premiere tomorrow
-1	rt hehehiddles age of ultron premiere tomorrow
-1	rt hehehiddles age of ultron premiere tomorrow
-1	hehehiddles age of ultron premiere tomorrow we re all gonna dieeee
-1	rt hehehiddles age of ultron premiere tomorrow
-1	age of ultron premiere tomorrow
-1	publishing for digital minds is tomorrow perfect start to lb amp sw for those serious about the future of their businesses in the digital age
-1	peep my chat with top actor sa host zikhonasodlaka in tomorrow s edition of the_new_age https t co bppeqj4xp7
-1	why be afraid of tomorrow when today is all we have elizabeth the golden age 2007
-1	rt legalnomads tomorrow i m joining some great photogs to discuss photos in an internet age sign up here http t co uht79yvbr8 part
-1	why be afraid of tomorrow when today is all we have elizabeth the golden age 2007
-1	age of ultron premiere tomorrow im stoked murag muadto ba but still
-1	why be afraid of tomorrow when today is all we have elizabeth the golden age 2007
-1	age of ultron premiere t t tomorrow
-1	nowplaying the jet age of tomorrow but she s not my lover syndicatedhh http t co oodkuxfbya fb
-1	nowplaying the jet age of tomorrow but she s not my lover on epradio http t co nu3sovvjnl
-1	rt grettama tomorrow is age of ultron world premiere well shuck i dont have anyone to shuck tho iamgoingcrazy
-1	the analog program designed twenty years ago to meet the digital age of tomorrow http t co cokfqb1jtx
-1	rt amediocrewave he said the police will be round tomorrow because she s not of consenting age fml
-1	he said the police will be round tomorrow because she s not of consenting age fml
-1	rt legalnomads tomorrow i m joining some great photogs to discuss photos in an internet age sign up here http t co uht79yvbr8 part
-1	tomorrow i m joining some great photogs to discuss photos in an internet age sign up here http t co uht79yvbr8 part of nytravfest
-1	nowplaying jet age of tomorrow the betty s room syndicatedhh http t co oodkuxfbya fb
-1	nowplaying jet age of tomorrow the betty s room on epradio http t co nu3sovvjnl
-1	tomorrow is age of ultron world premiere well shuck i dont have anyone to shuck tho iamgoingcrazy
-1	lady didn t even give me a chance bc of my age hope second time goes better tomorrow
-1	lodocomello tomorrow you are entering a new age god i m proud of you
-1	that review of last night s tv is from tomorrow s paper but we re reading it today this is an age of miracles amp wonders wearethejetsons
-1	tomorrow is already here the age of notifications https t co eqaxldvvvg http t co cby0ovjucz
-1	caroline wilson to demand james hird s resignation in tomorrow s age it was rigged she will claim that light in the corner of her eye
-1	will be playing some age of mythology tomorrow lt 3 can t wait to stream make sure you come out http t co bvmgx8336i
-1	why be afraid of tomorrow when today is all we have elizabeth the golden age 2007
-1	why be afraid of tomorrow when today is all we have elizabeth the golden age 2007
-1	the jet age of tomorrow juney jones http t co 3uixb0qbmd
-1	feel like doing a little cover of act my age on instagram tomorrow fav this if i should
-1	the internet or the jet age of tomorrow
-1	rt colliderfrosty seeing avengers age of ultron tomorrow night just heard no social media embargo after screening means disney is very
-1	reminder that tomorrow we ll have a never seen before footage just like rdjr said from age of ultron getexited http t co f4fe8qrval
-1	starlightroian she s playing for gold for her age group for all of ontario tomorrow and i will
-1	his daughter ran a 27 in the 200 at the age of 7 http t co z4ne7jslkl
-1	jordanspieth is 21 amp instead of getting bachelors at this age he is cruising into final round tomorrow to get themasters
-1	the first half of the national age team ready to race tomorrow http t co rk2gdf7qgb
-1	game of thrones comes back tomorrow na we live in the internet age it s already back baby
-1	rt coam filmed in 95 locations 18 countries 7 continents airplanesmovie opens tomorrow http t co gfz98bvjyw http t co ddgu1hqedm
-1	why be afraid of tomorrow when today is all we have elizabeth the golden age 2007
-1	why be afraid of tomorrow when today is all we have elizabeth the golden age 2007
-1	jambster ash_k23 will finish the entire series tomorrow things getting in the way of me finishing it tonight like old age etc etc
-1	tomorrow is a big day watch premiere red carpet avengers age of ultron here http t co vifzf06b5y live
-1	georgie_t it does however solve the age old problem of i m going out for a nice dinner but then i want to dance until tomorrow
-1	packing is so stressful because what if you need those three pairs of jeans for that possible ice age that could hit tomorrow in florida
-1	rt deborahutchens unless jordanspieth totally falls apart tomorrow he will win themasters at the age of 21 currently he has a 7 shot
-1	barnesbigman justinrose99 correct big chap 21 years of age 64 66 and a 70 that s special ano tomorrow is massive but he wants it masters
-1	new ant man trailer tomorrow that and age of ultron are looking insane
-1	rt deborahutchens unless jordanspieth totally falls apart tomorrow he will win themasters at the age of 21 currently he has a 7 shot
-1	rory mcilroy held a 4 shot lead into sunday in 2011 at the age of 21 he lost spieth has a 4 shot lead heading into tomorrow he s 21
-1	this chap will need some balls to hold out and win tomorrow 22 years of age fair play to him rorywho
-1	tomorrow s gold asia s age of discovery by marc faber 2002 paperback http t co klvfv1siqt http t co dobvhd28pt
-1	bought advanced screening for age of ultron and i have a date tomorrow this day is beautiful holy hell
-1	unless jordanspieth totally falls apart tomorrow he will win themasters at the age of 21 currently he has a 7 shot lead
-1	and now i am going to bed because my life sucks and i have to study tomorrow i ll be fangirling in my dreams because age of ultronskajaowir
-1	rt billyloveclogh the best of luck tomorrow to the 3 kilkenny under age handball teams who contest the all ireland semi finals and if su
-1	all of these age of ultron press tour pictures are wrecking me how am i supposed to make it through tomorrow night when they re on stage
-1	orphan black is back in a week game of thrones starts again tomorrow age of ultron is in 10 days what a great time to be alive
-1	rt failterstaurant f ilte is 5 years of age tomorrow retweet this tweet for a chance to win our special prize http t co aojhxawxbz
-1	the best of luck tomorrow to the 3 kilkenny under age handball teams who contest the all ireland semi finals and if successful the finals
-1	rt failterstaurant f ilte is 5 years of age tomorrow retweet this tweet for a chance to win our special prize http t co aojhxawxbz
-1	rt failterstaurant f ilte is 5 years of age tomorrow retweet this tweet for a chance to win our special prize http t co aojhxawxbz
-1	rt failterstaurant f ilte is 5 years of age tomorrow retweet this tweet for a chance to win our special prize http t co aojhxawxbz
-1	he was their inspiration arclightpresents dead poets society tomorrow night reserve http t co tswhgofjyt http t co hknwnjpqhr
-1	see you tomorrow at one of our services at 9 15 holy communion at 11 all age service or at our 6 30 evening service
-1	rt citysoundpro after announcing the secret garden today we ll be announcing our heritage venues tomorrow they have a combined age
-1	rt citysoundpro after announcing the secret garden today we ll be announcing our heritage venues tomorrow they have a combined age
-1	rt citysoundpro after announcing the secret garden today we ll be announcing our heritage venues tomorrow they have a combined age
-1	after announcing the secret garden today we ll be announcing our heritage venues tomorrow they have a combined age of nearly 2000 yrs
-1	can someone please take me to la for the avengers age of ultron red carpet premiere tomorrow
-1	final part of photo shoot prep starts tomorrow looking forward to first ever shoot fitographer age is a number not an excuse fitatfifty
-1	i will be 19 years of age tomorrow
-1	game of thrones is back tomorrow and age of ultron is out soon n that s all that really ma http t co r2ejx8vq6r http t co eijcrlwats
-1	game of thrones is back tomorrow and age of ultron is out soon n that s all that really matters folks x
-1	why be afraid of tomorrow when today is all we have elizabeth the golden age 2007
-1	i have tomorrow off so i get to watch the mtv awards which i m watching for the age of u http t co r2ejx9d0yp http t co h9xov33qzz
-1	i have tomorrow off so i get to watch the mtv awards which i m watching for the age of ultron sneak peek
-1	why be afraid of tomorrow when today is all we have elizabeth the golden age 2007
-1	why be afraid of tomorrow when today is all we have elizabeth the golden age 2007
-1	rt sundaytimesza in an age of automation do we still need pilots gt in sundaytimes travel weekly tomorrow
-1	rt sundaytimesza in an age of automation do we still need pilots gt in sundaytimes travel weekly tomorrow
-1	montysdognigel at the grand old age of 36 i just used a lawnmower for the 1st time you are welcome to visit now planting salad tomorrow
-1	rt sundaytimesza in an age of automation do we still need pilots gt in sundaytimes travel weekly tomorrow
-1	rt sundaytimesza in an age of automation do we still need pilots gt in sundaytimes travel weekly tomorrow
-1	in an age of automation do we still need pilots gt in sundaytimes travel weekly tomorrow
-1	jet age of tomorrow a place where lovers go
-1	brightonmarathn good luck to all tomorrow brighton was my 1 amp only marathon at the age of 48 it was such a magical day amp so well organised
-1	mums will always be mums no mattzr your age mine sent me a whole message full of advices for tomorrow allezletsdoit
-1	the philosophies of one age have become the absurdities of the next and the foolishness of yesterday has become the wisdom of tomorrow
-1	why be afraid of tomorrow when today is all we have elizabeth the golden age 2007
-1	rt wellington1884 tomorrow 7 00 pm evening service in wellington three score years and ten a testament of age led by dr glenda whi
-1	tomorrow 7 00 pm evening service in wellington three score years and ten a testament of age led by dr glenda white glasgow
-1	rt colliderfrosty seeing avengers age of ultron tomorrow night just heard no social media embargo after screening means disney is very
-1	rt aliciavitarelli just saw the avengers age of ultron fantastic deep funny interviews tomorrow
-1	age of tomorrow
-1	rt coam filmed in 95 locations 18 countries 7 continents airplanesmovie opens tomorrow http t co gfz98bvjyw http t co ddgu1hqedm
-1	jet age of tomorrow telephones
-1	introducing smartbox amp x2014 physical mail for the digital age http t co euqeyunjc5 google http t co ztzzwbsgc2
-1	i liked a youtube video http t co kdmfbzkn7n the jet age of tomorrow lunchbox feat vince staples amp jq
-1	cactus plays an altered setlist tomorrow at city centre 2 to reach out to a wider audience of all age https t co rjuyvayskz
-1	the pain of today is a training for tomorrow success and a story to tell at old age be strong be rightous be a man of good dream
-1	expect a new mini podcast tomorrow about deaths in avengers age of ultron avengers marvel
-1	tomorrow is gonna be weird the first funeral of someone my age that i knew of all people i definitely didn t expect it to be you
-1	rt coam filmed in 95 locations 18 countries 7 continents airplanesmovie opens tomorrow http t co gfz98bvjyw http t co ddgu1hqedm
-1	rt coam filmed in 95 locations 18 countries 7 continents airplanesmovie opens tomorrow http t co gfz98bvjyw http t co ddgu1hqedm
-1	rt coam filmed in 95 locations 18 countries 7 continents airplanesmovie opens tomorrow http t co gfz98bvjyw http t co ddgu1hqedm
-1	rt coam filmed in 95 locations 18 countries 7 continents airplanesmovie opens tomorrow http t co gfz98bvjyw http t co ddgu1hqedm
-1	rt coam filmed in 95 locations 18 countries 7 continents airplanesmovie opens tomorrow http t co gfz98bvjyw http t co ddgu1hqedm
-1	rt coam filmed in 95 locations 18 countries 7 continents airplanesmovie opens tomorrow http t co gfz98bvjyw http t co ddgu1hqedm
-1	rt coam filmed in 95 locations 18 countries 7 continents airplanesmovie opens tomorrow http t co gfz98bvjyw http t co ddgu1hqedm
-1	rt asykes_hockey time flies seems like yesterday titans tourney kicked off the season best of luck to the 99 age group tomorrow enjoy
-1	rt sippycupmom we will be interviewing james spader and paul bettany tomorrow for avengers age of ultron any questions avengersevent
-1	rt asykes_hockey time flies seems like yesterday titans tourney kicked off the season best of luck to the 99 age group tomorrow enjoy
-1	time flies seems like yesterday titans tourney kicked off the season best of luck to the 99 age group tomorrow enjoy the day ohldraft
-1	busy fortnight of work starts tomorrow almost doubling workload and working 6 days a week only day off is for overnight age of ultron
-1	why be afraid of tomorrow when today is all we have elizabeth the golden age 2007
-1	rt sippycupmom we will be interviewing james spader and paul bettany tomorrow for avengers age of ultron any questions avengersevent
-1	rt coam filmed in 95 locations 18 countries 7 continents airplanesmovie opens tomorrow http t co gfz98bvjyw http t co ddgu1hqedm
-1	we will be interviewing james spader and paul bettany tomorrow for avengers age of ultron any questions avengersevent
-1	nationalsiblingsday this is me and the sister closest to me in age i get to see most of the family tomorrow http t co hanstnotpw
-1	worst film i have ever made the mistake of watching that s easy age of tomorrow ageoftomorrow cheapfilm badfilm toomanydeaths
-1	jasonepowell today i ll say the age of innocence ask tomorrow and it ll be something different
-1	why be afraid of tomorrow when today is all we have elizabeth the golden age 2007
-1	i m playing river city aleworks tomorrow night from 9pm to 1am if you re over the age of 18 come on down
-1	rt colliderfrosty seeing avengers age of ultron tomorrow night just heard no social media embargo after screening means disney is very
-1	um wise old jo and i are soulmates of the same age lol still wish i could go tomorrow but it s a hockey http t co 3pwy0iyh6k
-1	age of tomorrow dvd 2014 sku 1764 http t co qksho7qrie http t co jlzbk6iwm6
-1	rt 8dcomix 3 weeks from tomorrow 5 2 15 we re gonna have an epic freecomicbook day and avengers age of ultron at houstonalamo deta
-1	3 weeks from tomorrow 5 2 15 we re gonna have an epic freecomicbook day and avengers age of ultron at houstonalamo details to come
-1	why be afraid of tomorrow when today is all we have elizabeth the golden age 2007
-1	rodrigocapilla2 avengers age of ultron in 2 weeks and new ultimate spider man tomorrow
-1	rt meijinmo jet age of tomorrow ft kilo kish
-1	at a 2 year old frozen b day party tomorrow with a bunch of screaming kids under the age of 7 pls send help and ear plugs
-1	rt meijinmo jet age of tomorrow ft kilo kish
-1	jet age of tomorrow ft kilo kish
-1	join us tomorrow from 9 10am for our puppy social at camp puppies 8 14 weeks of age who are current on http t co tedf8srlw1
-1	me and lauren are taking matching shaun the sheep lunchboxes to london tomorrow because we have the mental age of 6 year olds
-1	how do people our age know who they want to spend the rest of their lives with i don t even know what i want for breakfast tomorrow morning
-1	why be afraid of tomorrow when today is all we have elizabeth the golden age 2007
-1	can not believe i have lasted since january without having beer definitely getting drunk tomorrow acting like 50 years of age instead of 22
-1	golden age ministry will have fried catfish fillets fries choice of two sides for 8 00 each tomorrow 11am 2pm in the fellowship hall
-1	ronaldkoeman we are bringing my mum to her 1st bpl match tomorrow at age of 76 she is so excited chapel stand need pic with sammy saint
-1	kids asleep all excited to be hading to sol tomorrow to see cpfc hoping for goals to celebrate my 40th coming of age
-1	don t get internet at my new place until tomorrow guess it s time for age of empires ii campaign 3
-1	age of tomorrow 2014 action thriller scifi avoid this bad multiply derivative effort by asylum films 1 5 http t co tgkr550vsx
-1	9 8 year olds run tomorrow the last horse of this age group to win being bindaree in 2002
-1	we have a full day of classes tomorrow come down and take part 9 30am ballet amp tap age 2 4 4 10 15am ballet amp http t co ed5vmgijc3
-1	why be afraid of tomorrow when today is all we have elizabeth the golden age 2007
-1	msyonce i hope beyonce dies of old age tomorrow
-1	the jet age of tomorrow jellyfish mentality
-1	ive got to the age where the excitement of a nandos tomorrow night is more exciting than anything alcohol related ever
-1	rt sippycupmom i ll be interviewing the cast kevin feige and joss whedon tomorrow any avengers age of ultron questions avengersevent
-1	rt sippycupmom i ll be interviewing the cast kevin feige and joss whedon tomorrow any avengers age of ultron questions avengersevent
-1	i ll be interviewing the cast kevin feige and joss whedon tomorrow any avengers age of ultron questions avengersevent
-1	verossimo tomorrow watching avengers age of ultron 2015 at http t co vjl5yfyxfu movie film streaming http t co g3irzse6u1
-1	rt neweraeurope preview new era x avengers age of ultron launches tomorrow here s a taster http t co 1if1jltguh neweraavengers htt
-1	rt ubercoolstuff tomorrow at the gamecrawl if you can storm uber castle you win a free copy of age of war http t co mnwi624vuu
-1	tomorrow i ll do a long age of mythology stream with maybe something afterwards not sure about the exact timeframe yet
-1	ken walston book signing tomorrow at weiser classic candy 11 1 for his new book the golden age of weiser idaho
-1	winststaidans veteran keeper rob_alcock1 to make long awaited come back tomorrow at the ripe old age of 39 experienceiskey
-1	rt colliderfrosty seeing avengers age of ultron tomorrow night just heard no social media embargo after screening means disney is very
-1	why be afraid of tomorrow when today is all we have elizabeth the golden age 2007
-1	i am not talking to anyone under the age of 21 tomorrow i need some grown up conversation
-1	normally i would be super depressed that i can t join my first of age pubcrawl but than i remember i m about to make bank tomorrow
-1	my discouragement for the day tomorrow i turn 33 at age 27 john calvin published his institutes of the christian religion
-1	rt colliderfrosty seeing avengers age of ultron tomorrow night just heard no social media embargo after screening means disney is very
