-1	rt londellmcmillan congrats to kylaimani for surpassing 1 mil views spread the word to kids age 10 15 about tomorrow s video casting ht
-1	rt rathcoolepci also if you are of secondary school age then connect youth fellowship is on tomorrow evening from 7 45pm rathcoolepci c
-1	also if you are of secondary school age then connect youth fellowship is on tomorrow evening from 7 45pm rathcoolepci connect
-1	jamiecdixon freedombarsoho no doubt we ll be there tomorrow night celebrating christina s coming of age x
-1	i work at a cinema so i get to see avenger age of ultron tomorrow staff get the film ear http t co r2ejx8vq6r http t co scanjoucfh
-1	i work at a cinema so i get to see avenger age of ultron tomorrow staff get the film early don t worry i won t spoil blackfire might
-1	rt abilitydrain tomorrow is the return of dragon age d amp d stream with scottishw92 ladyinsanity gamermd83 myself and our new recruit
-1	22avelondon shoppingwoman1 http t co yfdtlkrq3x is a glass of wine you can feel good about greenshopping for today and a tomorrow
-1	age of upton is out tomorrow in the uk really tempted to go see it but it ll be packed
-1	rt agnewjason passes to the sneak preview of avengers age of ultron tomorrow on sunday morning trivia
-1	all age worship tomorrow at 10 30am includes baptism of tia friend everyone welcome
-1	according to google age of ultron is in theaters tomorrow theyoungerfinn why didn t you know this http t co rqh6ku78vw
-1	tomorrow sun 19 april our service is at 9 15am amp is family all age worship with theme the word of life 1 john 1 1 4 john 1 1 9
-1	when joff was born we were told that he wouldn t reach the age of 8 when he wakes up tomorrow he ll https t co z8l2stthsq
-1	audition tomorrow the agony and ecstasy of steve jobs calling for 9 actors of any gender race or age http t co vsyapbbvoc
-1	well done lewicarlin win more premier tix tomorrow kissavengers http t co bnmy1ffptd
-1	passes to the sneak preview of avengers age of ultron tomorrow on sunday morning trivia
-1	scored advanced screening tickets to age of adaline tomorrow thanks for the heads up nyutix
-1	19 years of age tomorrow a privilege taken away from many
-1	going to be uploading a video about the generalelection tomorrow and why everyone of voting age needs to vote
-1	so apparently the australian premiere for avengers age of ultron is tomorrow night did anyone actually win the iamanavengercomp
-1	can t even describe how excited i am for age of adaline tomorrow ageofadaline mumandsondate excited filmreview
-1	blg children our hope for tomorrow children are gifts from god our pillars in old age our source of joy and http t co yf1akjwv2o
-1	robtdaly thanks rob tomorrow s game could possibly be the most interesting of the season a potentially major coming of age moment
-1	so age of ultron releases tomorrow
-1	congrats to kylaimani for surpassing 1 mil views spread the word to kids age 10 15 about tomorrow s video casting http t co ftepqkbvms
-1	why be afraid of tomorrow when today is all we have elizabeth the golden age 2007
-1	i was thinking that the crew screeing on age of ultron tomorrow might be the highlight of my weekend but rachaelatwork now follows me
-1	last game of the season tomorrow it seems a age since our last game so really looking forward to getting the lads back into action
-1	rt tonybaxter1 tbaxter0 reecejenn higgsy stiffening up has reduced ave age of 1 s to 24 good luck amp enjoy today tomorrow blackley
-1	tbaxter0 reecejenn higgsy stiffening up has reduced ave age of 1 s to 24 good luck amp enjoy today tomorrow blackleycc1
-1	stephhpatino thank you next year when ur actually of age ahaha or maybe tomorrow
-1	tomorrow the old vic gala academy of country music awards stereokicks gig tribeca montage of heck screening age of adaline premiere
-1	tomorrow is long awaited birthday i get used to 18 years of age and one year dating mihiro three https t co d5hezmvrwn
-1	why be afraid of tomorrow when today is all we have elizabeth the golden age 2007
-1	why be afraid of tomorrow when today is all we have elizabeth the golden age 2007
-1	age of tomorrow
-1	you are beyond that age a baby a sense of doubt and what if you die tomorrow a part of it
-1	tomorrow would be the 20th birthday of a girl who passed away at the age of 17 a month before her birthday lacey you re missed
-1	rt greatfilmsquote why be afraid of tomorrow when today is all we have elizabeth the golden age 2007
-1	if anyone 18 years of age would like to go to the movies tomorrow with me and friends please hit me up rn
-1	looking forward to seeing this tomorrow gt the age of adaline 2015 official trailer https t co 3uymyw4gu0 via youtube
-1	rt abilitydrain tomorrow is the return of dragon age d amp d stream with scottishw92 ladyinsanity gamermd83 myself and our new recruit
-1	four children under the age of 5 in one house an all of them are awake right now an have to be up early tomorrow watch the eff out
-1	seeing an early screening of the age of adaline tomorrow so excited
-1	nowplaying jet age of tomorrow the 5th echelon syndicatedhh http t co oodkuxfbya fb
-1	nowplaying jet age of tomorrow the 5th echelon on epradio http t co nu3sovvjnl
-1	first race of the year for me is tomorrow i ll also be in a new age group tomorrow hopefully i https t co 0hbpnufepa
-1	why be afraid of tomorrow when today is all we have elizabeth the golden age 2007
-1	rt uncanny_pop next saturday night is upopmovienight we re watching next avengers heroes of tomorrow in honor of age of ultron being re
-1	next saturday night is upopmovienight we re watching next avengers heroes of tomorrow in honor of age of ultron being released may 1st
-1	i m going to a wedding tomorrow eek my first wedding since the age of 9 not including my wedding
-1	tomorrow is my birthday i usually do the amount of push ups according to my age did them with no problem this morning stronger
-1	rt abilitydrain tomorrow is the return of dragon age d amp d stream with scottishw92 ladyinsanity gamermd83 myself and our new recruit
-1	rt thesource congrats to kylaimani for surpassing 1 mil views spread the word to kids age 10 15 about tomorrow s video casting http t
-1	rt londellmcmillan congrats to kylaimani for surpassing 1 mil views spread the word to kids age 10 15 about tomorrow s video casting ht
-1	don t forget the festival tomorrow lots of fun for all age groups we are offering instore reductions for http t co kaup75pn5x
-1	jnfletcha i ll be shocked if he s not taken out later and on the dl tomorrow guys made of glass in his old age
-1	rt londellmcmillan congrats to kylaimani for surpassing 1 mil views spread the word to kids age 10 15 about tomorrow s video casting ht
-1	rt londellmcmillan congrats to kylaimani for surpassing 1 mil views spread the word to kids age 10 15 about tomorrow s video casting ht
-1	rt rightsidenews bombiran nukes back to the stone age or they will bomb israel tomorrow http t co rshysg4q4u irantalks irandeal http
-1	bombiran nukes back to the stone age or they will bomb israel tomorrow http t co rshysg4q4u irantalks irandeal http t co qrrjesl7qh
-1	rt thesource congrats to kylaimani for surpassing 1 mil views spread the word to kids age 10 15 about tomorrow s video casting http t
-1	make sure you pick up your 2 for 1 movie pass to age of adaline at tomorrow s market you ll find a map and all http t co hivvtem7m6
-1	if everything goes right picking up another cbr tomorrow older model but profit doesn t care about age of the vehicle
-1	rt abilitydrain tomorrow is the return of dragon age d amp d stream with scottishw92 ladyinsanity gamermd83 myself and our new recruit
-1	rt abilitydrain tomorrow is the return of dragon age d amp d stream with scottishw92 ladyinsanity gamermd83 myself and our new recruit
-1	d 1 hbd to me live a life age of 16 for the last time tomorrow i m 17 year old i wish https t co 0nmryrgzgx
-1	rt thesource congrats to kylaimani for surpassing 1 mil views spread the word to kids age 10 15 about tomorrow s video casting http t
-1	rt londellmcmillan congrats to kylaimani for surpassing 1 mil views spread the word to kids age 10 15 about tomorrow s video casting ht
-1	rt thesource congrats to kylaimani for surpassing 1 mil views spread the word to kids age 10 15 about tomorrow s video casting http t
-1	rt abilitydrain tomorrow is the return of dragon age d amp d stream with scottishw92 ladyinsanity gamermd83 myself and our new recruit
-1	rt abilitydrain tomorrow is the return of dragon age d amp d stream with scottishw92 ladyinsanity gamermd83 myself and our new recruit
-1	why be afraid of tomorrow when today is all we have elizabeth the golden age 2007
-1	might just play coming of age all day tomorrow to celebrate the weather
-1	rt abilitydrain tomorrow is the return of dragon age d amp d stream with scottishw92 ladyinsanity gamermd83 myself and our new recruit
-1	congrats to kylaimani for surpassing 1 mil views spread the word to kids age 10 15 about tomorrow s video casting http t co irzw3nitiv
-1	rt thesource congrats to kylaimani for surpassing 1 mil views spread the word to kids age 10 15 about tomorrow s video casting http t
-1	rt abilitydrain tomorrow is the return of dragon age d amp d stream with scottishw92 ladyinsanity gamermd83 myself and our new recruit
-1	rt abilitydrain tomorrow is the return of dragon age d amp d stream with scottishw92 ladyinsanity gamermd83 myself and our new recruit
-1	so i definitely plan on streaming tomorrow it will more than likely be child of light blind or continuing my 3rd character on dragon age
-1	rt abilitydrain tomorrow is the return of dragon age d amp d stream with scottishw92 ladyinsanity gamermd83 myself and our new recruit
-1	why be afraid of tomorrow when today is all we have elizabeth the golden age 2007
-1	if ur going to the global citizen thing tomorrow and ur over the age of 15 hit me or anna up because we need one of those
-1	rt thesource congrats to kylaimani for surpassing 1 mil views spread the word to kids age 10 15 about tomorrow s video casting http t
-1	rt thesource congrats to kylaimani for surpassing 1 mil views spread the word to kids age 10 15 about tomorrow s video casting http t
-1	rt thesource congrats to kylaimani for surpassing 1 mil views spread the word to kids age 10 15 about tomorrow s video casting http t
-1	congrats to kylaimani for surpassing 1 mil views spread the word to kids age 10 15 about tomorrow s video casting http t co ielx9spzdw
-1	rt abilitydrain tomorrow is the return of dragon age d amp d stream with scottishw92 ladyinsanity gamermd83 myself and our new recruit
-1	rt abilitydrain tomorrow is the return of dragon age d amp d stream with scottishw92 ladyinsanity gamermd83 myself and our new recruit
-1	rt abilitydrain tomorrow is the return of dragon age d amp d stream with scottishw92 ladyinsanity gamermd83 myself and our new recruit
-1	tomorrow is the return of dragon age d amp d stream with scottishw92 ladyinsanity gamermd83 myself and our new recruit irregulardave lt 3
-1	rt bethsykes_tw time has flown by so fast this year cause nathansykes is 22 tomorrow it was only like yesterday i fell in love with him
-1	rt bethsykes_tw time has flown by so fast this year cause nathansykes is 22 tomorrow it was only like yesterday i fell in love with him
-1	rt bethsykes_tw time has flown by so fast this year cause nathansykes is 22 tomorrow it was only like yesterday i fell in love with him
-1	rt __sherane jet age of tomorrow
-1	jet age of tomorrow
-1	time has flown by so fast this year cause nathansykes is 22 tomorrow it was only like yesterday i fell in love with him at the age of 16
-1	the jet age of tomorrow is beautiful meijinmo
-1	the pain of today is a training for tomorrow success and a story to tell at old age be strong be rightous be a man of good dream
-1	best couple of weeks of sports all year start tomorrow betfred cant wait snookerloopy https t co 1zmjybyyno
-1	why be afraid of tomorrow when today is all we have elizabeth the golden age
-1	why be afraid of tomorrow when today is all we have elizabeth the golden age 2007
-1	hey guys tomorrow s the day if you are under the age of 18 we need you to have your parents sign this http t co wfdrx2jerg
-1	a week tomorrow i m seeing avengers age of ultron i m pumped
-1	i turn 22 tomorrow and at the tender age of 21 i am ready to go to bed at 8pm on a friday night am i doing adulthood right
-1	i liked a youtube video http t co 2wsouzpoyq naked the jet age of tomorrow ft hodgy beats
-1	why did i agree to watch 6 kids under the age of 6 from 9am today until sometime in the am tomorrow why why did i do this to myself
-1	rt glowlian my hair is falling off like there is no tomorrow i ll be bald by the age of 30
-1	my hair is falling off like there is no tomorrow i ll be bald by the age of 30
-1	rt guideguardian tomorrow s guide cover the mighty marvel franchise helming joss whedon on his avengers swan song age of ultron http t
-1	tomorrow s guide cover the mighty marvel franchise helming joss whedon on his avengers swan song age of ultron http t co skkjxjymkl
-1	why be afraid of tomorrow when today is all we have elizabeth the golden age 2007
-1	blazikken after tomorrow you can vote buy rillos and a bunch of other shit all because you re a certain age
-1	daredevil tomorrow for age of ultron next week i think
-1	rt greatfilmsquote why be afraid of tomorrow when today is all we have elizabeth the golden age 2007
-1	but guys tomorrow at prom if you wanna leave with someone you might want to ask their age now you might of babysat them
-1	why be afraid of tomorrow when today is all we have elizabeth the golden age 2007
-1	covering forfarathletic at pfcofficial tomorrow for bbcsportsound total age of forfar s starting 11 last week was 334 experiencecounts
-1	the for the love of children walk run is tomorrow there is a free fun run for kids age 9 and under and http t co sym37qbfaa
-1	tomorrow 4 18 is the first of our four money smart week events children age 3 and up are welcome join us at the http t co skwznzl4yx
-1	rt wtlib lego club is tomorrow saturday 3 00 4 30pm various sizes of legos will be provided to suit various age http t co 8vywnm
-1	lego club is tomorrow saturday 3 00 4 30pm various sizes of legos will be provided to suit various age http t co 8vywnmdaze
-1	rt msfoundation if you re in dc tomorrow see aijenpoo speak on her new book the age of dignity economicjustice forwomen rsvp http
-1	why be afraid of tomorrow when today is all we have elizabeth the golden age 2007
-1	rt boweryboys new bowery boys podcast chelsea piers in the age of the ocean liner post w photos tomorrow http t co 3d9vdycgvw http
-1	halesowen we resume training tomorrow morning at the earl s high school halesowen for all children aged between 4 14yrs of age
-1	reckon we won t lose tomorrow sort of confident considering eto o at a senile age scored a hattrick like it was nothing
-1	rt thenerdynurse average age of nursing faculty today s nurses tomorrow s educators http t co y54du1gehm
-1	rt greatfilmsquote why be afraid of tomorrow when today is all we have elizabeth the golden age 2007
-1	i made an art of moving on it sparks the age of quarrel in your heart throw your body on the bad days on all the midnights of tomorrow
-1	got out of age of adeline this afternoon i liked it review up tomorrow
-1	rt greatfilmsquote why be afraid of tomorrow when today is all we have elizabeth the golden age 2007
-1	rt greatfilmsquote why be afraid of tomorrow when today is all we have elizabeth the golden age 2007
-1	why be afraid of tomorrow when today is all we have elizabeth the golden age 2007
-1	i thinking of buying dragon age tomorrow
-1	busy weekend of track amp field fixtures ahead ukydl upper age group tomorrow in harrow amp then the ebbisham boys league on sunday at sutton
-1	why be afraid of tomorrow when today is all we have elizabeth the golden age 2007
-1	it s that time of year again where jaidebrand and i become the same age tomorrow we celebrate
-1	i think i might be the only person over the age of 12 at ddlovato in sydney tomorrow night imakewlmom
-1	going to watch my bae blake lively in age of adeline tomorrow
-1	rt boweryboys new bowery boys podcast chelsea piers in the age of the ocean liner post w photos tomorrow http t co 3d9vdycgvw http
-1	thesuper3 what s up with the homie hal and when is jet age of tomorrow making a new album oh and the super 3 for nardwuar
-1	tomorrow can be a wonderful age our scientists today are opening the doors of the space age to achievements that http t co hyzpx92wzx
-1	trials to select budding footballers of under 14 and under 17 age groups will be held tomorrow 9 am onwards http t co dcsjyktkxa
-1	rt boweryboys new bowery boys podcast chelsea piers in the age of the ocean liner post w photos tomorrow http t co 3d9vdycgvw http
-1	rt learnedmedia get excited tomorrow we kickoff our 7 day countdown to the apple watch with an email series around the new age of buyer
-1	rt boweryboys new bowery boys podcast chelsea piers in the age of the ocean liner post w photos tomorrow http t co 3d9vdycgvw http
-1	kill em all ready 2 die death squad age of tomorrow asteroid vs earth scorcher air collision
-1	lord i ll be 27 years of age tomorrow
-1	rt boweryboys new bowery boys podcast chelsea piers in the age of the ocean liner post w photos tomorrow http t co 3d9vdycgvw http
-1	new bowery boys podcast chelsea piers in the age of the ocean liner post w photos tomorrow http t co 3d9vdycgvw http t co dzubfvxj7f
-1	rt philosophy_rr the age of insight psychology tomorrow magazine http t co whnu4c6crv
-1	why be afraid of tomorrow when today is all we have elizabeth the golden age 2007
-1	thank goodness tomorrow is friday i want to see unfriended and the avengers age of ultron when it comes out omg
-1	rt thenerdynurse average age of nursing faculty today s nurses tomorrow s educators http t co y54du1gehm
-1	average age of nursing faculty today s nurses tomorrow s educators http t co y54du1gehm
-1	once tomorrow comes i m pre ordering my tickets for age of ultron
-1	tomorrow i m planning on seeing paul blart mall cop 2 and on may 1st i will also see avengers age of ultron
-1	tomorrow is the dawn of the age of kris bryant cubs gocubsgo
-1	iphayfaisal blitzmegaplex tweeps avengers age of ultron besok sudah bisa advance sales stay tune for tomorrow
-1	rt blitzmegaplex tweeps avengers age of ultron besok sudah bisa advance sales stay tune for tomorrow
-1	rt blitzmegaplex tweeps avengers age of ultron besok sudah bisa advance sales stay tune for tomorrow
-1	the age of insight psychology tomorrow magazine http t co whnu4c6crv
-1	why be afraid of tomorrow when today is all we have elizabeth the golden age 2007
-1	rt sciencespectrum today at 3 00pm is the last public showing of hidden universe in the omni theater living in the age of airplanes open
-1	rt blitzmegaplex tweeps avengers age of ultron besok sudah bisa advance sales stay tune for tomorrow
-1	rt learnedmedia get excited tomorrow we kickoff our 7 day countdown to the apple watch with an email series around the new age of buyer
-1	get excited tomorrow we kickoff our 7 day countdown to the apple watch with an email series around the new age of buyer behavior pumped
-1	nowplaying the jet age of tomorrow light speed syndicatedhh http t co oodkuxfbya fb
-1	nowplaying the jet age of tomorrow light speed on epradio http t co nu3sovvjnl
-1	michiel_huisman welcome to twitter really look forward to seeing you in age of adaline and having hoffmanonfilm interview you tomorrow
-1	rt sciencespectrum today at 3 00pm is the last public showing of hidden universe in the omni theater living in the age of airplanes open
-1	why be afraid of tomorrow when today is all we have elizabeth the golden age 2007
-1	rt kimvelsor donate blood tomorrow you must be 16 years of age come donate and save a life
-1	rt kimvelsor donate blood tomorrow you must be 16 years of age come donate and save a life
-1	in other news tomorrow ll buy my tickets for the avengers age of ultron http t co i6pphvbjv8
-1	rt kimvelsor donate blood tomorrow you must be 16 years of age come donate and save a life
-1	donate blood tomorrow you must be 16 years of age come donate and save a life
-1	rt nikkise7en i m watching a woman dealing with 3 boys all under the age of 5 right now and fuck that i m getting sterilized first thing
-1	i ve been sleepin on the jet age of tomorrow way too much
-1	wonder if disney will give us a look at the force awakens trailer on the imax before age of ultron tomorrow
-1	last night of voting tomorrow is the concert pleaseee vote http t co jhciigtd69
-1	there s the stone age the dark age last decade amp today where do you stand i stand on the edge of tomorrow youthpastorlife
-1	in e amp s africa hiv aids is the leading cause of death for girls age 15 19 learn more csis s event tomorrow http t co olnpz0ytaw
-1	tomorrow i hit the grand old age of 41 i dislike birthdays and try to pretend they aren t happening so why do people insist on buying cards
-1	rt tomfeilden 1 2 tomorrow on r4today moore s law turns 50 with little sign of slowing down in middle age but for how much longer
-1	rt tomfeilden 1 2 tomorrow on r4today moore s law turns 50 with little sign of slowing down in middle age but for how much longer
-1	rt tomfeilden 1 2 tomorrow on r4today moore s law turns 50 with little sign of slowing down in middle age but for how much longer
-1	rt tomfeilden 1 2 tomorrow on r4today moore s law turns 50 with little sign of slowing down in middle age but for how much longer
-1	1 2 tomorrow on r4today moore s law turns 50 with little sign of slowing down in middle age but for how much longer
-1	we re looking forward to another day at british champs tomorrow with one of our age group stars alicia dingle http t co q3w39i9xez
-1	seeing home tomorrow age of ultron next weekend then pitch perfect 2 then mall cop 2 then minions then paper towns so many films
-1	age_uk hope you can join us tomorrow for a twitter chat on building awareness of elder abuse follow weaadweekly 4 17 1pm et
-1	rt impexb tomorrow is not today and today is not yesterday age is a brain quality improvement drags your anger out of your heart bye see
-1	tomorrow is not today and today is not yesterday age is a brain quality improvement drags your anger out of your heart bye seen end lines
-1	the avengers age of ultron hits theaters 2 weeks from tomorrow
-1	why be afraid of tomorrow when today is all we have elizabeth the golden age 2007
-1	it was the fourteenth day of april over the waves she rode sailing into tomorrow to a golden age foretold https t co tfvzcm3zdu
-1	one of my kindergarteners asked me to come over tomorrow to play and then he told me he loved me this kid is smoother than guys my age
-1	a week tomorrow at 150pm i shall be sitting down in amctheatres watching age of ultron wit http t co r2ejx8vq6r http t co hgbpgvxy7t
-1	a week tomorrow at 150pm i shall be sitting down in amctheatres watching age of ultron with amazing food can t wait
-1	rt blitzmegaplex tweeps avengers age of ultron besok sudah bisa advance sales stay tune for tomorrow
-1	http t co 80lhmlje3r pray for blinded eyes to see and ears to be open at un tomorrow
-1	i just want tomorrow to be april 30th for age of ultron and day after to be the force awakens then day after that to be civil war
-1	nowplaying age of you by phony ppl yesterday s tomorrow 2015 http t co whnzhe4bk4
-1	seems like an age since the last bank holiday so we re off tomorrow to make a long weekend of the btcc doningtonparkuk dunlopbtcc
-1	rt blitzmegaplex tweeps avengers age of ultron besok sudah bisa advance sales stay tune for tomorrow
-1	today at 3 00pm is the last public showing of hidden universe in the omni theater living in the age of airplanes opens tomorrow
-1	why be afraid of tomorrow when today is all we have elizabeth the golden age 2007
-1	photo teamdowney1965 age of ultron red carpet premiere in south korea will begin tomorrow http t co 5lqedo92ke
-1	rt msfoundation if you re in dc tomorrow see aijenpoo speak on her new book the age of dignity economicjustice forwomen rsvp http
-1	last day of being 18 the same age as my younger brother tomorrow i ll be the same age as my older sister
-1	age of ultron comes out a week from tomorrow alltheblessings
-1	rt blitzmegaplex tweeps avengers age of ultron besok sudah bisa advance sales stay tune for tomorrow
-1	rt blitzmegaplex tweeps avengers age of ultron besok sudah bisa advance sales stay tune for tomorrow
-1	jet age of tomorrow x mac miller x speak juney jones
-1	audiin already excited for the audiavengers contest tomorrow had been waiting to catch avengers age of ultron audiavengers
-1	follow audiin and join in their audiavengers contest tomorrow to win movie tickets to watch avengers age of ultron
-1	thanks to stephen cooke and the chronicle herald for the review of the 7 and the release show plug tomorrow http t co uebqwj5ucx
-1	thanks to robert picardo s class act age of tomorrow was better than expected in the end despite the shit ending http t co hg2ch5qnua
-1	rt blitzmegaplex tweeps avengers age of ultron besok sudah bisa advance sales stay tune for tomorrow
-1	rt blitzmegaplex tweeps avengers age of ultron besok sudah bisa advance sales stay tune for tomorrow
-1	rt blitzmegaplex tweeps avengers age of ultron besok sudah bisa advance sales stay tune for tomorrow
-1	rt blitzmegaplex tweeps avengers age of ultron besok sudah bisa advance sales stay tune for tomorrow
-1	rt msfoundation if you re in dc tomorrow see aijenpoo speak on her new book the age of dignity economicjustice forwomen rsvp http
-1	ehem blitzmegaplex tweeps avengers age of ultron besok sudah bisa advance sales stay tune for tomorrow
-1	rt blitzmegaplex tweeps avengers age of ultron besok sudah bisa advance sales stay tune for tomorrow
-1	rt blitzmegaplex tweeps avengers age of ultron besok sudah bisa advance sales stay tune for tomorrow
