-1	edshow marcorubio speaks of the guilded age of the 19th century doesn t sound like tomorrow marcorubio hasn t learn his u s history
-1	tomorrow s princeton seminar on global health will explore wrap around health services in the age of obamacare http t co h1xs2cionl aca
-1	my brother is officially signing to play college football tomorrow holy cow he was the age of 10 like 12 seconds ago i swear
-1	didnt study for german tomorrow but who cares i watched the age of ultron premiere red carpet amp caught up on press interviews
-1	rt boxnationtv tomorrow at 7pm on boxnation greatestboxingclassics features larryholmes75 fighting at the age of 44 http t co dykve
-1	bb starts back tomorrow evening from 6 15pm at trinity and are open for new boys to join us from the age of 5 http t co w7zqa4rbn7
-1	tomorrow at 7pm on boxnation greatestboxingclassics features larryholmes75 fighting at the age of 44 http t co slubymswzr boxing
-1	why be afraid of tomorrow when today is all we have elizabeth the golden age 2007
-1	rt boxnationtv tomorrow at 7pm on boxnation greatestboxingclassics features larryholmes75 fighting at the age of 44 http t co dykve
-1	tomorrow at 7pm on boxnation greatestboxingclassics features larryholmes75 fighting at the age of 44 http t co dykveodec0
-1	emmawebsterxxx it is closer but you could walk in front of a bus tomorrow so age don t matter p
-1	tomorrow is tax day and i was reminded of the 3rd aquarian sutra when the time is on you start and the http t co jxyfubdyjf
-1	clonmel enters space age with opening of centre to create sunscreen for satellites for european space agency see tomorrow s nationalist
-1	rt annemullettamg occupywallstnyc and it part of the internet age ridiculous edited history children never think to question adults
-1	rt aletiam tomorrow learn about data governance amp info sharing in age of bigdata symantecgov symposium free for gov gt gt http t co bw
-1	what seems to be true and honest is a mini ice age is going to happen think of the movie the day after tomorrow
-1	so merickwins up was sampled by tevin campbell kendrick was the one that sampled jet age of tomorrow s the knight hawk
-1	working at the cinema tomorrow and we re gonna put together the age of ultron promotional stuff
-1	pafrey s glen state natural area amp part of the ice age sauk point trail may be closed tomorrow for a prescribed http t co lmqesf75fi
-1	why be afraid of tomorrow when today is all we have elizabeth the golden age 2007
-1	new stuff going out tomorrow part 1 new halo action figures deapool bobble head avengers age of ultron http t co itktwzljnk
-1	rilly dont wanna go to cbeebies land in alton towers tomorrow cos no one of my age is goin with me and lil sisters r gonna get me a headache
-1	occupywallstnyc and it part of the internet age ridiculous edited history children never think to question adults of tomorrow
-1	the age of adeline movie premier tomorrow yas yas yas
-1	rt cebas_swc our group represented at egu15 today with a postrr on age of organic carbon in sediments tomorrow more in sss2 15 http t
-1	someone thinks we ve been acting childish about water we re sorry drop we ll be better tomorrow la_mag http t co 9suaxs3thv
-1	vigorously pursuing a resilience approach today is the world s best chance at safeguarding tomorrow http t co apbc04rtbc
-1	bencheltenham mp_horseracing just need proof of age with id tomorrow to get in foc if u18
-1	rt phillygossipdn get tickets to a special screening of the age of adaline w blakelively https t co m5eks7dujl i ll be there tomorr
-1	22 years of age and still not had a blood test until tomorrow
-1	get tickets to a special screening of the age of adaline w blakelively https t co m5eks7dujl i ll be there tomorrow
-1	new stock on the shelves for tomorrow avengers age of ultron pop vinyl figures iron man hulk captain http t co fnhrbcgcmp
-1	our group represented at egu15 today with a postrr on age of organic carbon in sediments tomorrow more in sss2 15 http t co vsbj83wu5x
-1	rt supermcslayer jet age of tomorrow so underrated
-1	rt aletiam tomorrow learn about data governance amp info sharing in age of bigdata symantecgov symposium free for gov gt gt http t co bw
-1	jet age of tomorrow so underrated
-1	moms kids under 5 yrs of age come and play tomorrow 9 30 11am at goodyear community park click here for more info http t co fhu81kgrxs
-1	swritesbooks that is so exciting also a useful place to take refuge in case of sudden ice age according to the day after tomorrow
-1	tomorrow learn about data governance amp info sharing in age of bigdata symantecgov symposium free for gov gt gt http t co bw01aczlqh
-1	with pizarro out tomorrow bayern munich s entire outfield bench will likely have a mean age of 20
-1	and so the cricket season begins a fantastic array of brilliant fixtures at every age group begins tomorrow with kesstratford
-1	or the ali tape by mike g or voyager by the jet age of tomorrow nobody know about the other of artists https t co wdnz0fra4j
-1	join us tomorrow 4 a little taxrelief rayskc raysotr amp raysitc will hand out lotto tix while supplies last amp 2 those of legal age
-1	ageukrotherham good luck with your hustings tomorrow don t forget to tweet lots of pictures and use the hashtag votelaterlife
-1	rt bis_spaceflight alan bond reactionengines ceo speaking the shaping of the space age http t co 4tgowq0v66 http t co riljvhpbf6
-1	rt bis_spaceflight alan bond reactionengines ceo speaking the shaping of the space age http t co 4tgowq0v66 http t co riljvhpbf6
-1	it s my last day being an age people are envious of tomorrow i join the old and haggard pushed to the side for the young ones
-1	thesuper3 any jet age of tomorrow coming soon
-1	rt gracierivera21 bcmonigold rose_red25 prepare to get some tomorrow a coming of age gift
-1	bcmonigold rose_red25 prepare to get some tomorrow a coming of age gift
-1	why be afraid of tomorrow when today is all we have elizabeth the golden age 2007
-1	we ll be watching the avengers in the run up to age of ultron for movie night tomorrow
-1	great and small is back tomorrow if you re a parent of a child of pre school age join us for our big stay and play http t co 9gspv7eaip
-1	i turn 18 tomorrow and im a junior in highschool doing better then the ones my age in and out of highschool i thank god for my out come
-1	why be afraid of tomorrow when today is all we have elizabeth the golden age 2007
-1	talking about hannah arendt human rights and the contemporary struggles of migrants tomorrow at columbia http t co jthmrqugzw
-1	tomorrow night bond_age_ live tweets the first of the tournament of bonds finalists it s from russia with love 9pm est follow frwl
-1	darciexox15 well as of tomorrow only 265 days until we are the same age again
-1	rt bis_spaceflight alan bond reactionengines ceo speaking the shaping of the space age http t co 4tgowq0v66 http t co riljvhpbf6
-1	rt bis_spaceflight alan bond reactionengines ceo speaking the shaping of the space age http t co 4tgowq0v66 http t co riljvhpbf6
-1	alan bond reactionengines ceo speaking the shaping of the space age http t co 4tgowq0v66 http t co riljvhpbf6
-1	tomorrow my age increase the time is so fast thankyou seventeen times a lot of new things at the https t co rzjlmxyxgl
-1	avengers age of ultron imax 3d ticket ima buy that shit tomorrow this is the reason i ve been saving up
-1	ijf15 is starting tomorrow enjoy see u on sunday to talk about discrimination in media in the age of equalmarriage journalismfest
-1	so far 9 of us coming coming to see shaynetward tomorrow yay ellie age 8 is very very excited
-1	the profile of vfx supervisor daniel kramer talking about age of tomorrow working sony imageworks http t co ijniqghn7v
-1	rt epchihuahuas join us tomorrow 11 05 a m game time over the age of 60 lunch is on us presented by cbs4 el paso plus amp the fox htt
-1	good thing i ve not watched age get discouraged each time i open it mr_gudman the two age edge of tomorrow films were shit
-1	age of tomorrow http t co eg99eh9rch noobroom tubeplus megashare streaming
-1	22 years of age tomorrow
-1	the two age edge of tomorrow films were shit
-1	why be afraid of tomorrow when today is all we have elizabeth the golden age 2007
-1	compy time east mums what are you doing tomorrow we have two double passes to give away to the 1pm session of http t co krxzikwdcs
-1	oh shit reviews for age of ultron come out tomorrow oh shit oh shit oh shit
-1	rt epchihuahuas join us tomorrow 11 05 a m game time over the age of 60 lunch is on us presented by cbs4 el paso plus amp the fox htt
-1	i should buy my ticket for age of ultron tomorrow before it s too late
-1	mali s age of empire a talk by kevin macdonald tomorrow at sudbury library http t co 8gxdjlzqcj
-1	rt dallas_now screening added http t co jnizp63lmj rt bri_crum excited to be hosting the vip screening of the age of adaline tomorr
-1	why be afraid of tomorrow when today is all we have elizabeth the golden age 2007
-1	sorry i will not be at school tomorrow due to the instability that the age of ultron premiere has caused me
-1	rt epchihuahuas join us tomorrow 11 05 a m game time over the age of 60 lunch is on us presented by cbs4 el paso plus amp the fox htt
-1	rt epchihuahuas join us tomorrow 11 05 a m game time over the age of 60 lunch is on us presented by cbs4 el paso plus amp the fox htt
-1	why be afraid of tomorrow when today is all we have elizabeth the golden age 2007
-1	the jet age of tomorrow
-1	rt epchihuahuas join us tomorrow 11 05 a m game time over the age of 60 lunch is on us presented by cbs4 el paso plus amp the fox htt
-1	join us tomorrow 11 05 a m game time over the age of 60 lunch is on us presented by cbs4 el paso plus amp the fox http t co rum4rk6hcf
-1	the longest ride amp promo screening of age of adaline tomorrow with nat
-1	i could go see the age of adaline tomorrow but instead i m going to go to david s soccer game bc love requires sacrifice
-1	rt bri_crum excited to be hosting the vip screening of the age of adaline tomorrow night at the magnolia theatre https t co 7pq47nvkts
-1	i have gym tomorrow no thanks i have to do a physics essay tomorrow no thanks i wanna watch the age of ultron red carpet tomorrow yes please
-1	surrounded by paparazzi here are the 4 age representatives from wetaskiwin s leaders of tomorrow amazing youth http t co plcotbqwmd
-1	so i guess by tomorrow we d know what the end credits scene in age of ultron is
-1	rt victorialynden empowering tomorrow s leaders at a young age creates innovative environmental solutions learn abt greenschoolsall ht
-1	never mind avengers age of ultron premier i can watch a movie i ve already seen tomorrow
-1	i m missing the age of ultron live stream but i m going to bed soon i ll watch it on youtube along with jimmy tomorrow
-1	private screening to age of adaline tomorrow yess http t co nrlrhbt4kn
-1	age of ultron premiere and chemistry test tomorrow after a butt kicking workout what a great monday ageofultron
-1	should i stay up and watch the age of ultron premiere probably not am i going to of course will i regret this tomorrow at school yes
-1	what i can t wait for now is new the internet material and the jet age of tomorrow
-1	i ll have my 4th knee surgery tomorrow at the age of 18 lol
-1	screening added http t co jnizp63lmj rt bri_crum excited to be hosting the vip screening of the age of adaline tomorrow night at th
-1	braces tomorrow i ll be reverting back to 12 years of age
-1	rt bri_crum excited to be hosting the vip screening of the age of adaline tomorrow night at the magnolia theatre https t co 7pq47nvkts
-1	excited to be hosting the vip screening of the age of adaline tomorrow night at the magnolia theatre https t co 7pq47nvkts
-1	rt iamfroggyfresh me and mike going in undercover fun trip music video drops tomorrow http t co p3mntoyrg2
-1	attention twitter tomorrow is the best guys bday ever bale of cale will be 17 years of age repeat 17 years of age
-1	it s been 6 years tomorrow it s crazy years go by fast lost him at the age of 12 dam
-1	rt firesciencegov mt nrfirescience new age of wildland fuel science webinar w bob keane tomorrow http t co wkhyldjbeh http t co
-1	tomorrow is a perfect day for me to return to the world of age of wushu b
-1	viewing the age of adaline during a private screening tomorrow night 10 days before its public release
-1	the age of the universe dreams of tomorrow recently played at http t co iundmgeyr9
-1	so excited to get a sneak preview of harrisonford s new film the age of adeline tomorrow thanks carmikecinemas
-1	rt evolve_pr age of wonders iii eternal lords expansion launches tomorrow aow3 mixes empire building role playing and warfare lmk if
-1	age of wonders iii eternal lords expansion launches tomorrow aow3 mixes empire building role playing and warfare lmk if you need code
-1	watching age of tomorrow with robertpicardo not as good as his roles with star trek amp stargate but it s alright
-1	join ashe and global zero for a screening of the film the ultimate wish ending the nuclear age tomorrow night at 6 pm in the grotto
-1	then a week from tomorrow i ll be 19 years of age
-1	ok i must go see the age of adaline asap i think tomorrow sounds good
-1	why be afraid of tomorrow when today is all we have elizabeth the golden age 2007
-1	why be afraid of tomorrow when today is all we have elizabeth the golden age 2007
-1	the fact i could be watching age of ultron a week tomorrow
-1	grrr surely the amount of acne i have atm is illegal considering my age i would go to work tomorrow in a burkha if i could 15again
-1	my best friend turning 25 tomorrow we met at the tender age of 6 where did the time go
-1	setting up my first ever bank account tomorrow at the age of 18
-1	why be afraid of tomorrow when today is all we have elizabeth the golden age 2007
-1	tomorrow iddi taping 12 more days for the rdma s 3 more weeks for the avenger age of ultron
-1	mt nrfirescience new age of wildland fuel science webinar w bob keane tomorrow http t co wkhyldjbeh http t co xxbnrnsrrs
-1	webinar tomorrow 4 14 11am mdt a new age of wildland fuel science bob keane on his latest book nrfirescience http t co gqkbayiki7
-1	rt bm_purpose in an age of mistrust http t co jpazdv6jyx perception is important and being authentic is hard learn more tomorrow co
-1	rt bm_purpose in an age of mistrust http t co jpazdv6jyx perception is important and being authentic is hard learn more tomorrow co
-1	tomorrowland tv spot fight for tomorrow maybe when disney is done promoting the hell out of avengers age http t co 30e1yp1wg4
-1	birthday tomorrow just another day to me but a real blessing to be of age nae19
-1	agents of shield is on tomorrow and i have 7 more episodes of daredevil to watch and age of ultron and comic con are coming and nerd joy
-1	dukeu s vvvek wadhwa on letting computer become the teachers of tomorrow s classrooms in the washingtonpost http t co esnewzsymw
-1	trying to decide whether or not to get up early tomorrow morning to watch the age of ultron premiere
-1	born to read tomorrow at 10 30 am this program is especially for parents and babies under a year of age or http t co odvfgjfw6s
-1	why the f my school doesn t declare a holiday when f ing age of ultron have a f ing livestream in the morning tomorrow
-1	kinda leaning towards some titanfall tomorrow night instead of dragon age and pick that back up on wed
-1	rt supermcslayer i hate when of fans sleep on the internet amp jet age of tomorrow though
-1	age of wonders iii eternal lords expansion out tomorrow catch up with two 25 min vids https t co khbaqcrmpp amp https t co ndxyuiepak
-1	tomorrow s agenda reserve imax tickets for age of ultron
-1	rt supermcslayer i hate when of fans sleep on the internet amp jet age of tomorrow though
-1	rt supermcslayer i hate when of fans sleep on the internet amp jet age of tomorrow though
-1	back when the internet was the space age of tomorrow niggas used to say they sound dumb asf i m schleep man
-1	i hate when of fans sleep on the internet amp jet age of tomorrow though
-1	there s the age of ultron premiere tonight and i can t watch it and then tomorrow i won t http t co r2ejx8vq6r http t co rgoqfvikvj
-1	there s the age of ultron premiere tonight and i can t watch it and then tomorrow i won t be home until 7 pm at least how will i survive
-1	tomorrow marks the 10 day countdown till avengers age of ultron head to hmv and check out our marvel selection http t co w8ddcqoete
-1	why be afraid of tomorrow when today is all we have elizabeth the golden age 2007
-1	in an age of mistrust http t co cozgsr0jdw being authentic is hard more tomorrow at b_m s corporatepurpose study launch bm_purpose
-1	why be afraid of tomorrow when today is all we have elizabeth the golden age 2007
-1	taking back power in the age of networks tomorrow noon w astradisastra rsvp here https t co 1gkvx0usus media internet
-1	rt quickslvers petition for aaron taylor johnson to shave so he ll look like this at the age of ultron premiere tomorrow http t co uuh
-1	the super3 the internet the jet age of tomorrow know music well in fact most of odd future just understand creativity and nice sounds lol
-1	rt nxnchalant left brain one of the illest producers though i mean just listen to jet age of tomorrow fallen angel co produced b
-1	left brain one of the illest producers though i mean just listen to jet age of tomorrow fallen angel co produced but uno
-1	rt handsinmachines living maps seminar tomorrow evening csmgraphics featuring regners_thesis and dominicwilcox among others https
-1	rt handsinmachines living maps seminar tomorrow evening csmgraphics featuring regners_thesis and dominicwilcox among others https
-1	rt victorialynden empowering tomorrow s leaders at a young age creates innovative environmental solutions learn abt greenschoolsall ht
-1	rt handsinmachines living maps seminar tomorrow evening csmgraphics featuring regners_thesis and dominicwilcox among others https
-1	dominicwilcox rt handsinmachines living maps seminar tomorrow evening csmgraphics featuring regners_thesis and d https t co q2tonkdgko
-1	in an age of mistrust http t co jpazdv6jyx perception is important and being authentic is hard learn more tomorrow corporatepurpose
-1	rt handsinmachines living maps seminar tomorrow evening csmgraphics featuring regners_thesis and dominicwilcox among others https
-1	rt handsinmachines living maps seminar tomorrow evening csmgraphics featuring regners_thesis and dominicwilcox among others https
-1	rt handsinmachines living maps seminar tomorrow evening csmgraphics featuring regners_thesis and dominicwilcox among others https
-1	rt handsinmachines living maps seminar tomorrow evening csmgraphics featuring regners_thesis and dominicwilcox among others https
-1	living maps seminar tomorrow evening csmgraphics featuring regners_thesis and dominicwilcox among others https t co jhoyg0e8pm
-1	rt susiepp it s my birthday tomorrow if you add the 2 numbers of my age it makes 11 my favourite number d http t co rhrtwaqwql
-1	it s the age of the prosumer you can be an innovator of tomorrow st3di3dprinters staplesuk milton keynes st3di_launch
-1	so the age of ultron premier is tomorrow night how hard will it be to avoid spoilers after that
-1	waiting with friends for the avengers age of ultron premiere tomorrow d lt 3 avengers ageofultron aou http t co xazaa3avxd
-1	the avengers age of ultron premier tomorrow 6 00 p m the dolby theatre 6801 hollywood blvd in hollywood avengersageofultron
-1	rt getkittiefied ps4 games i have so far minecraft little big planet destiny the binding of issac gta v bloodbourne amp dragon age
-1	rt colliderfrosty seeing avengers age of ultron tomorrow night just heard no social media embargo after screening means disney is very
-1	our classic showing of x men and x men 2 is tomorrow night get in the superhero mood before avengers age of http t co oajezatjo2
-1	pilot reminds me of the jet age of tomorrow
-1	note to self make sure to watch avengers age of ultron premiere tomorrow
-1	rt victorialynden empowering tomorrow s leaders at a young age creates innovative environmental solutions learn abt greenschoolsall ht
-1	rt arclightdcarea he was their inspiration arclightpresents dead poets society tomorrow night reserve http t co tswhgofjyt http
-1	why be afraid of tomorrow when today is all we have elizabeth the golden age 2007
-1	i want to experience the story of dragon age but i dont want to go to sleep because i dont want tomorrow to happen
-1	rt mayashakti_ i fucking love the jet age of tomorrow from their artwork to the beats to the lyrics to their genre being acid jazz and
-1	i fucking love the jet age of tomorrow from their artwork to the beats to the lyrics to their genre being acid jazz and electric sex
-1	rt avgsocialite guess what tomorrow is the avengers ageofultron premiere robertdowneyjr markruffalo chrishemsworth chrisevans htt
-1	rt quickslvers petition for aaron taylor johnson to shave so he ll look like this at the age of ultron premiere tomorrow http t co uuh
-1	you re gonna regret that tomorrow jokes on you i regret everything i ve done past the age of 10
-1	why be afraid of tomorrow when today is all we have elizabeth the golden age 2007
-1	i can t sleep i m too excited for the first ever showing of age of ultron tomorrow night even though i won t be there
-1	petition for aaron taylor johnson to shave so he ll look like this at the age of ultron premiere tomorrow http t co uuhigpjw1z
-1	ps4 games i have so far minecraft little big planet destiny the binding of issac gta v bloodbourne amp dragon age streaming tomorrow
-1	back to watching 20 kids under the age of five for 7 hours tomorrow bring on the headaches satan do your worst
-1	i want to be like jet age of tomorrow and just make really wavy music that takes you to that place i think i m finally getting there
-1	so if age of ultron could come out tomorrow that be great
-1	why be afraid of tomorrow when today is all we have elizabeth the golden age 2007
-1	world premiere of avengers age of ultron tomorrow with mike pizza boy and his gf i ll probably be tweeting it hope to see rdj again
-1	jamalmemaybe their a musical group so diverse frank the internet jet age of tomorrow can t even compare them to nwa or any group ever
-1	rt ironpercy take me to age of ultron premiere tomorrow
-1	take me to age of ultron premiere tomorrow
-1	rt mikiebarb marco rubio has made career out of big even foolhardy political bets from age 26 until tomorrow s prez announcement http
-1	rt mikiebarb marco rubio has made career out of big even foolhardy political bets from age 26 until tomorrow s prez announcement http
-1	rt mikiebarb marco rubio has made career out of big even foolhardy political bets from age 26 until tomorrow s prez announcement http
-1	jet age of tomorrow calms me down
-1	marco rubio has made career out of big even foolhardy political bets from age 26 until tomorrow s prez announcement http t co vbpt56rqq3
-1	rhettandlink tomorrow it shall be my quest to reveal the age old question of at what time it gets aired at the city i currently am
-1	rt marissalace i turn 22 tomorrow and all i m concerned about is learning how to change the age preferences of my tinder account
-1	im finally off work age of ultron premiere tomorrow im gonna die
-1	imma go sneak into the avengers age of ultron hollywood premiere tomorrow
-1	rt victorialynden empowering tomorrow s leaders at a young age creates innovative environmental solutions learn abt greenschoolsall ht
-1	goblincleaver i know right and the la premiere for age of ultron is tomorrow and they re live streaming it and marvel is trying to kill us
-1	rt tke_fraternity jordan spieth won the masters at the age of 21 what are your plans for tomorrow iamtke
-1	at least i can reserve jess and mine age of ultron preview tickets tomorrow finally
-1	rt tke_fraternity jordan spieth won the masters at the age of 21 what are your plans for tomorrow iamtke
-1	at http t co mvsubwqnit tomorrow the avengers age of ultron red carpet world premiere i ll probably have t http t co dhwts6vagt
-1	mommy can you please put one of those johnny smith green apples in my lunch tomorrow lucy age 5
-1	i need tomorrow to be may 1st so i can watch age of ultron already
-1	rt 2claire4u and now a brief look at mack through the ages in honor of her age changing tomorrow http t co iozdch55eb
-1	and now a brief look at mack through the ages in honor of her age changing tomorrow http t co iozdch55eb
-1	jordan spieth won the masters at the age of 21 what are your plans for tomorrow iamtke
-1	rt avgsocialite guess what tomorrow is the avengers ageofultron premiere robertdowneyjr markruffalo chrishemsworth chrisevans htt
-1	rt avgsocialite guess what tomorrow is the avengers ageofultron premiere robertdowneyjr markruffalo chrishemsworth chrisevans htt
-1	sunday vegandinner taco spread my daughter liviluv is turning 8 years of age tomorrow tonight https t co wthglesfw4
-1	belkevitzlouise don t have school tomorrow but at the age of 15 almost 16 js js i think the bedtime thing has worn of a bit
-1	age of ultron premiere tomorrow hopefully i go votethomasmtv
-1	rt wickednebula76 girluniquexxx till tomorrow hun wanna share some pieces of cosmic dead again this band is marvelous a hidden treasur
-1	girluniquexxx till tomorrow hun wanna share some pieces of cosmic dead again this band is marvelous a hidden treasure in a modern age
-1	probs the thought of having to work tomorrow 9 5 of getting shouted at by old age pensioners yes pls
-1	rt avgsocialite guess what tomorrow is the avengers ageofultron premiere robertdowneyjr markruffalo chrishemsworth chrisevans htt
-1	guess what tomorrow is the avengers ageofultron premiere robertdowneyjr markruffalo chrishemsworth chrisevans http t co wlqjuryvfp
-1	nowplaying jet age of tomorrow the her secrets bonus syndicatedhh http t co oodkuxfbya fb
-1	nowplaying jet age of tomorrow the her secrets bonus on epradio http t co nu3sovvjnl
