-1	bronies you know it s hell with steven universe and uncle grandpa as a crossover worst crossover ever mlpseason5 http t co rvohmdv465
-1	that crossover looked nice by derozan but it was a bail out shot on pierce attack him
-1	k pop crossover 2ne1 s cl shows up in playful lip sync video with justin bieber ariana grande related articles http t co x7cgj9nfo0
-1	mangatherapy and there s very little separating him from gg there s a reason why there s so much crossover
-1	rt sportscenter the fans have spoken steph curry s crossover against chris paul is scnumber1 with 53 of the vote http t co mmlkzwn
-1	i don t cry at tv shows very often but the chicago pd chicago fire crossover episodes with the bombing have broken me
-1	rt internetdevin it s definitely half court crossover basketball weather outcheaaa ha
-1	rt swbts the first 35 swbts students to join us for crossover and sbc15 get to go for free http t co pehnjbydx2
-1	rt homerjsimpson my two favorite shows are gonna do a crossover tonight sunday night football and the morning news thank you in advance
-1	rt sportscenter the fans have spoken steph curry s crossover against chris paul is scnumber1 with 53 of the vote http t co mmlkzwn
-1	rt khunnieboo0624 the episode where there is a gintama and sket dance crossover was good man
-1	the episode where there is a gintama and sket dance crossover was good man
-1	rt sportscenter the fans have spoken steph curry s crossover against chris paul is scnumber1 with 53 of the vote http t co mmlkzwn
-1	rt sportscenter the fans have spoken steph curry s crossover against chris paul is scnumber1 with 53 of the vote http t co mmlkzwn
-1	rt nirsachamp 5 for uncpembroke mike smith finishes a pretty crossover with an aerial performance to gain the lead over gcu http t
-1	would really like to see fairy tail and madoka magica crossover i don t know why unu
-1	rt joyful_sabri benoight crossover chicagopd svu mariska jasonbeghe http t co hvzjlrphk9
-1	rt drakoloid almost done outlining artictv hoaatv amp viraljenneration crossover hazelwooodley theloganmtv victorrious http
-1	rt deezjays nba playoffs
-1	noobde we want a mortal kombat crossover game with pornstars make it happen boon make it happen
-1	hi everyone im going to draw my fave crossover pairing yugi x green
-1	rt _kyoukosakura i love this crossover d http t co otkvrvvujr
-1	carlmallillin sophiagskrth does this mean teen wolf x the 100 crossover haha
-1	i love this crossover d http t co otkvrvvujr
-1	keep your eyes open little children a new crossover is coming soon stay tuned
-1	how about a frozen and game of thrones crossover to start off your weekend http t co yp4nsnkm7y
-1	sothepennydrops that crossover tho
-1	rt sportscenter the fans have spoken steph curry s crossover against chris paul is scnumber1 with 53 of the vote http t co mmlkzwn
-1	photoset makeup test and improv photoshoot for a crossover cosplay that s been on my to do list for a http t co ztysbkuvyd
-1	wow that was such an amazing crossover
-1	rt sportscenter the fans have spoken steph curry s crossover against chris paul is scnumber1 with 53 of the vote http t co mmlkzwn
-1	enter the volvocarsus twilightdrivetodreamsweepstakes for a chance to win a volvo xc60 crossover amp other prizes http t co g6y6adlxrb
-1	working on a starseed pilgrim bomberman crossover in pico8 for ldjam lexaloffle droqen screenshotsaturday http t co ujsrnkt3yr
-1	star wars crossover is too much
-1	rt xmenfrost this would be a great crossover http t co izbr5z2niq
-1	nomuru2d thedeadp4npepe nyronlamedici i think he s referring to all the retarded crossover bullshit
-1	do not let jennifer lawrence to get inside any of the avengers movies cuz thats when there will never be a xmen aveners crossover
-1	the kolly bolly crossover indiaforums
-1	rt fcacorporate our newest crossover the 2016 fiat 500x coming this quarter in north america choices of manual https t co s8ttoy8
-1	k pop crossover 2ne1 s cl shows up in playful lip sync video with justin bieber ariana grande related articles http t co k8vx2tigfg
-1	rt sportscenter the fans have spoken steph curry s crossover against chris paul is scnumber1 with 53 of the vote http t co mmlkzwn
-1	enter the volvocarsus twilightdrivetodreamsweepstakes for a chance to win a volvo xc60 crossover amp other prizes http t co ph9kb63fvz
-1	not enough mgr crossover art
-1	rt bobsbellamy easy things 2 help the cw boost its shows ratings 1 kill camille 2 have a klaroline crossover 3 end tvd this year amp cro
-1	enter the volvocarsus twilightdrivetodreamsweepstakes for a chance to win a volvo xc60 crossover amp other prizes http t co dunz2sx1aj
-1	rt crossover_athle starting off the cyfair invitational with a win crossover elite over sports prep 33 26 http t co rrtikygkfn
-1	easy things 2 help the cw boost its shows ratings 1 kill camille 2 have a klaroline crossover 3 end tvd this year amp cross some characters
-1	virulentwings disney crossover perhaps
-1	game of thrones movie westeros 1 vs westeros 2 crossover where the tv universe has to fight off the book universe ala dc s multiverse
-1	hq x free crossover with kuroo and haru arguing over whether mackerel or mackerel pike tastes better
-1	enter the volvocarsus twilightdrivetodreamsweepstakes for a chance to win a volvo xc60 crossover amp other prizes http t co 6myzllynea
-1	rt fcacorporate our newest crossover the 2016 fiat 500x coming this quarter in north america choices of manual https t co s8ttoy8
-1	this whole movie crossover business is getting out of hand http t co l6v1kxgaix
-1	crackmccraigen from all of the fanart i seen will there be a star vs the forces of evil wander over yonder crossover
-1	i hate paul pierce so fucking much
-1	this would be a great crossover http t co izbr5z2niq
-1	rt desusnice nba continuing to allow will i am to make playoff songs is the same as the nfl looking the other way on concussions
-1	rt ohheyitskatt may you rest easy in heaven funeral w the best sister crossover church https t co 8hfiitzola
-1	may you rest easy in heaven funeral w the best sister crossover church https t co 8hfiitzola
-1	rt hcthebarber on that crossover movement luiscoronel281 luiscoronelmusic delempire empireproductionsinc https t co u2czkchymz
-1	bleach nico_robin one_piece yoruichi crossover hentaimaster88 1358x2008 1 9mb png hotgirls hotass sexyg http t co kbvvttmifw
-1	rtnba cause he blocked everyone lmfao
-1	rt sportscenter the fans have spoken steph curry s crossover against chris paul is scnumber1 with 53 of the vote http t co mmlkzwn
-1	rt sportscenter the fans have spoken steph curry s crossover against chris paul is scnumber1 with 53 of the vote http t co mmlkzwn
-1	rt akantecki just underway at dundee crown hs for fvc crossover baseball between woodstock and the host chargers http t co 9y5fb9feo9
-1	enter the volvocarsus twilightdrivetodreamsweepstakes for a chance to win a volvo xc60 crossover amp other prizes http t co lpxedk0gys
-1	i added a video to a youtube playlist http t co u09brwxatm russell westbrook hesitation crossover nba basketball moves
-1	enter the volvocarsus twilightdrivetodreamsweepstakes for a chance to win a volvo xc60 crossover amp other prizes http t co cp8chuay5m
-1	enter the volvocarsus twilightdrivetodreamsweepstakes for a chance to win a volvo xc60 crossover amp other prizes http t co wozfq8qiac
-1	rt fcacorporate our newest crossover the 2016 fiat 500x coming this quarter in north america choices of manual https t co s8ttoy8
-1	rt erictylerpritt crossover market today at 3 at inman come out hang out and support members of the community leeuserves
-1	rt sportscenter the fans have spoken steph curry s crossover against chris paul is scnumber1 with 53 of the vote http t co mmlkzwn
-1	soccer game was great cant wait for the crossover
-1	game 2 in the books crossover elite 17u over austin elite gold 60 37 http t co xfudkobrme
-1	rt fcacorporate our newest crossover the 2016 fiat 500x coming this quarter in north america choices of manual https t co s8ttoy8
-1	enter the volvocarsus twilightdrivetodreamsweepstakes for a chance to win a volvo xc60 crossover amp other prizes http t co fqjo7y47no
-1	caveman rocco 7 gets a 12 point win over tnba west vega friday and suffers a 6 point loss to hwb white saturday erie crossover is next
-1	wolfcopthemovie i m going to need a crossover movie with hobo with a shotgun now please
-1	it s definitely half court crossover basketball weather outcheaaa ha
-1	the world needs an r2 d2 scooby doo crossover
-1	rt sportscenter the fans have spoken steph curry s crossover against chris paul is scnumber1 with 53 of the vote http t co mmlkzwn
-1	rt sportscenter the fans have spoken steph curry s crossover against chris paul is scnumber1 with 53 of the vote http t co mmlkzwn
-1	steven moffat dashes dreams of a doctor who sherlock crossover http t co xxqacc0vkn
-1	enter the volvocarsus twilightdrivetodreamsweepstakes for a chance to win a volvo xc60 crossover amp other prizes http t co shuagoygcs
-1	rt sportscenter the fans have spoken steph curry s crossover against chris paul is scnumber1 with 53 of the vote http t co mmlkzwn
-1	rt rtnba jalen rose playin 6man on air lmfaooo likeimlouwill
-1	last second ebay bid rt http t co gl8kksmgn1 21 sabian vault crossover ride cymbal please favorite amp share
-1	usa deals gt http t co eli553cvmx 779 girls ruffle tiered crossover dress http t co kaisu1nvyu
-1	angryblacklady when you talk about your add it is like you re talking about my tbi i need to research symptoms that crossover amp treatments
-1	usa new deals 667 http t co zsyreyp9jt chiara boni new becky blue crossover 3 4 sleeves party cocktail dress 6 http t co cotfxobgwe
-1	rt loveiysophia this makes me even more excited for the crossover http t co qrq6wsjtrh
-1	check out will smith blouse top white crossover long sleeves career work dressy sz 8 euc blouse http t co 07hwl7kdio via ebay
-1	rt comicbookgrrl awesome millarworld crossover art leinil francis yu i believe kick ass hitgirl superior nemesis http t co 6k
-1	enter the volvocarsus twilightdrivetodreamsweepstakes for a chance to win a volvo xc60 crossover amp other prizes http t co fxzmjutlgs
-1	enter the volvocarsus twilightdrivetodreamsweepstakes for a chance to win a volvo xc60 crossover amp other prizes http t co aucssx1idt
-1	this game sounds like a syfy movie of the week like some sort of jurassic park lord of the rings crossover raptorsvswizards wethenorth
-1	enter the volvocarsus twilightdrivetodreamsweepstakes for a chance to win a volvo xc60 crossover amp other prizes http t co ccruouoavm
-1	rt sportscenter the fans have spoken steph curry s crossover against chris paul is scnumber1 with 53 of the vote http t co mmlkzwn
-1	the crossover drops 5 1 15 my story into words like rap come check out my music http t co ddfcts6g3d
-1	another flash x arrow crossover rip eyes and ovaries
-1	hadizombie the most crossover and experimental band everr gt
-1	comics sequels reboots sequels to comic book reboots reboots of sequels spin offs of reboot sequels crossover comics sequel to reboot
-1	rt sportscenter the fans have spoken steph curry s crossover against chris paul is scnumber1 with 53 of the vote http t co mmlkzwn
-1	lakers please make the playoffs next year this shit ain t the same
-1	rt hotmamanthecity the all new 2016 fiat 500x crossover fiat500x ad http t co jnx1wgi9kt
-1	rt ckleeu so proud of the co directors of crossover christina sarmiento amp brad_lachapell they represent us well hungersummit le
-1	rt sportscenter the fans have spoken steph curry s crossover against chris paul is scnumber1 with 53 of the vote http t co mmlkzwn
-1	sportscenter scnumber1 cp3 crossover and j
-1	rt sportscenter the fans have spoken steph curry s crossover against chris paul is scnumber1 with 53 of the vote http t co mmlkzwn
-1	rt sportscenter the fans have spoken steph curry s crossover against chris paul is scnumber1 with 53 of the vote http t co mmlkzwn
-1	olemcconnell zackreader55 your crossover slows you down
-1	enter the volvocarsus twilightdrivetodreamsweepstakes for a chance to win a volvo xc60 crossover amp other prizes http t co n2gmzajr5q
-1	rt herwaldt steph got crossover of the year
-1	rt footlocker everybodyup the nbaplayoffs are about to tip off which matchup are you most looking forward to nbaontnt http t co
-1	rt fcacorporate our newest crossover the 2016 fiat 500x coming this quarter in north america choices of manual https t co s8ttoy8
-1	sttephy melilumko yeah but she is still a fixture in pop culture due to her crossover appeal her being able to make r amp b popular pop
-1	rt swaaqon100 i got my crossover from youtube lmao
-1	subaru beefs up new exiga crossover 7 in japan http t co dspczc5v4g
-1	rt sportscenter the fans have spoken steph curry s crossover against chris paul is scnumber1 with 53 of the vote http t co mmlkzwn
-1	game of thrones vs frozen crossover ex post r gameofthrones http t co anm1utbpbe
-1	i got my crossover from youtube lmao
-1	rt torturedbsaa anyone want to do a crossover story with silent hill dm me if your interest
-1	rt ckleeu so proud of the co directors of crossover christina sarmiento amp brad_lachapell they represent us well hungersummit le
-1	rt tom_landrum iampoolean you re gonna love crossover country artist songwriter 19yr old ari castronovo http t co 96cubixghd http t
-1	rt loveiysophia this makes me even more excited for the crossover http t co qrq6wsjtrh
-1	so proud of the co directors of crossover christina sarmiento amp brad_lachapell they represent us well hungersummit leeuserves
-1	anyone want to do a crossover story with silent hill dm me if your interest
-1	seeing otoya x natsuki crossover cd when will masa x toki cd be out orz
-1	our newest crossover the 2016 fiat 500x coming this quarter in north america choices of manual https t co s8ttoy8o7e
-1	sonia delaunay the first crossover artist http t co frlz1yfaxd
-1	harley screamin eagle evolution 1340 softail head pipes no crossover 95 99 http t co 1srmpluxsh http t co r2tlbz5sx0
-1	rt h1ddenabilities what do you guys think of this crossover mega whisper and magnyanzone source http t co jyokxfm3ye http t co qz3
-1	free ebay sniping rt http t co kyzpbbr2up sdcc 2013 gi joe transformers crossover jetfire new sealed please favorite amp share
-1	i saw this crossover fanart of disney characters as jaeger pilots and it seemed alright until they paired up anna and goddamn hans
-1	enter the volvocarsus twilightdrivetodreamsweepstakes for a chance to win a volvo xc60 crossover amp other prizes http t co lxx2bnz8b0
-1	rt hotmamanthecity the all new 2016 fiat 500x crossover fiat500x ad http t co jnx1wgi9kt
-1	oh my god can you imagine a bprd and gf crossover
-1	rt hotmamanthecity the all new 2016 fiat 500x crossover fiat500x ad http t co jnx1wgi9kt
-1	i wanna see a modernfam and black_ishabc crossover show abcnetwork ericstonestreet anthonyanderson
-1	doctorshoney you know if you want to we could try a crossover
-1	http t co pjwe9qsjky the things i ll do for free razors stan lee joked at a recent gillette avengers crossover event
-1	rt sportscenter the fans have spoken steph curry s crossover against chris paul is scnumber1 with 53 of the vote http t co mmlkzwn
-1	stephen curry has both the 1 assist and crossover of the season mvp mvp mvp mvp mvp mvp http t co kxyjafs7ko
-1	enter the volvocarsus twilightdrivetodreamsweepstakes for a chance to win a volvo xc60 crossover amp other prizes http t co rzzkjnxidu
-1	this makes me even more excited for the crossover http t co qrq6wsjtrh
-1	rt fiatusa get to know italian style the all new 2016 fiat 500x crossover http t co yuobexthac
-1	rt ifntaesthetics rejected infinite concepts waluigi paul blart crossover
-1	again notdeadyet raw gig alternative crossover veteran street https t co trvqznswgy
-1	enter the volvocarsus twilightdrivetodreamsweepstakes for a chance to win a volvo xc60 crossover amp other prizes http t co p6xo155tdo
-1	setterington crossover btw professional and home crafter raises interesting issues do artists downplay the connection between techniques
-1	esba 7th grade fybl team also opens up the niketeamflorida fybleague crossover session i with a win esba fybl
-1	the all new 2016 fiat 500x crossover fiat500x ad http t co jnx1wgi9kt
-1	rt tom_landrum elenazosayas you re gonna love crossover country artist songwriter 19yr old ari castronovo http t co 96cubixghd http
-1	i did a naruto pokemon crossover pikachhatake my draft then sharpied then colored http t co ztd23r2bem
-1	i liked a youtube video http t co ajrdlyo33x jamal j crossover crawford nba mix hd
-1	crossover https t co 7qtt6zx5ft
-1	i want a makoharu and kikuro crossover
-1	game of thrones vs frozen crossover ex post r gameofthrones http t co e5zzhcwppw
-1	enter the volvocarsus twilightdrivetodreamsweepstakes for a chance to win a volvo xc60 crossover amp other prizes http t co o0wer7t14e
-1	rt sportscenter the fans have spoken steph curry s crossover against chris paul is scnumber1 with 53 of the vote http t co mmlkzwn
-1	crossover suv with the best ride comfort crv rav4 forester cx 5 http t co xvbvpfn7qd
-1	rt sportscenter the fans have spoken steph curry s crossover against chris paul is scnumber1 with 53 of the vote http t co mmlkzwn
-1	rt tooathletic_gd aj productions ft bobby shmurda ft robertdiazii christmas crossover 2014 http t co ya8ga8lalp tooathletic tooat
-1	rt sportscenter the fans have spoken steph curry s crossover against chris paul is scnumber1 with 53 of the vote http t co mmlkzwn
-1	video subaru outback crowned king of the crossover in test drive via telegraph http t co w1lwtpjrdn
-1	never too early for arm care 12 year old mike from nell getting his crossover symmetry work in at on https t co 2f7j1xr2jy
-1	rt sportscenter the fans have spoken steph curry s crossover against chris paul is scnumber1 with 53 of the vote http t co mmlkzwn
-1	man the steve universe and uncle grandpa crossover was awesome y all suck for not having humor
-1	rt oscopelabs spotted an easter egg in the new starwars trailer i smell a crossover franchisegold sequelsonsequels http t co spv9n
-1	rt itdeeznutsvideo ruby amp max got em https t co 4ron3ogfdb
-1	rt sportscenter the fans have spoken steph curry s crossover against chris paul is scnumber1 with 53 of the vote http t co mmlkzwn
-1	in this nbaplayoffs overview here at crossover chronicles http t co kpdc18hb06 reflections on gsw assistant alvin gentry and the spurs
-1	rt easports_mut sweetness giveaway rt for a chance to win http t co qp7xaekmn6
-1	rt sportscenter the fans have spoken steph curry s crossover against chris paul is scnumber1 with 53 of the vote http t co mmlkzwn
-1	see who dominates the crossover segment http t co wjym9ojeqk
-1	hit em with the crossover https t co pv8potatbz
-1	enter the volvocarsus twilightdrivetodreamsweepstakes for a chance to win a volvo xc60 crossover amp other prizes http t co tqpbwvqzhu
-1	rt sportscenter the fans have spoken steph curry s crossover against chris paul is scnumber1 with 53 of the vote http t co mmlkzwn
-1	amurphy00 and then a mad men crossover making ad
-1	freemarketkev i feel a crossover of universes
-1	rt sportscenter what was best steph curry play this season handles amp step back 3 cp3 crossover amp j vote w scnumber1 watch midnigh
-1	rt sportscenter the fans have spoken steph curry s crossover against chris paul is scnumber1 with 53 of the vote http t co mmlkzwn
-1	game of thrones vs frozen crossover ex post r gameofthrones http t co jaj0j2ylpi
-1	ahaaaa theflash and arrow crossover is the best the final episode teaser totally cheered me up hahahaa
-1	wake up wake up wake up
-1	in honor of our sister band five year mission s two indianapolis shows today we bring you this epic crossover http t co x2i8pbwlim
-1	raww gigs notdeadyet alternative crossover veteran street https t co 9verbsgdhd
-1	rt sportscenter the fans have spoken steph curry s crossover against chris paul is scnumber1 with 53 of the vote http t co mmlkzwn
-1	rt sportscenter the fans have spoken steph curry s crossover against chris paul is scnumber1 with 53 of the vote http t co mmlkzwn
-1	game of thrones vs frozen crossover ex post r gameofthrones http t co bipesj5wpx
-1	lt rt hakogaku host club oh mygod i have been wanting and waiting for this crossover shkgssvgusuyog finallyyy
-1	rt glennhowerton you want a crossover workaholics sunnyfxx http t co l5nm8fuwjw
-1	rt digitaltrends subaru exiga crossover 7 official pictures and specs http t co kmqjli2cw9 http t co znpnmlgrdq
-1	nfandomhard ohmygod ouran crossover you did n o t i have been waiting 18 years for this
-1	rt sportscenter the fans have spoken steph curry s crossover against chris paul is scnumber1 with 53 of the vote http t co mmlkzwn
-1	charboner was always a little hard headed charmander cubone mashup crossover pokemon http t co xtpr9bmmzf http t co 5a17nh94dq
-1	enter the volvocarsus twilightdrivetodreamsweepstakes for a chance to win a volvo xc60 crossover amp other prizes http t co 1vuxia87g4
-1	rt sportscenter what was best steph curry play this season handles amp step back 3 cp3 crossover amp j vote w scnumber1 watch midnigh
-1	aw the steven universe x uncle grandpa crossover is on
-1	rt ballersdesire that last crossover http t co rxbokreebv
-1	new post scion plans no crossover anytime soon http t co heuyxvqrkw
-1	rt nuvo_net the explosion of the edibles market has created a predictable crossover between food people and weed people http t co mts1
-1	rt sportscenter the fans have spoken steph curry s crossover against chris paul is scnumber1 with 53 of the vote http t co mmlkzwn
-1	wait what a uncle grandpa steven universe crossover episode lol
-1	rt sportscenter the fans have spoken steph curry s crossover against chris paul is scnumber1 with 53 of the vote http t co mmlkzwn
-1	rt thefunnyvine the greatest crossover of all time http t co r0pmc3q3yw
-1	fukyutv come and support takeshi crossover video games franchises
-1	rt slevin11yt who likes our hp and harry potter crossover episode ft alex or wh0craft http t co roxj0ifdog
-1	uncle fucking grandpa and stephen universe have a fucking crossover episode i live in a utopian society
-1	steph got crossover of the year
-1	crossover market today at 3 at inman come out hang out and support members of the community leeuserves
-1	here only in house watch only of crossover stephen curry
-1	rt nba_mixes jamal crawford gets jeremy lamb spinning with the sick crossover https t co 7cbjtbjfi0
-1	steven universe uncle grandpa crossover episode great pregame gameday beatgland
-1	the uncle grandpa and stu crossover is on
-1	enter the volvocarsus twilightdrivetodreamsweepstakes for a chance to win a volvo xc60 crossover amp other prizes http t co 9ymvxqtsol
-1	lemon crossover blouse also in black very generous sizing ladies so go down a size 8 14 http t co nieneavdhs
-1	i m think too used to sentai crossover movies where the ___ vs ___ doesn t mean they actually fight each other really
-1	rt hatersrscum tisharaquel bat whooped caps ass in in the dc marvel crossover i can tell you don t know batman
-1	rt sportscenter the fans have spoken steph curry s crossover against chris paul is scnumber1 with 53 of the vote http t co mmlkzwn
-1	well there is now a canon mlp inception crossover mlp5
-1	rt sportscenter the fans have spoken steph curry s crossover against chris paul is scnumber1 with 53 of the vote http t co mmlkzwn
-1	enter the volvocarsus twilightdrivetodreamsweepstakes for a chance to win a volvo xc60 crossover amp other prizes http t co xihoosbwhy
-1	how has there not been a twelfth doctor third doctor crossover yet especially when this man exists http t co nu6pxsvn8g
-1	panel from next mega marvel crossover event revealed http t co 3revaxlppw
-1	steven universe uncle grandpa crossover episode wuddaphuck
-1	whoa uncle grandpa steven s universe crossover episode ayo its lit
-1	smorello_92 it happens man but sadly i ll probly never do that same crossover a again haha
-1	spokane sasquatch softball is in yakima today at an nwac crossover tournament ccs is ranked 1 in the nwac
-1	rt sportscenter the fans have spoken steph curry s crossover against chris paul is scnumber1 with 53 of the vote http t co mmlkzwn
-1	rt sportscenter the fans have spoken steph curry s crossover against chris paul is scnumber1 with 53 of the vote http t co mmlkzwn
-1	tisharaquel bat whooped caps ass in in the dc marvel crossover i can tell you don t know batman
-1	rt sportscenter the fans have spoken steph curry s crossover against chris paul is scnumber1 with 53 of the vote http t co mmlkzwn
-1	the explosion of the edibles market has created a predictable crossover between food people and weed people http t co mts1gsukao
-1	the newly updated qx50 is the sports car that comes in a crossover package http t co xoruvhty8l
-1	rt sportscenter what was best steph curry play this season handles amp step back 3 cp3 crossover amp j vote w scnumber1 watch midnigh
-1	rt sportscenter the fans have spoken steph curry s crossover against chris paul is scnumber1 with 53 of the vote http t co mmlkzwn
-1	leomendoza11 leo you do not want this lethal crossover boi
-1	rt sportscenter the fans have spoken steph curry s crossover against chris paul is scnumber1 with 53 of the vote http t co mmlkzwn
-1	enter the volvocarsus twilightdrivetodreamsweepstakes for a chance to win a volvo xc60 crossover amp other prizes http t co joxsrqbbow
-1	the crossover i have been waiting for
-1	dream crossover talk about lucid mlp5
-1	rt nba_mixes jamal crawford gets jeremy lamb spinning with the sick crossover https t co 7cbjtbjfi0
-1	rt sportscenter what was best steph curry play this season handles amp step back 3 cp3 crossover amp j vote w scnumber1 watch midnigh
-1	rt gurlzknowbetter crossover episodes on disney channel were the best http t co gp3ndtckey
-1	rt nba_mixes jamal crawford gets jeremy lamb spinning with the sick crossover https t co 7cbjtbjfi0
