-1	enter the volvocarsus twilightdrivetodreamsweepstakes for a chance to win a volvo xc60 crossover amp other prizes http t co dxvlpvnx4r
-1	goldenrusset keatingrogers wheelofcheese mlp5 monsters inc crossover
-1	rt sportscenter the fans have spoken steph curry s crossover against chris paul is scnumber1 with 53 of the vote http t co mmlkzwn
-1	i seriously love how someone did a crossover with inu x boku and black butler http t co bxsxkyoyqc
-1	squeemonster i just finished that spn twd crossover d c and it was so good daryl with cas and the winchester s __
-1	rt nba_mixes jamal crawford gets jeremy lamb spinning with the sick crossover https t co 7cbjtbjfi0
-1	rt sportscenter the fans have spoken steph curry s crossover against chris paul is scnumber1 with 53 of the vote http t co mmlkzwn
-1	cartier and nialaya rings pop against a beautiful orange herm s clutch our crossover ring is available now at http t co 8sfv27bakf
-1	rt sportscenter the fans have spoken steph curry s crossover against chris paul is scnumber1 with 53 of the vote http t co mmlkzwn
-1	cartier and nialaya rings pop against a beautiful orange herm s clutch our crossover ring is https t co ui1kwfgcva
-1	clermont toulon final would be boring to me want some league crossover clermont leinster i could get into
-1	jamal crawford gets jeremy lamb spinning with the sick crossover https t co 7cbjtbjfi0
-1	rt sportscenter the fans have spoken steph curry s crossover against chris paul is scnumber1 with 53 of the vote http t co mmlkzwn
-1	do i see a maki hestia crossover tho
-1	and marvels are shit rt almostyoehzer i hate dc marvel crossover debates cause both universes have different power standards
-1	rt gurlzknowbetter crossover episodes on disney channel were the best http t co gp3ndtckey
-1	two the potential of mcdavid getting crossover appeal in the united states
-1	crossover episodes on disney channel were the best http t co gp3ndtckey
-1	harjapgarcha murrrmz batman admitted captain america could kick his ass in a crossover
-1	rt sportscenter the fans have spoken steph curry s crossover against chris paul is scnumber1 with 53 of the vote http t co mmlkzwn
-1	fozzief1 as would i love the look of the new 500 l x crossover thing too vivaitaly
-1	i hate dc marvel crossover debates cause both universes have different power standards
-1	hot deal gt gt http t co quhsomebqk new commscopescreened 65ns4 cat 6 4pr 24 cable crossover 30ft pn 010960 http t co u8zobvyvok
-1	rt sportscenter the fans have spoken steph curry s crossover against chris paul is scnumber1 with 53 of the vote http t co mmlkzwn
-1	harley screamin eagle slip on mufflers softail 2000 flstf fxstd crossover http t co hwanaovrlw http t co w2beqtwjtr
-1	i be watching crossover videos amp i feel unstoppable afterwards
-1	enter the volvocarsus twilightdrivetodreamsweepstakes for a chance to win a volvo xc60 crossover amp other prizes http t co gmjycqq6mw
-1	enter the volvocarsus twilightdrivetodreamsweepstakes for a chance to win a volvo xc60 crossover amp other prizes http t co fxa0kjgcaf
-1	https t co mueksgmsbe besame mucho anastasia lee 15 yr old classical crossover style of andrea bocelli justhear great
-1	rt glennhowerton you want a crossover workaholics sunnyfxx http t co l5nm8fuwjw
-1	rt sportscenter the fans have spoken steph curry s crossover against chris paul is scnumber1 with 53 of the vote http t co mmlkzwn
-1	rt sportscenter the fans have spoken steph curry s crossover against chris paul is scnumber1 with 53 of the vote http t co mmlkzwn
-1	teachersrockatl you should check out crossover when you get a chance very good but still liked bgd a little better
-1	rt xboxuk win an xbox one simply tell us your dream crossover for legodimensions amp tag it allforone http t co vohj6cyem3
-1	xboxuk legodimensions i think a ghostbusters crossover would be very good and give lots of good level options allforone
-1	rt sportscenter the fans have spoken steph curry s crossover against chris paul is scnumber1 with 53 of the vote http t co mmlkzwn
-1	enter the volvocarsus twilightdrivetodreamsweepstakes for a chance to win a volvo xc60 crossover amp other prizes http t co z0unonzn7a
-1	still mad cause this wasn t a fucking crossover with his cheating ass but ok http t co tq4eqeexbj
-1	rt sportscenter the fans have spoken steph curry s crossover against chris paul is scnumber1 with 53 of the vote http t co mmlkzwn
-1	diamandahagan rapcritic_tgwtg foldablehuman best crossover idea ever
-1	what s this about a star wars tnr crossover io9 http t co ekpkiw6nb3
-1	game of thrones vs frozen crossover ex post r gameofthrones imgur http t co g7vjyt7e39
-1	enter the volvocarsus twilightdrivetodreamsweepstakes for a chance to win a volvo xc60 crossover amp other prizes http t co nmdtnw692d
-1	rt gerfdown mlp independence day crossover is now canon guess i need a new fanfic idea phooey mlp5 mlpseason5 brony
-1	mlp independence day crossover is now canon guess i need a new fanfic idea phooey mlp5 mlpseason5 brony
-1	rt nba check out nbadleague call up buycksworld13 with the absurd crossover lakers nbavine https t co fs2erix6uk
-1	rt sportscenter the fans have spoken steph curry s crossover against chris paul is scnumber1 with 53 of the vote http t co mmlkzwn
-1	rt sportscenter the fans have spoken steph curry s crossover against chris paul is scnumber1 with 53 of the vote http t co mmlkzwn
-1	rt fiatusa get to know italian style the all new 2016 fiat 500x crossover http t co yuobexthac
-1	rt sportscenter the fans have spoken steph curry s crossover against chris paul is scnumber1 with 53 of the vote http t co mmlkzwn
-1	robdenbleyker an upcoming crossover movie between the wizard and alligator
-1	rt autoguide ford edge vs nissan murano which stylish crossover do you prefer http t co gesxktnjlq
-1	rt sportscenter the fans have spoken steph curry s crossover against chris paul is scnumber1 with 53 of the vote http t co mmlkzwn
-1	wildpipm i need a crossover between teen wolf and the 100 even it doesnt make any sense
-1	tfw gintama crossover but u still like it
-1	rt sportscenter the fans have spoken steph curry s crossover against chris paul is scnumber1 with 53 of the vote http t co mmlkzwn
-1	myesha buys cboe 58 4 cboe holdings bearish moving average crossover alert cboe today shares of cboe holding http t co j94afe2z2p
-1	nathanfillion anianl looking forward to season 8 maybe you can do a crossover with forever
-1	latest kids book czechophile crossover object of my affection http t co rivg3icv6k http t co jpk1tldueu
-1	rt markhoppus debbyryan it s true i m a crossover hit
-1	rt maidbarrett you mean buck dewey s not modern au barrett loosely qualifies for crossover prompt i guess rf_69min http t co dtt9qk
-1	who likes our hp and harry potter crossover episode ft alex or wh0craft http t co roxj0ifdog
-1	enter the volvocarsus twilightdrivetodreamsweepstakes for a chance to win a volvo xc60 crossover amp other prizes http t co ofmrfshedk
-1	tydigga1 they had a crossover for dc marvel and had aquaman vs sub mariner i was very surprised aquaman won that
-1	rt sportscenter the fans have spoken steph curry s crossover against chris paul is scnumber1 with 53 of the vote http t co mmlkzwn
-1	rt sportscenter the fans have spoken steph curry s crossover against chris paul is scnumber1 with 53 of the vote http t co mmlkzwn
-1	photoset flamingtoadart now this is a crossover i could get into haha http t co dosz69zcnw
-1	the talent is all over the screen in this fun filled collection of shows featuring crossover stars fr http t co ewn7kjjntv via dramafever
-1	2015 aston martin dbx concept 2016 aston martin dbx crossover concept supercar supercars supercar2015 car http t co 1cfbmbppoi
-1	sirpatstew imagine a got and xmen crossover like this who needs bran when we got prof x controlling hodor http t co cbpdcjqznh
-1	rt sportscenter the fans have spoken steph curry s crossover against chris paul is scnumber1 with 53 of the vote http t co mmlkzwn
-1	part iii of our latest international blog crossover is now live on nerissa s life live the adventure in the http t co zwfslqqtik
-1	rt skatronixxx exclusive game of thrones and terminator crossover stills leaked http t co dllvflnb6o
-1	what do you guys think of this crossover mega whisper and magnyanzone source http t co jyokxfm3ye http t co qz3hmi2mnq
-1	rt sportscenter the fans have spoken steph curry s crossover against chris paul is scnumber1 with 53 of the vote http t co mmlkzwn
-1	rt sportscenter the fans have spoken steph curry s crossover against chris paul is scnumber1 with 53 of the vote http t co mmlkzwn
-1	rt sportscenter what was best steph curry play this season handles amp step back 3 cp3 crossover amp j vote w scnumber1 watch midnigh
-1	rt febarrosbr2012 i just can t wait for this crossover mariskahargitay sophiabush jasonbeghe svu cpd mariska http t co d8oblp
-1	5 for uncpembroke mike smith finishes a pretty crossover with an aerial performance to gain the lead over gcu http t co pfltcoyzon
-1	rt thefunnyvine the greatest crossover of all time http t co r0pmc3q3yw
-1	rt sportscenter what was best steph curry play this season handles amp step back 3 cp3 crossover amp j vote w scnumber1 watch midnigh
-1	rt mariskamission can t wait for the crossover mariskahargitay sophiabush http t co 5gdshjlbtr
-1	i think all of my crossover residuals this year are going to go to funding my expensive japanese action figure addiction
-1	rt leonbolier mikepush ill pass u my album dude u might dig it the main stuff is more crossover but the melodies r beautiful imo
-1	enter the volvocarsus twilightdrivetodreamsweepstakes for a chance to win a volvo xc60 crossover amp other prizes http t co zqpsdjpfe1
-1	enter the volvocarsus twilightdrivetodreamsweepstakes for a chance to win a volvo xc60 crossover amp other prizes http t co seyqdamzay
-1	put the crossover into play thursday night can t say i feel different in approach need to shoot video in a bad way release needs work
-1	enter the volvocarsus twilightdrivetodreamsweepstakes for a chance to win a volvo xc60 crossover amp other prizes http t co vqf0spfcwg
-1	rt cerromerussell batman had a chance to fight captain america and he backed down in a crossover
-1	new daily deals http t co vjlmnbnnem 481 14k yellow gold crossover shiny cz cubic zirconia toe ring body art http t co 97jeie5tjf
-1	enter the volvocarsus twilightdrivetodreamsweepstakes for a chance to win a volvo xc60 crossover amp other prizes http t co ffame3cxfh
-1	enter the volvocarsus twilightdrivetodreamsweepstakes for a chance to win a volvo xc60 crossover amp other prizes http t co icrltqxj94
-1	unnecessary crossover https t co akfj5rvfge
-1	rt sportscenter the fans have spoken steph curry s crossover against chris paul is scnumber1 with 53 of the vote http t co mmlkzwn
-1	rt ayanna_leeshell cant wait til junior crossover picnic
-1	rt sportscenter the fans have spoken steph curry s crossover against chris paul is scnumber1 with 53 of the vote http t co mmlkzwn
-1	rt sportscenter the fans have spoken steph curry s crossover against chris paul is scnumber1 with 53 of the vote http t co mmlkzwn
-1	shaunduke princejvstin eruditeogre also she writes under two different names with from what i can tell little fan crossover
-1	cant wait til junior crossover picnic
-1	furforthefun superwiiubros and they even had a crossover
-1	can wait for the fast amp furious disney cars crossover
-1	superwiiubros crossover confirmed
-1	last rts i demand parks and rec ghostbuster crossover fanfiction someone make that happen
-1	rt sportscenter the fans have spoken steph curry s crossover against chris paul is scnumber1 with 53 of the vote http t co mmlkzwn
-1	so my dreams created a dragon age doctor who crossover in which cybermen arrived in thedas
-1	rt sportscenter what was best steph curry play this season handles amp step back 3 cp3 crossover amp j vote w scnumber1 watch midnigh
-1	the killer crossover https t co lcwhnchqnd
-1	crossover_ahmed tbh as long as we don t lose we ll be fine arsenal can t and won t catch chelsea
-1	star wars game of thrones crossover let s do it https t co gzfadw9bod
-1	rt amymebberson nice my tink ww was featured in channelfred s latest vid of disney crossover artists https t co 7pkw5d4ywx
-1	rt sportscenter the fans have spoken steph curry s crossover against chris paul is scnumber1 with 53 of the vote http t co mmlkzwn
-1	rt sportscenter the fans have spoken steph curry s crossover against chris paul is scnumber1 with 53 of the vote http t co mmlkzwn
-1	rt sportscenter what was best steph curry play this season handles amp step back 3 cp3 crossover amp j vote w scnumber1 watch midnigh
-1	pm needs to write up his crossover s l for his spndean and then look for a bonnie
-1	enter the volvocarsus twilightdrivetodreamsweepstakes for a chance to win a volvo xc60 crossover amp other prizes http t co ifoizkfnk0
-1	rt thefunnyvine the greatest crossover of all time http t co r0pmc3q3yw
-1	there s a sharknado and archie crossover via digg http t co oyafbkptlh
-1	enter the volvocarsus twilightdrivetodreamsweepstakes for a chance to win a volvo xc60 crossover amp other prizes http t co dccrlwdsug
-1	alan s psychedelic breakfast amp lucy in the sky with diamond crossover
-1	rt sportscenter the fans have spoken steph curry s crossover against chris paul is scnumber1 with 53 of the vote http t co mmlkzwn
-1	lantetrain l_and_j_rule in the press release for the episode after the crossover it says he makes a costly mistake so maybe that s why
-1	a fan of crossover thrash me with my reputation http t co a1sddk1at8
-1	rt __lexooo i need to go to this drake concert
-1	enter the volvocarsus twilightdrivetodreamsweepstakes for a chance to win a volvo xc60 crossover amp other prizes http t co cz8k3fevsj
-1	enter the volvocarsus twilightdrivetodreamsweepstakes for a chance to win a volvo xc60 crossover amp other prizes http t co 7rfqxfhhuy
-1	rt akantecki just underway at dundee crown hs for fvc crossover baseball between woodstock and the host chargers http t co 9y5fb9feo9
-1	according to the nba steph has the top assist and crossover of the season thatnigga
-1	authentic louis vuitton crossover bag brand new http t co qxrh1wkz0h louisvuitton
-1	n crossover hits on top of longevity https t co 5tmrv0kqqy
-1	mikepush ill pass u my album dude u might dig it the main stuff is more crossover but the melodies r beautiful imo
-1	rt sportscenter the fans have spoken steph curry s crossover against chris paul is scnumber1 with 53 of the vote http t co mmlkzwn
-1	enter the volvocarsus twilightdrivetodreamsweepstakes for a chance to win a volvo xc60 crossover amp other prizes http t co u7ix1l3yiw
-1	rt fiatusa get to know italian style the all new 2016 fiat 500x crossover http t co yuobexthac
-1	3of top 10assists the bst crossover 2in top10plays harden westbrook lebron all have collectively3 there u have your mvp end of discussion
-1	rt sportscenter the fans have spoken steph curry s crossover against chris paul is scnumber1 with 53 of the vote http t co mmlkzwn
-1	rt zoeeminem yungkeem4rmlb well that s not a crossover anyone needs
-1	17 35 live crossing for maghrib from makkah live crossover to the holy mosque in makkah mukarramah for live prayers with imagery
-1	with a scooby doo and kiss crossover coming up it s safe to say hannah barbara has too much money and needs to chill out
-1	andrewlearmonth both marvel and dc currently spewing out continuity heavy crossover events so i d go for back issues right now
-1	nlees42 if you are registered for crossover rewards and are a delta medallion member delta miles will post to your spg account 1 2
-1	rt zoeeminem yungkeem4rmlb well that s not a crossover anyone needs
-1	capnstrawhat oh i see never thought of doing a op frozen crossover huh
-1	can t wait for the crossover svuchicagopd http t co ocibqyvfkj
-1	yungkeem4rmlb well that s not a crossover anyone needs
-1	i added a video to a youtube playlist http t co nemttozaam klaus kenzi crossover i ve been aching for you
-1	icequeenelsie wanna do an op pr crossover but the others would have to be onboard
-1	rt sportscenter the fans have spoken steph curry s crossover against chris paul is scnumber1 with 53 of the vote http t co mmlkzwn
-1	rt sportscenter the fans have spoken steph curry s crossover against chris paul is scnumber1 with 53 of the vote http t co mmlkzwn
-1	rt akantecki just underway at dundee crown hs for fvc crossover baseball between woodstock and the host chargers http t co 9y5fb9feo9
-1	enter the volvocarsus twilightdrivetodreamsweepstakes for a chance to win a volvo xc60 crossover amp other prizes http t co zbjwzpgilj
-1	rt mariskamission can t wait for the crossover mariskahargitay sophiabush http t co 5gdshjlbtr
-1	rt amz_furoku_wm http t co bcc5r0hqpr humor if anyone reads the futurama graphic novels you ll see they are just as good as th http
-1	rt sportscenter the fans have spoken steph curry s crossover against chris paul is scnumber1 with 53 of the vote http t co mmlkzwn
-1	peytonsawyxr next week is the crossover
-1	peytonsawyxr sophiabush tuesday and wednesday i think cause it s a crossover and maybe thursday too
-1	rt sportscenter the fans have spoken steph curry s crossover against chris paul is scnumber1 with 53 of the vote http t co mmlkzwn
-1	rt febarrosbr2012 i just can t wait for this crossover mariskahargitay sophiabush jasonbeghe svu cpd mariska http t co d8oblp
-1	rt childhoodfacts crossover episodes on disney channel were the best http t co 5vlibvn8lg
-1	rt sportscenter the fans have spoken steph curry s crossover against chris paul is scnumber1 with 53 of the vote http t co mmlkzwn
-1	crossover les mis disney http t co ios6udy129
-1	rt official_djteo catch me this sunday performing crossover clubmystic w loonzmtr amp mikescomedyy ifyouknowyouknow
-1	no 2 james harden s nasty crossover of ricky rubio vine by sportscenter https t co g4u8iqeavw
-1	just underway at dundee crown hs for fvc crossover baseball between woodstock and the host chargers http t co 9y5fb9feo9
-1	she gift him a wine my god crossover
-1	alymdc exo sex slave x a bet lost crossover g ba
-1	rt amz_furoku_wm http t co bcc5r0hqpr humor if anyone reads the futurama graphic novels you ll see they are just as good as th http
-1	forging new allies and friends cp with vincent and springtrap crossover http t co nzbe8z8lxa
-1	rt sportscenter the fans have spoken steph curry s crossover against chris paul is scnumber1 with 53 of the vote http t co mmlkzwn
-1	rt sportscenter the fans have spoken steph curry s crossover against chris paul is scnumber1 with 53 of the vote http t co mmlkzwn
-1	qcn79 weak relative strength slow stoch crossover and flat macd
-1	rt sportscenter the fans have spoken steph curry s crossover against chris paul is scnumber1 with 53 of the vote http t co mmlkzwn
-1	can t wait for the crossover mariskahargitay sophiabush http t co 5gdshjlbtr
-1	rt sportscenter the fans have spoken steph curry s crossover against chris paul is scnumber1 with 53 of the vote http t co mmlkzwn
-1	enter the volvocarsus twilightdrivetodreamsweepstakes for a chance to win a volvo xc60 crossover amp other prizes http t co bntt7tvwuu
-1	rt sportscenter the fans have spoken steph curry s crossover against chris paul is scnumber1 with 53 of the vote http t co mmlkzwn
-1	cal butted heads with daredevil dd x agents of shield crossover when
-1	check out nbadleague call up dwight buycks with the absurd crossover lakers nbavine vine by nba https t co jlzqokqe1v
-1	rt febarrosbr2012 i just can t wait for this crossover mariskahargitay sophiabush jasonbeghe svu cpd mariska http t co d8oblp
-1	enter the volvocarsus twilightdrivetodreamsweepstakes for a chance to win a volvo xc60 crossover amp other prizes http t co 0ir74ugmds
-1	rt 3blackgeeks last i checked batman vs captain america ended in a stalemate when they fought in that marvel vs dc crossover
-1	crossover by m travis lane cormorant books http t co 5cqfkaevb1
-1	i just can t wait for this crossover mariskahargitay sophiabush jasonbeghe svu cpd mariska http t co d8oblpk34s
-1	rt childhoodfacts crossover episodes on disney channel were the best http t co 5vlibvn8lg
-1	top 10 crossovers 2014 2015 nba regular season dancewithme nba crossover https t co cte3dzpk47 via youtube
-1	rausllys except the jessie crossover
-1	iamanisalah arsenal chelseafc there run down now and united will show you that today
-1	name the crossover who would win http t co 9ndpnipfxs http t co u1fxsxvjrz
-1	best on ebay of louis vuitton authentic louis vuitton crossover bag brand new http t co oeizz1zyzk http t co 42zttvsdsh
-1	photo winters over im miami but not in the north this crossover jacket dress is purfect for travel http t co bj0hceyz5b
-1	winters over im miami but not in the north this crossover jacket dress is purfect for travel https t co lzovvfjjbd
-1	rt cerromerussell batman had a chance to fight captain america and he backed down in a crossover
-1	http t co un8eqyxdiv deals 0104 gold tone over 925 silver 3 5ct champagne diamond amp white topaz crossover rin http t co qn8ejb6iye
-1	rt sportscenter the fans have spoken steph curry s crossover against chris paul is scnumber1 with 53 of the vote http t co mmlkzwn
-1	last i checked batman vs captain america ended in a stalemate when they fought in that marvel vs dc crossover
-1	rt cerromerussell batman had a chance to fight captain america and he backed down in a crossover
-1	rt sportscenter the fans have spoken steph curry s crossover against chris paul is scnumber1 with 53 of the vote http t co mmlkzwn
-1	you can beat me but itll take you awhile rt cerromerussell batman had a chance to fight captain america and he backed down in a crossover
-1	aj productions ft bobby shmurda ft robertdiazii christmas crossover 2014 http t co ya8ga8lalp tooathletic tooathleticvideos
-1	enter the volvocarsus twilightdrivetodreamsweepstakes for a chance to win a volvo xc60 crossover amp other prizes http t co lpacwgecfa
-1	enter the volvocarsus twilightdrivetodreamsweepstakes for a chance to win a volvo xc60 crossover amp other prizes http t co byjb3jqbfk
-1	rt erikaatbh julieplec when the klaroline crossover happens we all know it will happen please caroline should amp must sing something to k
-1	how to ice skate how to do a backward crossover on ice skates http t co wqyuwo41es makemoney leads http t co nuzdsxtumh
-1	rt sportscenter what was best steph curry play this season handles amp step back 3 cp3 crossover amp j vote w scnumber1 watch midnigh
-1	i added a video to a youtube playlist http t co lpmiopyxuw somebody to die for crossover mep vol 1
-1	rt sportscenter the fans have spoken steph curry s crossover against chris paul is scnumber1 with 53 of the vote http t co mmlkzwn
-1	roland synthesizer amp ableton x logic pro amp boss loop station crossover beatbox korea pop song https t co 0zhmvunnnf
-1	rt fiatusa get to know italian style the all new 2016 fiat 500x crossover http t co yuobexthac
-1	enter the volvocarsus twilightdrivetodreamsweepstakes for a chance to win a volvo xc60 crossover amp other prizes http t co mhcxiexgfb
-1	rt bestof90s easily the best tv crossover http t co uaavqc8aov
-1	daily deals usa crossover 2795qhd 2560x1440 lg ah ips non glare 27 monitor http t co daw08bkj7k 5778
-1	let s get a crossover in the works on you dccomics and disneypictures http t co 7bcuek4lyr
-1	thatguytagg he s everywhere now i m assuming you haven t watched the scooby doo cena crossover movie
-1	enter the volvocarsus twilightdrivetodreamsweepstakes for a chance to win a volvo xc60 crossover amp other prizes http t co zsxfezqkao
-1	i cant wait until the pall blart grouwndups crossover movies
-1	new womens cobalt blue crossover designer long cocktail party maxi dress s http t co klpbtqrncv http t co ca4mv4rosi
-1	new womens cobalt blue crossover designer long cocktail party maxi dress s http t co cmsyl4tdwa http t co 5ff3bl0hbg
-1	new womens cobalt blue crossover designer long cocktail party maxi dress s http t co loizznlhlu http t co l9q5fxfxlw
-1	rt kingofkings0007 derekt529 lol please batman gt any marvel character you don t believe me read the crossover comics or ask stan lee lol
-1	ford edge vs nissan murano which stylish crossover do you prefer http t co gesxktnjlq
-1	rt sportscenter what was best steph curry play this season handles amp step back 3 cp3 crossover amp j vote w scnumber1 watch midnigh
-1	new womens cobalt blue crossover designer long cocktail party maxi dress s http t co tm8dusrzit http t co x0ot9ggi6y
-1	batman had a chance to fight captain america and he backed down in a crossover
-1	derekt529 lol please batman gt any marvel character you don t believe me read the crossover comics or ask stan lee lol he ll say the same
-1	thepharaohmaf at 100 is just a scary thought he would ve been a huge draw and had crossover https t co sy3y0ydi5c
-1	get to know italian style the all new 2016 fiat 500x crossover http t co yuobexthac
-1	funny fakes let s do a crossover http t co jdyde1a8xx
-1	rt tvaniotis and here is a crossover between ast_news cast2015 and leanux15 context driven testing applied phenomenological metaph
-1	rt sneakerticker he still looking for it lmao crossover https t co lkasrmy8gj
-1	rt sportscenter the fans have spoken steph curry s crossover against chris paul is scnumber1 with 53 of the vote http t co mmlkzwn
-1	rt sportscenter the fans have spoken steph curry s crossover against chris paul is scnumber1 with 53 of the vote http t co mmlkzwn
-1	exhaust crossover pipe dorman 679 000 http t co wtp3lh6feg http t co tzeqmmk5sh
-1	fychicagofire every one on this show is awesome cant wait for crossover
-1	way back at the beginning of 2013 nintendo announced an upcoming role playing game crossover title for the wii u
-1	rt sportscenter the fans have spoken steph curry s crossover against chris paul is scnumber1 with 53 of the vote http t co mmlkzwn
-1	sportscenter cp3 crossover
