-1	enter the volvocarsus twilightdrivetodreamsweepstakes for a chance to win a volvo xc60 crossover amp other prizes http t co n4c3e3wjwz
-1	enter the volvocarsus twilightdrivetodreamsweepstakes for a chance to win a volvo xc60 crossover amp other prizes http t co 2dod6tup2q
-1	agents of s h i e l d clip teases avengers 2 crossover http t co uzklaytljm http t co lsykuio6gq
-1	spidergwen batgirl the crossover byfooray deviantart the1stbat g0thams_batgirl doordonot75 http t co bdogzprxro http t co 7t47l8dawk
-1	agents of s h i e l d clip teases avengers 2 crossover http t co 4j4m7hfstq http t co g9qkvmuvrh
-1	ap2hyc i honestly thought this is the worst flash episode by a long way the crossover episodes have all been a bit weak
-1	nasty crossover and game winner https t co vf38wt7xil
-1	no 2 james harden s nasty crossover of ricky rubio vine by sportscenter https t co ohdbj8yoyy
-1	tremendous respect for extinctionad the best new band we ve seen at moshfest so far dudes put the thrash in crossover thrash nemhf
-1	agents of s h i e l d clip teases avengers 2 crossover http t co apnijz3xze http t co chmkegfanm
-1	enter the volvocarsus twilightdrivetodreamsweepstakes for a chance to win a volvo xc60 crossover amp other prizes http t co 3zyl13edmg
-1	agents of s h i e l d clip teases avengers 2 crossover there are only 2 episodes of marvel s agen http t co j3de5tdwxk
-1	agents of s h i e l d clip teases avengers 2 crossover there are only 2 epis http t co q1fvq4epqy movie tv download
-1	movie news agents of s h i e l d clip teases avengers 2 crossover there are only 2 episodes of http t co 5lvhwrufmw
-1	agents of s h i e l d clip teases avengers 2 crossover there are only 2 episodes http t co 1tjvesf6sr movies follow
-1	jdahmaniii hillaryclinton we call that crossover appeal
-1	kiiiugons rinharunova 7 but one isnt localized and a crossover
-1	enter the volvocarsus twilightdrivetodreamsweepstakes for a chance to win a volvo xc60 crossover amp other prizes http t co 7oyfyzd94c
-1	enter the volvocarsus twilightdrivetodreamsweepstakes for a chance to win a volvo xc60 crossover amp other prizes http t co 5haecxahvo
-1	rt intercomicspod my new sounds episode 86 sniktcast crossover snikt just got real https t co vdorj4zq7s on soundcloud
-1	tokyo ghoul and snk crossover where everyone starts cleaning http t co enkulpnc83
-1	rt 2wired2tired did you know the fiat500x is a crossover with dual personalities sport mode or traction you will be good to go no ma
-1	rumor that back 1 2 of oah2015 convention hall being used by dance moms i m literally the only demographic excited by this crossover
-1	kodokumi said aww thank you for your assclass x kagepro crossover it s good to know that not everyone http t co odpmceoz8q
-1	hiccstrid crossover google haku http t co sesdwyorrz
-1	rt fcacorporate our newest crossover the 2016 fiat 500x coming this quarter in north america choices of manual https t co s8ttoy8
-1	rt 900_162 great job ladies won our pool reffing now playing our crossover at 4 30 on ct 55
-1	game of thrones vs frozen crossover ex post r gameofthrones http t co tzlk9dgn9a http t co rbt1oizjat
-1	this crossover pitch perfect nba playoffs ad is phenomenal
-1	rt the100soldiers wildpipm now i need a crossover between the100 and teenwolf please
-1	the 20 best nba crossover gifs http t co 1hjisgntmi
-1	did you know the fiat500x is a crossover with dual personalities sport mode or traction you will be good to go no matter the conditions
-1	bradballislife i grew up with him he s the funniest guy lol use to have a lil jumper and crossover too
-1	photoset flamingtoadart now this is a crossover i could get into haha http t co jquojz3oub
-1	nbaplayoffs picture nba nbamvp http t co hamt2xscsu
-1	rt sportscenter the fans have spoken steph curry s crossover against chris paul is scnumber1 with 53 of the vote http t co mmlkzwn
-1	rt desirascals wonder if there will be a towie desirascals tv crossover jasminwalia everyone loved meeting u theonlywayisdesi http
-1	rt billboard bachata sensation princeroyce wants to be latin s next crossover king http t co hftcrzxdhy http t co 1pmb7cng8g
-1	i guess that s the wbb x lovecraft crossover kemohomo doujin
-1	rt sportscenter the fans have spoken steph curry s crossover against chris paul is scnumber1 with 53 of the vote http t co mmlkzwn
-1	rt er_notr this whole movie crossover business is getting out of hand http t co l6v1kxgaix
-1	mudrock makes me think of stones under the sea daredevil spongebob crossover here i come
-1	great job ladies won our pool reffing now playing our crossover at 4 30 on ct 55
-1	rt tom_landrum myrtlemanor_aa you re gonna love crossover country artist songwriter 19yr old ari castronovo http t co 96cubixghd http
-1	rt nba watch the top 10 plays of the season to see where stephencurry30 s nasty crossover ranks http t co uo4xghs3yg http t co cebz
-1	night fast handled shot at 60 fps basketball baller dribbles dribbling handles crossover https t co wfoildpunl
-1	rt sportscenter the fans have spoken steph curry s crossover against chris paul is scnumber1 with 53 of the vote http t co mmlkzwn
-1	rt sportscenter the fans have spoken steph curry s crossover against chris paul is scnumber1 with 53 of the vote http t co mmlkzwn
-1	rt ioveofthegame push yourself you will not regret it http t co m3rykiqik9
-1	arrow hasn t been the same this season flash has stolen all its thunder the crossover episodes have been great though
-1	wildpipm now i need a crossover between the100 and teenwolf please
-1	alright so steph got crossover assist and play of the year mvp
-1	rt sierraakilah i wanna go here http t co qmx3irqsf9
-1	rt sportscenter the fans have spoken steph curry s crossover against chris paul is scnumber1 with 53 of the vote http t co mmlkzwn
-1	game of thrones vs frozen crossover ex post r gameofthrones http t co tkvogglljn
-1	my jeep is one of a kind it s not like any jk s tj s or even yj s for that matter it s a hybrid jeep crossover of a tj and a yj
-1	rt sportscenter our no 2 play of the nba season is james harden s nasty crossover of ricky rubio animated by patricktruby https t c
-1	there will never be a toriko x one piece x dbz crossover again because toei fucked up the toriko anime thanks toei
-1	ebay bid last second rt http t co mvv0bvlih4 thule tcbp 417 crossover 32l 7 inch macbook pro or laptop black backpack please favo
-1	last second outbid rt http t co hsace1zkgn thule tcbp 417 crossover 32l 7 inch macbook pro or laptop black backpack please favori
-1	free ebay sniping rt http t co v1hqcbc3p2 icy blue thule crossover 25l 17 laptop backpack lightly used please favorite amp share
-1	rt mariskamission can t wait for the crossover mariskahargitay sophiabush http t co 5gdshjlbtr
-1	rt abc7 2 killed after car crashes into tree splits in half in pomona http t co ow4pkzsnqb http t co twwufzezo8
-1	last second outbid rt http t co xjvdhtjmab icy blue thule crossover 25l 17 laptop backpack lightly used please favorite amp share
-1	rt sportscenter the fans have spoken steph curry s crossover against chris paul is scnumber1 with 53 of the vote http t co mmlkzwn
-1	rt smilepiease when you get past level 20 in orbit run http t co cl1zuba9vx
-1	rt marc_raimondi marvel s plan is for three other netflix shows and a defenders crossover but to not put out daredevil season two next y
-1	rt slamonline report nike close to nba apparel deal http t co okhidzqkmt http t co kcvm8snkod
-1	enter the volvocarsus twilightdrivetodreamsweepstakes for a chance to win a volvo xc60 crossover amp other prizes http t co ymg4bscnxt
-1	rt footballau important links for a day 2015 listen http t co xj3ta1jxih watch http t co smqzenoejj wareagle auburnfast
-1	rt sportscenter the fans have spoken steph curry s crossover against chris paul is scnumber1 with 53 of the vote http t co mmlkzwn
-1	enter the volvocarsus twilightdrivetodreamsweepstakes for a chance to win a volvo xc60 crossover amp other prizes http t co enpwixixnb
-1	rt sportscenter the fans have spoken steph curry s crossover against chris paul is scnumber1 with 53 of the vote http t co mmlkzwn
-1	thejohnbarber your writing on transformers just gets better and better fella really getting into this crossover now after grave doubts
-1	if nina is leaving they should have sam amp dean from supernatural come to town and finish her off lol great crossover tvd julieplec
-1	rt glennhowerton you want a crossover workaholics sunnyfxx http t co l5nm8fuwjw
-1	rt rtnba wizards 46 raptors 42 halftime nbaplayoffs
-1	rt sweatergawdd a relationship where we stay together through the struggles amp the fights
-1	rt comedyortruth this is how my week goes mooooonnnnnddaaaaaaaaay tueeeesssdaaaaaaayyyyy weeedddnnnesssdayyyyy thursssssdaaaaaaaayyyyy
-1	a doll that can kill through internet videos annabelle unfriended crossover incoming http t co su2kyvxd6i weirdnews
-1	batman v superman trailer 6 biggest moments from first teaser of the international business times http t co 8jrg5bzq4s dcuo
-1	nephew dropped buckets and got one lil crossover but still lost
-1	rt danceauthor there s no place in god s plan for a vampire barbara s not so sure https t co asys2tdwld 99cents crossover paranorma
-1	rt fiatusa get to know italian style the all new 2016 fiat 500x crossover http t co yuobexthac
-1	there s nothing like a good fandom crossover
-1	rt richmondcheer fantastic run for our juniors this was their first time competing without their senior crossover teammates but still ro
-1	rt coachsampurcell freshman aricuuuh with the change your scouting report crossover i you cali letsgo https t co tvsldiy0sg
-1	enter the volvocarsus twilightdrivetodreamsweepstakes for a chance to win a volvo xc60 crossover amp other prizes http t co sjmtmwk9ve
-1	or if he listens to oty i want to make a crossover acc
-1	rt marc_raimondi marvel s plan is for three other netflix shows and a defenders crossover but to not put out daredevil season two next y
-1	i d like a supernatural vampire diaries crossover where we d go and just wipe them out jensen lol win
-1	kaisoserranon crossover time
-1	this wee bimmer probably won t come to the us http t co kyifuqercz
-1	rt luwaineggmu someone send me a link to no1drug s music
-1	9721 perfect crossover 27qhd 6ms d dvi qhd 2560 x 1440 lg s ips computor monitor http t co zbpilnbhn7 http t co dnpxuhrd5u
-1	rt swbts the first 35 swbts students to join us for crossover and sbc15 get to go for free http t co pehnjbydx2
-1	rt squeemonster je_souhaite actually you don t even have to watch twd to read it altho you d appreciate more if u did here it is http
-1	sfxmagazine ah is that from the power rangers star wars crossover reboot get kateesackhoff involved amp it could be awesome justsaying
-1	great crossover via clint porter http t co ym1gssp4yb https t co 4a2mpm60v2
-1	rt marc_raimondi marvel s plan is for three other netflix shows and a defenders crossover but to not put out daredevil season two next y
-1	rt thefunnyvine the greatest crossover of all time http t co r0pmc3q3yw
-1	beal that was filthy and not in a crossover type way
-1	rt sportscenter the fans have spoken steph curry s crossover against chris paul is scnumber1 with 53 of the vote http t co mmlkzwn
-1	crossover 2019 team up huge over hype 9th grade team in the 1st half defensive pressure is giving hype problems
-1	rt thefunnyvine the greatest crossover of all time http t co r0pmc3q3yw
-1	apocalypticses kamuisorey wait this crossover ship is it mikleo ludger
-1	apocalypticses ah that yeah but it s not like everyone shits on him idec if he ships crossover ships or anything but he should
-1	rt the_black_elite steph curry with the killer crossover gta nba wasted lmfao https t co nhgfxlchuo
-1	rt snugglingimouto this crossover tho atom1794 http t co zesgtmvo9b
-1	rt destieluk squeemonster i just finished that spn twd crossover d c and it was so good daryl with cas and the winchester s __
-1	fiat 500x review http t co 4qlxo3jevk http t co xf5xs7takt
-1	let the bullet from the 9 crossover like rondo
-1	good lord john wall s crossover is dirtyy
-1	john wall s crossover is filthy
-1	rt yungpineapple_ son are you smoking weed lifts up pant leg to reveal huf socks well you re grounded shut the fuck up mom
-1	rt marc_raimondi marvel s plan is for three other netflix shows and a defenders crossover but to not put out daredevil season two next y
-1	john wall crossover
-1	enter the volvocarsus twilightdrivetodreamsweepstakes for a chance to win a volvo xc60 crossover amp other prizes http t co p6vwq7ssf6
-1	rt marc_raimondi marvel s plan is for three other netflix shows and a defenders crossover but to not put out daredevil season two next y
-1	enter the volvocarsus twilightdrivetodreamsweepstakes for a chance to win a volvo xc60 crossover amp other prizes http t co bztzkvie2m
-1	rt drake h town
-1	rt calimelily when you beat you high score in orbit run http t co bswho83fxp
-1	marvel s plan is for three other netflix shows and a defenders crossover but to not put out daredevil season two next year is a mistake
-1	rt yungpineapple_ hey grandma have you met my friend d no d who deez nuts ha goteem
-1	rt glennhowerton you want a crossover workaholics sunnyfxx http t co l5nm8fuwjw
-1	rt calimelily when you get past level 20 in orbit run http t co xwkxzlxt0c
-1	rt raine4ver the truth http t co panhsdfvwi
-1	10th grade wins 56 53 over crossover elite
-1	supernatural dexter crossover miami sam and dean pick up a trail of missing persons in miami fl unable to http t co xtlhvf5fcm
-1	rt hoopershooter tim hardaway was dirty nba oldschool t_hardjr you got bring back that crossover http t co q7zvksgxok
-1	enter the volvocarsus twilightdrivetodreamsweepstakes for a chance to win a volvo xc60 crossover amp other prizes http t co zkhg7mc573
-1	am i making a silly crossover video oh yeah is it hurting my hand only a little
-1	_vinnyf24 he s gonna drop on his slowass crossover
-1	rt locoanime vashthestampede spikespiegel trigun cowboybebop outlawstar anime crossover http t co 1jkpusmhso
-1	gbennett90 my big fat greenwich gypsy wedding basically those dresses but in lilly prints logical step after target crossover amirite
-1	http t co qkqec5si2y read vote amp comment love you all tvd supernatural wattpad crossover florenceandthemachine damonsalvatore
-1	rt sportscenter the fans have spoken steph curry s crossover against chris paul is scnumber1 with 53 of the vote http t co mmlkzwn
-1	rt femaletextmsg put god first and you ll never be last
-1	tambourine i am watching musketeers and wondering about a daredevil musketeers crossover
-1	rt keegansheridan millennials are coming of age and their economic impact will be breathtaking via foodnavigatorus http t co id4cdwf
-1	rt usattire_ these college football catches are crazy the best since 2000 check them out vids included http t co qrwz0esxeg http
-1	1st meeting of spiderman amp superman 76 amp 1st dccomics amp marvel crossover marvelvsdc dcvsmarvel marvelfactoids http t co h6onwnp4nl
-1	rt ifindbestdeals rt thug life fav dream order here gt http t co zlzjeakwwb http t co joowikszbq
-1	rt espnnba kyle lowry goes in for the bucket and john wall denies him access it s getting rowdy in toronto video http t co hwedf5u
-1	rt baseballpiayers how to hit 1 step in box 2 grab crotch 3 bat tap each side of plate 4 stare down pitcher 5 smash first pitch fast
-1	cross examination ritual snackrifice thrash crossover 2014 submitted by the_munchies link comment http t co q3btxsc55v
-1	rt lifted_pickups need this jeep http t co kdqrq9npuw
-1	rt lifted_pickups white jeeps gt gt gt http t co kmtvnv9ajg
-1	i just discovered a burning need to do a rwby x bh6 crossover do they sell creams for that
-1	rt allhailtaron crying http t co dwmlzx2mnu
-1	basketball crossover drive in layup jump shot techniques basketball drills http t co hugsq6uwfr http t co 3cckrtuiew
-1	hoping for some eventual daredevil punisher crossover specials like dc does for their series even more so http t co hmrvwsfqon
-1	rt sportscenter what was best steph curry play this season handles amp step back 3 cp3 crossover amp j vote w scnumber1 watch midnigh
-1	pghultimate pycu just won their pool at born to dive crossover game at 3pm
-1	tim hardaway was dirty nba oldschool t_hardjr you got bring back that crossover http t co q7zvksgxok
-1	rt _cartographer working on a starseed pilgrim bomberman crossover in pico8 for ldjam lexaloffle droqen screenshotsaturday http
-1	suns out let s hit a patio soludos leather crossover sandals she comes in white too soludos https t co oegqvq7tez
-1	i will always check out wwe naruto crossover slashfic
-1	7th grade beats erie crossover by 19 representpgh
-1	rt teamrunner4life track is the most under appreciated sport on the planet showsomelove runnerprobs
-1	rt tmznews2015 childhood actors who have grown up to be bombshells http t co arqqpjtz36 http t co ikt9dj1a4n
-1	check out nwt rare 24k vitamin a crossover bandeau monokini s 6 vitamina monokini http t co hpdzmnpkmn via ebay
-1	lt 3 would love to win lt 3 fiat usa the all new 2016 fiat 500x crossover lt lt lt http t co iffu5iofoc
-1	isn t my new hung up blazer crossover bag cher top heart beat city adorable check out my suite http t co joz9nyrikd
-1	lol this was the crossover of the summer https t co khniglynka
-1	rt sportscenter the fans have spoken steph curry s crossover against chris paul is scnumber1 with 53 of the vote http t co mmlkzwn
-1	rt bullsnationnet aaron brooks with the fatal crossover https t co hdh4nnsoto
-1	rt curvables westbrook shouldve tested his power levels first https t co jazywhrjky
-1	rt sportscenter the fans have spoken steph curry s crossover against chris paul is scnumber1 with 53 of the vote http t co mmlkzwn
-1	rt glennhowerton you want a crossover workaholics sunnyfxx http t co l5nm8fuwjw
-1	a crossover tweet from oah2015 relates to our 39 amp today s task force report benjaminepark
-1	flutist_kim all i m gonna say is i luved sam s outfit if a crossover 2 blacksails is ever possible he would fit in damn hot outlander
-1	not a big crossover guy but i do keep thinking how much i d love to see a batman action co written b s crossover by gregpak amp ssnyder1835
-1	so 4 point tory lead in first of tonight s polls crossover or outlier your guess is as good as mine ge2015
-1	check out tory burch top blouse sleeveless multi color crossover career casual sz 8 silk blouse http t co ykz7bksxwi via ebay
-1	i found a folder full of scanned panels from when i was going tried to blog read dc s 1988 millennium crossover event
-1	rt sportscenter the fans have spoken steph curry s crossover against chris paul is scnumber1 with 53 of the vote http t co mmlkzwn
-1	undefeated now crossover match
-1	rt sportscenter the fans have spoken steph curry s crossover against chris paul is scnumber1 with 53 of the vote http t co mmlkzwn
-1	rt sportscenter what was best steph curry play this season handles amp step back 3 cp3 crossover amp j vote w scnumber1 watch midnigh
-1	rt wireduk archie comics just keep getting weirder the next crossover is with sharknado yes that sharknado http t co rsefluqjjw by
-1	rt sportscenter the fans have spoken steph curry s crossover against chris paul is scnumber1 with 53 of the vote http t co mmlkzwn
-1	on our crossover route one of the dogs out had adorable puppies some are needing good home they https t co glbsuvclpq
-1	rt thetumblrposts crossover episodes on disney channel were the best http t co e5in8x24uy
-1	rt thefunnyvine the greatest crossover of all time http t co r0pmc3q3yw
-1	rt hcthebarber on that crossover movement luiscoronel281 luiscoronelmusic delempire empireproductionsinc https t co u2czkchymz
-1	rt thefunnyvine the greatest crossover of all time http t co r0pmc3q3yw
-1	hoover_dam terebifunhouse michaeltoole hazukari 2 2 with a lot of help from the alberta anime con scene lots of staff crossover
-1	http t co znajccr135 4611 new puma 15288 crossover titanium rimless drill mount hot eyeglass frame glass http t co ig5ywxhxf9
-1	enter the volvocarsus twilightdrivetodreamsweepstakes for a chance to win a volvo xc60 crossover amp other prizes http t co bsl9plqiap
-1	rt thefunnyvine the greatest crossover of all time http t co r0pmc3q3yw
-1	rt sportscenter the fans have spoken steph curry s crossover against chris paul is scnumber1 with 53 of the vote http t co mmlkzwn
-1	enter the volvocarsus twilightdrivetodreamsweepstakes for a chance to win a volvo xc60 crossover amp other prizes http t co 4qn2edvy9m
-1	buss_19 i just don t think it ll be a full cast meets cast crossover
-1	raidoukuzunogf that 2v2 shonen jump crossover game that came out last year it s finally coming out in the west this summer
-1	honestly i would have never thought of this crossover http t co anuqvszmq2
-1	rt markhoppus debbyryan it s true i m a crossover hit
-1	but wheres the better call saul daredevil crossover episode
-1	rt bronyrebellionx bronies you know it s hell with steven universe and uncle grandpa as a crossover worst crossover ever mlpseason5 h
-1	rt desirascals wonder if there will be a towie desirascals tv crossover jasminwalia everyone loved meeting u theonlywayisdesi http
-1	fiatusa would love to win the all new 2016 fiat 500x crossover http t co xuhuwo353v
-1	the best starwars archer crossover hjbenjamin aishatyler starwars http t co mggfnvvfdv
-1	alekbeal12 that s possibly the most aggravating thing i ve heard fuck uncle grand pa his bitch ass ain t worth doing a crossover with
-1	vda experience con moveyourlife top weekend crossover http t co ojopyn4olm
-1	rt sportscenter the fans have spoken steph curry s crossover against chris paul is scnumber1 with 53 of the vote http t co mmlkzwn
-1	rt sportscenter the fans have spoken steph curry s crossover against chris paul is scnumber1 with 53 of the vote http t co mmlkzwn
-1	sickest crossover ever https t co 0jvv7z2b4e
-1	thespoonyone or adapt that superman batman crossover cartoon world s finest
-1	rt njsportsscene derryck thornton drops 1 ranked ben simmons with a killer crossover https t co r7eeqx3aub
-1	perfect crossover 27qhd 6ms d dvi qhd 2560 x 1440 lg s ips computor monitor 7482 http t co ivvluixegh http t co srwguihsko
-1	rt sportscenter the fans have spoken steph curry s crossover against chris paul is scnumber1 with 53 of the vote http t co mmlkzwn
-1	metal gear transformers crossover let s get on this
-1	metal gear transformers crossover let s get on this
-1	enter the volvocarsus twilightdrivetodreamsweepstakes for a chance to win a volvo xc60 crossover amp other prizes http t co zifm9yanr4
-1	2016 mercedes slc maserati mc12 versione corse subaru exiga crossover 7 car news headlines related articles http t co udczreedb7
-1	rt njsportsscene derryck thornton drops 1 ranked ben simmons with a killer crossover https t co r7eeqx3aub
-1	rt yg504 amir johnson did a behind the back crossover
-1	i had a weird harry potter 1d crossover dream
-1	13 6 over columbia ending with scooter from staples to mohler good game chsvft get wwp south in crossover now
-1	amir johnson did a behind the back crossover
-1	rt bronyrebellionx bronies you know it s hell with steven universe and uncle grandpa as a crossover worst crossover ever mlpseason5 h
-1	amir with a crossover
-1	amir wit the crossover
-1	rt sportscenter the fans have spoken steph curry s crossover against chris paul is scnumber1 with 53 of the vote http t co mmlkzwn
-1	you miss out if you don t go to crossover ministries join us next saturday at 10am behind the https t co qvn4adnnnh
-1	buss_19 i doubt they all crossover they said the guardians won t be going to earth in the foreseeable future
-1	rt fiatusa get to know italian style the all new 2016 fiat 500x crossover http t co yuobexthac
-1	jeffreydegraw13 no last week s crossover with felicity and ray lol
-1	enter the volvocarsus twilightdrivetodreamsweepstakes for a chance to win a volvo xc60 crossover amp other prizes http t co gjxoqjqkyh
-1	rt sportscenter the fans have spoken steph curry s crossover against chris paul is scnumber1 with 53 of the vote http t co mmlkzwn
-1	saw bike rider galaxy dx 3 on japanese eshop it had pri para gopri and miku crossover http t co outb5g9tpg
-1	titleist 913 d3 driver 5 reasons to buy a crossover vehicle5y http t co bhmwi62gyu
-1	tybee island crossover wedding location north beach tybee island https t co nyz5hqpnfm
-1	rt sportscenter the fans have spoken steph curry s crossover against chris paul is scnumber1 with 53 of the vote http t co mmlkzwn
-1	i added a video to a youtube playlist http t co opzezwzjxi crossover couples little game
-1	rt hcthebarber on that crossover movement luiscoronel281 luiscoronelmusic delempire empireproductionsinc https t co u2czkchymz
-1	game of thrones vs frozen crossover ex post r gameofthrones http t co cknxr6aiiv
-1	cool wee star wars winnie the pooh crossover picture just getting framed to go up in baby hay s room https t co 0iqmiinjfy
-1	derozan got paul with that crossover
-1	rt bronyrebellionx bronies you know it s hell with steven universe and uncle grandpa as a crossover worst crossover ever mlpseason5 h
-1	gymclassboners does that mean hannah montana shrek and lizzy mcguire crossover
-1	derozan got me with that crossover
-1	that was a rude crossover but no finish
-1	bro that was a dirty crossover
-1	rt bronyrebellionx bronies you know it s hell with steven universe and uncle grandpa as a crossover worst crossover ever mlpseason5 h
-1	rt sportscenter the fans have spoken steph curry s crossover against chris paul is scnumber1 with 53 of the vote http t co mmlkzwn
-1	i added a video to a youtube playlist http t co zhq5kiscfy crossover clarke katniss beth and stiles elastic heart
-1	ohioplayer1980 i hear u but if keep that crossover game strong a guy wont complain marie calendar burger king restaurant in rotation
-1	rt bronyrebellionx bronies you know it s hell with steven universe and uncle grandpa as a crossover worst crossover ever mlpseason5 h
