-1	nickwiger having seduced him she pulls a stake out from under the covers die hard dracula the audience groans and so does he
-1	minsthins item 185786 die hard dracula dvd 2004 brand new free us ship http t co huul6ym2eg
-1	minsthins item 185786 die hard dracula dvd 2004 brand new free us ship http t co spcuguzyil
-1	one year my friend threw a dress up themed bday party it was die hard vs dracula i had to work that night but came straight over
-1	die hard dracula movie trailer watch movie free http t co 0ozqslcjbs https t co p09bs3qi3j via youtubejjjunkkk wwisshess ccommee
-1	die hard dracula review https t co y2oxmad50j via youtubegggettt ooouutttt bbrrucccee wwwilllisss pprrredicctedd tttoo bbbeee
-1	rt brendanekstrom chitty chitty bang dracula die hard 2 die hard with a dracula changelastwordoffilmtodracula how did this become a
-1	rt hasama36 minsthins item 179327 die hard dracula dvd 2004 brand new free us ship http t co lygsrjcot3
