-1	it s difficult for city dwellers to relate to our food as what it is plants amp animals that exist outside the supermarket foodfight nwnws
-1	very interesting food panel at nwnws foodfight conference glad most of these panelists brought their a game http t co daqx7ynkid
-1	nwnws foodfight nah that doesn t work nm
-1	rt nwnws having fun at foodfight conference over at multnomahu the smell of bacon is in th air and we re talking about gmos
-1	having fun at foodfight conference over at multnomahu the smell of bacon is in th air and we re talking about gmos
-1	rt johnluce listening to a panel on farms food and the common good at nwnws s foodfight conference oh and for some reason they let
-1	listening to a panel on farms food and the common good at nwnws s foodfight conference oh and for some reason they let me mc
-1	rt andeezomerman at the foodfight conference at mult u our friend beyth moderating https t co 2fjgttqsku
-1	rt andeezomerman at the foodfight conference at mult u our friend beyth moderating https t co 2fjgttqsku
-1	at the foodfight conference at mult u our friend beyth moderating https t co 2fjgttqsku
-1	who will get the last piece sushi foodfight http t co l8xlrkszvx
-1	halifaxscb bexsaunders7 foodfight just saying buddys lol http t co cusshqnjsz
-1	rt foodfightchi so honored 2 have chefsarahjayne join us for foodfight learn about her plans for monteverde opening this summer http
-1	district 16 from what i gather through social media is campaigning like champs steak amp eggs w libs amp kitchen party w pcs peipoli foodfight
-1	foodfight had me like http t co iugqsqiloh
-1	you took the french fries catfightoverfood foodfight wafflehouse https t co eyqwf8tdp4
-1	foodfight matarslagur
-1	skylander saturday fancy winning a new skylander then come into store grab a sheet and colour in foodfight winner announced tomorrow
-1	halifaxscb bexsaunders7 mmmmm good foodfight http t co livbmhe6yr
-1	halifaxscb bexsaunders7 lady s first princessbex foodfight
-1	halifaxscb bexsaunders7 oh i want it foodfight
-1	konah_dyer96 jeromevidgen just tell them no if not then we all know where we will be having breakfast on friday foodfight
-1	bexsaunders7 halifaxscb you started it lol foodfight http t co wsvvmb4vtd
-1	i ve been up a while so as far as i m concerned i can class this as brunch nomnom foodfight halifaxscb coikle http t co djuah5eirc
-1	so purple its unreal instafood foodstagram foodporn foodfight https t co zphb68skga
-1	the rise and fall of the computer animated foodfight http t co rqyolpqvxs
-1	nudefightclub presents foodfight http t co r1kvbl4qix hardcore sex adult xxx
-1	alex_navarro caseymalone trashnightvideo steve guttenberg as paul simon in foodfight
-1	matt_volk caseymalone trashnightvideo oh my god he s the guy who wanted to make the sci fi action tetris movie http t co jp2zxevebk
-1	alex_navarro caseymalone trashnightvideo want to know the story behind the movie it is pretty good http t co h1lvxrvpjn
-1	rt nwnws are you coming to food fight a civil dialogue over our daily bread conference tomorrow at multnomahu http t co ncbzcseqc
-1	ghibliblog man i wanna see the original version of foodfight that allegedly got stolen sometimes you just have to wonder even if it bad
-1	my left arm smells like bleu cheese and the rest of me smells like cinnamon foodfight
-1	foodfight has a higher rating than paul blart 2
-1	rt trashnightvideo this tuesday steel yourself and submit to cgi animated trainwreck foodfight https t co so4jy6oftl https t co u
-1	i panera d too hard tonight my baguette didn t go down without a fight as you can see by my battle wound foodfight http t co xgp9iccy4m
-1	rt trashnightvideo this tuesday steel yourself and submit to cgi animated trainwreck foodfight https t co so4jy6oftl https t co u
-1	rt trashnightvideo this tuesday steel yourself and submit to cgi animated trainwreck foodfight https t co so4jy6oftl https t co u
-1	rt trashnightvideo this tuesday steel yourself and submit to cgi animated trainwreck foodfight https t co so4jy6oftl https t co u
-1	this tuesday steel yourself and submit to cgi animated trainwreck foodfight https t co so4jy6oftl https t co u5h4xpaujo
-1	nudefightclub presents foodfight http t co r1kvbl4qix hardcore sex adult xxx
-1	rt nwnws are you coming to food fight a civil dialogue over our daily bread conference tomorrow at multnomahu http t co ncbzcseqc
-1	two more workshop descriptions for our foodfight conference tomorrow at multnomahu http t co bru11tl6rl
-1	rt nwnws what are you doing saturday come have a foodfight with us http t co gpu8qcd9jp rt to your foodie friends
-1	are you coming to food fight a civil dialogue over our daily bread conference tomorrow at multnomahu http t co ncbzcseqcj foodfight
-1	walmart gets beaten in a foodfight with supermarkets http t co isigw5nxt9
-1	foodfight review http t co ltiexc8gng
-1	mrkmullin fyi a mssmarauders hr of senior students brought in almost 600 food items boom foodfight
-1	rt rosecityforum hey nwnws friends beth will be on the show at 12pm and 6pm to talk about foodfight tune in or log in to kkpz1330
-1	are food fights still a thing in school foodfight
-1	rt foodfightchi so honored 2 have chefsarahjayne join us for foodfight learn about her plans for monteverde opening this summer http
-1	rt chef_ilona we need some media coverage on the food offerings at the various peipoli election events who bbqs the best wieners foodf
-1	so honored 2 have chefsarahjayne join us for foodfight learn about her plans for monteverde opening this summer http t co jp8kwkbxe4
-1	get your tickets for tomorrow s foodfight conference at multnomahu https t co kc7ixm86pv https t co vypgofafwu
-1	foodfight conference tomorrow so some workshop previews today here s the first two http t co 5pcmbzxhtv
-1	hey nwnws friends beth will be on the show at 12pm and 6pm to talk about foodfight tune in or log in to kkpz1330
-1	chef_ilona cbcpei peiguardian some comic relief for an intense election peipoli foodfight bestweiners coldplates
-1	we need some media coverage on the food offerings at the various peipoli election events who bbqs the best wieners foodfight imavailable
-1	i liked a youtube video http t co dkeixefeew foodfight jontron
-1	tomfooleryat34 beatstreetmcr can you be ott at foodfight
-1	nudefightclub presents foodfight http t co saklgbghxx pornstars hardcore fetish nsfw
-1	gunge and splosh sessions available seven days a week mutual gunge sessions also available call 07938786274 for info foodfight
-1	beautiful isn t it instafood foodstagram foodporn foodfight https t co gksvts2xhi
-1	nudefightclub presents foodfight http t co r4n4zvmrrb pornstars hardcore fetish nsfw
-1	nudefightclub presents foodfight http t co geodyzoqr0 pornstars hardcore fetish nsfw
-1	misssaiya it s ehm my and my friend had a foodfight yes gt lt
-1	i liked a youtube video http t co 62xowek3b8 foodfight jontron
-1	he played cake anf threw two cakes in the audiance now theres a cake fight annnd threw a veggie tray this is great foodfight
-1	rt nwnws what are you doing saturday come have a foodfight with us http t co gpu8qcd9jp rt to your foodie friends
-1	rt johnluce pauljpastor foodfight on saturday http t co smrsiacsi1
-1	rt stxfoodandwine dr bbq ray lampe fb chef dean spinks amp chef sam choy competed in foodfight stxfwe stcroix https t co m3pnjkvadr
-1	camerondallas whats a video on yt with u without a foodfight its a dallas thing ily cameron famchallenge
-1	pauljpastor foodfight on saturday http t co smrsiacsi1
-1	alright who of my pdx friends is coming to this on saturday http t co smrsiacsi1 foodfight
-1	watch foodfuapp battle asparagus go down https t co kctfsg5drc foodie foodfight asparagus gamenight cooking http t co xoexvd1ifz
-1	linksassy i m sorry _ still not sorry about foodfight or space jam tho
-1	rt nwnws what are you doing saturday come have a foodfight with us http t co gpu8qcd9jp rt to your foodie friends
-1	rt gayboy2006 groovyryou i watched all of foodfight before
-1	groovyryou i watched all of foodfight before
-1	what are you doing saturday come have a foodfight with us http t co gpu8qcd9jp rt to your foodie friends
-1	foodfight 2012 full youtube http t co coxzjlmylc
-1	claudettegabbs holy shit yep here s a better look sharks whiteseabass spearfishing sharktax foodfight http t co 6mi5p8spe1
-1	dr bbq ray lampe fb chef dean spinks amp chef sam choy competed in foodfight stxfwe stcroix https t co m3pnjkvadr
-1	the cold doesn t bother these sisters anna amp elsa wfmyfoodfight 5 30 6 30 come take pics http t co xm7dodvcdi http t co tqrqkhe6wt
-1	the cold doesn t bother these sisters anna amp elsa wfmyfoodfight 5 30 6 30 come take pics http t co 0ss9lxqsyk http t co byugxevz1o
-1	rt dancintina foodfight lawrence kasanoff http t co z1q9146bvn kids amp family nowplaying kids family top movies to rent
-1	rt dancintina foodfight lawrence kasanoff http t co z1q9146bvn kids amp family nowplaying kids family top movies to rent
-1	foodfight lawrence kasanoff http t co z1q9146bvn kids amp family nowplaying kids family top movies to rent
-1	thursday throwdown tahina vs baba ghanoush which one reigns supreme foodfight https t co bjizts6zoe
-1	rt foodnetwork_uk tacothursday foodfight rt for roasted tomato and pepper chicken tacos fav for fiesta prawn tacos ad http t co stb
-1	had a fucking brill day today thought it would be well shit but it was good laughed my head of at lunch foodfight x http t co akv5cnidln
-1	which side are you on gusfriedchicken vs lucysfriedchick friedgreentomatoes foodfight http t co dui0mqnr5x acfood atx austineats
-1	tacothursday foodfight rt for roasted tomato and pepper chicken tacos fav for fiesta prawn tacos ad http t co stbbkxkrrf
-1	rt foodfightyeg only 9 days away till our next edmonton foodfight swichfood vs toastkitchen place your bets now yegfood yeg http
-1	rt ozmudbone foodfight didnt get hit once just sayin dominate the snake paintballskillz
-1	rt ozmudbone foodfight didnt get hit once just sayin dominate the snake paintballskillz
-1	rt ozmudbone foodfight didnt get hit once just sayin dominate the snake paintballskillz
-1	foodfight didnt get hit once just sayin dominate the snake paintballskillz
-1	foodfight how many potato chips does it take to get your daily allotment of vitamin c how about broccoli http t co ejar2nqdv2
-1	mt foodfightyeg only 9 days away till our next edmonton foodfight swichfood vs toastkitchen yegfood yeg http t co glyowsxznj
-1	rt foodfightyeg only 9 days away till our next edmonton foodfight swichfood vs toastkitchen place your bets now yegfood yeg http
-1	batterysama you re watching doc in foodfight while i m watching marty on letterman
-1	nudefightclub presents foodfight http t co r4vwhozog7 hardcore sex adult xxx
-1	rt foodfightyeg only 9 days away till our next edmonton foodfight swichfood vs toastkitchen place your bets now yegfood yeg http
-1	camerondallas loved the video cam it turned out to a foodfight 20daysofdallas http t co lecwyimsnk
-1	nudefightclub presents foodfight http t co r1kvbl4qix hardcore sex adult xxx
-1	oh god i mentioned foodfight the movie
-1	rt bna2292 ltmelvin it was a pleasure meeting you earlier this morning i hope teamjulie wins wfmy foodfight together we can end hu
-1	ltmelvin it was a pleasure meeting you earlier this morning i hope teamjulie wins wfmy foodfight together we can end hunger
-1	cinemasins you should do one for foodfight that would be the greatest sins video ever
-1	the new york times article reported that foodfight has been seized upon by internet purveyors of bad cinema i wonder if there s ev
-1	nudefightclub presents foodfight http t co rarjb1rgia hardcore sex adult xxx
-1	http t co ogmpadweaj foodfight wiki page sells it for me what a sordid tale statistics posted by shalabi
-1	i ve always wanted to be in a foodfight
-1	nudefightclub presents foodfight http t co xg4geqp9mn pornstars hardcore fetish nsfw
-1	rt foodfightyeg only 9 days away till our next edmonton foodfight swichfood vs toastkitchen place your bets now yegfood yeg http
-1	rt lancerietwit grill chicken salad instafood foodstagram foodporn foodfight https t co r4yself4ft
-1	grill chicken salad instafood foodstagram foodporn foodfight https t co r4yself4ft
-1	rt foodfightyeg only 9 days away till our next edmonton foodfight swichfood vs toastkitchen place your bets now yegfood yeg http
-1	nudefightclub presents foodfight http t co uenjgkmrdp pornstars hardcore fetish nsfw
-1	rt foodfightyeg only 9 days away till our next edmonton foodfight swichfood vs toastkitchen place your bets now yegfood yeg http
-1	rt foodfightyeg only 9 days away till our next edmonton foodfight swichfood vs toastkitchen place your bets now yegfood yeg http
-1	only 9 days away till our next edmonton foodfight swichfood vs toastkitchen place your bets now yegfood yeg http t co u6xi9y1qpw
-1	photo photo by anna_nguyentour with sputniknova photo published in foodfight zine distributed by http t co tmzpt01mh0
-1	photo by anna_nguyentour with sputniknova photo published in foodfight zine distributed by https t co uud4d57z2d
-1	hotwingschallenge turned into a foodfight
-1	when did freddy krueger become a potato chip important foodfight questions
-1	nudefightclub presents foodfight http t co ynfqjwalcd hardcore sex adult xxx
-1	i ve learnt today to never go to sonic with a group of people it will turn nasty foodfight
-1	ateamhotwings 20daysofdallas awesome video go watch it you won t regret it https t co 1wykbucudm foodfight hahah
-1	where the dead go to die or foodfight which is worse
-1	rt 21westcreative chefs sam choy dean spinks and drbbq are here let the games begin stxfwe foodfight foodie http t co 8fdkzjzg
-1	chefs sam choy dean spinks and drbbq are here let the games begin stxfwe foodfight foodie http t co 8fdkzjzgsm
-1	how about them plating i playing with food what s on your plate foodfight foodfun foodie https t co i9vvhadz9w
-1	rt xklllc how to make a campus connection http t co e0vevo9ceg byob broadband connectivity foodfight xklllc
-1	chefs drbbq sam choy and dean spinks will love this mobile pantry smells amazing stxfwe foodfight http t co yc482uaqfq
-1	chefs drbbq sam choy and dean spinks will love this mobile pantry smells amazing stxfwe foodfight http t co rhkipdfxlc
-1	if you could smell how delicious the beach smells with all these fresh and organic veggies stxfwe foodfight
-1	if you could smell how delicious the beach smells with all these fresh and organic veggies stxfwe foodfight
-1	foodfight is a leprocy filled pile of super electrified shitty dick aids coated in a layer of piss flavoured https t co g4ukpy6ome
-1	rt icemoonpromo_yt mikekeepstrong it s on biatch make sure to like comment share and subscribe foodfight food youtube http t
-1	rt stxfoodandwine today at carambolabeach is foodfight come for the chef competition stay for dinner share photos with stxfwe http
-1	rt xklllc how to make a campus connection http t co e0vevo9ceg byob broadband connectivity foodfight xklllc
-1	rt xklllc how to make a campus connection http t co e0vevo9ceg byob broadband connectivity foodfight xklllc
-1	rt xklllc how to make a campus connection http t co e0vevo9ceg byob broadband connectivity foodfight xklllc
-1	rt xklllc how to make a campus connection http t co e0vevo9ceg byob broadband connectivity foodfight xklllc
-1	rt xklllc how to make a campus connection http t co e0vevo9ceg byob broadband connectivity foodfight xklllc
-1	rt xklllc how to make a campus connection http t co e0vevo9ceg byob broadband connectivity foodfight xklllc
-1	rt xklllc how to make a campus connection http t co e0vevo9ceg byob broadband connectivity foodfight xklllc
-1	rt xklllc how to make a campus connection http t co e0vevo9ceg byob broadband connectivity foodfight xklllc
-1	rt xklllc how to make a campus connection http t co e0vevo9ceg byob broadband connectivity foodfight xklllc
-1	rt xklllc how to make a campus connection http t co e0vevo9ceg byob broadband connectivity foodfight xklllc
-1	rt xklllc how to make a campus connection http t co e0vevo9ceg byob broadband connectivity foodfight xklllc
-1	how to make a campus connection http t co e0vevo9ceg byob broadband connectivity foodfight xklllc
-1	does it pay to buy organic food 50 better according to studies article on the fb page quilton foodfight https t co en63c7rthr
-1	rt stxfoodandwine today at carambolabeach is foodfight come for the chef competition stay for dinner share photos with stxfwe http
-1	there are two types of people in the world rt for french fries or favorite if you prefer potato wedges foodfight http t co z4kjfj5483
-1	today at carambolabeach is foodfight come for the chef competition stay for dinner share photos with stxfwe http t co 7ih9qyx5hz
-1	one of my favorite episodes of one of my new favorite podcasts http t co 06qgfltfq8
-1	traceymccain how long is smith s step team staying out at harris teeter i want to learn how to do that foodfight teamgrant wfmy
-1	mikekeepstrong it s on biatch make sure to like comment share and subscribe foodfight food youtube http t co alqdiw3sau
-1	rt tsushopperblog link removed it s on biatch make sure to like comment share and subscribe foodfight food youtube link re
-1	link removed it s on biatch make sure to like comment share and subscribe foodfight food youtube link removed
-1	it s on biatch make sure to like comment share and subscribe foodfight food youtube http t co bcvweibqsy
-1	foodfight review http t co mno5etvo06
-1	good wednesday morning it s hump day and day one of our 2015 wfmy foodfight we need your help collecting food for families in need
-1	starpuncher foodfight
-1	rt chiefkeef lilflashgg foodfight mixtape prod by me and the ggp
-1	linka13 oh christ tbh i thought of one for foodfight control of any object as long as it s in a supermarket
-1	foodfight 2012 full movie http t co oovrcccljy
-1	rt joycepring tapos soda shower instead of beer shower tapes may free milk shakes because why not rt bastisantos joycepring puro foodf
-1	rt joycepring tapos soda shower instead of beer shower tapes may free milk shakes because why not rt bastisantos joycepring puro foodf
-1	tapos soda shower instead of beer shower tapes may free milk shakes because why not rt bastisantos joycepring puro foodfight
-1	joycepring puro foodfight
-1	it took me way too many watches of the foodfight episode of jontronshow to realize that brentalfloss was mr clean wowimdumb
-1	fullhouse for our annual nationalgrilledcheesemonth specialedition foodfight trivianight fun trivia games http t co udoxnaapr5
-1	i added a video to a youtube playlist http t co ap951b28kt foodfight trailer
-1	yeah but why are we studying eden lake in film studies when there s way better cinematic masterpieces like birdemic and foodfight
-1	thanks for the follow polumbe remembering classic arcadegames one new follower at a time foodfight atari http t co lucrdensim
-1	insane fight at perkins women gone wild again http t co yxxz5hlhzg foodfight crazyfight brawl
-1	sir billy and foodfight s visual aesthetics come together to furries best part is the deceptively disney sleeve http t co gsaxxjseqd
-1	did you see foodfight judge rickgresh and former contestant on cbsnews this weekend http t co 3anlq9n638
-1	megagliscor foodfight
-1	stupidmontana foodfight
-1	rt foodfightchi love this kmillerlib great collage of yushologan at wgnnews lunchbreak promoting foodfight http t co 9ekn5ih9cw
-1	post hunger games i only died twice foodfight http t co k0unf7zmdp
-1	rt foodfightchi love this kmillerlib great collage of yushologan at wgnnews lunchbreak promoting foodfight http t co 9ekn5ih9cw
-1	love this kmillerlib great collage of yushologan at wgnnews lunchbreak promoting foodfight http t co 9ekn5ih9cw
-1	lotta people gettin suspended lol foodfight
-1	rt mslinch i want to be in robrtmiller s class check out his foodfight tourny using brainpop s gameup http t co ybz2qfbdmh gbl g4
-1	and who doesn t love a foodfight http t co dlexf2iaxe
-1	fcs foodfight logo icesculpture icecarving ice abstract pedestal food cooking for an https t co v9jkdz3dpr
-1	quinoa vs rice preventionmag foodfight gets to the bottom of which grain is greater http t co kyiz5bzlh9 http t co unu8rezl7k
-1	foodfight can t be that bad right people just build up the hype around it right no it s that bad it s fucking terrible
-1	or 2 fire monkeys fire kitchenthug food foodfight girl cacow https t co egzkun5ywv
-1	pt1 my crew is pro kitchenthug foodfight fire girl burn https t co wdhlfxytab
-1	just got attacked by a seagull and almost lost a sandwich foodfight trauma
-1	rt lancerietwit hell s ramen instafood foodstagram foodporn foodfight https t co yaesu8l
-1	rt stxfoodandwine stay for dinner at carambolabeach after foodfight for island buffet tkts still avail drbbq samchoy fbchefdean ht
-1	hell s ramen instafood foodstagram foodporn foodfight https t co yaesu8lyjm
-1	pizzas or burgers which one do you like more rt for burger or favorite if you prefer pizza foodfight http t co mqy3od17f8
-1	rt fabuland_ check out our latest video dragqueen foodfight http t co myaanz3pd7
-1	hope you enjoyed tonight s it all kicks off tomorrow attempted murder foodfight surprise gifts secret kisses and
-1	check out our latest video dragqueen foodfight http t co myaanz3pd7
-1	nerdbotmk2 i never knew it was made by the same guys who made foodfight and suddenly everything makes sense
-1	rt bazking8 7daysuaelife 7daysuae would be amazing if restaurants had different sections for different food personalities foodfight
-1	bradleysmith38 motomatters sofaracer ssvives exactly because it s business class all round party bags and cocktail sausages foodfight
-1	7daysuaelife 7daysuae would be amazing if restaurants had different sections for different food personalities foodfight
-1	talking about this on rosecityforum friday foodfight https t co hxtq9xrsyk
-1	foodfight club midnight collgemovies
-1	our food fight conference at multnomahu is less than a week away get your tickets now https t co 6v0uetsjm4 foodfight
-1	romantically watching foodfight
-1	i liked a youtube video http t co xtarzg2ays foodfight jontron
-1	there s an ape in my uniform instead of a violent face eating attack this leads to a foodfight realism wtbm
-1	_xxoxxoxxx why not ill get her to throw the cream cakes at you foodfight
-1	rt stxfoodandwine stay for dinner at carambolabeach after foodfight for island buffet tkts still avail drbbq samchoy fbchefdean ht
-1	philipnolan1 colm_keaveney tomdoorley only one way to settle it lads foodfight http t co nokdxxrpsj
-1	foodfight commentary http t co iyt7zfwo8r via youtube
-1	i liked a youtube video http t co 0baa4jg8jl foodfight matarslagur
-1	i still can t believe foodfight happened
-1	wfmy i am ready to fight to end hunger foodfight this wed and thursday with team grant_gilmore and team julie_luck
-1	unpopularanimatedmovies foodfight 2
-1	rt kmillerlib yusho chef harold jurado makes japanese savory pancake http t co 9obzuai0a4 via wgnnews yushologan foodfightchi scler
-1	i liked a youtube video http t co mdu7ngpz1m foodfight matarslagur
-1	yusho chef harold jurado makes japanese savory pancake http t co 9obzuai0a4 via wgnnews yushologan foodfightchi scleroderma foodfight
-1	for freshmeatmonday we pitted englishmuffin against waffle who will win this foodfight it s not https t co oybzhphmnm
-1	i want to be in robrtmiller s class check out his foodfight tourny using brainpop s gameup http t co ybz2qfbdmh gbl g4c2015 edtech
-1	rt foodfightchi oh me oh my where does the time fly just two more weeks until foodfight make sure to get your tix today http t co
-1	rt thesonicgeek unpopularanimatedmovies foodfight
-1	rt kmillerlib getting ready for wgnnews lunchbreak w yushologan amp foodfightchi scleroderma foodfight wgn dinabairwgn http t co
-1	rt foodfightchi oh me oh my where does the time fly just two more weeks until foodfight make sure to get your tix today http t co
-1	getting ready for wgnnews lunchbreak w yushologan amp foodfightchi scleroderma foodfight wgn dinabairwgn http t co 6yv8xc7bel
-1	rt robrtmiller which species will thrive while others strive to survive a teaser for our foodfight tourny using brainpop s gameup https
-1	is foodfight a fair choice for this unpopularanimatedmovies
-1	unpopularanimatedmovies foodfight
-1	which species will thrive while others strive to survive a teaser for our foodfight tourny using brainpop s gameup https t co nptd041lnl
-1	rt lancerietwit curry chicken salted egg and cucumber instafood foodstagram foodporn foodfight https t co 70hakao
-1	curry chicken salted egg and cucumber instafood foodstagram foodporn foodfight https t co 70hakaokoj
-1	rt amylyall83 more pictures act2cam nedefibs foodfight http t co ookxrgjckx
-1	i just found out that im the reason my school last year had a foodfight
-1	oh my god we re watching cr1tik al watch foodfight where is maddigzlz
-1	i have never seen game of thrones i also never saw titanic but i have seen animal house at least 100 times foodfight
-1	commanderculien in character foodfight livestream
-1	shitty movie night on citta in which everyone is forced to watch foodfight
-1	thejuiceee weren t you taught to not throw your food jeez foodfight
-1	joshua and the promised land makes foodfight look like a five star movie im not even joking right now i wish i was
-1	have you checked out the burgerbrawl interview the good son vs lisa marie chefbattle foodfight fightclub http t co hz4ydxczeo
-1	best foodfight ever http t co yiquwttodf
-1	bring on the canadian foodfight masterchefcanada https t co mpjmr5h5uy
-1	insane fight at perkins women gone wild again http t co y6jdzm10lo foodfight crazyfight brawl
-1	manchester food fight amc manchester foodfight cider fun dj https t co 9n42uour2e
-1	foodfight to cat o nine tails onlyattheivy http t co oamrr82mvg
-1	rt kutilovay minecraft http t co bp7vg5qsh5 foodfight
-1	rt kutilovay minecraft http t co bp7vg5qsh5 foodfight
