-1	oh me oh my where does the time fly just two more weeks until foodfight make sure to get your tix today http t co 5vcn8kfint
-1	good night friday boys rbond08 tomfumarola foodfight terrace westwood tmc didsbury almost aintree http t co xljoniryla
-1	foodfight 2014
-1	holy shit i m feeling some foodfight vibes in this cutscene
-1	rt kutilovay minecraft http t co bp7vg5qsh5 foodfight
-1	i liked a youtube video http t co jnmmebkhva foodfight jontron
-1	rt stxfoodandwine stay for dinner at carambolabeach after foodfight for island buffet tkts still avail drbbq samchoy fbchefdean ht
-1	loving us some pancakes w almond butter and berries foodfight breakfastforlearning fraichefood http t co kknocqupud
-1	endless foodfight http t co nflygid4ww
-1	minecraft http t co bp7vg5qsh5 foodfight
-1	rt stxfoodandwine stay for dinner at carambolabeach after foodfight for island buffet tkts still avail drbbq samchoy fbchefdean ht
-1	i feel so dumb when mrsslaraa brings up tha dumb stuff i did in the past like tha foodfight bak in high skool
-1	foodfight jesus christ i have my old lighting back i finally have light from my favorite lamp
-1	misssaiya it s ehm my and my friend had a foodfight yes gt lt
-1	watching foodfight tonight with my brother jontronshow save us
-1	beckyandfrank it s hard to top foodfight
-1	brockbaker did you and the animators of foodfight have a crossover foodfightjokesareoldandlame
-1	is it normal that sean and i throw the cauliflower ends at each other and all around the house while laughing lovehim foodfight
-1	shokugeki no soma is just foodfight the anime
-1	rt stxfoodandwine stay for dinner at carambolabeach after foodfight for island buffet tkts still avail drbbq samchoy fbchefdean ht
-1	how cool would a sequel to the movie foodfight be
-1	things get tenderizing in tomorrows all new episode mentalcooking eatable foodfight smetana wienerdog love http t co 5cigucumrv
-1	i liked a youtube video from theheadhunter44 http t co bcmxuvz8c8 hunter reviews foodfight
-1	rt stxfoodandwine stay for dinner at carambolabeach after foodfight for island buffet tkts still avail drbbq samchoy fbchefdean ht
-1	stay for dinner at carambolabeach after foodfight for island buffet tkts still avail drbbq samchoy fbchefdean http t co 3z63bkyify
-1	if i ever started a foodfight in india i would call it an act of naan violence
-1	rt amylyall83 brilliant day on film set for act2cam nedefibs foodfight http t co 5cwx2nkcix
-1	first time with becs family foodfight http t co gcqbup2yxq
-1	if you ever feel bad about yourself just remember someone animated foodfight
-1	the 24 7 foodfight stream has been down for too long i need to re watch this art
-1	i added a video to a youtube playlist http t co bt7mdjaod1 foodfight jontron
-1	to think foodfight could have been not as terrible as it ended up i mean the characters actually had facial expressions in that 2002 trailer
-1	foodfight 2 confirmed http t co hqsgo6dhun
-1	foodfight share for chipotle pork tacos like for tortilla soup mexican ad http t co xmqdm9tlle
-1	i liked a youtube video http t co 0ikigyv2pr foodfight jontron
-1	i liked a youtube video http t co 865mrsaceg foodfight jontron
-1	i liked a youtube video http t co r9j0n82x48 foodfight jontron
-1	nudefightclub presents foodfight http t co mzotllavlk pornstars hardcore fetish nsfw
-1	lyzetteg24 if you haven t seen foodfight it doesn t get any worse than that
-1	i have now seen foodfight twice because others must suffer like i once suffered
-1	schmanthonyp foodfight is the worst i ve seen such a fart of a movie
-1	rt iainhemming beautiful sunrise to i hope a mega day thymeandtides we ve a top team in today lucky lucky customers foodfight
-1	remember foodfight
-1	rt ididntdoitdeets so it s just not foodfight in ididntdoit http t co chyk9cjsgu olivia_holt austinnorth55 pipercurda http
-1	misssaiya it s ehm my and my friend had a foodfight yes gt lt
-1	beautiful sunrise to i hope a mega day thymeandtides we ve a top team in today lucky lucky customers foodfight
-1	rt juiceycow a tip to thepeakcalgary don t give out cupcakes to room full of drunks foodfight cream kforrestm thewetsecrets
-1	a tip to thepeakcalgary don t give out cupcakes to room full of drunks foodfight cream kforrestm thewetsecrets
-1	we re watching foodfight and andy has just been nonstop frowning
-1	awdtwit for a moment i thought you meant this http t co v8gqj4x4b4
-1	saying el dos mil doce over and over again so i can talk about how much i love foodfight 2012 in spanish
-1	cassidyquinn loved the sward bit but what was with the bread and bagles foodfight
-1	rerun ididntdoit sat apr 11 11 00 am and 9 30 pm disney foodfight olivia_holt doratheexplorer phineasandferb http t co t7yasbqlig
-1	no joke this movie ended by saying wait he s jewish and then cut to black and that was the ending to foodfight
-1	sneechworth hed hate foodfight hes a world famous choreographer and works with actors regularly
-1	animat505 worst animated film other than foodfight the only few that comes to mind is home on the range digimon the movie or sonic ova
-1	coffee vs tea see how they stack up http t co jycc3skunc foodfight eatclean
-1	foodfight sunshine_goodness r_ex 1240x876 213 6kb jpg hotgirls hotass sexygirl porn boogie__1969 boog http t co fj7u5djg7o
-1	forever jealous of peter pan and the lost boys food from the movie hook foodfight bangarang riprobinwilliams
-1	rt foodnetwork_uk kerrypure foodfight rt for lemon drizzle slices fav for banana bread donalsbakes dairyfree ad http t co 40qand
-1	natface_ get on foodfight it s awful and by that logic it s good
-1	rt foodnetwork_uk kerrypure foodfight rt for lemon drizzle slices fav for banana bread donalsbakes dairyfree ad http t co 40qand
-1	rt ididntdoitdeets so it s just not foodfight in ididntdoit http t co chyk9cjsgu olivia_holt austinnorth55 pipercurda http
-1	kerrypure foodfight rt for lemon drizzle slices fav for banana bread donalsbakes dairyfree ad http t co 40qandl0vy
-1	rt ididntdoitdeets so it s just not foodfight in ididntdoit http t co chyk9cjsgu olivia_holt austinnorth55 pipercurda http
-1	rt ididntdoitdeets so it s just not foodfight in ididntdoit http t co chyk9cjsgu olivia_holt austinnorth55 pipercurda http
-1	rt ididntdoitdeets so it s just not foodfight in ididntdoit http t co chyk9cjsgu olivia_holt austinnorth55 pipercurda http
-1	rt ididntdoitdeets so it s just not foodfight in ididntdoit http t co chyk9cjsgu olivia_holt austinnorth55 pipercurda http
-1	rt ididntdoitdeets so it s just not foodfight in ididntdoit http t co chyk9cjsgu olivia_holt austinnorth55 pipercurda http
-1	here we go foodfight http t co 9nwkggqomm
-1	charliesheen hilaryduff waynebrady why does foodfight exist
-1	mrbathurst yannickbelzil y ont fait des horreurs post russo surtout avec les femmes stinkface match makeover match foodfight pour la belt
-1	foodfight is a form of art
-1	had a great time at ironfork15 congrats chef dale levitski sinemanashville chefsrock foodfight https t co odc0z34un8
-1	rt ididntdoitdeets so it s just not foodfight in ididntdoit http t co chyk9cjsgu olivia_holt austinnorth55 pipercurda http
-1	rt ididntdoitdeets so it s just not foodfight in ididntdoit http t co chyk9cjsgu olivia_holt austinnorth55 pipercurda http
-1	so it s just not foodfight in ididntdoit http t co chyk9cjsgu olivia_holt austinnorth55 pipercurda http t co sqpnhyzara
-1	the gang is all here getourfoodon wafflehouse foodfight http t co xufmsove2x
-1	we play with our food when we try to plan our lives together this summer m_melinda foodfight cuw https t co aguebohjh2
-1	rt ididntdoitdeets so it s just not foodfight in ididntdoit http t co chyk9cjsgu olivia_holt austinnorth55 pipercurda http
-1	rt coreythebutcher it s only 2 weeks away i can t wait to be a judge for this exciting event foodfight chefvschef yegfood http t
