-1	rt krzitg i liked a youtube video from its_grvty http t co 39j9f0t784 i cant do it ghosts
-1	i cant stand ghosts on a bad connection it s impossible to do anything
-1	i liked a youtube video from its_grvty http t co 39j9f0t784 i cant do it ghosts
-1	rt esmthz i liked a youtube video from vyle_rezzii http t co jctdnquys3 i cant do it ghosts
-1	i liked a youtube video from vyle_rezzii http t co jctdnquys3 i cant do it ghosts
-1	i need to edit my header got ideas but cant friggin edit it lol i will learn how to do it 0s
