-1	eleanorhopwood3 gingerwhelan212 mitchell_pullen joe_bond5 shit that looks al lot like him
-1	rt bloodyscotland the mitchell library is absolutely buzzing for ayewrite looking forward to some great events
-1	rt fandombeliefs im gay for shay mitchell
-1	rt opstreetstyles shay mitchell http t co hyhz4doiv6
-1	my dad is an angry driver
-1	what you doing here gingerwhelan212 mitchell_pullen joe_bond5 benstephenson98 http t co ylvezkdh75
-1	rt q107stevemorgan mitchell high school baseball today harrisburg 2 30p amp sf roosevelt 6 00p have both been postponed on korn news ra
-1	rpgsdi shay mitchell est libre
-1	1916 mitchell lewis motor car racine wi why cars go wrong john bates ad http t co xet0dz1bda deals_us http t co iirox7i8sd
-1	think joni mitchell is the only person ever to have had to genius to rhyme figure skater with coffee percolator https t co n2lrhyvq4u
-1	maia mitchell is gorgeous
-1	rt wwiipix the 16 b 25 mitchell bomber crews of the doolittle raid all 80 men volunteered for the top secret mission ww2 http t co o
-1	rt mrdavidboberesq restored b 25 mitchell bombers taking off from uss ranger during 1992 s 50th anniversary of the 1942 doolittle raid h
-1	shay mitchell turns me on not only because of her bomb body but also because of her personality
-1	rt h2fcomedy kel mitchell in the house nacanpl showcasing today at 3 40 iamkelmitchell http t co ed3xw0nl8r
-1	up town funk you up thank you cassi mitchell smith https t co pepk1s2rdi
-1	mr_mitchell_2_u i gotta check that out lol
-1	mitchell high school baseball today harrisburg 2 30p amp sf roosevelt 6 00p have both been postponed on korn news radio 1490 due to rain
-1	rt fandombeliefs im gay for shay mitchell
-1	rt fandombeliefs im gay for shay mitchell
-1	rt pixts maia mitchell for oyster magazine http t co skwptwafka
-1	special order furniture event featuring mitchell gold amp bob williams save 20 30 http t co 3yoswqljbe http t co hreqgqxtrl
-1	rt pixts maia mitchell for oyster magazine http t co skwptwafka
-1	rt perfectships shay mitchell and sasha pieterse http t co qjmbfyuszo
-1	rt ciatto_hannah everyone vote osceolas very own lindsey hall for her winning hit over mitchell for district champs https t co fvh5rsxq
-1	rt fandombeliefs im gay for shay mitchell
-1	rt pixts maia mitchell for oyster magazine http t co skwptwafka
-1	rt pixts maia mitchell for oyster magazine http t co skwptwafka
-1	apparel souvenirs mitchell amp ness losangeles lakers super script purple snapback hat cap nba http t co s0h4v41xhx forsale onsale
-1	rt fandombeliefs im gay for shay mitchell
-1	rt pixts maia mitchell for oyster magazine http t co skwptwafka
-1	mitchell_lund well played today great performance you were man of the match for me hope you get a start next match
-1	jalil_mitchell when is the dance
-1	rt agentsofshield wishing luke mitchell a very happy birthday from marvel s agentsofshield http t co 6cjfkk8gyy
-1	rt pixts maia mitchell for oyster magazine http t co skwptwafka
-1	one of those offsides are going to be given against us and it s going to punish us if we don t sort it out
-1	1 pitch black blu ray pitch black blu ray vin diesel acteur radha mitchell acteur vin diesel http t co iwkecgyes6
-1	rt pixts maia mitchell for oyster magazine http t co skwptwafka
-1	rt pixts maia mitchell for oyster magazine http t co skwptwafka
-1	i am tonya sabrina mitchell christian pianist email me at cattales1967 earthlink net or join my facebook page tonya sabrina mitchell
-1	im gay for shay mitchell
-1	rt vincentvanmoe mitchmcveigh lol people think i m being mean to mitchell for a group of ppl who love sarcasm y all don t seem to un
-1	rt perfectships maia mitchell and david lambert http t co a2p0wknvan
-1	rt roflindian ours is a truly forgiving nation mitchell johnson ripped out our pants in the world cup amp yet here we are extending him 5
-1	the difference btwn a mitchell johnson amp a sandeep sharma is the former knows his strength while the latter knows his weakness kxipvskkr
-1	every once in a while the crazy bitch does something nice today was one of those days
-1	rt pixts maia mitchell for oyster magazine http t co skwptwafka
-1	now playing vashawn mitchell god my god http t co xmytgh5hlq daytonabeach
-1	rt pixts maia mitchell for oyster magazine http t co skwptwafka
-1	mitchell_lund well played today mate looked like you had been playing in that position for years for rovers
-1	r i p karl mitchell corkyybaby
-1	rt garylineker mertesacker is the only player i ve seen limp off the field at the same pace as he sprints
-1	dgstormtrooper this is totally how you d get about if it wasn t for getting the bus https t co ufnztq3fwf
-1	sam__fleming can t wait 2 c u
-1	rt lightskinjawnie all the girls was buggin when k mitchell loyal came on
-1	rt pixts maia mitchell for oyster magazine http t co skwptwafka
-1	rt pixts maia mitchell for oyster magazine http t co skwptwafka
-1	rt agentsofshield wishing luke mitchell a very happy birthday from marvel s agentsofshield http t co 6cjfkk8gyy
-1	fxckingfxke what what couldn t you remember if you weren t to caught up in the moment my name is mitchell glad you remembered
-1	rt kyletmnews seymour 21 mitchell 3 final
-1	rt dooleyfunnyaf aint no such thing as being bisexual http t co ncuqimvjfb
-1	rt pixts maia mitchell for oyster magazine http t co skwptwafka
-1	rt jamie2258 garcia mitchell 330 automatic bail spinning reel made in france mitchell http t co uglh0fgkmc http t co ivwoirlden
-1	mitchell johnson s not having one of his better days here ipl2015 kxipvskkr
-1	rt pixts maia mitchell for oyster magazine http t co skwptwafka
-1	rt pixts maia mitchell for oyster magazine http t co skwptwafka
-1	rt kyletmnews seymour 21 mitchell 3 final
-1	rt cutiepieterse because she s shay mitchell she s adorable even without trying emisonnnnn
-1	rt jaegersports there they are again mitchell family coming thru big time again thx can t believe it s already out si https
-1	rt orangeandwhite clemson s freshmen ol performed all spring catching the head coach s eye http t co lxsxhnit4b http t co di8jw8ys
-1	rt pixts maia mitchell for oyster magazine http t co skwptwafka
-1	mr_mitchell_2_u lol man al guhl ain t finna miss a kill twice
-1	the doolittle tokyo raiders b 25 mitchell display at the national museum of the u s air force lt 3 http t co vfm9qy7fgv
-1	rt thesavannah01 i m able to hide my true feelings all too well
-1	volleyball at mitchell s 5 today
-1	rt jamie2258 garcia mitchell 330 automatic bail spinning reel made in france mitchell http t co uglh0fgkmc http t co ivwoirlden
-1	rt thesavannah01 such good food for thought about relationships http t co svxjd9xkq4
-1	joni mitchell hospitalized after she was found unconscious http t co qathmgomjx
-1	aeuproar yo is ae recruiting
-1	rt pixts maia mitchell for oyster magazine http t co skwptwafka
-1	howling watching this on repeat https t co gfrywwrwhe
-1	http t co fwwnnhf8ho figureskate ryuichikihara simcoe county barrie natives alexandra paul and mitchell islam will be on the ice fo
-1	rt mrdavidboberesq restored b 25 mitchell bombers taking off from uss ranger during 1992 s 50th anniversary of the 1942 doolittle raid h
-1	rt mrdavidboberesq restored b 25 mitchell bombers taking off from uss ranger during 1992 s 50th anniversary of the 1942 doolittle raid h
-1	emilwezh yo is ae recruiting
-1	rt pixts maia mitchell for oyster magazine http t co skwptwafka
-1	l l fan apparel chicago whitesox xl gray mitchell amp amp amp ness hustle play henley shirt souvenirs deals http t co 3ib03swz5b
-1	l l sporting buzz nwt mitchell amp amp amp ness womens royal blue dallas mavericks vintage look hoodie l sales http t co wjbztcon2o
-1	lakers nba mitchell amp ness los angeles lakers super script purple snapback hat cap nba http t co y1pcrhsu3r collectibles offer
-1	collectibles buzz mitchell amp ness replica nfl throwback jersey sf 49ers 42 ronnie lott men http t co 59wwn0flqm onsale discount
-1	souvenirs phillies 1980 home jersey luzinski mitchell amp ness size 46 http t co mgivxrd4dz fan apparel
-1	l knicks clothing new york knicks mitchell and ness official nba snapback baseball hat cap 1 size ebay auction http t co fxlmalxhxn
-1	l collectible buzz miami heat mens nba mitchell amp amp ness current jersey hat cap adjustable one size auction http t co jbrmfeqoxw
-1	rt pixts maia mitchell for oyster magazine http t co skwptwafka
-1	rt purpleclvr we are stardust we are golden and we ve got to get ourselves back to the garden joni mitchell
-1	rt dinahoiic shay mitchell is so so so pretty
-1	rt agentsofshield wishing luke mitchell a very happy birthday from marvel s agentsofshield http t co 6cjfkk8gyy
-1	legendaryriver yo is ae recruiting
-1	mitchell chiraq critics should let spike lee do his thing chicago sun times http t co hgehqwrjtd
-1	hayley mitchell now i know why that thigh gap is there o http t co jqgwyrm3gc
-1	hey mitchell what do you think safer than earbuds on a run http t co nkkeim37ck http t co 74ebypdmu0 mitchell_dotson
-1	rt pixts maia mitchell for oyster magazine http t co skwptwafka
-1	mr_mitchell_2_u i almost lost it when roy died then the thea thing smh
-1	because she s shay mitchell she s adorable even without trying emisonnnnn
-1	rt pixts maia mitchell for oyster magazine http t co skwptwafka
-1	rt pixts maia mitchell for oyster magazine http t co skwptwafka
-1	hazard is something else
-1	palmer bul 0 sunnyvale 1 top 3rd 0 out 0 balls 0 strikes no one on p b 11 ty mitchell
-1	rt pixts maia mitchell for oyster magazine http t co skwptwafka
-1	well going kkr andre russell and yousaf pathan on fire poor mitchell johnson kkrvskxip
-1	rt evandaniels louisville s donovan mitchell is starting to steal the show in the regional game 10 minutes to go and he has 26 points 3
-1	mitchell brunings redemption song the voice of holland season 4 http t co tu72saqyhg
-1	rt pixts maia mitchell for oyster magazine http t co skwptwafka
-1	unfriended or sjj dance
-1	rt anaraquel113 my only regret was never letting you know how i felt and what was up
-1	mitchell malinga flops in ipl8
-1	rt umichwrugby michigan wins their pool and will play purdue at 3 00 take a study break and come to mitchell field to watch some rugby
-1	rt pixts maia mitchell for oyster magazine http t co skwptwafka
-1	tired of mitchell johnson he only bowls and bats well against india
-1	deleted the facebook app from my phone so i could have room for the joni mitchell mix i made for myself
-1	rt spongebobmemory put that thing away there are children here http t co 00skm9zzwk
-1	rt evandaniels louisville s donovan mitchell is starting to steal the show in the regional game 10 minutes to go and he has 26 points 3
-1	dorothy norwood great jehovah god feat vashawn mitchell http t co vwsclmijb3 nowplaying listenlive
-1	can t wait to see th improvements and train with mitchell
-1	rt pixts maia mitchell for oyster magazine http t co skwptwafka
-1	rt tweetcricscore ipl punvskol kol 112 5 13 4 ovs yusuf pathan 8 12 andre russell 43 24 mitchell johnson 2 4 0 33 0 need
-1	rt funnyquotees you drink too much http t co q4z16l47rx
-1	rt pixts maia mitchell for oyster magazine http t co skwptwafka
-1	detroit lions mitchell amp ness nfl barry sanders authentics detroit lions 20 jersey http t co to03nrwtht detroit lions
-1	nba basketball nwt mitchell amp ness womens royal blue dallas mavericks vintage look hoodie l http t co yymo5mgs7w auction buy
-1	clothing accessory new oklahoma city thunder snapback hat mitchell ness nba http t co zzzbnktsyl nba auction
-1	rt _jessycrooks been walking for 5 hours straight
-1	trousdale 11 ehs 2 top 6th 0 out 0 balls 0 strikes no one on p 9 mitchell burris b 12 logan calhoun
-1	rt 5sosmegz when did maia mitchell pierce her nose
-1	lesley_mitchell ltdhq thank u looking so forward to it
-1	rt pixts maia mitchell for oyster magazine http t co skwptwafka
-1	rt pixts maia mitchell for oyster magazine http t co skwptwafka
-1	rt pulplibrarian three go back by leslie mitchell famous fantastic mysteries december 1943 cover by lawrence caveman http t co ik
-1	tomjunod final thought i had on this malcolm says mitchell was irritated by facts and aspects and his disregard for them gives his 1
-1	garcia mitchell 330 automatic bail spinning reel made in france mitchell http t co uglh0fgkmc http t co ivwoirlden
-1	rt roflindian ours is a truly forgiving nation mitchell johnson ripped out our pants in the world cup amp yet here we are extending him 5
-1	mitchell clark meller s work at art after dark check him out this weekend at the love art fair or https t co cecolfoeug
-1	happy recordstoreday anyone want to go pick me up a reissue of d j entendu i ll repay you with as much graphic design work as you want
-1	mitchell_eddy7 he did dj hanzel stuff
-1	hi diamond these tee amp hoodies are named by you get it now http t co tanvtkaprf bye goodbye mitchell_jmp http t co vdz8treiim
-1	panerabread mitchell_13579 time to slide in
-1	joni mitchell a case of you live 1974 https t co h9xtfapnmk
-1	shay mitchell is so so so pretty
-1	and y all think she s bad http t co xsqshtivxv
-1	rt pixts maia mitchell for oyster magazine http t co skwptwafka
-1	mitchell_lund yea i m good bro
-1	rt pixts maia mitchell for oyster magazine http t co skwptwafka
-1	mitchell_lund you played well mate
-1	google alert morgan ready to speak about bella in mitchell http t co kfpq2padd6
-1	vila_halafihi cheers mate and good you
-1	rt pixts maia mitchell for oyster magazine http t co skwptwafka
-1	raindrops on roses and whiskers on joseph http t co w2xdx8vsze
-1	rt pixts maia mitchell for oyster magazine http t co skwptwafka
-1	rt pixts maia mitchell for oyster magazine http t co skwptwafka
-1	rt pixts maia mitchell for oyster magazine http t co skwptwafka
-1	rt pixts maia mitchell for oyster magazine http t co skwptwafka
-1	mitchell_lund congrats mate hope your well
-1	rt evandaniels louisville s donovan mitchell is starting to steal the show in the regional game 10 minutes to go and he has 26 points 3
-1	l nba basketball miami heat mens nba mitchell amp amp ness current jersey hat cap adjustable one size goods http t co ckz4jkffzj
-1	mohegan sun with mitchell for the weekend
-1	13szczesny13 useless
-1	tompkinsmiah mitchell_lee12 i need water
-1	rt perrysburgtrack emily mitchell 2nd in 100 meters 13 12
-1	seems like mitchell johnson s highlights darkening his performance hehe kxipvskkr winitkkr go4more
-1	rt shock_the_w0rld we catching bodies malab shooters kill mitchell hopkinsna15 http t co hgkkqszeda
-1	rt pixts maia mitchell for oyster magazine http t co skwptwafka
-1	ismoraisanen austingal55 mgdigital reidsart ip_mitchell joancarroll my pleasure ismo
-1	mitchell_13579 hi mitchell we re sorry to hear this can you dm your bakery cafe and more details so we can chat
-1	pulplibrarian goodness me that s leslie mitchell of a scots quair fame so interesting to see him in his sci fi guise
-1	rt lauracooops whyyyy do a not look like shay mitchell
-1	mitchell_mairi aw thank you mairi xx
-1	his blood still works vashawn mitchell ft lisa page brooks http t co 3pjg51qblh praise break http t co qp5sxfpir4
-1	rt pixts maia mitchell for oyster magazine http t co skwptwafka
-1	pattymac91 miss you boys too don t forget to have the nightly bowl of cinnamon toast crunch for me
-1	l collectible buzz mitchell amp amp ness nfl barry sanders authentics detroitlions 20 jersey deal bargain http t co wm84vpnmdr
-1	that s why he s a cup keeper
-1	rt ismoraisanen carolleemiller tysm carol austingal55 mgdigital reidsart ip_mitchell joancarroll
-1	mitchmcveigh lol people think i m being mean to mitchell for a group of ppl who love sarcasm y all don t seem to understand it
-1	rt pixts maia mitchell for oyster magazine http t co skwptwafka
-1	ceddyevina cheers lad
-1	rt evandaniels louisville s donovan mitchell is starting to steal the show in the regional game 10 minutes to go and he has 26 points 3
-1	mitchell johnson shows lack of confidence https t co umchuzmhkv
-1	rt relatablequote i m screaming http t co o8a8th4jnt
-1	rt pixts maia mitchell for oyster magazine http t co skwptwafka
-1	happy birthday hope you ve had a good day xx megan_fowlerxx
-1	we need to get our act together man
-1	kca votejkt48id maxturner jazz recordstoreday blue mitchell the lesser known jazz musician brother of phil http t co fbjk1kctsw
-1	rt pixts maia mitchell for oyster magazine http t co skwptwafka
-1	axecalibur369 mitchell hyder wanna get iphone6 for free join the giveaway right now link on my profile
-1	rt hanraenah attention mitchell and i need help moving this afternoon if you can help you ll be compensated in beer and pizza let us k
-1	i added a video to a youtube playlist http t co muvhhkkbb6 guy mitchell rock a billy
-1	http t co ccv0jic1vf i think mitchell johnson needs a hug kxipvskkr kxip pepsiipl
-1	http t co ccv0jic1vf pepsiipl ipl punvskol kol 112 5 13 4 ovs yusuf pathan 8 12 andre russell 43 24 mitchell johnson 2 4 0
-1	today s result halstead utd reserves 5 1 eynsford goals from danielchick11 2 craig fisher mitchell clegg amp dan bell coyh
-1	rt 49ersteamstore last week jerryrice released his official mitchell_ness snapback photos http t co p13kcwtsf2 http t co itfoeo
-1	rt pixts maia mitchell for oyster magazine http t co skwptwafka
-1	rt botanic rock garden sale happening now to 3 pm in mitchell hall free with botanic admission rmrockgarden
-1	rt pixts maia mitchell for oyster magazine http t co skwptwafka
-1	burnin_mitchell 29 more days
-1	mitchell johnson basically had 1 good test series bouncing the mentally ill and blasting away the tail back to his old self now
-1	lancers 0 cougars 3 top 2nd 2 out 0 balls 0 strikes man on second and third p 3 mitchell patterson b 2 brook vosler
-1	rt kaisercobalt yells michell then jumps into pool to give mitchell a hug
-1	kenzie_bolton17 i don t know if i d call that their crowning achievement i mean they did also birth mitchell
-1	mitchell johnson don t deserve to be in playing 11 ipl2015
-1	i miss sam mitchell
-1	rt mitchellnavy mitchell navy takes a trip to macdill afb jwmhs_cortier jwmhs_schultz jwmhs jmichaels727 michelleobama http t co r
-1	a cigarette case that belonged to rj mitchell the designer of the spitfire is returned to the museum from which it was stolen in a
-1	yo did u see arrow mr_mitchell_2_u mraaronjones
-1	rt amelia_blogger mimosas drink before noon and pretend you aren t an alcoholic http t co dlxfqz9vy9
-1	jazz recordstoreday blue mitchell the lesser known jazz musician brother of phil and grant http t co rcdtbwmbtk
-1	kxipvskkr why couldn t mitchell johson bowl this beautifully in the world cup
-1	i am heading to mitchell library in glasgow for the ayewrite book festival to hear munromoonwalker talk about the scottish mountains
-1	rt roflindian ours is a truly forgiving nation mitchell johnson ripped out our pants in the world cup amp yet here we are extending him 5
-1	rt jonrothstein two guys to buy stock in terms of immediate mins and immediate production in 15 16 uconn s jalen adams and louisville s
-1	rt jonrothstein two guys to buy stock in terms of immediate mins and immediate production in 15 16 uconn s jalen adams and louisville s
-1	it s just too much going on
-1	rt busbybulletin watching the game at mitchell s v amp a waterfront cape town mufc http t co i8tydrifrt
-1	i m so ready for graduation yall
-1	just another day in the life of a think peer leader deflating the earth ball after the mitchell cleanup earthweek http t co cuf1geo4k3
-1	extremely overwhelmed right now
-1	we have updated our facebook page some great photographs taken today photoshoot is 20 for around 15 20 http t co 1z9c5sb1py
-1	rt elisabethstaab me sends picture of youngest kid in karate gi to grandparent grandparent oh that s cute now i see why people dre
-1	rt stephenasmith wall and pierce toronto will need to find a way to hold one of them in check in order to win this series
-1	jazz recordstoreday blue mitchell the lesser known jazz musician brother of phil and grant http t co qx61sdm7fp
-1	rt cortez_rodgers enjoli_mitchell sexy and smooth and strong and smart and attractive
-1	we see you cicely mitchell get your tickets for theaocproject today http t co tn46cflhkq http t co whmjhxieer
-1	i ordered a bagel and they forgot the bagel panerabread
-1	rt eastendersultra being bad with phil mitchell eastenders https t co qxucaxzwrf
-1	seymour 21 mitchell 3 final
-1	lancers 0 cougars 3 top 2nd 1 out 0 balls 0 strikes man on first and second p 3 mitchell patterson b 13 logan grigsby
-1	i think mitchell johnson needs a hug kxipvskkr kxip pepsiipl
-1	rt roflindian ours is a truly forgiving nation mitchell johnson ripped out our pants in the world cup amp yet here we are extending him 5
-1	rt zumsouth report from jv baseball coach eric mitchell josh messler threw a no hitter versus st charles nice work indeed josh
-1	1909 t206 mike mitchell cincinnati reds piedmont back baseball card tobacco http t co atjsqsm8yu http t co kwcevnlz8w
-1	l nba celtics arena vintage nba boston celtics pistol pete maravich mitchell and ness hardwood basketball deals http t co f9slxieyl7
-1	great debut for lund today drfc mitchell_lund
-1	pepsiipl ipl punvskol kol 112 5 13 4 ovs yusuf pathan 8 12 andre russell 43 24 mitchell johnson 2 4 0 33 0 ipl8 kxip kkr
-1	rt clashfordummies when you re at a concert but pushing at 4k trophies http t co 44sxwmvyph
-1	slow wicket and mitchell johnson bowling like a drain lesson for english groundsmen there
-1	rt sureshtriveni mitchell johnson looks bored ipl kkrvskxip
-1	eskay1x_ ummhuhh ms mitchell even fed us before we took our eoct
-1	rt festivalreviews great review from netsruck congrats to sheridan s musical theatre grads and julie amp mitchell outsidethemarch http
-1	jackwalters8 mitchell_lund well played today mitch excellent performance many more to come drfc
-1	kxipvskkr mitchell johnson u letting preity down
-1	mitchell johnson seems to just be dishing them up in his last couple of games struggling with something
-1	rt saucougarsfan1 lancers 0 cougars 3 top 2nd 0 out 0 balls 0 strikes no one on p 3 mitchell patterson b 12 colton
-1	rt cricketndtv ipl suryakumar yadav hammers mitchell johnson for a couple of sixes kkr 53 2 6 overs vs kxip 155 9 http t co buuh
-1	rt sureshtriveni mitchell johnson looks bored ipl kkrvskxip
-1	something to enjoy in the sheraton is that every hour you re going to hear at least one aimee mann or joni mitchell song gritlit2015
-1	we are stardust we are golden and we ve got to get ourselves back to the garden joni mitchell
-1	rt eskay1x_ _briyyahiman lmao oh god i wish i could ve took mitchell instead of nisinger cause i swear she didn t know what she was d
-1	help the studio amp paul mitchell celebrate earth day 2015 join the greentakeover and help paul mitchell and http t co zwuvum2p33
-1	1916 mitchell lewis motor car racine wi why cars go wrong john bates ad http t co hw6ev9fxxw http t co jalydfy7m1
-1	ipl punvskol kol 107 5 13 1 ovs andre russell 42 23 yusuf pathan 4 10 mitchell johnson 2 1 0 28 0 need 99
-1	_briyyahiman lmao oh god i wish i could ve took mitchell instead of nisinger cause i swear she didn t know what she was doing
-1	ipl punvskol kol 112 5 13 4 ovs yusuf pathan 8 12 andre russell 43 24 mitchell johnson 2 4 0 33 0 need
-1	rt kkrofficial after axar patel it s time for mitchell johnson andre russell starts the over with a four kkr kkrvskxip
-1	rt kkrofficial after axar patel it s time for mitchell johnson andre russell starts the over with a four kkr kkrvskxip
-1	always enjoyable to watch mitchell johnson get carted round the park kxipvkkr
-1	rt mrdavidboberesq restored b 25 mitchell bombers taking off from uss ranger during 1992 s 50th anniversary of the 1942 doolittle raid h
-1	rt deathsexmoney john cameron mitchell talks about how love and loss changed the way he plays hedwigonbway http t co qi4qhe1tjo http
-1	mitchell johnson is being slapped about in the ipl serves him right for having that horrific tash
-1	also the way mitchell johnson has been treated shows that these pacers are so ineffective in the subcontinent sab apne ghar me sher hai
-1	carolleemiller tysm carol austingal55 mgdigital reidsart ip_mitchell joancarroll
-1	rt kkrofficial after axar patel it s time for mitchell johnson andre russell starts the over with a four kkr kkrvskxip
-1	mitchell jhonson and axar patel going for cleaners whereas sandeep sharma is almost unplayable that s ipl 4 u kkrvskxip sonysix eit20
-1	fxkingforfun mitchell coby michael grassi just tell me what s wrong
-1	rt kkrofficial after axar patel it s time for mitchell johnson andre russell starts the over with a four kkr kkrvskxip
-1	ipl mitchell johnson has only had 1 decent test series in the last 10 years very overrated and very average ipl2015
-1	found a wild mitchell at beecraigs http t co fvacnriel4
-1	great viewing watching mitchell johnson get smacked to all corners of the ground ipl2015
-1	ipl we want mitchell mcclenaghan to play next match for mumbai indians
-1	rt kkrofficial after axar patel it s time for mitchell johnson andre russell starts the over with a four kkr kkrvskxip
-1	finished david mitchell back story by david mitchell http t co 0avfz714zj
-1	eskay1x_ boyyy nooooooo everyrthang ms mitchell taught was on there yall shoulda called obama on ha ahh
-1	rt kkrofficial after axar patel it s time for mitchell johnson andre russell starts the over with a four kkr kkrvskxip
-1	rt mrdavidboberesq restored b 25 mitchell bombers taking off from uss ranger during 1992 s 50th anniversary of the 1942 doolittle raid h
-1	nine says mitchell i can do that hoopshoot
-1	rt kkrofficial after axar patel it s time for mitchell johnson andre russell starts the over with a four kkr kkrvskxip
-1	i fancy getting phil mitchell d tonight been a long week http t co adugaw8zvv
-1	rt kkrofficial after axar patel it s time for mitchell johnson andre russell starts the over with a four kkr kkrvskxip
