-1	sb ecu starting lineup at usf bradford dp oshiro rf smith 3b wynne c alcorn ss ramirez 1b ervin lf johnson 2b mitchell cf cruise rhp
-1	rt bodiciasapple review pi paula mitchell in a broken life by jan christensen reviewed by cynthiaharriso1 for aww http t co dn1zwr7n
-1	hey senjohnthune greggharper mitchell amp nancy t of az wants you to support netneutrality not big cable
-1	haven t seen mitchell all week
-1	rt thegoodvillain long day ahead buzzfest33 glamourbones 945thebuzz the cynthia woods mitchell pavilion https t co swp0oyedac
-1	would clinton warren be a winning ticket http t co 7wzofelj5j
-1	rt causewereclassy dressing my future kids like this http t co pc5ijhgmwh
-1	antique school atlas maps mitchell over 600 maps geography exercises home school http t co yzxz2ii5p3 http t co swl1takboi
-1	antique school atlas maps mitchell over 600 maps geography exercises home school http t co jrtmlvpxyi http t co qyhge3gxpv
-1	tyler_mitchell_ don t fall in love it ruins your life lol
-1	joni mitchell was right they ve paved paradise and put up a parking lot ugh http t co rqsq8rqxee
-1	rt hotfreestyle lavish leo back at it lvshleo http t co utby3ltwy1
-1	fucktyler do u like star wars favorite character also
-1	rt msgvarsitykdj absurd dunk by elmsford s donovan mitchell in the jordan classic rt jordanclassic joyride http t co atfqcyyd1s
-1	rt ditrfr 16 diamond prospect spotlight thomas mitchell dl pennhills pittsburgh pa http t co fogifch1az follow ohh_tmitch
-1	mitchell_lund outstanding debut today drfc rtid
-1	rt hoopinsider tabc 3a player of the year wendell mitchell igb_chuck rockdale http t co tnva09vyjn
-1	rt busbybulletin watching the game at mitchell s v amp a waterfront cape town mufc http t co i8tydrifrt
-1	maybe our mistakes are what make our fate carrie bradshaw http t co 1pzcczpmrz
-1	nkuchdestiny and me
-1	d3tt0l no i need friends
-1	rt drfc_official pd i thought mitchell lund was great on his full debut drfc
-1	georgia_pricee definitely i fully believe we can win the premiership this year
-1	jersey season is in full affect divineuniversal mitchell_ness https t co qeanakqvfd
-1	mitchell conroy live tonight edm toronto http t co rrrmpiwb7t
-1	rt jimmitchellgold natick ma shop now signature store mitchell gold bob williams 20 off 625 worcester rd rt 9 w ask for jim ht
-1	rt jimmitchellgold natick ma shop now signature store mitchell gold bob williams 20 off 625 worcester rd rt 9 w ask for jim ht
-1	rt jimmitchellgold natick ma shop now signature store mitchell gold bob williams 20 off 625 worcester rd rt 9 w ask for jim ht
-1	rt jimmitchellgold natick ma shop now signature store mitchell gold bob williams 20 off 625 worcester rd rt 9 w ask for jim ht
-1	rt jimmitchellgold natick ma shop now signature store mitchell gold bob williams 20 off 625 worcester rd rt 9 w ask for jim ht
-1	rt jimmitchellgold natick ma shop now signature store mitchell gold bob williams 20 off 625 worcester rd rt 9 w ask for jim ht
-1	rt jimmitchellgold natick ma shop now signature store mitchell gold bob williams 20 off 625 worcester rd rt 9 w ask for jim ht
-1	rt jimmitchellgold natick ma shop now signature store mitchell gold bob williams 20 off 625 worcester rd rt 9 w ask for jim ht
-1	rt jimmitchellgold natick ma shop now signature store mitchell gold bob williams 20 off 625 worcester rd rt 9 w ask for jim ht
-1	rt jimmitchellgold natick ma shop now signature store mitchell gold bob williams 20 off 625 worcester rd rt 9 w ask for jim ht
-1	rt busbybulletin watching the game at mitchell s v amp a waterfront cape town mufc http t co i8tydrifrt
-1	impressed with mitchell_lund today looks solid and was growing in confidence as game went on madeindoncaster drfc rtid
-1	rt mfcompany matthew ferrara talks innovation with kelly mitchell http t co brrrjxgv3p
-1	dave_mitchell i ll say offer a friend a drink then immediately starts picking a fight with the guy next to us idiocy
-1	rt busbybulletin watching the game at mitchell s v amp a waterfront cape town mufc http t co i8tydrifrt
-1	rt pixts maia mitchell for oyster magazine http t co skwptwafka
-1	rt a_southern_lady there are more carbs in a large sweet tea from mcdonald s than there are in a bigmac kill me
-1	mr_mitchell_2_u but they were still putting out there trash movies batman begins changed everything
-1	rt hotfreestyle composition books http t co rrqseqyinb
-1	sugawarakoushis shameless is the only us version of anything they did better lmao geroge annie and mitchell fo lyf
-1	_mitchell_brown you need a booty call
-1	check out andrae mitchell s listing in milton fl http t co vp9jkjahoc realestate realtor http t co u9twkyuru6
-1	l sporting goods mitchell amp amp ness anthony a train thomas chicago bears rare jersey 52 bargain deal http t co u8hpltsayv
-1	baseball nba authentic mitchell ness m amp n newyork knicks blue osfa snapback hat cap http t co gxgrs9akvj onsale discount
-1	nba knicks authentic mitchell ness m amp n newyork knicks blue osfa snapback hat cap http t co nw7fagisds offers deals
-1	bobbie mitchell is our fabulous emcee http t co mhfk6njddb
-1	mitchell hosts collisionindustry boot camp in seattle next week http t co az9dnhszr0 apd http t co aee8anqz2v
-1	remember when mitchell musso made music lmao
-1	rt busbybulletin watching the game at mitchell s v amp a waterfront cape town mufc http t co i8tydrifrt
-1	rt draftexpress donovan mitchell named mvp of jordanclassic regional game should be playing in the national game i think eric gordon e
-1	eastenders phil mitchell s been locked up that many times they should book im a complimentary cell
-1	rt draftexpress donovan mitchell named mvp of jordanclassic regional game should be playing in the national game i think eric gordon e
-1	http t co b0od0fw8od atlanta hawks nba basketball mitchell amp ness trifecta cuff be hawks http t co laekobkvoj
-1	_mitchell_brown it s a no from me
-1	rt peppynayaholic bay_clem shay mitchell summa cum hottie
-1	joe_lovell alexzaroulias the third mitchell brother
-1	mitchell brunings giovanca en shirma rouse we and them bob marley https t co asktvmdvcx via youtube
-1	rt busbybulletin watching the game at mitchell s v amp a waterfront cape town mufc http t co i8tydrifrt
-1	jw_13 larkinswsun haha i am sorta the same like to see em get a series w tho
-1	natick ma shop now signature store mitchell gold bob williams 20 off 625 worcester rd rt 9 w ask for jim http t co eknpwdumn8
-1	natick ma shop now signature store mitchell gold bob williams 20 off 625 worcester rd rt 9 w ask for jim http t co v9syqt8rwq
-1	rt kevincalpin atlanta braves pitching matchup today wood vs dickey gwinnett braves pitching matchup today wang vs johnson giggle im
-1	s0phiesm1th that is literally the most fucking hideous picture of me ever delete it
-1	i want a selfie stick
-1	rt opstreetstyles shay mitchell http t co hyhz4doiv6
-1	pretty little liars pll lucy hale shay mitchell ashley benson troian bellisario hanna marin emily fields http t co qemuuakule
-1	bay_clem shay mitchell summa cum hottie
-1	rt _ianbeale_ phil mitchell just said he s voting ukip so i got the bald cunt in a classic beale headlock pussy cried bealed
-1	when i m listening to idfwu i always think it s a gospel song but then he starts saying i don t guck with you
-1	mr_mitchell_2_u because they saw what marvel is doing and want to try duplicating it
-1	mitchell gets 7gb a month for data and he used 75 after four days k
-1	home alone tonight anyone wanna come keep me company
-1	rt caroline_writes just 1 week to booklaunch for haunting crime thriller dontturnaround pre order now for 99p http t co arnmxk2egf h
-1	rt adamzagoria donovan mitchell spidadmitchell also said he s recruiting drexel transfer damion lee to louisville lee visits april 19 2
-1	rt busbybulletin watching the game at mitchell s v amp a waterfront cape town mufc http t co i8tydrifrt
-1	mitchell_blythe the only way is up for this team saints should be worried
-1	rt busbybulletin watching the game at mitchell s v amp a waterfront capetown mufc http t co ieghmdtcv2
-1	rt bftexaminer chiefs mitchell to play hoops for urbana university http t co ms3w30zy7u
-1	larkinswsun aaron_mitchell_ hater
-1	rt hotfreestyle he snapped jzacmusic http t co trzffixlqh
-1	when did maia mitchell pierce her nose
-1	rt draftexpress donovan mitchell named mvp of jordanclassic regional game should be playing in the national game i think eric gordon e
-1	rt pulplibrarian three go back by leslie mitchell famous fantastic mysteries december 1943 cover by lawrence caveman http t co ik
-1	i am so fucking excited to watch the warriors play today i can t do anything for the next 2 hours
-1	you hate lookin like a tube of toothpaste
-1	rt mlbwhitesox fan apparel chicago whitesox xl gray mitchell amp ness hustle play henley shirt http t co lt2hk8o3w2
-1	reaganjm because your mom is a ding a ling and didn t get you signed up on time
-1	mitchell_blythe yeah your right i guess sososo gutted absolute shift by the boys fully focused on next week against saints
-1	andi owens leads off with an infield single but no runs for mitchell seymour 10 0 after two
-1	rt awkwardposst the best things happen unexpectedly
-1	lionsdenkxip kkriders still we are in and we will win surely mitchell will fire today livepunjabiplaypunjabi
-1	apparel souvenirs miamiheat mens nba mitchell amp ness current jersey hat cap adjustable one size http t co cx4ixrmjzx ebay auction
-1	hey get free a fitness tracker on us http t co puuejeypjr jim mitchell hypnojim your http t co vyf4k91vtg http t co e9ee8ynrwq
-1	fan apparel chicago whitesox xl gray mitchell amp ness hustle play henley shirt http t co foazrh9llp souvenirs deals
-1	the hardest thing about the act is breaking the seal
-1	wow what a catch by gautam gambhir mitchell johnson caught off morne morkel kkrvskxip http t co ndrwofdz9d
-1	that s awesome
-1	rt opstreetstyles shay mitchell http t co hyhz4doiv6
-1	cora_mitchell ohkaye i went in and they gave me 15 a couple weeks ago i was shocked
-1	larkinswsun jw_13 stressed about the jets
-1	rt drfc_official coppinger26 says the main thing to come out of today s game is mitchell_lund s debut and he was outstanding drfc m
-1	bleedigblue kyletucker_cj the school down the street is starting to look good as well mitchell and lewis are great additions
-1	mr_mitchell_2_u i m still confused as to why they did that
-1	rt hotfreestyle real http t co rxhfxzqcu5
-1	rt busbybulletin watching the game at mitchell s v amp a waterfront cape town mufc http t co i8tydrifrt
-1	or for the premiership salary cap to keep up with top 14 greater squad depth allows the burden to be spread more thinly
-1	rt busbybulletin watching the game at mitchell s v amp a waterfront cape town mufc http t co i8tydrifrt
-1	don t expect to get a light drill in when you go with mitchell or reedy lol
-1	rt opstreetstyles shay mitchell http t co hyhz4doiv6
-1	coppinger26 says the main thing to come out of today s game is mitchell_lund s debut and he was outstanding drfc madeindoncaster
-1	happy birthday mitchell from my crush in 1st grade to my prom date this year you ve always been https t co geiktc5zlw
-1	georgia_pricee yeah i guess but then where else can it be played frustrating game to watcch
-1	watching the game at mitchell s v amp a waterfront cape town mufc http t co i8tydrifrt
-1	rt inutonthots_ i hate when people bring up old shit
-1	l b apparel souvenirs newyork knicks medium mitchell amp amp amp amp amp ness drop step mesh tank top jersey http t co rnk7gq57hs
-1	i want to go to italy so bad
-1	lmfao http t co gkp0uafuhv
-1	lexus jacobtanaka my friend do provide shay mitchell a lexus
-1	rt pixts maia mitchell for oyster magazine http t co skwptwafka
-1	rt thegoodvillain long day ahead buzzfest33 glamourbones 945thebuzz the cynthia woods mitchell pavilion https t co swp0oyedac
-1	aaron_mitchell_ jw_13 indifferent i guess nephew likes em but i don t care one way or other
-1	rt ip_mitchell new artwork for sale the road to snowdon http t co j6acawsbsm fineartamerica http t co 13ptxtwknr
-1	incidentally if sarries injury ravaged season is a hangover from last season surely it s time for training schedules to be biennial
-1	rt chrisking1994 conormoody94 mitchfountain fuck off mitchell
-1	rt pixts maia mitchell for oyster magazine http t co skwptwafka
-1	i m listening to you turn me on i m a radio live by joni mitchell on pandora pandora http t co txji0m6rfp
-1	rt mara1937 claudette colbert in midnight directed by mitchell leisen 1939 classicfilms 1930s fashion glamour vintage http t
-1	mr_mitchell_2_u i wonder if chris will be doing any consulting though
-1	rt ditrfr 16 diamond prospect spotlight thomas mitchell dl pennhills pittsburgh pa http t co fogifch1az follow ohh_tmitch
-1	rt ayorafernando just beautiful b 25 mitchell b 17 flying fortress b 24 liberator amp p 51 mustang aa_pilot wbskipper25352 paul_sb http
-1	larkinswsun jw_13 not cheering for the raps
-1	rt joeykamman so content with everything and everyone in my life
-1	long day ahead buzzfest33 glamourbones 945thebuzz the cynthia woods mitchell pavilion https t co swp0oyedac
-1	aaron_mitchell_ jw_13 uh what beatit
-1	rt tydillon i ll be giving away my yuengling_beer 59fifty neweracap today to a random follower retweet to win http t co kmpy1timnd
-1	sethrogen jayde__mitchell go get em http t co mhpeoa1r6w i love you
-1	rt jacobab79331810 m23mclaughlin you are a legend mitchell good on you looking forward to your next stream with technophiles g day fr
-1	confirmed starting xi vs umbc morton ahimbisibwe yeboah ahtchi ali white del riego adami krug mitchell mensah toribio
-1	cam_a_mitchell thank you miss you
-1	jw_13 larkinswsun i m all in now is the time boys
-1	photo swournin la dispute by mitchell manz http t co u7ym8k6xv7
-1	rt skelly____ i wish i could fast forward through mornings cause they are almost always boring af
-1	rt nobodizperfekte peter mitchell http t co nybtmw4r99
-1	rt hotornot_4 rt for shay mitchell fave for emma watson http t co xykeyju2yj
-1	fucktyler do like dinosaurs and what s your dream car
-1	wishing my handsome nephew godson anton mitchell zapp a very happy 14th birthday love you so much tony and hope you have an amazing day
