-1	rt aathabs a very optional practice today prust gallagher mitchell weise petry galchenyuk emelin subban gilbert markov and pric
-1	a very optional practice today prust gallagher mitchell weise petry galchenyuk emelin subban gilbert markov and price missing
-1	rt rtgirlcrushes shay mitchell http t co xa5rbz1uuz
-1	rt urmindblown if i don t pet my dog immediately he gets someone else to pet him then stares at me to see if i m jealous http t co
-1	ihateleafs bobrock88 it s the plan boys grab eichel re sign flynn and mitchell boom gmjr
-1	rt lego_group day 3 rt for a chance to win a lego starwars celebration exclusive legoswcvii swcvii swca http t co rncrnw0jrx http
-1	report from jv baseball coach eric mitchell josh messler threw a no hitter versus st charles nice work indeed josh
-1	georgia_pricee im sure itoje will captain england one day he is incredible considering his age
-1	the wizards should be so much better on offense than they are
-1	rt drfc_official pd i thought mitchell lund was great on his full debut drfc
-1	the first time i saw luke mitchell on agents of shield i was like oh my god it s john from the tomorrow people i screamed
-1	johnarussell oh wha i finally made it to the last mitchell funhouse but that was lunchbreak doable u must tweet pics
-1	itskorrttt marisa_heinecke nope just me
-1	shay mitchell is such a wonderful gorgeous human being inside amp out http t co rj8ytgbvkn
-1	l sporting buzz nwt mitchell amp amp ness womens royal blue dallas mavericks vintage look hoodie l sales discount http t co qfw8xhck7i
-1	beauty professionals fine tune your skills with these upcoming paul mitchell advanced academy classes
-1	rt tdj_lovely free my brother gws big head love them http t co ihu1ywdhe3
-1	l d collectible buzz mitchell ness los angeles clippers 1984 85 norm nixon nba basketball jersey forsale http t co dcqkf2qozw
-1	everything that s broke leave it to the breeze
-1	rt thens_spartans balanced scoring in 2018 loudenberg s 64 41 w vs wbc 2018 trey davis plainfield 14 craig porter th south 12 ben
-1	that song love em all by k mitchell is a hoe anthem
-1	lawn_mitchell thanks mitch
-1	mhairi_mitchell u know it
-1	collectible buzz mitchell amp ness nfl barry sanders authentics detroitlions 20 jersey http t co 3woobmrcko deal bargain
-1	mitchell_lund my nigga my nigga congratsspen imeanmitch lookthesame
-1	emily mitchell 2nd in 100 meters 13 12
-1	fccagriculture s corinna mitchell beaudin discusses farmland values on today s ctvnews market prospects 12 30pm 6 30pm
-1	i added a video to a youtube playlist http t co s7f7bkl7zz mike mitchell stanley clarke brazilian love affair live
-1	mitchell_lund well done bro bossed it
-1	i added a video to a youtube playlist http t co tqhly5zojg mike mitchell stanley clarke goodbye pork pie hat live
-1	rt bendallcallie shay mitchell does it best http t co wnlf48masb
-1	indiatimes six hit by ms dhoni off mitchell johnson in over 18 5 inning 2 http t co zrni4x4pni
-1	rt stevestfler forever changed route running http t co gtvkgxhg1h
-1	rt agentsofshield wishing luke mitchell a very happy birthday from marvel s agentsofshield http t co 6cjfkk8gyy
-1	there is no cosmetic for beauty like happiness maria mitchell quote
-1	rt mpsportstjames diamond in the rough attendee damarcus mitchell 6 6 so from memphis wooddale that has a bright future http t co ltw
-1	justarran_ i m so funny
-1	there is no cosmetic for beauty like happiness maria mitchell quote
-1	i m getting so behind in these lp1 edits http t co 2qfoxgodci
-1	powerful run for a touchdown by a powerful rb in idaho state s braeden mitchell skyline hs goisu https t co tbqoua1rwb
-1	rt justarran_ u know a lot about jews don t u mhairi i jew actually ok mhairi
-1	i love the character grant mitchell plays in ross kemp on gangs
-1	rt bestvinesever one last ride https t co 3q7sxxbx08
-1	rt chic_dreams big deal for our local boy http t co j7fbmliyi6
-1	busy day at paul mitchell today phase 2 working hard lt 3 pmts pmtslife pmtsschenectady cosmetology http t co puvcvvwu6l
-1	the doobie brothers don felder and others 26 april 2015 houston cynthia woods mitchell pavilion http t co ga6al7osch
-1	rt cricketndtv ipl suryakumar yadav hammers mitchell johnson for a couple of sixes kkr 53 2 6 overs vs kxip 155 9 http t co buuh
-1	rt rtgirlcrushes shay mitchell http t co xa5rbz1uuz
-1	rt portchester28 no it s not the mitchell brothers helping at the firefighters999 beer festival it s geoff steve c jasper amp steve t ht
-1	i added a video to a youtube playlist http t co nbymdupljq mike mitchell solo studio
-1	helenlederer having a pre taxi bottle of pinot in anticipation of your mitchell library extravaganza tonight pure dead brilliant excited
-1	thank you shane mitchell for donating this amazing raffle prize for our spring lunch of a dinner for 2 in the http t co vkdiec08qk
-1	made up for mitchell_lund starting today had a great game
-1	fourth model done hairbygloria makeupbysomher teamworkmakesthedreamwork paul mitchell the https t co 09ioczzhxi
-1	rt jccaylen goin wherever the world takes us
-1	rt rtgirlcrushes shay mitchell http t co xa5rbz1uuz
-1	mitchell hashimoto of hashicorp with madgreek65 http t co zveyitffif
-1	big deal for our local boy http t co j7fbmliyi6
-1	rt maggieferrel someone tell mitchell that i m the original patrick star
-1	marisa_heinecke kelsie_mitchell you re not ugly
-1	legs are in bits well done mitchell_lund on your league debut bro solid drfc
-1	a 1993 chevrolet c k 1500 series was just scanned near fort mitchell al 36856 http t co aczacnvx3d vinny areyoutheone
-1	someone tell mitchell that i m the original patrick star
-1	rt aggiemten a amp m vs mississippi state at noon for a spot in the secmtennis finals tomorrow warmups underway at mitchell 12thman http
-1	ashley sutton holds in the brands re run he beats whorton eales stilp smith mitchell and ladell cliocup
-1	mitchell_lund well done my lad
-1	if sequoia mitchell don t call me i will really make a trip to wayne state university
-1	dizzyo244 it s okay mitchell you can come jump on my trampoline
-1	rt pylusdconfess 1 blake mitchell broke up with his girlfriend cause she wouldn t have sex with him
-1	boise state doubles lineup 1 roskilly tenreiro 2 patton mitchell 3 foley hewko
-1	kelsie_mitchell itskorrttt yeah i m sorry i m ugly too gee
-1	rt cricket_country another six by suryakumar yadav mitchell johnson is stomping his way back kkr 53 2 after six overs kxipvskkr
-1	mitchell_lund congrats mate
-1	rt hoopinsider tabc 3a player of the year wendell mitchell igb_chuck rockdale http t co tnva09vyjn
-1	honestly don t know what i d do without mitchell
-1	mitchell recalled a memory as he laid down in bed catching the faint scent of anders on the sheets http t co qrixp6mahq
-1	i added a video to a youtube playlist http t co m80ximjtbd mike mitchell byzance extra dry dual cymbals
-1	itskorrttt sorry i m ugly jeez
-1	how was mitchell johnson completely dispatched by a 24 year old ipl2015 kkrvskxip
-1	rt jimmitchellgold natick ma shop now signature store mitchell gold bob williams 20 off 625 worcester rd rt 9 w ask for jim ht
-1	rt jimmitchellgold natick ma shop now signature store mitchell gold bob williams 20 off 625 worcester rd rt 9 w ask for jim ht
-1	a 1993 chevrolet c k 1500 series was just scanned near fort mitchell al 36856 http t co pa268hmek6 winacar vinny_scans
-1	rt jimmitchellgold natick ma shop now signature store mitchell gold bob williams 20 off 625 worcester rd rt 9 w ask for jim ht
-1	rt jimmitchellgold natick ma shop now signature store mitchell gold bob williams 20 off 625 worcester rd rt 9 w ask for jim ht
-1	rt jimmitchellgold natick ma shop now signature store mitchell gold bob williams 20 off 625 worcester rd rt 9 w ask for jim ht
-1	rt jimmitchellgold natick ma shop now signature store mitchell gold bob williams 20 off 625 worcester rd rt 9 w ask for jim ht
-1	rt jimmitchellgold natick ma shop now signature store mitchell gold bob williams 20 off 625 worcester rd rt 9 w ask for jim ht
-1	rt jimmitchellgold natick ma shop now signature store mitchell gold bob williams 20 off 625 worcester rd rt 9 w ask for jim ht
-1	rt jimmitchellgold natick ma shop now signature store mitchell gold bob williams 20 off 625 worcester rd rt 9 w ask for jim ht
-1	rt jimmitchellgold natick ma shop now signature store mitchell gold bob williams 20 off 625 worcester rd rt 9 w ask for jim ht
-1	rt hotfreestyle please report this page http t co 8exblxlzch
-1	shirlawjames fuckin mitchell brothers right there
-1	mlb 15 the show is pretty fun especially since me and my brother made our dream teams wish they would ve had randy johnson amp pete rose
-1	ipl punvskol kol 60 3 7 0 ovs gautam gambhir 11 15 yusuf pathan 0 1 mitchell johnson 1 0 15 0 need 96 r
-1	mitchaiden aiden mitchell wanna get 50o0 000 fifa 15 coins for free check this secret trick link on my profile
-1	rt lifeasstoner that comment tho http t co bzxovhvgdl
-1	had to drop 35 on jjallen33
-1	_mitchell_brown on it
-1	rt greysonchance praying for joni mitchell
-1	from nybooks the master writer of the city by janet malcolm http t co wa3utqbxyp
-1	rt matthewwgr foligno 25 20 flynn 16 17 larsson 14 16 stafford 37 43 mitchell 12 14 deslauriers 14 15 hodgson ahem uh 48 13
-1	only thing i m getting out of studying for exams in an addiction to iced coffee
-1	rt camilahauregui shay mitchell is such a beautiful person inside and out i m so in love http t co ssjyoc49si
-1	richardgordon48 was that paul mitchell commentating today maybe ask him who scored winner in the utd aberdeen semi final
-1	rt dtponcancer wai you might want to win this autographed andrew mccutcheon picture donated by rick mitchell at solar financial http
-1	louie_db9 lionsdenkxip best bowler in the world right now is mitchell starc we have the wrong aussie bowler at kings punjab
-1	mitchlg_77 people make mistakes mitchell lol
-1	all that i m after is a life full of laughter
-1	rt hotfreestyle darkskin with savage bars in the halls andybil_99 http t co yuujkxwolb
-1	hbd to my lover baileycoppedge ur awesome ily
-1	rt nicola_pye after all the planning it s in less than 24hours varsity 2015 bangors year aberuni vs bangoruni bringthetrophyba
-1	d3tt0l do a group chat again
-1	natick ma shop now signature store mitchell gold bob williams 20 off 625 worcester rd rt 9 w ask for jim http t co c9cbl4o3gy
-1	natick ma shop now signature store mitchell gold bob williams 20 off 625 worcester rd rt 9 w ask for jim http t co xqapuaotkp
-1	cliftonmurray mitchell_meganm willie_mitch33 enjoy clifton hope you reel in a biggie funinthesun lifeofarockstar
-1	mitchell_ness yankees that is a great photograph newyorkyankees yankees yankeestadium baseball mlb mlb espn cbssports
-1	_mitchell_brown yeah we do sort it out
-1	m_mitchell21 god bless the mitchell family oh my god i am in tears
-1	jacorey_fisher lol fuck no last time mitchell had to pay for his ass because i wouldn t
-1	mitchell johnson has been so bad for lionsdenkxip even last season but it got disguised somewhat because we reached the final
-1	rt drfc_official pd i thought mitchell lund was great on his full debut drfc
-1	sexstrology with a scorpio for sure
-1	suryakumar yadav hammers mitchell johnson for a couple of sixes kkr 58 2 6 2 overs vs kxip 155 9 kkrvkxip ipl
-1	mr_mitchell_2_u because that green lantern was trash they should ve let him take a stab with that too
-1	ipl seeing the way surya kumar yadav playing against mitchell johnson is absolutely delightful
-1	when man u playing like that and when mitchell johnson getting beat bout
-1	teamkxip with all due respect but mitchell johnson is total fail in this team need to replace him with sensible bowler
-1	rt cricketndtv ipl suryakumar yadav hammers mitchell johnson for a couple of sixes kkr 53 2 6 overs vs kxip 155 9 http t co buuh
-1	rt hoopinsider tabc 3a player of the year wendell mitchell igb_chuck rockdale http t co tnva09vyjn
-1	mitchell_lund you were excellent mate keep going the rb position could be yours next year
-1	hs baseball aaron brodnik hits a bases loaded single up the left field line scoring szalai and mitchell to make it 6 1 khscatsbaseball
-1	rt drfc_official coppinger26 says the main thing to come out of today s game is mitchell_lund s debut and he was outstanding drfc m
-1	muddafuggajones thanks mitchell
-1	rt hoopinsider tabc 3a player of the year wendell mitchell igb_chuck rockdale http t co tnva09vyjn
-1	the unofficial general mitchell international welcome dog mke http t co cb5nlczsrd
-1	eminem killed by m amp amp amp m matthew mitchell bitch i even have your initials bad guy
-1	rt lauracooops whyyyy do a not look like shay mitchell
-1	listen to rootsriders amp mitchell brunings top rankin by rootsriders np on soundcloud https t co dbr1mquisw
-1	ipl suryakumar yadav hammers mitchell johnson for a couple of sixes kkr 53 2 6 overs vs kxip 155 9 http t co buuhaikogm
-1	the thousand autumns of jacob de zoet a novel david mitchell good condition http t co leqp8rvkbu http t co 52p1ueqzeo
-1	antique school atlas maps mitchell over 600 maps geography exercises home school http t co dtqoip1eay http t co ftyeptanmg
-1	mitchell johnson is angry with suryakumar yadav yadav clips him for six iceman ipl kxipvkkr kxip kkr
-1	diamond in the rough attendee damarcus mitchell 6 6 so from memphis wooddale that has a bright future http t co ltwuaj1j6u
-1	let s go aggies btho miss state sec tennis george p mitchell tennis center tamu https t co e9j0ffxo69 http t co qfmuh7opjb
-1	rt abcfpll hey pll fans don t miss the pll summer premiere tuesday june 2 shay mitchell https t co 8rysk6amdt
-1	who the hell s yadav flicks it for six of mitchell johnson bravo kkrvskxip pepsiipl
-1	buzzing to get my first full league debut now the hard work starts drfc
-1	mr_mitchell_2_u until he saw all the money stan lee and then made a few years later
-1	mitchell s bad patch continues go kkr kxipvskkr
-1	georgia_pricee yes farrell especially was very good off the bench even though it wasn t for long
-1	two sixes of mitchell johnson nicely done s yadhav winitkkr
-1	fucktyler where do you get your inspiration from for songz
-1	rt _dcsports six suryakumar yadav treating mitchell johnson like any ordinary bowler what a shot http t co hlieolhves kxipvskkr ipl8
-1	six suryakumar yadav treating mitchell johnson like any ordinary bowler what a shot http t co hlieolhves kxipvskkr ipl8
-1	rt cricket_country another six by suryakumar yadav mitchell johnson is stomping his way back kkr 53 2 after six overs kxipvskkr
-1	whyyyy do a not look like shay mitchell
-1	drew gooden still getting paid to play basketball
-1	on assignment with cynthia woods mitchell center for the arts http t co 1sxjlh3oqv
-1	rt impact_index mitchell johnson s hallmark in t20s is his ability to constrict runs rather than taking wickets ipl2015
-1	greg mitchell eric_ulrich s rep said they ll know around next month when they can introduce legislation re illegal signs i hope soon
-1	antique school atlas maps mitchell over 600 maps geography exercises home school http t co wnw4vnp1y0 http t co dyc0rbossw
-1	here we go https t co ubzekdw8t0
-1	rt wadespeters maia mitchell is so hot i wanna date her
-1	rt bhaleraosarang what audacity from suryakumar yadav hits mitchell johnson for a huge six over fine leg kxipvskkr
-1	rt imabhishek_ suryakumar yadav won t stop take that mitchell johnson kkr ipl
-1	antique school atlas maps mitchell over 600 maps geography exercises home school http t co 4vykmix1cz http t co xdf12oerk7
-1	rt agentsofshield wishing luke mitchell a very happy birthday from marvel s agentsofshield http t co 6cjfkk8gyy
-1	mr_mitchell_2_u who was first
-1	surya_14kumar wat a shot for six and that too of mitchell johnson ipl2015 ipl kkrvskxip
-1	natick ma shop now signature store mitchell gold bob williams 20 off 625 worcester rd rt 9 w ask for jim http t co 0fmqixsbxb
-1	natick ma shop now signature store mitchell gold bob williams 20 off 625 worcester rd rt 9 w ask for jim http t co wvjco2foou
-1	rt _ianbeale_ phil mitchell just said he s voting ukip so i got the bald cunt in a classic beale headlock pussy cried bealed
-1	mitchell johnson is bowling like a bullet at 145 5 kmph but the player s of kkr have worn a shield or what kxipvskkr pepsiipl
-1	rt cricket_country mitchell johnson is the new batsman for kxip kxipvskkr
-1	rt jackmckay96 massive well done too mitchell_lund on his start today played unreal drfc
-1	mitchell johnson s hallmark in t20s is his ability to constrict runs rather than taking wickets ipl2015
-1	mitchdaabiitch eastarwars u think i havent already watched it 3 times and watched ign s break down of it cuz u would be wrong mitchell
-1	surya kumar yadav sign first ball to him from mitchell jhonson with sixer what a lovely shot ipl
-1	rt holdingwilley mitchell johnson finally into the attack kxipvkkr
-1	the thousand autumns of jacob de zoet a novel david mitchell good condition http t co uulw2tg5lw http t co wx84xoj58c
-1	mitchell_darel you want a cookie for picking all the high seeds to win
-1	rt twittvenkat kolkata keep finding the boundary and bailey turns to mitchell johnson kxipvskkr
-1	jeremyclarkson the man
-1	rt holdingwilley lovely little big six off mitchell johnson from suryakumar yadav kxipvkkr
-1	d3tt0l me you and keeley need to have a catch up we never did arrange it
-1	mitchell_lund well played today the first of many more appearances i m sure
-1	antique school atlas maps mitchell over 600 maps geography exercises home school http t co k3yde3m0bb http t co xlf3tzrp6c
-1	nba celtics arena vintage nba boston celtics pistol pete maravich mitchell and ness hardwood http t co k49vxxvxgj basketball deals
-1	rt twittvenkat kolkata keep finding the boundary and bailey turns to mitchell johnson kxipvskkr
-1	rt beautifulbzarre kirsty mitchell coming in issue 009 of beautifulbizarre photography fineartphotography artbook http t co dnhlrk
-1	i liked a youtube video from jtgoeslive http t co wtqneuvqya draw my life jake mitchell
-1	please keep the mitchell lathan family lifted in prayer
-1	antique school atlas maps mitchell over 600 maps geography exercises home school http t co dfotisiiol http t co 1mcjueqbsz
-1	kellieannem83 kelly mitchell wanna secret to get 100 amazon gift card check the secret trick on my bio profile
-1	mr_mitchell_2_u but wasn t snyder an understudy of nolan
-1	what audacity from suryakumar yadav hits mitchell johnson for a huge six over fine leg kxipvskkr
-1	suryakumar yadav won t stop take that mitchell johnson kkr ipl
-1	lovely little big six off mitchell johnson from suryakumar yadav kxipvkkr
-1	rt rtorfav_1 requested rt for beca mitchell fav for jessica stanley http t co nakijlsmlt
-1	i have an aquarius rising https t co gdsltgd9ri
-1	rt drfformulator new drfpod shared belief ph races john doyle on mike mitchell ky derby http t co yzzfacb3z4 carsoniph bernier_
-1	massive well done too mitchell_lund on his start today played unreal drfc
-1	rt bendallcallie shay mitchell does it best http t co wnlf48masb
-1	rt smackhighfl mitchell softball plays thursday at chambo and vs the lady chiefs oh god that game won t be pretty smack chiefs
-1	rt pixts maia mitchell for oyster magazine http t co skwptwafka
-1	mitches ain t shit but guys named mitchell
-1	rt smackhighfl mitchell softball plays thursday at chambo and vs the lady chiefs oh god that game won t be pretty smack chiefs
-1	rt hotfreestyle i ain t tryna be a father dopelikeblaze http t co bqyi8j6vbl
-1	5 of 5 stars to like a flower in bloom by siri mitchell https t co 9bit0irbth
-1	joni mitchell amp joan didion
-1	kacex a billy mitchell le gusta esto http t co bthhtnqf52
-1	came out the mitchell library and someone just asked me the way to the nearest tobacconist is that a word people still use
-1	joni mitchell s performance of woodstock http t co 4izsptv43l via purpleclvr
-1	mitchell come and this is time for gambhir to get back to pavilion livepunjabiplaypunjabi
-1	hi mitchell in vail arizona gt gt earn up to 75 percent in your community be a city promoter
-1	my brother is only in 4th grade and he already has girls claiming him
-1	rt humberlaunch would you attend a humberlaunch event complete the survey for a chance to win a 25 gift card http t co jjmrxzpu4g htt
-1	rt _dcsports mitchell johnson into the attack can he work some magic for kxip http t co hlieolhves kxipvskkr ipl8
-1	antique school atlas maps mitchell over 600 maps geography exercises home school http t co kg7bnu699s http t co 28fk0oysks
-1	mich mitch mitchell michael mike mikey mike n ikes mick mickey mickey mouse mickeroony aye yo mika http t co ndyl74f7sm
-1	mitchell johnson into the attack can he work some magic for kxip http t co hlieolhves kxipvskkr ipl8
-1	amomblogs mitchell and nora were meerkating at the same time but you both have to show the other on a pc
-1	what up doe
-1	mitchell johnson finally into the attack kxipvkkr
-1	redmitch my bad how many phone chargers has brandon mitchell lost
-1	vashawn mitchell promises http t co gpvy7oy9fy nowplaying listenlive
-1	mr_mitchell_2_u you gotta admit he kinda saved them so maybe he felt he deserves some level of respect lol
-1	rt hotfreestyle bruh he freestyling at school http t co iusdy6sbbi
-1	you know mitchell mmm yes http t co hubo2lveoy
-1	shay mitchell c une bombe putain
-1	antique school atlas maps mitchell over 600 maps geography exercises home school http t co lnolhijzuh http t co 32fceokq7b
-1	kings xi have their tails up in the field now surely time to bring on mitchell johnson and try to expose the middle order 38 2 5
-1	hey senjohnthune greggharper mitchell amp nancy t of az wants you to support netneutrality not big cable
-1	kolkata keep finding the boundary and bailey turns to mitchell johnson kxipvskkr
-1	collectible buzz miami heat mens nba mitchell amp ness current jersey hat cap adjustable one size http t co vlf6rnndfh auction cheap
-1	nba basketball miami heat mens nba mitchell amp ness current jersey hat cap adjustable one size http t co naotlalkl2 goods forsale
-1	l collectibles buzz mitchell amp amp ness anthony a train thomas chicago bears rare jersey 52 ebay auction http t co dwfpciywr9
-1	rt hotfreestyle straight savage http t co wllg8fe8l5
-1	rt radastrology the signs as foreign words amp their meanings http t co qlp4vpidoq http t co i5w9yjcauh
-1	rt bombshellbf this is 150 me http t co ly1c2krzaf
-1	rt intrinsicmusic looking forward to meeting and singing with info_edward and the sfjazzcollectiv at the gala for joni mitchell at sf
-1	antique school atlas maps mitchell over 600 maps geography exercises home school http t co nbgvvkhgkb http t co npgvllcv4e
-1	mitchell_blythe 100 as long as we keep playing at the high standard we have been recently having baritt amp faz amp brits back a huge boost
-1	rt opstreetstyles shay mitchell http t co hyhz4doiv6
-1	mr_mitchell_2_u salty for what tho
-1	rt intrinsicmusic looking forward to meeting and singing with info_edward and the sfjazzcollectiv at the gala for joni mitchell at sf
-1	rt naarpr why the city of chicago does not want you to see video of police killing laquan mcdonald http t co 4zckzbjx7p
-1	rt smackhighfl mitchell softball plays thursday at chambo and vs the lady chiefs oh god that game won t be pretty smack chiefs
-1	natick ma shop now signature store mitchell gold bob williams 20 off 625 worcester rd rt 9 w ask for jim https t co wfovm8hjmy
-1	natick ma shop now signature store mitchell gold bob williams 20 off 625 worcester rd rt 9 w ask for jim https t co 9op0ufq7qz
-1	busbybulletin watching the game at mitchell s v amp amp a waterfront cape town mufc http t co ytiqosgjty great place to be enjoy
-1	rt wadespeters maia mitchell is so hot i wanna date her
-1	thank you mitchell m_floch12
-1	build your personal brand with marketing blogger speaker and author justice mitchell http t co q8junbfqjq
-1	rt bryannmalfoy maia mitchell is so
-1	rt sydney_komlenic maia mitchell is so beyond perfect
-1	antique school atlas maps mitchell over 600 maps geography exercises home school http t co p0bh2uglsd http t co kiuwhndc8n
-1	do u ever get in that i love shay mitchell and i don t care who knows it mood bc me rn
-1	ideas for building and living well in less than 400sq feet by ryan mitchell http t co kgzmmdet4x http t co 2gh8njt5sr
-1	simply introducing new products is not the answer to unintended pregnancy mitchell creinin md womenshealth2015
-1	cop that before it s extinct toronto raptors nba mitchell amp ness style baseballcap snapback https t co d2phc0jji8
-1	what a crowd at this raps game
-1	natick ma shop now mitchell gold bob williams newest signature store natick ma https t co uqnmiy1pej
-1	natick ma shop now mitchell gold bob williams newest signature store natick ma https t co melztpxlvu
-1	joni mitchell and judy collins hanging out in a laurel canyon tree house http t co bqwasvbrbu
-1	leya_mitchell fuck
-1	rt shealeparoux glad he s remembered for what s important article horse trainer mike mitchell was the ultimate family man http t co uw
-1	antique school atlas maps mitchell over 600 maps geography exercises home school http t co f5sczonc6h http t co egpj9u8led
-1	team must learn lessons mitchell worcestershire captain daryl mitchell says that they must learn their lessons http t co innl9waj7h
-1	rt hotfreestyle mac millers first ever recorded freestyle http t co rr9w2rtrdh
-1	rt dipaola_joe productive meetings tom mathews bill mitchell scott childress amp 650 wfg tfa associates the wealth wave http t co 7ot
-1	rt agentsofshield wishing luke mitchell a very happy birthday from marvel s agentsofshield http t co 6cjfkk8gyy
-1	rt camilahauregui shay mitchell is such a beautiful person inside and out i m so in love http t co ssjyoc49si
-1	really isn t my week at all so depressed
-1	rt relateable2you this is the cutest thing ever http t co lsc9b6low0
-1	mr_mitchell_2_u were they trying to get him to do jl
