-1	rt kkrofficial after axar patel it s time for mitchell johnson andre russell starts the over with a four kkr kkrvskxip
-1	rt kkrofficial after axar patel it s time for mitchell johnson andre russell starts the over with a four kkr kkrvskxip
-1	rt kkrofficial after axar patel it s time for mitchell johnson andre russell starts the over with a four kkr kkrvskxip
-1	rt kkrofficial after axar patel it s time for mitchell johnson andre russell starts the over with a four kkr kkrvskxip
-1	rt kkrofficial after axar patel it s time for mitchell johnson andre russell starts the over with a four kkr kkrvskxip
-1	after axar patel it s time for mitchell johnson andre russell starts the over with a four kkr kkrvskxip
-1	rt gayathomedad visiting a busy playground is the best form of birth control
-1	mitchell johnson looks bored ipl kkrvskxip
-1	haydostweets ipl iamyusufpathan kkriders lionsdenkxip kxip no yorkers from mitchell j not even try a yorker
-1	rt carolleemiller for great art follow these tweeps ismoraisanen austingal55 mgdigital reidsart ip_mitchell joancarroll photog
-1	what the fuck is mitchell johonson doing what mitchelljohnson c mon
-1	mitchell_lund quality today mitchell you played amazing
-1	jeff mitchell mink ranch named business of the year at chamber of commerce awards it s always a surprise who http t co uu6hspgtw1
-1	rt roflindian ours is a truly forgiving nation mitchell johnson ripped out our pants in the world cup amp yet here we are extending him 5
-1	after axar patel it s time for mitchell johnson andre russell starts the over with a four kkr kkrvskxip
-1	mitchell_lund impressive debut you can make it your own
-1	rt _ianbeale_ phil mitchell just said he s voting ukip so i got the bald cunt in a classic beale headlock pussy cried bealed
-1	rt thornysterling lgbt community centers http t co uznimhfctp lgbtqpushback mmromance amreading charity http t co b5e4tpntpv
-1	rt mrdavidboberesq restored b 25 mitchell bombers taking off from uss ranger during 1992 s 50th anniversary of the 1942 doolittle raid h
-1	ipl punvskol kol 107 5 13 1 ovs andre russell 42 23 yusuf pathan 4 10 mitchell johnson 2 1 0 28 0 need
-1	rt _ianbeale_ phil mitchell just said he s voting ukip so i got the bald cunt in a classic beale headlock pussy cried bealed
-1	my big boy corbin mitchell https t co a52nzyjoxw
-1	rt roflindian ours is a truly forgiving nation mitchell johnson ripped out our pants in the world cup amp yet here we are extending him 5
-1	rt flowrjpg crying bc of how amazing ems__mitchell and igniting_faith are for the encouragement after that death test
-1	flowrjpg ems__mitchell you re the one that just showed that test who was boss sooo
-1	large map plan of boston 1868 original hand colored mitchell map 12 50 x 15 25 http t co nloeav8nyn http t co cmpwj2hskx
-1	conundrum be content with the friendship we have or risk losing it by seeking intimacy
-1	lancers 0 cougars 3 top 2nd 0 out 0 balls 0 strikes no one on p 3 mitchell patterson b 12 colton ferrand
-1	mr_bluesky87 dog shit would rather watch peggy mitchell getting slammed out by my dad utv avfcofficial
-1	rt floydszn couldn t ask for a more beautiful day
-1	rt turtlelegzz what happened to love mitchell
-1	bluebonnet festival drive http t co z3ggrqvu5f
-1	rt roflindian ours is a truly forgiving nation mitchell johnson ripped out our pants in the world cup amp yet here we are extending him 5
-1	there is no cosmetic for beauty like happiness maria mitchell quote showawesomeness
-1	mitchell_pinney sweet
-1	check real estate agency peter mitchell homes information pack provider address 94 high st lowestoft http t co gjzfylnwtq peter
-1	rt biilionaires retweet and you ll find money tomorrow http t co ihfmewizsw
-1	kylermelson paul mitchell
-1	rt comethproject thank you to everyone that joined mitch s march today rest in peace mitchell http t co 6zqvdj5ew4
-1	rt baernmunich we don t need hazard griezmann we have mitchell weiseeeeeeeer
-1	there is no cosmetic for beauty like happiness maria mitchell quote
-1	rt authorkcburn lgbtq push back charity giveaway it s not about pizza it s about human rights enter now http t co x1cryy6gha
-1	rt tomjunod powellnyt edcaesar her review of the mitchell bio is a textbook exercise in burying the lede a freudian textbook that i
-1	badgerh531 just now mr b in mitchell lib aye write http t co ctphydfcv8
-1	girls who get mad when their boyfriend compliments another girl are fucking stupid yes he s just trying to be http t co xgkwih1g2b
-1	flowrjpg igniting_faith awwwh but you re the amazing one
-1	i liked a youtube video from ucdprehealth http t co gevsteueeu introduction to osteopathic medicine r mitchell hiserote d o
-1	how can i just be getting worse no improvement this is all for nothing
-1	4 x garcia mitchell 300 301 reel spool spindle repair parts used good france http t co nt1ei84cfl http t co 7yjvquxmdc
-1	rt flowrjpg crying bc of how amazing ems__mitchell and igniting_faith are for the encouragement after that death test
-1	mitchell_rossco come back man we miss you and we got more cinnamon toast crunch
-1	woodstock by joni mitchell is just i have no words for how profound and wonderful this song is
-1	rt brandonclaypsb per shun williams fr devin mitchell is at georgia st this weekend potential destination after alabama d_mitch23 h
-1	rt roflindian ours is a truly forgiving nation mitchell johnson ripped out our pants in the world cup amp yet here we are extending him 5
-1	crying bc of how amazing ems__mitchell and igniting_faith are for the encouragement after that death test
-1	we don t need hazard griezmann we have mitchell weiseeeeeeeer
-1	thank you to everyone that joined mitch s march today rest in peace mitchell http t co 6zqvdj5ew4
-1	i do it all in moderation
-1	antique book general view of the world by s augustus mitchell estate book http t co 49jzwrtam7 http t co 1e5nsapkc5
-1	reports of donovan mitchell s play at jordan regional prove what i already know snubbing him from the national game amp mcd game was a crime
-1	delarollsumm nah iont rock with the mitchell wave rather grab a dada or mecca piece from the thrift
-1	rt hotornot_4 rt for lily collins fave for shay mitchell http t co ndjvtkcus8
-1	dallas mavericks nwt mitchell amp ness womens royal blue dallas mavericks vintage look hoodie l http t co 1inped9a3p nba collectibles
-1	georgia_pricee yeah especially saints next week should be a huge game
-1	surprised how well liammandeville amp mitchell_lund handled themselves decent players
-1	ams legislative team leaders david wroten scott smith jd michael mitchell jd and laura hawkins honored for http t co ierkeff8zf
-1	fucking young http t co ckjcmurtpq
-1	jhsalazar92 where your mitchell amp ness jersey tho
-1	i added a video to a youtube playlist http t co nzs3qtjzm0 mike mitchell time is now
-1	great crowd 4 parren mitchell mansion in west b more humbled to join keiffermitchell cfantoniohayes druid_heights http t co gnmmk1i1xj
-1	rt roflindian ours is a truly forgiving nation mitchell johnson ripped out our pants in the world cup amp yet here we are extending him 5
-1	fifth model done hairbygloria makeupbygloria lovewhatido paul mitchell the school raleigh https t co iirv06gx3l
-1	rt pixts maia mitchell for oyster magazine http t co skwptwafka
-1	i really want a kebab but i can t be arsed to get in my car and go get one
-1	rt fronz1lla i got to hang out with some quokkas today retweet if this makes you smile http t co 0kjssuuoma
-1	nickguyone fucktyler favorite joni mitchell song
-1	this afternoon has been a mixture of good and bad haircut went slightly wrong as i m now sporting a phil mitchell cut
-1	rt aathabs a very optional practice today prust gallagher mitchell weise petry galchenyuk emelin subban gilbert markov and pric
-1	ceddyevina mitchell_lund my eyes are in bits watchin that shower
-1	rt fwildecricket kxip could do worse than open with mitchell johnson today they need early wickets ipl kxipvkkr kkr
-1	rt jaegersports there they are again mitchell family coming thru big time again thx can t believe it s already out si https
-1	rt roflindian ours is a truly forgiving nation mitchell johnson ripped out our pants in the world cup amp yet here we are extending him 5
-1	rt _hafees in ipl 8 ashish nehra gt mitchell johnson ipl csk kxip
-1	rt usc_baseball eureste leads off the t1 with a double to rf and wheatley walks goldfarb 2 on nobody out in the t1 for mitchell tolman
-1	rt roflindian ours is a truly forgiving nation mitchell johnson ripped out our pants in the world cup amp yet here we are extending him 5
-1	now ministering vashawnmitchell vashawn mitchell god my god http t co vbz8k0rhl5
-1	rt roflindian ours is a truly forgiving nation mitchell johnson ripped out our pants in the world cup amp yet here we are extending him 5
-1	int career ended way too early well done sir a legend in my book despite being an aussie p drew_mitchell bryanhabana giteau_rugby
-1	this really sucks
-1	rt roflindian ours is a truly forgiving nation mitchell johnson ripped out our pants in the world cup amp yet here we are extending him 5
-1	i have just sponsored kate mitchell running the l marathon for asthma uk http t co w9hltp3v0b
-1	http t co ccv0jic1vf pepsiipl ipl punvskol kol 73 5 10 4 ovs andre russell 10 9 yusuf pathan 3 9 mitchell johnson 1 4 0 20
-1	rt dancer_caleigh too much fun at hankinsashlee sweet sixteen birthday party last night love all these girlies so much http t co 2y6
-1	rt bostonred88 it s not always easy to be a joni mitchell fan but her illness devastates me linda grant http t co b7jsuhrebk
-1	rt rock_roll_pics eric clapton john lennon keith richards and mitch mitchell in 1969 http t co hwpygq2rc6
-1	rt haydn_gray chaddiddychad im biting because the level of delusion is funny
-1	rt wwiifoundation 73 years ago today 80 men did something incredible aboard 16 b 25b mitchell bombers 2 of the 80 are left jim http
-1	rt yepillposts cutest thing i ve seen all day http t co nwugkwyfnf
-1	richardbuxton_ simply bizarre reasoning
-1	ours is a truly forgiving nation mitchell johnson ripped out our pants in the world cup amp yet here we are extending him 5 star hospitality
-1	our moneymen went through every bill in mitchell s wallet and house less than 100 pounds and about the same in euros and dollars
-1	i_am_molnar mitchell in goal
-1	dr mitchell where are you
-1	rt wwiipix the 16 b 25 mitchell bomber crews of the doolittle raid all 80 men volunteered for the top secret mission ww2 http t co o
-1	mitchell_lund well done lad
-1	mitchell_lund congrats brother
-1	ms mitchell literally my type a nigga never dropped out of band when she became the director
-1	this afternoon has been a mixture of good and bad haircut went slightly wrong as i m now sporting a phil mitchell cut
-1	143_brielle mac_bz mitchell
-1	rt ciatto_hannah everyone vote osceolas very own lindsey hall for her winning hit over mitchell for district champs https t co fvh5rsxq
-1	rt eastendersultra being bad with phil mitchell eastenders https t co qxucaxzwrf
-1	fashion x austin austinfashionweek stars outfits on kara dress by abi ferrin bag by allison mitchell earrings http t co j9kvo79anh
-1	trousdale 8 ehs 2 top 5th 0 out 0 balls 0 strikes no one on p 9 mitchell burris b 1 brady durham
-1	shay mitchell is actually mint
-1	bennett_lehner yeah i will
-1	domination of that first half classic mourinho mufc
-1	morin_mitchell why am i laughing so hard at this
-1	jarodwills23 trust him the buzzing cunt wheresmybagbutt
-1	rusherslovebtr logan mitchell
-1	the keith mitchell daily is out http t co 9omtqdbacf stories via nflfantasy bhattidaud
-1	my best rts this week came from js_digest indiecoderdanny jondevbot mitchell_mike thanksall who were yours http t co tjssq4frye
-1	thatredneckfuck oh iight cause i m goin to wake with mitchell
-1	rt _hafees in ipl 8 ashish nehra gt mitchell johnson ipl csk kxip
-1	rt jackmckay96 massive well done too mitchell_lund on his start today played unreal drfc
-1	rt camilahauregui shay mitchell is such a beautiful person inside and out i m so in love http t co ssjyoc49si
-1	mitchell_boyce nah clonkers that is spewy
-1	man earlier this morning i was reminded of ms mitchell that s actually my wife i must go back for her
-1	s0phiesm1th where you at the on group chat
-1	jarodwills23 fucked you are butt
-1	in ipl 8 ashish nehra gt mitchell johnson ipl csk kxip
-1	pepsiipl ipl punvskol kol 73 5 10 4 ovs andre russell 10 9 yusuf pathan 3 9 mitchell johnson 1 4 0 20 0 need 83 arslannaseem6
-1	i attended a meeting of the mitchell linden civc association this morning
-1	tam i ll sub you for tonight since you re skint eh pure love matty mitchell what a guy
-1	mitchell_boyce every game is different butt should know that and aye hahah still loving it see
-1	rt opstreetstyles shay mitchell http t co hyhz4doiv6
-1	rt keith247sports evander holyfield with son 4 star rb elijah holyfield at auburn today http t co zntooytdws
-1	the rec centre is absolutely packed today so many kids at this swim meet
-1	paul mitchell salon is my favorite now because they give out wine
-1	new shay mitchell http t co nb66os7lpe celebrity nsfw http t co thzqgb7nau
-1	deandraduggans suitenation i love marvin gaye and i love this such fresh art
-1	rock garden sale happening now to 3 pm in mitchell hall free with botanic admission rmrockgarden
-1	jarodwills23 will you fuck you reckon you ll beat arsenal just after they smashed you 4 1 can tell you had a good smoke last night boy
-1	my lil girl has turned into my lil lady kennedy mitchell 2015 http t co u1w50b1zdo
-1	ipl punvskol kol 73 5 10 4 ovs andre russell 10 9 yusuf pathan 3 9 mitchell johnson 1 4 0 20 0 need 83
-1	54 walking horses rescued found living in filth according to reports mitchell has prior convictions for cru http t co pgxohrjjqr
-1	54 walking horses rescued found living in filth according to reports mitchell has prior convictions for cru http t co 0jewcfclb3
-1	just chill with the eggs yo lol ucdavis picnicday https t co xrmylamtip
-1	joni mitchell queso you
-1	rt j_guapo16 prom with my date is gonna be fun
-1	mitchell_11_11 ryan_keszeg dang your hands are dirty
-1	rt colinmccredie excellent talk from alanmccredie d_gray_writer in the gorgeous mitchell library ayewrite http t co ubcf7rmh4c
-1	so starving any body wanna bring me food i ll pay u
-1	mitchell aw come on bullshit
-1	rt brandonclaypsb per shun williams fr devin mitchell is at georgia st this weekend potential destination after alabama d_mitch23 h
-1	my good afternoon post wussup and good glorious saturday afternoon to everybody i hope that you re so far are http t co cusnot3dqo
-1	pepsiipl ipl punvskol kol 68 5 10 1 ovs yusuf pathan 2 8 andre russell 6 7 mitchell johnson 1 1 0 15 0 need 88 r arslannaseem6
-1	ayewrite this is scotland dan gray loves aye write as there s blood on the mitchell steps
-1	when the price of crayons goes up so you need to get a job http t co rss2kfbdyk
-1	mitchell_boyce aye dw mun we ll have the fa cup instead
-1	rt nobodizperfekte peter mitchell http t co nybtmw4r99
-1	mitchell_pinney thanks man will you be at the game tonight
-1	rt pixts maia mitchell for oyster magazine http t co skwptwafka
-1	rt m_summs kids playing basketball in castle hills are you mickey mitchell me yes yes i am
-1	rt l6loretta85405 joni mitchell s condition improving
-1	jarodwills23 we will not getting top 4 wether you beat them or not anyway
-1	l fan apparel chicago whitesox xl gray mitchell amp amp ness hustle play henley shirt souvenirs deals http t co 7r9roaoero
-1	l baseball nba authentic mitchell ness m amp amp n newyork knicks blue osfa snapback hat cap onsale discount http t co m3ilq8ifni
-1	listen now vashawn mitchell vashawnmitchell greatest man on http t co 17n9kmcc3v ccm amp gospel together on the same station
-1	kids playing basketball in castle hills are you mickey mitchell me yes yes i am
-1	jayde__mitchell herooftwilight i work at gc now so i ve played every pedal we carry and i think the xotic stuff is the best
-1	mu tolonglah yee help me by joni mitchell https t co qeioygivei
-1	im fucki ng crying why is this on my tablet http t co lwmwlbu2g2
-1	enjoli_mitchell sexy and smooth and strong and smart and attractive
-1	mitchell_boyce we ll see when we play them then
-1	rt brandonclaypsb per shun williams fr devin mitchell is at georgia st this weekend potential destination after alabama d_mitch23 h
-1	ipl punvskol kol 68 5 10 1 ovs yusuf pathan 2 8 andre russell 6 7 mitchell johnson 1 1 0 15 0 need 88 r
-1	hanna__mitchell thanks nig
-1	saw paul mitchell at the hotel guess he was waiting for dele
-1	rt jeffgreer_cj louisville signee donovan mitchell was 12 of 19 for 30 points and had nine steals in the regional jordan brand all star g
-1	jarodwills23 haha be 4 0 by now if they we re playing liverpool
-1	boise state singles lineup 1 patton 2 tenreiro 3 mitchell 4 foley 5 hewko 6 roskilly
-1	maia mitchell everybody http t co apjccfenha
-1	gotye somebody that i used to know feat kimbra official video https t co zf5wd31i8m v a youtube
-1	chris__mcardle unbelievable man
-1	paige courtright single but nothing else for mitchell seymour 18 0 thru 4
-1	randallishere mitchell s on beltline
-1	rt amnestyscotland we re here at mitchell library glasgow with ayewrite for our imprisoned writers event publish and be damned moir
-1	just want to say a huge thank you to cameron coles for the last 2 nights at work you have been an absolute http t co lhw4ppgqak
-1	herooftwilight frankharvey ep booster where s the keeley katana
-1	unique magical playground opens today mitchell park https t co fvvxwk3bju
-1	broncos take the doubles point 2 0 results 1 roskilly tenreiro w 6 2 2 patton mitchell w 6 1 3 foley hewko up 5 2 dnf
-1	rt _ianbeale_ phil mitchell just said he s voting ukip so i got the bald cunt in a classic beale headlock pussy cried bealed
-1	i have 2 nerf guns if anybody wants to come battle me
-1	fucktyler if you could only listen to one record on repeat forever what would it be
-1	what if michael s name was mitchell
-1	by far https t co usaiswsioc
-1	joseph beuys felt suit amp portrait at mitchell innes amp nash madelooksat art chelsea https t co z2xdaoix5a
-1	rt eastendersultra being bad with phil mitchell eastenders https t co qxucaxzwrf
-1	peopleruin brittanyhunter_ this is what high school girls chant for fun these days geez
-1	calm down falcao before someone puts you in the stand
-1	jpup7 theepaultee it really does tho
-1	agreed pawboy2 a whole sorry generational tale in the first 2 sentences of this article about joni mitchell http t co nyvx1mihrs
-1	up next at risetour2015 in dc candace mitchell of myavana stemgurl techstartup womenintech blackbeauty
-1	up next at risetour2015 in dc candace mitchell of myavana stemgurl techstartup womenintech blackbeauty
-1	undeserved from chelsea crap
-1	rt hotspurrelated pochettino he paul mitchell knows the profile of the players that i need to develop my philosophy that is an advan
-1	jpup7 3__mitchell thefunnyvine hahaha that s what s up
-1	rt robinarmstrong4 i love the character grant mitchell plays in ross kemp on gangs
-1	rt _scarlettlee amisi1 from 0 to phil mitchell you know http t co usglkfvfn0 crying hahahahahahaha
-1	_maelynnjohnson happy early birthday
-1	rt nobodizperfekte peter mitchell http t co nybtmw4r99
-1	rt gallerymitchell the mitchell gallery is open today for croquet2015 take a break from the sun to view the stunning ahmet erteg n h
-1	moontowerr knew that was coming
-1	you kan be in the hood all day but if you ain t gettin no money what s the point
-1	rt amnestyscotland we re here at mitchell library glasgow with ayewrite for our imprisoned writers event publish and be damned moir
-1	shay mitchell commented on a photo of selena http t co tgufeqqnvm
-1	2 of 5 stars to the thousand autumns of jacob de zoet by david mitchell http t co sj3y0duonk
-1	rt jpup7 reminds me of my coach theepaultee swear lol look 3__mitchell https t co maalspjb9t
-1	rt mitchellreports un security council was moved to tears after hearing accounts of chlorine attacks in syria http t co bu4jmorqys
-1	now everyone tell flowrjpg how amazing she is because she survived through the act
-1	souvenirs mens philadelphia phillies mitchell amp ness wool leather jacket 5xl 64 msrp 650 http t co yczqywlbsd fan apparel
-1	mitchell_blythe and i m a firm believer he will deliver huge couple of weeks left for us in regular season
-1	shay mitchell http t co hw1ymv2v3r
-1	we re here at mitchell library glasgow with ayewrite for our imprisoned writers event publish and be damned moiradunworth
-1	austingal55 ismoraisanen mgdigital reidsart ip_mitchell joancarroll you re welcome cj a twerp you re not
-1	terminally ill fundraiser simon mitchell 44 stole a laptop phone and satellite navigation system from donna s dream house a charity
-1	averee_mitchell girlposts at the mall
-1	reminds me of my coach theepaultee swear lol look 3__mitchell https t co maalspjb9t
-1	rt granburyisd mitchell may a member of the pirate basketball team signed a letter of intent to play at letourneau university http
-1	joseph beuys iconic sled at mitchell innes amp nash madelooksat art chelsea https t co huez4xkzaj
-1	rt sensualgifs it s weird when you realize the person you once told everything to now has no idea of what s happening in your life
-1	being bad with phil mitchell eastenders https t co qxucaxzwrf
-1	switzerland now on a 5 on 3 pp for 1 17 mitchell stephens for slashing
-1	crazy is loyal
-1	rt austingal55 carolleemiller ismoraisanen mgdigital reidsart ip_mitchell joancarroll thanks carol and for not calling me a twer
-1	cool as a cucumber
-1	rt letumbb welcome to the yellowjacket family mitchell may mitchell was the district 8 5a defensive poy for granbury hs http t co toq
-1	rt brandonclaypsb per shun williams fr devin mitchell is at georgia st this weekend potential destination after alabama d_mitch23 h
-1	rt missmartin30 960 come on guys u what to do https t co icnetav8eo xx
-1	great joseph beuys show at mitchell innes amp nash madelooksat art chelsea https t co chtqjiyxm1
-1	georgia_pricee yeah i saw he renewed his contract big things expected of him now
-1	shay mitchell s house
-1	carolleemiller ismoraisanen mgdigital reidsart ip_mitchell joancarroll thanks carol and for not calling me a twerp
-1	ho aggiunto un video a una playlist di youtube http t co cw0aj0vxnd joni mitchell ladies of the canyon 1970 full album
-1	rt chelseafc goal 1 0 hazard cfclive
-1	hazarddddd
-1	rt normanicuddles shay mitchell is such a wonderful gorgeous human being inside amp out http t co rj8ytgbvkn
-1	president mitchell seems to have stonewalled it up tothis point unintelligible talked huh
-1	shay mitchell shailene demi ariana https t co qiwqed9xqq
-1	everyone vote osceolas very own lindsey hall for her winning hit over mitchell for district champs https t co fvh5rsxqki
-1	mitchell 908 3310 4410 spool spindle http t co bogeloreyf http t co exr1kyccv5
-1	hazard is on another level
-1	jordan high school varsity lax 1 broughton 1 by mitchell schneider 1st 7 42 jhslax lacrosse nclaxscores jhsfalconslax jhslax
-1	mitchell allard of wyoming is second this is his second appearance in the finals and first since 2012 hoopshoot
-1	that s my boi congrats man columbianplayoftheweek bennett_lehner http t co rcr6qmdt3j
-1	kelsie_mitchell marisa_heinecke neither of you
-1	rt maggieferrel someone tell mitchell that i m the original patrick star
-1	mitchell_lund quality bro well done xx
-1	six suryakumar yadav treating mitchell johnson like any ordinary bowler what a shot http t co nq6o4jhe4i newsintweetsindia
-1	rt brandonclaypsb per shun williams fr devin mitchell is at georgia st this weekend potential destination after alabama d_mitch23 h
-1	rt opstreetstyles shay mitchell http t co hyhz4doiv6
-1	mitchell_blythe i fully agree we all seen what he did for the lv cup team absolute class act he is chuffed he s staying with sarries too
-1	knicks clothing new york knicks mitchell and ness official nba snapback baseball hat cap 1 size http t co unqluiwhia ebay auction
-1	kolkata keep finding the boundary and bailey turns to mitchell johnson kxipvskkr venkata http t co 2n2dronsmb newsintweetsindia
-1	nfl 49ers apparel size 48 mitchell and ness red ronnie lott 49ers jersey http t co idn7ws94b4 souvenirs deals
-1	rt thefunnyvine goals http t co eybpqoo1n9
-1	velvetgh0st can you film a celebrity inspired makeup look like vanessa hidgens selena gomez or shay mitchell
-1	mitchell_lund well done bro
-1	mitchtilley1 exposure_bb exposuregiles nesevent katsolleyx oh mitchell
-1	mitchell johnson into the attack can he work some magic for kxip http t co wurkh7rlz9 http t co omi6fkiul1 newsintweetsindia
-1	mitchell isn t okay
-1	rt bleacherreport let s go nbaplayoffs http t co 1lasrylxmg
-1	mitchell 302 303 402 403 bushing http t co rieha2ahdc http t co byeifjj072
-1	helping out our newest client the whiskey with an emergency weekend delivery to get them open welcome to the http t co 5cntfxx9j8
-1	for great art follow these tweeps ismoraisanen austingal55 mgdigital reidsart ip_mitchell joancarroll photography interiordecor
-1	paul mitchell tea tree essential oil 10 ml pack of 2 for usd21 99 health beauty hair essential http t co 1dh5oupaeg
-1	as spring dances on my lips the flowers are blooming to the sway of my hips and my vibe is my super power
-1	my holy ghost post 2 the mission n purpose of west mount eagle holy baptist ministries are to win souls for the http t co pdfk1218qh
-1	ryan_keszeg thanks http t co 7uffuig1mt
-1	rt fiirtationship when you re broke af but you still continue to spend money on food
-1	my hair is so big
-1	per shun williams fr devin mitchell is at georgia st this weekend potential destination after alabama d_mitch23 http t co qitixb2ihv
-1	rt rtgirlcrushes shay mitchell http t co knvktf4mca
-1	rt rtgirlcrushes shay mitchell http t co xa5rbz1uuz
-1	mitchell_lund congratulations bro
-1	mitchell indiana http t co bgappr7btn
-1	need a red bandana
