-1	in a confined crowded and humid space lack of a c its pure torture it would be more likely to start a mutiny than starvation
-1	rt actionberg why did no one tell me john milius wrote a miami vice episode called viking bikers from hell starring space mutiny s reb
-1	why did no one tell me john milius wrote a miami vice episode called viking bikers from hell starring space mutiny s reb brown
-1	i will drink beer while i watch space mutiny mst3k buffdrinklots
-1	hmm i haven t watched space mutiny in ages time to fix that mst3k bigmclargehuge
-1	blast_thickneck good to find an mstk3k space mutiny fan
-1	teespring franzenmuth just bought that space mutiny shirt with no regrets
-1	puddinwolf nice so many good ones horrors of spider island time chasers the puma man space mutiny warrior of the lost world
-1	mobute chrissyteigen space mutiny for the proletariat
-1	theaaronfiles space mutiny right
-1	1964 avram davidson mutiny in space pyramid r1069 army of death dealing women http t co mcx1sxmtzf http t co pgiyjaaauy
-1	mst3k space mutiny the many names of david ryder https t co 4znyqtb2bc via youtube
-1	the new space mutiny trailer looks sick
-1	namethatmst3k space mutiny
-1	hyenahyenahyena same reason i wouldn t recommend people straight up watch space mutiny or manos hands of fate without mst3k
-1	when british troops marched in during the 1857 mutiny redfort didnt have engh space to accommodate them they demolished several structures
-1	i want to start a new game of xcom solely so i can give everyone in the squad david ryder from space mutiny nicknames
-1	mochachick8 lol yeah i love those guys i saw he was in space mutiny even which is a trip
-1	every time i start a new game of coming out on top i pick a new space mutiny name
-1	watching 2001 a space odyssey reminds me of my great uncle hal and the mutiny on his ship very sad story
-1	all the nicknames from the space mutiny episode of mst3k http t co r6mduerw2v
-1	ah in which case we re kinda simpatico then i misunderstood what you were get either manos or space mutiny http t co 3ow92g1stv
-1	1 out of 5 would recommended space mutiny welcome back to 1 out of 5 would recommend where reb brown is th http t co ndeexjcnzj
-1	rt piedboeufp dolores faith best known for v d 1961 mutiny in outer space 1965 and wild harvest 1962 http t co qwnszvwxrx
-1	dolores faith best known for v d 1961 mutiny in outer space 1965 and wild harvest 1962 http t co qwnszvwxrx
-1	watching space mutiny this movie never fails to make me cry from laughing so hard
-1	rt cukeman space mutiny http t co wafjpmacim
-1	space mutiny http t co wafjpmacim
-1	now i want to watch space mutiny it s my favorite shitty movie of all time
-1	for those who don t know about these names please enjoy this mst3k space mutiny the many names of david r http t co 7fj7omfi4k
-1	in terms of the space ship earth the wrong crew is in command and it is time for a mutiny
-1	holy crap does that count as a railing kill it was total space mutiny action and i could hear tom servo s excitement gotham
-1	rt garylazer_eyes flexbulkhead just a question is your twitter handle not display name a reference from the mst3k episode space muti
-1	flexbulkhead just a question is your twitter handle not display name a reference from the mst3k episode space mutiny
-1	mizabitha it s basically space mutiny
-1	i m making up for it by adding space mutiny references in my comic that should cheer me up
-1	last second outbid rt http t co dgyxkyidfs mystery science theater 3000 volume 4 rare out of print box set space mutiny please fa
-1	michaeljnelson they go there and not space mutiny what s wrong with them
-1	hurakanworks you have space mutiny to thank for that one gt gt
-1	rt neonbubble akiva checking wikipedia and the two stars of space mutiny are married to one another i love discovering things like that
-1	akiva checking wikipedia and the two stars of space mutiny are married to one another i love discovering things like that
-1	rt bro_pair some men produce 35 vaccines in their lifetimes and others like me can list all the fake male lead names in the mst3k spa
-1	retsygamer i ve got you covered https t co sng6h06lgg this is gold if you ve seen space mutiny already
-1	rt thud4444 namethatmst3k finally christmas comes to santa space mutiny
-1	rt mindfulzoo namethatmst3k space mutiny
-1	rt flamefingered1 namethatmst3k space mutiny
-1	rt bookworm1225 namethatmst3k that is of course space mutiny
-1	rt wpwend42 space mutiny https t co 2qncclt67i
-1	namethatmst3k finally christmas comes to santa space mutiny
