-1	announcing my acceptance at surf school with my dude taetrilly
-1	guard rails surf kasparov penis run kids run diet in school we slytherin has become diarrhea mug you airs ayy it s the qmart
-1	rt alexaatrujillo lil surf sesh before school with mcleavins http t co gs0thomxm5
-1	couple s surf school for bangladeshi girls changes lives http t co bbtkoqdr92
-1	_chance_em_ we got em hi surf shop amp school https t co tp2tedhlg1
-1	hd school by liquid shredder surfboards the best surf camp boards 100 liquid fun http t co vhlmagx1gh
-1	couple s surf school for bangladeshi girls changes lives http t co mlh6e0zlhj
-1	going to surf school would be cool
-1	rt dscottwrites you can t stop the waves but you can learn to surf jonkabatzinn mindfulness http t co crsdpa4uee http t co t
-1	farmdog surf school i miss you see you this summer
-1	rt thecamp_2012 we are having an awesome spring isalber1 hitting this sweet right hander surfschool surf http t co lj8rx5mnic
-1	get a group of friends to take lessons and it lowers the cost corky carroll s surf school on yelp http t co frizkh8rkp
-1	this was in the movie surf ninjas old school surfninjas chinatown central plaza https t co kmmo0b0tsu
-1	rt thecamp_2012 we are having an awesome spring isalber1 hitting this sweet right hander surfschool surf http t co lj8rx5mnic
-1	we are having an awesome spring isalber1 hitting this sweet right hander surfschool surf http t co lj8rx5mnic
-1	duuuur thanks westcountry surf school for the sweaters you deliberately left here for us both as presents http t co ry1xuvshqy
-1	surf chill then comeback to tx for school
-1	more fun ones http t co susqa3lenq fuerteventura corralejo elcotillo surf kailua http t co 9ggxfyzxsm
-1	rt jossbaysurfing memphis came down today to see what was going down at the surf school she gave her seal of approval https t co dmz
-1	end of surf school party dress http t co tis7edrqxy http t co tkpfg13vbj
-1	rt ebshackett i want to go back and surf i don t want to go to school croyde bay devon https t co fcvuwdyzhs
-1	only in florida will you find a school where they have a period where they teach u to surf highschoolgoals
-1	i want to go back and surf i don t want to go to school croyde bay devon https t co fcvuwdyzhs
-1	memphis came down today to see what was going down at the surf school she gave her seal of approval https t co dmziv3svhf
-1	rt dscottwrites you can t stop the waves but you can learn to surf jonkabatzinn mindfulness http t co crsdpa4uee http t co t
-1	rt dscottwrites you can t stop the waves but you can learn to surf jonkabatzinn mindfulness http t co crsdpa4uee http t co t
-1	rt dscottwrites you can t stop the waves but you can learn to surf jonkabatzinn mindfulness http t co crsdpa4uee http t co t
-1	rt dscottwrites you can t stop the waves but you can learn to surf jonkabatzinn mindfulness http t co crsdpa4uee http t co t
-1	rt dscottwrites you can t stop the waves but you can learn to surf jonkabatzinn mindfulness http t co crsdpa4uee http t co t
-1	surf school day two sea swallowed 1 mouthful bruises 9 seconds stood up on board 0 75 quarter second improvement i ll take that
-1	rt jordannofficial i m not ready to go back to school tomorrow
-1	rt dscottwrites you can t stop the waves but you can learn to surf jonkabatzinn mindfulness http t co crsdpa4uee http t co t
-1	rt dscottwrites you can t stop the waves but you can learn to surf jonkabatzinn mindfulness http t co crsdpa4uee http t co t
-1	rt dscottwrites you can t stop the waves but you can learn to surf jonkabatzinn mindfulness http t co crsdpa4uee http t co t
-1	rt dscottwrites you can t stop the waves but you can learn to surf jonkabatzinn mindfulness http t co crsdpa4uee http t co t
-1	rt dscottwrites you can t stop the waves but you can learn to surf jonkabatzinn mindfulness http t co crsdpa4uee http t co t
-1	rt dscottwrites you can t stop the waves but you can learn to surf jonkabatzinn mindfulness http t co crsdpa4uee http t co t
-1	you can t stop the waves but you can learn to surf jonkabatzinn mindfulness http t co crsdpa4uee http t co todgyzgchs
-1	watch our simplifiers video featuring localssurf nysurf simplicitypays http t co r7zh6mjlcp
-1	checking the surf from our deck old school scope photo cred thomcoupe surfcheck superlife https t co if6ysyq26f
-1	rt mr516 rt gleamsatm word high school was fun rt tsu_surf niggas party thursday to sunday wake up monday broke tryna figure out l
-1	rt gleamsatm word high school was fun rt tsu_surf niggas party thursday to sunday wake up monday broke tryna figure out life
-1	rt gleamsatm word high school was fun rt tsu_surf niggas party thursday to sunday wake up monday broke tryna figure out life
-1	word high school was fun rt tsu_surf niggas party thursday to sunday wake up monday broke tryna figure out life
-1	stop by mondo taitu mono loco surf school amp tajada de sandia to get your give amp surf gear today not in bocas http t co umq7ukqxdn
-1	i posted 21 photos on facebook in the album surf school april 2015 http t co 4pd99rd9mg
-1	work life work beach harlyn surf school harlynsurfschool cornwall sand instructors https t co featvodmp0
-1	school of surf is out http t co b8k8jqoire stories via windsurfingstor poolewindsurf surfandclimb_de
-1	rt party_stories_ when you crowd surf in a house party school plano west http t co 2zm7i4svlt
-1	couple s surf school for bangladeshi girls http t co o4v64fz0yj
-1	hard work surf surflessons surfschool escoladesurfemporda mediterraneansurf estartit https t co vh953nsiin
-1	surf lessons sign up http t co cnky6obfvl
-1	surf surfing hawaii boards hi surf shop amp school https t co enxvl2uibp
-1	rt putycan daily activity in aw surf school http t co zchnhdwkpc
-1	prom 2015 carlisle high school surf_n_twerf victorianyoung berean assembly https t co qxbapmz1cf
-1	this girl just said she had surf school and now the alien babes are watching her like i think they re interested imho
-1	rt timple_yohan flagler is turning into less and less of a surf school since everyone s fucking boards are being stolen burninhell
-1	flagler is turning into less and less of a surf school since everyone s fucking boards are being stolen burninhell
-1	my bed at school gt bed at home
-1	i am so stoked to hit the waves for a surf sesh school needs to be over i need to go surfing like now
-1	surf school 06 jpg nude female celebrity scenes pictures and videos celebrity surfschool06jpg pictures videos
-1	couple s surf school for bangladeshi girls changes lives http t co rp0sxqujd7 surfboards http t co g5ru7w0xj7
-1	couple s surf school for bangladeshi girls changes lives http t co uchgf7grbj
-1	http t co uic8rlot1w couple s surf school for bangladeshi girls changes lives cnrapp
-1	wnd tcot couple s surf school for bangladeshi girls changes lives new york times in 2009 vanessa r http t co giwl459g0m news
-1	enews endtimesnews couple s surf school for bangladeshi girls changes lives new york ti http t co uxrxzgyxgu via worldnetdaily
-1	couple s surf school for bangladeshi girls changes lives http t co kezgxcdkkz liberty
-1	couple s surf school for bangladeshi girls changes lives new york times in 2009 vanessa rude and her husba http t co rwdpbhakvk
-1	couple s surf school for bangladeshi girls changes lives new york times in 2009 vanessa rude and her husba http t co sd8266mook
-1	couple s surf school for bangladeshi girls changes lives new york times in 2009 vanessa rude and her husba http t co btu8nwiqpq
-1	couple s surf school for bangladeshi girls changes lives http t co yccvfmvoam new york times in 2009 vanessa rude and her husband r
-1	new post couple s surf school for bangladeshi girls changes lives http t co yjrpsboapq
-1	surf school day one sea water drunk 3 mouthfuls muscles aching all of em bruises 8 seconds stood up on board 0 5 fun tons
-1	surf spider man reboot will center on peter parker as a high school superhero http t co povdg011re http t co mi7fy3cjjm
-1	couple s surf school for bangladeshi girls changes lives http t co izaaam2oui
-1	ace news report couple s surf school for bangladeshi girls changes lives new york times in 2009 vanessa r http t co b7rg5lfn7o
-1	couple s surf school for bangladeshi girls changes lives http t co olybzoxyfy
-1	new york times in 2009 vanessa rude and her husband rashed alam began offering surf lessons and english lesso http t co szuhcjqrdj
-1	news headlines wnd couple s surf school for bangladeshi girls changes lives http t co eaxetvkntz
-1	couple s surf school for bangladeshi girls changes lives http t co 3lrsef8eln
-1	couple s surf school for bangladeshi girls changes lives http t co 5c8hzfgfxu
-1	couple s surf school for bangladeshi girls changes lives http t co uomxtphe56
-1	rt surfschoolsc the true locals of the ocean nellysmagicmoments surfschoolsantacruz surfschool surf surfing whale http t c
-1	rt surfschoolsc the true locals of the ocean nellysmagicmoments surfschoolsantacruz surfschool surf https t co xoedpqb3va
-1	the true locals of the ocean nellysmagicmoments surfschoolsantacruz surfschool surf surfing whale http t co wm1ez8zgn3
-1	the true locals of the ocean nellysmagicmoments surfschoolsantacruz surfschool surf https t co xoedpqb3va
-1	surf lesson on life http t co 0zhadnz4yl
-1	pete from shore surf school off the forecourt with this beautiful 5 4 racecar from canvas surfboards classic http t co wg7cd03mjp
-1	i liked a youtube video from surfingcroyde http t co xzrwcvtvqz lyndon wake surf school
-1	surfcamp costa rica http t co tdu7ahppse
-1	rt johnnyalonso exreverend hwilson2009 carlton thank you that wildkat screams w old school surf tone i love collecting vintage guitar
-1	exreverend hwilson2009 carlton thank you that wildkat screams w old school surf tone i love collecting vintage guitars
-1	rt party_stories_ when you crowd surf in a house party school plano west http t co 2zm7i4svlt
-1	rt fablousfour when you are in school and someone says one direction celebrityawards2015 one direction http t co ngzd657pxw
-1	rt filthyfrank satan used to pick me up from school in a run down subaru thinkin he was my dad or something wtf
-1	ok so v dramatic day at the surf school
-1	sluhxctrack when is my boy ben hayes up to set a new school record in the triple
-1	fuerteventura surf school http t co wn0welbrr3
-1	moana surf school was pumping today such fun lessons thanks all you wonderful students for making it so enjoyable d
-1	rt seasurffun i m on a hiiighway to surf sanfrancisco oceanbeach weekends surfschool http t co s6u1qol3hn
-1	rt _trippyjones listen to adrian lau james bond prod by hannibal king by surf school recordings np on soundcloud https t co gkhj
-1	rt seasurffun i m on a hiiighway to surf sanfrancisco oceanbeach weekends surfschool http t co s6u1qol3hn
-1	i m on a hiiighway to surf sanfrancisco oceanbeach weekends surfschool http t co s6u1qol3hn
-1	listen to adrian lau james bond prod by hannibal king by surf school recordings np on soundcloud https t co gkhjatruqe
-1	school of surf learn with the pros http t co qiyelio5hq
-1	surf_nwildwood i know that goofy lol but with 200 hrs of fire school amp emergency mgmnt school under my belt i always go safety 1st
-1	school of surf is out http t co 3akh1hmao4 stories via boylos_lymebay islandlotion stormchasershq
-1	surfing surfing advanced pop up gift surf school hawaii http t co t2oefz8tlk http t co lhcchdeysl
-1	rt thesurfingsumo some great reviews for westcountry surf school on our site http t co ldmpbdrq7r learntosurf surfing http t co i1
-1	surf clinic today at madison ave for junior high school class 10 12 open for business after that till 4 today fun waves and good times
-1	the calm before the waves la union surf school https t co ysvczudnvs
-1	he needs to work on getting the legs straight any guesses on which surf coach this is surfberbere surfschool h http t co 3k99qpwwly
-1	rt thesurfingsumo some great reviews for westcountry surf school on our site http t co ldmpbdrq7r learntosurf surfing http t co i1
-1	angry that cornwallcouncil want more power but don t want to run the toilets or debate important issues like surf school licences
-1	rt thesurfingsumo some great reviews for westcountry surf school on our site http t co ldmpbdrq7r learntosurf surfing http t co i1
-1	son you hold footage like lux back in in 06 snoopdogg can you please drop those gladiator school battles at least daylyt vs surf
-1	end of lesson group shot surf sunshine surfschool by getwetsurf http t co fde9k9roxi http t co seckuw7tfz
-1	new shelves thank you salassiei hi surf shop amp school https t co w8mw8ygiwa
-1	aloha friday hi surf shop amp school https t co vrvdumvacu
-1	just posted a photo hi surf shop amp school https t co twjtkqzgtw
-1	rt worldstarever he freestyling at school https t co dwifd0mksi
-1	tour with all dreams surf school reserve yours
-1	angiebuttag yeah its really good have you heard of surf curse they are somewhat kinda sorta like old school surf rock haha
-1	schoolwasbad i ve never seen reservoir dogs i really need to though but i love this band haha i like the whole old school surf rock vibe
-1	skippy s turn to score at surf school this week surfschool skippy seeaustralia diamondhead https t co vlkaetjplj
-1	saturday class literally goes to school to surf the net
-1	rt bcvacation pacific surf school in tofino offers group and family surf lessons private lessons gear rentals amp more pacificsurfco
-1	surf school with kidlets awesome spring break
-1	rt sincerelytumblr me at school http t co khy4hakclt
-1	when you live close to the ocean might as well have a high school surf team maui hana hawaii https t co dedglkxxnd
-1	jenna s drunk art school sculpting http t co z71fnqgvwo staged http t co rdazaoviwj
-1	rt thesurfingsumo some great reviews for westcountry surf school on our site http t co ldmpbdrq7r learntosurf surfing http t co i1
-1	bangladesh surfing club and school provides girls with education and freedom to realize their potential http t co swqvc7kk4a
-1	pacific surf school in tofino vancouverisland offers year round group and family surf lessons gear rentals and surf camps pacificsurfco
-1	rt thesurfingsumo some great reviews for westcountry surf school on our site http t co ldmpbdrq7r learntosurf surfing http t co i1
-1	rt thesurfingsumo some great reviews for westcountry surf school on our site http t co ldmpbdrq7r learntosurf surfing http t co i1
-1	rt thesurfingsumo some great reviews for westcountry surf school on our site http t co ldmpbdrq7r learntosurf surfing http t co i1
-1	picking up some boards and heading out surfari surf school on yelp http t co 4m1rwxmbus
-1	rt thesurfingsumo some great reviews for westcountry surf school on our site http t co ldmpbdrq7r learntosurf surfing http t co i1
-1	rt apexkerryj_ paulmars24 take these fools to surf school young wave child word to harry fraud
-1	rt thesurfingsumo some great reviews for westcountry surf school on our site http t co ldmpbdrq7r learntosurf surfing http t co i1
-1	rt thesurfingsumo some great reviews for westcountry surf school on our site http t co ldmpbdrq7r learntosurf surfing http t co i1
-1	rt thesurfingsumo some great reviews for westcountry surf school on our site http t co ldmpbdrq7r learntosurf surfing http t co i1
-1	some great reviews for westcountry surf school on our site http t co ldmpbdrq7r learntosurf surfing http t co i1uwqjvlub
-1	rt juanma_furio primer ba o post gh15 con my family de mediterranean surf school http t co swmfizfmkd
-1	paulmars24 take these fools to surf school young wave child word to harry fraud
-1	stay in newquay and have surf lessons with the escape school discounts available http t co lj7vswiw3l
-1	i saw nsu swag surf i stg ain t no other school fuckin with a amp t when it come to that
-1	rt isasurfing going against all odds to surf amp go to school in india isa ambassador saku is an inspiration http t co z8h30eyve9 http
-1	if i just could stop school and surf everyday
-1	the north devon surf school http t co khnzhtwrwa
-1	surf sesh after school thank the lord http t co yuj1llqhu4
-1	surfing surfing advanced pop up gift surf school hawaii http t co t2oefz8tlk http t co tyvwd246s0
-1	aw surf school http t co fu2xnidoey
-1	beccacox98 this is totally going to happen as soon as we leave school
-1	love this baby pink super soft sweatshirt by hawaiianfire a surf wear brand and school run by https t co sbkzyythcd
-1	rt isasurfing going against all odds to surf amp go to school in india isa ambassador saku is an inspiration http t co z8h30eyve9 http
-1	going against all odds to surf amp go to school in india isa ambassador saku is an inspiration http t co z8h30eyve9 http t co wkjuhfqail
-1	surf yoga and pilates school http t co lvbufk8umo sign travel beach photography
-1	today at aw surf school http t co o91s6opzj8
-1	the new skibennetts ski school van towing a fresh new mastercraftboat x23 surf edition this boat https t co 2ibtjkbrua
-1	waves too crowded by surf school students laguna beach independent newspaper surfboards http t co yuk7qnjqu8
-1	vintage old navy baja california waveriders surf school shirt mens large vintage oldnavy surf shirt http t co wieafuubdp via ebay
-1	rt surfingcroyde our awesome new sign is up and out directing everyone to the best surf school in croyde as ever https t co q0txqebt
-1	taking a grape and sucking the juice and life out of it and turning it into a raisin is a good illustration of what school does to me
-1	pacific surf school in tofino offers year round group and family surf lessons private lessons gear rentals and surf camps pacificsurfco
-1	our awesome new sign is up and out directing everyone to the best surf school in croyde as ever https t co q0txqebtwh
-1	rt surfinggb stoked to be working with our newest accredited surf school cbsurfschool surf cornwall
-1	via new wave surf school http t co gnlg1miixy
-1	can i drop out of school and move to hawaii and just surf and lay on the beach and eat pineapple for the rest of my life
-1	rt surfinggb stoked to be working with stivesurfschool again during 2015 as an accredited surf school surf stives yewwww
-1	rt surfinggb stoked to be working with stivesurfschool again during 2015 as an accredited surf school surf stives yewwww
-1	100 getting surf taco before i go back to school today
-1	please tell the high school kids to stop taking the booths in the union
-1	rt mackie_studio from yesterdays surf school shoot at watergatebay with a new brand we are working with called blue mackiestudio http
-1	school of surf is out http t co zd79xaxwla stories via riwmag teleamenoticias wakewindandsurf
-1	from yesterdays surf school shoot at watergatebay with a new brand we are working with called blue mackiestudio http t co dqrn3uk20i
-1	stoked to be working with stivesurfschool again during 2015 as an accredited surf school surf stives yewwww
-1	stoked to be working with our newest accredited surf school cbsurfschool surf cornwall
-1	rt laurisaneuwirth this surfing school in bangladesh is empowering girls one wave at time http t co srz6le5fdc http t co dltohhccqq
-1	this surfing school in bangladesh is empowering girls one wave at time http t co srz6le5fdc http t co dltohhccqq
-1	happy siblings day today is also beach wear day at school so jonah made a surf board to take with https t co ucaecfcvkd
