-1	rt surfschoolsc this is what it s all about sharingthestoke surfschoolsantacruz surf smile shaka surfschool https t co 2cjc0nei
-1	this is what it s all about sharingthestoke surfschoolsantacruz surf smile shaka surfschool shaka http t co xp3il6rrrm
-1	this is what it s all about sharingthestoke surfschoolsantacruz surf smile shaka surfschool https t co 2cjc0neiwo
-1	rt surferliving rt shopsurfjobs the 2015 guide to surf universities which surf school suits you best http t co hhymwga2tw http t
-1	surf the 2015 guide to surf universities which surf school suits you best http t co njzymkczbo http t co 0yncdqp9dp santacruz
-1	rt tinaaxt school needs to be over so i can just go to the beach and surf
-1	school needs to be over so i can just go to the beach and surf
-1	surf school stand up paddle boarding body boarding sand boarding coastal tours fish markets hotspring http t co wdrbisolub
-1	surf the 2015 guide to surf universities which surf school suits you best http t co njzymkczbo http t co 5ii4cgqvb3 santacruz
-1	riding your first wave with the tony silvagni surf school http t co 8d8nizjs2l via walkingontravel
-1	if i had a dollar for every time i got stung by a sting ray last summer working at corky caroll s surf school i d have 4 dollars
-1	rt ucsdnews uc san diego ranked no 2 academic surf school by the inertia a website for surfers http t co crkx1gsokm ucsd http t
-1	rt lajollamom riding your first wave with the tony silvagni surf school http t co xa5kbucg1x via walkingontravel
-1	surfing surfing advanced pop up gift surf school hawaii http t co t2oefz8tlk http t co du2vse0jt5
-1	school holidays family fun at bondi beach 23c in amp out of water magnificent surf lifestyle https t co 51chljsixn
-1	redgoldeden i can t bring my 1 due to finals school have extra ticket hope to make friends and find a couch to surf for the night
-1	surf the 2015 guide to surf universities which surf school suits you best http t co njzymkczbo http t co boljnxw9yu santacruz
-1	rt surftravelblogs rt shopsurfjobs the 2015 guide to surf universities which surf school suits you best http t co bmdetk0dth http
-1	so little time try to understand that i m trying to make everybody s changing by keane at surf school bali https t co pcw9rnqn10
-1	grace school rewards their students with the fun company s triply lindy surf n slide http t co 8z2pgfkpko
-1	rt surferliving rt shopsurfjobs the 2015 guide to surf universities which surf school suits you best http t co hhymwga2tw http t
-1	rt ucsdnews uc san diego ranked no 2 academic surf school by the inertia a website for surfers http t co crkx1gsokm ucsd http t
-1	rt ucsdnews uc san diego ranked no 2 academic surf school by the inertia a website for surfers http t co crkx1gsokm ucsd http t
-1	katie bond amp claire collins win today s for setting up across the board a surf school for children with autism
-1	rt surferliving rt shopsurfjobs the 2015 guide to surf universities which surf school suits you best http t co hhymwga2tw http t
-1	rt ucsdnews uc san diego ranked no 2 academic surf school by the inertia a website for surfers http t co crkx1gsokm ucsd http t
-1	rt surftripfinder rt shopsurfjobs the 2015 guide to surf universities which surf school suits you best http t co aahjvimcra http
-1	uc san diego ranked no 2 academic surf school by the inertia a website for surfers http t co crkx1gsokm ucsd http t co 8r4zteihrj
-1	riding your first wave with the tony silvagni surf school http t co xa5kbucg1x via walkingontravel
-1	just gotta make it through this week of school then surf trip
-1	surf the 2015 guide to surf universities which surf school suits you best http t co njzymkczbo http t co bjnqpjftfs santacruz
-1	rt surftravelblogs rt shopsurfjobs the 2015 guide to surf universities which surf school suits you best http t co bmdetk0dth http
-1	rt surftripfinder rt shopsurfjobs the 2015 guide to surf universities which surf school suits you best http t co aahjvimcra http
-1	dakotamaeshop you are the go to girl for corky cochran surf school xo
-1	rt shopsurfjobs the 2015 guide to surf universities which surf school suits you best http t co aahjvimcra http t co 0w1yb3oh9m
-1	rt shopsurfjobs the 2015 guide to surf universities which surf school suits you best http t co rucbeohu3h http t co 9bhxm6twcr
-1	surf the 2015 guide to surf universities which surf school suits you best http t co sspqmlnoh6 santacruz http t co xnuptuwylv
-1	surf the 2015 guide to surf universities which surf school suits you best http t co njzymkczbo santacruz http t co l4g7hnay0o
-1	surf the 2015 guide to surf universities which surf school suits you best http t co njzymkczbo http t co uzoahy2kqr santacruz
-1	rt shopsurfjobs the 2015 guide to surf universities which surf school suits you best http t co bmdetk0dth http t co 9b1t8oh5tw
-1	rt surferliving rt shopsurfjobs the 2015 guide to surf universities which surf school suits you best http t co hhymwga2tw http t
-1	rt surferliving rt shopsurfjobs the 2015 guide to surf universities which surf school suits you best http t co hhymwga2tw http t
-1	rt surferliving rt shopsurfjobs the 2015 guide to surf universities which surf school suits you best http t co hhymwga2tw http t
-1	rt surferliving rt shopsurfjobs the 2015 guide to surf universities which surf school suits you best http t co hhymwga2tw http t
-1	rt shopsurfjobs the 2015 guide to surf universities which surf school suits you best http t co hhymwga2tw http t co wkksc8q9rx
-1	the 2015 guide to surf universities which surf school suits you best http t co k3okytbaw7 http t co qnc81titop
-1	surf the 2015 guide to surf universities which surf school suits you best http t co njzymkczbo santacruz http t co silsb8v62d
-1	surf the 2015 guide to surf universities which surf school suits you best http t co njzymkczbo http t co vvk8ddewzl santacruz
-1	rt triumpalism rt blackjeezuss rt party_stories_ when you crowd surf in a house party school plano west http t co ctmnv9krjw
-1	rt saxonstandridge party_stories_ when you crowd surf in a house party school plano west http t co pjzgbsjbts madeit http t
-1	rt juniormanika party_stories_ when you crowd surf in a house party school plano west http t co 7xdpvzxy64
-1	surf the 2015 guide to surf universities which surf school suits you best http t co njzymkczbo http t co c14u0ookhu santacruz
-1	after school surf seah
-1	after school surf sesh http t co io2zzr954l
-1	sunset yoga in playa carrillo with chillasana yoga amp surf school cs vinyasa yoga will not only optimize your http t co enzatu4h00
-1	little surfer riding your first wave with the tony silvagni surf school http t co t8sdfmunsl via keryn means http t co 6cfxlknvez
-1	couple s surf school for bangladeshi girls changes lives pedia for today http t co anthkn2bpe
-1	surf the 2015 guide to surf universities which surf school suits you best http t co njzymkczbo http t co 6jxlrxhezq santacruz
-1	rt wilmingtoncoast fun traveltuesday piece by walkingontravel riding your first wave with the tony silvagni surf school http t co zt
-1	fun surf this morning especially after the high school surf club left stoked http t co awtnnmijde
-1	rt wilmingtoncoast fun traveltuesday piece by walkingontravel riding your first wave with the tony silvagni surf school http t co zt
-1	fun traveltuesday piece by walkingontravel riding your first wave with the tony silvagni surf school http t co ztxnywssqf ttot surf
-1	surf the 2015 guide to surf universities which surf school suits you best http t co njzymkczbo http t co jwns7lldd0 santacruz
-1	bedroomm bite me surf school i haven t seen the sun in decades
-1	surf the 2015 guide to surf universities which surf school suits you best http t co njzymkczbo http t co md98ytsc35 santacruz
-1	well i think it s safe to say i haven t miss being in school
-1	cas surf the 2015 guide to surf universities which surf school suits you best http t co gidhip5sly
-1	review of tony silvagni surf school via walkingon http t co 6trcm1zlfc
-1	riding your first wave with the tony silvagni surf school http t co ttdf9vsy08 via walkingontravel
-1	rt g_b_dub if surf drops during school you already know imma leave
-1	the 2015 guide to surf universities which surf school suits you best http t co houhhsmgmp iscriviti alla new http t co fmglp3d5px
-1	if surf drops during school you already know imma leave
-1	the 2015 guide to surf universities which surf school suits you best http t co wydat423cy calpolysanluisobispo
-1	wish i could surf the internet on the computer while at work everything be blocked worse than school lol
-1	the 2015 guide to surf universities which surf school suits you best http t co kwmopmlz4o
-1	surf s up beach aljezur praiaamoreira algarve portugal surfing surfschool ig_travel ig_portugal sea san http t co gbrygxkthd
-1	little surfer riding your first wave with the tony silvagni surf school http t co yl9uwyf2n3 via walkingontravel
-1	school surf work n repeat
-1	riding your first wave with the tony silvagni surf school http t co rgujms4abz via walkingontravel
-1	want to learn how to dance we have some good time to share http t co 2ajuqt7fjy fuerteventura corralejo surf http t co rsgozq9y8n
-1	school of surf is out http t co 3zdsa2pr01 stories via redhdwindsurfer sportsandmusics windsurfingstor
-1	my mom thinks i sneak out to surf before school i give my sister a ride everyday
-1	riding your first wave with the tony silvagni surf school http t co bic6u8rwpv via walkingontravel
-1	rt ristolable dumb guy from high school i have a lot of money now me i make free jokes on the computer
-1	about to surf my way to school
-1	rt tonguemagazine back to reality solo x quiksilver_mx quiksilver backpack surf school antara ag47 https t co liloxuwwr0
-1	kitesurfing beginner course 4 days kailua surf school fuerteventura http t co pbwhgksbfb
-1	pasta point maldives special sought after high season and school holiday spots just opened up get in from http t co xkn02ayezy
-1	riding your first wave with the tony silvagni surf school http t co reciz7ny4x via walkingontravel
-1	fuck everyone that doesn t have a pass and drives to school you re all pricks and i hope your cars get towed
-1	riding your first wave with the tony silvagni surf school http t co gmxxl0lkcs via walkingontravel
-1	the owler community added a new company profile porthcawlsurf available here http t co vgtvyzklkr
-1	new instagram photo tagged at gary s surf school http t co uep6nybmin
-1	welcome quiksilversurfs your business profile has been created http t co gtynzydasy
-1	rt thesurfingsumo some great reviews for westcountry surf school on our site http t co ldmpbdrq7r learntosurf surfing http t co i1
-1	rt globalboarders what a day perfect for the start of the school surf clubs grassroots surfing cornwall surfinggb waves sun
-1	rt chancetherapp kick back chancetherapper good enough back to school 10 day acid rap amp surf http t co hrpjw8qmns
-1	what a day perfect for the start of the school surf clubs grassroots surfing cornwall surfinggb waves sun stoked
-1	great article about learning to surf in carolinabeachnc courtesy of walkingontravel http t co u4insxewh5 carolinabeachnc tt
-1	blacktown_lad going on a 2 day surf camp with school down near phillip island
-1	check out elle s beach of the week http t co 0b9jhcrwro raw rugged coastline epic surf and boho chic design surferslodgepeniche
-1	raleigh team burner 1985 old school bmx restored nos skyway vw camper surf http t co uvdaij2mom http t co gtrxcmgznd
-1	17 for a 3 hour surf lesson for one choice of four locations http t co oynqp65itj
-1	almost summer pettirosso surf school http t co gmxvizy9tt tramite youtube
-1	can t access to twitter from school work connect through a webproxy to surf with privacy http t co pqdfvwfi3u and bypass security
-1	rt coolumsurfschol term 2 surf groms is starting the second week back of school we will be offering classes on monday or friday http
-1	i want to lighten my hair go to cosmetology school and surf everyday that s all
-1	rt dscottwrites you can t stop the waves but you can learn to surf jonkabatzinn mindfulness http t co crsdpa4uee http t co 2
-1	tsu_surf hit my dm senior year of high school didn t sugar coat shit i play college ball now in newark my home hood grateful jersey
-1	port macquarie surf school 1 middle rock rd lake cathie nsw 2445 australia http t co e9dht1cokp
-1	when you want to go surf but you have to go to school 1gottago boring sucks
-1	sometimes i want to wake up and surf before school just because and then i remember i m in alaska and i can t onemonth
-1	the super stocks thunder road surf route 101 school is a drag gary usher cd http t co ynsz9izjp9 http t co tzjccwk96h
-1	the super stocks thunder road surf route 101 school is a drag gary usher cd http t co use9yttcgf http t co dyv0hv7tgu
-1	sd surf school is now on twitter follow us and share us with your friends so they can come and learn how to surf too
-1	dscottwrites u can t stop the waves but u can learn 2 surf jonkabatzinn mindfulness http t co fkpk0rvvnn http t co 1qmzuvgl8m
-1	new boardshorts hawaii surf northshore surfshophawaii hi surf shop amp school https t co ag2tsuu7ml
-1	rt party_stories_ when you crowd surf in a house party school plano west http t co 2zm7i4svlt
-1	why do kids have nightmares about coming to school in their pajamas i basically do that all the time
-1	rt dscottwrites you can t stop the waves but you can learn to surf jonkabatzinn mindfulness http t co crsdpa4uee http t co 2
-1	rt dscottwrites you can t stop the waves but you can learn to surf jonkabatzinn mindfulness http t co crsdpa4uee http t co 2
-1	what better way to astro school a prisoner has been downgraded from surf clubs tumblr also uses
-1	rt lqthegawwd rt worldstarvlne this really how bitches was in school http t co f78dyat11q
-1	riding your first wave with the tony silvagni surf school http t co mwellncl95 via walkingontravel
-1	at http t co rm2i7rwbjg yoga meditate mudra school holidays becomes surf school which would you rather http t co lc1bmd8ky2
-1	school holidays becomes surf school which would you rather on the sand bondi beach sydney https t co mnmqvlfuca
-1	term 2 surf groms is starting the second week back of school we will be offering classes on monday or friday http t co 3udsf04yj8
-1	rt snowboardracing old school carving time carve snowboard surf mustache https t co jm5dykdnkd
-1	roxy s insta makes me wanna quit school learn to surf and work for them
-1	riding your first wave with the tony silvagni surf school http t co s6tdqm2phg via walkingontravel
-1	riding your first wave with the tony silvagni surf school http t co kolcmlxppr via walkingontravel
-1	rt dscottwrites you can t stop the waves but you can learn to surf jonkabatzinn mindfulness http t co crsdpa4uee http t co 2
-1	rt dscottwrites you can t stop the waves but you can learn to surf jonkabatzinn mindfulness http t co crsdpa4uee http t co 2
-1	rt dscottwrites you can t stop the waves but you can learn to surf jonkabatzinn mindfulness http t co crsdpa4uee http t co 2
-1	rt dscottwrites you can t stop the waves but you can learn to surf jonkabatzinn mindfulness http t co crsdpa4uee http t co 2
-1	rt dscottwrites you can t stop the waves but you can learn to surf jonkabatzinn mindfulness http t co crsdpa4uee http t co 2
-1	rt dscottwrites you can t stop the waves but you can learn to surf jonkabatzinn mindfulness http t co crsdpa4uee http t co 2
-1	rt dscottwrites you can t stop the waves but you can learn to surf jonkabatzinn mindfulness http t co crsdpa4uee http t co 2
-1	rt dscottwrites you can t stop the waves but you can learn to surf jonkabatzinn mindfulness http t co crsdpa4uee http t co 2
-1	old school carving time carve snowboard surf mustache https t co jm5dykdnkd
-1	rt dscottwrites you can t stop the waves but you can learn to surf jonkabatzinn mindfulness http t co crsdpa4uee http t co 2
-1	rt dscottwrites you can t stop the waves but you can learn to surf jonkabatzinn mindfulness http t co crsdpa4uee http t co 2
-1	rt dscottwrites you can t stop the waves but you can learn to surf jonkabatzinn mindfulness http t co crsdpa4uee http t co 2
-1	rt dscottwrites you can t stop the waves but you can learn to surf jonkabatzinn mindfulness http t co crsdpa4uee http t co 2
-1	rt dscottwrites you can t stop the waves but you can learn to surf jonkabatzinn mindfulness http t co crsdpa4uee http t co 2
-1	you can t stop the waves but you can learn to surf jonkabatzinn mindfulness http t co crsdpa4uee http t co 2kkkrypatv
-1	missmirandaal seriosly there was this white girl in y school she was like a surf board and after summer when school started she a big but
-1	after school surf sesh tomorrow
-1	family fun surf lessons godfathersoftheoceansurfschool burleigh heads beach mungabarry http t co m3s4tulyhc
-1	hey pcr miss u best i ever had grey sky morning by vertical horizon with hebrina at surf school bali https t co mdujngdqxa
-1	let s get out there getwet learntosurfgoldcoast surfschool surfing shredders surf http t co 7drw8eqcch http t co najwulexmq
-1	a letter my mom found tht she wrote to my dad in high school asking him to surf less and pay more attention to her http t co e4fwnokvqh
-1	back to reality solo x quiksilver_mx quiksilver backpack surf school antara ag47 https t co liloxuwwr0
-1	riding your first wave with the tony silvagni surf school http t co phcjf37fyl via walkingontravel
-1	work school surf
-1	dad having a good time familyfun surfeasy holidayprogramme surf easy surf school https t co v2p5846b6n
-1	riding your first wave with the tony silvagni surf school http t co rilj2kucqx via walkingontravel
-1	riding your first wave with the tony silvagni surf school http t co ju5ca00lbz via walkingontravel
-1	rt ssandrabyrne surf lesson with equipment hire tramore surf school https t co avrpfpdbmp via livingsocialie surfing deal tramore
-1	another life remedy post yoga ouijetaime california thewhalesvagina i mean sandiego surf meta school http t co ic5utwb64m
-1	back to reality quiksilver backpack surf school antara ag47 actionsports surf skate https t co liloxuwwr0
-1	surf lesson with equipment hire tramore surf school https t co avrpfpdbmp via livingsocialie surfing deal tramore waterford lesson
-1	can i like drop out of school build a house near the beach have a hammock as a bed amp surf
-1	rt festivalseekers rt bcvacation pacific surf school in tofino offers group and family surf lessons private lessons gear rentals amp m
-1	couple s surf school for bangladeshi girls changes lives pedia for today http t co anthkn2bpe
-1	great day in school then 4 hours in wetsuit in oil waves learned how to pop a surf rescue board spring tomandersonbks porthcawlsurf
-1	eviewilkins1 no way did you do surf school coolcat
-1	rt surfgsd another happy group of young surfers caswellbay heading up beach after a lush apr s school surf http t co u4bftgvuy1
-1	we re so stoked to be partnering with surf for life to build a new school in bahia roja this summer http t co sohwolcupf
-1	gymboree nwt surf legend surf school monkey t shirt size 2t http t co pryhca9fid http t co ewlwx1rize
-1	rt becciblakeway amazing weekend with woolacombe bay surf school and i m totally going to become a surfer girl http t co tlpsg4apc4
-1	rt foxnewsaustin del valle high school teacher confesses to having sexual intercourse with a student multiple times student says she l
-1	exciting stuff coming soon with ajani s irie surf school barbados keep your eyes here theoldjamminn http t co ctpo32ljbn
-1	pablitovz backside turn barra an surf gopro goprohero4 surfschool mondaymotivation http t co kbb8m8mqhu
-1	are you looking for a surf camp for teens in spain http t co 7ryicxd70g surfschool summer2015 cantabria nomadsurfers
-1	og_rada lol yea that s only kause it was gladiator school surf still killed em tho
-1	rt dscottwrites you can t stop the waves but you can learn to surf jonkabatzinn mindfulness http t co crsdpa4uee http t co t
-1	couple s surf school for bangladeshi girls changes lives http t co uchgf7y2zt newyork york http t co pp26qkeh96
-1	riding your first wave with the tony silvagni surf school http t co tapbb9a4hz via walkingontravel
-1	rt surfgsd another happy group of young surfers caswellbay heading up beach after a lush apr s school surf http t co u4bftgvuy1
-1	another happy group of young surfers caswellbay heading up beach after a lush apr s school surf http t co u4bftgvuy1
-1	chancetherapper im in school your video is what i needed to get me trough today it made my brain light up just waiting for surf now
-1	ls amp shaka surf school 100 liquid fun http t co srktepyudf
-1	riding your first wave with the tony silvagni surf school http t co haj7ywuc4w via walkingontravel
-1	riding your first wave with the tony silvagni surf school http t co 9f45wgr2vu via walkingontravel
-1	don t you just love school inset days beachlife surf http t co 7muwhbfxk5
-1	don t you just love school inset days beachlife surf https t co vnlaq7ngfp
-1	wave are narly as fuck about to go surf well everyone else is still in school got the ocean to myself
-1	rt comedyortruth i ve been ready for the last day of school since the first day of school
-1	i checked in at carolina school of surf on yelp http t co w1mtq2usdo
-1	memories from manawai surf school travel travelphotography surfing instadaily canary https t co oxtkhzdn9v
-1	riding your first wave with the tony silvagni surf school http t co zqkfvwdtu9 via walkingontravel
-1	close to impossible to sleep in the beds at school with another person lol
-1	moonemoji california facts we surf to school if we don t say dude at least 10 times a day we will die http t co sdg3gjjnty
-1	rt dscottwrites you can t stop the waves but you can learn to surf jonkabatzinn mindfulness http t co crsdpa4uee http t co t
-1	rt thesurfingsumo some great reviews for westcountry surf school on our site http t co ldmpbdrq7r learntosurf surfing http t co i1
-1	riding your first wave with the tony silvagni surf school http t co j9u5rfgspg via walkingontravel
-1	rt schoolofsurf school of surf is out http t co ndieftudqj stories via yellowflate continentseven watersportinfos
-1	school of surf is out http t co ndieftudqj stories via yellowflate continentseven watersportinfos
-1	im so down skip school and go teach kids how 2 surf
-1	surf lesson on life http t co 0zhadnhu6n
-1	1 have my own apartment by the time i m 23 2 have my all orange civic si 3 lean to surf 4 still going to school pursuing my dreams
-1	hello surfing ahikava surf school amp smoothie bar https t co j8cpaqysnj
-1	rt abi_may_jackson it s been awesome surfers lodge peniche huge thanks full report on surf school holiday coming soon patraveleditor ht
-1	listen to curren y amp smoke dza first light prod by harry fraud by surf school recordings np on soundcloud https t co fi5nahyhuw
-1	rt becciblakeway amazing weekend with woolacombe bay surf school and i m totally going to become a surfer girl http t co tlpsg4apc4
-1	amazing weekend with woolacombe bay surf school and i m totally going to become a surfer girl http t co tlpsg4apc4
-1	it s been awesome surfers lodge peniche huge thanks full report on surf school holiday coming soon patraveleditor http t co n8jykx71sm
-1	great deal for surfing ttot deals travel travelskills tni weekend rtw lp luxchat smtravel http t co kns1dfk66m
-1	rt surf_bude he he he it s gonna be fun fun fun at the surf school today the waves are lining up perfectly wearebude http t co 0mdlr
-1	riding your first wave with the tony silvagni surf school http t co vdn3wpg18q gottravel
-1	via walkingontravel riding your first wave with the tony silvagni surf school http t co lt1y3eupkz travel
-1	riding your first wave with the tony silvagni surf school http t co fqdspwqmcx via walkingontravel
-1	stay in newquay and have surf lessons with the escape school discounts available http t co lj7vswiw3l
-1	after 6 hours of kite surf lesson the best kite school is at the lagoon of grand cul de sac with enguerrand espinassou
-1	rt surfinggb https t co npok06vuob aquajuice brit school surf champs surfdome aceruk_official billabongeurope santacruz_eu c
-1	rt tripoutsurf sunrise the start of the day sunrise surf surfschool picture color https t co d2kfmaqd5z
-1	sunrise the start of the day sunrise surf surfschool picture color https t co d2kfmaqd5z
-1	thanks to freedom surf school amp adventure for being one of the sponsors for our upcoming bout on april 18th in http t co tmjq4ibr4r
-1	big thanks to freedom surf school amp adventure for being one of the sponsors for our upcoming bout on april 18th http t co e4ho0gbl5h
-1	https t co npok06vuob aquajuice brit school surf champs surfdome aceruk_official billabongeurope santacruz_eu carvevisionaries
-1	he he he it s gonna be fun fun fun at the surf school today the waves are lining up perfectly wearebude http t co 0mdlrxqjhv
-1	dad said if i give 110 on tomorrow s work out i don t have to go to school and i can go surf instead
-1	going to bali we highly recommend http t co q9jzgzdx1h personal touch fun friendly what seperates pro surf http t co z5qrabexz3
-1	at http t co zbge1vbkvc like and share my friend s surf school instagram best surf school in tahiti the be http t co wdtt46ahvw
-1	couple s surf school for bangladeshi girls changes lives http t co rp0sxqujd7 surfboards http t co xonywxns88
-1	njhlotsoflove we can surf and drink out of coconuts all day bc fuck school
-1	i just want my new wetsuit this wensday so i can ditch school and be warm in the water while i surf
-1	rt stephgracemeyer men ink article bound by sea features jack viorel of indo jax surf school http t co sh02delnmy iwrotethat surfin
-1	back to school tomorrow
-1	rt taetrilly hbkmyo announcing my acceptance at surf school with my dude taetrilly dude we are going to kill it
-1	rt hbkmyo announcing my acceptance at surf school with my dude taetrilly
-1	hbkmyo announcing my acceptance at surf school with my dude taetrilly dude we are going to kill it
