-1	extinct_surf suck my ass but yea thats what i was thinking except i cant go earlier if i have school huh
-1	rt party_stories_ when you crowd surf in a house party school plano west http t co 2zm7i4svlt
-1	surfcastle surf school as been working since 2007 bringing unique surf experiences to all our trainees we take http t co iwz1crwky0
-1	when school finished ima be the happiest person
-1	surf s up carnival this weekend at saint sebastian catholic school carnival westla http t co zht5od35py
-1	school of surf is out http t co f3sshxmwrz stories via riwmag starboardwind luismvsousa
-1	simplicity is about doing less but doing it better localssurf watch our simplifiers video http t co ha1cqn893k siegelgale
-1	hello sunny nice shades eh just wrapped up afree saturday surf school at deerfield beach with https t co sy16fp9zs0
-1	18 apr 2015 today s wave in bali by bow s surf bali surfing guide and school http t co aip9mx90h1 http t co lmmlse4vts
-1	learn to surf in lossiemouth lessons amp equipment hire available at new wave surf school http t co 2ikqdvj99s http t co d8fdppcnjv
-1	simplicity is about doing less but doing it better localssurf watch our simplifiers video http t co r7zh6max0z
-1	lovely weather blouberg pitty edenonthebay grass is in a bad state surf school in action http t co fwbtjwqeso
-1	riding your first wave with the tony silvagni surf school http t co tan3l9f3bx via walkingontravel
-1	love this old school surf van surfing http t co b5kzaiqqad
-1	surfing surfing advanced pop up gift surf school hawaii http t co t2oefz8tlk http t co dvxwlto9hc
-1	corsi surf kayaksurf sup wave blackwave surf school amp shop http t co a6qkf4hpmt
-1	lou surfou is good for you ecole de surf surf school surf seignosse surfingfrance billabong http t co manxa2hid2
-1	stay in newquay and have surf lessons with the escape school discounts available http t co lj7vswiw3l
-1	sat 18 amp sun 19 apr liberty longboard classic son surf school strand helderberg http t co rdu5brd8gk
-1	meowman jamesvhenry meow meow meow endless sun surf school https t co eywhtmlv8s
-1	i m at msp surf school in galle southen https t co 4dpver10ds
-1	to the waves girlsurfing crosscountry surfeasy funandfitness currumbinalley surf easy surf school https t co oqmaihaygd
-1	mom at work and pops he at school well that s what mama said but i ain t no fool tsu_surf
-1	rt lowlifebvrfield listen to nachopicasso in the trump prod by harry fraud by surf school recordings np on soundcloud https t c
-1	rt carolinabeachnc join pro surfer amp cb native toni silvagni at the inaugural tony silvagni surf school foam board fest http t co xsy
-1	rt lowlifebvrfield listen to nachopicasso in the trump prod by harry fraud by surf school recordings np on soundcloud https t c
-1	listen to nachopicasso in the trump prod by harry fraud by surf school recordings np on soundcloud https t co tciab63fkv
-1	spankin new greco soft tops for surf lessons amp clinics surfschool softtopboards magiksea https t co k09luvphcx
-1	rt fairfaxnswnorth surfingaus how good s this surf photo the evolution of a grommet http t co ilksfmldsq via mrtaree http t co
-1	pottery barn kids hawaii and california surf school wood wall picture art link http t co evi7a83jui http t co zhwv9xkeej
-1	rt carolinabeachnc join pro surfer amp cb native toni silvagni at the inaugural tony silvagni surf school foam board fest http t co xsy
-1	the 2015 guide to surf universities which surf school suits you best http t co jrzzjgfzd7 via the_inertia
-1	rt carolinabeachnc join pro surfer amp cb native toni silvagni at the inaugural tony silvagni surf school foam board fest http t co xsy
-1	can i just lie all day play and surf like normal summer from school
-1	fistral today fistral fistralbeach fistralbeachsurfschool fistral beach surf school amp surf hire https t co fqea476xdz
-1	my school has a surf unit for pe
-1	instructor luan medeiros training hard in pipa brasil zangs surf wear surfcamppipa surf school brazil
-1	we want to keep it simple so we can handle growth in the right way http t co r7zh6mjlcp http t co grqvokgyqg
-1	check out the new promo from our friends in lahinch surf experience hands down the best surf school in lahinch http t co babzuijsp1
-1	proskiier doing your surf school
-1	rt killemwhiteboy can i skip school amp surf
-1	uc campuses ranked by the inertia as top academic surf schools guess which one is the top core surf school http t co jtebox0eqt
-1	next level surf camp the original european surf tour surf lifestyle and surf school company all wrapped in one http t co kljxb0qsid
-1	join pro surfer amp cb native toni silvagni at the inaugural tony silvagni surf school foam board fest http t co xsyrl8begf
-1	can i skip school amp surf
-1	riding your first wave with the tony silvagni surf school http t co 2sj3podlet via walkingontravel
-1	this sunday ajani s irie surf school barbados host its annual surf competition at pebbles beach after party at http t co kxvmwm944c
-1	happy aloha friday from your friends at hans hedemann surf school hawaii have a great weekend pc josephlibby http t co u8y39mjuw6
-1	rt barbadosboosy new videos up at boosy s surf school on facebook photo credit mark harris barbados surfing soupbowl gopro http t
-1	school of rock is on and i ve decided i want to crowd surf at least once in my life
-1	volunteer randy helped us build our school in el paredon in partnership with surf for life and loved the http t co wi2vnp0jts
-1	rt ravensurfschool raven surf school is opening a new office in portugal on the beautiful unspoiled algarve based in lagos we will h
-1	review of the tony silvagni surf school from walkingontravels http t co of4hsifjq4
-1	rt photographerswb give and surf is a non profit that provides school programs and surf outreach mentorship in indigenous communities htt
-1	fresh homemade local bodhi breakfast is served bodhi surf school https t co twqzfzfk1z
-1	can t surf on fridays because this school shit isn t wavy
-1	just think about this while you re all at school i m heading to santa cruz to surf
-1	rt dory high school http t co ollub6zsdb
-1	school of surf is out http t co ppfhek4q94 stories via ifcafunboard virtualstarr justjomtien
-1	give and surf is a non profit that provides school programs and surf outreach mentorship in indigenous communities http t co e6nrciewsu
-1	rt friddle_brandon gona be one of those high school grom that surf after school
-1	gona be one of those high school grom that surf after school
-1	join the corky carroll s surf school newsletter http t co c2oxzgwsrp
-1	a brand i made for my final project for school art artwork skate surf beach beachlife https t co rs4vaxgcpv
-1	raven surf school is opening a new office in portugal on the beautiful unspoiled algarve based in lagos we will http t co ji6du3op0w
-1	17 apr 2015 today s wave in bali by bow s surf bali surfing guide and school http t co aip9mx90h1 http t co z8qrxzaz1d
-1	surf school 05 jpg nude female celebrity scenes pictures and videos celebrity surfschool05jpg pictures videos
-1	don t wanna go to school wanna surf
-1	no longer temporary manager of the surf school phew
-1	i must go to sleep for 3hrs in order to go to school this is what happens when i surf through the internet noregrets
-1	sat 18 amp sun 19 apr liberty longboard classic son surf school strand helderberg http t co yhy7nfxkfe
-1	primeamazon vans men s backpack skate bag treflip black grey vn 0okiy30 school bag http t co demnilxmet surf skate street retweet
-1	riding your first wave with the tony silvagni surf school http t co eomwkc2bqz via walkingontravel
-1	why do we have to go to school i wanna just stay at home and surf the internet all day and all night
-1	surf_strat why do u revive so late like do you have work or school or some shit
-1	morning at pro surf school bali pic https t co wt3ruldb8f
-1	rt imrufamaequinto surf school then cool down with shower https t co zsiiibj7ai
-1	surf school then cool down with shower https t co zsiiibj7ai
-1	we hi hawaii surf surfoahu northshore paradise hi surf shop amp school https t co knu4qng765
-1	they don t have surf taco in wisconsin i can t go to school there
-1	rt kailab3ar starryeyed82 ashmarie_27 we have to go to his surf school remember
-1	starryeyed82 ashmarie_27 we have to go to his surf school remember
-1	rt daswamidon friday night surf camping trips redondo to hungtinton beach high school days https t co nm6ulxiv9k
-1	friday night surf camping trips redondo to hungtinton beach high school days https t co nm6ulxiv9k
-1	a6 is there some sort of volunteer run surf school that needs help weekendwanderlust
-1	everyone is stressing about school and all i m stressing about is putting my surf board on an air plane and where i m traveling next
-1	flowerpower surfschool 2015 with amazing moments lots of fun good waves join our daily surf classes or rent http t co vihehdny19
-1	listen to curren y amp smoke dza first light prod by harry fraud by surf school recordings np on soundcloud https t co fi5nahyhuw
-1	the internet is a blessing amp a curse if i need to know anything about someone s relationship family school work i just surf the internet
-1	new review for boosy s surf school on tripadvisor is up thanks donna http t co 9es30n9xoj barbados gopro surf http t co deupvnh32b
-1	sunset yoga in playa carrillo with chillasana yoga amp surf school cs vinyasa yoga will not only optimize your http t co katg4dnk2s
-1	surf school at tynemouth longsands http t co yphu78ejrr
-1	rt ravenser surf school at tynemouth longsands this evening http t co enlxa5cofq
-1	rt ravenser surf school at tynemouth longsands this evening http t co enlxa5cofq
-1	rt ravenser surf school at tynemouth longsands this evening http t co enlxa5cofq
-1	surf school at tynemouth longsands this evening http t co enlxa5cofq
-1	flowerpower surfschool 2015 with amazing moments lots of fun good waves join our daily surf classes or rent http t co jk1x2sszyt
-1	rt cozyknights beachjewellery_ surfsouthwest one amp half miles from the best surf school in devon
-1	who thought of corky carroll s surf school the first surf school of huntington beach http t co aurgqggzww
-1	cozyknights surfsouthwest seriously that s great and surfsouthwest can i park my car at your surf school for cheap or free
-1	danbeav i m from the bayou yo went kayaking in the surf before a hurricane in high school i ll be right in my element
-1	surf school tynemouth longsands http t co rnusjzbkbj
-1	rt comedyortruth how am i supposed to go to school do homework study stay in shape be social help out at home and get 8 hours of s
-1	rt cozyknights beachjewellery_ surfsouthwest one amp half miles from the best surf school in devon
-1	goliveoutdoors you can book a surf lesson at woolacombe here http t co sispcllqbn get on it
-1	did transworld surf really just get blocked at school
-1	beachjewellery_ surfsouthwest one amp half miles from the best surf school in devon
-1	another day another poorly drawn naked person hartford art school https t co n8qtkgaaza
-1	s o to the three girls in shark s surf shop tees at hale right now i think you re at the wrong school ladies lfk
-1	waterworld surfing school presenta save the reef surf contest chequea la entrevista a roly con toda la http t co fwrvwrlysr
-1	surf the 2015 guide to surf universities which surf school suits you best http t co njzymkczbo http t co xxpb22fdot santacruz
-1	flowerpower surfschool 2015 with amazing moments lots of fun good waves join our daily surf classes or rent http t co vt2wqleaf0
-1	rt clickhole shocking this is what our kids school lunches look like http t co d8yptdpqat http t co kn0gmg3hii
-1	school of surf is out http t co 1g2tqgoijp stories via 4windsurf windsurfmag maxmassironi
-1	took the surf to school time to get these locs retwisted
-1	surf the 2015 guide to surf universities which surf school suits you best http t co njzymkczbo http t co ookq97khx1 santacruz
-1	surf the 2015 guide to surf universities which surf school suits you best http t co sspqml6dpy santacruz http t co r1twoovhvi
-1	surf the 2015 guide to surf universities which surf school suits you best http t co njzymkczbo http t co wgr35zizvs santacruz
-1	welcome to domizar cornish wave mobile surf school check out their profile here http t co y50o5fd1sl http t co srevogjrbq
-1	surf the 2015 guide to surf universities which surf school suits you best http t co njzymkczbo http t co bwzthegu2t santacruz
-1	riding your first wave with the tony silvagni surf school http t co zjisiopwon via walkingontravel
-1	surf the 2015 guide to surf universities which surf school suits you best http t co njzymkczbo http t co nw3aulfpft santacruz
-1	read how vivit has helped customers improve business with onlinebookings http t co laubhxm2ni
-1	16 apr 2015 today s wave in bali by bow s surf bali surfing guide and school http t co aip9mx90h1 http t co a3tuqtrsf5
-1	surf the 2015 guide to surf universities which surf school suits you best http t co njzymkczbo http t co g91prdog0b santacruz
-1	tbt to 10 years ago today on my 20th birthday at surf school in seven mile beach nsw australia https t co uknia6ysog
-1	surf the 2015 guide to surf universities which surf school suits you best http t co njzymkua2w http t co ajnelkerdp santacruz
-1	this is what we re up to this weekend wanna join pull in and visit us at our new surf amp sup school https t co p5chuqlrbd
-1	surf the 2015 guide to surf universities which surf school suits you best http t co uxu4t4prsd surfboards http t co ox7gehqhad
-1	interested in learning to surf el palmar in panama has a great surf school enjoy the waves inside panama http t co yvn27u8zi8
-1	it s the perfect time of year for a surf lesson with get wet surf school http t co o3gci47b3d
-1	riding your first wave with the tony silvagni surf school http t co 5pl35ykpfd via walkingontravel
-1	surf the 2015 guide to surf universities which surf school suits you best http t co njzymkua2w http t co 9n0gjjgtp4 santacruz
-1	surf the 2015 guide to surf universities which surf school suits you best http t co njzymkua2w http t co pdvvs3oyuk santacruz
-1	surf the 2015 guide to surf universities which surf school suits you best http t co njzymkua2w http t co lvzkfgcstj santacruz
-1	riding your first wave with the tony silvagni surf school http t co yod9efxgzc via walkingontravel
-1	i ve just bought 1 day surfing lesson from odysseys surf school bali get it now before its too late
-1	surf the 2015 guide to surf universities which surf school suits you best http t co njzymkua2w http t co tiyljwqny0 santacruz
-1	surf the 2015 guide to surf universities which surf school suits you best http t co njzymkczbo http t co gy2jboji5i santacruz
-1	we hi hawaii surf surfoahu northshore paradise hi surf shop amp school https t co knu4qng765
-1	surf school quiksilver juliendavid justoneeye juliendavidxquiksilver surf hang10 just one eye https t co m392kaygzs
-1	surf the 2015 guide to surf universities which surf school suits you best http t co njzymkua2w santacruz http t co cr8fjuov2c
-1	surf the 2015 guide to surf universities which surf school suits you best http t co njzymkczbo http t co gwtjays0m8 santacruz
-1	oakley backpack green military black nylon laptop bag hiking school skate surf at tactical gear zone http t co edw4utgriq oakley hiki
-1	oakley backpack green military black nylon laptop bag hiking school skate surf at tactical gear zone http t co o28azqksof oakley hiki
-1	surf the 2015 guide to surf universities which surf school suits you best http t co njzymkczbo http t co 4ehcghd4ju santacruz
-1	surf the 2015 guide to surf universities which surf school suits you best http t co njzymkua2w santacruz http t co kmzrygevg4
-1	shoresurf welcome to owler your company profile can be accessed here http t co ye8iwyromo
-1	surf the 2015 guide to surf universities which surf school suits you best http t co njzymkczbo http t co hpcjgtx1vj santacruz
-1	surf the 2015 guide to surf universities which surf school suits you best http t co njzymkczbo santacruz http t co krd9fc6nmd
-1	surf the 2015 guide to surf universities which surf school suits you best http t co njzymkczbo http t co cbzlqf9vco santacruz
-1	i can t be bothered with school
-1	rt ccabelloch hey let s hit up walmart and grab some chipotle and surf our way through california before high school starts yo
-1	surf the 2015 guide to surf universities which surf school suits you best http t co njzymkczbo http t co 1orkpfiscz santacruz
-1	if it flood them bitches go want you to surf to school
-1	love the natural world and kindered spirits corky cochran surf school xo
-1	surf the 2015 guide to surf universities which surf school suits you best http t co njzymkczbo http t co jorg84y0ro santacruz
-1	surf the 2015 guide to surf universities which surf school suits you best http t co sspqml6dpy santacruz http t co eovqcghs9t
-1	watch this this could be you s trip high school grad trip excursions surf camp http t co olipkhgp8u
-1	plankers coolsport00 shoulder surf school action appropriate but not the rest we need to be capable of considering age offenses
-1	primeamazon vans men s backpack skate bag treflip black grey vn 0okiy30 school bag http t co demnilxmet surf skate street retweet
-1	surf the 2015 guide to surf universities which surf school suits you best http t co njzymkczbo http t co tfek3ovvej santacruz
-1	just told someone that i m from california amp they ask if i used to surf to school
-1	the golden breed surf movie complete old school longboarding music by da https t co spx8d5wun5 via youtube surf classic film
-1	amazing sup tour of the copper coast waterford with freedom surf school and adventure summerscoming flatdays
-1	rt biarritzblog cause surfing is everything biarritz lagoondy surfschool cotedesbasques surf board placetosurf thelittlecartel http
-1	stoked school of surf prize winner dutch for days never at home http t co hkhyp5xond
-1	surf the 2015 guide to surf universities which surf school suits you best http t co njzymkczbo http t co g5yrtfnevp santacruz
-1	rt giveandsurf we re so stoked to be partnering with surf for life to build a new school in bahia roja this summer http t co sohwolcupf
-1	wade_2000 idk but im at school
-1	baia de peniche well located on the bay of peniche ba a de peniche bodyboard surf school combines all the http t co 0tn0t2txn1
-1	baia de peniche well located on the bay of peniche ba a de peniche bodyboard surf school combines all the http t co qoij4hdsaf
-1	popehat when i visited pepperdine in high school it was with pre med in mind when i left that day i was thinking more about the surf team
-1	surf the 2015 guide to surf universities which surf school suits you best http t co njzymkczbo http t co ntxpys0raz santacruz
-1	east coast hui surf school will be donating 50 to the mr8 foundation today when you sign up for surf camp god bless http t co i66bhns21p
-1	huntington beach surf lessons farewell to alex gray http t co lm9eecrjp6
-1	after school beach surf jumping http t co dijyxlhjn1
-1	rt _alexoverboard i m so upset i can t go to skate and surf cause i still be at school there s so many good bands playing
-1	i m so upset i can t go to skate and surf cause i still be at school there s so many good bands playing
-1	flowerpower surfschool 2015 with amazing moments lots of fun good waves join our daily surf classes or rent http t co t5sj9rlnb2
-1	surf the 2015 guide to surf universities which surf school suits you best http t co njzymkczbo http t co zqpt12ubr7 santacruz
-1	the 2015 guide to surf universities which surf school suits you best http t co ttrv83cz6r the_inertia http t co frugzomis7
-1	rt shopsurfjobs 2015 guide to surf universities which surf school suits you best http t co aahjvimcra http t co 0w1yb3oh9m
-1	rt shopsurfjobs 2015 guide to surf universities which surf school suits you best http t co fjo9rrfanr http t co 0kuajl6aqy
-1	rt shopsurfjobs 2015 guide to surf universities which surf school suits you best http t co rucbeohu3h http t co 9bhxm6twcr
-1	why the heck do i surf internet like i have no homework and 16382949 pages to memorize and there s no school tomorrow
-1	stay in newquay and have surf lessons with the escape school discounts available http t co lj7vswrkel
-1	rt santacruz_agent surf the 2015 guide to surf universities which surf school suits you best http t co njzymkczbo http t co imydt
-1	surf the 2015 guide to surf universities which surf school suits you best http t co njzymkczbo http t co imydtswksb santacruz
-1	surf the 2015 guide to surf universities which surf school suits you best http t co njzymkua2w santacruz http t co nipxkhtoyr
-1	surf the 2015 guide to surf universities which surf school suits you best http t co njzymkczbo http t co rqnx2aru2t santacruz
-1	rt cfcamerer caltech surf student josh kim coauthored w us in amer econ rev before grad school he s off to stanford econ phd http
-1	thinking of our indo jax surf school family tomorrow they will travel to varkala beach kerala to share their http t co 5ebkprumpp
-1	caltech surf student josh kim coauthored w us in amer econ rev before grad school he s off to stanford econ phd http t co baqghavetu
-1	rt lajollamom riding your first wave with the tony silvagni surf school http t co xa5kbucg1x via walkingontravel
-1	surf the 2015 guide to surf universities which surf school suits you best http t co njzymkczbo http t co l918euj5tf santacruz
-1	rt ucsdnews uc san diego ranked no 2 academic surf school by the inertia a website for surfers http t co crkx1gsokm ucsd http t
-1	rt ucsdnews ucsd ranked no 2 academic surf school by the inertia a website for surfers http t co sa1ubzqabd http t co rat3149i5r
-1	my new sounds bloues break april 15 2015 billy hector old school thang ghetto surf https t co 7mbjmp9ju9 on soundcloud
-1	rt lajollamom riding your first wave with the tony silvagni surf school http t co xa5kbucg1x via walkingontravel
-1	school of surf is out http t co jmbbnkibsp stories via thetravellers1 stokednews gigimadeddu
-1	rt lajollamom riding your first wave with the tony silvagni surf school http t co xa5kbucg1x via walkingontravel
-1	the suicide death of a high school student from a prestigious academy turns out to be a homicide soon he was dragged away by the surf
-1	surf the 2015 guide to surf universities which surf school suits you best http t co njzymkczbo http t co nyssqwtvfa santacruz
-1	surf the 2015 guide to surf universities which surf school suits you best http t co njzymkua2w santacruz http t co butghedpaj
-1	one went to a mcdonalds and went to hunter sports high school surf_strat
-1	we braaing tonight come join us stoked school of surf will be giving away a prize http t co xj4maaen1l
-1	surf the 2015 guide to surf universities which surf school suits you best http t co njzymkczbo http t co rvc2xg2jrk santacruz
-1	surf the 2015 guide to surf universities which surf school suits you best http t co njzymkczbo http t co 3hqancknex santacruz
-1	eat surf stare at school works lay down in bed but never sleeping whatislife
-1	aaron_dont_surf get to school you an fagit
-1	blessed to see another day up getting ready for school np tsu_surf you re worst
-1	surf the 2015 guide to surf universities which surf school suits you best http t co njzymkczbo http t co g4ehuk2zuu santacruz
-1	old school http t co 3vs909swmb
-1	15 apr 2015 today s wave in bali by bow s surf bali surfing guide and school http t co aip9mx90h1 http t co advdaocdai
-1	surf the 2015 guide to surf universities which surf school suits you best http t co njzymkczbo http t co xrwayqk5cv santacruz
-1	rt surferliving rt shopsurfjobs 2015 guide to surf universities which surf school suits you best http t co hhymwga2tw http t co w
-1	surf the 2015 guide to surf universities which surf school suits you best http t co njzymkczbo http t co hfzbnj6mzy santacruz
-1	rt shopsurfjobs 2015 guide to surf universities which surf school suits you best http t co hhymwga2tw http t co wkksc8q9rx
-1	lil bros going for a surf after school http t co aqyprmhfmk
-1	surf the 2015 guide to surf universities which surf school suits you best http t co njzymkczbo http t co hzz5lzn11t santacruz
-1	surf the 2015 guide to surf universities which surf school suits you best http t co njzymkczbo http t co s2nzgxgnkv santacruz
-1	surf school nude sex scenes pictures and videos http t co vxlgn1hban celebrity surfschool pictures videos
-1	surf the 2015 guide to surf universities which surf school suits you best http t co njzymkczbo http t co jop6o82bo7 santacruz
-1	taaaasssiiiaaaa fuck school
-1	surf_vb_all_day melissa i love you too please rest we have school in a few hours
-1	parliament primary school keeping kids safe in the surf pps15 ymcaempowers surfsafe
-1	surf the 2015 guide to surf universities which surf school suits you best http t co njzymkczbo http t co g0fcw22dk4 santacruz
-1	whenever i surf tumblr in school it lags like hell
-1	rt sadii_22 aggravated is hell phone on do not disturb tsu_surf where have you been on until i k o school in the a m
-1	aggravated is hell phone on do not disturb tsu_surf where have you been on until i k o school in the a m
-1	i m pretty sure everyone in school was in love with you
-1	rt isasurfing going against all odds to surf amp go to school in india isa ambassador saku is an inspiration http t co z8h30eyve9 http
-1	gakuen polizi encouraging high school girls to surf porn sites on a regular basis haha xd jkjk
-1	interested in learning to surf el palmar in panama has a great surf school enjoy the waves inside panama http t co lvjmosbmrp
-1	surf the 2015 guide to surf universities which surf school suits you best http t co njzymkczbo http t co oxxaukv7rc santacruz
-1	i just played after school navigators on audio surf and i was like w the whole time
-1	fatboy_kevin cont plus by the time i learn to surf if i do id be to old for it to be cool like i would want to still be in high school
