-1	rt sinemapodcast breaking news someone s only gone amp leaked last week s sinema expect dubious translation beavershark amp onions http
-1	rt sinemapodcast breaking news someone s only gone amp leaked last week s sinema expect dubious translation beavershark amp onions http
-1	breaking news someone s only gone amp leaked last week s sinema expect dubious translation beavershark amp onions https t co ygbtadrmp1
-1	rt sinemapodcast sinema saturday this week we awkwardly bind our podcast name with a day of the week in an attempt to gain listeners htt
-1	rt johncnharris check out this week s sinemapodcast we chat lizard beasts and topless men https t co qfqzmefgpc
-1	sinema saturday this week we awkwardly bind our podcast name with a day of the week in an attempt to gain listeners https t co ygbtadrmp1
-1	rt sinemapodcast friday you look splendid while we re on the subject of splendid check out this week s podcast twobellringsofgold http
