-1	books 2233 survivors terry nation my mate twigger is planning for the zombie apocalypse i ve been planning for viral wipeout since this
-1	rt geekygifts1 zombie sign it s only fair to warn people about your zombie after all http t co jdccknqgxm
-1	zombie sign it s only fair to warn people about your zombie after all http t co jdccknqgxm
-1	but of course the liberal obama zombie nation will either deny this entirely or go back to their old school http t co tvqta7j07x
-1	rt longhany prop bets on blue white game attendance over under 70k citations given o o 150 total points scored o o 84 zombie nation p
-1	prop bets on blue white game attendance over under 70k citations given o o 150 total points scored o o 84 zombie nation played o o 5
-1	god i love waking up to zombie nation
-1	zombie nation is out http t co 9asrkhd1un stories via sisterofthulu nicholas_vince nicegames75
-1	rt geekygifts1 if there was a zombie apocalypse would you survive http t co uuzrbkcfo3
-1	goodmotivator mashishimos then we seem to be a zombie nation
-1	if there was a zombie apocalypse would you survive http t co uuzrbkcfo3
-1	i don t have control of the music please sing zombie nation yourself
-1	philthethrill my biggest part is in a movie called zombie nation which is a truly strange horror movie by ulli lommel it s on netflix
-1	rt keithnrichards i liked a youtube video http t co giass1bljq rave 5 sandstorm vs blow your mind vs zombie nation vs blade techno op
-1	rt senatorjohn thanks there s more to life than zombie nation soxmusic https t co y5jygimxyp
-1	rt senatorjohn thanks there s more to life than zombie nation soxmusic https t co y5jygimxyp
-1	thanks there s more to life than zombie nation soxmusic https t co y5jygimxyp
-1	roblox lets play ep 6 zombie nation http t co d6ncptosfr via youtube
-1	i liked a youtube video http t co ywlrpu3osy zombie nation woah oh oh 30min hd
-1	i added a video to a youtube playlist http t co ywlrpu3osy zombie nation woah oh oh 30min hd
-1	wow reading the cast list on the zombie nation is not making me want to read the comic
-1	backpacking australia is the best way to experience the zombie nation zombies
-1	season 2 of z nation hoping i can get a role nikeimoru geraldwebb zombie znation actors washington spokane tv
-1	loving that jasehagger is playing zombie nation work fridaynightbeats
-1	kernkraft 400 by zombie nation found with shazam listen now http t co 4wsfxnldml
-1	nothing screams zombie nation like englebert val jean and randy bachman https t co lavewshvzw
-1	rt weekiirky_x a remember about a month ago me and jamiebyrne_ walked in on choooobe dancing to zombie nation in his maws nightey
-1	rt weekiirky_x a remember about a month ago me and jamiebyrne_ walked in on choooobe dancing to zombie nation in his maws nightey
-1	a remember about a month ago me and jamiebyrne_ walked in on choooobe dancing to zombie nation in his maws nightey
-1	basement_nation glad to have you on our trail help us make a movie on a zombie salary here http t co oczcqsh9mi
-1	the interview with zombie nation is coming up right now on in it for the kicks for those night owls
-1	clinmick gordie_bhoy hahaha sums up the type ae guu he is then well seeing he s a slef proclaimed supporter ae the zombie nation
-1	zombie nation is out http t co odci5idqq8 stories via filmfactoryuk amandathomas90 sisterofthulu
-1	if you know the words sing along drops zombie nation
-1	nueva musica free download https t co sdh57prkbs
-1	i m listening to kernkraft 400 dj gius live remix by zombie nation on pandora http t co shhraoal2j
-1	probably my fave pair zombie nation leggings i always receive so many compliments when i wear https t co uipnooeoaa
-1	oi team gb get ur own goal song zombie nation belongs to the caps thieves
-1	tonight on our lil radio show in it for the kicks greg amp i talk to zombie nation about the creation of kernkraft http t co 1kylvu2h4p
-1	rt thebarryhorns zombie nation brass band stylee https t co nv0yjlsjlz walesaway zombienation
-1	listening to zombie nation in the car last time we listened to their goal song the penguins scored so
-1	enzy s nation music premier authentic zombie dance ft isolate http t co 046jzn6mpe
-1	now playing zombie nation push
-1	pool nation fx 2nd twitch http t co xhpndkezz7
-1	a new favorite zombie nation kernkraft 400 riggi and piros rmx etc etc trapped it free download by iametc https t co jlw46dodsf
-1	offisheel how s zombie nation oh too soon
-1	rt makegreatlight zombies could be in your office read our blog on productivity insomnia amp lighting http t co dao2mwl3my http t
-1	rt makegreatlight zombies could be in your office read our blog on productivity insomnia amp lighting http t co dao2mwl3my http t
-1	backpacking australia is the best way to experience the zombie nation zombies
-1	a total of 10 hours of sleep in the past 3 days zombie nation is now accepting pledges anyoneiswelcome
-1	zombies could be in your office read our blog on productivity insomnia amp lighting http t co dao2mwl3my http t co bodef6zcgy
-1	100 trance with zombie nation kernkraft 400 w amp w http t co xh83zjf39i follow and rt us
-1	zombie nation worth it http t co ca3ze33fqq
-1	seniors how the left considers you a zombie tea party nation http t co bcpu7wplfq
-1	rt lovebian zombie nation is out http t co mbku4yle1d stories via vakulkumarmore jsdavis9901 ongoingly
-1	remember the track kernkraft 400 by zombie nation that i played about 374528454 times in 2000 and at nearly http t co exl5czmypf
-1	rt zaiyd_patni roboootic go check out my bigroom house with an oldschool tune it s one of those huge tracks to be played http
-1	zombie nation is out http t co mbku4yle1d stories via vakulkumarmore jsdavis9901 ongoingly
-1	z nation is the realist zombie show dude just smoked out a zombie
-1	rt rizwanyousuf8 since pmlnservingthenation half the nation is turned into zombies btw remaining half is already zombie after national
-1	since pmlnservingthenation half the nation is turned into zombies btw remaining half is already zombie after national serving of ppp
-1	abatouttahell i was going to hashtag the chant from zombie nation but was derailed by this hilarity http t co zki81d5bwk
-1	roboootic go check out my bigroom house with an oldschool tune it s one of those huge tracks to be played http t co bd26diwmfi
-1	roboootic go check out my bigroom house with an oldschool tune it s one of those huge tracks to be played http t co 7dygqzzaur
-1	roboootic go check out my bigroom house with an oldschool tune it s one of those huge tracks to be played http t co zovc3oiqgh
-1	hey look everyone the padres played zombie nation how smart and original and creative
-1	every hockey game has to have zombie nation playing at some point
-1	zombie nation just played at bridgestone arena my heart hurt a little
-1	danj_official thank god no although zombie nation is pretty bad
-1	pool nation fx 1st twitch http t co l4jlfvxbfw
-1	pool nation fx 1st twitch http t co tqv05x6bis
-1	cardiodimension the zombie baby on z nation
-1	yeaaaah zombie nation finally
-1	what s up cake zombie nation
-1	davidvonderhaar will there be zombie remastered maps in bo3 mr vonderhaar
-1	our war against the zombie nation has already begun we simply just don t realize it yet and are behind in the fight
-1	imjimr87 fave if you know this song without hearing it kernkraft 400 dj gius mix by zombie nation from s http t co mdobxikd0x
-1	fave if you know this song without hearing it kernkraft 400 dj gius mix by zombie nation from soundhound http t co szf9jm9yxv
-1	mexico is a zombie nation it doesn t live it just exists
-1	now playing zombie nation mr sunbeam
-1	zombie nation worth it http t co ca3ze33fqq
-1	backpacking australia is the best way to experience the zombie nation zombies
-1	panoramix radio station djs producers zombie nation kernkraft 400 w amp w remix http t co dtwwyfxyto http t co npnpffepc2
-1	kamber well with i zombie it s quite refreshing and z nation is based on a cure walking dead is built on solid characters story
-1	z nation is a show i love to hate it so amazing yet shitty all one procedural apocalypse zombie show closure znation
-1	zombie nation never gets old
-1	rt syfyau enter your free codeword here http t co sjmaspar4c for your chance to be a zombie extra in z nation season 2 http t co 0p
-1	ultra zombie nation kernkraft 400 w amp amp w remix by letmehearthefuckingbass on soundcloud np https t co 8k7kwzstxl
-1	nowplaying kernkraft 400 zombie nation http t co rr1wsrmdtd
-1	zombie nation is out http t co 65h9lnhgyl stories via deidbastards jokaihaku mass_creation
-1	rt syfyau enter your free codeword here http t co sjmaspar4c for your chance to be a zombie extra in z nation season 2 http t co 0p
-1	rt syfyau enter your free codeword here http t co sjmaspar4c for your chance to be a zombie extra in z nation season 2 http t co 0p
-1	enter your free codeword here http t co sjmaspar4c for your chance to be a zombie extra in z nation season 2 http t co 0puwtgb040
-1	rt geekygifts1 could you survive a zombie apocalypse role playing book http t co 47vjxsof8x
-1	could you survive a zombie apocalypse role playing book http t co 47vjxsof8x
-1	spoiler alert lori is a technologically advanced zombie sent back in time to kill rick and the gang in order to fulfill zombie nation
-1	rt topeditorint sa s shame mob mentality grips nation as violence becomes the only way for the zombie masses http t co v3zqkmggox
-1	rt topeditorint sa s shame mob mentality grips nation as violence becomes the only way for the zombie masses http t co v3zqkmggox
-1	rt g_coppo zombie nation rt tyleriam whats the best song you ever heard when you drunk
-1	rt angry_haitian go knights rt g_coppo zombie nation rt tyleriam whats the best song you ever heard when you drunk
-1	zombie nation rt tyleriam whats the best song you ever heard when you drunk
-1	panoramix radio station djs producers zombie nation kernkraft 400 w amp w remix http t co dtwwyfxyto http t co npnpffepc2
-1	zombie nation velcrosquat light http t co vodtdty7io nowplaying
-1	zombie nation worth it http t co ca3ze2lezi
-1	scientists determine the nation s safest places to ride out a zombie outbreak http t co peiuiuwjhv
-1	i love watching z nation like its so good zombie movies and shows always have my attention
-1	on air nanou better off alone zombie girl vs barbie nation mix http t co jdxg3abvyg
-1	i still remember flosstradamus mash up of act a fool and zombie nation after all these years 4life
-1	rt zombietacteam hot chocolate and zombie zombienation zombiestory zombie hotchocolate owl cute mermaid and weirdlegs by htt
-1	kernkraft 400 by zombie nation is nowplaying in genesis dandedong dandenong download it now at http t co llu5x4f9jm
-1	scientists determine the nation s safest places to ride out a zombie outbreak http t co peiuiuwjhv
-1	hi zombie nation last day before the price rise tomorrow so get those registrations in it looks like we
-1	walkingdead zombie identification chart white t shirt adult size s walking dead z nation http t co enivvdveod unisex deals
-1	rt mathesonanna another day in the acid nation
-1	zombie nation kernkraft 400 from the album fired up 2004
-1	i have kernkaft 400 zombie nation stuck in my head
-1	zombie nation so to fit n as one u gotta talk zombie talk
-1	scientists determine the nation s safest places to ride out a zombie outbreak http t co peiuiuwjhv
-1	you re going to be so pissed at yourself when you see what you missed http t co drry7q6gzi
-1	davidgknights i do know whetever he paid for that zombie nation track he s had his money s worth
-1	rt rekka_kun my retrogaming nes game of the day is zombie nation http t co rvzlylbghp
-1	i liked a youtube video from leon_nation http t co kyxf8x0uqj leon nation zombie trickshotting
-1	rt coaster_nation the 2015 zombieprom presented by fearfair haunted house was awesome check out photos amp everything you missed http
-1	rt rekka_kun my retrogaming nes game of the day is zombie nation http t co rvzlylbghp
-1	rt rekka_kun my retrogaming nes game of the day is zombie nation http t co rvzlylbghp
-1	my retrogaming nes game of the day is zombie nation http t co rvzlylbghp
-1	arclegger 6 40 zombie nation love it how very relevant
-1	zombie nation zzz traveling to ft myers fl from pittsburgh international airport http t co rysypfjfic
-1	zombie nation is out http t co puh7vbhbre stories via joscomic zombies_dp greenhillcomics
-1	scientists determine the nation s safest places to ride out a zombie outbreak http t co peiuiuwjhv
-1	backpacking australia is the best way to experience the zombie nation zombies
-1	and quietly the zombie nation begins scifri as the arctic permafrost thaws microbes are kicking into action http t co pf9aksgjom
-1	soccer game goals crowd chants zombie nation while you play
-1	djred678 politichickam carlyfiorina you seem to think i m extremely ignorant http t co xxb6ql0lan
-1	the 2015 zombieprom presented by fearfair haunted house was awesome check out photos amp everything you missed http t co z2fqldlycb
-1	z nation review http t co 3qbph2khnn zombie znation http t co w8tpfvaf3x
-1	rt mistermetokur i m triggered that a three year old victim is afraid of black men now probation for everyone http t co qzel4rckl
-1	panoramix radio station djs producers zombie nation kernkraft 400 w amp w remix http t co wslrs1pe0w http t co npnpffepc2
-1	there s a zombie apocalypse tv series called z nation and this is the first i m hearing about it omg
-1	rt hypnoticvibes kill your tv culture programming zombie nation
-1	kill your tv culture programming zombie nation
-1	rt rasmajesty kill your tv culture programming zombie nation
-1	kill your tv culture programming zombie nation
-1	rt granttanaka zebras are born black with white stripes playing seven nation army
-1	definitely trying to sign up for a class next semester called zombie nation
-1	i added a video to a youtube playlist http t co xgqz1zdkq9 zombie nation kernkraft 400
-1	now playing zombie nation kernkraft 400 http t co ni5vaeewvd
-1	rt thebarryhorns zombie nation brass band stylee https t co nv0yjlsjlz walesaway zombienation
-1	i knew it i knew it them islamic freaks are the real zombies watch out zombie nation http t co cmrqyeudma
-1	rt thebarryhorns zombie nation brass band stylee https t co nv0yjlsjlz walesaway zombienation
-1	rt thebarryhorns zombie nation brass band stylee https t co nv0yjlsjlz walesaway zombienation
-1	rt thebarryhorns zombie nation brass band stylee https t co nv0yjlsjlz walesaway zombienation
-1	rt thebarryhorns zombie nation brass band stylee https t co nv0yjlsjlz walesaway zombienation
-1	rt thebarryhorns zombie nation brass band stylee https t co nv0yjlsjlz walesaway zombienation
-1	galaxyfreak_xda wandwmusic true but remember giving w amp w their zombie nation remix away for free caused a lot of trouble
-1	programming digital dreams for the consumers a zombie nation devoid of improvisation
-1	ajoosterwijk 11 amp the place is smashed angerfist with a hardcore zombie nation burin love was a classic back in the day too nosebleed
-1	ajoosterwijk just listened to it there mate haha cracking mix an can never beat a wee bit of zombie nation haha
-1	rt brittany_seph gazjsmithy song of the day kernkraft 400 zombie nation
-1	panoramix radio station djs producers zombie nation kernkraft 400 w amp w remix http t co wslrs1pe0w http t co npnpffepc2
-1	listen zombie nation triple glazed taken from his recent a night at the zoo ep on ukw records http t co 3nild8rvzt
-1	gazjsmithy song of the day kernkraft 400 zombie nation
-1	rt lovebian zombie nation is out http t co gfavgobtaz stories via normanchristof abkuijer daniellebenji
-1	i liked a youtube video http t co giass1bljq rave 5 sandstorm vs blow your mind vs zombie nation vs blade techno opener
-1	zombie nation is out http t co gfavgobtaz stories via normanchristof abkuijer daniellebenji
-1	monster nation a zombie novel david wellinton 2004 thunder s mouth 3rd printing http t co pvjvmdtdum http t co j9yhnqdffk
-1	i liked a youtube video from kimblejustice http t co svijwwq9c8 nes review collection part 1 zombie nation mr gimmick power
-1	the little ones taste sweeter rt ken_dahl rockprincess818 leahr77 hillary s zombie nation marching in lockstep like little nazis
-1	panoramix radio station djs producers zombie nation kernkraft 400 w amp w remix http t co wslrs1pe0w http t co npnpffepc2
-1	rt ken_dahl rockprincess818 leahr77 hillary s zombie nation marching in lockstep like little nazis
-1	rockprincess818 leahr77 hillary s zombie nation marching in lockstep like little nazis
-1	crzycanucklehed being a prime pita and a sometime dj it is my job to inform you that it s kernkraft400 by zombie nation
-1	while writing my paper zombie nation came on had to think of where i had heard that song before
-1	a night at the zoo by zombie nation http t co nthx3whgsq bbc 1xtra np
-1	a night at the zoo by zombie nation http t co us76llqd0n bbc radio1 np
-1	a night at the zoo by zombie nation http t co gnekzur2bs zombienation radio1 nowonr1
-1	now playing zombie nation a night at the zoo zombienation http t co zoykqoy5nh
-1	now playing zombie nation a night at the zoo zombienation http t co bhpwr3rraw
-1	dale_roots gouwpunk12 briefcase_wanka petenowakowski japotsis actually that is a great idea instead of zombie nation d
-1	tarastrong i vote for juliet starling she has a strong stance on zombie defense which is one of the greatest dangers facing the nation
-1	rt gaijingoombah oh dear lord i just found a video idea for samurai zombie nation
-1	james_traynor10 has a new tune you know you need a little groove have a listen http t co u3j0xka4do
-1	oh dear lord i just found a video idea for samurai zombie nation
-1	rt wolfcopthemovie you re welcome mt undeadmolly from the glorious nation that brought us ginger snaps wolfcop thank you canada ht
-1	so i was getting my zombie fix at z nation new take on the apocalypse and completely worth watching
-1	rt voghfrants whyimvotingforhillary i think she can unify the american people because that s what a big nation needs in these hard times
-1	kca votejkt48id dayz_foro jaket_book somos un foro de rol con tematica zombie the walking dead resident evil z nation y mas unetenos
-1	assisti a z nation die zombie die again s1ep9 http t co a1c72omfgs orangotag
-1	rt tommybrownstone zombie film to return to the beginning https t co 9jkqchnqet zombienation
-1	rt garock945 nation of indoctrination on display with zombie apocalypse also called democrats disagreeing with obama racist disagree with
-1	rt garock945 nation of indoctrination on display with zombie apocalypse also called democrats disagreeing with obama racist disagree with
-1	nation of indoctrination on display with zombie apocalypse also called democrats disagreeing with obama racist disagree with hillary sexist
-1	aparently no one is in a zombie nation mood http t co h50kqoiedy
-1	thegamechasers they want 175 for it plus a zombie nation for 225
-1	zombie film to return to the beginning https t co 9jkqchnqet zombienation
-1	zombie film to return to the beginning zombiesquad zombienation robzombie zombieresearch walkingdead_amc http t co jl2umsx6su
-1	utep plays zombie nation before each softball game and i couldn t love a place more if i tried bleedblackandgold
-1	johnoliver lays out full horror of nsa surveillance programs http t co ikbdlujivq
-1	andrew rayel dropping zombie nation o o o
-1	zombie nation the fact https t co egdsevwpzb
-1	rt draiochta14 itsdalp i am talking about press and not about negative views zombie nation
-1	zombie nation worth it http t co ca3ze33fqq
-1	itsdalp i am talking about press and not about negative views zombie nation
-1	kernkraft 400 by zombie nation is nowplaying in anytime fitness download it now at http t co llu5x4f9jm
-1	zombie nation is out http t co cpjptp8vqc stories via deadinburghbook bjcopas zombieagency
-1	photo hadleyhcrenshaw zombie nation thewalkingdead twd brains eat some need more uncle sam http t co rq1bjj6hb5
-1	scientists determine the nation s safest places to ride out a zombie apocalypse the washington post http t co xapid9be0c
-1	assisti a z nation home sweet zombie s1ep5 http t co xz1etmkczq orangotag
-1	assisti a z nation full metal zombie s1ep4 http t co bzkmlw7mvv orangotag
-1	so walking dead and z nation both had episodes involving zombie tornadoes but neither one had the tornadoes rip flesh off of the zombies
-1	also was that zombie nation playing after did they have that as last year s song i don t remember them doing so
-1	zombie nation sure why not dosenbeatz
-1	rt northbrezeh need a few people for moon trickshoting bo1 zombie map
-1	zombie nation was playing while i was getting my nails done today hockey gods what are you trying to say
-1	jabsmusic i m cool with the b s playing zombie nation but would be even cooler with ronposter playing paree after goals
-1	now on radiostation only jd hardwell w amp w vs zombie nation jumper 400 makj edit
-1	alpha__zombie__ trapnation i love trap nation he makes my morning better every morning
-1	remember kids useyourbrain zombie zombienation geek hipsterlife yougotmybrain likeazombie https t co nswmb4yvww
-1	noo she s playing zombie nation
-1	shouldbelegal alisonspalding2 zombie nation i ll vote with god yes
-1	weltome to my black deck also called zombie nation goes well with a blue splash rite of replication mtg mtgraps spellsnshit
-1	is zombie nation still going
-1	tavanyar_nation to show nhlbruins what they are going to miss out on and screw with them haha gobolts bethethunder beatboston
-1	rt whatpeopleplay staff tip zombie nation a night at the zoo single ukw records zombienation ukw_records https t co qbbxxhp
-1	craigsj as if the zombie nation inspired intro wasn t funny enough
-1	rt hillaryguess japitter my interest is in this nation not in what the media says it sh b not a zombie angelwryter richdoll54 nupe117
-1	japitter my interest is in this nation not in what the media says it sh b not a zombie angelwryter richdoll54 nupe117
-1	mind that time me and hysert were drinking in the saints in bryde and i put on zombie nation and got grannies dancing along with me
-1	zombie nation on anicend stream d
-1	rt zombieskinfx don t miss fearfair s first ever kentuckiana zombie prom zombie skin will be there doing makeup details gt http t
-1	don t miss fearfair s first ever kentuckiana zombie prom zombie skin will be there doing makeup details gt http t co xrxf68ukbe
-1	shanselman funny i was cursing netflix this morning for including them on zombie nation
-1	zombie nation is out http t co kyzenh3qfk stories via janmeijroos mer6553 crypticreads
-1	comedian john oliver lays out full horror of nsa surveillance no one in u s even notices http t co cquecbiott
-1	panoramix radio station djs producers zombie nation kernkraft 400 w amp w remix http t co wslrs1pe0w http t co npnpffepc2
-1	nowplaying my robot friend the short game feat zombie nation http t co 92gjjtfwsu
-1	today s street live is spiral zombie nation hart
-1	rt sunnidee_lite living on campus sometimes you hear random screams outside amp i m just like i m ready zombie apocalypse fau zombienati
-1	zombie nation tryouts gta v soundtrack https t co iaym2x9biu
-1	z nation 10 000 000 000x better than the walking dead hands down thanks scyfy for restoring my hope in zombie http t co monrwphrav
-1	rt itellsya zombie nation comedian john oliver lays out full horror of nsa surveillance programs http t co iibvsfz4j4
-1	rt itellsya zombie nation comedian john oliver lays out full horror of nsa surveillance programs http t co iibvsfz4j4
-1	just found out that jamie cut a deal on zombie boy it s going to be distributed nation wide
-1	zombie nation kernkraft 400 is playing now on http t co zsm61alpoe planet90 nowplaying 90s p90
-1	zombie nation kernkraft 400 woh oh oh from hockey games lol https t co nfhjxd4glu via youtube
-1	i dont know how i got into this show z nation on nerflix shits corny but i luv my zombie shows
-1	rt domwilkins v proud to say pick_tv have bought uk rights to brilliant us zombie drama series z nation http t co iqtxok2d7m http
-1	rt itellsya zombie nation comedian john oliver lays out full horror of nsa surveillance programs http t co iibvsfz4j4
-1	abdulrehmansays arsched imrankhanpti grow up wat this wat u learn online today u guys r like a zombie nation any1cn screw u staycalm
-1	zombie nation comedian john oliver lays out full horror of nsa surveillance programs http t co iibvsfz4j4
-1	patthenespunk check out one of the latest two episodes of storage wars they find a nintendo lot stadium events zombie nation etc
-1	rt coaster_nation don t miss the first ever kentuckiana zombie prom presented by fearfair details gt http t co laxxghgpgb
-1	thebarryhorns are you going to play zombie nation at belguim game
-1	i added a video to a youtube playlist http t co qn4zty0ms3 zombie nation kernkraft 400
-1	zombie baby zombie bear meth zombies viagra zombies z nation beats walking dead any day like a breath of fetid stinking air
-1	don t miss the first ever kentuckiana zombie prom presented by fearfair details gt http t co laxxghgpgb
-1	z nation air shaft scene doc zombie https t co evnm4n5oz9 ya fkn right telus pmharper senjohnmccain barackobama ludacris
-1	nation of zombies zombie fighting defence game campbell tech ltd http t co r79le7teeo
-1	the kennel zombie nation https t co xoxzs5ero6 steelershockey rtb_218 we can do this better house of steel
-1	zombie nation worth it http t co ca3ze33fqq
-1	zombie nation ooohhhhohhhhhhh haaaoooohhhhhh booom neverstop oldschool by por http t co hporifayqr http t co qteqqhcvp9
-1	now playing kernkraft 400 by zombie nation https t co smkqhjuloy
