-1	iraqi officials top saddam hussein aide may have been killed in fighting washington post http t co fzswjfgbos
-1	divergent font http t co lwipmwbyxt tobias eaton is enough divergent insurgent allegiant four http t co 69ca71a7ke
-1	done watching insurgent and i don t know how i feel about it it s mixed up
-1	rt divergent theo james amp shailene woodley reason enough to see insurgent http t co q2omrs0x2m http t co vmckpxnkcf
-1	is there a good quality for insurgent online yet
-1	i d rather buy another freaking book that s not insurgent aha
-1	rt pimpmytweeting still in prison for shooting a taliban insurgent that had tried to kill him his patrol freemarinea http t
-1	oh wellll i m just gonna read some other book but it sucks bc now i have to buy another insurgent and i don t feel like buying
-1	rt divergent theo james amp shailene woodley reason enough to see insurgent http t co q2omrs0x2m http t co vmckpxnkcf
-1	iraqi officials top saddam hussein aide may have been killed in fighting washington post http t co v3scy7mbgg
-1	iraqi officials top saddam hussein aide may have been killed in fighting washington post http t co sppk4yntgf
-1	i can t read insurgent bc it s ripped
-1	had a fantastic day filled with way too many laughs with this girl anyways insurgent was great https t co yp4mv3lbr2
-1	iraqi officials top saddam hussein aide may have been killed in fighting washington http t co d7cbifxznb news
-1	saddam aide iraqi insurgent leader douri reported killed the rakyat post http t co 9dqfs2cabg
-1	iraqi officials top saddam hussein aide may have been killed in fighting washington post http t co s6ebefmdot
-1	watching insurgent https t co d3qdhjsmzo
-1	nw insurgent
-1	rt woebizdeiwatch insurgent edith prior http t co hgrke9sfnt
-1	iraqi officials top saddam hussein aide may have been killed in fighting washington post http t co blpji6bzas
-1	insurgent leader al douri reported killed http t co nzmdgm8633 http t co gu7qjg7eis
-1	insurgent leader al douri reported killed http t co qlm3vl5gtc http t co i3fe7kvj22
-1	rt keithspeaking insurgent was cole af
-1	iraqi officials top saddam hussein aide may have been killed in fighting washington post http t co xlkhb5s8w5
-1	iraqi officials top saddam hussein aide may have been killed in fighting washington post http t co qdypezsfny
-1	i need to see insurgent
-1	divergentid the spectacular now divergent insurgent
-1	iraqi officials top saddam hussein aide may have been killed in fighting washington post http t co jrrjtn6upe
-1	iraqi officials top saddam hussein aide may have been killed in fighting washington post http t co pekw86j8ty
-1	rt pimpmytweeting still in prison for shooting a taliban insurgent that had tried to kill him his patrol freemarinea http t
-1	me ima go home amp do some online hw what me actually does drives to jerry s to get sno cones amp to see insurgent w hunter _ _
-1	rt andreypanevin andreypanevin the ukraine insurgent army historically collaborated with the nazis amp were named ukrainian heroes by po
-1	insurgent was so frustrating
-1	iraqi officials top saddam hussein aide may have been killed in fighting washington post http t co rx2yfo5uyh
-1	iraqi officials top saddam hussein aide may have been killed in fighting washington post http t co pyemilatiw
-1	iraqi officials top saddam hussein aide may have been killed in fighting washington post http t co bzflxlpsyb
-1	iraqi officials top saddam hussein aide may have been killed in fighting washington post http t co ok71gp0jg1
-1	iraqi officials top saddam hussein aide may have been killed in fighting washington post http t co flojtphjwj
-1	ya i ll just watch insurgent tomorrow
-1	read more the hidden hand behind the islamic state militants islamicstate http t co v6rmso3gbs
-1	read more the hidden hand behind the islamic state militants islamicstate http t co 7v0gji2i8a
-1	started watching insurgent amp my bf goes isn t that girl like vine famous gingerwlavender
-1	insurgent was the best movie ever
-1	rt divergent theo james amp shailene woodley reason enough to see insurgent http t co q2omrs0x2m http t co vmckpxnkcf
-1	and now i m angry i was mopey driving through gta and the shittiest people ever killed me and then i took their insurgent from them
-1	iraqi officials top saddam hussein aide may have been killed in fighting washington post http t co dvgawnsqug
-1	iraqi officials top saddam hussein aide may have been killed in fighting washington post http t co wbicvzzxqn http t co qwqjwpafqu
-1	insurgent with the crew was the greatest
-1	rt ohaideme tris s brother was a aint shit mothafucka in insurgent
-1	iraqi officials top saddam hussein aide may have been killed in fighting washington post http t co njpxsynvko
-1	insurgent was so good omg
-1	watching insurgent https t co g6ylbzkqcf
-1	iraqi officials top saddam hussein aide may have been killed in fighting washington post http t co xgfxjuseyy
-1	rt andreypanevin new ukrainian law says that upa ukraine insurgent army are heroes they have taken responsibility for recent murders ht
-1	i enjoyed divergent fresh_lezinto i m still not watchig divergent and insurgent
-1	now on deck insurgent watch free online visit us http t co swbh91by3g amp see the difference in your pocket free
-1	rt meaggy652 finally seeing insurgent jerrodcrouch
-1	idcmainiacx_ insurgent
-1	iraqi officials top saddam hussein aide may have been killed in fighting washington post miami heraldiraqi http t co rrzm3csjkc
-1	rt haleyarod omg insurgent
-1	4 5 out of 5 stars for insurgent divergent trilogy book 2 by veronica roth http t co tlpwgd6shm kindle http t co nnega0gwlr
-1	insurgent was cole af
-1	iraqi officials top saddam hussein aide may have been killed in http t co nabewhzyar news http t co cedcugmtxs
-1	tris s brother was a aint shit mothafucka in insurgent
-1	rt yashalevine long live ukrainian insurgent army thanks to a new law you can t deny the heroism of their slaughter of poles amp jews http
-1	rt crespnejustan anna calvi the heart of you insurgent original motion picture soundtr v a anna calvi the heart of you insurgent
-1	insurgent leader al douri reported killed http t co fy0oy9xrh2 http t co iapson69u6 world
-1	miami heraldiraqi officials top saddam hussein aide may have been killed in fightingwashington postba http t co pnlvbvakuj
-1	news from the archive 18 april 1975 khmer rouge take over cambodia the insurgent guerrillas were greeted b http t co djvkig2ibx
-1	soon as i peeped that roof seen when i was watching insurgent i knew uriah was bae
-1	insurgent
-1	ukrainian insurgent army upa claimed responsibility for recent murders of regime opponents http t co dmqb7ajhcz
-1	johngreen i went to rewatch insurgent today and ran into this beautiful thing papertownsmovie http t co m1wo08maae
-1	i m still not watchig divergent and insurgent
-1	rt yazminn_95 insurgent is such a good movie
-1	the insurgent plot twist omg
-1	insurgent was perf
-1	rt otehemav insurgent you amp 39 http t co pxgb9exmvo
-1	insurgent he says noun a person who acts in opposition to the established authority who is not https t co ofyirfmeu4
-1	insurgent was so good
-1	rt rtorfav14 rt if u love insurgent fav if u dislike insurgent http t co 96x4tnoeow
-1	rt mrahssiah sohappilyash saw insurgent today and literally talked about him the entire time during the movie
-1	sohappilyash saw insurgent today and literally talked about him the entire time during the movie
-1	rt yashalevine long live ukrainian insurgent army thanks to a new law you can t deny the heroism of their slaughter of poles amp jews http
-1	divergent saw insurgent for the tris time today is it just me or does four get hotter and hotter every time http t co rymkon3v9t
-1	insurgent is such a good movie
-1	rt andreypanevin the ukraine insurgent army claimed responsibility for kalashnikov s and buzina s murder same group that poroshenko c
-1	watching the divergent series insurgent 3d https t co uvhebfyzru
-1	with af girls amp insurgent lt 3 lt 3 pic https t co etyw9viasn
-1	dear abby was huge but no one knew it was rose byrne rubble answering as the cashier to jk simmons play of spiderman insurgent divergent
-1	insurgent t t
-1	just watched insurgent
-1	i m watching insurgent by myself
-1	insurgent https t co 0fcqiwose5
-1	insurgent full movie http t co dldujngv7n via youtube
-1	rt poeticalexis anyone else see the resemblance between actor keiynan lonsdale from insurgent amp ray_broderickw http t co lqdkozs0hb
-1	insurgent was fun and sooo good w tang jaja and sissy
-1	marvinamasula unfriended to insurgent 3 naman
-1	is insurgent good
-1	rt pimpmytweeting still in prison for shooting a taliban insurgent that had tried to kill him his patrol freemarinea http t
-1	finally insurgent with fitri ellyawati and 2 others at aep s https t co c6aukbopko
-1	insurgent was such a good movie wtf
-1	omg insurgent
-1	tris prior amp four insurgent https t co anxa9rwivq
-1	rt triciabeech watching insurgent and let me tell ya theo james fiiiiya
-1	finished divergent i shall start insurgent tmw
-1	we may both be bad but there s a huge difference between us i m not content with being this way insurgent
-1	rt poeticalexis anyone else see the resemblance between actor keiynan lonsdale from insurgent amp ray_broderickw http t co lqdkozs0hb
-1	insurgent doe alynaaaa__
-1	yrbmagazine previously on yrb insurgent trailer divergent insurgent http t co yiq0tnmdvr film http t co nfzpqixeuy
-1	insurgent
-1	not gonna watch insurgent
-1	watching insurgent https t co mpmmehhbgo
-1	hussein deputy insurgent leader al douri killed http t co na2biek5j3 http t co vvfibyy1ii
-1	at http t co lwipmwbyxt i kissed eric because i m divergent comment what you guys get divergent insurgent allegiant
-1	at http t co lwipmwbyxt i wanna go see insurgent divergent insurgent sydney
-1	insurgent amp fast 7 for the second time made for a good night
-1	lfranzia insurgent is a really good movie but pretty different from the book
-1	yrbmagazine previously on yrb insurgent trailer divergent insurgent http t co rrqa6msqsd film http t co e93unaaihn
-1	finally saw insurgent amp it was soooooooo good
-1	it s 10 12 insurgent at 11 20 http t co bshpilcqx1
-1	me and my baby girl having a girls night out at the movies gonna see insurgent https t co lppuie1bzn
-1	rt divergent theo james amp shailene woodley reason enough to see insurgent http t co q2omrs0x2m http t co vmckpxnkcf
-1	me and my baby girl having a girls night out at the movies gonna see insurgent http t co tnbqlrlu74
-1	me and my baby girl having a girls night out at the movies gonna see insurgent http t co ymeodxheui
-1	rt rdgtylor not even sure how to describe what all just took place in gta apparently an insurgent can withstand a hydra running into i
-1	turns out i was thinking nonsense makes me want to watch insurgent moar 3
-1	watching insurgent https t co lbawshmnsr
-1	oh hey so did you guys like insurgent
-1	not even sure how to describe what all just took place in gta apparently an insurgent can withstand a hydra running into it getfucked
-1	watching insurgent https t co amoc6vwcwp
-1	me until i finally get the chance to watch insurgent http t co ri3mjiedxj
-1	i don t know how to feel about insurgent
-1	oh and insurgent was amazing
-1	they ruined insurgent booknerd disappointed
-1	insurgent was a pretty decent movie
-1	daniel dae kim ashley judd oscar winners octavia spencer amp kate winslet hope you were paid handsomely to appear in the awful insurgent
-1	watched insurgent perfect divergent
-1	from the archive 18 april 1975 khmer rouge take over cambodia http t co awk65svnjc network front the guardian the insurgent guerri
-1	http t co u3oyy4ry3a hussein deputy insurgent leader al douri killed cnrapp
-1	rt pimpmytweeting still in prison for shooting a taliban insurgent that had tried to kill him his patrol freemarinea http t
-1	from the archive 18 april 1975 khmer rouge take over cambodia the insurgent guerrillas were greeted http t co 6wi3gokys7 gua
-1	watching insurgent https t co vikhdf69zh
-1	cnn insurgent leader al douri killed in security op http t co 9vie4pxrzu
-1	now i want to go see insurgent
-1	im going to watch insurgent now
-1	insurgent was alright to
-1	insurgent movieeditscontest vine by ayishia1 https t co 2y21gppl2s
-1	rt 4nnak operacaobetalab email claim over kiev killings a group calling itself the ukrainian insurgent http t co 2r1hl7ilv6 sdv
-1	email claim over kiev killings a group calling itself the ukrainian insurgent army says it was behind the dea http t co sxumge4w6l
-1	bbc email claim over kiev killings a group calling itself the ukrainian insurgent army says it was be http t co 1h8kkk8qbf world
-1	email claim over kiev killings a group calling itself the ukrainian insurgent army says it was behind the dea http t co dp9tuzxhqr
-1	from the archive 18 april 1975 khmer rouge take over cambodia http t co mapmiewdzf the insurgent guerrillas were greeted by cambodia
-1	email claim over kiev killings a group calling itself the ukrainian insurgent army says it was behind the dea http t co slpzh0n4bg
-1	email claim over kiev killings a group calling itself the ukrainian insurgent army says it was behind the dea http t co kk5crfdmui
-1	email claim over kiev killings a group calling itself the ukrainian insurgent army says it was behind the dea http t co 50nynkyfg2
-1	email claim over kiev killings a group calling itself the ukrainian insurgent army says it was behind the dea http t co dlu6bjxjoc
-1	operacaobetalab email claim over kiev killings a group calling itself the ukrainian insurgent http t co b6jvfpeqd5 sdv timbeta
-1	operacaobetalab email claim over kiev killings a group calling itself the ukrainian insurgent http t co 2r1hl7ilv6 sdv timbeta
-1	news email claim over kiev killings a group calling itself the ukrainian insurgent army say http t co jo5sbgxvkj via thenewshype
-1	email claim over kiev killings a group calling itself the ukrainian insurgent army says it was behind the dea http t co rhhknck8q2
-1	email claim over kiev killings a group calling itself the ukrainian insurgent army says it was behind the dea http t co 1s6wjitrd6
-1	insurgent the avengers 2 age of ultron unfriended paper towns
-1	news headlines wnd hussein deputy insurgent leader al douri killed http t co 5uccdalnin
-1	hussein deputy insurgent leader al douri killed http t co qkspluh7ko
-1	insurgent starts at 10 30 should i go or no
-1	watching insurgent
-1	watching insurgent https t co yho2jwumyt
-1	hussein deputy insurgent leader al douri killed http t co pseexisdy9
-1	insurgent was good but i wanna see unfriended
-1	hussein deputy insurgent leader al douri killed http t co 1mmoloidwe
-1	insurgent http t co g6ppveyy5h
-1	from the archive 18 april 1975 khmer rouge take over cambodia the insurgent guerrillas were greeted by cam http t co kq3b4re2tl
-1	hussein deputy insurgent leader al douri killed http t co wjaobwwzxd cnn izzat ibrahim al douri a former top deputy to saddam husse
-1	watching insurgent https t co hefs6ntmkl
-1	from the archive 18 april 1975 khmer rouge take over cambodia the insurgent guerrillas were greeted by cam http t co a5ue4egj2d
-1	guardiannews from the archive 18 april 1975 khmer rouge take over cambodia the insurgent guerrillas were http t co 5jc58130yo
-1	although jai totally was not how i imagined eric in the books his character portrayal was spot on insurgent
-1	insurgent was gr8
-1	rt markantonio98 me so have you seen insurgent alissa yes b it was as good as detergent
-1	rt eveehunt insurgent divergent book 2 unabridged veronica roth http t co inhgyxax4u kids amp young adults audiobook http
-1	rt eveehunt insurgent divergent book 2 unabridged veronica roth http t co inhgyxax4u kids amp young adults audiobook http
-1	rt theogasms i wish we got a theo and shai photoshoot for insurgent ugh
-1	from the archive 18 april 1975 khmer rouge take over cambodia http t co edwzjqg1hx the insurgent guerrillas were greeted by cambodian
-1	and maybe insurgent
-1	i just saw insurgent at the cinema and loved it it s so hard to hate peter when he s played by miles_teller
-1	holy shit insurgent
-1	rt hotornot_4 rt for divergent fave for insurgent http t co oyauogcnaq
-1	diverging from canon insurgent finds steelier wartime heroine
-1	insurgent done
-1	film review insurgent from built for speed insurgent is the second instalment in that other dysto http t co ihxuupvswl
-1	from the archive 18 april 1975 khmer rouge take over cambodia the insurgent guerrillas were greeted by cam http t co 83jb9dca6d
-1	i guess i ll watch insurgent
-1	watching insurgent with aini https t co ykr1zht525
-1	finally watching insurgent at home by myself
-1	rt eveehunt insurgent divergent book 2 unabridged veronica roth http t co inhgyxax4u kids amp young adults audiobook http
-1	rt eveehunt insurgent divergent book 2 unabridged veronica roth http t co inhgyxax4u kids amp young adults audiobook http
-1	rt divergent theo james amp shailene woodley reason enough to see insurgent http t co q2omrs0x2m http t co vmckpxnkcf
-1	rt eveehunt insurgent divergent book 2 unabridged veronica roth http t co inhgyxax4u kids amp young adults audiobook http
-1	rt poeticalexis anyone else see the resemblance between actor keiynan lonsdale from insurgent amp ray_broderickw http t co lqdkozs0hb
-1	perfect shailenewoodley divergent insurgent tris hazel tfios shailenefans at http t co 2hahkiorsi http t co uegtkutego
-1	tokyo drift priest insurgent as we house spider man as tim allens home improvement it connects jonathan taylor thomas as taylor lautner
-1	aw i miss all the tfios hype i need insurgent on dvd like rn i ve already watched it http t co 2hahkiorsi http t co gsvo1qtgi1
-1	nw insurgent
-1	anyone else see the resemblance between actor keiynan lonsdale from insurgent amp ray_broderickw http t co lqdkozs0hb
-1	rt divergent theo james amp shailene woodley reason enough to see insurgent http t co q2omrs0x2m http t co vmckpxnkcf
-1	divergent font http t co lwipmwbyxt aw i miss all the tfios hype i need insurgent on dvd like rn i ve http t co ppo86opzp7
-1	insurgent divergent book 2 unabridged veronica roth http t co inhgyxax4u kids amp young adults audiobook http t co 9nenan1hxv
-1	insurgent leader al douri killed in security op http t co s3sdqkle44 sale http t co neiwkxgvpb news
-1	i want to watch insurgent
-1	i m pretty impressed by how well insurgent followed the book and i still love kate winslet
-1	watching insurgent and let me tell ya theo james fiiiiya
-1	i liked insurgent but some of the dialogue ugh cheesy and boring and sudden intro of uriah after leaving him out previously pffft
-1	insurgent is great what are y all talking about
-1	rt itskaelababyyy raphie gave me an insurgent poster with my husband on it thank you raphie i love you http t co xpcwpdkukn
-1	insurgent was so effing good
-1	from the archive 18 april 1975 khmer rouge take over cambodia http t co 9s8bq3fuz1 the insurgent guerrillas were greeted by cambodian
-1	rt pimpmytweeting still in prison for shooting a taliban insurgent that had tried to kill him his patrol freemarinea http t
-1	rt lbci_news_en video report saddam aide iraqi insurgent leader al douri reported killed http t co snmcfcadwc
-1	watching insurgent https t co 4dchytq7ad
-1	now on deck insurgent watch free online visit us http t co ow8ybn3xzq amp see the difference in your pocket free
-1	me so have you seen insurgent alissa yes b it was as good as detergent
-1	rt geeksonscreen tonight s podcast main topic is book adaptations let us know your favs gameofthrones insurgent lotr twilight f
-1	rt eatonprior4 one of my favourite quotes from the movie fourtris insurgent http t co tah7oi00uf
-1	insurgent was soooo good
-1	saramayeux the aclu plans to use soros s 50 million in 501 c 4 not c 3 to fund insurgent da candidates http t co nlibhgex1p
-1	hussein deputy insurgent leader al douri killed iraqi tv reports http t co 8hbsvmpbwq
-1	watching the divergent series insurgent at harkin s theater http t co euafd1gvo4
-1	rt divergent_au divergent was a phenomenon insurgent will change everything tickets http t co akdody0kap https t co q5hrpd8fyk
-1	insurgent wasn t bad tho
-1	insurgent was actually terrible haha
-1	well insurgent sucked
-1	review for insurgent divergent great sequel to divergent it picks up right where divergent ended http t co tbkqtzzfso
-1	insurgent was
-1	insurgent 2015 http t co p0o1tpzbpv
-1	thinking of watching insurgent hahahaha i m so freaking late
-1	rt divergent who can you trust when you re on the run insurgent http t co q2omrs0x2m http t co 3qtglhataa
-1	rt insurgentmovie the factionless need a leader and who better than tobias eaton insurgent http t co u0rkovsvsz
-1	rt divergent_au truth shailenewoodley on the importance of strong female characters http t co gqr4a6rmtg insurgent http t co p0nf
-1	rt pimpmytweeting still in prison for shooting a taliban insurgent that had tried to kill him his patrol freemarinea http t
-1	vlnfrn fast 7 cinderella home indigenous insurgent the cobler
-1	shailene woodley in insurgent looks like lesbian peter pan
-1	noisy babies ruined the late night movie insurgent regalmovies managers don t care next time watching on home big screen tv
-1	rt gabeim5 what did you guys think of insurgent
-1	i can t even watch divergent now because i ll be thinking about insurgent
-1	insurgent was so unbelievably disappointing
-1	rt geeksonscreen tonight s podcast main topic is book adaptations let us know your favs gameofthrones insurgent lotr twilight f
-1	rt pimpmytweeting still in prison for shooting a taliban insurgent that had tried to kill him his patrol freemarinea http t
-1	i couldn t watch unfriended so i just went to the other theatre to watch insurgent tru
-1	the insurgent movie was amazing 10 gold starts
-1	video report saddam aide iraqi insurgent leader al douri reported killed http t co snmcfcadwc
-1	yeay finally insurgent https t co o4zt2cxdn3
-1	insurgent
-1	rt jamie__bee insurgent was sooo good
-1	ahhhh insurgent was great
-1	high level insurgent leader reported killed in iraq http t co gwi3m3ojrw
-1	saw insurgent for the 3rd time
-1	cnn hussein deputy insurgent leader al douri killed iraqi tv reports http t co sed24yeewb
-1	rt roomofrumor insurgent leader al douri killed http t co 52zcum2csk
-1	i still haven t watched insurgent oh
-1	s o to brooketressa for being a babe and going to insurgent with me tonight
-1	rt asscld imy and we neeed to hang out i want to see insurgent lol ily
-1	insurgent was so good but they kept calling rose dawson janine silly that no one caught that
-1	rt mckay_girl oh my gosh insurgent was just
-1	watching insurgent with prity at cinema21manado https t co uplvwxsxc9
-1	saddam aide iraqi insurgent leader al douri reported killed http t co igf16jqvck
-1	rt spikealbrecht just saw insurgent gt divergent
-1	watching insurgent https t co jpmcrpkdzv
-1	imy and we neeed to hang out i want to see insurgent lol ily
-1	rt spikealbrecht just saw insurgent gt divergent
-1	omg insurgent is so goood
-1	watching insurgent with prity https t co fmosvh4imi
-1	insurgent with bella and calvin at cinema21manado https t co y5ckhd0acu
-1	rt daniiiilopezz insurgent is the best movie by far but i haven t seen gethard yet so it might change soon
-1	saddam aide iraqi insurgent leader al douri reported killed http t co gr9kw3u3ps
-1	rt rileynoe13 i think tris should be the star of monkey kingdom insurgent http t co duaqyxgt0q
-1	insurgent
-1	just saw insurgent i ve decided i am going to learn to fight
-1	insurgent was sooo good
-1	theo james of insurgent is always learning view at http t co 6ad6ad27nf
-1	rt divergent theo james amp shailene woodley reason enough to see insurgent http t co q2omrs0x2m http t co vmckpxnkcf
-1	gonna see insurgent today
-1	u people need to go watch insurgent
-1	i still need to see insurgent
-1	disela2 jaga the divergent series insurgent 3d https t co skxdv7kl2v
-1	i think tris should be the star of monkey kingdom insurgent http t co duaqyxgt0q
-1	rt fandombattles rt for mockingjay part 2 fav for insurgent http t co dlv01n0ys8
-1	insurgent was so good wow
-1	i just watched insurgent and i don t know what to do with my life
-1	insurgent was soooo good
-1	rt logan_noe insurgent basically http t co 9poeh8gyof
-1	rt sweetlockscrwn insurgent free pi http t co vjgnn3sjsj
-1	ready stock original merch tees insurgent army bogor idr 100k limited http t co rfpk6jlvep
-1	theojamesff i love you so much your so handsome every time i see you in divergent and insurgent i just melt
-1	i added a video to a youtube playlist http t co 42pyfrajdj killing spree 3 insurgent time
-1	while everyone is watching furious 7 and unfriended i m watching the longest ride and insurgent lol
-1	insurgent basically http t co 9poeh8gyof
-1	rt mazdaki izzat ibrahim al douri led the naqshbandi order insurgent group a key force behind the recent rise of isis http t co lzw24
-1	rt divergent theo james amp shailene woodley reason enough to see insurgent http t co q2omrs0x2m http t co vmckpxnkcf
-1	saddam aide iraqi insurgent leader al douri reported killed http t co mtgmoow9ov artikel terbaru
-1	a voz dela ta woodkid feat lykke li never let you down insurgent soundtrack video https t co ankt71i5zb via youtube
-1	theo james of insurgent is always learning see at http t co 6ad6ad27nf
-1	saddam aide iraqi insurgent leader al douri reported killed http t co i6mxw9fpil
-1	saddam aide iraqi insurgent leader al douri reported killed http t co kiusfbuaem
-1	saddam aide iraqi insurgent leader al douri reported killed http t co pueysj8rj9
-1	i want to watch insurgent
-1	rt divergent theo james amp shailene woodley reason enough to see insurgent http t co q2omrs0x2m http t co vmckpxnkcf
-1	rt allegiantu pre order insurgent on digital hd on itunesmovies and googleplay http t co 69666xxtjq
-1	we saw insurgent tonight on a whim holy shit that is a terrible movie
-1	insurgent was the best
-1	can someone take me to see insurgent tomorrow i still haven t seen it
-1	finallyy insurgent https t co xwraey2wpv
