-1	watching kidnapping mr heineken https t co 1xbmmudmxt
-1	a man can have a lot of money or a lot of friends but cant have both kidnapping mr heineken https t co ismcddtspr
-1	i m watching kidnapping mr heineken 2015 https t co 0oaqp4vvtn trakt
-1	calvin_m__ also check out kidnapping mr heineken it s a bit of a bore tho don t know if you gon like it but yeah
-1	rt omycesok kidnapping mr heineken sponsorship http t co wokxkj7sun
-1	i m watching kidnapping mr heineken http t co cbrys0vt2n
-1	rt bihisitaxp kidnapping mr heineken shirt http t co x7s1bjfq9f
-1	watching kidnapping mr heineken https t co p5p9nskgpt
-1	brettadams_7 wow watching kidnapping mr heineken 2015 at http t co tdh7lirffv movie film streaming http t co iquhscjmtd
-1	watching kidnapping mr heineken and lowkey wishing they got away w it
-1	kidnapping mr heineken international http t co cxl22quy93
-1	rt omycesok kidnapping mr heineken sponsorship http t co wokxkj7sun
-1	megamind1973 droidsticks think so bud watched clown now i m watching the kidnapping of mr heineken
-1	kidnapping mr heineken yush http t co 0a1hjpcnga
-1	kidnapping mr heineken full movie https t co rbps6wxwzh
-1	kidnapping mr heineken full movie https t co 84ofq4wbqp
-1	kidnapping mr heineken full movie https t co oeq2zgmcqh
-1	new post listening groove soundtrack review kidnapping mr heineken http t co k2h9dlfkwg
-1	win kidnapping mr heineken on dvd in the alchemy giveaway from efilmcritic http t co qmi8kpevkh
-1	watching kidnapping mr heineken
-1	watching kidnapping mr heineken https t co frey1kggoy
-1	kidnapping mr heineken 2015 http t co acxpqrhc1u
-1	kidnapping mr heineken 2015 http t co nzdafdx7bk http t co p0iwkgch8c
-1	kidnapping mr heineken jazz http t co enomzb4jl7
-1	mazenh just finished watching kidnapping mr heineken 2015 at http t co a846ezf2xk movie film streaming
-1	rt udajifeh kidnapping mr heineken holland http t co umbq4hppxw
-1	kidnapping mr heineken
-1	kidnapping mr heineken sponsorship http t co wokxkj7sun
-1	rt bihisitaxp kidnapping mr heineken shirt http t co x7s1bjfq9f
-1	watching kidnapping mr heineken at ade_ginanjar https t co 4i1g60lcnd
-1	watching kidnapping mr heineken https t co ddfsm4lmsq
-1	kidnapping of mr heineken i give it 79
-1	watching kidnapping mr heineken https t co mzgoy1z7gt
-1	watching kidnapping mr heineken https t co 3jkex1aqve
-1	kidnapping mr heineken https t co zywnuiaaos
-1	watching kidnapping mr heineken https t co eljbgcbbrn
-1	must watch kidnapping mr heineken
-1	satnite movie kidnapping mr heineken https t co x3omzyse4u
-1	jasarteaga i l0ve watching kidnapping mr heineken 2015 at http t co jzqwlboy5v movie film streaming
-1	kidnapping mr heineken http t co xxthlkg2qb
-1	kidnapping mr heineken opener http t co fy9baqldvo
-1	kidnapping mr heineken 2015 now
-1	watching kidnapping mr heineken https t co 68b7s4osfn
-1	kidnapping mr heineken action crime drama anthony hopkins sam worthington jim sturgess available now http t co qumgmgurxr
-1	watching kidnapping mr heineken with aldi yori and aditya https t co 0u3zev7cxq
-1	kidnapping mr heineken pony http t co sar677hglc
-1	rt abdullah11harbi nw kidnapping mr heineken 2015
-1	freddy heineken there is two ways a man can be rich in this world he can have a kidnapping mr heineken https t co vnzjkum4i0
-1	watching kidnapping mr heineken https t co yaudpc9b4g
-1	rt yforazaq kidnapping mr heineken qube http t co gyyjrqpnkn
-1	kidnapping mr heineken was dope
-1	there is two ways a man can be rich in this world he can have a lot of money or he kidnapping mr heineken https t co yqwkifcfrz
-1	watching kidnapping mr heineken https t co bytecwuoai
-1	kidnapping mr heineken
-1	kidnapping mr heineken 2015 imdb http t co sjzyo6mvz5
-1	kidnapping mr heineken kegerator http t co fsxzqnggq7
-1	kidnapping mr heineken sign http t co 7mwdsdqb1i
-1	watching kidnapping mr heineken https t co vrofybntq3
-1	kidnapping mr heineken museum http t co xtpchdvvmg
-1	watching kidnapping mr heineken https t co 5dtdyd9r3p
-1	kidnapping mr heineken sweepstakes http t co nwcbxjop1c
-1	thedabstore thinkin about watching kidnapping mr heineken 2015 at http t co vssp5n2ehy movie film streaming
-1	off day movie time aloneeeee kidnapping mr heineken with belovedbed pillow and snack https t co zszi5tbhzv
-1	nw kidnapping mr heineken
-1	watching kidnapping mr heineken https t co seasoi8cef
-1	kidnapping mr heineken at kostan https t co 6mmgmwsimi
-1	sexta de leve assistindo kidnapping mr heineken
-1	watching kidnapping mr heineken https t co sdkijsoo1h
-1	ssscales watch kidnapping mr heineken 2015 at http t co vq08g3n23k movie film streaming
-1	rt udajifeh kidnapping mr heineken holland http t co umbq4hppxw
-1	watching kidnapping mr heineken https t co 5xckllpzyd
-1	saadkhan711 i love watch kidnapping mr heineken 2015 at http t co vxdmwefjdd movie film streaming
-1	rt licavelil kidnapping mr heineken kidnapping http t co jlgxodk1xo
-1	bllydyss are you watching kidnapping mr heineken 2015 at http t co azhghgfyxg movie film streaming http t co 2yevcyuvs5
-1	ezmeslimany focus kidnapping mr heineken
-1	kidnapping mr heineken shirt http t co x7s1bjfq9f
-1	bryantdigital peep whiplash and kidnapping mr heineken th 2nd one based on a true story
-1	soundtrack review kidnapping mr heineken kidnapping mr heineken soundtrack review this is a review of the http t co jnfnvjmvnb
-1	new post soundtrack review kidnapping mr heineken http t co 9mwf24lup5 http t co 74vio5aerk
-1	rt udajifeh kidnapping mr heineken holland http t co umbq4hppxw
-1	kidnapping mr heineken is worth watching movie
-1	rt udajifeh kidnapping mr heineken holland http t co umbq4hppxw
-1	watching kidnapping mr heineken
-1	kidnapping mr heineken l based on true story
-1	kidnapping mr heineken https t co llro8nyw1y
-1	cool its a true story kidnapping mr heineken https t co tutsmciqpi
-1	your on and off game strong nigga where you been rt ladidub kidnapping mr heineken
-1	kidnapping mr heineken qube http t co gyyjrqpnkn
-1	kidnapping mr heineken
-1	yolo kidnapping mr heineken https t co tceekjwl7i
-1	nw kidnapping mr heineken
-1	rt udajifeh kidnapping mr heineken holland http t co umbq4hppxw
-1	rt udajifeh kidnapping mr heineken holland http t co umbq4hppxw
-1	zambiazharshtag just last week watched kidnapping mr heineken and it was awesome now thinking the gambler
-1	kidnapping mr heineken the gambler and whiplash kept me up three nights in a row great casts great soundtracks great plots excellent
-1	kidnapping mr heineken you are here http t co 5d1xrb5qjs
-1	tonyorellana8 this beautiful movie kidnapping mr heineken 2015 at http t co f0tfadmztf movie film streaming
-1	tumben akur kidnapping mr heineken with brother https t co e3btfm9iok
-1	rt udajifeh kidnapping mr heineken holland http t co umbq4hppxw
-1	rt wurelyly kidnapping mr heineken employment http t co 5mpfimjcq0
-1	watching kidnapping mr heineken https t co x1mplmwiem
-1	watching kidnapping mr heineken https t co kzjcnsscrz
-1	true story kidnapping mr heineken at voice over room jtv madiun https t co xhy84yqfc0
-1	watching kidnapping mr heineken at voice over room jtv madiun https t co bnnps1kmht
-1	nw kidnapping mr heineken
-1	watching kidnapping mr heineken at pci blok b https t co 90w5c0x1au
-1	rt licavelil kidnapping mr heineken kidnapping http t co jlgxodk1xo
-1	watching kidnapping mr heineken with kevinst at blitzmegaplex https t co gmtmf2lx35
-1	kidnapping mr heineken
-1	kidnapping mr heineken aluminum http t co wbmjyupyjk
-1	voy a ver kidnapping mr heineken
-1	i added a video to a youtube playlist http t co qsiq2a9hun kidnapping mr heineken trailer phim 2015
