-1	milyarder bir kidnapping mr heineken https t co e7px0xvziy
-1	watching kidnapping mr heineken https t co ywfe0f0jtx
-1	brother sister time kidnapping mr heineken with dalyes romeldy https t co hakpc3cu2n
-1	photoset kidnapping mr heineken by daniel alfredson 2015 http t co opppk0pnpd
-1	martingicheru i mma watch kidnapping mr heineken tonight promises to be a good movie just sat down to watch spoilers coming soon
-1	i mma watch kidnapping mr heineken tonight promises to be a good movie
-1	watching kidnapping mr heineken with ana https t co cjxtnnnogi
-1	kidnapping mr heineken scores with anthony hopkins not with its video http t co 50kqid7guu http t co 5j8eifdfzy
-1	watching kidnapping mr heineken with ikas raena https t co sk06velgrl
-1	rt inupiwih kidnapping mr heineken history http t co hdtif4b1vb
-1	kidnapping mr heineken soundtrack eviction notice http t co ajjs1ppv4v
-1	watching kidnapping mr heineken with rima at blue house https t co pgyyhvpa1p
-1	kidnapping mr heineken soundtrack eviction notice http t co ajjs1ppv4v youtube
-1	rt ncerapchochil kidnapping mr heineken horses http t co 0t4opwk4df
-1	kidnapping mr heineken quiet http t co fofprqgufv
-1	rt wolizewywi kidnapping mr heineken factory http t co v6qib4ycfy
-1	kidnapping mr heineken soundtrack opening titles http t co cvpcbx38wi
-1	rt ncerapchochil kidnapping mr heineken horses http t co 0t4opwk4df
-1	kidnapping mr heineken soundtrack opening titles http t co cvpcbx38wi youtube
-1	craigvillinger lol really haven t seen them but saw kidnapping mr heineken recently amp he plays a dutch character with pure aussie accent
-1	watching kidnapping mr heineken https t co hoqjprwrm9
-1	kidnapping mr heineken trailer 1 graycut http t co emfvwgxcqo
-1	rt vofohatihu kidnapping mr heineken stock http t co mlikfrrehz
-1	watching kidnapping mr heineken at kompleks villa mandiri https t co donc9jhq1i
-1	trailer phim kidnapping mr heineken http t co 1yfhxniota http t co b8fjxpixf7
-1	kidnapping mr heineken
-1	rt alnadalcons kidnapping mr heineken voyage http t co 0vhbvjtyrq
-1	kidnapping mr heineken factory http t co v6qib4ycfy
-1	rt ncerapchochil kidnapping mr heineken horses http t co 0t4opwk4df
-1	rt ylehaxaci kidnapping mr heineken hats http t co wj9gqgwhfw
-1	kidnapping mr heineken singapore http t co s4mbniplw3
-1	jim kidnapping mr heineken official trailer 1 2015 anthony hopkins sam worthington movie hd http t co l02glw4uar
-1	kidnapping mr heineken hats http t co wj9gqgwhfw
-1	rt osykyhidoq kidnapping mr heineken glasses http t co ujsqw48qpj
-1	rt alnadalcons kidnapping mr heineken voyage http t co 0vhbvjtyrq
-1	rt bellguasadi kidnapping mr heineken gluten http t co b0wn22coln
-1	rt ncerapchochil kidnapping mr heineken horses http t co 0t4opwk4df
-1	kidnapping mr heineken products http t co xhswfobowa
-1	rt ncerapchochil kidnapping mr heineken horses http t co 0t4opwk4df
-1	kidnapping mr heineken history http t co hdtif4b1vb
-1	rt uhisymotu kidnapping mr heineken new york http t co efaf5zlail
-1	rt itidoutot kidnapping mr heineken trailer http t co pztlxbzxap
-1	kidnapping mr heineken with innaharunna at tracia base 76b https t co n6ytz0kszz
-1	nowwatching kidnapping mr heineken
-1	kidnapping mr heineken vietnam http t co mgizkku8w5
-1	rt rashidmw kidnapping of mr heineken
-1	kidnapping mr heineken glasses http t co ujsqw48qpj
-1	kidnapping of mr heineken
-1	kidnapping mr heineken https t co scroy7dzqe
-1	kidnapping mr heineken voyage http t co 0vhbvjtyrq
-1	rt uhisymotu kidnapping mr heineken new york http t co efaf5zlail
-1	kidnapping mr heineken gluten http t co b0wn22coln
-1	kidnapping mr heineken 2015 full movie play now http t co hmek5uso8z more movie http t co tvif79q5gd
-1	nw kidnapping mr heineken
-1	rt jikutyluph kidnapping mr heineken uefa http t co wtrpvmpogr
-1	rt itidoutot kidnapping mr heineken trailer http t co pztlxbzxap
-1	watching kidnapping mr heineken https t co o4zckejj77
-1	watching kidnapping mr heineken https t co 0ghivhs01v
-1	watching kidnapping mr heineken
-1	rt calhidiri kidnapping mr heineken quality http t co zq8izc6wmj
-1	kidnapping mr heineken
-1	watching kidnapping mr heineken https t co nuagj8fflw
-1	rt jikutyluph kidnapping mr heineken electric http t co ngsh0xxeye
-1	kidnapping mr heineken with delistya https t co fcynxg042d
-1	watching kidnapping mr heineken https t co y0izgi4eat
-1	kidnapping mr heineken trailer http t co pztlxbzxap
-1	rt uhisymotu kidnapping mr heineken new york http t co efaf5zlail
-1	watching kidnapping mr heineken https t co jwlcbx1el0
-1	sssttttt kidnapping mr heineken https t co xgg6itcno2
-1	kidnapping mr heineken 2015 http t co ofaafko7lm http t co oqzc6xrhid
-1	rt jsocom kidnapping mr heineken releases on dvd br in the us today get some jim for yourself there are 6 deleted scenes http t co m
-1	kidnapping mr heineken http t co gl5prf09tr via youtube
-1	me dio sed ver kidnapping mr heineken bueno ma ana
-1	kidnapping mr heineken in china http t co n3wgsdsn9r
-1	kidnapping mr heineken click aqui para ver la pelicula http t co ghmnjdoxi9
-1	rt ehagufiw kidnapping mr heineken on sale http t co m5mxaon4xh
-1	watching kidnapping mr heineken with my lovely hanankhaleel73
-1	rt sticincocon kidnapping mr heineken drummer http t co nlrlxv2vvk
-1	nw kidnapping mr heineken
-1	kidnapping mr heineken horses http t co 0t4opwk4df
-1	rt xulofygij kidnapping mr heineken store http t co ddi9dqsymf
-1	i rated kidnapping mr heineken 5 10 http t co f0wolwce9q what a waste of epic story
-1	daily movies online watch amp download kidnapping mr heineken hd online free http t co uxo9y3nwxq
-1	kidnapping mr heineken electric http t co ngsh0xxeye
-1	kidnapping mr heineken on sale http t co m5mxaon4xh
-1	rt jikutyluph kidnapping mr heineken uefa http t co wtrpvmpogr
-1	rt sticincocon kidnapping mr heineken drummer http t co nlrlxv2vvk
-1	watching kidnapping mr heineken https t co 8pmlteozto
-1	yramses oookey j allais regarder kidnapping mr heineken
-1	whop based on true story kidnapping mr heineken https t co ddbdpinon0
-1	rt exmapenni kidnapping mr heineken vending http t co b5arkfr4ig
-1	anthnyhopckins anthony hopkins ritorna al cinema con kidnapping mr heineken http t co tkmiowyjpy
-1	rt hairiliti kidnapping mr heineken q2 http t co itktmrydc8
-1	rt jikutyluph kidnapping mr heineken uefa http t co wtrpvmpogr
-1	anthony hopkins ritorna al cinema con kidnapping mr heineken http t co 4u2hooeeof cinema http t co zdgxthsvjp
-1	check out this amazon deal kidnapping mr heineken blu ray by anthony hopkins http t co s8shk76xlg via amazon
-1	check out this amazon deal kidnapping mr heineken blu ray by anthony hopkins http t co r0uj3opdyd via amazon
-1	kidnapping mr heineken stock http t co mlikfrrehz
-1	very very rich or have a real friends you cannot have both kidnapping mr heineken https t co ynghdnx29e
-1	badassbeergear kidnapping mr heineken dvd 2015 free shipping http t co 3pwr3x4lon
-1	rt prondeswildprem kidnapping mr heineken investor http t co on22xmnhnh
-1	rt vefepudu kidnapping mr heineken umbrella http t co ka3staz48b
-1	watching kidnapping mr heineken with andriy and alvi https t co i18l3ci0h6
-1	kidnapping of mr heineken
-1	kidnapping mr heineken trailer http t co honqypkwma
-1	win kidnapping mr heineken on dvd in th http t co rj64b5rt4d
-1	watching kidnapping mr heineken https t co p9nndskwdg
-1	watch kidnapping mr heineken click http t co a1tdgazvqc http t co h2tens6zgc
-1	watching kidnapping mr heineken with agnes https t co db6orfzmdb
-1	couchpotato found 167 releases for kidnapping mr heineken before eta select and download via the dashboard
-1	kidnapping mr heineken https t co p7qfo3t2ot
-1	kidnapping mr heineken drummer http t co nlrlxv2vvk
-1	rt xulofygij kidnapping mr heineken store http t co ddi9dqsymf
-1	rt film_streaming anthony hopkins ritorna al cinema con kidnapping mr heineken http t co rekurf4tlv http t co gdd3j4brrm
-1	watching kidnapping mr heineken https t co uy5btiffbc
-1	dvd ing kidnapping mr heineken https t co rrq2ceyeig
-1	rt prondeswildprem kidnapping mr heineken investor http t co on22xmnhnh
-1	kidnapping mr heineken us open http t co fihcrm1uac
-1	rt hairiliti kidnapping mr heineken q2 http t co itktmrydc8
-1	anthony hopkins ritorna al cinema con kidnapping mr heineken http t co rekurf4tlv http t co gdd3j4brrm
-1	couchpotato found 14 releases for kidnapping mr heineken before eta select and download via the dashboard
-1	kidnapping mr heineken jobs http t co us7olpvjdx
-1	rt ehagufiw kidnapping mr heineken brews up a b movie crime tale http t co phg1xqpsel
-1	emlmillar watch good movie kidnapping mr heineken 2015 at http t co ttpvg0hjru movie film streaming
-1	kidnapping mr heineken neon http t co spz8deadk8
-1	rt vefepudu kidnapping mr heineken umbrella http t co ka3staz48b
-1	kidnapping mr heineken quality http t co zq8izc6wmj
-1	kidnapping mr heineken new york http t co efaf5zlail
-1	rt jikutyluph kidnapping mr heineken uefa http t co wtrpvmpogr
-1	rt exmapenni kidnapping mr heineken vending http t co b5arkfr4ig
-1	kidnapping mr heineken full movie https t co nuvpqwuzmp
-1	kidnapping mr heineken full movie https t co oefjdixor0
-1	kidnapping mr heineken full movie https t co ts3udthnyv
-1	kidnapping mr heineken zero http t co 91yvqhtviy
-1	kidnapping mr heineken f u l l m o v i e http t co lq17hxxx4a via youtube
-1	kidnapping mr heineken
-1	rt prondeswildprem kidnapping mr heineken investor http t co on22xmnhnh
-1	kidnapping mr heineken vending http t co b5arkfr4ig
-1	i just watched kidnapping mr heineken 2015 https t co mgdqzuf1t0 trakt
-1	rt hairiliti kidnapping mr heineken q2 http t co itktmrydc8
-1	kidnapping mr heineken wikipedia http t co bunixhtgyo
-1	rt otehemav kidnapping mr heineken commercial singer http t co fipoym1q3k
-1	kidnapping mr heineken looter http t co neewvfvyw3
-1	watching kidnapping mr heineken https t co tccq25vyaq
-1	kidnapping mr heineken images http t co 8hy5bmtl7x
-1	rt ymihudyp kidnapping mr heineken nutritional information http t co qkgcxhypyf
-1	kidnapping mr heineken brews up a b movie crime tale http t co phg1xqpsel
-1	rt ymihudyp kidnapping mr heineken nutritional information http t co qkgcxhypyf
-1	kidnapping mr heineken nutritional information http t co qkgcxhypyf
-1	kidnapping mr heineken distributors http t co ebtlrbrv5a
-1	the caper thriller kidnapping mr heineken ouralchemy w intense performances by a charismatic cast http t co lenmhzjubm on dvd blu ray
-1	watching kidnapping mr heineken with sigit at perum polri gowok https t co 75vwasj5mn
-1	rt jsocom kidnapping mr heineken releases on dvd br in the us today get some jim for yourself there are 6 deleted scenes http t co m
-1	rt jsocom kidnapping mr heineken releases on dvd br in the us today get some jim for yourself there are 6 deleted scenes http t co m
-1	rt vefepudu kidnapping mr heineken umbrella http t co ka3staz48b
-1	watching kidnapping mr heineken https t co ulq8kxlevq
-1	watching kidnapping mr heineken https t co 08xuccqiju
-1	kidnapping mr heineken https t co bdhiubg5my
-1	watching kidnapping mr heineken https t co fnlkd2zm9z
-1	manny lewis 4 5 the second best exotic marigold hotel 3 5 that sugar film 3 5 kidnapping mr heineken 1 5 seventh son 2 5
-1	watching kidnapping mr heineken https t co keuosn1i1k
-1	based on a true story godftaher nya belanda kidnapping mr heineken https t co z1tnxhqspx
-1	rt tyqavagyo kidnapping mr heineken cup http t co nswiqphpeh
-1	nw kidnapping mr heineken
-1	rt donzogonk watching kidnapping mr heineken https t co fafudoayjl
-1	watching kidnapping mr heineken https t co fafudoayjl
-1	dvd ing kidnapping mr heineken https t co spnqa7cvl4
-1	watching kidnapping mr heineken https t co sfiew9zn7d
-1	kidnapping mr heineken accessories http t co uxrsgqptmu
-1	kidnapping mr heineken q2 http t co itktmrydc8
-1	rt prondeswildprem kidnapping mr heineken investor http t co on22xmnhnh
-1	kidnapping mr heineken festival in puerto http t co suu8vglrn8
-1	kidnapping mr heineken https t co j9tvv1o16s
-1	tonight is for kidnapping mr heineken the last five years play pes
-1	kidnapping mr heineken https t co ceosyily79
-1	kidnapping mr heineken umbrella http t co ka3staz48b
-1	rt sticincocon kidnapping mr heineken extra http t co 0l3nhqsctj
-1	rt tiorilona kidnapping mr heineken marketing http t co ew6r8ju7h7
-1	rt xulofygij kidnapping mr heineken store http t co ddi9dqsymf
-1	rt jikutyluph kidnapping mr heineken uefa http t co wtrpvmpogr
-1	the maze runner 2014 full movie http t co ua4y5pjzam kidnapping mr heineken 2015 full movie http t co ntpcoysgls
-1	rt tiorilona kidnapping mr heineken marketing http t co ew6r8ju7h7
-1	nw kidnapping mr heineken
-1	viendo kidnapping mr heineken en cinever http t co fi3qjemq4s
-1	rt italmovix kidnapping mr heineken sub ita http t co shyx2dmxdc via tiritwittoio ritwittandoci ioretweet seguitutti ritiwtto
-1	alexhepburn kidnapping mr heineken
-1	rt tyqavagyo kidnapping mr heineken cup http t co nswiqphpeh
-1	rt xulofygij kidnapping mr heineken store http t co ddi9dqsymf
-1	kidnapping mr heineken pictures http t co vnudz4mvg1
-1	so i m watching kidnapping mr heineken tonight
-1	kidnapping mr heineken 2015 imdb http t co que1aoasum
-1	rt italmovix kidnapping mr heineken sub ita http t co shyx2dmxdc via tiritwittoio ritwittandoci ioretweet seguitutti ritiwtto
-1	new releases big eyes babadook woman in black 2 man with the iron fist 2 kidnapping mr heineken and http t co wyo6foscdc
-1	rt jikutyluph kidnapping mr heineken uefa http t co wtrpvmpogr
-1	i liked a youtube video http t co w1htwkh7yb kidnapping mr heineken 2015 grea a bate filmul
-1	rt italmovix kidnapping mr heineken sub ita http t co shyx2dmxdc via tiritwittoio ritwittandoci ioretweet seguitutti ritiwtto
-1	kidnapping mr heineken sub ita http t co shyx2dmxdc via tiritwittoio ritwittandoci ioretweet seguitutti ritiwtto antonypisa
-1	the inside story of the planning execution rousing aftermath and ultimate downfall of the kidnappers of beer http t co ozaalriwm9
-1	rt jikutyluph kidnapping mr heineken uefa http t co wtrpvmpogr
-1	megan_tam thinking about some1 while watching kidnapping mr heineken 2015 at http t co f4xnv7rjhy movie film streaming
-1	new this week kidnapping mr heineken big eyes woman in black 2 the babadook you re not you http t co b4i5behqa9
-1	kidnapping mr heineken wiki http t co yf3ukh7v0t
-1	kidnapping mr heineken official website http t co yqxyssebwn
-1	kidnapping mr heineken 2015 http t co 0jiablrvyb
-1	nw kidnapping mr heineken
-1	mr kidnapping mr heineken at home https t co yuki7zzk6j
-1	pizza and movies dvduesday watching kidnapping mr heineken
-1	kidnapping mr heineken premium http t co 7a5njpee11
-1	mr heineken kidnapping mr heineken https t co xqxbx6xu0v
-1	new releases april 14 antarctica a year on ice big eyes kidnapping mr heineken the missing the http t co likzaqwwl1
-1	kidnapping mr heineken with vetto https t co o6ac4t6hdt
-1	rt sticincocon kidnapping mr heineken extra http t co 0l3nhqsctj
-1	rt prondeswildprem kidnapping mr heineken investor http t co on22xmnhnh
-1	rt jsocom kidnapping mr heineken releases on dvd br in the us today get some jim for yourself there are 6 deleted scenes http t co m
-1	download movie kidnapping mr heineken action interesting http t co fhbex6alc3
-1	rt jsocom kidnapping mr heineken releases on dvd br in the us today get some jim for yourself there are 6 deleted scenes http t co m
-1	kidnapping mr heineken releases on dvd br in the us today get some jim for yourself there are 6 deleted scenes http t co mtyql1vggl
-1	rt tiorilona kidnapping mr heineken marketing http t co ew6r8ju7h7
-1	rt esylepudec kidnapping mr heineken percent http t co kuk62ydaea
-1	kidnapping mr heineken store http t co ddi9dqsymf
-1	chasepedia back to watching kidnapping mr heineken 2015 at http t co ajul0o3bof movie film streaming http t co qezj350wkq
-1	watching kidnapping mr heineken https t co pkdnbpt7wv
-1	watching kidnapping mr heineken https t co kkaunk9ftc
-1	kidnapping mr heineken extra http t co 0l3nhqsctj
-1	there are to ways a man can be rich in this world he can have a lot of money or he kidnapping mr heineken https t co v6x6y3toad
-1	justinsimon watching good movie kidnapping mr heineken 2015 at http t co omvucleqx9 movie film streaming http t co ziuwd4v2id
-1	action crime drama kidnapping mr heineken 2015 http t co zpk1avbi6h
-1	kidnapping mr heineken https t co a0aznuygqp
-1	rt tyqavagyo kidnapping mr heineken cup http t co nswiqphpeh
-1	watching kidnapping mr heineken https t co lhgoi2emdr
-1	kidnapping mr heineken trailer http t co zvhkz980we via youtube
-1	kidnapping mr heineken formaldehyde http t co e2eitv3egg
-1	kidnapping mr heineken marketing http t co ew6r8ju7h7
-1	kidnapping mr heineken 2015 subita crime drammatico durata 1 35 00 kidnapping mr heineken 2015 http t co vgj8ogddt9
-1	kidnapping mr heineken uefa http t co wtrpvmpogr
-1	selamat siang kidnapping mr heineken https t co p2hma5k8pp
-1	kidnapping mr heineken https t co gskiqjoret
-1	watching kidnapping mr heineken https t co sahnuun9iw
-1	watching kidnapping mr heineken
-1	kidnapping mr heineken 2015 subita http t co sj5phy841i http t co 4zidvjgkzt
-1	there are two ways a man can be rich in this world he can have a lot of money or he kidnapping mr heineken https t co uooy8aom1t
-1	kidnapping mr heineken commercial singer http t co fipoym1q3k
-1	kidnapping mr heineken music hall http t co gsonqsypby
-1	hd rental price drop kidnapping mr heineken for 4 99 prev 6 99 http t co phlsfxmpjs
-1	kidnapping mr heineken international graduate http t co zcrx5y2e5o
-1	there s 2 ways the mans can be rich in this world 1 he have a lot of money or 2 kidnapping mr heineken https t co i2rpovdkjs
-1	ganti film kidnapping mr heineken https t co sqyi3mnzuk
-1	danawessel starts now kidnapping mr heineken 2015 at http t co my0zvvvyxx movie film streaming
-1	cutiepieconnorx i love watch kidnapping mr heineken 2015 at http t co 6g2oq8fo1i movie film streaming
-1	rt tyqavagyo kidnapping mr heineken cup http t co nswiqphpeh
-1	kidnapping mr heineken investor http t co on22xmnhnh
-1	kidnapping mr heineken investor http t co axv23j54q0
-1	rt tyqavagyo kidnapping mr heineken cup http t co nswiqphpeh
-1	cbanks04 been watching kidnapping mr heineken 2015 at http t co hd2rnhqvyl movie film streaming http t co uuthrsqjq8
-1	dvd review kidnapping mr heineken struggles to forge its own identity http t co gktocgaox3 http t co pwz36k7ayx
-1	rt xulofygij kidnapping mr heineken holiday http t co yhqm9pfzkw
-1	about to watch the same movie tho rt babaunl0ck kidnapping mr heineken
-1	kidnapping mr heineken let s see what your sayin
-1	kidnapping mr heineken
-1	nw kidnapping mr heineken based on a true story of the kidnapping of the founder of heineken the largest ransom ever paid cc heineken_ug
-1	movie kidnapping mr heineken
-1	kidnapping mr heineken 2015 un film di daniel alfredson con sam worthington anthony hopkins jim sturgess http t co yhhswqcckk
-1	kidnapping mr heineken holiday http t co yhqm9pfzkw
-1	watching kidnapping mr heineken https t co jtfilapkkk
-1	rt riyomoe watching kidnapping mr heineken at rockson palace https t co oi96rpswgd
-1	kidnapping mr heineken http t co bftuulaixl
-1	rt observer in kidnapping mr heineken nobody gets killed raped or mutilated but it s still thrilling http t co 3qyts4nkby
-1	rt kidnapfhmovie welcome to all new followers and enjoy kidnapping mr heineken in the cinema http t co yfrtwfjd0m
-1	watching kidnapping mr heineken https t co wxmtw6rmco
-1	kidnapping mr heineken sub ita 2015 http t co eejimbkqzt
-1	nowwatching kidnapping mr heineken
-1	doha_mousa fast and furious 7 assassin 2015 focus kidnapping mr heineken 2015 the gambler interstellar p
-1	tuesday s new releases the babadook big eyes enter the dangerous mind from the dark kidnapping mr heineken the http t co 8gacre0wlg
-1	rt online_movies_4 kidnapping mr heineken trailer http t co uqgclijkqi imdb http t co 3sbzp5gtbw watch movie http t co jcvkili1pf h
-1	watching kidnapping mr heineken at rockson palace https t co oi96rpswgd
-1	watching kidnapping mr heineken https t co plsitl9u8u
-1	watching kidnapping mr heineken https t co hiippwmf4j
-1	vou ver agora de tarde o kidnapping mr heineken
-1	rt zesowaza kidnapping mr heineken jazz http t co enomzb4jl7
-1	rt ahaxenemhe kidnapping mr heineken love http t co 9iducjrwil
-1	watching kidnapping mr heineken with antonius https t co maxdnvnlef
-1	rt ewewubyvw kidnapping mr heineken true story http t co uwxesp5clh
-1	based on a true story wow kidnapping mr heineken https t co ceolsi0kur
-1	jennnariveraa been watching kidnapping mr heineken 2015 at http t co rxhnf1i9vi movie film streaming http t co a3rbm2jpeg
-1	watching kidnapping mr heineken https t co 3soxkwhaye
-1	the top ransom ever paid comes to lifestyles with kidnapping mr heineken http t co o3vwwjwnej
-1	ron_skolnik i l0ve watching kidnapping mr heineken 2015 at http t co xodpangdrv movie film streaming
-1	kidnapping mr heineken love http t co 9iducjrwil
-1	kidnapping mr heineken review examinercom http t co iclwzsd5k2
-1	kidnapping mr heineken https t co xmy4ppusdm
-1	kidnapping mr heineken http t co qqyofxfsgu
-1	kidnapping mr heineken http t co qqyofxfsgu http t co m1kvsunf3a
-1	rt prondeswildprem kidnapping mr heineken kegerator http t co fsxzqnggq7
-1	camaliciousp just finished watching kidnapping mr heineken 2015 at http t co 8ega6culhp movie film streaming http t co ka5g2rgfnq
-1	rt atalsede kidnapping mr heineken label http t co 9udnbhrmvv
-1	philliproost best movie i ever saw kidnapping mr heineken 2015 at http t co mwuufeszbk movie film streaming
-1	kidnapping mr heineken 2015 95 min action crime drama the inside story of the planning execution http t co jco3t8uac8
-1	watching kidnapping mr heineken https t co bvtxuqmvmo
-1	kidnapping mr heineken http t co h5ho1xprf2
-1	kidnapping mr heineken full movie watch now http t co 35twzpww0a http t co j85u3uxhol
-1	kidnapping mr heineken apparel http t co 00zdc4wm3h
-1	kidnapping mr heineken true story http t co uwxesp5clh
-1	kidnapping mr heineken ad http t co 7euxok5tzw
-1	jassymoo510 just watching kidnapping mr heineken 2015 at http t co jzmpjjymue movie film streaming http t co vjqxnvaef7
-1	kidnapping mr heineken cup http t co nswiqphpeh
-1	assistindo kidnapping mr heineken
-1	kidnapping mr heineken
-1	vean kidnapping mr heineken es muy buena
-1	rt yify_torrents kidnapping mr heineken 2015 720p https t co q8kde00akc
-1	byoung7171 anybody else watching kidnapping mr heineken 2015 at http t co achaywx9bg movie film streaming http t co 3g4sm0vpab
-1	couchpotato found 9 releases for kidnapping mr heineken before eta select and download via the dashboard
-1	kidnapping mr heineken
-1	watching kidnapping mr heineken https t co w9dlbek5sz
-1	kidnapping mr heineken muito bom
-1	kidnapping mr heineken http t co tua426dph9
-1	kidnapping mr heineken english movie 2015 http t co 645qfjmbfy http t co o9khspclib
-1	kidnapping mr heineken was a good film
-1	the movies stretch and the voices never mind the kidnapping of mr heineken and the forger a little more acceptable
-1	bsquirek been watching kidnapping mr heineken 2015 at http t co kaup6k4rer movie film streaming http t co 7kxgncvjm7
-1	watching kidnapping mr heineken with mono and kamasari https t co wzltoz8wu8
-1	kidnapping mr heineken label http t co 9udnbhrmvv
-1	guardate il nuovo film kidnapping mr heineken in streaming sub ita http t co sfi3u1bbyu
-1	kidnapping mr heineken https t co wvcxmr2bd2
-1	now watching kidnapping mr heineken 2015 http t co 5wzjwndriq
-1	rt omycesok kidnapping mr heineken sponsorship http t co wokxkj7sun
-1	kidnapping mr heineken percent http t co kuk62ydaea
-1	watching kidnapping mr heineken https t co bx80soagyk
-1	rt prondeswildprem kidnapping mr heineken kegerator http t co fsxzqnggq7
-1	make sure you dont miss new post soundtrack review kidnapping mr heineken http t co 9mwf24lup5 http t co qa454ddfvj
-1	kidnapping mr heineken americas http t co dstrcgmpyk
-1	watch kidnapping mr heineken in november 1983 the brazen kidnapping of beer magnate alfred fredd http t co ngr9vte5gg netflix
-1	kidnapping mr heineken with fenny at cikutra 101 https t co djhnnxwlqm
-1	rt omycesok kidnapping mr heineken sponsorship http t co wokxkj7sun
-1	watching kidnapping mr heineken https t co btr8rytnin
-1	kidnapping mr heineken http t co wmuxzsujgm
-1	kidnapping mr heineken http t co ttytxem8nh
-1	kidnapping mr heineken http t co w49pnqrqkh
-1	kidnapping mr heineken now on netflix by mail http t co qssfdi0s7y
-1	kidnapping mr heineken http t co rs0crmxvt7
-1	kidnapping mr heineken http t co ihrkrc1iny
-1	kidnapping mr heineken http t co pikslsdlve http t co amcfaacxms http t co 6i0hpcqgzm
-1	kidnapping mr heineken is new on netflix http t co koorbprhkz http t co zjt5arwalv
-1	netflix kidnapping mr heineken http t co w3maj20vwh in november 1983 the brazen kidnapping of beer magnate alfred freddy heineken
-1	rt qmuxhx57 kidnapping mr heineken international http t co cxl22quy93
-1	rt qmuxhx57 kidnapping mr heineken international http t co cxl22quy93
-1	watching kidnapping mr heineken like 5mins into the movie guys kicking out bad tenants is just hilarious yo fuck em up all of them
-1	nowwatching kidnapping mr heineken
-1	brock_t3 starts now kidnapping mr heineken 2015 at http t co t7xff3kocv movie film streaming http t co dof9u14kzj
-1	kidnapping mr heineken
-1	rt hairiliti kidnapping mr heineken yush http t co 0a1hjpcnga
-1	watching kidnapping mr heineken https t co suxakxdfto
-1	bluraytime kidnapping mr heineken with taufik https t co haaaubwp3l
-1	watching kidnapping mr heineken https t co jbombgeiuw
-1	rt omycesok kidnapping mr heineken sponsorship http t co wokxkj7sun
-1	rt esylepudec kidnapping mr heineken sweepstakes http t co nwcbxjop1c
-1	kidnapping mr heineken 2015 1080p bluray x264 yify
-1	watching kidnapping mr heineken at my home https t co eq8felkpad
-1	watching kidnapping mr heineken https t co pyizz2wuaf
-1	kidnapping mr heineken house http t co p3fnmpxwmd
