-1	who watched mortdecai
-1	watching mortdecai
-1	rt brendohare it has been a great year for art mortdecai chappie paul blart 2 in june i m going to make a mr peanut parody account
-1	watching mortdecai
-1	rt brendohare it has been a great year for art mortdecai chappie paul blart 2 in june i m going to make a mr peanut parody account
-1	nw mortdecai 2015 movie starring johnny depp
-1	im watching mortdecai
-1	watching mortdecai https t co rv7527maoa
-1	nw mortdecai
-1	rt justinshanes remember you can write off those mortdecai tickets as a charitable donation
-1	mortdecai guarda film completo streaming gratis http t co 9xsancq0bu infowars alexjones
-1	finally watching mortdecai gotta love johnny depp
-1	rt justinshanes remember you can write off those mortdecai tickets as a charitable donation
-1	just finish watching mortdecai film
-1	watching mortdecai https t co blkb308t3b
-1	new release johnny depp m terbaeeekkk mortdecai https t co gpoyqcztyo
-1	watching mortdecai
-1	watching mortdecai https t co 7yypzldo5c
-1	watched mortdecai and i now see why it never got that big
-1	as bad as mortdecai is and it s bad i enjoyed it more than will smith s last borefest focus
-1	tonight laker cinema presents mortdecai at 9 pm in the peacock cove http t co 9gw30empms
-1	haha funny stuff from johnny depp mortdecai
-1	if there s an ironic screening of paul blart mall cop 2 in a few months i ll weep amp wipe my tears with my criterion edition of mortdecai
-1	i ve heard a lot people ridiculing the movie mortdecai but it s actually a hilarious flick highly recommended http t co 0kvojgmzrq
-1	ddiaz2187 watched mortdecai t 2015 r on my nexus 5 for 59 seconds 1
-1	paul whitehouse is actually in this film and the circle of ham acting is complete mortdecai
-1	ranzkyle ow dinner with your bae hahaha d mortdecai
-1	watched mortdecai havent laughed so much in a while
-1	all the actors in mortdecai are doing impersonations of paul whitehouse doing acting
-1	watching mortdecai with ricky at cinema21 https t co us8yda6vn0
-1	johnny depp p watching mortdecai
-1	watching mortdecai at cinema21 https t co conppgwbqf
-1	mortdecai available for download aah its been a while
-1	i m just about to start the film mortdecai this is exciting i ve heard it s an abomination
-1	watching a movie mortdecai 2015 starring johnny depp dara alx you will love it
-1	bruh mortdecai is horrible wish johnny depp would stop with the accents and awkward running already
-1	nw mortdecai johnny depp
-1	meninblazers silva s stache is the most awful thing i ve seen on screen since mortdecai the film not depp s stache http t co 2oihrj57na
-1	watching mortdecai https t co mn6z8cftag
-1	nw mortdecai
-1	is it wrong that i m tempted to watch mortdecai just to see how achingly unfunny it is
-1	nw mortdecai
-1	lady mortdecai https t co xdlpsc91xx
-1	rt uncledynamite judge sentences tsarnaev to 20 000 consecutive viewings of mortdecai
-1	run i shall like a bloody gazelle mortdecai
-1	amp you will always be my first love johnnydepp mortdecai watching mortdecai
-1	homemaxx time mortdecai at adwara s home https t co qwevbuqkro
-1	watching mortdecai 2015 movie hd
-1	watching mortdecai
-1	adore johnny drop mortdecai
-1	i mean there s parts of mortdecai that could be entertaining and dare i say funny but not with johnny depp
-1	watching mortdecai https t co mdslr53c0x
-1	after watching mortdecai i feel like an apology is due from any american who s ever tried to fake a british accent
-1	also silly moustaches silly moustaches are actually a plot point in the hideously awful mortdecai
-1	i believe i should put my foot down on this dear with your permission ofcourse mortdecai
-1	everyone involved in making mortdecai grossly overestimated the public interest in johnny depp gwyneth paltrow and goya paintings
-1	nw mortdecai
-1	films4ever mortdecai 720p web dl download now for free hd http t co weqxc31b56
-1	lady mortdecai gwynethpaltrow cheer up you lasted more than mortdecai boxoffice
-1	loveyou mortdecai with baridi at cinema21 https t co 7r4icfmzmy
-1	today i m watching mortdecai and http t co muolh569nq
-1	what happened to johnny depp seriously what happened to him mortdecai https t co gzookqvq5w
-1	mortdecai 2015 300mb mediafire links hdrip x264 http t co 8t2vvdxt2y
-1	olivia munn mortdecai blu ray http t co u2u8nzlmej
-1	johnny depp s mortdecai is now available in hdrip 1 38 gb https t co gtff92beht
-1	so mortdecai is basically british tony stark via http t co htb6r68uzx
-1	ok watch movie mortdecai 2015 online full movie free watchmovie so http t co 3u17vh4zmx via sharethis
-1	watching mortdecai
-1	mortdecai movie review http t co sdhslehluq
-1	living for johnny depp s chelsea accent in mortdecai
-1	mortdecai was such a hoot and his missus particularly fetching
-1	don t point that thing at me great fun cloudyday strawberry mortdecai bonfiglioli http t co zfoxnvclcu
-1	rt brendohare it has been a great year for art mortdecai chappie paul blart 2 in june i m going to make a mr peanut parody account
-1	nw mortdecai
-1	last night s viewing a film so bad you physically can t turn it off mortdecai official trailer 1 2015 https t co 1k6miuut55
-1	i love jock mortdecai
-1	mortdecai isn t even close to being fun bad
-1	i don t know what the fuss was about i thoroughly enjoyed mortdecai parttimerogue
-1	watching mortdecai https t co gkriv45mti
-1	nw mortdecai johnny depp
-1	finally watching mortdecai d love me some gwynethpaltrow
-1	watching mortdecai
-1	mortdecai hilarious movie
-1	is mortdecai more than a mustache http t co oaikc41ia7
-1	mortdecai is a one fun movie to watch d johnny depp ftw
-1	desgoffetaxis gt davie and mortdecai i know i have been busy as of late tokiko is a really good student dmitri took a seat next to adel gt
-1	ianelliot is watching fucking mortdecai i m rethinking my choice in boyfriend fml lionsgate https t co yzuf2xdo9t
-1	the mortdecai great jhonny depp at his very best as always nowwatching
-1	new post mortdecai 2015 md webdl ita http t co cqourl3ddk
-1	watching mortdecai while eating ice cream
-1	nw mortdecai
-1	johnny depp u fabulous _ __ _ hilarious xd xd watching mortdecai
-1	midnight showing of mortdecai at ash cinema
-1	couchpotato downloaded mortdecai 1080p
-1	oh dear no piers mortdecai today piersmorgan gmb
-1	rt gwynethpaltrow only a brave woman dares http t co qvyamlgzjo mortdecai http t co nxagquaik8
-1	rt brendohare it has been a great year for art mortdecai chappie paul blart 2 in june i m going to make a mr peanut parody account
-1	watching mortdecai with eri https t co 9q2rxcolox
-1	rt gwynethpaltrow taming the scoundrel that is charlie mortdecai http t co ceaxi6kkkj parttimerogue mortdecai sneakpeek http t co
-1	rt brendohare it has been a great year for art mortdecai chappie paul blart 2 in june i m going to make a mr peanut parody account
-1	rt gwynethpaltrow only a brave woman dares http t co qvyamlgzjo mortdecai http t co nxagquaik8
-1	rt gwynethpaltrow no stone left unturned on the sternshow with howardstern mortdecai https t co 1ba7almht4
-1	rt gwynethpaltrow reunited in the western colonies mortdecai http t co jkmniivkez
-1	rt gwynethpaltrow a little game of never have i ever theellenshow mortdecai http t co ulucysurbg
-1	rt gwynethpaltrow tonight on the silver screen modern day screwball comedy mortdecai http t co looolc2qub
-1	watching mortdecai
-1	i watched mortdecai 2015 tonight imdb gave it a 5 4 but i would give it a 6 8 it was a good comic film http t co lfzlsa3jmu
-1	rt brendohare it has been a great year for art mortdecai chappie paul blart 2 in june i m going to make a mr peanut parody account
-1	rt whattedsaid pete carroll just went to see mortdecai worst decision he s made this month
-1	bluray mortdecai johnny depp gwyneth paltrow ewan mcgregor teks indonesia barat https t co whlmlajjfm
-1	mortdecai is sweet
-1	desgoffetaxis gt tugged on mortdecai s trouser i do think he is requesting your attention dmitri chuckled watching the scene with gt
-1	mortdecai movie review http t co yn1j7ak8sf
-1	desgoffetaxis gt mortdecai no one would have guessed that jopling of all people would turn out to have a normal life after all he s lived gt
-1	watching mortdecai at the boredroom https t co rncnbjbxgc
-1	mortdecai_jp 10 04 2 t m s 9 5 ff l 10 07 pure lie d wn 14 45 want t f c 4 f key se f c same same all
-1	downloaded mortdecai
-1	petergatt mortdecai i can t stand gwyneth
-1	johnny depp s mortdecai release date moved forward movies http t co hdejmfug0r
-1	mortdecai was so bad even will ferrall with his over the top unfunny shit would be unable to save this one
-1	http t co zasqbiq4oh full mortdecai http t co 3smuwcqmbq
-1	working overtime to finish up the event stuff for tomorrow and sunday while watching mortdecai with https t co may2tbcrpy
-1	nw mortdecai
-1	rt brendohare it has been a great year for art mortdecai chappie paul blart 2 in june i m going to make a mr peanut parody account
-1	rt brendohare it has been a great year for art mortdecai chappie paul blart 2 in june i m going to make a mr peanut parody account
-1	rt brendohare it has been a great year for art mortdecai chappie paul blart 2 in june i m going to make a mr peanut parody account
-1	rt brendohare it has been a great year for art mortdecai chappie paul blart 2 in june i m going to make a mr peanut parody account
-1	rt brendohare it has been a great year for art mortdecai chappie paul blart 2 in june i m going to make a mr peanut parody account
-1	rt brendohare it has been a great year for art mortdecai chappie paul blart 2 in june i m going to make a mr peanut parody account
-1	it has been a great year for art mortdecai chappie paul blart 2 in june i m going to make a mr peanut parody account all is good
-1	watch mortdecai 2015 vodly to
-1	rt uncledynamite judge sentences tsarnaev to 20 000 consecutive viewings of mortdecai
-1	mortdecai 2015 hdrip http t co lnjwe5vgu9 http t co r57xrpsbhy
-1	rt uncledynamite judge sentences tsarnaev to 20 000 consecutive viewings of mortdecai
-1	mortdecai 2015 english movie http t co 9u97vmuoec ____
-1	rt uncledynamite judge sentences tsarnaev to 20 000 consecutive viewings of mortdecai
-1	i see johnny s future as an elder robert mitchum john waters on the crybaby commentary was mortdecai what he had in mind
-1	judge sentences tsarnaev to 20 000 consecutive viewings of mortdecai
-1	movies i ve watched today mortdecai american sniper and now the interview
-1	couchpotato downloaded mortdecai 1080p
-1	the truth is nice but rumors are priceless mortdecai
-1	paul blart 2 is kind of benefiting from the mortdecai afterglow his moustache fits in with the zeitgeist
-1	batman v superman v paul blart v chappie v mortdecai dawn of justice
-1	get create your greatest life by les brown for only 20 577 less than original price http t co lsoubikmtm
-1	watching mortdecai http t co ahj7xjwdzm
-1	ulrichthomsen can t wait to see you in mortdecai
-1	rt gwynethpaltrow tonight on the silver screen modern day screwball comedy mortdecai http t co looolc2qub
-1	putrimds yes i ve watched it today we ll watch mortdecai johnny depp haha
-1	couchpotato snatched mortdecai 2015 hdrip xvid ac3 etrg mortdecai 2015 in brrip movies
-1	watching mortdecai
-1	mortdecai 2015 720p web dl mortdecai 2015 720p web dl juggling angry russians the british mi5 and an in http t co j3pwqgvqmg
-1	watching mortdecai
-1	nw mortdecai
-1	nowwatching mortdecai by david koepp starring johnny depp gwyneth paltrow ewan mcgregor amp paul bettany
-1	mortdecai too silly for its own good aside from some pretty terrible overacting there are a few really solid physical gags though
-1	johnny depp watching mortdecai
-1	watch mortdecai online free putlocker http t co izai0wxljb
-1	watching mortdecai doritos
-1	rt _04181024 anyone is mortdecai good alwayswithjessicajung happyjessday
-1	rt _04181024 anyone is mortdecai good alwayswithjessicajung happyjessday
-1	anyone is mortdecai good alwayswithjessicajung happyjessday
-1	watching mortdecai
-1	is pompadou the new mortdecai
-1	mortdecai_jp 9 59 2 t m s same same sakaif op tf matsuuraf f door outside in takashi if quiet go out at after optf10 01 a
-1	have you heard the expression open your balls it made me feel dirty mortdecai
-1	oooh you pretended to be gentle but you weren t mortdecai
-1	i rated mortdecai 2015 5 10 imdb average http t co ir3puybqvs
-1	mortdecai_jp 9 44 2 t m s f key f l se same same maedaf kosei 4 pretence go out quiet upstairs sakaif neighbor 44 all
-1	okay the boy next door did u dl that m_u_y_e muyiskoko saw mortdecai but no 700mb version will wait
-1	have they announced a derek mortdecai team up movie yet
-1	muyiskoko saw mortdecai but no 700mb version will wait
-1	now it s time for mortdecai
-1	yaah jhonny depp character kman f m4wark el fnii y watching mortdecai
-1	mortdecai starring johnny depp another comedy film of johnny depp entitled http t co 1qsawszowv actionmovies comedymovies movies
-1	johnny depp clownin it up in mortdecai gwyneth paltrow reminding him who da boss is http t co n26bsodcwn
-1	watch mortdecai 2015 online free putlocker putlocker watch movies online free http t co by5ll9ewac
-1	lookasingh 4 singh s opening credits of mortdecai jonnydepp and gwynethpaltrow http t co 002v7fytax
-1	olivia munn mortdecai blu ray http t co u2u8nzlmej
-1	stefapie futurehasbeen married to mortdecai http t co u3cjwkvgo8
-1	rt justinshanes remember you can write off those mortdecai tickets as a charitable donation
-1	whoop mortdecai in english finally
-1	futurehasbeen kill chappie because robot fuck paul blart because i think he d be a grateful lover marry mortdecai for the adventures
-1	stefapie thnk how whimsical being married to mortdecai would be begins bleeding internally
-1	futurehasbeen fuck mortdecai marry chappie kill i now pronounce you larry
-1	mortdecai torrent movie 2015 1080p download http t co kyesuqhl47
-1	few things in life are more entertaining than watching gwynethpaltrow live for a week on the total box office of her last film mortdecai
-1	jus watched mortdecai brilliant film positively posh and very funny
-1	wtf is mortdecai lol
-1	watching mortdecai
-1	mortdecai don t imbibe the crime scene
-1	mortdecai johnny depp n this moustache dies
-1	worn out watching mortdecai twilight
-1	do i really dare watch mortdecai fan of the books big fan of depp oh go on then trash tv for friday evening
-1	mortdecai may be a commercial flop but i m rather enjoying it maybz cz am british amp depp is as immersed amp dedicated as ever 7 10
-1	mortdecai_jp 6 36 2 t m s 5 3 6 2 watch twitter be don t use about t m m s name same same kosei 37 offenders a
-1	rt g2g__fm johnny depp s new movie mortdecai is now available in 720p hd http t co m1ngotfyhf
-1	rt g2g__fm johnny depp s new movie mortdecai is now available in 720p hd http t co m1ngotfyhf
-1	watch mortdecai 2015 movie http t co uobznrvoed http t co yrgk4sbuyj
-1	mortdecai_jp 6 27 2 t m s want t f c 2 f c same same after sakaif garage wires in wires kinki all
-1	mortdecai good cast promising but not hitting it off mildly amusing but no terry thomas
-1	just wanna settle and watch mortdecai because johnny depp is awesome
-1	charlie mortdecai watch free http t co fwisq3uxio
-1	i watched mortdecai and it was painful to watch i could barely understand what johnny depp was saying in that english accent
-1	what on earth is wrong with johnny depp and his choice in movies these days mortdecai
-1	mortdecai offensive on many levels if only it were effective enough to offend depp needs a punch the rest of the cast need help fast
-1	mortdecai watch mortdecai movie online for free on yify tv juggling angry russians the british mi5 and an http t co 0v0ehlq6dq
-1	watching mortdecai
-1	mortdecai there s time in my life i m not getting back showerofshit
-1	mortdecai what a bizarre film wtf is going on
-1	watching watch mortdecai online free 2015
-1	girlshouse the cobbler and mortdecai
-1	mortdecai is hilarious af depp has done it again
-1	mortdecai 2015 rmvb v o s e http t co thnwvhsfao
-1	watching mortdecai
-1	jessehawken disney nature s mortdecai kingdom
-1	watching mortdecai
-1	bout to go grab some food then come home amp laugh at the new johnny depp movie watching mortdecai
-1	today theellenshow has vp with a special surprise for ellen mortdecai star oliviamunn a 4pm on wisn12 http t co azrm8zlqwl
-1	mortdecai is hilarious
-1	rt justinshanes remember you can write off those mortdecai tickets as a charitable donation
-1	mortdecai anyone
-1	rt justinshanes remember you can write off those mortdecai tickets as a charitable donation
-1	watching mortdecai
-1	movie night insurgent boy next door furious 7 camp x ray mortdecai the water diviner looong nyt ahead
-1	i ve finally worked up the self hatred to watch mortdecai or at least the beginning of mortdecai
-1	weekend aka movie time nw mortdecai met oa johnny depp
-1	wildpalmcity tom waits voice my name is mortdecai
-1	can t watch any more mortdecai tonight because 35 minutes alone have given me a stabbing headache
-1	it s pretty clear that somebody envisioned mortdecai as an austin powers type franchise which is mind boggling
-1	movie night up next american sniper seventh son last knight and camp x ray the rest i ll watch tommorow watching mortdecai
-1	rt swinevlesic charlie mortdecai wife http t co rmoaikpk5y
-1	one syllable review of the first 10 minutes of mortdecai oof
-1	mortdecai was good idk why it got very low ratings for it
-1	i am 2 minutes into watching mortdecai and am already stunned by the hubris of everyone involved in making this movie
-1	mortdecai s rolling in
-1	lord mortdecai
-1	i want to see this mortdecai movie
-1	rt if mortdecai was available to watch as in flight entertainment on your flight fav if you watched it
-1	watching mortdecai
-1	143 mortdecai 2015 365movies 365days dlmchallenge johnny depp annoys as a dandy art dealer in this comedy that is painfully unfunny
-1	3 watching mortdecai
-1	mortdecai full movie https t co g8f3yyhvxh
-1	watching mortdecai
-1	time to finish watching mortdecai what a night
-1	photo watching mortdecai their british s accents are weirddddd http t co n0qntxfc0t
-1	watching mortdecai johnny is the best
-1	omg i love mortdecai s ending the gag reflex holy crap
-1	nw mortdecai
-1	movie time charisma humor sarcasm watching mortdecai
-1	charlie mortdecai torrent http t co swb1o1fwfx
-1	mortdecai johnny depp
-1	watching mortdecai
-1	mortdecai is hella funny
-1	the mortdecai of up and coming artists https t co tnxmetqbxn
-1	badnewscentral ohpencilsharp jerfad toebone mortdecai vapeth
-1	ohpencilsharp jerfad toebone oh god the mortdecai stache
-1	humancipator35 we takes it one day at a time mortdecai haters be damned cmon we watched him play tonto
-1	rt humancipator35 adamabwithers11 fo sho i even wanna see mortdecai when it hit s the internets i d watch johnny read hunter thompso
-1	johnny depp rocks the handlebar mustache like a fucking boss in mortdecai
-1	adamabwithers11 fo sho i even wanna see mortdecai when it hit s the internets i d watch johnny read hunter thompson s letters amp have
-1	watching mortdecai toniteee
-1	nw mortdecai
-1	premier mortdecai videocine screening room https t co o8f8pv6hwv
-1	willsloanesq max_mertens hopefully you ll also be able to watch mortdecai on the flight
-1	rt thepoke an english teacher decided to mark a ukip election flyer that came through her letterbox http t co 9f9ufnh591 http t co
-1	joanna maybe i should have an affair do you think i can keep it a secret allistor yes joanna well then what s the point mortdecai
-1	watch mortdecai 2015 featured vodly to
-1	willsloanesq jessehawken around the world in 80 screenings of mortdecai
-1	about to watch mortdecai pray 4 me
-1	lord mortdecai
-1	jessehawken max_mertens some say i m crazy for booking an overnight trip to shanghai to see mortdecai but they re not real patriots
-1	max_mertens willsloanesq mortdecai opens today in china which may indicate they feel the international pressure to relax state controls
-1	willsloanesq max_mertens the eu must have staggered the release of mortdecai across europe to encourage travel within the union
-1	jessehawken willsloanesq i d be lying if i said their appreciation of mortdecai didn t influence my decision to visit spain in may
-1	jessehawken max_mertens mortdecai s success in spain three months after its american release attests the durability of the character
-1	hey willsloanesq mortdecai has climbed up to 8th place in spain competition s getting nervous https t co kmpza5dkex
-1	new mortdecai 2015 web dlrip http t co 61yfaqagy4
-1	mortdecai official trailer 1 2015 johnny depp gwyneth paltrow movi https t co zvum6gp3cc via youtube
-1	watching mortdecai
-1	mortdecai ts screener http t co q2r9i9gs2s
-1	tonight laker cinema presents mortdecai at 9 pm in the peacock cove http t co ec7rthnd7i
-1	watching mortdecai http t co re8ncx3wva
-1	mortdecai 2015 720p web dl synopsis juggling angry russians the british mi5 and an international terrori http t co ashqy0l2dr
-1	mortdecai 2015 720p web dl is now out
-1	mortdecai ftw
-1	mortdecai 2015 720p web dl synopsis juggling angry russians the british mi5 and an international terrori http t co sbhhf5p7n8
-1	johnny depp s new film mortdecai is out i see i ll be giving that a pass
-1	rt jessehawken cloaked figure removes cowl to reveal it s mortdecai ruinthenewstarwars
-1	mortdecai full movie online dvdrip english watch 2015 http t co l5x0mzol9z on bloglovin
-1	rt deep_beige is this the netflix version of mortdecai http t co bjlxzzf4q7
-1	cloaked figure removes cowl to reveal it s mortdecai ruinthenewstarwars
-1	i gueds mortdecai is a lil bit
-1	buzz buzz english movie update mortdecai 17th april 2015 format size avi 1 46gb quality of the http t co 22bwedh6bi
-1	tonight i m going to see mortdecai
-1	nw mortdecai
-1	rt jamil1985m mortdecai 2015 hdrip web xvid ac3 evo action comedy 5 5 10 _ _ http t co
-1	mortdecai_jp 17 22 19 2 t m s same same in imagawaf d r21 34 ayano 34w 17 55 1 26 28can t 20 31 1 32 34can abe op all
-1	rt willsloanesq another business cashes in on the mortdecai craze at dundas and simcoe mortdecaidoestoronto http t co 0mjlkfrnud
-1	jessehawken i would pay to see that is mortdecai in it too
-1	been avoiding this will watch this weekend kinsan02 mortdecai weird comedy totally fun
-1	normwilner no blart review even mortdecai got a capsule review
-1	piersmorgan in lieu of piersmorgan gmb i m gonna watch mortdecai
-1	kadokawabunko mortdecai_jp 17 22 14 2 t m s 21 33 set 33 22 0 same same 21 23 33show no show in miyagawaf d r all
-1	mortdecai_jp 17 21 28 2 t m s 22 03 want t f c 0 f c same same heavy aya keep open 1 2floor door for sakaif a
-1	screenonline mortdecai_jp 17 21 17 2 t m s in t m washing m same same maedaf often come takashi ayano kosei harassment al
-1	moviestar_mag mortdecai_jp 17 21 14 2 t m s 14washing m end can t hang wet cl thes 5 f key surely same same maedaf al
-1	cinematoday mortdecai_jp 17 19 44 2 t m j depp picture j depp t m same same maedaf show no imagawaf give cough all
-1	mortdecai_jp 19 29 2 t m s same same sakaif 28car key in op tf matsuraf at home outside abe obama wires op neighbor all
-1	mortdecai_jp 14 17 18 59 2 t m s pure bright saint bell ringing f r brilliant clear future o same same all
-1	six years after the first film how can paul blart expect to compete in this high stakes mortdecai dominated marketplace
-1	mortdecai_jp 17 18 52 2 t m s 18set 18 51 19 18 pure meal wash brush put n pure everything same same all
-1	lubchansky is this mortdecai the tv show but somehow even worse
-1	tsff_east_staff mortdecai_jp 13 59 2 t m s j depp an ther same same maedaf show no 11 17 1 37 39can t all o all
-1	mortdecai 2015 master print available now http t co 5fcffe3fur
-1	http t co 8wotl6lg1q mortdecai official http t co paygevrtkl depp gwyneth johnny mortdecai movie official paltrow trailer
-1	rt willsloanesq another business cashes in on the mortdecai craze at dundas and simcoe mortdecaidoestoronto http t co 0mjlkfrnud
-1	ff parttimerogue his film mortdecai opens in china today http t co tls0avo7fx
-1	bored so i am going to watch mortdecai finally
-1	http t co l0bciuidhw download mortdecai a http t co gwfbcmrakb
-1	mortdecai b never as good as it should be the right parts but the wrong build
-1	mortdecai johnny depp weekend begins
-1	mortdecai 2015 hdrip watch movie online in english hollywood watch online free movies and tv show http t co pobdbkgizh
-1	mortdecai 2015 hdrip watch movie online in english hollywood mortdecai 2015 movie watch online in english wat http t co mxicfgc49m
-1	nw mortdecai johnny depp is everything
-1	movie time mortdecai https t co n48fvhompj
-1	im probably one of the late ones to know pictured here is junix inocian playing fang fat in the movie mortdecai http t co nw5jqukeh0
-1	johny deep blonde hair hahah mortdecai https t co fghksmtola
-1	mortdecai full movie watch onlien http t co eem4kumc0y http t co vxlvbbdct2
-1	i also wish to have a falcon that wears a cap and is named mortdecai
-1	vikings muna then mortdecai d
-1	now watching mortdecai gt
-1	new movie mortdecai r 2015 107min 720p 6ch 6 07am 17 apr 15 http t co yb4jld8i6z
-1	sd video mortdecai_2015_hdrip_x264_ac3 ift
-1	johnny depp s acting in mortdecai is indeed marvellous
-1	mortdecai 2015 web dlrip vo http t co xyiijozphv
-1	mortdecai is disappointing
-1	rt g2g__fm johnny depp s new movie mortdecai is now available in 720p hd http t co m1ngotfyhf
-1	nw mortdecai this better be good
-1	rt g2g__fm johnny depp s new movie mortdecai is now available in 720p hd http t co m1ngotfyhf
-1	rt g2g__fm johnny depp s new movie mortdecai is now available in 720p hd http t co m1ngotfyhf
-1	rt g2g__fm johnny depp s new movie mortdecai is now available in 720p hd http t co m1ngotfyhf
-1	mortdecai od dts r1 action comedy johnny depp gwyneth paltrow olivia munn https t co sggzyqoxr0
-1	johnny depp in mortdecai is just so cute
