-1	donghwa just called he told me that he believes there s a ghost in his house i should lend him my nightlight
-1	i use it as a nightlight it s very bright
-1	rt harrythetypeto_ still use a nightlight because he is afraid of the dark
-1	spider man nightlight ac treasures shoplocal http t co s2mlml3ayu via scottsmktplace
-1	i was the only white kid to play basketball and i actually did pretty good nightlight
-1	a nightlight why do i get th feelin it ain t a nightlight he raised a brow
-1	i made a nightlight she speaks proudly
-1	rt gojewelry rt dancerainbows fairy candle holder faerie by intheshadeofthesycamoretree on zibbet https t co zetai5ofkw
-1	funky red throwback hipster syle vintage camera nightlight by lightandtimeart http t co egfrbctbxb http t co tiecrv26fq
-1	how does it feel to have your own nightlight therealquestions jensenackles jarpad http t co 9fn8oiryky
-1	rt protolalia a real man won t pressure you to sleep with him until after your nightlight shadow puppet comedy routine is complete
-1	antique camera nightlight kodak brownie starflash great upcycled giftidea from etsy http t co qprumdxut6 http t co 9mmbk4bh33
-1	great deal multi color led star master nightlight http t co akb6d4j1rg
-1	rt dancerainbows fairy candle holder faerie by intheshadeofthesycamoretree on zibbet https t co zetai5ofkw
-1	funky red throwback hipster syle vintage camera nightlight by lightandtimeart http t co egfrbctbxb http t co puussofgus
-1	western logs cabin lamp cowboy cabin horseshoe shaped accent lamp nightlight http t co tyjdzpjdp1 http t co jvkgrjlicz
-1	rt dancerainbows fairy candle holder faerie by intheshadeofthesycamoretree on zibbet https t co vyjdhre801
-1	green and blue nightlight http t co kfinvv2rhk etsy twitter
-1	the avengers 3d wall art nightlight tersedia 8 item hrg 49 99 exclude shipping minat 08561007899 kabarbintaro http t co qodzhmdsfh
-1	ailynzayn 616 paranormal incident nightlight
-1	pre order the avengers 3d wall art nightlight harga 49 99 exclude shipping minat 0856 100 7899 kabarbintaro http t co ub6sina42w
-1	only 14 95 for the summerinfant slumber buddies on bountyuk nightlight soothing sleep bedtime musical http t co qgsu3ghokk
-1	nw nightlight
-1	nightlight 2015 http t co kzeotuufew
-1	funky red throwback hipster syle vintage camera nightlight by lightandtimeart http t co egfrbctbxb http t co 6s1twqyd9y
-1	nightlight goes off turn kisses to bites
-1	last night i used my tv as a nightlight since i didn t want to sleep in the dark i guess you can say i m pretty tough
-1	rt promotemyshop beach decor scallop seashell night light nautical decor nursery bathroom kitchen nightlight http t co 7e1aoey90p et
-1	upcycled nightlight vintage kodak bullet camera etsy handmade photography art http t co xwko7ntvyo http t co sjujk9vjwh
-1	rt promotemyshop beach decor scallop seashell night light nautical decor nursery bathroom kitchen nightlight http t co 7e1aoey90p et
-1	rt promotemyshop beach decor scallop seashell night light nautical decor nursery bathroom kitchen nightlight http t co 7e1aoey90p et
-1	antique camera nightlight kodak brownie starflash great upcycled giftidea from etsy http t co qprumdxut6 http t co 4g2tsh7rcu
-1	rt promotemyshop beach decor scallop seashell night light nautical decor nursery bathroom kitchen nightlight http t co 7e1aoey90p et
-1	funky red throwback hipster syle vintage camera nightlight by lightandtimeart http t co egfrbctbxb http t co 3e7v3m3jcz
-1	rt promotemyshop beach decor scallop seashell night light nautical decor nursery bathroom kitchen nightlight http t co 7e1aoey90p et
-1	rt promotemyshop beach decor scallop seashell night light nautical decor nursery bathroom kitchen nightlight http t co 7e1aoey90p et
-1	oh yeah tardis nightlight just arrived thanks think geek for getting it to me quickly
-1	rt promotemyshop beach decor scallop seashell night light nautical decor nursery bathroom kitchen nightlight http t co 7e1aoey90p et
-1	rt promotemyshop beach decor scallop seashell night light nautical decor nursery bathroom kitchen nightlight http t co 7e1aoey90p et
-1	rt promotemyshop beach decor scallop seashell night light nautical decor nursery bathroom kitchen nightlight http t co 7e1aoey90p et
-1	rt promotemyshop beach decor scallop seashell night light nautical decor nursery bathroom kitchen nightlight http t co 7e1aoey90p et
-1	at first he wanted the lantern to be a nightlight for me because apparently i m still 5 but now he s decided it s going to live in the shed
-1	beach decor scallop seashell night light nautical decor nursery bathroom kitchen nightlight http t co 7e1aoey90p etsymntt coastaldecor
-1	le weekend has a show on 04 24 2015 at 09 00 pm nightlight in chapel hill nc http t co hcjptt71zg concert
-1	rt dancerainbows fairy candle holder faerie by intheshadeofthesycamoretree on zibbet https t co vyjdhre801
-1	kerr mason lampfrosted nightlight by monroe2830 http t co ko9t6iudxa via etsy
-1	you lied to me you said you turned on your nightlight but you didn t are u fking serious right now
-1	antique camera nightlight kodak brownie starflash great upcycled giftidea from etsy http t co qprumdxut6 http t co w3tbddiqng
-1	funky red throwback hipster syle vintage camera nightlight by lightandtimeart http t co egfrbctbxb http t co dk6ktor71y
-1	rt carterjenkins nightlight is coming to theaters amp vod march 27th who wants to play http t co 7xddojnlli
-1	rt julyghoost my brother got me a nightlight because i told him i was scared of the dark howsweet
-1	fairy candle holder faerie by intheshadeofthesycamoretree on zibbet https t co vyjdhre801
-1	funky red throwback hipster syle vintage camera nightlight by lightandtimeart http t co egfrbctbxb http t co okp4cefyva
-1	my brother got me a nightlight because i told him i was scared of the dark howsweet
-1	dondodgerino jayyeo88 ethan_something can use it as a nightlight
-1	antique camera nightlight kodak brownie starflash great upcycled giftidea from etsy http t co qprumdxut6 http t co npnpoj9na4
-1	http t co kambbkjpde is this a nightlight
-1	fleurty girl everything new orleans fleur de lis nightlight home accessories for the home http t co kefb5s7ule
-1	children s pirate ship night light nite lite nightlight http t co cgak7pbetr http t co jbepirlvm7
-1	funky red throwback hipster syle vintage camera nightlight by lightandtimeart http t co egfrbctbxb http t co vdwavxfb3q
-1	decorative tole painted patriotic bear nightlight hand painted link http t co 48do1hc7v4 http t co wwggnjonkv
-1	upcycled nightlight vintage kodak bullet camera etsy handmade photography art http t co xwko7ntvyo http t co h95lpf2mm5
-1	antique camera nightlight kodak brownie starflash great upcycled giftidea from etsy http t co qprumdxut6 http t co jfulq2re5p
-1	funky red throwback hipster syle vintage camera nightlight by lightandtimeart http t co egfrbctbxb http t co 0kpinifmew
-1	rt instructables create your own solar powered mason jar nightlight from junk http t co 8ddjm3dqp0 http t co 5vklxxyhtp
-1	the avengers spiderman mask 3d deco wall light led art nightlight furniture a link http t co 5f94fndrfz http t co qshqgntgli
-1	funky red throwback hipster syle vintage camera nightlight by lightandtimeart http t co egfrbctbxb http t co g4tft18gyg
-1	thesamwillows for the script i hope i win lyrics mashup man on wire x nightlight thescriptsingapore thesamwillows ihopeitsme
-1	antique camera nightlight kodak brownie starflash great upcycled giftidea from etsy http t co qprumdxut6 http t co fi42tdygzr
-1	funky red throwback hipster syle vintage camera nightlight by lightandtimeart http t co egfrbctbxb http t co vhkqbzcwex
-1	rt auswingcontacts pierced nipples navels necklace to nightlight the breasts love your body let naked men women love you http t co
-1	eoin mc hugh little hans nightlight and mark francis stage at artcologne http t co 1dfbpi5xtn
-1	upcycled nightlight vintage kodak bullet camera etsy handmade photography art http t co xwko7ntvyo http t co bhwc3lclxh
-1	funky red throwback hipster syle vintage camera nightlight by lightandtimeart http t co egfrbctbxb http t co 1wpaard0xj
-1	rewatchng nightlight the movie
-1	antique camera nightlight kodak brownie starflash great upcycled giftidea from etsy http t co qprumdxut6 http t co f62aa4n4p6
-1	funky red throwback hipster syle vintage camera nightlight by lightandtimeart http t co egfrbctbxb http t co fz2wj9szej
-1	xwnklmnx i have a full moon nightlight definitely exists
-1	airam nightlight and apple magic mouse separated at birth http t co fmgahoedxx
-1	funky red throwback hipster syle vintage camera nightlight by lightandtimeart http t co egfrbctbxb http t co yf9i7yiaon
-1	wait this girl just plugged in a nightlight lmfaoo i 4got those existed
-1	can i be your nightlight friendzone link in bio https t co sko9sskboe
-1	upcycled nightlight vintage kodak bullet camera etsy handmade photography art http t co xwko7ntvyo http t co lzko6jrqu2
-1	antique camera nightlight kodak brownie starflash great upcycled giftidea from etsy http t co qprumdxut6 http t co 3crpqhbnpf
-1	running a selenium grid using docker and compose nightlight http t co odi3cxw1eq docker seleniumgrid ci
-1	funky red throwback hipster syle vintage camera nightlight by lightandtimeart http t co egfrbctbxb http t co etaygtu32l
-1	tomy boon glo nightlight 38 86 http t co cxienca6pa
-1	top home amp garden deals gt http t co 8ljegkzez9 lumawarm round white heated nightlight toilet seat http t co dej1lggrwk
-1	energizer fl452wrh weatheready folding lantern high low nightlight slide switch http t co oonrvbpzvv http t co ftrnl1lvxq
-1	funky red throwback hipster syle vintage camera nightlight by lightandtimeart http t co egfrbctbxb http t co pr38psxhbt
-1	flushedtoilet a lot of ppl use nightlight and glasshouse lyrics already
-1	antique camera nightlight kodak brownie starflash great upcycled giftidea from etsy http t co qprumdxut6 http t co 0hzawustcy
-1	funky red throwback hipster syle vintage camera nightlight by lightandtimeart http t co egfrbctbxb http t co vvltibvfdf
-1	res 7 commending the important outreach work carried out by nightlight is passed with an invitation for the moderator to visit
-1	upcycled nightlight vintage kodak bullet camera etsy handmade photography art http t co xwko7ntvyo http t co rorkulsu7p
-1	i watched thebabadook alone in the dark and i m now grateful i still have a nightlight
-1	rt purewhitemoly daylight nightlight by trichardsen on deviantart http t co ftupltptwd
-1	funky red throwback hipster syle vintage camera nightlight by lightandtimeart http t co egfrbctbxb http t co yik5xquqah
-1	im using this shit as a nightlight
-1	rt willjaymusic hearing people tell ghost stories is too much for me to handle like i still sleep with a nightlight don t go there
-1	donghwa just called he told me that he believes there s a ghost in his house i should lend him my nightlight
-1	cool waters porcelain lithophane nightlight night light nite lite http t co czdyplwzpt http t co tlvvebsaeh
-1	antique camera nightlight kodak brownie starflash great upcycled giftidea from etsy http t co qprumdxut6 http t co pguplznoxb
-1	funky red throwback hipster syle vintage camera nightlight by lightandtimeart http t co egfrbctbxb http t co g27kimqs7a
-1	avery s nightlight shines stars on the roof nightlight baby stars https t co icinrdagkc
-1	anime_adventure huh he nodded well i m probably gonna be out here for awhile i ve got nightlight to waste
-1	nightlight of my night was coming home and chundering all over my bedroom floor
-1	funky red throwback hipster syle vintage camera nightlight by lightandtimeart http t co egfrbctbxb http t co a9s6ojwghe
-1	now i need some cuddles amp a nightlight
-1	never seem to sleep well the night before nightlight sleepy goingtobealongday
-1	believe porcelain lithophane nightlight night light nite lite http t co eujnsin4dw http t co kldstragrn
-1	upcycled nightlight vintage kodak bullet camera etsy handmade photography art http t co xwko7ntvyo http t co lpb5cui8uo
-1	dammit kids you wouldn t have to freak about shadows in your room if you just turned the fricken nightlight off
-1	caterpillar attack coachella nightlight coachella music festival https t co lwazvgsdv8
-1	antique camera nightlight kodak brownie starflash great upcycled giftidea from etsy http t co qprumdxut6 http t co wu5bbtlb90
-1	funky red throwback hipster syle vintage camera nightlight by lightandtimeart http t co egfrbctbxb http t co ml8t00ysju
-1	rt countrygirl0818 osnapitz_megan i m coming over right now with mr caterpillar and the nightlight
-1	brentalfloss nah if anything nightlight shameallama would have just dragged him down
-1	cascading falls porcelain lithophane nightlight night light nite lite http t co hppzciuty3 http t co z8esfvluvz
-1	funky red throwback hipster syle vintage camera nightlight by lightandtimeart http t co egfrbctbxb http t co c6ritrb6sb
-1	aureouscopycat that nightlight fic was rly good if a bit abrupt felt like a diary entry was that intentional
-1	6 but i m scared to unplug my nightlight for my charger someone help
-1	nightlight news stand is out http t co auih74lfi5 stories via drspiritcom faststartdc asianentr
-1	watching nightlight with rifqi https t co ymhawnugch
-1	njudah i have a cool color block light in the loo it s an art piece but i use it as a nightlight and candlelit baths
-1	outlet cover with nightlight genius and you wouldn t lose an outlet to have a nightlight plugged i http t co ayowymettf
-1	saw a bug in my room so i did the only reasonable thing i m now sleeping in a different room with a nightlight
-1	osnapitz_megan i m coming over right now with mr caterpillar and the nightlight
-1	antique camera nightlight kodak brownie starflash great upcycled giftidea from etsy http t co qprumdxut6 http t co 12q3iea6cc
-1	funky red throwback hipster syle vintage camera nightlight by lightandtimeart http t co egfrbctbxb http t co 0iqtuq7bza
-1	rt countrygirl0818 where is my nightlight there is no way i m sleeping in the dark tonight osnapitz_megan
-1	where is my nightlight there is no way i m sleeping in the dark tonight osnapitz_megan
-1	cap and i tackle another diy this time a cloud in a jar what a cool nightlight idea b http t co vw6tctizrf
-1	angel of the morning ghosthunting putinbay nightlight http t co vrjxhwxkzi
-1	i added a video to a youtube playlist http t co vw6tctizrf diy nightlight diy lighting diy cloud in a jar diy home accent diy room
-1	upcycled nightlight vintage kodak bullet camera etsy handmade photography art http t co xwko7ntvyo http t co zcemqer4fo
-1	rt smnrtrt nightlight 17 by smnrtrt on soundcloud https t co aqogduptjh analogmusiq moonisis27 dubblasta ultra forsecercavi
-1	rt roaryals my nightlight is better than yours follow that unicorn on the road to love http t co a14hgmx2au
-1	funky red throwback hipster syle vintage camera nightlight by lightandtimeart http t co egfrbctbxb http t co p7dlrify6j
-1	my nightlight is better than yours follow that unicorn on the road to love http t co a14hgmx2au
-1	best nightlight ever frozen elsa anna charlotte northcarolina vacation http t co 4buv8x1yew
-1	when your nightlight does the thing followformorerelatable
-1	northerndarlinn my other one only lasted me a couple months since i used it as a nightlight for b though
-1	antique camera nightlight kodak brownie starflash great upcycled giftidea from etsy http t co qprumdxut6 http t co qznler4oe1
-1	saw unfriended and ariel is freaking out wanting a nightlight
-1	funky red throwback hipster syle vintage camera nightlight by lightandtimeart http t co egfrbctbxb http t co jimybaqfvu
-1	i think i m boutta k o
-1	in a world of so many baby girl you are that one
-1	rt lightandtimeart funky red throwback hipster syle vintage camera nightlight by lightandtimeart http t co egfrbctbxb http t
-1	emmilllllaay i still need a nightlight same
-1	funky red throwback hipster syle vintage camera nightlight by lightandtimeart http t co egfrbctbxb http t co hre7zqx6zd
-1	my nightlight just went out what an awful night
-1	i still need a nightlight
-1	bruh i need my girl laying here cuddling with me i need her kisses
-1	rt naewoodster not sleeping with my nightlight tonight i feel so grown
-1	upcycled nightlight vintage kodak bullet camera etsy handmade photography art http t co xwko7ntvyo http t co zw9uxelflh
-1	not sleeping with my nightlight tonight i feel so grown
-1	antique camera nightlight kodak brownie starflash great upcycled giftidea from etsy http t co qprumdxut6 http t co vihhh60pna
-1	funky red throwback hipster syle vintage camera nightlight by lightandtimeart http t co egfrbctbxb http t co moo66pff7e
-1	homemade nightlight wine bottle glass gems christmas lights this is a great idea for even a bath http t co ok39uu7jqs
-1	sleeping w o my nightlight on trying to be a big girl but i m actually really scared rn
-1	everytime you get undressed i hear symphonies in my head
-1	alien metal queen lamp isn t the best idea for a nightlight http t co evz5njjcqt
-1	funky red throwback hipster syle vintage camera nightlight by lightandtimeart http t co egfrbctbxb http t co gfkvqidirq
-1	when i used to grab your booty and suck on your titties
-1	rt xstrology gemini s are never focused but when they are they are
-1	im 18 still sleeping w ah nightlight b
-1	rt smnrtrt have you heard nightlight 17 by smnrtrt on soundcloud np https t co aqogduptjh edmfamily
-1	sunset night lights lastdayofschool sunset nightlight http t co us6ssp5agv
-1	rt smnrtrt have you heard nightlight 17 by smnrtrt on soundcloud np https t co aqogduptjh edmfamily
-1	have you heard nightlight mix 17 by smnrtrt on soundcloud np https t co aqogduptjh petersawdy gt atomic
-1	there are three kids under 5 staying in the spare room tonight the moose nightlight was moved from kitchen to room to keep them company
-1	rt smnrtrt have you heard nightlight 17 by smnrtrt on soundcloud np https t co aqogduptjh edmfamily
-1	celestial bodies porcelain lithopane nightlight light luminaria space astrology http t co otlnbpnewm http t co stailng626
-1	have you heard nightlight 17 by smnrtrt on soundcloud np https t co aqogduptjh edmfamily
-1	antique camera nightlight kodak brownie starflash great upcycled giftidea from etsy http t co qprumdxut6 http t co prr1gzxo6g
-1	have you heard nightlight mix 17 by smnrtrt on soundcloud np https t co aqogduptjh turn it up
-1	i wouldn t call in the midnight hour i wouldn t tuck you in and turn the nightlight out
-1	nothing like this on planet earth gt nightlight 17 by smnrtrt on soundcloud np https t co aqogduptjh gt just dnc
-1	funky red throwback hipster syle vintage camera nightlight by lightandtimeart http t co egfrbctbxb http t co jsjunkynsu
-1	rt mikobhayangkara kca votejkt48id sun_sijia wired q light nightlight watch your home and send alert when someone break into http
-1	i m glo ing boy nightlight
-1	boutta go on a booty liking spree on ig
-1	nightlight 17 by smnrtrt on soundcloud np https t co aqogduptjh yk3nin fxgenerator officialjackel djtobynyc bpmpool welcome
-1	i just miss how it good it used to taste
-1	kiss her thighs slowly up and down
-1	have you heard nightlight mix 17 by smnrtrt on soundcloud np https t co aqogduptjh marconoldani forsecercavi vampyba marettats
-1	have you heard nightlight 17 by smnrtrt on soundcloud np https t co aqogduptjh the 1st only 4u baby gt moonisis27
-1	link removed upcycled nightlight vintage kodak bullet camera etsy handmade photography link removed
-1	have you heard nightlight mix 17 by smnrtrt on soundcloud np https t co aqogduptjh nothing like this
-1	have you heard nightlight 17 by smnrtrt on soundcloud np https t co aqogduptjh n this is 4 all my cosmic tl gt pure love
-1	playing da t r u t h truthonduty nightlight at http t co fkc5l1cetr
-1	nightlight 17 by smnrtrt on soundcloud https t co aqogduptjh analogmusiq moonisis27 dubblasta ultra forsecercavi girlsloveedm
-1	nightlight 17 by smnrtrt np https t co aqogduptjh marqueelv warehouseldn ultra ushuaiaibiza matineeusa insomniacevents
-1	fuck it all gt that s nightlight
-1	nightlight wormseyeview vscocam concretejungle heinzsanchez the enterprise center https t co bpubimtzzr
-1	nightlight for tsukki http t co leqkjtvshx
-1	86 r u reeeaaady 4 the best live act of independent music of all da planet nightlight is coming stay tuned
-1	i just wanna be your alarm clock lemme wake you up every morning by putting my tongue inside you
-1	i ll buy anything with tony chopper on it i got a chopper blanket pillow socks plush nightlight ect idk if it got chopper i m buying it
-1	whip cream on her body lemme lick it off
-1	just lay back and enjoy amp let me do all the work
-1	i miss how i used to hug you from behind and kiss your neck
-1	boingloins you need these http t co z8mzxujrd1 http t co fddpc2uxdy
-1	would you mind would you mind of i pull over and eat your pussy in a bathroom stall
-1	fondle my balls she got the softest grip
-1	gently kissing on her clit
-1	antique camera nightlight kodak brownie starflash great upcycled giftidea from etsy http t co qprumdxut6 http t co vl3xclnhcn
-1	seee i m tweeting freaky shit now but catch me during 3rd shift when i m listening to drake its a whole different story
-1	when she fresh out the shower smelling all good just lay her down and put that tongue game on her
-1	funky red throwback hipster syle vintage camera nightlight by lightandtimeart http t co egfrbctbxb http t co ivaovsduau
-1	will you ever come back will their ever be an us again
-1	posed to be in love
-1	i miss those days i used to rub her booty amp give it kisses
-1	when she grind on my tongue when she boutta cum
-1	mann i m just nasty i kinda wish i was this freaky with all my other girls but then again not really
-1	rt nerdapproved this alien metal queen lamp isn t the best idea for a nightlight http t co 5vibguiqtb http t co 0aa1jkntph
-1	played amazing today nightlight of the day
-1	the thoughts of the shit i wanna do to you make a porno look boring
-1	that moment you pull a girl panties off wit cha teeth amp she watching you and biting her lip all sexy nshit
-1	nightlight 17 gt r u ready
-1	welp i can wait a lil longer to get a lap dance since my birthday weekend we going to king of diamonds
-1	i feel like i wanna eat some pussy for hours
-1	i wanna go to a strip club i wanna lap dance
-1	i wanna girl to grind on me and bite my lip while she do it
-1	rt jessmariegarcia thank you aloka_designs broke my beautiful nightlight that i got 4 a baby shower and they are sending me a new1
-1	if my sister lemme get her whip tomorrow gon be a good day
-1	that walk made me feel so much better but i feel freaky af right now smh
-1	plies feel like fucking explains errthang i wanna do to ya
-1	they look like nightlight https t co ddml94plti
-1	upcycled nightlight vintage kodak bullet camera etsy handmade photography art http t co xwko7ntvyo http t co xndocfuhe9
-1	rt nerdapproved this alien metal queen lamp isn t the best idea for a nightlight http t co 5vibguiqtb http t co 0aa1jkntph
-1	rt nerdapproved this alien metal queen lamp isn t the best idea for a nightlight http t co 5vibguiqtb http t co 0aa1jkntph
-1	funky red throwback hipster syle vintage camera nightlight by lightandtimeart http t co egfrbctbxb http t co lr67mssj1t
-1	hd movie http t co h0sei7wchx nightlight 2015 bro sis http t co uoi5u8fmpr
-1	welp got the email looks like i got the job after all i did give the best interview i ve ever gave i went deep on they asses
-1	amazon i put on my jewelry and go to bed the bling bling becomes a nightlight
-1	rt evanrileymusic philly it s lit like my nightlight come thru to vox populi gallery from 8 10 i m with my woes recphilly http t co
-1	rt topinventionss glowing nightlight lamp with removable glow balls http t co p5kt853w8i
-1	its to early to be crying smh lemme stop and go for a walk
-1	i feel like i m waiting for somebody whos already gone
-1	i just wanna love you show you attention give you all my hugs and kisses cuddle you but you dnt want that
-1	rt evanrileymusic philly it s lit like my nightlight come thru to vox populi gallery from 8 10 i m with my woes recphilly http t co
-1	funky red throwback hipster syle vintage camera nightlight by lightandtimeart http t co egfrbctbxb http t co lvfa1cfmlp
-1	i hate that i love you so much
-1	only person i wanna be with don t wanna wanna be with me smh mannn
-1	mannn i just wanna be happy with somebody is that to much to ask for smh
-1	oxyled t 05 led night light with sensor battery powered stick anywhere http t co pzi8elwauf detski_fotograf
-1	philly it s lit like my nightlight come thru to vox populi gallery from 8 10 i m with my woes recphilly http t co crqs6p8ecv
-1	drinking a nightlight dry irish stout by circlebrew at drinkwellaustin http t co pmguepk7jy
-1	rt lightandtimeart antique camera nightlight kodak brownie starflash great upcycled giftidea from etsy http t co qprumdxut6 ht
-1	antique camera nightlight kodak brownie starflash great upcycled giftidea from etsy http t co qprumdxut6 http t co vmqlr3epol
-1	funky red throwback hipster syle vintage camera nightlight by lightandtimeart http t co egfrbctbxb http t co shldw82zi4
-1	rt jessmariegarcia thank you aloka_designs broke my beautiful nightlight that i got 4 a baby shower and they are sending me a new1
-1	features four brightness modes nightlight low mid high16 hours of led light on a day s charge usb port to ch http t co n9jsafo6bn
-1	upcycled nightlight vintage kodak bullet camera etsy handmade photography art http t co xwko7ntvyo http t co xt4hwnoold
-1	check out this hella awesome nightlight projecting on my ceiling http t co 5s5fv0bmdd
-1	funky red throwback hipster syle vintage camera nightlight by lightandtimeart http t co egfrbctbxb http t co e46tgbxm6w
-1	rt smnrtrt nightlight mix 16 by smnrtrt np https t co cy9eaex3ms erickmorillo radiotabu lgdolly petersawdy dubblasta sabrinas
