-1	3xchair on america s riot club who s afraid of affleck amp skip gates plus the mafia genre redeemed http t co m4jqtkmmax
-1	thanks again to the 20 414 rsl fans that made tonight s riot sellout the club s 19th straight and 25th in last 30
-1	film review the riot club lord riot was an englishman who a secret society at oxford is named after http t co falwn7cm6h
-1	rt smile4these the i m shaving my head because i left a boyband to become a solo artist club http t co aywbt0pjww
-1	vou assistir the riot club
-1	rt keemstarx the bashurverse interview a story of lies amp betrayal on dramaalert tonight 10pm est rt if u will make under 301 cl
-1	douglas booth sam clafflin and max irons in the riot club
-1	the riot club full movie watch now http t co qbukuvhdiu http t co kl0wgwmeg2
-1	australia 77 the riot club lone scherfig http t co uvyublnay3 movies itunes iphone apple
-1	rt jenannemarie ollie alexander is such a triple threat peter amp alice amp riot club amp god help the girl amp skins amp years amp years like good
-1	implicidades assiste run and jump moonrise kingdom the riot club e song one
-1	the riot club 100 because of holliday grainger seeallthefilms2015
-1	glenncocooooo have you seen the riot club if not you need to see the riot club
-1	gilesmacdonogh that pic is the cast of riot club film but thus article has dave and boris pics in it gt http t co wpzgvin6hg
-1	nw the riot club
-1	olly in the riot club
-1	watching the riot club again
-1	ollie alexander is such a triple threat peter amp alice amp riot club amp god help the girl amp skins amp years amp years like good man
-1	douglas booth in the riot club
-1	the riot club
-1	photo metaphorwaters the riot club 2014 official movie poster filthy rich spoilt rotten http t co vucsxf8r96
-1	to vendo the riot club
-1	rt you_watch_it 413 the riot club http t co syeawf0ox1
-1	rt you_watch_it 413 the riot club http t co syeawf0ox1
-1	cvl n the club might start a fuckin riot dnt get yo ass stumped out n front of errbody
-1	done for movietime the riot club not bad
-1	rt mindyskaling i want sam claflin s character in the riot club dead he is the biggets prick ever honestly
-1	i want sam claflin s character in the riot club dead he is the biggets prick ever honestly
-1	i m watching the riot club and it s so
-1	i should ve watched sdtg instead of the riot club wow
-1	lisanfh omfg my childhood no lah hes an actor and the frontman of years amp years who ive been obsessing abt he was in the riot club too
-1	supermissmarcys the riot club they only play it there
-1	just watched the riot club
-1	judging by the referee s amp tmo s they produce i imagine club rugby in ireland is essentially a 15 a side prison riot
-1	the riot club exclusive video http t co usq96ixqfs
-1	nw the riot club
-1	the riot club
-1	imma watch the riot club again god i m so fcking weak
-1	the riot club is the most disgusting and fucked up film i ve seen in a while
-1	just realised olly from years and years is in the riot club what the hell
-1	the riot club is so so intense
-1	alan rickman harry potter olivia cooke me and earl and the dying girl and douglas booth the riot club will http t co zlaf4qptvc
-1	watching the riot club and there s sam claflin douglas booth and max irons
-1	rt you_watch_it 413 the riot club http t co syeawf0ox1
-1	rt you_watch_it 413 the riot club http t co syeawf0ox1
-1	rt indieshuffle from the archives tdcinemaclub handshake ryan riot bootleg remixes http t co hmcdky4fie http t co vqmjpe4g
-1	rt theriotclubfilm leave no table unturned get crazy reckless with theriotclub available now http t co 7cjoe2oygp https t co ypad
-1	rt indieshuffle from the archives tdcinemaclub handshake ryan riot bootleg remixes http t co hmcdky4fie http t co vqmjpe4g
-1	rt indieshuffle from the archives tdcinemaclub handshake ryan riot bootleg remixes http t co hmcdky4fie http t co vqmjpe4g
-1	from the archives tdcinemaclub handshake ryan riot bootleg remixes http t co hmcdky4fie http t co vqmjpe4grr
-1	max ironsssssss the riot club posh with you https t co bgmged5yku
-1	acabo de ver the riot club
-1	jodielayne yes the riot club has been on my to watch list for ages because i know it prob ends with someone being destroyed
-1	rt our5sosupdatesx do you think 5sos would go for a girl at the club who yeah mostly all the girls fans last night ran and th ht
-1	just done watching the riot club wonder if there will be a part 2
-1	rt wlnchestr i think pauline likes movies with the word club the riot club geography club
-1	rt wlnchestr i think pauline likes movies with the word club the riot club geography club
-1	rt pierrebouvier 100k club and all it took was a picture in my underwear to push it over the edge thanks for https t co io2uace
-1	we re watching the riot club and i don t understand any of this english slang and i keep getting all these white boys mixed up
-1	i think pauline likes movies with the word club the riot club geography club
-1	the riot club
-1	the riot club victor frankenstein
-1	the riot club
-1	rt fayebuckland i am astounded that the riot club is based on a real life club that people like our current prime minister used to be a
-1	i literally used to watch the riot club every single night during the summer holidays last year after my exams theriotclubfilm
-1	remember when i used to watch the riot club almost every night during the summer holidays
-1	rockstargtav i m not day 3 still cant get the social club to load
-1	just watched the riot club goes to show money isn t everything
-1	i d like my own version of the riot club when i m older
-1	australia 72 the riot club lone scherfig http t co uvyublnay3 movies itunes iphone apple
-1	unikaija14 the riot club was actually about like an activist film it shows how rich people exploits the poor the whole marxism shit
-1	inlove x3 estoy viendo the riot club
-1	nooo waaaay olly alexander was in the riot club i knew he looked familiar omg
-1	i watched the rest of the riot club and they re actually the posh versions of chavs im disgusted
-1	wearewhovians he was in rome last september to promote the riot club with max and douglas and i meet them and i cried a lot
-1	going to watch the riot club right now amp see if it s any good if not i m pretty sure it s already worth to just watch all the hot guys p
-1	i can actually imagine louis_tomlinson in the riot club http t co vhjlwj4dl1
-1	rt zaynstormy paynobyn the riot club
-1	paynobyn the riot club
-1	http t co xcztwomm16 the riot club official trailer http t co yaoq01molo club official pictures riot trailer universal
-1	rt 77a see film the riot club as more etonian tories stand for london seats http t co tao4uzbgfj http t co wsh4vgdgdo
-1	i really liked douglas booth in hollyoaks but i don t like him in the riot club
-1	the riot club http t co mz7tukyc5g it would be more entertaining if so many people in power hadn t been involved in something similar
-1	nlnetyflve the riot club there are loads of hot guys in it
-1	bon j ai un lien pour the riot club sam claflin douglas booth night sorted
-1	rt sodamntrue proud member of the i don t draw in my eyebrows club
-1	about to watch the riot club any cop or will it enrage me
-1	rich boys behave badly in theriotclub now playing at digital gym cinema http t co phulb18ije http t co ckw6krvxvm
-1	i just finished watching the riot club and it made me so mad and got me so frustrated how can someone be so disrespectful i almost cried
-1	rt mrandrewlally the riot club david cameron boris johnson are the london rioters of 2011 but they never went to jail http t co gtlc
-1	rt mrandrewlally the riot club david cameron boris johnson are the london rioters of 2011 but they never went to jail http t co gtlc
-1	yasmeezzle yeah he has to to the istanbul film festival there is a screening of the riot club im not very sure but good luck xx
-1	the riot club
-1	the riot club coming soon may impressive showcase for a whole gallery of brilliant up amp coming actors viff http t co efjpvtdrx4
-1	rt mediumraretv our review of the theriotclubfilm by lonescherfig is up now wealthy young and full of http t co jnfn9qidal
-1	beb love story ba yung the riot club gwynxzcullen
-1	i m conflicted between wanting to watch the riot club online but also feeling extremely awful about it
-1	our review of the theriotclubfilm by lonescherfig is up now wealthy young and full of http t co jnfn9qidal
-1	the riot club w natalie dormer harrylloyd amp max irons opens in theatres and on vod today
-1	i m gonna watch the riot club and cry bc every guy in that movie makes me wanna jump of a cliff bye bye
-1	i want to watch the riot club again so bad but i have no money to buy it
-1	the riot club
-1	calgary edmonton kingston are you ready for the riot club because it opens today in your cities filmfriday
-1	just finished watching love rosie and the riot club oh my god english ppl
-1	rt thecobgallery douglas booth talks to the standardnews about his budding art collection which includes pieces from haydenkays http
-1	rt thecobgallery douglas booth talks to the standardnews about his budding art collection which includes pieces from haydenkays http
-1	the riot club
-1	i am astounded that the riot club is based on a real life club that people like our current prime minister used to be a member of
-1	reviews of movies now playing clouds of sils maria the riot club home the wonders the babadook cinderella http t co nv2ungld15
-1	jonathan reviews the riot club a tough to watch but entertaining look inside the vulgar side of the posh life http t co arezrb5vcb
-1	the riot club made me feel a little ill
-1	sam claflin douglas booth and max irons in the same frames that s brilliant the riot club posh https t co 3tmeq9wgnq
-1	movies hd http t co 5djgde0ui7 the riot club 2014 http t co 5ujh0afp8g
-1	rt gaygustin she is literally like my older sister she means so much to me she loves everything i love eg the riot club thomas dylan tw
-1	speaking of the riot club
-1	rt gaygustin sometimes i forget that pauline and i dont spend every friday night together watching the riot club and talking about sangst
-1	she is literally like my older sister she means so much to me she loves everything i love eg the riot club thomas dylan tw tmr everything
-1	sometimes i forget that pauline and i dont spend every friday night together watching the riot club and talking about sangster dick u know
-1	nrl 2 2 why not penalise club severely one day you will have a massive riot on your hands becuse you as the governing body did nothing
-1	rt thecobgallery douglas booth talks to the standardnews about his budding art collection which includes pieces from haydenkays http
-1	so basically the riot club is the posh versions of chavs
-1	the riot club s cast is so fit wtf
-1	douglas booth talks to the standardnews about his budding art collection which includes pieces from haydenkays http t co o5b5rcy9hr rt
-1	jbaker90 is this that film you were on about it s called the riot club it looks really good http t co 81ybzc9lln
-1	the riot club nw
-1	thatbelgianfan i didn t see yet romeo and juliet and the riot club so much movies to watch
-1	watching the riot club holy shit all the boys are extremely attractive
-1	nw the riot club
-1	the cast of the riot club is a and by a i mean a
-1	aaliyahsnc that one scene just got me hard you should watch the riot club
-1	1 grease 2 the breakfast club 3 the riot club three movies i can watch over and over again without getting tired of it
-1	i m gonna dedicate two pages of my dream diary to the riot club cause they use so much chim british words
-1	the riot club 2014 english by fasadik dvdrip avi download movie torrent download 100 http t co mw4i7kmeli
-1	review the riot club http t co qol29csxag
-1	watching the riot club posh with oviya and alya https t co txs1iegmh5
-1	movie review the riot club plagued with boring unlikeable http t co aom9xrdlmi davidcameron
-1	im watching the riot club rn its kinda random but rlly good so
-1	vikings hope they realize that ragnar falls in the if x dies we riot club
-1	watched the riot club just over an hour ago what a shocking movie
-1	the riot club socorrinho http t co jwoo3smlve
-1	movie review the riot club plagued with boring unlikeable characters http t co 0ycnqosvfh http t co fkbjcb8ohx moviereview
-1	movie review the riot club plagued with boring unlikeable characters http t co bpgdgbvnfp http t co rdpl6ozxw4
-1	hunger strike riot live at the eagles club in green bay wi 1 1 10 part 1 of 4 http t co linnvaf14a http t co rbwtnpn5ll
-1	new obsession yearsandyears you guys music is toxifying mydrug official bae olly alexander since the riot club
-1	the riot club more like the dad club am i right ladies xox
-1	the riot club fails to earn its riotous stripes http t co dcrcwtktgb angeles brother club
-1	rt poisonhunter_ loved the riot club it was nothing i expected but it was still good https t co 3akdydc5hh
-1	rt shahiramustafa how did i just heard about the riot club max iron sam clafin and freaking douglas booth bloody hell top not
-1	rt theriotclubfilm you better wear a f kin helmet theriotclub comes out swinging http t co 7cjoe2oygp http t co smfqcdjv8t
-1	the riot club 0 http t co e03eujzg1p
-1	i liked a youtube video from jdolgovaa http t co lbk8hjcxqu the riot club
-1	the riot club 2014 full movie https t co kzig9jteqo
-1	the riot club 2014 full movie https t co ytivdo6dck
-1	the riot club 2014 full movie https t co nykwoij5ja
-1	for some reason the chuckle brothers are coming to a club at my uni and if this isn t played i m gonna riot https t co yhvqc0klog
-1	the debauchery starts tomorrow http t co 2lfrs1klaa http t co upzo3jw7av
-1	rt standardshowbiz standardshowbiz the riot club star douglasbooth has declared his love for fine art http t co e3dsnpcks9 http t
-1	the riot club is my happiness
-1	it s my turn to join this club please invite me lol nowwatching the riot club
-1	it s really cool coz the riot club is based in oxford and i was there like a few weeks ago so i recognise places
-1	smexayhoran google is the best gonna watch the riot club now btw
-1	rt standardshowbiz standardshowbiz the riot club star douglasbooth has declared his love for fine art http t co e3dsnpcks9 http t
-1	bilgeebiri i ve been trying to think of something positive i really liked the riot club then she found me and friends with benefits
-1	you better wear a f kin helmet theriotclub comes out swinging http t co 7cjoe2oygp http t co smfqcdjv8t
-1	rt thelastmagazine british actor max irons http t co iuu9fjvtu8 by jonathanshia thomasgiddings maxirons theriotclub http t co
-1	standardshowbiz the riot club star douglasbooth has declared his love for fine art http t co e3dsnpcks9 http t co cixztkxbwl
-1	rt theriotclubfilm see hollidaygrainger and maxirons in this clip from theriotclub now available http t co 7cjoe2oygp https t c
-1	rt theriotclubfilm tap to find which member of the riot club you d do dump amp marry theriotclub https t co 6sllewrvxy
-1	how did i just heard about the riot club max iron sam clafin and freaking douglas booth bloody hell top notch actors
