-1	rt talofficial coldplay the scientist https t co hcgfrmif5d
-1	se joga em lovers on the sun feat sam martin de david guetta na deezer http t co zoqrgom1rj
-1	hands down the most embarrassing facebook fails of all time http t co ywagbsy9e5
-1	rt jenmorrisonlive tonight warninglblsfilm is on the big screen thank you to everyone that made the film possible tribecatogether ht
-1	rt killerpassbots green lovers from serowe finished as runners up and will play mogoditshane fighters in the bwpl playoffs debswanafdn
-1	hands down the most embarrassing facebook fails of all time http t co qf5wv5piro
-1	rt jenmorrisonlive today is the day warninglblsfilm premieres at tribecatogether a big thank you to the cast and crew https t co rd
-1	about the bookit s the berenstain bears country cookbook bear lovers everywhere are sure to find favorite https t co f54fsgclmg
-1	rt rikerr5 on the way to san diego
-1	sidzig5 arlh1980 this was for the cat lovers
-1	ryan gosling thrills brixton film lovers at the ritzy http t co 67kwkzy8d2
-1	rt ontheredroad a little something for you drogo lovers is dothraki the new klingon gameofthrones redroad http t co g0rewzz0jd htt
-1	chamorro short highlights uog film fest film lovers from all over the island flocked yesterday to the univers http t co wreukpdyqt
-1	rt loverubiuh miners in the sun parodia lovers on the sun cover by francesca ha llegado a las 12k reproducciones gracias https t co
-1	the haters and the lovers i love em all man may everyone straighten up and fly right
-1	like caustic films on fb then invite all friends to like the page examples person that cuts your hair ex lovers crazy aunt etc
-1	where my cf lovers at http t co 1r6mfccqs1
-1	all of you bandwagoning bobblehead lovers are preventing me from getting good tickets for the m s game tonight shame on you
-1	rt justdoitnowok if the mirror doesn t reflect the true image of who you are maybe it s the wrong mirror friends amp lovers r our mirrors
-1	recipe of the day for the coffee lovers vanilla shakeology latte 1 scoop vanilla shakeology 1 cup brewed coffee http t co ibp2m7ohq0
-1	tripod and the mso show 46 classy comedy a fun night for lovers of tripod the mso and gaming micf tripodactual melbsymphony
-1	rt damn_its_batman djdeong play lovers on the sun david guetta feat sam martin dictatetheplaylist dedicate to sunny
-1	it s another busy saturday night at gin71 delighted to see our cheery gin lovers tonight the sunshine has everyone in a good mood
-1	ours is the same apart from the nutella apples and porridge welovecrisps https t co thkhmhrtmh
-1	happy saturday bikini lovers hope to see you on the sunset strip today from 12 4 to cele http t co uvnytwi064 http t co kbsadmrx7v
-1	rt lindi_mkati i wish i was infront of the sweets at food lovers market
-1	gerardo means the to me whether we re lovers or friends
-1	now playing two lovers the twang try our awesome responsive radioplayer http t co sjh6mwuozw
-1	debbiemacosa luvin the tunes and also the sun sittin with the hutlife crew cumnock can ya play lovers on the sun david guetto
-1	i wish i was infront of the sweets at food lovers market
-1	lh i feel great i feel very happy i think we re in a good position looking forward to the fight bahraingp http t co 7abrm64e8y
-1	attention truck lovers for the 6th time in 7 years ford motor company is the best overall truck brand http t co ylxstzlv3r
-1	rt killerpassbots green lovers from serowe finished as runners up and will play mogoditshane fighters in the bwpl playoffs debswanafdn
-1	heritage walk on the occasion of worldheritageday generated lot of interest from culture lovers of the temple city http t co vbuicrgrd9
-1	the blood shedder mqm will inshallah be beaten from the pti peace lovers kaptaanforpeacefulkarachi
-1	max_the_husky for all the husky lovers
-1	rt confrerie_tokaj tokaj lovers from around the world gather 25th april s rospatak tokajauction http t co y60xg1x4uj enjoytokaj h
-1	damn fine lovers 1 first song ever 2 just a trial 3 for the haters crime 4 no promo 5 badly done foundabuyer http t co y3x6mtqoms
-1	hurray i ve completed the a duel between lovers quest in mystery manor game http t co j69lgdy5vq ipad ipadgames gameinsight
-1	rt yubanet morning update on the loversfire near alta ca holding at 5 acres and 30 contained http t co ckps701sr5 http t co mkf
-1	tanutd_mufc cridheone sister heike is the sweetest one from mu lovers she is awesome xxx
-1	rt adonnellywriter for paperback lovers http t co zmfg7o7m5m inspiration books iartg bookboost indiepublishing
-1	rt catrina500 sometimes u just need to disconnect for a little bit to enjoy the view amp ur own company have a great weekend lovers http
-1	rt dylanpitman sometimes we re lovers sometimes we re friends behold the magnetism between two dead ends dawestheband
-1	come see us at the latimesfob festivalofbooks booth 186 15 min in and it s been verified book lovers r the wackiest smartest amp sexiest
-1	its peak in the summer when you live in an estate everybody turn dj but we all know sundays are 4 jamaicans to play lovers rock reggae lol
-1	marketurbanism 2 _ for true city lovers they are part of the complex diversity that makes cities both interesting and beautiful
-1	rt lifeproadvices the best relationship is when you act like lovers and best friends at the same time
-1	kendralust can u post photos of your feet for the feet lovers out there
-1	the house at the end of time was really good warmly recommended to all horror lovers
-1	sometimes u just need to disconnect for a little bit to enjoy the view amp ur own company have a great weekend lovers http t co 1ksbsrfttj
-1	just added to the etsy shop chihuahua cuddle ring handmade jewelry for all the dog puppy and pet lovers by tiny http t co sdy7r4ebxk
-1	casually smiles at the lovers in tl http t co kdpdc6d0nd
-1	rt southernjonesy my heart is so full from seeing all of the animal lovers supporting the kristenlindsey petition so many good people o
-1	best way to build a great fan base for edm and multi genre lovers all over the world progressivehouse electronica electro fan lovers
-1	rt taylorswift13 sending my love to all the lonely starbucks lovers out there this valentine s day even though that is not the correc
-1	green lovers from serowe finished as runners up and will play mogoditshane fighters in the bwpl playoffs debswanafdn debswanafds
-1	on the other note meta shifted towards the direction as i predicted on analyst desk where are all the assassin lovers now
-1	notsohernandez same where is the rihanna lovers when you need them
-1	the game of love wayne fontana amp mindbenders lovers radio tunein http t co 1vbod2f6zk
-1	look at all the ozil lovers now
-1	for the capoeira lovers at txai resorts itacar welovetxai txairesorts relaischateaux instagood https t co jlape4r37d
-1	rt libraterms if a libra is into you consider yourself lucky we happen to be some of the choosiest lovers around
-1	rt entiretyinbits it was a sweet kiss a lovers kiss a good morning kiss and their last kiss she remembers it well imprinted in the place
-1	rt taylorswift13 sending my love to all the lonely starbucks lovers out there this valentine s day even though that is not the correc
-1	rt gede_prama weapon is the vehicle of anger compassion is the flower of lovers http t co w45wplfhlg
-1	rt entiretyinbits it was a sweet kiss a lovers kiss a good morning kiss and their last kiss she remembers it well imprinted in the place
-1	rt notebookmsgs best relationship when you can act like lovers and best friends at the same time
-1	another one for all the lovers i say you will i http t co sg180ogqpl
-1	but it raises the question that surely troubles all serious music lovers now which is whether we can find our way to a musical syntax whic
-1	rt thedeepmusic2 pritishnandy when we come to the real peak of succes there is no fame no follower no other things only two things lef
-1	calling all jazz lovers you all really need to get down to the orpheum theater tonight sat 4 18 to hear the http t co dnagme9tde
-1	thesaturdaypm loved the word today god always has a rescue plan amp speaks to people amp being lovers of god not idols blessings gameoftruths
-1	new on e2 the robbery of such tiny things idea this is not the stuff of dreams nor a world where lovers k http t co 593p8w5em6
-1	rt kaatilana its not always the astronauts who have seen the outside world ask the lovers
-1	for all the coffee lovers in england 17 coffee shops to visit before you die http t co 6znr4oirce lifestyle
-1	tennislover16 we re now long lost lovers in this crazy world nothing to connect us across the sea getanewphone
-1	lovers on the sun
-1	rt wyzechef parents lovers friends and family of a troubled black person please don t ever call the police on them
-1	rt ravisinghka to all the beard lovers this is a sikh beard our beards are symbols of humanity don t judge respect all beards http
-1	mern n folks strictly for the lovers tour 2nite w ekolu micahg naki amp tribal theory in san diego https t co annc2dz3p7
-1	rt yubanet morning update on the loversfire near alta ca holding at 5 acres and 30 contained http t co ckps701sr5 http t co mkf
-1	lovers on the sun aaaahhhh
-1	the respect never goes away they re teammates first after all silverarrowsrule http t co 7i9qxchydx
-1	attn football lovers i m in a restaurant on holiday and the way the waiter ran to the kitchen when chelsea scored http t co sa9ojutebb
-1	rt karenjntn i am thrilled to see liason at the top of the pulse poll yet again it s time for these two star crossed lovers to make a l
-1	the game of thrones lovers now have an app to relive got times download mojo earn rewards http t co kbx9untgwa http t co yatoqbq3li
-1	rt ravisinghka to all the beard lovers this is a sikh beard our beards are symbols of humanity don t judge respect all beards http
-1	aiden used to be my fave out of all of carrie s lovers but after the 2nd movie i hated him for wanting to cheat on his wife sexandthecity
-1	rt pqpjp lovers on the sun
-1	the best relationship is when you can act like lovers and best friends
-1	butt lovers gather around http t co 1fkydwff8q
-1	rt a_new_chapter_ curly_gurl135 robbiesherman21 davedittell the lovers the dreamers and me such poignancy from a frog it s a be
-1	rt washingtonlife shoe lovers psa get thee to saks in chevychase for the louboutinworld trunk show and take this https t co 1iqk8cf
-1	rt librathatsme if a libra is into you consider yourself lucky we happen to be some of the choosiest lovers around
-1	how the he ll can we be lovers when we don t even love each other
-1	instagram lovers the perfect album for your photos http t co ytqc6ru1lm instagram squarephotolove photoalbum scrapbook memory
-1	rt paulshawcrossuk france lovers pjadams uncorks the magic for you in intoxicatingsouthernfrance http tinyurl com isf2015pjadams pja
-1	como la estas rompiendo francess lovers on the sun blasterjaxx remix ultralive
-1	heavy d amp the boyz the overweight lovers in the house http t co xdefwx96ix bitemeradio1 hiphip rnb
-1	why are you looking down all the wrong roads mine is the heart the soul to the souls there may be lovers who hold out their hands but
-1	love s a mystery the pretenders lovers radio tunein http t co 1vbod2f6zk
-1	rt pqpjp lovers on the sun
-1	two young lovers and when the mood is right
-1	lovers on the sun
-1	djdeong play lovers on the sun david guetta feat sam martin dictatetheplaylist dedicate to sunny
-1	the soundtrack for only lovers left alive is nothing shy of perfection i ve been obsessed since i first saw the film
-1	rt faeyriss what is this lovers accidentally meeting in the airport http t co wpxatbebc0
-1	rt sofiaandress this is the yummiest for the coffee lovers out there x https t co ugnr77w2se
-1	like what do they think i care go be with those fucking lovers that you have all they can do is show their live assholeness all the time
-1	nca is can really interested about it it is very good news for nepali cricket lovers all around the globe that
-1	oh yay here come the rest of the defense lovers bluewhite autograph sesh beginning in 10 minutes http t co l98hhzm7ff
-1	rt ramblefoxreview the 5 worst game controllers ever invented i m sure you retrogaming lovers will recognize a couple http t co z
-1	we are lovers ahli we are loyal in love we the kings we are senior clubs we are crazy ahli
-1	the complete bunny guide for rabbit lovers pet lover reveals astonishing secrets guaranteed to thrill and make http t co ftlisrhbbl
-1	jack nicholson and diane keaton bein ex lovers and falling back in love and jack is a jerk and cries at the end nice
-1	urbandesign fun mt citylab time to break out the crayons for this city themed coloringbook http t co thrzumuxdg
-1	music video you re the song in me for lovers http t co 3pb2yh0a0q romance music billywellsmusic piano http t co hcyey1xlyo
-1	kjaz radio brings jazz lovers kjaz radio playing the best smooth jazz on demand 24 7 http t co tatz7fwuqp
-1	rt centiass molokopretoria touchmixwellexperience iamtbotouch fistazmixwellbdaycelebtration for the house lovers tonight is 4 u http
-1	rt wyzechef parents lovers friends and family of a troubled black person please don t ever call the police on them
-1	10 10 would enjoy staying here aww http t co bgv7ybt6p7 http t co f8v98ki9it lol http t co lv960nmfcm
-1	i am thrilled to see liason at the top of the pulse poll yet again it s time for these two star crossed lovers to make a leap ahead gh
-1	soundprank legion anjunabeats sick track only for the real trance lovers trancehead
-1	rt tiffys1983 111111rhonda templarlady justucker0104 annapaquin smoyer they are right we gots lots of crap from the eric sookie lov
-1	rt derekbeaugarde amreading http t co psozqwks2p great book for lovers of historical fact about the spice race in the east indies
-1	you got something to remember i will but our deals never really marched in time that s the bottom line jilted lovers and broken hearts
-1	rt dinela waffle lovers rejoice read on to see where you can find the best waffles in los angeles http t co 5slk2sorei
-1	rt goddesssinclair roo8019 goddesssinclair how about a pic of your bum for all the bum lovers x enjoy http t co q1lhdsrfzh
-1	111111rhonda templarlady justucker0104 annapaquin smoyer they are right we gots lots of crap from the eric sookie lovers about bill
-1	the longer you live the more you realize that reality is just made of pain suffering and emptiness uchiha madara naruto
-1	wishing all music lovers a happy recordstoreday this is my first one in the burbs what are the https t co aedikhrpke
-1	trust me when i say i ll never breake the rules of lovers game
-1	rt citylab it s time to break out the crayons for this city themed coloring book http t co mjsopreq4s http t co v4697smvfz
-1	rt dinela waffle lovers rejoice read on to see where you can find the best waffles in los angeles http t co oe4jidgwyu
-1	milfs_lovers how to make me do the dishes
-1	rt officialr5 behind the scenes of the letsnotbealonetonight video https t co mf82dyzlxh http t co zvtebhzvvd
-1	franky_nathan best friends turned into the perfect lovers
-1	shoutout to the dancers and lovers of that edm stuff do you support new artists check out http t co jlef81patl
-1	best friends or lovers can t seem to find the line between each other
-1	waffle lovers rejoice read on to see where you can find the best waffles in los angeles http t co 5slk2sorei
-1	art lovers fondation louis vuitton presents the exhibition keys to a passion until 6th july matisse picasso http t co gc2jdjbewv
-1	the game of thrones lovers now have an app to relive got times download mojo earn rewards http t co eranpibzej https t co 7jn0kpnnqj
-1	rt templarlady justucker0104 111111rhonda annapaquin tiffys1983 smoyer watched the show for 7 years but bill lovers got a load of ha
-1	rt ostationgallery for garden lovers there s a fabulous gardeners market on in the peak shopping village derbyshire peakdistrict http
-1	what do all you golf lovers think of the new golf alltrack introducing the golf alltrack the 2nd member of http t co egicm9q7ic
-1	curly_gurl135 robbiesherman21 davedittell the lovers the dreamers and me such poignancy from a frog it s a beautiful thing
-1	rt marlowekit sometimes i feel like one of the only lovers left alive christopher marlowe
-1	the craziest tattoos on women http t co intg95cojj
-1	the craziest tattoos on women http t co xjslc5xkmu
-1	got a long list of ex lovers they ll tell you i m insane cause you know i love the players and you love the game
-1	the best relationship is when you can act like lovers and best friends at the same time via http t co 3zqboesvt5
-1	france lovers pjadams uncorks the magic for you in intoxicatingsouthernfrance http tinyurl com isf2015pjadams pjadams10
-1	justucker0104 111111rhonda annapaquin tiffys1983 smoyer watched the show for 7 years but bill lovers got a load of hate online
-1	charlie_ricker traceynyy one for the cat lovers http t co 1hg5y1qvln
-1	now i m at a non record store day record store and they re playing the modern lovers
-1	the 5 worst game controllers ever invented i m sure you retrogaming lovers will recognize a couple http t co z0wl6cb6oz
-1	the very thought of you aaron neville linda ronstadt lovers radio tunein http t co 1vbod2f6zk smoothjazz
-1	schnauzer_of_instagram schnauzer_lovers my diddie enjoying the spring weather and the beautiful flowers https t co ok13rvrf06
-1	rt arrowlicity three years of progress and slowburn from strangers to partners to friends to lovers this has been three years in the ma
-1	meat lovers this video says it all traffic flow is good at the suncoast bbq bash head down with the kids for http t co velazvf1tf
-1	rt loverubiuh miners in the sun parodia lovers on the sun cover by francesca ha llegado a las 12k reproducciones gracias https t co
-1	rt citylab it s time to break out the crayons for this city themed coloring book http t co rjv5y2x0lc http t co cvzeu26o28
-1	miners in the sun parodia lovers on the sun cover by francesca ha llegado a las 12k reproducciones gracias https t co oequmluqmj
-1	the spotify generation don t know what they re missing http t co amfg9qgzm9
-1	but we re the lovers if you don t believe me just look into my eyes cause the heart never lies
-1	rt wowsexfactz the best relationship is when you re lovers and best friends
-1	miners in the sun parodia lovers on the sun cover by francesca willyrexyt libertymario https t co oequmluqmj
-1	rt thedeepmusic2 saritatanwar when u come the real peak of success there is no fame no followers no enemies there is only two things l
-1	so that s who finnick loves i think not his string of fancy lovers in the capitol but a poor mad girl back home
-1	what else do the lovers have to say that has not already been said what other dreams can turn this earth in ways that it has not seen
-1	morning update on the loversfire near alta ca holding at 5 acres and 30 contained http t co ckps701sr5 http t co mkftrbzod9
-1	rt crystalseries book lovers there are great books amp indie authors at the network http t co d8ntfwthu4 ian1 http t co u6c87hg7xz
-1	the lovers are losing
-1	brid lovers respect the style amp power of the audi a8l tdi clean diesel via
-1	scary movie lovers are anticipating the new unfriendedmovie will you be seeing it https t co k6mwp8hwqn unfriended
-1	111111rhonda templarlady annapaquin tiffys1983 smoyer u said bill lovers got abuse i asked if it was cause of the sookie erik or what
-1	renzeyakaru raizefloof because it s actually a fun gta game that was finally released for all the previous gta lovers
-1	this is the world s biggest beagle bed amp breakfast guesthouse for you dog lovers http t co ulznxxhrw0 via 9gag
-1	rt the3basics it s like christmas for music lovers happy recordstoreday wherever you are in the world
-1	for all the puzzle lovers http t co kklzoy1ldn
-1	rt derekbeaugarde amreading http t co psozqwks2p great book for lovers of historical fact about the spice race in the east indies
-1	rt scorpiozodiacc scorpio s are the most unconditional lovers you can be blessed with
-1	cigar lovers worldwide beautiful day in new york city a day for the guayabera shirts many of you https t co kietsbzff9
-1	rt wyzechef parents lovers friends and family of a troubled black person please don t ever call the police on them
-1	my heart is so full from seeing all of the animal lovers supporting the kristenlindsey petition so many good people out there muchlove
-1	rt jlo thank you to all the lovers who voted for me theboynextdooor mtvmovieawards goldenpopcorn http t co pvbnfa1nqp
-1	rt scorpiozodiacc scorpio s are the best lovers
-1	the drink you spilt all over me lovers spit left of repeat
-1	the food lovers 21 day transformation diet program new in box http t co whui3139xq http t co 9nlw143nbu
-1	imagine you and luke are the lovers that went wrong credit to the person who made this edit https t co pfqf3al5pn
-1	thank you ghiradhelli soda shop for being the highlight of my week a chocolate lovers dream https t co 3klj9gffrh
-1	football lovers are the worst creatures
-1	rt elisabethjoffe there was a thing that said swimmers make the best lovers did you not see that that was a bumper sticker waitwa
-1	good day bbc lovers surfaliciouslu mychele4u juicyred88 the__snowbunny
-1	rt matt_dominguez puppy lovers against the ncchamber ncfarmbureau ncaggag bill ncpol stopanimalabuse http t co b9fisujzrk
-1	rt esta__ the planet desperately needs more peacemakers healers restorers story tellers and lovers of all kinds dalai lama
-1	this is the world s biggest beagle bed amp breakfast guesthouse for you dog lovers http t co wi65xbjfqi
-1	rt bbwloversuk retweet for all the bbw lovers out there join http t co 21ekmxhrwq for free http t co 3o5mvxpzmf
-1	amreading http t co psozqwks2p great book for lovers of historical fact about the spice race in the east indies
-1	david guetta lovers on the sun ft sam martin showtek remix http t co gk1iuvk56p
-1	shitzone paradisecross david_cameron charles promised for god in the church at one day from another day he had lovers and camila and etc
-1	rt meowmiya88 5 ways your cat proves their love to you via http t co 0w1oidl5ex the ultimate site for cat lovers http t co ohlpslo
-1	rt _wesocial something for the classical music lovers http t co cmyu8ebcrd
-1	rt bbwloversuk retweet for all the bbw lovers out there join http t co 21ekmxhrwq for free http t co 3o5mvxpzmf
-1	pc budget takes the froth off breweries no corporate taxes you say this cuts into main pc demographic beer lovers https t co ayxf3wz5ob
-1	the game of thrones lovers now have an app to relive got times download mojo earn rewards http t co txtovgyso2 http t co nsw944zank
-1	cspanwj some obamacare facts for the gop fact lovers neksceptic cigarvolante http t co 2kevnw2uce
-1	not often my name is in the same sentence as tchaikovsky s i ll take that https t co lki4uucirt
-1	rt thebeat979fm np lovers on the sun davidguetta ft sammartinmusic saturdayafternoonshowwithlonii loniioke lolushomuyiwa
-1	where are all the coonhound lovers rhonda lee is waiting patiently at mentor petsmart http t co uahcithrod
-1	be lovers on the sun me and my blue sky https t co bpgkylonk7
-1	rt onlinetollywood the alluring beauty srabantismile srabanti lovers rt must fr dis xclusive http t co dvyr3otuls
-1	rt meowmiya88 5 ways your cat proves their love to you via http t co 0w1oidl5ex the ultimate site for cat lovers http t co ohlpslo
-1	don t forget about this novel for the fantasy lovers http t co r7mcb019f0
-1	all the lovers https t co 6d5htrimng
-1	the look of love diana krall lovers radio tunein http t co 1vbod2f6zk smoothjazz
-1	wow i just won this for free for the owl lovers http t co x6n7mki9wm listia
-1	lewis at this rate will soon pass sebastian vettel to take 3rd place in the all time list of pole sitters teamlh http t co jah79gum3j
-1	rt 1dallupdateess zayn cried when the fans said him that they still love him http t co kvcos5p65t
-1	rt drrehoming a shout out to the staffy lovers sasha is our 3 year old fully vaccinated and spayed sbt her markings http t
-1	rt bookmobility prettttty rt citylab it s time to break out the crayons for this city themed coloring book http t co enahulufws http
-1	rt vodafonein t20 lovers here s the 21st question of the vodafonespeedquiz reply quickly and be a vodafone superfan hydvsdel http t
-1	hey fantasy lovers check out my custom fairy decals etsy shop fairy fantasy fairyfantasy fairytale cute rt http t co weinbhqpeg
-1	the best of friends always make the best lovers that s probably why we ve been best friends since https t co d1zpydcphk
-1	and in the streets the children screamed the lovers cried and the poets dreamed but not a word was spoken
-1	rt hdwallpapersim the lovers bipasha basu josh hartnett tamsin egerton images http t co 4wmknwx2rc hollywoodmovies bipashabasu
-1	rt the3basics it s like christmas for music lovers happy recordstoreday wherever you are in the world
-1	rt bbwloversuk retweet for all the bbw lovers out there join http t co 21ekmxhrwq for free http t co 3o5mvxpzmf
-1	nxasi it s written in the beard lovers havers manual
-1	the game of thrones lovers now have an app to relive got times download mojo earn rewards http t co txtovgyso2 http t co izoha2bn5y
-1	lovers of god are the ones who know god best the wise theologian listens to them hans urs von balthasar
-1	parking is limited on st armands circle the art lovers are out on this amazing april day checking out the art show lunch and more srq
-1	rt bbwloversuk retweet for all the bbw lovers out there join http t co 21ekmxhrwq for free http t co 3o5mvxpzmf
-1	rt newssun vinyl lovers across the world are celebrating recordstoreday today http t co ouo2ckletl http t co fjuqh0snoq
-1	rt sinfinimusic calling gamers classical fans explore links between game soundtracks amp classical music http t co x1byg0w1oa http
-1	rt ceeejvalentin joaquin_lovers he s playful but i like his candidness and sincerity he s straight to the point
