-1	check out marc chagall the lovers large lithograph signed by artist in paint expressionism http t co ys6fsw6rpb via ebay
-1	after a certain age it s best not to get attached the emotions that come with it are not compatible with wisdom be it friends or lovers
-1	rt wyzechef parents lovers friends and family of a troubled black person please don t ever call the police on them
-1	rt pisces245 pisces woman will stir trouble in her lovers heart show them worlds they ve never known amp love them deeper than the ocean
-1	rt wyzechef parents lovers friends and family of a troubled black person please don t ever call the police on them
-1	two lovers divided by the cold war meet again on a dangerous mission thriller romance http t co wew3m6cnez http t co 2lkzt6cwyr
-1	lost in the mist passion heat onset misty lovers dance kiss actor mister_galaxy https t co 4toud6ng1h
-1	haters wanna hate lovers wanna love i don t even want none of the above
-1	this broken mother did something unbelievable to the killer of her daughter my heart stopped http t co sjo2drfw22
-1	rt wowsexfactz the best relationship is when you re lovers and best friends
-1	rt designer4yu for gingham lovers be stylish by wearing gingham with a touch of colour its the perfect match fashion luxe http
-1	music video one touch for lovers on the outside looking in http t co lt0tmtef24 romance music billywellsmusic http t co 86uf55jkf1
-1	special offer for all you lovers of the written word buynow https t co 2lks2ppdux
-1	karenmonsour12 norsu2 tedcruz marcorubio wakeupamerica of course she smiles the whole room full of hillary lovers
-1	the latte today somcity coffee lovers bangkok thailand http t co 6nwjbslxls
-1	andrew4pendle conservatives team2015 tories want 2 bring back the vile cruel fox hunting animal lovers won t vote 4 cruel tories
-1	rt aboutlibras when a libra is in love they are the most passionate lovers they can do anything to electrify their loved ones
-1	sarcasticluther we are not supposed to be better christians but better lovers living in the grace of god mbirdnyc15 mockingbirdnyc
-1	dear facebook please allow the bunny lovers to see bwf posts in their newsfeed don t deny them the opportunity http t co br99gk2cig
-1	rt therealstafford when people say think outside of the box my response is oh there was a box go live today lovers
-1	today is record store day get out to your local record store today to get the 10 release of frank s songs for young lovers rsd15
-1	the golden hour standing in front of the gateway to red whale coffee good morning coffee lovers https t co hk1tldpidr
-1	lewis the first amp only one so far to dip into the 1 33s in qualifying we ve got a thrilling battle ahead bahraingp http t co lisxi7rzjz
-1	happy record store day to all the lovers recordstoreday cincyproud
-1	to the soccer lovers i laugh eskom strikes at 6pm
-1	rt smithsonianscie spread the word math lovers national math festival is today in dc http t co foqctxusld mathfest2015
-1	universeinwords sally_malcolm shakespeare wrote it as a tragedy for the lovers but also for society choclitsaturday
-1	rt smilepiease the best relationship is when you can act like lovers and bestfriend at the same time
-1	tttayconn i did when the last one stitched my cheek to my gums they re all frankestein lovers
-1	rt 111publishing fantasy lovers the ghostcrow by kay theodoratus http t co uukuhrhsc3 http t co feza76p8ou fantasybooks fantasyst
-1	got a last minute gift you need to buy and need it now hood lovers is perfect for this just write the membership code in a card
-1	rt princessfrance totalgirlph hi you still have copies of your issue with gimme 5 on the cover i want to purchase sana thanks
-1	yes lovers that s the attitude livingforlove
-1	rt therealstafford when people say think outside of the box my response is oh there was a box go live today lovers
-1	i see judas in the hard eyes of the boys working the corners i feel jesus in the clumsiness of young and awkward lovers theholdsteady
-1	rt madhurid_tweets you not doing films is a loss for the cinema and cinema lovers madhuridixit pls madhurisignamovie http t
-1	fatherjohnmisty has set the standard that all of my future lovers will be held to including myself fingeringoblivion
-1	download the new jammout app created amp developed by my great friend nathan music lovers stream https t co yvrhovlxl6
-1	dog lovers everywhere dog lovers everywhere 1 join together in national boycott of all dog br https t co ihjmrfxsjd via changeger
-1	takin ya back with kurt david is coming up at 5 pm http t co uueg2vikp5 kurt delivers the brings us 80s lovers
-1	rt franckpontais to all healthy living and food lovers the natural and organic show is on koppertcressuk on stand l62 http t co ndbow
-1	if you love tasting your way through a city then these are the top 10 places for you http t co z2vdamuvps
-1	rt zushee to the other food lovers i know just look at this menu guys mizymusthafa pompeee nooshinwaheed http t co hyluew3poc
-1	sometimes you meet someone and it s so clear that the two of you on some level belong together as lovers or http t co umrplryvny
-1	rt 9gag the purrfect lovers http t co wvzu7lbxxy http t co dok8zyepkp
-1	rt wyzechef parents lovers friends and family of a troubled black person please don t ever call the police on them
-1	lovers on the sun stadiumx remix
-1	great vibes at the shop for smugglers record store day cocos lovers on now recordstoreday cocoslovers http t co o5usg8pxaq
-1	rt sj_iriszhu for green tea lovers the crunch is good http t co echqvxm3kt
-1	rt wowsexfactz the best relationship is when you re lovers and best friends
-1	rt myweddinnigeria wunola and kunle congrats hml to all lovers tying the knot today a zapphaireevents picture by https t co ss
-1	tmhliv3 head to http t co yvvv9qu3mi and sign up 4 free lots of fun stuf for the edm dance lovers and peeps who like fun come ch
-1	rsiradio rsi dance gt hot hit now david guetta sam martin lovers on the sun gt http t co 2zzntrsaxp
-1	rt therealstafford when people say think outside of the box my response is oh there was a box go live today lovers
-1	after the runs on the options it s lewis ahead of nico and ferrari following through bahraingp http t co lsiomh1r1d
-1	still not too old to die young the lovers hold on to everything and lovers holds on to anything
-1	good morning beer lovers beersimple and i will be representing yardsbrewing at the annapolis beer https t co v8bsapu9yf
-1	rt libraquotess libra they are the most wonderful willing and selfless lovers
-1	an interesting read for all of our sunglass lovers out there http t co egmkckf5id toronto kensingtonmarket eyewear
-1	lovers on the sun
-1	respect was invented to cover the empty place where love should be
-1	respect was invented to cover the empty place where love should be
-1	respect was invented to cover the empty place where love should be
-1	rt wowsexfactz the best relationship is when you re lovers and best friends
-1	happy rsd15 to all music lovers just bought alabama_shakes s new sound amp color for the occasion think it will be a good one for me
-1	rt wyzechef parents lovers friends and family of a troubled black person please don t ever call the police on them
-1	rt ludeerstar they showed yifan amp luhan s photos together and the screen showed yifan s movie and luhan lifted his head to watch http
-1	become lovers for the poeple with no lovers
-1	mercedes going out on the softs too now we re not fast enough to the others to go through with the primes this week bahraingp
-1	rt wyzechef parents lovers friends and family of a troubled black person please don t ever call the police on them
-1	find your love partner on the net on twitter why not http t co xy8qpzodpu
-1	kylie minogue all the lovers http t co 0ukk5flovc
-1	rt wyzechef parents lovers friends and family of a troubled black person please don t ever call the police on them
-1	rt asiandramalove2 sunnies koo is being criticized let s all show the haters that koo has more lovers please a good comment for koo
-1	via the waffle lab thewafflelab good day waffle lovers we are open today until 3 pm as long as the weather http t co 3qtijyanuj
-1	rt askchefdennis what a perfect day for food lovers suncoastbbqbash with destcuisine and joearvin if you re in the venicefl area stop
-1	frothedup mofuromi oh the kkyurin 11th lovers duet sounds amazing
-1	rt aboutlibras when a libra is in love they are the most passionate lovers they can do anything to electrify their loved ones
-1	got a long list of ex lovers they ll tell you i m insane cause you know i love the players
-1	rt pisces245 pisces woman will stir trouble in her lovers heart show them worlds they ve never known amp love them deeper than the ocean
-1	rt and_think_free_ dog lovers everywhere dog lovers everywhere 1 join together in national boycott of all dog breed https t co
-1	nature lovers are already flocking to drumheller to take advantage of the spring weather http t co lpmt03aeqw
-1	rt ebookpr fantasy lovers the ghostcrow by kay theodoratus http t co cv5wk8dsjb https t co vde4nwjvlv
-1	rt wyzechef parents lovers friends and family of a troubled black person please don t ever call the police on them
-1	cotd the lovers look carefully at the consequences of your choices tarot http t co zp9njyuscg
-1	rt be_inspirits you can tell me when it s over if the high was worth the pain got a long list of ex lovers markbam htt
-1	rt thorncoyle let s be critical lovers and loving critics and open ourselves to the truth about where we are and where we ve been d
-1	rt romblonph lambingan falls the natural crystal clear pool is ideal for a dip a favorite dating place among lovers http t co gkg5s2
-1	what s the big deal with the thai and german lovers haha people nowadays if you can t get yours don t mess up with others
-1	rt thorncoyle let s be critical lovers and loving critics and open ourselves to the truth about where we are and where we ve been d
-1	we might as well be lovers on the sunnnn
-1	rt afam20 new blog and stuff about stuff gt gt gt gt gt http t co imbqhzdz3d http t co uynvwgrwqa
-1	fuck the lion lovers https t co 3zmqznzdy1
-1	rt maxhurd did anyone else think that the lyrics of blank space were gotta love those starbucks lovers they ll tell you i m insane o
-1	elizabethtown nc any beagle lovers out there to save these three frightened sisters contact the following http t co 7vv5kvuvwq
-1	rt wyzechef parents lovers friends and family of a troubled black person please don t ever call the police on them
-1	fantasy lovers the ghostcrow by kay theodoratus http t co cv5wk8dsjb https t co vde4nwjvlv
-1	9 of the worst habits of book lovers that leave us broke in pain and lonely but it s all totally worth it http t co 1bptjzf1fo
-1	lovers on the sun feat sam martin by david guetta at celine s crib https t co l87szpa2p6
-1	cotd the lovers look carefully at the consequences of your choices tarot http t co lsnvoma28d
-1	rt jonathannewsam one for the history lovers the roman forum one of the worlds great views another one of our insightmoments http t
-1	rt 1enlightenedcat what the planet needs is more peacemakers healers restorers and lovers http t co bvx52iby2x
-1	photo lovers the two swords alone are just mundane pieces of steel able to kill in skilled hands but http t co cr8foplupj
-1	rt katyperryslave video legendary lovers the prismatic world tour guangzhou http t co fbdngwtuxb
-1	rt vodafonein t20 lovers here s the 21st question of the vodafonespeedquiz reply quickly and be a vodafone superfan hydvsdel http t
-1	attention word lovers my colleague clive chemist musician entrepreneur sheds light on the true meaning of things http t co gvchssxyjc
-1	rt sj_iriszhu for green tea lovers the crunch is good http t co echqvxm3kt
-1	rt billywellsmusic music video why does the rainman cry lovers on the outside http t co dcfv7gy7k2 romance music billywellsmusic
-1	dog lovers everywhere dog lovers everywhere 1 join together in national boycott of all dog bre https t co dnx0encfxt via ukchange
-1	revised amp condensed update assessing interest in a centralized online community where everyone https t co uop0eizwtd via ukchange
-1	rt vevo breezy takes to the far east in this lovers lament autumnleaves ft kendricklamar http t co hzdstadsnd chrisbrown vevopr
-1	vinalba fifty 50 just screams steak this one is for the steak lovers lovesteak argentiniansteak
-1	rt mikeyc74 great to see coastlines by patrick_barkham at number 7 in guardian bookshop top of the pops a must for coast lovers http
-1	rt wyzechef parents lovers friends and family of a troubled black person please don t ever call the police on them
-1	rt therealstafford when people say think outside of the box my response is oh there was a box go live today lovers
-1	rt brixtonblog ryan gosling was in brixton ritzycinema amp the audience loved it theadammarshall reports http t co plebt4vow9 http
-1	rt thedailyprotein meet the animal lovers with the bear necessities in life spring time sees the arrival of http t co dn0s947gpr
-1	daily draw 3 of pentacles queen of wands the lovers http t co mm3fffshkq
-1	rt midtowncomics today s deal of the day larry marders beanworld vol 3 remember here when you are there hc for 30 off http t co qg
-1	sportsaccessse tsn2 hd streams for the f1 lovers
-1	rt centiass molokopretoria touchmixwellexperience iamtbotouch fistazmixwellbdaycelebtration for the house lovers tonight is 4 u http
-1	for green tea lovers the crunch is good http t co echqvxm3kt
-1	the game of thrones lovers now have an app to relive got times download mojo earn rewards http t co vmpdcpfncp http t co sseyjupkjj
-1	rt therealstafford when people say think outside of the box my response is oh there was a box go live today lovers
-1	fantasy lovers the ghostcrow by kay theodoratus http t co uukuhrhsc3 http t co feza76p8ou fantasybooks fantasystories fantasyauthor
-1	we are the bubble lovers riesaichaa calais artisan bubble tea amp coffee mall ska pekanbaru https t co ueaba7zvzx
-1	music video why does the rainman cry lovers on the outside http t co dcfv7gy7k2 romance music billywellsmusic http t co yylf9tlnrj
-1	the flamingos that love is you lovers never say goodbye dj promo white label http t co c8dqmwvjod http t co 2ac0g7gsdk
-1	hi music lovers lets play some music https t co px2vkwbdry sushitech recordday the wise caucasian
-1	dog lovers everywhere dog lovers everywhere 1 join together in national boycott of all dog breed https t co f2ggnyicwr via change
-1	when people say think outside of the box my response is oh there was a box go live today lovers
-1	happy record store day 2015 vinyl lovers http t co aq1gmthyl5 springsteen boss
-1	the little girl in the apt next door is singing about her starbucks lovers she s decent don t hate it thinwalls
-1	perfect for all those pet lovers keep track of leashes collars and a personalized rag to wipe the puppy s http t co qa00sqgvys
-1	collecting names of the lovers that went wrong
-1	rt 1enlightenedcat what the planet needs is more peacemakers healers restorers and lovers http t co bvx52iby2x
-1	rt utherben bad news for lovers of cali wine high levels of arsenic especially in the budget brands http t co unb5omuosm
-1	meet the animal lovers with the bear necessities in life spring time sees the arrival of http t co dn0s947gpr
-1	happy recordstoreday everyone cheers to all the music lovers music makers amp music distributors out there music local rsd15 art
-1	happy recordstoreday everyone cheers to all the music lovers music makers amp music distributors out there music local rsd15 art
-1	with warm weather approaching we need to encourage our fellow dog lovers to heed the warnings about the spread http t co xhjanev6ag
-1	libra they are the most wonderful willing and selfless lovers
-1	rt wordacrobatics1 cool the night breeze silver the glow by moonlight we show in scattered stars we shine a beauty so far like lovers kis
-1	lovers are fantastic the friends are awesome
-1	two book lovers married their love for books and the beautiful colorado terrain to realize a beautiful dream a library nestled in the
-1	rt exoticsabrina by request a pic of the spikalicious hot chick louboutin for the heels lovers and for everyone else as well http
-1	rsi dance gt hot hit now david guetta sam martin lovers on the sun gt http t co psroesfg2o
-1	rt pattymjansen the shortest distance between two lovers is negative
-1	rt wyzechef parents lovers friends and family of a troubled black person please don t ever call the police on them
-1	head to http t co 4nx71n7ocq and sign up 4 free lots of fun stuf for the edm dance lovers and peeps who like fun come chill
-1	rt exa969fm as va elexametro 81 con diarinelmeliva gt 16 lovers on the sun 15 elastic heart 14 somewhere to run 13 living
-1	what a perfect day for food lovers suncoastbbqbash with destcuisine and joearvin if you re in the venicefl area stop by lovefl
-1	just played important in your life jonathan richman and the modern lovers best of beserkley
-1	happy recordstoreday everyone cheers to all the music lovers music makers amp music distributors out there music local rsd15 art
-1	rt wowsexfactz the best relationship is when you re lovers and best friends
-1	calling all moscato lovers this is the wine for you our new vintage of la crescent is now available in stores http t co fgff7cfr5y
-1	as va elexametro 81 con diarinelmeliva gt 16 lovers on the sun 15 elastic heart 14 somewhere to run 13 living for love
-1	one for dog lovers and why we fall in love with our dogs the look of love is in the dog s eyes http t co yldjfpefaq
-1	rt wyzechef parents lovers friends and family of a troubled black person please don t ever call the police on them
-1	rt snowglobeman lovers need to have much in common the real fascinating moments though are when they show each other things they never
-1	we spoke to the brains behind waxandstamp the vinyl subscription service for music lovers http t co pcq1xq7sme http t co edko1c7bkk
-1	parting words from the word are we haters or lovers jesus grace vondaskelton http t co hlq4nhj0dt via vondaskelton
-1	rt havanacane and we have 2 kitties available for the cat lovers born 2 days ago http t co m8tjozzhvt
-1	a beer lover s guide to seattle the best breweries taprooms and brewpubs http t co e05dafh3xs via lonelyplanet travel
-1	calling all lego lovers send us photos of your best creations and see we ll feature the best http t co deiaxpluk7 http t co bhcpns3lur
-1	smoonstylee which the type of your lg i m samsung lovers but wants to change my phone
-1	and i guess that s why they call it the blues time on my hands could be time spent with you laughing like children living like lovers
-1	rt spudsyourway potato lovers we are in hamden at the zmiddle school for earthday until 3 amp we are clintoncrossingpo by coach until 5 30
-1	the man i love gladys knight lovers radio tunein http t co 1vbod2f6zk smoothjazz
-1	the game of thrones lovers now have an app to relive got times download mojo earn rewards http t co 2gwwdntjvz http t co rvguo0vnhz
-1	the last time i saw him he was walking down lovers lane holding his own hand
-1	rt colinbevis1 sharing the sunrise through an open bedroom window sound of church bells early morning birdsong sensuous kissing a lovers
-1	rt fcbarcelona the second best attendance of the season at the camp nou 92 915 people watching bar a lead 1 0 fcblive http t co nym0b
-1	the lovers tateshots http t co evqaaqgxdp http t co ihwrtyedlv
-1	calm before the storm the summer of lovers and horrid consequences http t co s2istuteta
-1	rt for the cycling lovers vsco cycling bike https t co fgn31wvqom
-1	dog lovers everywhere dog lovers everywhere 1 join together in national boycott of all dog breed https t co jrswzyeuvl via change
-1	pizza lovers today s pizza of the day is the amazing bacon double cheeseburger join us for lunch and make today special pizzalove
-1	rt _demondean things sam hates the deaths of all his past lovers not being able to have a dog me dying and stuff low ceilings good food
-1	rt dougjcooper book lovers will find great books and indie authors at the network gt http t co web77ursre ian1 http t co 9vxzkih5pz
-1	rt michael_coons a couple of surfers jump into the water near lovers point in monterey california monterey ca https t co i37ynfxwsc
-1	it s a beautiful day in the neighborhood so i put together this pretty little collection for flower lovers and http t co frcbnmbafz
-1	the game of thrones lovers now have an app to relive got times download mojo earn rewards http t co 2gwwdntjvz http t co mnm3cftsvq
-1	good afternoon caribbean food lovers and followers my friends over at the flying squad wanted me to share this http t co rt85dbqzja
-1	rt _demondean things sam hates the deaths of all his past lovers not being able to have a dog me dying and stuff low ceilings good food
-1	my lovers got humour shes the giggle at a funeral knows everybody s disapproval 8
-1	the game of thrones lovers now have an app to relive got times download mojo earn rewards http t co ufe5kd0tea http t co nncvippwh4
-1	rt tauruscopehere taurus can make it work with anyone in the zodiac cause we are the relentless lovers and usually wear them out
-1	rt thorncoyle let s be critical lovers and loving critics and open ourselves to the truth about where we are and where we ve been d
-1	the game of thrones lovers now have an app to relive got times download mojo earn rewards http t co ufe5kdiuw8 http t co znhn0wnh9m
-1	hope lazyjohnny has found some fellow lampard lovers to watch the game with in nyc
-1	the game of thrones lovers now have an app to relive got times download mojo earn rewards http t co ufe5kd0tea http t co fzz4ei9bd4
-1	for the cycling lovers vsco cycling bike https t co r6tv9rzqcq
-1	rt tauruscopehere taurus can make it work with anyone in the zodiac cause we are the relentless lovers and usually wear them out
-1	rt siscosaudi the game of thrones lovers now have an app to relive got times download mojo earn rewards http t co ufe5kd0tea http t
-1	what can i say http t co vpns183zrc
-1	tonight spring has sprung and the masked lovers and primed and ready to pollinate willing ovaries we ll http t co duidjvekuy
-1	the game of thrones lovers now have an app to relive got times download mojo earn rewards http t co gvyhpvkjfp http t co 7ryohfy5c1
-1	rt thorncoyle let s be critical lovers and loving critics and open ourselves to the truth about where we are and where we ve been d
-1	the game of thrones lovers now have an app to relive got times download mojo earn rewards http t co ufe5kd0tea http t co ndhc4iwanp
-1	the game of thrones lovers now have an app to relive got times download mojo earn rewards http t co 2gwwdntjvz http t co su4bdomrhq
-1	rt wowsexfactz the best relationship is when you re lovers and best friends
-1	tyler starts playing the sims 4 will he make abby and james be true lovers or screw everything up http t co 314digqdxw
-1	rt fcbarcelona bar a lead 1 0 at half time check out the stats from the first 45 minutes http t co xxi7pd1ehg http t co 8wata4nre7
-1	the game of thrones lovers now have an app to relive got times download mojo earn rewards http t co ufe5kd0tea http t co i0wm1r35tl
-1	tonight spring has sprung and the masked lovers and primed and ready to pollinate willing ovaries we ll http t co flcmlrbdwm
-1	arcana the lovers wheel of fortune ojoubot
-1	dog lovers everywhere dog lovers everywhere 1 join together in national boycott of all dog breed https t co qc1fyhackh via change
-1	rt wyzechef parents lovers friends and family of a troubled black person please don t ever call the police on them
-1	rt doctorwhofanz_ the mini tardis lego lovers have been waiting for doctorwho http t co vulnawi7qo
-1	rt susan_rodeo good morning the peaceful place i ll be hiding out at today painting up a storm what you doing smile lovers http
-1	all i ve listened to today is deftones and the lovers the devil
-1	the game of thrones lovers now have an app to relive got times download mojo earn rewards http t co ufe5kd0tea http t co peygkurwi7
-1	cnn swimmers make the best lovers survey http t co qqggejdmrl
-1	rt l0rd_byron deep lovers are oft reviled by those fear limits to the shallows micropoetry
-1	rt wyzechef parents lovers friends and family of a troubled black person please don t ever call the police on them
-1	10 minutes left all you cartalk lovers in the greater wichita area https t co 8frprucxqp
-1	rt drrehoming a shout out to the staffy lovers sasha is our 3 year old fully vaccinated and spayed sbt her markings http t
-1	the game of thrones lovers now have an app to relive got times download mojo earn rewards http t co 2gwwdntjvz http t co 6p2mzmvcea
-1	rt pomomagazine readers writers lovers fighters there was something for everyone at the oregon book awards http t co trhk8v0fzd htt
-1	the game of thrones lovers now have an app to relive got times download mojo earn rewards http t co 2gwwdntjvz http t co s6snllfp7h
-1	the game of thrones lovers now have an app to relive got times download mojo earn rewards http t co ufe5kd0tea http t co 6xzskblkpv
-1	rt be_inspirits you can tell me when it s over if the high was worth the pain got a long list of ex lovers markbam htt
-1	rt pisces245 pisces woman will stir trouble in her lovers heart show them worlds they ve never known amp love them deeper than the ocean
-1	rt loyzagadiegs my lovers got humor shes the giggle at a funeral darrenflores_ nocombryan ma lss kayo amen amen aaamen
-1	for the dog lovers rt sciencemagazine this week sciencemagazine is all about dogs http t co mrbg2of7wr http t co bp2gftv1z8
-1	rt fcbarcelona 40 neymar collects the ball on the left xavi heads on to messi but the shot is right footed wide fcb 1 0 val fcblive
-1	the blue one for the blue lovers https t co wtrnl1vu6s
-1	rt wyzechef parents lovers friends and family of a troubled black person please don t ever call the police on them
