-1	rt citylab it s time to break out the crayons for this city themed coloring book http t co rjv5y2x0lc http t co cvzeu26o28
-1	rt meowmiya88 5 ways your cat proves their love to you via http t co 0w1oidl5ex the ultimate site for cat lovers http t co ohlpslo
-1	strangers in the night frank sinatra lovers radio tunein http t co 1vbod2f6zk smoothjazz
-1	lovers on the sun
-1	rt sarahpitard with my girls thepertbear and 1diminutivediva getting ready for last of the red hot lovers dress tech http t co f31
-1	np lovers on the sun davidguetta ft sammartinmusic saturdayafternoonshowwithlonii loniioke lolushomuyiwa
-1	the girl at pie last night really tried telling me one of these was a meat lovers really she said that s a sausage http t co rthwicktzt
-1	rt bbwloversuk retweet for all the bbw lovers out there join http t co 21ekmxhrwq for free http t co 3o5mvxpzmf
-1	rt matt_dominguez puppy lovers against the ncchamber ncfarmbureau ncaggag bill ncpol stopanimalabuse http t co b9fisujzrk
-1	the game of thrones lovers now have an app to relive got times download mojo earn rewards http t co txtovgyso2 http t co cnavzravca
-1	rt brickalleylug this weekend for lego lovers in the north east displays and stalls at tanfieldrailway http t co 6e4mow1tof
-1	rt matt_dominguez puppy lovers against the ncchamber ncfarmbureau ncaggag bill ncpol stopanimalabuse http t co b9fisujzrk
-1	ahora en el 97 1 de 7mil300 radio the black keys 10 lovers http t co e8fvwedhij
-1	np richard ashcroft a song for the lovers
-1	sometimes i feel like one of the only lovers left alive christopher marlowe
-1	rt sophia_amoruso buy the ticket take the ride hunter s thompson
-1	rt 111111rhonda annapaquin tiffys1983 smoyer anna ya ll cannot even imagine the online abuse bill lovers had to tread thru for 7 yea
-1	rt sylviamims youtube video of what are you doing the rest of your life from sylvia s cd where lovers live http t co gphrslpyi0
-1	rt topwinenews happy caturday to the cat luvin wine lovers does your cat digg wine
-1	ancient lovers believed a kiss would literally unite their souls because the spirit was said to be carried in one motivation
-1	officialpsl derek049 we shouldn t 4get the oppenheimer stadium tragedy either as soccer lovers also perished there
-1	rt dijay_cj some serious geek ish going down right now in hero_radio 99 0 with the ninja samwestke tune in house lovers n show some love
-1	we are the others the dreamers and the lovers we are every color we are the others
-1	rt bbwloversuk retweet for all the bbw lovers out there join http t co 21ekmxhrwq for free http t co 3o5mvxpzmf
-1	annapaquin tiffys1983 smoyer anna ya ll cannot even imagine the online abuse bill lovers had to tread thru for 7 years it was vicious
-1	rt yaddyfruit braziliansean ukip lovers the lot of them we should just give them like a few isles around britain and send them all there
-1	livemusic tonight from the secret lovers from 9 30pm don t miss the best party in islington
-1	rt _demondean things sam hates the deaths of all his past lovers not being able to have a dog me dying and stuff low ceilings good food
-1	tukutukum lovers for the wonderful photos https t co kz63vwwwyg
-1	rt okaylydia the two people connected by the red thread are destined to be lovers regardless of time place or circumstances http t c
-1	we our new malibu leggings perfect for the beach amp sunset lovers yoga yogapants atx https t co eznq3fpwji
-1	rt rmdrk let go and let in disappear and then appear back and forth over and over lovers and haters life is a series of the same thi
-1	rt dijay_cj some serious geek ish going down right now in hero_radio 99 0 with the ninja samwestke tune in house lovers n show some lo
-1	i guess kitty is the equivalent of babe since all my lovers call me that
-1	are you a shipping container enthusiast sign up to be a part of the u lovers http t co adn1mhkkfm
-1	rt playboy do you love grilled cheeses this survey says you have more sex than the haters http t co ml2ijzba94 http t co htkacjoxsv
-1	altafhussain is ready to set the record to his lovers http t co i1vooiehtx
-1	just got two of my friends to get shitlife and the lovers the devil fuck yeah giftgiverband sworninband
-1	the 2 paths of correlation first path strangers friends lovers strangers second path strangers friends friends with benefits besties
-1	rt mlylas why are we acting like lovers we dont know each other even though we used to rule the world
-1	eissheff beseniorfinals pls can you play lovers on the sun by david guetta for caden
-1	the bqe is for lovers http t co gcp5aoldpi
-1	why are we acting like lovers we dont know each other even though we used to rule the world
-1	i loathe the fact that i can t escape cig smoke i step out the grocery store and the cancer stick lovers greet me
-1	rt corddabbsibro the lovers by picasso http t co fqefrwrb3a
-1	braziliansean ukip lovers the lot of them we should just give them like a few isles around britain and send them all there
-1	rt dougjcooper book lovers there are great books amp indie authors at the network http t co web77ursre ian1 http t co dhemp03q
-1	all of the old school lovers next saturday is for you http t co cbyl8l8gw1
-1	spring shopping the sun s out time to buy beyonc inspired round sunglasses fusion
-1	rt bbwloversuk retweet for all the bbw lovers out there join http t co 21ekmxhrwq for free http t co 3o5mvxpzmf
-1	rt dijay_cj some serious geek ish going down right now in hero_radio 99 0 with the ninja samwestke tune in house lovers n show some lo
-1	rt matt_dominguez puppy lovers against the ncchamber ncfarmbureau ncaggag bill ncpol stopanimalabuse http t co b9fisujzrk
-1	rt dijay_cj some serious geek ish going down right now in hero_radio 99 0 with the ninja samwestke tune in house lovers n show some lo
-1	rt serievines au it wasn t the brothers death that drove her over the edge it was the lovers https t co evbyarfh91
-1	qtsy pet show in your pocket app the new fun pet show app for pet lovers http t co qidjhffqsz
-1	the two people connected by the red thread are destined to be lovers regardless of time place or circumstances http t co ic6hpzy0sm
-1	rt topwinenews happy caturday to the cat luvin wine lovers does your cat digg wine
-1	some serious geek ish going down right now in hero_radio 99 0 with the ninja samwestke tune in house lovers n show some love moseax
-1	rt levostregc kan we gette 100 retweetes for thys lynke to the newe john gower mysterye thriller the invencioun of fyre https t co zat
-1	rt wowsexfactz the best relationship is when you re lovers and best friends
-1	rt 9gag the purrfect lovers http t co wvzu7lbxxy http t co dok8zyepkp
-1	the game of thrones lovers now have an app to relive got times download mojo earn rewards http t co gdlwx4yuj2 http t co kzhorgqovg
-1	nowplaying the black keys 10 lovers tune in http t co qspqswslzn
-1	the game of thrones lovers now have an app to relive got times download mojo earn rewards http t co gdlwx4yuj2 http t co mz6pcqnkeu
-1	rt bbwloversuk retweet for all the bbw lovers out there join http t co 21ekmxhrwq for free http t co 3o5mvxpzmf
-1	rt artpicschannel the lovers rene magritte http t co mieujyxsqf
-1	rt _demondean things sam hates the deaths of all his past lovers not being able to have a dog me dying and stuff low ceilings good food
-1	rt tonimorgan_ happy birthday nathansykes have the best day i love you http t co wop3qfmghh
-1	rt cougarloversuk retweet if you think cougars make the best lovers http t co occgeal5jr
-1	rt bbwloversuk retweet for all the bbw lovers out there join http t co 21ekmxhrwq for free http t co 3o5mvxpzmf
-1	augustryder roar part of me wide awake dark horse et legendary lovers hot n cold international smile by the grace of god
-1	its a mercedes ferrari game on tomorrow at the bahrain grand prix f1 http t co anqzai5lfl
-1	rt poleofficial i made2one of my lovers the one i live with guess he will be glad hikershell drunkinkiss twajole hardytlc http
-1	rt bbwloversuk retweet for all the bbw lovers out there join http t co 21ekmxhrwq for free http t co 3o5mvxpzmf
-1	at focus on the family all you odyssey lovers
-1	the game of thrones lovers now have an app to relive got times download mojo earn rewards http t co ujagcg7zij http t co oupmxk2xwa
-1	rt allthingsfadra for those performance lovers the fiat500x comes in a 1 4l six speed manual transmission
-1	music lovers better be prepared for dude the hippy peace canoe is in motion young guy is on a drive no brakes
-1	the game of thrones lovers now have an app to relive got times download mojo earn rewards http t co gdlwx4yuj2 http t co tqyq2mtpx8
-1	rt wowsexfactz the best relationship is when you re lovers and best friends
-1	lake county vinyl lovers across the world are celebrating record store day today it s li http t co tp5x5p0grk
-1	rt allthingsfadra for those performance lovers the fiat500x comes in a 1 4l six speed manual transmission
-1	queenvanderbee tbh kris has lot of silent haters after he escape frm sme the haters become voice abt their hatred toward yifan
-1	mqm the scene is set the stage is set no scripts no prompting just pir sahib and his lovers maihoonmqm countdown begins
-1	rt wowsexfactz the best relationship is when you re lovers and best friends
-1	rt topwinenews happy caturday to the cat luvin wine lovers does your cat digg wine
-1	rt cougarloversuk retweet if you think cougars make the best lovers http t co qwt3urmvu8
-1	rt matt_dominguez puppy lovers against the ncchamber ncfarmbureau ncaggag bill ncpol stopanimalabuse http t co b9fisujzrk
-1	the game of thrones lovers now have an app to relive got times download mojo earn rewards http t co uwzadyyzzt http t co bmenqjpehu
-1	for those performance lovers the fiat500x comes in a 1 4l six speed manual transmission
-1	universal lovers of mevlana jelaluddin rumi all the rest are on foot http t co o9nccs5nnq
-1	for all you chipotle lovers help people in amsterdam get a taste of chipotle too look at my last tweet to sign the petition
-1	the best relationship is when you can act like lovers and bestfriends at the same time lt 3 http t co gqsylutuze
-1	the game of thrones lovers now have an app to relive got times download mojo earn rewards http t co txtovgyso2 http t co isgf5g63vu
-1	the best relationship is when you two can act like lovers and bestfriends at the same time it s when https t co 7kxbm6nfac
-1	rt wyzechef parents lovers friends and family of a troubled black person please don t ever call the police on them
-1	the game of thrones lovers now have an app to relive got times download mojo earn rewards http t co ujagcg7zij http t co g0klse9cfl
-1	katy perry legendary lovers the prismatic world tour dvd
-1	leightonearly stellerence prcfry salmayaqoob hell no i didn t date anybody like that but they don t all come in the form of lovers
-1	nowplaying the supermen lovers starlight
-1	rt pebble do you agree with pebbler acurrie we re lovers not fighters but a win s a win eh http t co 5nditrnwvr http t co jxtdn
-1	the game of thrones lovers now have an app to relive got times download mojo earn rewards http t co uwzadyyzzt http t co nzaaqdy0v0
-1	rt izaynielove everything i ve done with them will stay with me for the rest of my life zayn me http t co jgnio1lyzb
-1	rt esta__ the planet desperately needs more peacemakers healers restorers story tellers and lovers of all kinds dalai lama
-1	rt bbwloversuk retweet for all the bbw lovers out there join http t co 21ekmxhrwq for free http t co 3o5mvxpzmf
-1	rt wyzechef parents lovers friends and family of a troubled black person please don t ever call the police on them
-1	happy caturday to the cat luvin wine lovers does your cat digg wine
-1	rt gede_prama weapon is the vehicle of anger compassion is the flower of lovers http t co w45wplfhlg
-1	kylie minogue all the lovers http t co jqv4vrvpiq video 03 34 http t co a7jeedwnbk
-1	the game of thrones lovers now have an app to relive got times download mojo earn rewards http t co txtovgyso2 http t co yaemkseqcr
-1	rt bbwloversuk retweet for all the bbw lovers out there join http t co 21ekmxhrwq for free http t co 3o5mvxpzmf
-1	rt wyzechef parents lovers friends and family of a troubled black person please don t ever call the police on them
-1	harry_styles feel the sarcasm lovers
-1	rt destisurf arnaudderosnay gentleman of the extrem a great book for ocean lovers http t co eyyfhhb3zb windsurf http t co 9sok8qx1og
-1	the game of thrones lovers now have an app to relive got times download mojo earn rewards http t co ujagcg7zij http t co 18nsijoicu
-1	goodmorning to all the lovers
-1	the game of thrones lovers now have an app to relive got times download mojo earn rewards http t co uwzadyyzzt http t co carjbvquqb
-1	rt poleofficial i made2one of my lovers the one i live with guess he will be glad hikershell drunkinkiss twajole hardytlc http
-1	itsaliceeee will do also doug favorited my tweet to you we are being acknowledged for the dog lovers that we are
-1	rt _demondean things sam hates the deaths of all his past lovers not being able to have a dog me dying and stuff low ceilings good food
-1	rt starmagicphils gimme5 aguasnash01 will not be able to attend the back to back album tour tomorrow at sm manila and https t co fxb
-1	rt dougjcooper book lovers there are great books amp indie authors at the network http t co web77ursre ian1 http t co dhemp03q
-1	rt destisurf arnaudderosnay gentleman of the extrem a great book for ocean lovers http t co eyyfhhb3zb windsurf http t co 9sok8qx1og
-1	book lovers utopyacon is coming up in june fill out the application to volunteer http t co bbrc8sbbxp
-1	rt theclassydog beautiful dog themed fine jewelry for the dog lovers http t co b7cedrlowa http t co s89rldoypu
-1	cdehakyeon b b but we cannot disrespect them thats not the way how plant lovers handle it
-1	rt gede_prama weapon is the vehicle of anger compassion is the flower of lovers http t co w45wplfhlg
-1	monkfish goanese curry to follow we might as well be lovers on the sun a un un david guetta curryanddancesaturday
-1	i sought to hear the voice of god and climbed the topmost steeple but god declared go down again i dwell among the people
-1	i sought to hear the voice of god and climbed the topmost steeple but god declared go down again i dwell among the people
-1	rt bbwloversuk retweet for all the bbw lovers out there join http t co 21ekmxhrwq for free http t co 3o5mvxpzmf
-1	i sought to hear the voice of god and climbed the topmost steeple but god declared go down again i dwell among the people
-1	rt bbwloversuk retweet for all the bbw lovers out there join http t co 21ekmxhrwq for free http t co 3o5mvxpzmf
-1	rt bbwloversuk retweet for all the bbw lovers out there join http t co 21ekmxhrwq for free http t co 3o5mvxpzmf
-1	ancient lovers believed a kiss would literally unite their souls because the spirit was said to be carried in one
-1	just tryin to kill the pain but lovers always come and lovers always go
-1	another vacation outfit on the blog this lovers friends dress has been on repeat lately in fact you might http t co z6ut08zgft
-1	the game of thrones lovers now have an app to relive got times download mojo earn rewards http t co uwzadyyzzt http t co 3ncoro19u8
-1	rt destisurf arnaudderosnay gentleman of the extrem a great book for ocean lovers http t co eyyfhhb3zb windsurf http t co 9sok8qx1og
-1	bird lovers saturday breezy 5am count me out there is a f_r_e_e walk to hear grr the commuters feathered alarm clock s dawn choir
-1	books fiction lot of 3 vintage books d h lawrence sons and lovers the rainbow women in love http t co e5avfwlk4c book bargains
-1	friends music lovers supporters of the arts the premiere of capital divo is two weeks from today on http t co udmk53w9jk
-1	for all you lovers of saul bellow s work i got a scheme the moment saul bellow found his voice http t co g40gecmfm2
-1	super healthy kids chocolate treats treats for chocolate lovers my natural raw chocolate makes the best healthy http t co 2nw7dnpqz8
-1	rt crystalseries book lovers there are great books amp indie authors at the network http t co d8ntfwthu4 ian1 http t co g6ftcm
-1	rt dougjcooper book lovers there are great books amp indie authors at the network http t co web77ursre ian1 http t co dhemp03q
-1	rt citylab it s time to break out the crayons for this city themed coloring book http t co rjv5y2x0lc http t co cvzeu26o28
-1	got a long list of ex lovers they ll tell you i m insane cause you know i love the players and you love the game
-1	rt stalker_kenny i wish im the one who have no friends have no stress have no haters have no lovers just a simple person in the backg
-1	rt _demondean things sam hates the deaths of all his past lovers not being able to have a dog me dying and stuff low ceilings good food
-1	rt crystalseries book lovers there are great books amp indie authors at the network http t co d8ntfwthu4 ian1 http t co g6ftcm
-1	rt crystalseries book lovers there are great books amp indie authors at the network http t co d8ntfwthu4 ian1 http t co g6ftcm
-1	my new sounds lorenzo p lovers on the sun live radio globo beat club 5 dicembre 2014 https t co gipwbcshzk on soundcloud
-1	rt citylab it s time to break out the crayons for this city themed coloring book http t co rjv5y2x0lc http t co cvzeu26o28
-1	rt iamkirtidixit only 1 girls become wives of their lovers the remaining 99 become passwords on social sites
-1	whufc_news not such a great season now for the big sam lovers out there is it
-1	zbutterfly puts picture show lovers towards the drift in consideration of video watching peace vugnzec
-1	the game of thrones lovers now have an app to relive got times download mojo earn rewards http t co uwzadyyzzt http t co yalsmjhltm
-1	rt bbwloversuk retweet for all the bbw lovers out there join http t co 21ekmxhrwq for free http t co 3o5mvxpzmf
-1	rt artpicschannel the lovers rene magritte http t co mieujyxsqf
-1	jordan lovers check out the release dates for the new air jordan 13 lows hornets and the dover https t co elngilzso6
-1	at tweet4taiji we want the marriage laws changed many here including i have dolphin lovers but laws say we can t marry it s so sad
-1	bestfriends or lovers can t seem to draw the line between eachother
-1	rt sd_comic_con the walking dead escape and walker stalker fan fest tickets go on sale in just less than an hour http t co pg44uwbu7o
-1	rt bbwloversuk retweet for all the bbw lovers out there join http t co 21ekmxhrwq for free http t co 3o5mvxpzmf
-1	rt artpicschannel the lovers rene magritte http t co mieujyxsqf
-1	hillary to make bill jealous of her lovers in the white house
-1	two performances left of emergenttheatre production of last of the red hot lovers a chicago_reader recommended show come on out
-1	rt mylifeison the best relationship is when you two can act like lovers and best friends http t co lvpkb1szof
-1	all the lovers round the wrold
-1	the game of thrones lovers now have an app to relive got times download mojo earn rewards http t co uwzadyyzzt http t co zbwxag2pm6
-1	rt wyzechef parents lovers friends and family of a troubled black person please don t ever call the police on them
-1	rt dondiegoreggae disleyrascal the address for 45 lovers http t co xydycbalee cheers pocketdj http t co co7uxvdvq4
-1	newssun vinyl lovers across the world are celebrating today http t co dy9dbomdkw
-1	view the video and join my team today by following this link http t co lezikjnl9m http t co s0wwym5xdl
-1	i wish im the one who have no friends have no stress have no haters have no lovers just a simple person in the backgroud in this world
-1	the game of thrones lovers now have an app to relive got times download mojo earn rewards http t co 6omruyen6l https t co nqb4phimmg
-1	got a long list of ex lovers they ll tell you i m insane cause you know i love the players amp you love the game blankspace
-1	rt skyetownsend https t co mydtpjmarw for all the tamia toni braxton beyonce lauryn hill amel larrieux lovers
-1	rt bbwloversuk retweet for all the bbw lovers out there join http t co 21ekmxhrwq for free http t co 3o5mvxpzmf
-1	bird lovers chalk up the streets to let urbanites know that birdsmatter and are nesting http t co onte65oawe
-1	aries new moon launch that new enterprise http t co jydgytn3dd via ainsliefaust the way young lovers do vanmorrison
-1	ahora suena en full 94 1 fm lovers on the sun david guetta feat sam martin
-1	book lovers there are great books amp indie authors at the network http t co d8ntfwthu4 ian1 http t co g6ftcmc42c
-1	book lovers there are great books amp indie authors at the network http t co web77ursre ian1 http t co dhemp03qah
-1	the game of thrones lovers now have an app to relive got times download mojo earn rewards http t co uwzadyyzzt http t co 6h9kmtj1fe
-1	dog days as a nation of pet lovers we shouldn t need an excuse to shower love and attention on our furry fri http t co zf29h5qbrn
-1	rt butter_bahrain stuffed baby aubergine is the appetizer for our veggie lovers visit us at the royal uni for women campus in riffa http
-1	wordsporns attention all google lovers f o l l o w theserioussfact for the most shocking facts ever known tweets are mentioned by
-1	rt citylab it s time to break out the crayons for this city themed coloring book http t co rjv5y2x0lc http t co cvzeu26o28
-1	people used to gaze at the stars and wonder if their lovers were looking at the same ones now we look for the online status on watsapp
-1	rt wyzechef parents lovers friends and family of a troubled black person please don t ever call the police on them
-1	rt bbwloversuk retweet for all the bbw lovers out there join http t co 21ekmxhrwq for free http t co 3o5mvxpzmf
-1	rt bbwloversuk retweet for all the bbw lovers out there join http t co 21ekmxhrwq for free http t co 3o5mvxpzmf
-1	scrabble is a great game to play with friends lovers people you plan to kill or all of the above filmmaker http t co 8szva1yqnk
-1	recipe of the week any other chip lovers out there here is a healthy alternative http t co i7pubqkynu
-1	retweet for all the bbw lovers out there join http t co 21ekmxhrwq for free http t co 3o5mvxpzmf
-1	people can be lovers and enemies at the same time humairah_sabrina_husyam
-1	rt wyzechef parents lovers friends and family of a troubled black person please don t ever call the police on them
-1	the game of thrones lovers now have an app to relive got times download mojo earn rewards http t co uwzadyyzzt http t co 9t9mwmiukx
-1	the pet lovers daily is out http t co iffpe8amb0 stories via joannerighetti sfspca rescue4redempti
-1	rt themissems want rt citylab break out the crayons for this city themed coloring book http t co q0xevlgunh http t co t2k2vrayvv
-1	rt be_inspirits you can tell me when it s over if the high was worth the pain got a long list of ex lovers markbam htt
-1	and the promise we ve made along still keep me hanging on hold me now just like other lovers sakura mai chiru
-1	want rt citylab break out the crayons for this city themed coloring book http t co q0xevlgunh http t co t2k2vrayvv
-1	rt wyzechef parents lovers friends and family of a troubled black person please don t ever call the police on them
-1	rt destisurf arnaudderosnay gentleman of the extrem a great book for ocean lovers http t co eyyfhhb3zb windsurf http t co 9sok8qx1og
-1	rt matt_dominguez puppy lovers against the ncchamber ncfarmbureau ncaggag bill ncpol stopanimalabuse http t co b9fisujzrk
-1	bestfriends or lovers can t seem to draw the line between each other
-1	rt mspmaddog there are 2 different kinds of people when watching a movie 1 the i want to ruin the whole idea 2 the lovers http t co
-1	rt artpicschannel the lovers rene magritte http t co mieujyxsqf
-1	secret lovers that s something we could never be i want the world to know you re with me stir up the envy and jealousy
-1	rt wyzechef parents lovers friends and family of a troubled black person please don t ever call the police on them
-1	rt teamreggaemusic good aftanoon to all the reggaemusic lovers around the world reggae rules the world onelove jso
-1	rt sassymodernmom where are my pizza lovers join us for the randomactsofpizza twitter party w panago_pizza monday 8pm est http t
-1	it s pole for lewis hamilton for the first time in bahrain that s 4 poles in a row this year hamazing http t co lgu42uwaks
-1	best relationship when you can act like lovers and best friends at the same time
-1	for the selfie lovers everywhere https t co q3niwhlbty
-1	weapon is the vehicle of anger compassion is the flower of lovers http t co w45wplfhlg
-1	rt wyzechef parents lovers friends and family of a troubled black person please don t ever call the police on them
-1	i will always remember the moment we became lovers thank you for the love and caring happy w anton pic https t co o5axlgntik
-1	for all the coffee lovers out there wind amp fire just introduced this new coffee cup bangle it will be http t co py0aif1ydl
-1	rt wyzechef parents lovers friends and family of a troubled black person please don t ever call the police on them
-1	rt jlo thank you to all the lovers who voted for me theboynextdooor mtvmovieawards goldenpopcorn http t co pvbnfa1nqp
-1	rt matt_dominguez puppy lovers against the ncchamber ncfarmbureau ncaggag bill ncpol stopanimalabuse http t co b9fisujzrk
-1	rt citylab it s time to break out the crayons for this city themed coloring book http t co rjv5y2x0lc http t co cvzeu26o28
-1	rt matt_dominguez puppy lovers against the ncchamber ncfarmbureau ncaggag bill ncpol stopanimalabuse http t co b9fisujzrk
-1	rt matt_dominguez puppy lovers against the ncchamber ncfarmbureau ncaggag bill ncpol stopanimalabuse http t co b9fisujzrk
-1	there are 2 different kinds of people when watching a movie 1 the i want to ruin the whole idea 2 the lovers http t co q2z4ivmwv6
-1	awwww hahahah if only adults thot like children the world wld be filled with more lovers less haters https t co vryrdzrzzv
