-1	so hard culling the old clothes why i ve not touched this shirt in 2 years but
-1	derbyshirecuts i am against fox hunting badger culling and killing animals in the name of sport or because they are spiders
-1	hai the culling with atharizz dewi and 3 others https t co jbzd4up7nw
-1	humans aren t endangered like the rhino or serbian tiger our species may need culling more so than others especially these hunter types
-1	i just earned the the culling of stratholme achievement warcraft http t co pq0dc2yfxj
-1	rt sfpelosi sfgiants merely culling the bandwagon herd geoff9cow douglascp pattibbs drdind joanwalsh 99ermikeb ptaeufferautho
-1	rt jax_tara 2 12 the culling charliehunnam maggiesiff sonsofanarchy jaxandtara https t co 6bfxmyupqg
-1	watching the culling https t co jvc1qxrhib
-1	drbrianmay votelabour for an end to the conservatives libdems coalition badger culling votelabour webacked votelabour2015
-1	the un official r yugioh highlander tournament round 3 the culling http t co 8fypyjdivh
-1	rt uwoqymez the culling max attack speed http t co sx4igapnru
-1	the culling with ilma https t co lnmzaepugh
-1	rt bucktudyma culling the useless eaters http t co hsjbmm3yd7
-1	rt rogodwinw67 dr howard ralph veterinarian speaks of the everyday cruelty kangaroos face amp the cruelty that is culling kangaroos https
-1	lilmissemo24 time to start culling thin the herd lol
-1	rt rogodwinw67 dr howard ralph veterinarian speaks of the everyday cruelty kangaroos face amp the cruelty that is culling kangaroos https
-1	does culling feral cats reduce the population no http t co nu4nqo5wbe
-1	rt animallibqld benallendingo defends humane destruction of dingoes and misses the point http t co 5hjzsdzp18 conversationedu htt
-1	britishvets you should be ashamed supporting badger culling is wrong show me the evidence to support badgers spreading tb vacation yes
-1	jsuttonmorse me too although that s because the physical tbr pile needed serious culling
-1	rt animallibqld benallendingo defends humane destruction of dingoes and misses the point http t co 5hjzsdzp18 conversationedu htt
-1	and yet another horror film this weekend watching the culling
-1	hiiiyy the culling https t co 7kdua6ksiv
-1	the bovine tb eradication group for england admits there is no reduction in cattle tb by repeated badger culling save the badger
-1	watching some shit film the culling anyone got any good suggestions for horror films
-1	rt sylbernmigab culling the vermin http t co 59bnaksenf
-1	dan_the18thman needs culling from the club also at hull these shit top knots
-1	time for my my once a decade spring cleaning culling the herd of children s books isn t easy link https t co 65cymxntay
-1	rt inragenre the culling warcraft 3 black screen http t co zqw6vdpati
-1	culling day drakes and roosters i dread the day but look forward to the results http t co azupmwt1sx via robinsoutdoors
-1	rt cvchomes aoneaglamettle the fence is over 6ft and few animals breach this fence culling is not answer
-1	tescofood after seeing the seal culling pics i don t think i will
-1	rt hellhorror the culling review the culling review http t co pyp0qjmwnp
-1	rt jax_tara 2 12 the culling charliehunnam maggiesiff sonsofanarchy jaxandtara https t co 6bfxmyupqg
-1	rt hellhorror the culling review the culling review http t co pyp0qjmwnp
-1	rt hellhorror the culling review the culling review http t co pyp0qjmwnp
-1	rt jax_tara 2 12 the culling charliehunnam maggiesiff sonsofanarchy jaxandtara https t co 6bfxmyupqg
-1	much later down the line will be volumetric culling for supervoxels though that means the vbo approach would be moot
-1	the culling review the culling review http t co pyp0qjmwnp
-1	shfarnsworth two tools for pursuing a growth mindset i the rule of ten http t co vpkifkqluo amp ii data tracking http t co 3rk6og13gq
-1	2 12 the culling charliehunnam maggiesiff sonsofanarchy jaxandtara https t co 6bfxmyupqg
-1	kentishgazette celiagw and it s not just the nhs provision at risk local authority underfunding is culling the social care provision
-1	watching the culling https t co vre1eoozdv
-1	celticbhoy73 kthopkins one way of culling our bursting at the seems country i suppose
-1	bbcnews always the last to report badgercull news http t co vwaaqj2wsy
-1	tell australia stop shark culling http t co kklgvxowd7
-1	bird flu in hyderabad culling comes to an end the hindu http t co doozbtnuew health publichealth economy
-1	rt inragenre the culling warcraft 3 black screen http t co zqw6vdpati
-1	time for the annual culling of the feet as we break in the summer sandals a winter in boots amp trainers have softened my poor hooves
-1	rt bucktudyma culling the useless eaters http t co hsjbmm3yd7
-1	lotro the culling pit location http t co tus14dv0wi
-1	defragovuk are you now stopping the badgercull trials following the britishvets new stance http t co vwaaqj2wsy
-1	rt doalowlobi the culling by steven dos santos epub http t co k27yhwc26o
-1	rt berholestsul the culling quotes http t co v5pekuskbs
-1	dr howard ralph veterinarian speaks of the everyday cruelty kangaroos face amp the cruelty that is culling kangaroos https t co xxpne1gnew
-1	botswana re culling the world s population originally posted by coolstorybro compa http t co al8u8b63je http t co y9sgohc3ab
-1	rt caaarleats more people die on the road than they do in the ocean maybe we should mull over culling cars instead of sharks courtneyb
-1	independent rickygervais perhaps ricky could argue it s in the name of conservation culling a few it ensures sustainability
-1	culling comes to an end the source of the infection is yet to be ascertained http t co gmg3h2roxj
-1	rt doalowlobi the culling by steven dos santos epub http t co k27yhwc26o
-1	why did they do it 9 11 77 ch11 a rise of the nwo culling of man https t co enlpawlgqf via youtube
-1	rt philfarmvet another depressing tb test having seen the optimism amongst farmers in somerset driven by decreasing tb culling must be
-1	rt sundancer_uk ed_miliband mr_slater that s why we must finishthetories and any other party supporting the culling of disabled http
-1	rt philfarmvet another depressing tb test having seen the optimism amongst farmers in somerset driven by decreasing tb culling must be
-1	rt philfarmvet another depressing tb test having seen the optimism amongst farmers in somerset driven by decreasing tb culling must be
-1	rt philfarmvet another depressing tb test having seen the optimism amongst farmers in somerset driven by decreasing tb culling must be
-1	nfunorthwest nfupolitical agricontract uklabour meaglemp is that the same mp who labels are farmers cruel for culling badgers
-1	rt bucktudyma culling the useless eaters http t co hsjbmm3yd7
-1	rt osviehistdons the culling film wiki http t co xlvr2fnzwb
-1	eve_culling jessicaslickerr what the
-1	destinyforxbox1 i got truth needed universal remote shard the culling materials
-1	rt berholestsul the culling quotes http t co v5pekuskbs
-1	rt sfpelosi sfgiants merely culling the bandwagon herd geoff9cow douglascp pattibbs drdind joanwalsh 99ermikeb ptaeufferautho
-1	rt geoff9cow i had to look up culling rt sfpelosi sfgiants merely culling the bandwagon herd douglascp pattibbs drdind joanwa
-1	rt sfpelosi sfgiants merely culling the bandwagon herd geoff9cow douglascp pattibbs drdind joanwalsh 99ermikeb ptaeufferautho
-1	i had to look up culling rt sfpelosi sfgiants merely culling the bandwagon herd douglascp pattibbs drdind joanwalsh 99ermikeb
-1	sfgiants merely culling the bandwagon herd geoff9cow douglascp pattibbs drdind joanwalsh 99ermikeb ptaeufferauthor gregmessel
-1	happy bday jacob lol at the last pic but love you so much idk why i d do w out you http t co hlmimoanrz
-1	rt bucktudyma culling the useless eaters http t co hsjbmm3yd7
-1	suicide watch the culling of humanity recently played at http t co iundmgeyr9
-1	rt jeff_stamp culling wolves to save cariboo are we really to blame for the imbalance in nature ahead on prime geoff_hastings jillkr
-1	culling wolves to save cariboo are we really to blame for the imbalance in nature ahead on prime geoff_hastings jillkrop
-1	rt hydconnect culling comes to an end but the source of the infection is yet to be ascertained http t co ir4nqifqv1
-1	culling the useless eaters http t co hsjbmm3yd7
-1	rt uwoqymez the culling max attack speed http t co sx4igapnru
-1	rt osviehistdons the culling film wiki http t co xlvr2fnzwb
-1	rt caaarleats more people die on the road than they do in the ocean maybe we should mull over culling cars instead of sharks courtneyb
-1	culling comes to an end but the source of the infection is yet to be ascertained http t co ir4nqifqv1
-1	introduction neighbors rant and the culling of chickens http t co 1yz8dplz4v
-1	introduction neighbors rant and the culling of chickens via r breakingmom http t co rcu5xqtiz0 http t co 7v83tlfin4
-1	rt caaarleats more people die on the road than they do in the ocean maybe we should mull over culling cars instead of sharks courtneyb
-1	richardjensen46 i considering culling books for the first time
-1	stcom spca_sg avasg is culling the only solution to a pesky problem
-1	culling comes to an end the hindu the hinduculling comes to an endthe hinduthe culling of birds in thorrur http t co 7alxg1axxe
-1	it may break your heart to break her bones but someone s got to do the culling of the fold
-1	rt caaarleats more people die on the road than they do in the ocean maybe we should mull over culling cars instead of sharks courtneyb
-1	rt norfiabaffbe the culling dc comics list http t co ukeezxzyzu
-1	rt caaarleats more people die on the road than they do in the ocean maybe we should mull over culling cars instead of sharks courtneyb
-1	watching the culling and lets just say im creeped out just a tad
-1	rt caaarleats more people die on the road than they do in the ocean maybe we should mull over culling cars instead of sharks courtneyb
-1	rt caaarleats more people die on the road than they do in the ocean maybe we should mull over culling cars instead of sharks courtneyb
-1	rt steveghorvath culling at the catina http t co upgl0teqwc
-1	culling at the catina http t co upgl0teqwc
-1	3novices culling comes to an end the source of the infection is yet to be ascertained
-1	kennycable1000 have you read proxy by ca_london and or the culling by stevendossantos
-1	i m so angry at myself for some of the music in my library that my library as actually getting angrier with each culling
-1	why did they do it 9 11 77 ch11 a rise of the nwo culling of man https t co 12cvg3jol3 nofreedom4u via youtube
-1	rt blmayne culling occupants of interplanetary craft makeahappysongsad
-1	i m supposed to have been writing for the last hour got sucked into culling old photos
-1	the culling film wiki http t co xlvr2fnzwb
-1	conservatives clearly not the same experts who advised against badger culling tories listen only when it suits them to bunch of paedos
-1	eve_culling obvi the weather
-1	the sims 3 17 culling the herd 13 ghosts challenge via
-1	jollygoodbeer fuzzyduckbeer i s also a common tactic of culling the deadwood staff
-1	cbcnewsbc cbcalerts habitat destruction from o amp g exploration letting wolves decimate the cariboo culling is just short sighted band aid
-1	rt aintitgvnn pretty sure the people who fight for badger lives and against the culling are all city folk who genuinely have no idea how
-1	sorry about the flood of photos just culling through my picasa folders
-1	pretty sure the people who fight for badger lives and against the culling are all city folk who genuinely have no idea how they affect farms
-1	well you can t fix stupid but this came pretty close to culling it out of the population at least wow that http t co egefrpcz5p
-1	mybossisadroid i m ok with culling as long as someone s eating the meat
-1	rt movetheworldus for just 5 you can protect puppies from inhumane culling due to the fear of rabies http t co ga0ffbs4y0 http t c
-1	culling the cd collection i call it old skool spring cleaning
-1	rt network4animals check out torycull for the badger s guide to culling tories https t co 3semdlvkph badgers animalrights election
-1	resisting change preserving tradition culling the herd through profitable wars concentrating wealth upwards there s your conservatism
-1	rt inragenre the culling warcraft 3 black screen http t co zqw6vdpati
-1	jay weidner on jeff rense 03 09 2012 psychopaths the moon the culling https t co moee8zyc9n via youtube
-1	rt sewellspotnjot working on a new print inspired by the horrific culling of over 40 naturewords from the new junior oxford dictionary h
-1	homesitter_ time for a geo political culling of all nazis and plutocrats who are daily sucking the life out of 99 of earth s people fact
-1	rt sewellspotnjot working on a new print inspired by the horrific culling of over 40 naturewords from the new junior oxford dictionary h
-1	pftcommenter i would ve drawn the parallel to a slave auction as the culmination of the selective breeding culling amp exploitation myself
-1	lau_robertson01 the british veterinary association is now against the free shooting of badgers will you vote against further culling
-1	col_bogey kevinmullins10 camerons mad for his culling gt 29 000 deaths annually in the uk from air pollution http t co vkaey1rcof
-1	rt red13charlie hellyes thatcherism alive and culling the poor right to buy predatory capitalism ed4pm http t co fprjmawz8q
-1	rt red13charlie hellyes thatcherism alive and culling the poor right to buy predatory capitalism ed4pm http t co fprjmawz8q
-1	the culling 2015 http t co dmytfyb51s
-1	rt red13charlie hellyes thatcherism alive and culling the poor right to buy predatory capitalism ed4pm http t co fprjmawz8q
-1	rt red13charlie hellyes thatcherism alive and culling the poor right to buy predatory capitalism ed4pm http t co fprjmawz8q
-1	rt red13charlie hellyes thatcherism alive and culling the poor right to buy predatory capitalism ed4pm http t co fprjmawz8q
-1	rt red13charlie hellyes thatcherism alive and culling the poor right to buy predatory capitalism ed4pm http t co fprjmawz8q
-1	aoneaglamettle the fence is over 6ft and few animals breach this fence culling is not answer
-1	cvchomes 1800 pound bull moose can leap a 6ft fence or plow through it culling is the most effective means
-1	the culling review the culling 2015 is an american thriller horror mo http t co rvcgsscvy9
-1	rt hellhorror the culling review the culling 2015 is an american thriller horror mo http t co pyp0qjmwnp
-1	rt doalowlobi the culling by steven dos santos epub http t co k27yhwc26o
-1	the culling review the culling 2015 is an american thriller horror mo http t co pyp0qjmwnp
-1	culling the horde steve parker http t co 87gyigbpdr sci fi amp fantasy ebook scifi fantasy ebooks bestselle http t co 2jomhvactv
-1	britishvets say badgercull was ineffective and inhumane amp can t be improved now rule it out libdems catherinemep http t co zqabnfsblu
-1	creepy s clips the culling review the culling 2015 is an american thriller horror movie that is 81 minutes http t co 1y5alimudt
-1	rt johanntasker but britishvets remains convinced that badger culling must form part of the comprehensive strategy for tackling bovine
-1	theculling review the culling 2015 is an american thriller horror movie that is 81 minutes long director http t co jpbpotekt9
-1	review theculling the culling review the culling 2015 is an american thriller horror movie that is 81 http t co yxkx8jnfoh
-1	the culling warcraft 3 http t co trmn6kn2qs
-1	the culling review the culling 2015 is an american thriller horror movie that is 81 minutes long directo http t co 5fyebjjmut
-1	reluctantly culling my magazines after moving house but keeping the recipes i like olivemagazine from nov 2007 http t co co2peh1rzo
-1	rt sewellspotnjot working on a new print inspired by the horrific culling of over 40 naturewords from the new junior oxford dictionary h
-1	the culling cover poster art http t co ufl7gkctrb
-1	the culling cover poster art http t co avn3mumxnc
-1	rt aoifennph latedebaterte eamondelaney10 if the political beasts aren t up to scratch a culling can only ensure the survival of the f
-1	rt inragenre the culling warcraft 3 black screen http t co zqw6vdpati
-1	more people die on the road than they do in the ocean maybe we should mull over culling cars instead of sharks
-1	human parasites one of the earliest means of population culling http t co jdaqbppvka
-1	human parasites one of the earliest means of population culling https t co gcgfe4ondt via youtube
-1	britishvets says it no longer supports the use of controlled shooting to control badgers http t co iwpyt1kwik
-1	rt jax_tara getting ready to stay at the clubhouse 2 12 the culling maggiesiff charliehunnam jaxandtara https t co wgzdgikzla
-1	easter stuff out of the way time to start dieting again
-1	rt biodromegame culling the flapping slugs http t co yataim7cqe gamedev indiedev metroidvania
-1	rt biodromegame culling the flapping slugs http t co yataim7cqe gamedev indiedev metroidvania
-1	rt johanntasker but britishvets remains convinced that badger culling must form part of the comprehensive strategy for tackling bovine
-1	culling the flapping slugs http t co yataim7cqe gamedev indiedev metroidvania
-1	tis the season of hateful facebook posts and tweets elect2016 let the culling begin gop thedemocrats unfriend
-1	rt johanntasker but britishvets remains convinced that badger culling must form part of the comprehensive strategy for tackling bovine
-1	but britishvets remains convinced that badger culling must form part of the comprehensive strategy for tackling bovinetb badgercull
-1	bva do not support the continued use of controlled shooting as part of the badger control policy http t co 3joxigluid
-1	britishvets now say badger cull ineffective and inhumane what do the libdems now say acarmichaelmp http t co zqabnfsblu
-1	rt bob_owens exactly game management is incredibly well thought out for the preservation of the species culling is necessary https t
-1	rt jax_tara getting ready to stay at the clubhouse 2 12 the culling maggiesiff charliehunnam jaxandtara https t co wgzdgikzla
-1	rt bob_owens exactly game management is incredibly well thought out for the preservation of the species culling is necessary https t
-1	exactly game management is incredibly well thought out for the preservation of the species culling is necessary https t co bilfz1dsps
-1	cutting out the confusion email culling nx feeling ruthless
-1	please canada stop culling the baby seals it s heartbreaking and sick no one wants the fur the poor innocent creatures deserve to live
-1	jake_lach zombie_kitv2 it s called culling the herd don t need no weak ass angels in the for the whatever happens um next
-1	rt jax_tara getting ready to stay at the clubhouse 2 12 the culling maggiesiff charliehunnam jaxandtara https t co wgzdgikzla
-1	watching the culling https t co yt8xprwerv
-1	getting ready to stay at the clubhouse 2 12 the culling maggiesiff charliehunnam jaxandtara https t co wgzdgikzla
-1	kevinclosson you re better than i then i ll readily fess up to pleasure at the demise of inhuman scum some special flowers need culling
-1	bugsyndicate culling all the lies of this here tourniquet of pain the will power and gravity love has kept me sane
-1	rt kevinclosson pt3 brianpardy and this after the other day quickly stating i only shoot what i eat my mindset on predator culling has
-1	the culling of time http t co 0kbkygytph
-1	pt4 brianpardy so i feel strange now in this tweet thread i don t in fact eat everything i kill because of the predator culling
-1	pt3 brianpardy and this after the other day quickly stating i only shoot what i eat my mindset on predator culling has me dismissing that
-1	the culling by steven dos santos epub http t co k27yhwc26o
-1	dagger there are being swept out to touch you culling and curating the little less articulate off the richter
-1	culling the prospect herd http t co evooepgayx
-1	pay attention must listen the truth about jade helm https t co fffeeadcem stop believing media and prepare the culling of humanity
-1	suburban_hell assuming the planet will be here in 2045 me i m hoping for a mass culling and will volunteer as patient zero
-1	gillgarmesh let it be said we don t give up so easy deans been loosed from a cage as for the great culling dead ahead are you well
-1	myrockyrocks you re right there it certainly looks and feels to me the policy of population culling if it looks like a duck etc
-1	rt inragenre the culling warcraft 3 black screen http t co zqw6vdpati
-1	rt riybubbnol1986 the culling artemis http t co u9cbzjawn1
-1	rt network4animals check out torycull for the badger s guide to culling tories https t co 3semdlvkph badgers animalrights election
-1	check out torycull for the badger s guide to culling tories https t co 3semdlvkph badgers animalrights election2015
-1	rt sylbernmigab culling the vermin http t co 59bnaksenf
-1	the culling max attack speed http t co sx4igapnru
-1	rt newsdedishams the culling trailer http t co pmpzavqtl5
-1	mcampbellwhio whiotv nature culling the herd
-1	rt fagunconsral the great culling video http t co gaxv67fjnb
-1	rickygervais struggle to see the reason for this apart from sadism culling can be done without the need for an orgasm
-1	the culling dc comics list http t co ukeezxzyzu
-1	b c kills 84 grey wolves in first months of controversial cull a wolf culling program is underway in the can http t co vewz0vur0k
-1	pud91 i think u should hold a ceremony for the culling of the beard
-1	jennyleeparker3 not the likes of this https t co k0dxcdypxz
-1	nw the culling
-1	the culling of the cows igm
-1	nw the culling
-1	the culling is near lol histologyexam
-1	the great culling official air trailer https t co nvih5zjqpl via youtube
-1	more people die on the road than they do in the ocean maybe we should mull over culling cars instead of sharks courtneybarnett
-1	world of warcraft quest guide culling the damned id 12264 http t co pc9cvvytd8 via youtube
-1	rt rwac48 rwac48 this is horrendous amp shameful no where in the world has canine rabies been eradicated except by culling
-1	rt thisistrix maybe all this is a culling process to show me the people i really need to have in my inner circle ah well
-1	gettinggeekymj i just don t think it was a thing after the jedi culling even in a new hope the officers no longer believed in the force
-1	rt thisistrix maybe all this is a culling process to show me the people i really need to have in my inner circle ah well
-1	rt sylbernmigab culling the vermin http t co 59bnaksenf
-1	rt sylbernmigab culling the vermin http t co 59bnaksenf
-1	culling operations in full swing the hindu http t co dzu509lhoe hyderabad
-1	rt animallibqld benallendingo defends humane destruction of dingoes and misses the point http t co 5hjzsdzp18 conversationedu htt
-1	it may break your heart to break her bones but someone s got to do the culling of the fold
-1	culling operation continues on hyderabad outskirts continuing its operations for the third day the ts animal http t co xe5oi46fjy
-1	culling operation continues on hyderabad outskirts continuing its operations for the third day the ts animal http t co 1qsaliym2g
-1	culling operation continues on hyderabad outskirts continuing its operations for the third day the ts animal http t co kjvmngr2vv
-1	culling operation continues on hyderabad outskirts continuing its operations for the third day the ts animal http t co rvz4jei5j6
-1	culling operation continues on hyderabad outskirts continuing its operations for the third day the ts animal http t co vjtsanvi8x
-1	semoga ini beneran horor the culling with anne and anessa https t co xf9kuw8yiv
-1	rt riybubbnol1986 the culling artemis http t co u9cbzjawn1
-1	alexisjasmine12 culling the act of being a culo or the act of culeando
-1	rt accuratetext you can replace me but you can t replace the memories you had with me
-1	rt passionposts i wish i lived by the ocean so i could listen to it every single night
-1	daf inspired culling gems of inspiration from the daf http t co qwjqw2n1tu
-1	alexisjasmine12 is the biggest pussy culling hoe rt if agree culonation2k15
-1	matzav_com daf inspired culling gems of inspiration from the daf http t co 72luaahtbo
-1	rt animallibqld benallendingo defends humane destruction of dingoes and misses the point http t co 5hjzsdzp18 conversationedu htt
-1	rt animallibqld benallendingo defends humane destruction of dingoes and misses the point http t co 5hjzsdzp18 conversationedu htt
-1	rt wordsonlife hundreds of protected seals are being secretly shot along britain s coast every year yet the culling is legal http
-1	kelkesh i won t it was a lot of hard work culling our photos and doing the layouts
-1	rt animallibqld benallendingo defends humane destruction of dingoes and misses the point http t co 5hjzsdzp18 conversationedu htt
-1	rt animallibqld benallendingo defends humane destruction of dingoes and misses the point http t co 5hjzsdzp18 conversationedu htt
-1	rt animallibqld benallendingo defends humane destruction of dingoes and misses the point http t co 5hjzsdzp18 conversationedu htt
-1	pmharper it s unfortunate canada continues to conduct culling of baby seals humans have destroyed the earth by playing god pls stop
-1	why does the media not bring out more about culling of islam into a monotheistic religion eliminating http t co e2ivblxsbl
-1	culling the stupid cadence ep 2 https t co jyxlokxhai via youtube
-1	rt imackare the culling review http t co vppr9rpvet
-1	voted moderately for culling badgers to tackle bovine tuberculosis he voted for the badger cull fuck you alok
-1	rt rangerdiaries please stop the killing of jackals and caracals in the western cape http t co kgbmypx7ix helenzille capenature1 http
-1	im losing followers for that sebastian shitpost im culling the weak
-1	gotta start culling the nba folks from my timeline seriously i hate the nba
