-1	3xchair on america s riot club who s afraid of affleck amp skip gates plus the mafia genre redeemed http t co m4jqtkmmax
-1	watching the riot club with the riot club i ll update you when i wake up on wednesday
-1	more twitter buzz for the london cocktail club http t co qh0t92nx69 rt theginfizzgirl brixton riot cocktails at the london cocktai
-1	rt theabnorm rap battle this saturday club abernathys 3226 troost then performing at riot room for middle of the map fest http t c
-1	samclaflin holy shit the riot club got so dark wow
-1	brixton riot cocktails at the london cocktail club lcc https t co lzze4hryte
-1	australia 93 the riot club lone scherfig http t co uvyublnay3 movies itunes iphone apple
-1	a film like the riot club but instead of hating poor people the protagonists hate small town people
-1	i wanna watch the riot club again
-1	the riot club was really good oh my gosh
-1	going to bed go watch the riot club and praying that i feel normal tomorrow
-1	came back from the movies watched the riot club great movie
-1	ready for the riot club and some english traditions d
-1	has anyone seen the riot club it looks like a film abt spoilt rich kids and that s not my type of thing but nat dormer and sam claflin
-1	nw the riot club
-1	rt paramore more music is now available on http t co zrqbkp8xf9 listen to singles club the final riot and i caught myself http
-1	ohdobrevhalder yup hey have you seen the movie the riot club
-1	powerfully uncomfortable a review of the riot club http t co tbwzzmhtka
-1	rt tengkuamelya the riot club again
-1	the riot club mirrors america s hidden class conflicts black souls redeems http t co sopqbnw858
-1	riot the riot club posh https t co 6yteqmdwli
-1	i ve been watching the riot club on repeat for these past few months i hate what they did to me
-1	i m watching the riot club 2014 https t co hba596cf62 trakt
-1	watching the riot club bc of my boys sam max and douglas
-1	rt williamader my motorcycle club would be called the sons of atrophy
-1	rt paramore more music is now available on http t co zrqbkp8xf9 listen to singles club the final riot and i caught myself http
-1	photo naturaekos the riot club http t co 5wjmknex11
-1	omnia vincit riot mate the riot club posh https t co 2gf0e0a2no
-1	http t co za2wz5uioi the riot club full movie 2014 online free http t co cdvksbevia club full movie movie online riot
-1	reviews of movies now playing it follows clouds of sils maria the riot club home the wonders the babadook http t co t6sbhpuwhq
-1	the riot club not reviewed santa fe new mexican http t co pjtsfa9p0d jeancocteaucinema
-1	rt sonicboomsix have you heard 50cent vs sonicboomsix perfect in the club by riot milk on soundcloud np https t co nb3xfk9jy1
-1	have you heard 50cent vs sonicboomsix perfect in the club by riot milk on soundcloud np https t co nb3xfk9jy1
-1	max irons sam claffin douglas booth the riot club posh https t co zqlja5nejt
-1	54 5 the riot club
-1	rt djjohnaskew alexander and the terrible pile of horse shit the riot club to the face this is where i leave you for a different airli
-1	alexander and the terrible pile of horse shit the riot club to the face this is where i leave you for a different airline
-1	rt apollo_magazine riotous romans in paris parisart1 reviews the baroque underworld at the petitpalais_ http t co zs2gtkqlxu http
-1	rt thedhanset people hate him in the riot club but he got my attention https t co xezeq58pxi
-1	people hate him in the riot club but he got my attention https t co xezeq58pxi
-1	watching the riot club posh https t co fugjhlhmyp
-1	psa watch riot club the cast is inarguably the most attractive you wont be disappointed
-1	the riot club blr fast free shipping http t co nqb5b6cnb8 deals_uk http t co krmigdb2mf
-1	you see somebody accused me of the cameron types in the riot club
-1	he s in riot club too is everyone in the riot club i need to watch that damn movie
-1	trashyflowers douglas booth models menswear for spring 2015 in pictures the riot club actor turns http t co wjtpeu0txw
-1	9gag the riot club s girl
-1	the riot club
-1	australia 41 the riot club lone scherfig http t co uvyublnay3 movies itunes iphone apple
-1	skiesliam olly is he s in the riot club and god save the girl as well
-1	couchpotato found 67 releases for the riot club before eta select and download via the dashboard
-1	the riot club http t co 3q4igvcrkm
-1	but i still need to see the riot club
-1	futures can be made or broken in just one night the riot club the new film from the british director of an http t co p3t4aggryq
-1	rt papajoe1407 blairmcdougall cllrclive saw his film on a flight to us in tears at times i followed this film with the riot club ak
-1	the riot club full movie watch now http t co qbukuvpbuk http t co z8uv03hiby
-1	nothankujustin ja na the riot club
-1	when beth waxes lyrical about shakey and posts quotes referenced in band of brothers and the riot club
-1	rt papajoe1407 blairmcdougall cllrclive saw his film on a flight to us in tears at times i followed this film with the riot club ak
-1	blairmcdougall cllrclive saw his film on a flight to us in tears at times i followed this film with the riot club aka bullingdon club
-1	rt apollo_magazine riotous romans in paris parisart1 reviews the baroque underworld at the petitpalais_ http t co zs2gtkqlxu http
-1	rt paramore more music is now available on http t co zrqbkp8xf9 listen to singles club the final riot and i caught myself http
-1	the riot club becomes one of the few films i switched off before finishing 1 10
-1	rt apollo_magazine riotous romans in paris parisart1 reviews the baroque underworld at the petitpalais_ http t co zs2gtkqlxu http
-1	rt apollo_magazine riotous romans in paris parisart1 reviews the baroque underworld at the petitpalais_ http t co zs2gtkqlxu http
-1	rt apollo_magazine riotous romans in paris parisart1 reviews the baroque underworld at the petitpalais_ http t co zs2gtkqlxu http
-1	oh my wow the riot club
-1	rt kc_picks the riot room mentioned again http t co kxw07ypteo rt theabnorm rap battle this saturday club abernathys 3226 troost
-1	the riot room mentioned again http t co kxw07ypteo rt theabnorm rap battle this saturday club abernathys 3226 troost then perfor
-1	watching the riot club aka too many hot attractive young guys in one movie
-1	rt theabnorm rap battle this saturday club abernathys 3226 troost then performing at riot room for middle of the map fest http t c
-1	rap battle this saturday club abernathys 3226 troost then performing at riot room for middle of the map fest http t co lwwowvthma
-1	rt paramore more music is now available on http t co zrqbkp8xf9 listen to singles club the final riot and i caught myself http
-1	rt adrianashrmaine the riot club nw drooling http t co 8tlq8we68s
-1	this week i watch the riot club omg it was very eye opening samclaflin douglasbooth
-1	skhadijahhhh the riot club tu cite baru ke
-1	msu senior and the neuroscience club wrote a letter to the editor to shed light on why people riot http t co 39sc72a96y
-1	the riot club posh https t co ivfsapti2v
-1	the riot club nw drooling http t co 8tlq8we68s
-1	the riot club
-1	the riot club official trailer 2014 https t co kqmfuof9yx
-1	the riot club
-1	show me the money rapper iron and yang dong geun to perform at circle club in new york city http t co auquuyuomg
-1	show me the money rapper iron and yang dong geun to perform at circle club in new york city http t co lpvzsuicxa
-1	watching the riot club posh https t co op4p3vjk2p
-1	bye easy a unbroken and the riot club
-1	the riot club
-1	watching the riot club posh https t co c8fymfspdi
-1	literally hands down u should watch the friggin riot club bc is2g if u did not watch it yet youre wasting your time rn
-1	nw the riot club
-1	rt deyook the coroner found that his body contained the highest level of cocaine that he had ever seen bullingdon club http t co
-1	rt tensing334455 the riot club inside bullingdon interview with laura wade amp max irons http t co dduoofajet via youtube bullin
-1	the riot club posh https t co jo012grr4r
-1	wittertainment the riot club summedupinaselfie http t co 9cx6vmxsvk
-1	rt paramore more music is now available on http t co zrqbkp8xf9 listen to singles club the final riot and i caught myself http
-1	what da hell you guys are doing me after watching the bloody hell riot club movie
-1	izzatr_ basically its about two guys that in their first yeat at oxford become members of the riot club elite drinking club and belief
-1	1950s burnley ran riot as they beat merseyside club new brighton 9 0 at turf moor in the fa cup 3rd round in 1957 http t co fjkxrfqjhy
-1	aduh deeekkk the riot club posh https t co xbaakrroj7
-1	pretty sure i just served a shittier scottish version of the riot club at work tuxes at eight in the morning no less
-1	afiqahpika they re like a msian version of the riot club
-1	emeraldsun support the legendary riot v at eightball club livestage in thessaloniki on june 4th http t co eifpyd8ti3
-1	has anyone watched the riot club cause i m honestly so angry watching this i hate white boys with money i hate them
-1	the riot club has a show on 04 24 2015 at 09 30 pm exchange in rockaway nj http t co fxqek3gz1s http t co 7047bstej3
-1	the riot club has a show on 04 24 2015 at 09 30 pm exchange in rockaway nj http t co fxqek2zncs concert
-1	rt shanp92x oltie_b klinch14 cw_theflash from that trailer something s deffo gonna be going down if cisco dies we riot when is t
-1	oltie_b klinch14 cw_theflash from that trailer something s deffo gonna be going down if cisco dies we riot when is the fight club
-1	someone said that the riot club was a copy of dead poets society
-1	the riot club com 54 no metacritic max irons sucessssso
-1	australia 64 the riot club lone scherfig http t co uvyublnay3 movies itunes iphone apple
-1	i really liked the riot club but i feel like its campaign could use some work https t co owzxv3fukw
-1	watching the riot club
-1	if you ever watch the riot club remember it is based on the bullingdon club a club that david cameron was a member of says a lot really
-1	the riot club full movie watch now http t co qbukuvhdiu http t co k2ie1tntpw
-1	the riot club has actually got me so angry
-1	i have never seen a film before that has annoyed me as much as the riot club
-1	karlminns in a double bill with the riot club
-1	oh goodness every single cast member of the riot club swoon
-1	rt paramore more music is now available on http t co zrqbkp8xf9 listen to singles club the final riot and i caught myself http
-1	evan davis interview style aren t the riots in london just kids doing the same as bullingdon club supposedly did http t co g3cm4wt9ay
-1	rt theriotclubfilm see maxirons samclaflin amp hollidaygrainger in theriotclub now playing http t co 7cjoe2oygp http t co t2adf
-1	xspulgaciite oh i wanted to ask you if you saw the riot club
-1	see maxirons samclaflin amp hollidaygrainger in theriotclub now playing http t co 7cjoe2oygp http t co t2adf42fer
-1	the riot club es
-1	armstrongvinnie rfcswitcheroo fuck that i bet they two hang about with each other drinking red wine and watching the riot club
-1	des avis sur le film the riot club
-1	the riot club posh https t co grogxj3dqy
-1	nw the riot club
-1	rt walkinthefog welcome to the riot club http t co pt21ama0ai
-1	everyone i talk to about the riot club is like oh man that film is so fucked up so fucked up which it is
-1	rt walkinthefog welcome to the riot club http t co pt21ama0ai
-1	the riot club 2014 http t co yr4rixrrsw drama movie thriller http t co 0ud3lwoup3
-1	so lucrezia borgia is in the riot club this must be an awesome movie
-1	rt darknessbird_ watching olly on the riot club is so weird
-1	watching olly on the riot club is so weird
-1	rt paramore more music is now available on http t co zrqbkp8xf9 listen to singles club the final riot and i caught myself http
-1	the riot club
-1	http t co ote4ipvqh7 movie reference the riot club 2014 http t co xacrqo2qbp
-1	clone club book club the bookish picks of orphan black book recommendations and reviews book riot http t co 5tqvhogyn8
-1	movie marker the riot club 2014 http t co mqqkzomgb1
-1	watching the riot club posh https t co 8l1d4kikbf
-1	btw ysterday i watched the riot club i thought it was gonna be these sexy oxford dudes i was wrong cite tu geli and kejam and fckd up
-1	watching the riot club posh https t co wipowace1f
-1	the riot club
-1	rt sidcelery getting pre corralled by your own club to get tear gassed by the local riot police will improve their efficiency no end
-1	getting pre corralled by your own club to get tear gassed by the local riot police will improve their efficiency no end
-1	the riot club
-1	united kingdom 97 the riot club lone scherfig http t co ikscxseokt movies itunes iphone apple
-1	rt winstuffnz win the riot club on dvd http t co 9riumkwnqc please follow and rt http t co bx6a33vlx4
-1	win the riot club on dvd http t co 6dfpgdb5pl please follow and rt http t co 1saoxije4c
-1	the riot club 2014 http t co co0iipebna
-1	the riot club
-1	watching the riot club posh https t co s64euv574v
-1	alexandralawn i remember meeting you and the rest of ra ra riot years ago in houston tx when you opened for tokyo police club
-1	rt rainbowashes jumabr taylorrae_riot whykidscried this is justine at the club bear what do you say when a strange man offers you wh
-1	jumabr taylorrae_riot whykidscried this is justine at the club bear what do you say when a strange man offers you white powder
-1	australia 57 the riot club lone scherfig http t co uvyublemmd movies itunes iphone apple
-1	watching the riot club has just made me really angry and under the impression that all posh boys are pretentious twats
-1	the riot club is such a good movie and my baby was there yearsandyears yearsandyearsyoumakeushappy
-1	photoset u ok omg so i went on club penguin to mess with the kids and then they started a riot and http t co yucsxyndw4
-1	clone club book club the bookish picks of orphan black book recommendations and reviews book riot http t co eatu6t73nh via bookriot
-1	google the riot club rating director lone scherfig writing credit laura http t co 909ky4xbkm
-1	the riot club
-1	littlemissjlc oi have you seen the riot club
-1	oliviadgrace nightelf or riot join the shadowmeld club 3
-1	the riot club is one of my favourite films
-1	rt jimsbestfriendx i love the riot club vine by kolmklson https t co jxkv018d1b
-1	clone club book club the bookish picks of orphan black book recommendations and reviews book riot http t co q2xkw6owic via bookriot
-1	rt darknessbird_ definitely watching the riot club tonight
-1	definitely watching the riot club tonight
-1	the riot club 2014 http t co l4ejlrfjjz http t co xyd1as5hbb
-1	bing_jimmee it s from the riot club haha
-1	luke solomon feat sam lynham stop the riot remixes http t co uxj1ir27vv via djpestjay
-1	the riot club
-1	sam claflin will also be working with the director of the riot club again
-1	luke solomon feat sam lynham stop the riot remixes http t co 2jvfsgw8sd
-1	rt lilythomsons freddie fox ben schnetzer and sam claflin discuss the games and what might happen in the morning riot club af
-1	watch the riot club and find out why money is the root of all evil my god is it intense i didn t sign up to watch that tonight
-1	nw the riot club
-1	rt douglasbooth really excited for the world premiere of theriotclub at tiff_net http t co yxytgvzmwb see you there
-1	rt douglasbooth very interesting read theoxstu ganging up on the bullingdon olivia sung reviews the riot club for theoxstu http
-1	rt nationalstudent douglas booth on the riot club these are the gangs that are running our country http t co hnvkpa6q25
-1	rt bfi deep pockets and shallow morals unite the riot club watch the sharp satire on bfi player http t co uboboge2fh http t co aefs
-1	the riot club full movie watch now http t co qbukuvhdiu http t co jomwca8wzh
-1	rt theriotclubfilm happy 420 from theriotclub http t co 7cjoe2oygp http t co bgbgdlm6rp
-1	i forgot i planned to watch the riot club tonight cheers and goosies to sam claflin douglas booth and max irons whatsnottofangirlabout
-1	the riot club again
-1	watch the riot club 2014 movie streaming online and check out this url http t co lxsrjgjct9
-1	class warfare over dinner in the riot club
-1	the riot club 2014 full movie https t co ssqgx7zit5
-1	the riot club 2014 full movie https t co zohq6r6vkb
-1	the riot club 2014 full movie https t co wb35edfeej
-1	the riot club is a very well written story but somehow it lacks in supporting roles it doesn t develop any subplots and that s a shame
-1	seriously would never get bored watching the riot club
-1	i saw the riot club yesterday night and i must admit it s a very engrossing film with perfectly played main roles http t co rnb0x9is3t
-1	rt alejandrabxx the riot club boys give me life http t co 3ztvf02v3w
-1	rt alejandrabxx the riot club boys give me life http t co 3ztvf02v3w
-1	the riot club boys give me life http t co 3ztvf02v3w
-1	rt yahoomoviesuk the riot club boys playing beer pong video coming soon to yahoo https t co zjbhjtkep3
-1	and the riot club starring douglas booth
-1	trashyflowers douglas booth models menswear for spring 2015 in pictures the riot club actor turns http t co wjtpeu0txw
-1	australia 57 the riot club lone scherfig http t co uvyublnay3 movies itunes iphone apple
-1	it s honestly the riot club and brideshead revisited mashed up and i don t know why i haven t read it before bit obsessed lots obsessed
-1	the riot club
-1	rt theriotclubfilm happy 420 from theriotclub http t co 7cjoe2oygp http t co bgbgdlm6rp
-1	rt theriotclubfilm happy 420 from theriotclub http t co 7cjoe2oygp http t co bgbgdlm6rp
-1	the riot club full movie watch now http t co qbukuvpbuk http t co veo0teuzlm
-1	rt lilythomsons freddie fox ben schnetzer and sam claflin discuss the games and what might happen in the morning riot club af
-1	rt lilythomsons freddie fox ben schnetzer and sam claflin discuss the games and what might happen in the morning riot club af
-1	rt lilythomsons freddie fox ben schnetzer and sam claflin discuss the games and what might happen in the morning riot club af
-1	rt lilythomsons freddie fox ben schnetzer and sam claflin discuss the games and what might happen in the morning riot club af
-1	freddie fox ben schnetzer and sam claflin discuss the games and what might happen in the morning riot club af
-1	posh people mentioned fiscal policy in the riot club and i understand what it is thanks to economics
-1	tilderi i actually haven t even gone into the strip club xd not even for the story yet either i m just busy heisting
-1	riot_king11 you re that one guy that spends most of his time at the strip club http t co vjvg0vq15n
-1	the riot club is quite possibly the shittest film i ve ever watched
-1	hopeful_hiddles have u seen the riot club
-1	riot club was too good i expect 243 sequels but the same cast just within different scenarios thank u paramount
-1	angura_riot welcome to the awesome but broke club xd
-1	watching the riot club i can tell this film is going to annoy me
-1	nikcerutti oh the riot club
-1	rt justjared max irons reveals that he met with real riot club members to prepare for the movie http t co qgnbxg961o http t co eai
-1	the riot club time
-1	swiftietale agora imagine douglas jamie toby jeremy nico m sam claflin aaron luke pasqua e max irons fazendo um the riot club 2
-1	the riot club is such a pathetic movie
-1	lone scherfig e the riot club ad istanbul film festival 2015 by mariangiola castrovilli http t co etrcmgd12c via youtube
-1	sam claflin x the riot club faz main acc tagged below vine by cyber celebs https t co pvm91jjvwa
-1	rt theriotclubfilm happy 420 from theriotclub http t co 7cjoe2oygp http t co bgbgdlm6rp
-1	happy monday beautiful people just got some great pictures of the lions soul riot release party at dub club http t co w1aaqqkxfn
-1	i have work to do but tbh i m just gonna have a adam evening the riot club next me thinks
-1	rt theriotclubfilm happy 420 from theriotclub http t co 7cjoe2oygp http t co bgbgdlm6rp
-1	happy 420 from theriotclub http t co 7cjoe2oygp http t co bgbgdlm6rp
-1	stanbul film festivali the riot club http t co hmag3vw0jn http t co xnzvkadkak
-1	the riot club
-1	nw the riot club such a british movie omg
-1	the riot club time
-1	the riot club might be the most intense and dramatic movie i ve ever seen
-1	i need somebody who is a fan of the riot club to talk to me about it cause that movie is destroying me
-1	rt shahiramustafa how did i just heard about the riot club max iron sam clafin and freaking douglas booth bloody hell top not
-1	rt amazingcast the riot club cast http t co t2tttioip6
-1	no more ten on the riot club bestmovieever http t co dbc84ojabk
-1	m0ckingjaylives omg the riot club
-1	lone scherfig e the riot club ad istanbul film festival 2015 https t co jabdcexbll via youtube
-1	through one of the actors from the last movie i watched i found a new movie called the riot club and it looks hella good
-1	the riot club
-1	random retweets of things i tweeted weeks months ago always puzzle me who cares tonight that i watched the riot club almost a month ago
-1	rt scribehard nowwatching sam claflin max irons douglas booth and jessica brown findlay in lone scherfig s the riot club http t c
-1	rt alexandrearr max irons douglas booth sam claflin the riot club ace http t co 8kgym22in3
-1	rt hotinsantafe harry lloyd paul crosley in manhattan plays lord riot in the riot club opening fri at jean cocteau trailer http
-1	the riot club
-1	eawillz mar3ntaylor can we riot in front of the club house
-1	the riot club
-1	see as i calm my anger to a riot i feel for ronny he should be looking at the treble after what he s done doing to the team and club
-1	lone scherfig e the riot club ad istanbul film festival 2015 http t co am5fe6ilul
-1	thought i saw the actor who played warleggan before he was in the riot club poldark
-1	he s in the riot club
-1	can t believe the lead singer in that band years amp years was one of the cunts in the riot club
-1	rt apollo_magazine riotous romans in paris parisart1 reviews the baroque underworld at the petitpalais_ http t co zs2gtkqlxu http
-1	foto the riot club directed by lone scherfig 2014 http t co q4eahtpozk
-1	harry lloyd paul crosley in manhattan plays lord riot in the riot club opening fri at jean cocteau trailer http t co jcjvbj1abp
-1	the riot club
-1	having mixed emotions after watching the riot club i m mostly angry though
-1	thanks for the letter of recommendation nytimes http t co 7cjoe2oygp theriotclub http t co clspgolrhs
-1	about to watch the riot club fuck yes i ve been waiting for this moment for ages
-1	don t watch the riot club unless you re okay with be angry with all of the main characters for 95 of the film
-1	the riot club not my kind of movietime
-1	the riot club movietime
-1	the riot club full movie watch now http t co qbukuvhdiu http t co v0nvinnbcz
-1	anyone seen the riot club is it any good
-1	_bashton the_riot_club
-1	i saw the riot club and miles was just wow and alistair too
-1	the riot club nw
-1	rt realsaltlake thanks again to the 20 414 rsl fans that made tonight s riot sellout the club s 19th straight and 25th in last 30
-1	while on topic here s charles http t co fafpoi3vjl
-1	the riot club
-1	still not over the guy from years and years being in the riot club
-1	the riot club da bomb
-1	rt amxrabakri the riot club is so impulsive it scares me dynabakri repulsive omg i told you like a million times already
-1	the riot club is so impulsive it scares me dynabakri repulsive omg i told you like a million times already
-1	the riot club
-1	the riot club
-1	the riot club 2014 http t co 6qqwzu4o43
-1	the riot club 2014 http t co mlqtxdty6u
-1	the riot club 2014 http t co di5wz7nihy
-1	the riot club 2014 http t co 53u04dgrh7
-1	the riot club 2014 http t co sy1wtw7pvm
-1	the riot club 2014 http t co c1dof5ulkn http t co cb4g0esnaj
-1	the riot club 2014 http t co akaljenblx http t co viswaa9yrj
-1	the riot club 2014 http t co fdravz1vx8
-1	might watch the riot club it s got some top men in
-1	there are only a few movies that really disappointed me out there and those were movie 43 cabin in the wood and riot club sorry
-1	rt you_watch_it 413 the riot club http t co syeawf0ox1
-1	the riot club was trash i regret every minute of watching it douglas booth was though
-1	started to watch the riot club but i had to turn it off because the boys in it were breaking my heart
-1	rt you_watch_it 413 the riot club http t co syeawf0ox1
-1	the riot club is such a good film wow
-1	the riot club dvd gt gt http t co 82kpgjqc0k lt lt movies dvd bluray horror actionmovies romanticmovies http t co ite6zwou51
-1	the riot club
-1	the riot club is such a great movie
-1	rt realsaltlake thanks again to the 20 414 rsl fans that made tonight s riot sellout the club s 19th straight and 25th in last 30
-1	rt realsaltlake thanks again to the 20 414 rsl fans that made tonight s riot sellout the club s 19th straight and 25th in last 30
-1	rt realsaltlake thanks again to the 20 414 rsl fans that made tonight s riot sellout the club s 19th straight and 25th in last 30
-1	rt realsaltlake thanks again to the 20 414 rsl fans that made tonight s riot sellout the club s 19th straight and 25th in last 30
-1	rt realsaltlake thanks again to the 20 414 rsl fans that made tonight s riot sellout the club s 19th straight and 25th in last 30
-1	rt realsaltlake thanks again to the 20 414 rsl fans that made tonight s riot sellout the club s 19th straight and 25th in last 30
-1	rt realsaltlake thanks again to the 20 414 rsl fans that made tonight s riot sellout the club s 19th straight and 25th in last 30
-1	so the riot club about that
-1	rt realsaltlake thanks again to the 20 414 rsl fans that made tonight s riot sellout the club s 19th straight and 25th in last 30
-1	rt realsaltlake thanks again to the 20 414 rsl fans that made tonight s riot sellout the club s 19th straight and 25th in last 30
