-1	and that s it for another year a bit gutted with the time but a bronze medal tonight in the 200 massive congrats to queenmond brill swim
-1	congratulations to nicola heron gbr bronze medalist at the 2015 world pigeon championship in spain well done http t co fiok5cw49k
-1	get your summer glow on come by the spa for tanning services to get bronze and beautiful without baking in the sun http t co pa6cevtipg
-1	rt mikkitowler rare early victorian bronze shop sign provisions just on the website mx http t co ogn6df0vuo
-1	brainclouds what do you want in a dragon age game do you think everyone in the bronze age used plenty of bronze p
-1	the altar was built exodus 27 1 the bronze altar also became know as the altar of burned offering bereanworships
-1	i finished 1st at the bronze tournament in quiz run my username is erikahill download this app to challenge me http t co ijnarotc0i
-1	long day two bronze medals last competition for the moment swimming
-1	i finished 1st at the bronze tournament in quiz run my username is strider download this app to challenge http t co flnyjuwpoq
-1	rt britathletics ultrabritton reflects on world bronze and team gold at the iau 24h world and european champs http t co en51tbjea1
-1	rt agon_sm elliefaulkner picks up bronze in 200 freestyle and nick_grainger makes top 4 in the men s both in relay spots for kazan20
-1	hey atviassist do you know how to change the league best because mine won t change from bronze when it should be gold on bo2 please help
-1	np raekwon ghostface killah heavenrazah eternal of the killa beez ill methods killah priest enza cappadonna bronze nazareth kevlaa
-1	beauty of the day http t co bhbdpduvtb 32924 self tanning kit sunless beauty face amp body deep bronze mitt amp ba http t co vi68p1gr5u
-1	rt gbtaekwondo it s a bronze win for geeorgiabarnes at the moldovaopen2015 congrats
-1	aqua glow in the dark necklace collectible bronze chain findings 18in chain bonanza http t co yrdnfbh7av http t co vvcwlnzo4t
-1	i will go before you amp level the mountains i will break to pieces the doors of bronze and cut assunder the bars of iron
-1	rt ytcst well done to the ytcst u16 s today coach s players of the day are scott j gold george m e silver lloyd f bronze ytfc
-1	the bronze dofe group did really well on day one of their practise walk and just cooked dinner http t co swl1iultly
-1	rt hacksforgirls the body shop honey bronze shimmering dry oil wow http t co ddrlv3s6gl
-1	2kstauff ld2k nba2k15needs the badges re evaluated lower level nba players need more bronze silver badges to balance the gameplay
-1	rt gbtaekwondo it s a bronze win for geeorgiabarnes at the moldovaopen2015 congrats
-1	it s a bronze win for geeorgiabarnes at the moldovaopen2015 congrats
-1	rt kushnbae my girlfriend isn t allowed to play the lottery she already won the jackpot when she met me
-1	elliefaulkner picks up bronze in 200 freestyle and nick_grainger makes top 4 in the men s both in relay spots for kazan2015 _teamsteel
-1	1888 great blizzard paralyzes the east franklin mint solid bronze medal http t co bf6oi1vpe8 http t co vn8vzjgeay
-1	commonwealth games bronze medallist calum jarvis takes bronze in the open 200m freestyle final at british swimming championships in london
-1	rt savagetrvp_ don t lose your girl tryna be cool in front of your niggas cause in the end she might be the only one that has your ba
-1	rt diverdamo sam takes the bronze medal on 1m at 2015 adc leedsdiving http t co l3btqjmzhj
-1	sam takes the bronze medal on 1m at 2015 adc leedsdiving http t co l3btqjmzhj
-1	rt michaelny11731 ballroom20line sdccnerdsattack sdccgotgirl hallhline that s a lot of juice h just lapped itself the gold and bron
-1	i beat the bronze league in csr classics for android get it free http t co rjdfnrut83
-1	mametown flula go visit the bronze fonz heyusa
-1	rt elliedownie first senior euros done a bronze in the aa final yesterday amp 5th on vault and 4th on bars today couldn t be happier
-1	red franz one of the dozens of bog bodies discovered in germany throwing fresh light on bronze and iron age http t co n4evq8guzc
-1	rt digitour ticket update the last 9 bronze vip s at digifestma last 9 massachusetts gt http t co 7kksgzgkoc lt rt http t
-1	ladiesonspyders just so you ladies know i still have a lava bronze trailer in the crate only 3999 please call me if interesed 5032382510
-1	bronze artefacts suggest east asia traded with the new world 2 600 years ago http t co x9z5qilrbg
-1	1888 great blizzard paralyzes the east franklin mint solid bronze medal http t co w562utm3mt http t co xtzuybrkth
-1	walter crosses over w the cortexiphan kids but three don t survive bronze statue of liberty walternate wrote zft in 1995 fringe
-1	earned 5 ps3 trophies 2 bronze and 3 silver in need for speed the run http t co qg9cdnunrd
-1	user guest 328adb5 is awareded with the bronze medal by sweetjewelsgame get it on googleplay http t co 7zkaxo8ohu
-1	mametown flula go find the bronze fonz
-1	rt music_columbia bronze class learning about pitch by helping jack climb the steps up the slide http t co 2qrmlqwokw
-1	rt thefarahkhan the girls win their 1st golds n czar his 1st bronze he s always won golds b4 life s lessons taught early http t c
-1	amp amp i get the bronze state4n6
-1	mlb_pi is my roster glitched or do the angels don t have any players that can be trained or ranked up they re all bronze
-1	check out this item in my etsy shop https t co vzpyxjzp2a
-1	1888 great blizzard paralyzes the east franklin mint solid bronze medal http t co 7491oudbir http t co tgpmjjzkmc
-1	rt richsimmondsza friendship is born at that moment when one person says to another what you too i thought i was the only one c s
-1	50latersbaby where does ny get the funding for alll the bronze statues
-1	a look at a manufacturer of statues for civil war monuments the monumental bronze co of bridgewater connecticut http t co do3u3qojum
-1	saifnaminc i haven t played fifa since 1 year but silvers and bronze can defeat gold easy with the right formation
-1	then the philistines took him and put out his eyes and brought him down to gaza they bound him with bronze fetters judges 16 21
-1	photo iconic bronze lions at the art institute of chicago http t co 3ar90hiuhr via holeinthedonut
-1	when you need to mark your yard for landscape and the only spray paint you have is bronze blaze glitter blast girlproblems
-1	ballroom20line sdccnerdsattack sdccgotgirl hallhline that s a lot of juice h just lapped itself the gold and bronze medal to hallh
-1	i m in masters division and i get matched with bronze like the fuck are you guys retarded advancedwarfare
-1	photo ootd headed out to the shops to run errands no makeup with hopes to return a little more bronze http t co fruho36mb4
-1	ootd headed out to the shops to run errands no makeup with hopes to return a little more bronze https t co w9wpl4jgsg
-1	antique vintage bronze statue william shakespeare the bard ornament figurine http t co 8xe3xlfthc http t co vnnfvnqeqd
-1	queens of the stone age the bronze https t co rmnfzcbuoz
-1	well done to the ytcst u16 s today coach s players of the day are scott j gold george m e silver lloyd f bronze ytfc
-1	rt thefarahkhan the girls win their 1st golds n czar his 1st bronze he s always won golds b4 life s lessons taught early http t c
-1	rt thefarahkhan the girls win their 1st golds n czar his 1st bronze he s always won golds b4 life s lessons taught early http t c
-1	well done to the ytcst u14 s today coach s players of the day are harvey b gold tom p silver ellis d bronze ytfc
-1	rt thrmovies sundance opening film the bronze gets summer release date http t co ucp1yi2ovb http t co 2vt8djjho8
-1	rt variety melissa rauch s thebronze will debut in july http t co j7rmwpfjhi http t co 5qeqed0eae
-1	trying out the cocoa brown gentle bronze gradual tanner from this evening looking forward to seeing if it gives http t co srrahmcxwz
-1	earned 27 ps4 trophies 17 bronze 4 silver 5 gold and 1 platinum in the wolf among us http t co ujv4edv9a9
-1	rt thebigbangbuzzz melissarauch s the bronze will be hitting theaters in july http t co ei17tfqqju
-1	rt fakejackiegeary variety melissa rauch s the bronze set for july release http t co w5ruqtmgz8 get ready for the unadulterated ge
-1	rt gymcastic melissa rauch s gymnastics film the bronze set for july release http t co ad9ujwtfnf we talked about it this week on th
-1	rt elliedownie first senior euros done a bronze in the aa final yesterday amp 5th on vault and 4th on bars today couldn t be happier
-1	earned 1 ps4 trophy 1 bronze in the crew http t co p9vxh7ehfq
-1	rt sulagnamisra the bronze is coming july 10 july 31st you guys and i am so there http t co 4f26kmzvo6
-1	rt mayalouu_ when you finally get past that awkward stage in the friendship or relationship gt gt gt gt gt
-1	rt momknwsshopping htr sundance opening film the bronze gets summer release date http t co jmtjymhgxd
-1	rt elliedownie first senior euros done a bronze in the aa final yesterday amp 5th on vault and 4th on bars today couldn t be happier
-1	rt purvisdanny so happy to get the bronze in the europeans all round competition today big battle and good luck to are guys in the final
-1	that was bronze level throws who do they think they are dignitas lcs lolesports that play could potentially cost them the game
-1	rt elliedownie first senior euros done a bronze in the aa final yesterday amp 5th on vault and 4th on bars today couldn t be happier
-1	the game was a real challenging medcy still nailed it although it was just a bronze but i was https t co 1iuhnwiblj
-1	rt elliedownie first senior euros done a bronze in the aa final yesterday amp 5th on vault and 4th on bars today couldn t be happier
-1	rt elliedownie first senior euros done a bronze in the aa final yesterday amp 5th on vault and 4th on bars today couldn t be happier
-1	rt thefarahkhan the girls win their 1st golds n czar his 1st bronze he s always won golds b4 life s lessons taught early http t c
-1	earned 4 ps3 trophies 4 bronze in lego the lord of the rings http t co yk1cb78pao
-1	rt sonusood thefarahkhan what if he s won a bronze czar will always be a winner n will remain on the top n above everyone http t
-1	the ultimate beauty guide the body shop honey bronze shimmering dry oil via pinterest taylornmx http t co ooejtflgfv
-1	first senior euros done a bronze in the aa final yesterday amp 5th on vault and 4th on bars today couldn t be happier
-1	i beat the bronze league in csr classics for android get it free http t co m0mkanxkt6
-1	online set marry with be in existence nfl issue of the day pis aller exploitable bronze colored packers vs http t co ofjnjsgjij
-1	rt thefarahkhan the girls win their 1st golds n czar his 1st bronze he s always won golds b4 life s lessons taught early http t c
-1	rt digitour ticket update the last 9 bronze vip s at digifestma last 9 massachusetts gt http t co 7kksgzgkoc lt rt http t
-1	rt goalballuk in intermediate region x kirkleesgb triumphed over moor_end 12 4 to clinch the bronze medal
-1	my face when bih says they rap wannabe localartists why are you entertaining caramel_bronze da_afrikan_diva http t co fco0bts6fo
-1	rt vintage_trix vintagetouch of the day a bronze cuff with mini gold disks from monsoon circa 1980s https t co jymiegvt6p
-1	rt lindybooth rendering of my name in linear b the first greek writing from the bronze age thelibrarians fanartfriday love it http
-1	congratulations to the men s 3 meter synchro medalists japan takes gold malaysia silver and china bronze http t co ginx4chlbw
-1	rt life_of_jayz please lord forgive him has he lost his religion is the greed gon get him he s having heaven on earth will his wi
-1	shake4ndbake the packs have emerald ruby gold silver and bronze if they put the onyx in for the price of 8 400 vc u are getting it all
-1	huge news from 1972 olympic bronze medallist janet lynn the 2015 world figure championship and figure festival http t co k4cvmhhiac
-1	rt tds_teddington today s dance competition 2 gold medals 1 silver amp 1 bronze medal team tds teddington_town the_local_card http
-1	earned 4 ps4 trophies 4 bronze in lego the hobbit http t co vrevuy4ypv
-1	rt sonusood thefarahkhan what if he s won a bronze czar will always be a winner n will remain on the top n above everyone http t
-1	rt sonusood thefarahkhan what if he s won a bronze czar will always be a winner n will remain on the top n above everyone http t
-1	rt thefarahkhan the girls win their 1st golds n czar his 1st bronze he s always won golds b4 life s lessons taught early http t c
-1	digitour can we meet jack and jack if we buy the vip bronze
-1	rt thefarahkhan the girls win their 1st golds n czar his 1st bronze he s always won golds b4 life s lessons taught early http t c
-1	prodnose that bronze hand you talked about at your home today may be opening and closing the flue in a nearby chimney building surveyor me
-1	caramel_bronze swear she is an artist bahahahaaaaa stop it she been dropping beats ican t da_afrikan_diva she ain t no nickiminaj
-1	rt sonusood thefarahkhan what if he s won a bronze czar will always be a winner n will remain on the top n above everyone http t
-1	rt hopworksbeer we picked up medals at the australian international beer awards amp brussels beer challenge a gold silver amp 2 bronze htt
-1	a look at a manufacturer of statues for civil war monuments by the associated press the monumental bronze co of http t co numtrhzcde
-1	rt beautybychriss i am so honored and excited to serve as the 2015 2016 president of bronze elegance umich_be
-1	rt lindybooth rendering of my name in linear b the first greek writing from the bronze age thelibrarians fanartfriday love it http
-1	today s dance competition 2 gold medals 1 silver amp 1 bronze medal team tds teddington_town the_local_card http t co wkldssqw3n
-1	i won 1st place in the bronze league in csr classics for android now you try http t co 08r2irwurn
-1	rt sonusood thefarahkhan what if he s won a bronze czar will always be a winner n will remain on the top n above everyone http t
-1	rt thefarahkhan the girls win their 1st golds n czar his 1st bronze he s always won golds b4 life s lessons taught early http t c
-1	i wish the sun made me bronze i would go tanning
-1	i came top of the bronze league in csr classics for android get it for free now http t co sgkxmgvfga
-1	earned 6 ps4 trophies 2 bronze 3 silver and 1 gold in the walking dead season 2 http t co qhq7m3dzpp
-1	i will get the destiny plat soon i want to complete the gold trophies first then the bronze silver
-1	https t co mzhfvludyg thanks jan for remembering the hitching post with bronze jan is familiar with sam donaldson http t co aplacmfuii
-1	shake4ndbake the adidas would be good if they had no bronze onyx and 9330 as the price
-1	ohio a look at a manufacturer of statues for civil war monuments the monumental bronze co of bridge http t co yf1rfdyyfg whiotv
-1	jess fullalove bronze in the british swimming champs very well done a great achievement amp youngest on the podium http t co jubsuhsb64
-1	luck o the irish inspired bronze wine glass charms set of 5 holiday charms handmade wine char https t co elvxi2q6k4 etsy geekywine
-1	if my whole body got as much sun as my driving arm did i d be a bronze goddess all the time
-1	armyuber sissitech i was hoping my live fire video would load it was a bronze m1857 napoleon 12 lb gun smoothbore drilled the target
-1	rt sonusood thefarahkhan what if he s won a bronze czar will always be a winner n will remain on the top n above everyone http t
-1	rt thefarahkhan the girls win their 1st golds n czar his 1st bronze he s always won golds b4 life s lessons taught early http t c
-1	rt bodminpe camp set up at penhale for the bodmincollege amp foweyacademy bronze dofesouthwest dofe practice expedition http t co r
-1	concerned3013 ultrasonic888 the bronze serpent is to avoid poison bitten by snakes bcoz of hardheaded israelites but not to wrship or bow
-1	us a look at a manufacturer of statues for civil war monuments the monumental bronze co of bridgewate http t co mwpv6x5a5g news
-1	a look at a manufacturer of statues for civil war monuments the monumental bronze co of bridgewater connect http t co jpflxiiknw
-1	rt qmartinez central s matthew childress 3rd triple jump and the 400 relay also were on the award stand with bronze medals stpreps
-1	rt btitracy here goes gruff in the 11s 100m breast stroke really close for the bronze but a fabulous 5th place well done
-1	borderlands the pre sequel 360 no scope bronze ps4share id like to thank halo for preparing me http t co nle0cnem8h
-1	3novices a look at a leading manufacturer of soldier statues for civil war monuments http t co 8xmvkycfro the monumental bronze co of
-1	earned 3 ps4 trophies 3 bronze in borderlands the pre sequel http t co 6sgi9x5xvk
-1	rt thefarahkhan the girls win their 1st golds n czar his 1st bronze he s always won golds b4 life s lessons taught early http t c
-1	rt btitracy here goes gruff in the 11s 100m breast stroke really close for the bronze but a fabulous 5th place well done
-1	rt sonusood thefarahkhan what if he s won a bronze czar will always be a winner n will remain on the top n above everyone http t
-1	rt digitour ticket update the last 9 bronze vip s at digifestma last 9 massachusetts gt http t co 7kksgzgkoc lt rt http t
-1	nyt http t co jhcljo6ijs a look at a manufacturer of statues for civil war monuments the monumental bronze co of bridgewater conne
-1	rt thefarahkhan the girls win their 1st golds n czar his 1st bronze he s always won golds b4 life s lessons taught early http t c
-1	new sponsor thank you tiffany israel for your bronze sponsorship to the 5th annual carter s walk 4 cured http t co ay0jnnjpdq
-1	a look at a leading manufacturer of soldier statues for civil war monuments the monumental bronze co of brid http t co qhc5efpypg
-1	a look at a leading manufacturer of soldier statues for civil war monuments the monumental bronze co of brid http t co aiwuj1sijy
-1	fox news a look at a leading manufacturer of soldier statues for civil war monuments the monumental bronze c http t co tzoelspkoq
-1	congrats to us ice skaters for winning gold in the world team competition and to russia silver and japan bronze http t co jliy91lhn8
-1	mametown flula go see the bronze fonz brewers game the zoo and the domes also sobelmans has the best bloody mary s in town
-1	last day at the bronze boutique bittersweet
-1	mametown flula heyusa the bronze fonz downtown heyusa
-1	digitour are the gold amp bronze now on sale for san diego
-1	mametown flula go visit the bronze fonz and have some real chili heyusa
-1	the red bronze amp copper look great together faucet handle tp holder http t co aqsfi2yfll industrial steampunk decor bathroom
-1	photo holy family in egyptone of the panels of the huge bronze door of il duomo the basilica di santa m http t co mtneyse0oe
-1	the results are in we took the bronze award for best of springs 2015 we are excited beyond belief we couldn t http t co tvqbra7wec
-1	guess what i get for making it to finals of the prime 2v2 a bronze
-1	kesharose i can tell time with my jordan s son of man clay and the iron my feet are bronze and hair like wool http t co 5mst6nmnaa
-1	rt thefarahkhan the girls win their 1st golds n czar his 1st bronze he s always won golds b4 life s lessons taught early http t c
-1	rt lindybooth rendering of my name in linear b the first greek writing from the bronze age thelibrarians fanartfriday love it http
-1	mehmet just took bronze medal in the 82kg category
-1	rt thefarahkhan the girls win their 1st golds n czar his 1st bronze he s always won golds b4 life s lessons taught early http t c
-1	rt ilovehachi today a bronze statue of hachiko sits in his waiting spot outside the shibuya railroad station http t co exzkbauh
-1	rt fivinicdeo the bronze cafe las vegas http t co grptdwmdbt
-1	rt sonusood thefarahkhan what if he s won a bronze czar will always be a winner n will remain on the top n above everyone http t
-1	wtf the worst thing about bronze people are the ones running around saying gg
-1	fifa 15 the cuadrado project 4 bronze players http t co v1utdt1ne9 via youtube
-1	jamiemchale72 4of8 in tonight s fly final qualified faster than andyjamesonswim olympic bronze from 88 olympics bsc15 amp the other 4
-1	rt torresbjjderry today one of our attendees travelled to the manchester open to compete he secured a bronze in the https t co s9pxya
-1	does anybody know the best bronze or silver players in 2k
-1	rt thedigisaur owchcarpenter digitour here r the differences between gold vs silver vs bronze vips http t co aa62gi11y1
-1	rt bodminpe camp set up at penhale for the bodmincollege amp foweyacademy bronze dofesouthwest dofe practice expedition http t co r
-1	a fantastic beautiful dofe day out with the lutthigh bronze groups well done everyone http t co ezotom5rym
-1	rt mackenzieshop sittin on the dock of the bay watching the tide oh how we cant wait to see this stunning bronze sculpture htt
-1	thank you so much tanya igic the gorgeous fine leather and silver bronze and the gunmetal grey bracelets have http t co ajjdikzyl7
-1	rt sonusood thefarahkhan what if he s won a bronze czar will always be a winner n will remain on the top n above everyone http t
-1	camp set up at penhale for the bodmincollege amp foweyacademy bronze dofesouthwest dofe practice expedition http t co rxi1fnbeij
-1	rt thefarahkhan the girls win their 1st golds n czar his 1st bronze he s always won golds b4 life s lessons taught early http t c
-1	rt thefarahkhan the girls win their 1st golds n czar his 1st bronze he s always won golds b4 life s lessons taught early http t c
-1	kris_witdatlean just tweeted the s heckle with details check it out
-1	rt britwheelbball huge congratulations to thecwba who take the u15 bronze medal with a 24 9 win v lowriderswbc great game ltjlf15
-1	here s the list of jomc week events including details on terrencej s appearance this thursday coming ncat http t co 7oywjju6sl
-1	steal of the day only 29 99 reg 39 99 brass or bronze lens honeycomb template bee decal http t co ltdexwveen
-1	rt thefarahkhan the girls win their 1st golds n czar his 1st bronze he s always won golds b4 life s lessons taught early http t c
-1	rt digitour ticket update 6 bronze vips left for digifest ma meet ur baes in the vip tent http t co lw1k1dvzd4 rt http t co
-1	rt thefarahkhan the girls win their 1st golds n czar his 1st bronze he s always won golds b4 life s lessons taught early http t c
-1	rt digitour ticket update the last 9 bronze vip s at digifestma last 9 massachusetts gt http t co 7kksgzgkoc lt rt http t
-1	rt thefarahkhan the girls win their 1st golds n czar his 1st bronze he s always won golds b4 life s lessons taught early http t c
-1	huge congratulations to thecwba who take the u15 bronze medal with a 24 9 win v lowriderswbc great game ltjlf15
-1	rt fisunetwork chinese taipei takes the bronze at korfball uni world cup def great britain 1 31 22 in uniofeastanglia bucssport e
-1	rt thefarahkhan the girls win their 1st golds n czar his 1st bronze he s always won golds b4 life s lessons taught early http t c
-1	congratulations to the fhs forensics team for their performances today at state forensics andy received a bronze http t co i6y9zfqhkc
-1	mametown flula check out the bronze fonz southeast corner of wells st and the riverwalk
-1	beachheadstudios take the brackets and all the same as they were in bronze division up to diamond http t co jlmmnko7bx
-1	rt hollyhuntdesign discover the fascinating processes that go into creating our hollyhuntdesign cast bronze pieces https t co vzulkl
-1	rt btitracy here goes gruff in the 11s 100m breast stroke really close for the bronze but a fabulous 5th place well done
-1	rt thefarahkhan the girls win their 1st golds n czar his 1st bronze he s always won golds b4 life s lessons taught early http t c
-1	rt sonusood thefarahkhan what if he s won a bronze czar will always be a winner n will remain on the top n above everyone http t
-1	here goes gruff in the 11s 100m breast stroke really close for the bronze but a fabulous 5th place well done
-1	rt goalballuk in intermediate region x kirkleesgb triumphed over moor_end 12 4 to clinch the bronze medal
-1	the second group of bronze girls are ready rock bars http t co mxo5nqveao
-1	kilroyfirelizrd that isn t an actual guitar is something i haven t slept and i ve had the worst day and stop judging me
-1	in intermediate region x kirkleesgb triumphed over moor_end 12 4 to clinch the bronze medal
-1	sittin on the dock of the bay watching the tide oh how we cant wait to see this stunning bronze sculpture http t co 9pffrlzj9k
-1	photo blackhistoryalbum the bronze blond bombshell joyce bryant vintage black glamour african american http t co ttqcjwftt2
-1	with the return of the coyote in manhattan i m deeply intrigued elizabethdorbad cast bronze stay away come closer http t co pzpy3tn8lk
-1	r9rai the fifa 13 bronze god
-1	bronze casting the newest addition of native art at stanley park http t co k5hawolsvu
-1	going home after a good day in the hall ending with a silver and a bronze medal happy yes http t co ch0eicpc6z
-1	working on clay elephant commission in the studio destined for bronze i m transported back here grantcumings http t co tgicnplvu8
-1	earned 6 ps3 trophies 6 bronze in where the wild things are http t co acxicmmt83
-1	jamesmac23 hi james the u15 final between northern ireland wbc and cwsc phoenix is next up on court the bronze games are in last 3mins
-1	rt lonernigga drunk text me i want to be the one you think of when you can t think straight
-1	a giacommetto bronze scheduled for auction during the may sale has a high estimate of 130 million
-1	ultrasonic888 can u explain why god commanded making graven images bronze serpent cherubims of the ark inside temple prince_ayiel09
-1	rt lindybooth rendering of my name in linear b the first greek writing from the bronze age thelibrarians fanartfriday love it http
