-1	the game of thrones lovers now have an app to relive got times download mojo earn rewards http t co uwzadyyzzt http t co d1gjexj8c2
-1	rt kateloving 365 prayer prescriptions for dog and cat lovers http t co 4kfy8gfab6 amazoncart
-1	walking down 17th street yesterday to teach the first meetup photography lovers class https t co ltkz00bnrl
-1	the worst tattoo mistakes http t co suub6wmek7
-1	the worst tattoo mistakes http t co 1xdaycq9ip
-1	rt therealstafford when people say think outside of the box my response is oh there was a box go live today lovers
-1	rt matt_dominguez puppy lovers against the ncchamber ncfarmbureau ncaggag bill ncpol stopanimalabuse http t co b9fisujzrk
-1	rt skyetownsend https t co mydtpjmarw for all the tamia toni braxton beyonce lauryn hill amel larrieux lovers
-1	good aftanoon to all the reggaemusic lovers around the world reggae rules the world onelove jso
-1	365 prayer prescriptions for dog and cat lovers http t co 4kfy8gfab6 amazoncart
-1	let me go to the park and watch lovers love each other
-1	layinka15 abeg free the dude free thinkers and lovers of knowledge like him give it to him the guy is good and intelligent
-1	to the pink lovers in illinois and wisconsin head over to woodman s food market to pick your sweet revenge for http t co syzo9lyczn
-1	rt 666timmy repost exclusivevapes with repostapp for all you lemon lovers our newest flavors of the week https t co pmwjki0hqy
-1	rt s_m_i some word lovers will argue that the alternatives to text dumb down journalism but i disagree same http t co unvnenuys2
-1	rt wendylovesvinyl and falalalalalalalala the winnipegfolk store wants to open at 11 00 on rsd2015 and you call yourself music lov
-1	vinyl lovers across the world are celebrating recordstoreday today http t co ouo2ckletl http t co fjuqh0snoq
-1	prettttty rt citylab it s time to break out the crayons for this city themed coloring book http t co enahulufws http t co kha6xb4loq
-1	the change in direction mystic lovers http t co 49a4mk18iv
-1	rt 1enlightenedcat what the planet needs is more peacemakers healers restorers and lovers http t co bvx52iby2x
-1	rt destisurf arnaudderosnay gentleman of the extrem a great book for ocean lovers http t co eyyfhhb3zb windsurf http t co 9sok8qx1og
-1	and falalalalalalalala the winnipegfolk store wants to open at 11 00 on rsd2015 and you call yourself music lovers noloveforus
-1	are we in the clear yet good saying it s gonna be alright got a long list of ex lovers but the players have to play play play
-1	womens fiction lot of 3 vintage books d h lawrence sons and lovers the rainbow women in http t co qfvnrlixxw womensfiction book
-1	rt citylab it s time to break out the crayons for this city themed coloring book http t co rjv5y2x0lc http t co cvzeu26o28
-1	rt wyzechef parents lovers friends and family of a troubled black person please don t ever call the police on them
-1	rt wyzechef parents lovers friends and family of a troubled black person please don t ever call the police on them
-1	rt equipawspets the miami dog lovers daily is out http t co boch4azzoy stories via lizcpro candicemagowan dhvw61
-1	might as well be lovers on the sun
-1	establishment politicians getting caught in sex scandals hope none involving children if so nail them to the wall http t co vjtcae7wls
-1	rt _demondean things sam hates the deaths of all his past lovers not being able to have a dog me dying and stuff low ceilings good food
-1	the game of thrones lovers now have an app to relive got times download mojo earn rewards http t co uwzadyyzzt http t co zlv4cihdwq
-1	rt forbes ben amp jerry s concocted a new indulgence to satisfy the munchies for ice cream lovers http t co o9eao34piu http t co qcn2h
-1	rt theaquariusmind aquarius are so in their head love does not come fast or easy but when it does they are some of the most passionate l
-1	the game of thrones lovers now have an app to relive got times download mojo earn rewards http t co uwzadyyzzt http t co qmzbhqu1cw
-1	rt matzucker excited to hear from jay spencer of dog lovers community barkyard in bangkok monocle how to reinvent the high street
-1	honey go stand in front of the virginia is for lovers sign and make a sad face i ll take a picture thanks for that mom
-1	the world according to cats cat lovers http t co kgrlwnlqrl
-1	i just remember how we we re called the star crossed lovers
-1	we have a happy surprise for you macaron lovers on this hot sunny saturday the one and only blood orange http t co fxrhtaxaov
-1	joaquin_lovers he s playful but i like his candidness and sincerity he s straight to the point
-1	rt tylerdennen the lovers the devil is a true story
-1	my lovers the sunlight
-1	repost exclusivevapes with repostapp for all you lemon lovers our newest flavors of the week https t co pmwjki0hqy
-1	this is for all the wine lovers planning to visit barcelona in the near future here are some wineries to visit http t co u0djagcy9u
-1	rt konbini we spoke to the brains behind waxandstamp the vinyl subscription service for music lovers http t co pcq1xq7sme http t c
-1	rt citylab it s time to break out the crayons for this city themed coloring book http t co rjv5y2x0lc http t co cvzeu26o28
-1	rt citylab it s time to break out the crayons for this city themed coloring book http t co rjv5y2x0lc http t co cvzeu26o28
-1	rt citylab it s time to break out the crayons for this city themed coloring book http t co rjv5y2x0lc http t co cvzeu26o28
-1	shoe lovers psa get thee to saks in chevychase for the louboutinworld trunk show and take this https t co 1iqk8cf215
-1	rt imangelinavalen watch the movie free http t co rmwesxwmif big boob lovers dream come true diamond ng12 pornstarpress http t
-1	i made2one of my lovers the one i live with guess he will be glad hikershell drunkinkiss twajole hardytlc http t co tkopwdx87z
-1	lewis takes provisional pole on the used set of option tyres don t be surprised if times shoot up in 4 minutes time bahraingp
-1	the game of thrones lovers now have an app to relive got times download mojo earn rewards http t co uwzadyyzzt http t co fwjc6cw85t
-1	kyungsbooty look i thought you said that you repent but the feels still inside youu crawls towards you
-1	for all you lemon lovers our newest flavors of the week are teetotaler lemon custard amp a very popular xxx http t co qakhxodejp
-1	for all you lemon lovers our newest flavors of the week are teetotaler lemon custard amp a very https t co q09ychwq2j
-1	rt armyofnathan happy birthday nathansykes wishing you all the best made this myself http t co 4wxar6ghdq
-1	rt waseemaqeel7 watch lovers of mr altafhussain mqm the liberal public who hates status quo amp extremism http t co cre4as3tck maihoo
-1	listen to enjoy the ride social lovers by cherries records np on soundcloud https t co q464smqprj
-1	rt citylab it s time to break out the crayons for this city themed coloring book http t co rjv5y2x0lc http t co cvzeu26o28
-1	rt imangelinavalen watch the movie free http t co rmwesxwmif big boob lovers dream come true diamond ng12 pornstarpress http t
-1	all but daniel ricciardo are on used tyres so the mercedes will come out again for the final showdown at the end bahraingp
-1	josh hartnett regrets turning down christopher nolan s batman josh hartnett penny dreadful the lovers http t co 9dzfdn00ll
-1	the game of thrones lovers now have an app to relive got times download mojo earn rewards http t co yrdayylb5r http t co tywxhpjvcv
-1	he s playful but i like his candidness and sincerity he s straight to the point
-1	the game of thrones lovers now have an app to relive got times download mojo earn rewards http t co uwzadyyzzt http t co wpyhn4rwmm
-1	rt nathansykes ashleytabor well done for correcting the typo
-1	rt nathansykes thank you all so much for the birthday love
-1	the complete bunny guide for rabbit lovers pet lover reveals astonishing secrets guaranteed to thrill and ma http t co apejvuhbkp
-1	photoshopskills architecture_lovers the spelling bee toolbox tm http t co v7flnezimr earn 60 on our pop http t co nxa584zrju
-1	rt princessfrance he s playful but i like his candidness and sincerity he s straight to the point naks joaquinredreyes https t co
-1	the planet desperately needs more peacemakers healers restorers story tellers and lovers of all kinds dalai lama
-1	rt matt_dominguez puppy lovers against the ncchamber ncfarmbureau ncaggag bill ncpol stopanimalabuse http t co b9fisujzrk
-1	rt matt_dominguez puppy lovers against the ncchamber ncfarmbureau ncaggag bill ncpol stopanimalabuse http t co b9fisujzrk
-1	rt konbini we spoke to the brains behind waxandstamp the vinyl subscription service for music lovers http t co pcq1xq7sme http t c
-1	dog lovers of the highest order merchandise and tour http t co ef7yxu65w6 via fidoseofreality
-1	calling all coffee lovers we have the best coffee but if you never try you ll never know http t co resceineen http t co s5frtvmim8
-1	jordan lovers check out the release dates for the new air jordan 13 lows hornets and the dover https t co csjzkwrpuq
-1	rt michael5sos it s the last day for you sexy lovers to win an award if you wanna vote you tweet 5sosfam bestfanarmy iheartawards if u
-1	ayodhya hills on the boundary of purulia district an ideal retreat to captivate the senses of nature amp forest lovers http t co iaqm7eqrv3
-1	back to the street where we began felling as good as lovers can you know https t co kwnt7foaog
-1	rt citylab it s time to break out the crayons for this city themed coloring book http t co rjv5y2x0lc http t co cvzeu26o28
-1	rt wyzechef parents lovers friends and family of a troubled black person please don t ever call the police on them
-1	repost washingtonlife shoe lovers psa get thee to saks in chevychase for the louboutinworld https t co gwspggbyc7
-1	rt citylab it s time to break out the crayons for this city themed coloring book http t co rjv5y2x0lc http t co cvzeu26o28
-1	newkdramaaddict kekeke i saw her ff her way through rosy lovers and i watched the last 2 eps with her honestly don t bother
-1	time for the real deal bahraingp
-1	rt wyzechef parents lovers friends and family of a troubled black person please don t ever call the police on them
-1	rt matt_dominguez puppy lovers against the ncchamber ncfarmbureau ncaggag bill ncpol stopanimalabuse http t co b9fisujzrk
-1	rt matt_dominguez puppy lovers against the ncchamber ncfarmbureau ncaggag bill ncpol stopanimalabuse http t co b9fisujzrk
-1	rt citylab it s time to break out the crayons for this city themed coloring book http t co rjv5y2x0lc http t co cvzeu26o28
-1	rt matt_dominguez puppy lovers against the ncchamber ncfarmbureau ncaggag bill ncpol stopanimalabuse http t co b9fisujzrk
-1	neighbors rt wyzechef parents lovers friends and family of a troubled black person please don t ever call the police on them
-1	rt poet_carl_watts imagination lovers can you get the picture of a cat barking awesometeam
-1	nowplaying david guetta lovers on the sun feat sam martin vem ouvir http t co 4tq11l0fjb
-1	in honor of the cmas tomorrow night in dallas only true lovers of country music will enjoy this great https t co 6qpk1cwrzt
-1	backstreet lovers the crookes
-1	calling gamers classical fans explore links between game soundtracks amp classical music http t co x1byg0w1oa http t co 07gvxk15ra
-1	rt citylab it s time to break out the crayons for this city themed coloring book http t co rjv5y2x0lc http t co cvzeu26o28
-1	we greeks are lovers of the beautiful yet simple in our tastes and we cultivate the mind without loss of manliness thucydides 450 bc
-1	justblaze they might have been animal lovers and they were mad that he left his dog on the car so they took his jewelry too
-1	tidus_37 the right food choice is very important especially in the developmental stages plus dog lovers like us go little crazy lol
-1	rt citylab it s time to break out the crayons for this city themed coloring book http t co rjv5y2x0lc http t co cvzeu26o28
-1	brucel whose hips would ever lack funk so entirely to sign a petition to ban the english disco lovers edl anyway
-1	damn this guy is officialskidrow s new singer the new cd should be smoking 10 000 lovers in one by tnt http t co rakcr2fcv9
-1	it s time to break out the crayons for this city themed coloring book http t co rjv5y2x0lc http t co cvzeu26o28
-1	one million lovers to choose from but none like her the only one for sure
-1	rt wyzechef parents lovers friends and family of a troubled black person please don t ever call the police on them
-1	rt designtaxi fascinating long exposure pictures reveal movements of sleeping lovers http t co p1quhhwrqm http t co tw9qfxirph
-1	rt promoicemoon_ch djsandb have u nice weekend music lovers https t co bytisztdev housemusic springtime support rickytenaglia ha
-1	i wonder how many people don t get the one they want but end up with the one they re supposed to be with
-1	i wonder how many people don t get the one they want but end up with the one they re supposed to be with
-1	all cricket lovers be part of the t20 cricket gala at rodeo gt http t co nwmposvnna http t co m1z1v0iwju
-1	rt djsandb have u nice weekend music lovers https t co hsdubb7jfw housemusic springtime support rickytenaglia hakeemsyrbram sph
-1	rt theaquariusmind aquarius are so in their head love does not come fast or easy but when it does they are some of the most passionate l
-1	i wonder how many people don t get the one they want but end up with the one they re supposed to be with
-1	hi fellow pet lovers i have several hobbies one of which includes helping to save the earth by upcycling and http t co unsxgcqy8x
-1	rt sofreshkulture fresh nugget gt you must listen to velvet season amp the hearts of gold truth machine for lovers by velvetseason https
-1	there was a thing that said swimmers make the best lovers did you not see that that was a bumper sticker waitwaitdonttellme
-1	rt ratmaff alright you film lovers of leeds keighley bradford yorkshire world ratmaff is coming the selection is here http t
-1	nowplaying david guetta lovers on the sun f sam martin quick edit 2014 listen http t co dz5wgeefru
-1	rt turnupda_ac for all those bagel lovers please come to brueggers today show the attached flyer and help support pitt fieldhockey http
-1	the magician will be addressing his followers lovers workers long live altafhussain
-1	rt huskyhogbbq we re ready for the bacon lovers of chicago huskyhogbbq baconfestchi baconfest chicago https t co el1rr8gpc6
-1	rt matt_dominguez puppy lovers against the ncchamber ncfarmbureau ncaggag bill ncpol stopanimalabuse http t co b9fisujzrk
-1	where are chelsea lovers on my tl funkyladki oxymoronic_me gangeshrawal let the festivities begin mateys
-1	i cannot figure out the dynamic between these two men across from me lovers cousins friends who slept together once and regret it
-1	rt tauseefkarimi watch lovers of mr altafhussain mqm the liberal public who hates status quo amp extremism http t co u6xnzbk5uk dmili
-1	rt cougarloversuk retweet if you think cougars make the best lovers http t co qwt3urmvu8
-1	rt entiretyinbits it was a sweet kiss a lovers kiss a good morning kiss and their last kiss she remembers it well imprinted in the place
-1	we might as well be lovers on the sun
-1	rt edessaorden_ scorpiozodiacc scorpio s are the best lovers
-1	record store day celebrates hometown vinyl shops portland maine ap music lovers are paying homage to the http t co oaw2h2hcii
-1	rt bye_twons for the riley lovers http t co qumy084bnw
-1	rt wyzechef parents lovers friends and family of a troubled black person please don t ever call the police on them
-1	scorpiozodiacc scorpio s are the best lovers
-1	rt airstreamandco the topgear boys aren t caravan lovers but airstreams are travel trailers right great to see richardhammond yest h
-1	rt priory_farm calling all beer lovers we are now stocking beers from the guildford based littlebeerco why not give them a try this we
-1	rt circleoflebanon don t you get fed up of the star crossed lovers tag though choclitsaturday
-1	hope outdoor gallery is listed as top 10 things texas art lovers need to experience stay tuned for lots more http t co 3hrlwnhkjr
-1	nowplay david guetta ft sam martin lovers on the sun ten2midnight rnb songs until midnight dianswara_fm jogjastreamers
-1	rt matt_dominguez puppy lovers against the ncchamber ncfarmbureau ncaggag bill ncpol stopanimalabuse http t co b9fisujzrk
-1	watch lovers of mr altafhussain mqm the liberal public who hates status quo amp extremism http t co cre4as3tck maihoonmqm na246
-1	rt tauseefkarimi watch lovers of mr altafhussain mqm the liberal public who hates status quo amp extremism http t co u6xnzbk5uk dmili
-1	we just let it bang underneath the covers not colors just lovers
-1	rt tauseefkarimi watch lovers of mr altafhussain mqm the liberal public who hates status quo amp extremism http t co u6xnzbk5uk dmili
-1	cnnpolitics why does caring about people and having a heart not square with the nra and gun lovers i applaud tim mcgraw
-1	rt psymon_h romance ebook lovers get your diary out because so the heart can dance by mary crawford is out april 24 asmsg http
-1	set de fotos thegrungechild which do you like the most for more beautiful and cheap clothe click here http t co 2iq2ramcm8
-1	rt theclassydog beautiful dog themed fine jewelry for the dog lovers http t co b7cedrlowa http t co s89rldoypu
-1	rt wyzechef parents lovers friends and family of a troubled black person please don t ever call the police on them
-1	rt matt_dominguez puppy lovers against the ncchamber ncfarmbureau ncaggag bill ncpol stopanimalabuse http t co b9fisujzrk
-1	rt tauseefkarimi watch lovers of mr altafhussain mqm the liberal public who hates status quo amp extremism http t co u6xnzbk5uk metp
-1	beautiful dog themed fine jewelry for the dog lovers http t co b7cedrlowa http t co s89rldoypu
-1	rt matt_dominguez puppy lovers against the ncchamber ncfarmbureau ncaggag bill ncpol stopanimalabuse http t co b9fisujzrk
-1	rt forbes ben amp jerry s concocted a new indulgence to satisfy the munchies for ice cream lovers http t co o9eao34piu http t co qcn2h
-1	rt matt_dominguez puppy lovers against the ncchamber ncfarmbureau ncaggag bill ncpol stopanimalabuse http t co b9fisujzrk
-1	rt wyzechef parents lovers friends and family of a troubled black person please don t ever call the police on them
-1	rt matt_dominguez puppy lovers against the ncchamber ncfarmbureau ncaggag bill ncpol stopanimalabuse http t co b9fisujzrk
-1	kaisoo_lovers kyungsbooty of course i know lah you re from malaysia the question is for your friend here
-1	rt matt_dominguez puppy lovers against the ncchamber ncfarmbureau ncaggag bill ncpol stopanimalabuse http t co b9fisujzrk
-1	rt dubaisayings i like some arabic songs its fine by me but why do the singers refer to their lovers as a male
-1	for all those bagel lovers please come to brueggers today show the attached flyer and help support pitt fieldhockey http t co mdrg0kylza
-1	rt matt_dominguez puppy lovers against the ncchamber ncfarmbureau ncaggag bill ncpol stopanimalabuse http t co b9fisujzrk
-1	the best relationship is when you can act like lovers and best friends at the same time
-1	rt matt_dominguez puppy lovers against the ncchamber ncfarmbureau ncaggag bill ncpol stopanimalabuse http t co b9fisujzrk
-1	rt huskyhogbbq we re ready for the bacon lovers of chicago huskyhogbbq baconfestchi baconfest chicago https t co el1rr8gpc6
-1	rt vodafonein t20 lovers here s the 21st question of the vodafonespeedquiz reply quickly and be a vodafone superfan hydvsdel http t
-1	rt matt_dominguez puppy lovers against the ncchamber ncfarmbureau ncaggag bill ncpol stopanimalabuse http t co b9fisujzrk
-1	rt matt_dominguez puppy lovers against the ncchamber ncfarmbureau ncaggag bill ncpol stopanimalabuse http t co b9fisujzrk
-1	loving the lesbian lovers in 4k http t co bdqgrbzomj hd kissing lesbian lickingvagina milf oralsex romantic smalltits
-1	david guetta lovers on the sun q dl de musica cara
-1	rt barnummeserve you can now buy cd copies of our album digital lovers can download the album in mp3 flac https t co lse9ebnwmz http
-1	we have ceviche for the sea food lovers we ll be here till about 8 30 9 00pm foodtruck
-1	rt centiass molokopretoria touchmixwellexperience iamtbotouch fistazmixwellbdaycelebtration for the house lovers tonight is 4 u http
-1	8 days away next stop for all my dd4l lovers the ultimate battle is coming to columbia https t co t6ewaa5zli
-1	rt matt_dominguez puppy lovers against the ncchamber ncfarmbureau ncaggag bill ncpol stopanimalabuse http t co b9fisujzrk
-1	we re ready for the bacon lovers of chicago huskyhogbbq baconfestchi baconfest chicago https t co el1rr8gpc6
-1	stigmata location chest the lovers back wheel of fortune ojoubot
-1	just saw a bumper sticker redneck women make better lovers and the driver was a 300 pound women smoking alrighty haha
-1	rt matt_dominguez puppy lovers against the ncchamber ncfarmbureau ncaggag bill ncpol stopanimalabuse http t co b9fisujzrk
-1	rt matt_dominguez puppy lovers against the ncchamber ncfarmbureau ncaggag bill ncpol stopanimalabuse http t co b9fisujzrk
-1	rt matt_dominguez puppy lovers against the ncchamber ncfarmbureau ncaggag bill ncpol stopanimalabuse http t co b9fisujzrk
-1	david guetta lovers on the sun official video ft sam martin let s light it up let s light it up http t co uclwuolzsz
-1	arscik_lovers the cool kid citraciki http t co loo4sqsub2
-1	rt laloveleashes this beagle shaped hotel is the ultimate vacation destination for dog lovers http t co 5y55op8q9z
-1	lewis storms through the field for a 1 32 669 miles ahead of everyone take that bahraingp
-1	rt tauseefkarimi watch lovers of mr altafhussain mqm the liberal public who hates status quo amp extremism http t co u6xnzbk5uk barac
-1	puppy lovers against the ncchamber ncfarmbureau ncaggag bill ncpol stopanimalabuse http t co b9fisujzrk
-1	rt tauseefkarimi watch lovers of mr altafhussain mqm the liberal public who hates status quo amp extremism http t co u6xnzbk5uk metp
-1	wyzechef parents lovers friends and family of a troubled black person please don t ever call the police on them please
-1	rt pisces245 pisces woman will stir trouble in her lovers heart show them worlds they ve never known amp love them deeper than the ocean
-1	the complete bunny guide for rabbit lovers pet lover reveals astonishing secrets guaranteed to thrill and make http t co eqff0uva1i
-1	rt cougarloversuk retweet if you think cougars make the best lovers http t co qwt3urmvu8
-1	rt tauseefkarimi watch lovers of mr altafhussain mqm the liberal public who hates status quo amp extremism http t co u6xnzbk5uk david
-1	rt caroljhedges universeinwords sally_malcolm shakespeare wrote it as a tragedy for the lovers but also for society choclitsaturday
-1	rt wyzechef parents lovers friends and family of a troubled black person please don t ever call the police on them
-1	rt tauseefkarimi watch lovers of mr altafhussain mqm the liberal public who hates status quo amp extremism http t co u6xnzbk5uk david
-1	rt tauseefkarimi watch lovers of mr altafhussain mqm the liberal public who hates status quo amp extremism http t co u6xnzbk5uk metp
-1	5 ways your cat proves their love to you via http t co 0w1oidl5ex the ultimate site for cat lovers http t co ohlpslodti teamcatmojo
-1	rt desikhamba the planet doesn t need more successful people the planet desperately needs more peacemakers healers restorers and love
-1	watch lovers of mr altafhussain mqm the liberal public who hates status quo amp extremism http t co u6xnzbk5uk barackobama
-1	watch lovers of mr altafhussain mqm the liberal public who hates status quo amp extremism http t co u6xnzbk5uk philiprbarton
-1	watch lovers of mr altafhussain mqm the liberal public who hates status quo amp extremism http t co u6xnzbk5uk hillaryclinton
-1	rt tauseefkarimi watch lovers of mr altafhussain mqm the liberal public who hates status quo amp extremism http t co u6xnzbk5uk dmili
-1	watch lovers of mr altafhussain mqm the liberal public who hates status quo amp extremism http t co u6xnzbk5uk david_cameron
-1	1 for the real ale cider amp beer lovers everyone then the towcester beer festival is on 1st 3rd may http t co hbuv3iacue
-1	don t you get fed up of the star crossed lovers tag though choclitsaturday
-1	retweet if you think cougars make the best lovers http t co qwt3urmvu8
-1	watch lovers of mr altafhussain mqm the liberal public who hates status quo amp extremism http t co u6xnzbk5uk dmiliband
-1	rt wyzechef parents lovers friends and family of a troubled black person please don t ever call the police on them
-1	red the colour of warriors lovers and adventurers the expressions collection http t co fnqufcsfsy
-1	alright tea lovers to get your tea shopping list started i ve attached the fundraiser sheet that will be http t co ysclv4mkyk
-1	watch lovers of mr altafhussain mqm the liberal public who hates status quo amp extremism http t co u6xnzbk5uk metpoliceuk
-1	sex sexual ancient stamina secrets for husbands and lovers stamina secrets of the persian princes is a comp http t co 0rsk5e4mgi
-1	sex sexual ancient stamina secrets for husbands and lovers stamina secrets of the persian princes is a comp http t co jie4kc5idh
-1	sex sexual ancient stamina secrets for husbands and lovers stamina secrets of the persian princes is a comp http t co ugzvtjmp5c
-1	sex sexual ancient stamina secrets for husbands and lovers stamina secrets of the persian princes is a comp http t co gua9xrpana
-1	sex sexual ancient stamina secrets for husbands and lovers stamina secrets of the persian princes is a comp http t co okq7ch5q5r
-1	ngilangi penat lovers on the sun feat sam martin by david guetta https t co icfjnnr4yn
-1	rt wyzechef parents lovers friends and family of a troubled black person please don t ever call the police on them
-1	rt therealstafford when people say think outside of the box my response is oh there was a box go live today lovers
