-1	maybe all this is a culling process to show me the people i really need to have in my inner circle ah well
-1	the culling of stratholme deathcharger reins letsdothis lordaurius http t co dnjdaznxai
-1	rt imackare the culling review http t co vppr9rpvet
-1	culling the vermin http t co 59bnaksenf
-1	kalekatsura poaching go die in a fire illegal hunting too culling old animals amp using their carcass how the fuck can you hate that
-1	describes my culling strategy perfectly the latest dairy lingo dnb http t co 8ip4o4sd4v
-1	the undeniable frailty of a government that will not supply it s citizens with equal employment amp fair wages is akin to culling the unwanted
-1	culling operation continues on hyderabad outskirts with culling operations in full swing the animal husbandry http t co r8lmczniqq
-1	latedebaterte eamondelaney10 if the political beasts aren t up to scratch a culling can only ensure the survival of the fittest problem
-1	rt philfarmvet another depressing tb test having seen the optimism amongst farmers in somerset driven by decreasing tb culling must be
-1	on one level their culling on another level the slave master s encourage a baby boom so too forcibly adopt http t co lafcgmvg7x
-1	the culling av club http t co 74twi6hq1d
-1	i m watching sons of anarchy 2x12 the culling https t co 5ba9bofwyn trakt
-1	stop the biggest benefits family the royals from culling grey squirrels on their estates http t co wx8qx2zyeg via ukchange
-1	ninouh90 so you think culling the numbers by 500 is a good start or do you think the message will be sent by then
-1	rt berholestsul the culling quotes http t co v5pekuskbs
-1	eu urged to implement action plan on illegal wildlife trade http t co e2hhxsvrwy
-1	the culling artemis http t co u9cbzjawn1
-1	protect our wildlife stop culling the badgers supporttheparty that protects our wildlife https t co 0lulaha9mr
-1	claiming victory after culling of innocent ppl whom u say hinder ur success will not change the current socio economic circumstance of any1
-1	rt pipsuxx agreed we desperately need vets amp doctors in parliament vets to advice on badger culling amp bovine tb in the uk especially
-1	agreed we desperately need vets amp doctors in parliament vets to advice on badger culling amp bovine tb in the uk especially msaledb
-1	hunting to eat is humane amp enables an appreciation amp respect for the animal mass culling or for a thrill is foul https t co jpypjglcwt
-1	radiotabaus sydney has 8 teams about 3 to 4 to many the landscape has changed in r league in sydney needs culling amp relocations
-1	the culling
-1	on air world of warcraft the culling of stratholme music on digital mayhem radio http t co es5c65fahr
-1	rickygervais georganne72 or how bout we just leave the lions alone and while we re at it quit culling sharks and stay out of the ocean
-1	rt philfarmvet another depressing tb test having seen the optimism amongst farmers in somerset driven by decreasing tb culling must be
-1	rt elysiangamedev tile culling wasn t actually culling that probably explains the semi terrible performance gamedev indiedev
-1	rt elysiangamedev tile culling wasn t actually culling that probably explains the semi terrible performance gamedev indiedev
-1	tile culling wasn t actually culling that probably explains the semi terrible performance gamedev indiedev
-1	bbcdebate what will each party do about animal abuse the primate pet trade the hunting ban and the culling of innocent badgers
-1	terminations the whys and wherefores of culling the herd http t co zitn5qoem9 via sharethis
-1	rt philfarmvet another depressing tb test having seen the optimism amongst farmers in somerset driven by decreasing tb culling must be
-1	another depressing tb test having seen the optimism amongst farmers in somerset driven by decreasing tb culling must be part of tbfree
-1	rt poiskulorga culling the human population http t co s7pounnwlu
-1	has been culling the people i follow sorry if it was you but
-1	rt 5minutes10 happytobetommy i wonder if hitler s culling of those who weaken the strain had any merit
-1	happytobetommy i wonder if hitler s culling of those who weaken the strain had any merit
-1	caz_smash rickygervais georganne72 culling of the herd
-1	rt soaspolitics the london migration research group lmrg presents culling the masses the democratic roots of racist http t co j
-1	rickygervais georganne72 maybe hunters should start hunting each other you know culling the species
-1	rt fishvetmj vet caroline allen green_caroline on why we should not tolerate death of horses for racing in the grand national http t c
-1	rt prodevsoccersch fantastic end to the easter holidays 8 brilliant days of football the standard as always outstanding congrats to li
-1	fantastic end to the easter holidays 8 brilliant days of football the standard as always outstanding congrats to liam culling our potw
-1	cathyholloway1 oh i ve been thinking psychologists need a culling alright too many of them swanning about the place
-1	the culling process http t co sry6n00cll
-1	hughhowey no time to start culling the it department as a warning to others
-1	lessen the fear of culling physical books in learningcommons by moving to openeducation creativecommons resources http t co vh6l8n8bnn
-1	burt_carter earth_post i understand culling think of assisted suicide the doctor would not do a photo opp next to the body grinning
-1	rt scotwildlife find out why the trust and nine other wildlife conservation charities want a 3 year ban on culling mountainhares http
-1	thickslicing clearly we are just trying to beat rob to the punch of culling us off the list imo
-1	culling the world s population http t co qbkt8bmte0
-1	rt red13charlie hellyes thatcherism alive and culling the poor right to buy predatory capitalism ed4pm http t co fprjmawz8q
-1	rt jeremysumpter heading out to new orleans tomorrow to shoot my next film the culling
-1	rt jeremysumpter on set of the culling
-1	rt jeremysumpter check out the season finale of awkward my boy mattlfahey is ricky shwartz working all night on the culling with bdavv
-1	rt jeremysumpter another long night ahead on the culling
-1	np nowplaying the culling by iced earth from album plagues of babylon
-1	rt sandlaconbudd culling the beast http t co 6qhotthv0x
-1	culling of the cows gameplay las vaca re locas http t co nlxpdgo9v6 via youtube
-1	rwac48 would you advocate culling humans with aids the girl s death is tragic but there are other ways to handle this problem
-1	rwac48 seriously culling dogs is ur solution then i guess you wud also wanna cull all the people with swine flu and ebola etc
-1	ten wildlife and conservation organisations join forces to call for a three year ban on the culling of mountain hares on scotland s grouse
-1	rt mathew_kyle13 mc1assassin watch good movie the culling 2015 at http t co reil0sttp0 movie film streaming
-1	rt mathew_kyle13 mc1assassin watch good movie the culling 2015 at http t co reil0sttp0 movie film streaming
-1	the animal that does need culling is man throw a whole bunch in the wilderness w o gear and let nature take its course
-1	the culling quotes http t co puowec42uy 320kbps download http t co kxwhbt1s8d http t co uj9wuwkmbh
-1	love the fact there is going to be a new nando s and bella italia in tollgate
-1	the culling quotes http t co v5pekuskbs
-1	watching the culling with pujio tri at lebak bandung https t co 8vtmbkpuy3
-1	groups call for hare culling ban ten wildlife and conservation organisations join forces to call for a three year ban on the culling of m
-1	rt ayunhalliday clawing my way to a new issue of the east village inky amp pay what you can back issues at the bklynzinefest next weeken
-1	the culling trailer http t co pmpzavqtl5
-1	rt red13charlie hellyes thatcherism alive and culling the poor right to buy predatory capitalism ed4pm http t co fprjmawz8q
-1	rt somersetatbc listen to the science liz truss culling badgers is not a viable policy option bbcqt http t co pn1uwdhqqx
-1	the culling the torch keeper http t co xnwf9zyzmh
-1	hankhoch it may well be hank i don t know what i do know is the shields will be used for culling unwanted populations
-1	rahulreturns jaago_arnab_jaago the culling begins thenewshour timesnow tonight
-1	bit disappointed with the libdem manifesto pledge about the badger cull do we need any more proof that culling is not humane or effective
-1	watching the culling https t co qijbyjpkxn
-1	culling operation continues on hyderabad outskirts with culling operations in full swing the animal husbandr http t co e8vqcedw2d
-1	it is sickening to think we killed off the western black rhino there is a difference in poaching hunting amp culling it isn t all negative
-1	culling operation continues on hyderabad outskirts with culling operations in full swing the animal http t co 3fgmmwuluq
-1	if people understood the difference between hunting poaching and culling it would save so many emotional keystrokes rebeccafrancis
-1	np iced earth the culling
-1	3novices culling operation continues on hyderabad outskirts with culling operations in full swing the animal husbandry department is expe
-1	clawing my way to a new issue of the east village inky amp pay what you can back issues at the bklynzinefest next weekend zines culling
-1	hyderabad culling operation continues on hyderabad outskirts with culling operations in full swing the animal http t co rblrddg8hd
-1	rt hiddenheritage rwac48 lack of culling possibly the direct result of strange laws pushed by maneka gandhi as part of nda i
-1	culling operation continues on hyderabad outskirts the hindu operationsres http t co egafoxjmx9
-1	rt vjaconnect culling operation continues on hyderabad outskirts lasaniayunus http t co kh6fzjho47 http t co moqyxqjzkb
-1	rt red13charlie hellyes thatcherism alive and culling the poor right to buy predatory capitalism ed4pm http t co fprjmawz8q
-1	eveningexpress youngwd1 the countdown to the culling of the red tories has begun
-1	silver_stacker vonhenrick1 population explosion culling via abortion amp the pill 55 million abortions in usa alone since 1970 s
-1	rt bluebeatbadger expressandecho hustings questions how would the candidates vote on repeal of the hunting act do they support the c
-1	rt bluebeatbadger expressandecho hustings questions how would the candidates vote on repeal of the hunting act do they support the c
-1	expressandecho hustings questions how would the candidates vote on repeal of the hunting act do they support the culling of badgers
-1	thisisanfield cut the wage bill by culling the rejects not a legend gerrard8fanpage lfc ynwa liverpoolfc liverpool
-1	rwac48 chahal54321 outsource culling stray dogs and cattle to china sure they ll finish the job within a month
-1	i added a video to a youtube playlist http t co t6x6ztfuwc let s play rift part 95 culling the cultists re upload
-1	so if perthgloryfc exceeded do the salary cap when do they have to start culling squad players to come back into fair play aleague
-1	lembur yah the culling with isyrin https t co b1nz26hnbe
-1	my favs have finally overtaken my tweets well then it s time to start the culling
-1	oldkrish what is the source of ur data what about cow culling it kill more on roads nd cause damages to field produce
-1	the culling
-1	rt rwac48 chahal54321 whole world has tried them and failed culling was the norm in india too until law amended
-1	rt movetheworldus for just 5 you can protect puppies from inhumane culling due to the fear of rabies http t co ga0ffbs4y0 http t c
-1	watch the culling click http t co ozijjyebtw http t co jud0o7uqhs
-1	rt rwac48 rwac48 this is horrendous amp shameful no where in the world has canine rabies been eradicated except by culling
-1	rt hiddenheritage rwac48 lack of culling possibly the direct result of strange laws pushed by maneka gandhi as part of nda i
-1	chahal54321 whole world has tried them and failed culling was the norm in india too until law amended
-1	rt hiddenheritage rwac48 lack of culling possibly the direct result of strange laws pushed by maneka gandhi as part of nda i
-1	animal activists call for humane culling humane society international hsi has urged the governments of telangana http t co 7ksssfy7ga
-1	rt hiddenheritage rwac48 lack of culling possibly the direct result of strange laws pushed by maneka gandhi as part of nda i
-1	rt rwac48 rwac48 this is horrendous amp shameful no where in the world has canine rabies been eradicated except by culling
-1	rt rwac48 rwac48 this is horrendous amp shameful no where in the world has canine rabies been eradicated except by culling
-1	rt rwac48 rwac48 this is horrendous amp shameful no where in the world has canine rabies been eradicated except by culling
-1	telangana risk of bird flu infection spreads the slow pace of the culling of birds http t co 9cgnwvdgt1
-1	rwac48 lack of culling possibly the direct result of strange laws pushed by maneka gandhi as part of nda i
-1	rt rwac48 rwac48 this is horrendous amp shameful no where in the world has canine rabies been eradicated except by culling
-1	rt rwac48 rwac48 this is horrendous amp shameful no where in the world has canine rabies been eradicated except by culling
-1	rt rwac48 rwac48 this is horrendous amp shameful no where in the world has canine rabies been eradicated except by culling
-1	rt rwac48 rwac48 this is horrendous amp shameful no where in the world has canine rabies been eradicated except by culling
-1	rt rwac48 rwac48 this is horrendous amp shameful no where in the world has canine rabies been eradicated except by culling
-1	rwac48 this is horrendous amp shameful no where in the world has canine rabies been eradicated except by culling
-1	ed_miliband mr_slater that s why we must finishthetories and any other party supporting the culling of disabled http t co mn4cacapsl
-1	culling the human population http t co s7pounnwlu
-1	rt red13charlie hellyes thatcherism alive and culling the poor right to buy predatory capitalism ed4pm http t co fprjmawz8q
-1	warcraft 3 reign of chaos let s play part 7 the culling hard http t co p9ekbsh9vf http t co j6w8l2cujn
-1	warcraft 3 reign of chaos let s play part 7 the culling hard http t co wda8gew3zo http t co 1b2a7asklz
-1	rt byqokomarul ten wildlife and conservation organisations join forces to call for a three year ban on the culling of mountain hares on s
-1	rt red13charlie hellyes thatcherism alive and culling the poor right to buy predatory capitalism ed4pm http t co fprjmawz8q
-1	we are getting some good feedback here please join the conversation and have your say tho i might add i don t http t co 3tyqzlbnv4
-1	a brave idea but we can t even agree on badger culling so imagine the uproar if they let loose lynx on deer herds https t co zv6epuiyfk
-1	rt red13charlie hellyes thatcherism alive and culling the poor right to buy predatory capitalism ed4pm http t co fprjmawz8q
-1	rt red13charlie hellyes thatcherism alive and culling the poor right to buy predatory capitalism ed4pm http t co fprjmawz8q
-1	rt petemrcooper the stir up of badger territories from badger culling leads to further tb build up conscipol
-1	rt red13charlie hellyes thatcherism alive and culling the poor right to buy predatory capitalism ed4pm http t co fprjmawz8q
-1	rt petemrcooper the stir up of badger territories from badger culling leads to further tb build up conscipol
-1	https t co q4nkpzbncl the badger guide to culling tories
-1	rt movetheworldus for just 5 you can protect puppies from inhumane culling due to the fear of rabies http t co ga0ffbs4y0 http t c
-1	the stir up of badger territories from badger culling leads to further tb build up conscipol
-1	rt red13charlie hellyes thatcherism alive and culling the poor right to buy predatory capitalism ed4pm http t co fprjmawz8q
-1	rt red13charlie hellyes thatcherism alive and culling the poor right to buy predatory capitalism ed4pm http t co fprjmawz8q
-1	blazephoenix_ amp what we r supposed to be appalled i am for mercenary snipers taking out poachers reverse culling the herd if you will
-1	rt red13charlie hellyes thatcherism alive and culling the poor right to buy predatory capitalism ed4pm http t co fprjmawz8q
-1	telangana risk of bird flu infection spreads the slow pace of the culling of birds infected by the h5n1 outb http t co hrrdb7iudh
-1	rt red13charlie hellyes thatcherism alive and culling the poor right to buy predatory capitalism ed4pm http t co fprjmawz8q
-1	rt red13charlie hellyes thatcherism alive and culling the poor right to buy predatory capitalism ed4pm http t co fprjmawz8q
-1	rt red13charlie hellyes thatcherism alive and culling the poor right to buy predatory capitalism ed4pm http t co fprjmawz8q
-1	telangana risk of bird flu infection spreads the slow pace of the culling of birds infected by the h5n1 outbreak http t co vvqyyuigsg
-1	rt red13charlie hellyes thatcherism alive and culling the poor right to buy predatory capitalism ed4pm http t co fprjmawz8q
-1	rt chriswmp you can vote to cull the tories on 7 may to stop them culling badgers vote labour to cancel the badger cull https t co chj
-1	rt paipobysyn the culling wowpedia http t co wzx34a0dgt
-1	rt chriswmp you can vote to cull the tories on 7 may to stop them culling badgers vote labour to cancel the badger cull https t co chj
-1	rt red13charlie hellyes thatcherism alive and culling the poor right to buy predatory capitalism ed4pm http t co fprjmawz8q
-1	smiffy redsquirrelsinw is the expert on that one but i d say reducing s of greys is a substantial help either via culling or pine marten
-1	rt red13charlie hellyes thatcherism alive and culling the poor right to buy predatory capitalism ed4pm http t co fprjmawz8q
-1	rt red13charlie hellyes thatcherism alive and culling the poor right to buy predatory capitalism ed4pm http t co fprjmawz8q
-1	rt red13charlie hellyes thatcherism alive and culling the poor right to buy predatory capitalism ed4pm http t co fprjmawz8q
-1	rt red13charlie hellyes thatcherism alive and culling the poor right to buy predatory capitalism ed4pm http t co fprjmawz8q
-1	3novices telangana risk of bird flu infection spreads the slow pace of the culling of birds infected by the h5n1 outbreak in hayathnagar i
-1	3novices telangana risk of bird flu infection spreads http t co xo2jlkqlqi the slow pace of the culling of birds infected by the h5n1
-1	telangana risk of bird flu infection spreads the slow pace of the culling of birds infected by the h5n1 http t co f89sit5foo
-1	rt red13charlie hellyes thatcherism alive and culling the poor right to buy predatory capitalism ed4pm http t co fprjmawz8q
-1	snpout i think you should read it properly it s against the repeal of the hunting act torycull is about culling of badgers amp fox hunting
-1	rt red13charlie hellyes thatcherism alive and culling the poor right to buy predatory capitalism ed4pm http t co fprjmawz8q
-1	rt red13charlie hellyes thatcherism alive and culling the poor right to buy predatory capitalism ed4pm http t co fprjmawz8q
-1	rt chriswmp you can vote to cull the tories on 7 may to stop them culling badgers vote labour to cancel the badger cull https t co chj
-1	rt chriswmp you can vote to cull the tories on 7 may to stop them culling badgers vote labour to cancel the badger cull https t co chj
-1	rt red13charlie hellyes thatcherism alive and culling the poor right to buy predatory capitalism ed4pm http t co fprjmawz8q
-1	rt red13charlie hellyes thatcherism alive and culling the poor right to buy predatory capitalism ed4pm http t co fprjmawz8q
-1	rt red13charlie hellyes thatcherism alive and culling the poor right to buy predatory capitalism ed4pm http t co fprjmawz8q
-1	rt red13charlie hellyes thatcherism alive and culling the poor right to buy predatory capitalism ed4pm http t co fprjmawz8q
-1	rt red13charlie hellyes thatcherism alive and culling the poor right to buy predatory capitalism ed4pm http t co fprjmawz8q
-1	the rich say the earth is over populated then they say take your vaccine yes they are culling the herd
-1	rt red13charlie hellyes thatcherism alive and culling the poor right to buy predatory capitalism ed4pm http t co fprjmawz8q
-1	rt red13charlie hellyes thatcherism alive and culling the poor right to buy predatory capitalism ed4pm http t co fprjmawz8q
-1	rt red13charlie hellyes thatcherism alive and culling the poor right to buy predatory capitalism ed4pm http t co fprjmawz8q
-1	rt red13charlie hellyes thatcherism alive and culling the poor right to buy predatory capitalism ed4pm http t co fprjmawz8q
-1	rt red13charlie hellyes thatcherism alive and culling the poor right to buy predatory capitalism ed4pm http t co fprjmawz8q
-1	rt red13charlie hellyes thatcherism alive and culling the poor right to buy predatory capitalism ed4pm http t co fprjmawz8q
-1	classicistsong brushed back entering the room again without looking river s way he leaped onto the king sized bed culling down
-1	rt chriswmp you can vote to cull the tories on 7 may to stop them culling badgers vote labour to cancel the badger cull https t co chj
-1	hellyes thatcherism alive and culling the poor right to buy predatory capitalism ed4pm http t co fprjmawz8q
-1	rt chriswmp you can vote to cull the tories on 7 may to stop them culling badgers vote labour to cancel the badger cull https t co chj
-1	it may break your heart to break her bones but someone s got to do the culling of the fold
-1	rt chriswmp you can vote to cull the tories on 7 may to stop them culling badgers vote labour to cancel the badger cull https t co chj
-1	rt chriswmp you can vote to cull the tories on 7 may to stop them culling badgers vote labour to cancel the badger cull https t co chj
-1	rt chriswmp you can vote to cull the tories on 7 may to stop them culling badgers vote labour to cancel the badger cull https t co chj
-1	you can vote to cull the tories on 7 may to stop them culling badgers vote labour to cancel the badger cull https t co chjqoghjd6
-1	daf inspired culling gems of inspiration from the daf http t co 96x9vwtnmw
-1	matzav_com daf inspired culling gems of inspiration from the daf http t co gr2lsfchss
-1	shekolac they re getting rid of the dead weight culling the herd
-1	all players who played in craig johnston s 3rd team last week and the new 5th team training is at culling park http t co sbr6rdhref
-1	rt ms_rana ani_news the pace at which modi govt is culling environment amp destroying agriculture i am sure he is serious about this
-1	li_politico dovil think of the shelf space record stores would save by culling all the beatles and bob dylan bests of
-1	rt afp indian authorities order the culling of 150 000 birds after five chicks were found infected with h5n1 avian influenza http t co
-1	well the culling of audio for quotes begins i will say this though for a student of history today was one http t co kvw0pjbryj
-1	rt evepartdeux sings to all of you the culling song
-1	thanks for pointing that one out missed her in the culling
-1	rt evepartdeux sings to all of you the culling song
-1	sings to all of you the culling song
-1	that zq thread got like 5 gray names on the first page i thought gaf got done culling all the gators
-1	rt ms_rana ani_news the pace at which modi govt is culling environment amp destroying agriculture i am sure he is serious about this
-1	ani_news the pace at which modi govt is culling environment amp destroying agriculture i am sure he is serious about this
-1	watching the culling with ade https t co mm6ty1tg7a
-1	exjon darwin s not nearly done culling the herd bear that in mind each day
-1	introducing another friend to the 100 amd we reached the culling episode i hate having so many feelings
-1	environmental groups are calling for a three year ban on the culling of mountain hares on grouse moors across http t co volbsjfol1
-1	the culling hmmm
-1	billnsher42197 tsujimegumi jkaccinni nopecksniffian well the earth can only contain certain numbers so let s start culling off ppl
-1	rt ctvnewsvi video a citizens group says it has a better alternative to culling urban deer in the heart of oak bay http t co 6h81ltd
-1	rt victoriabcbuzz a better way in oak bay oak bay a citizens group says it has a better alternative to culling urban deer in the htt
-1	i m talking to myself my thoughts are crows waiting to murder culling to the caws of my dirge
-1	dethbox auto settings for most then fine tune for the ones i really like also have a process for culling shots
-1	3novices animal activists call for humane culling humane society international hsi has urged the governments of telangana and andhra pra
-1	rt victoriabcbuzz a better way in oak bay oak bay a citizens group says it has a better alternative to culling urban deer in the htt
-1	rt ctvnewsvi video a citizens group says it has a better alternative to culling urban deer in the heart of oak bay http t co 6h81ltd
-1	rt suckma3 jokeocracy culling the weak is necessary to build a race of trolling ubermenschen
-1	the culling 2015 web dl x264 aac http t co 6tvg3j1ql3
-1	rt lorabruncke our global elite culling the masses and we are paving our way to hell we better wake up or die opchemtrails political_
-1	itvnews another way of culling the dullards
-1	lulufagt the culling begins 3 deathparadenl
-1	rt lorabruncke our global elite culling the masses and we are paving our way to hell we better wake up or die opchemtrails political_
-1	rt lorabruncke our global elite culling the masses and we are paving our way to hell we better wake up or die opchemtrails political_
-1	rt lorabruncke our global elite culling the masses and we are paving our way to hell we better wake up or die opchemtrails political_
-1	rt lorabruncke our global elite culling the masses and we are paving our way to hell we better wake up or die opchemtrails political_
-1	our global elite culling the masses and we are paving our way to hell we better wake up or die opchemtrails political_porn jacquard612
-1	culling the beast http t co 6qhotthv0x
-1	the culling of stratholme world of warcraft http t co zgo7wgoyl5
