-1	joerichlaw you sold the farmers down the road with your culling of cattle torries i dont know how you dare make that statement
-1	hwoodbery businessinsider in the meat industry complete animals go to waste in the egg industry they practice chick culling google it
-1	thedarkening rickygervais each to their own culling the african baddies couldnt do any harm though right
-1	rt jonnyecology call for three year scottish ban on hare culling the scotsman http t co tadesro3kh
-1	wish they d start executing the arsonists who start grassfires in south wales so many defective human beings they need culling scum
-1	inhuman_draw i know i ve changed a lot over the years culling slurs from my vocab and it wasn t because someone called the hounds
-1	realistginger and if it required killing all the cows or culling a significant portion of them
-1	risk of bird flu infection spreads the slow pace of the culling of birds infected by the h5n1 outbreak in http t co sxclnuo28u
-1	rt gingbestgolme culling the weak remember us lyrics http t co viw7nf9pxt
-1	shaunholt8587 313libertarian sensandreps doesn t stop them from taking the trophy specimen rather than culling the weak from the herd
-1	the culling wowpedia http t co wzx34a0dgt
-1	risk of bird flu infection spreads the slow pace of the culling of birds infected by the http t co 9ke3cznfpw
-1	brew_york brewersassoc lack of or inconsistent quality will be that which leads to the culling of the ever growing herd
-1	encourage business ideas and maximize productivity by culling workplace distractions http t co 8m2evisvkh
-1	the badger guide to culling tories torycull http t co pn0jydece2 via youtube
-1	so much un subs today love it culling the ppl just using me for darkwood content muahahahahaaa ugh
-1	telangana orders culling of 1 45 lakh poultry birds financial express the hindutelangana orders culling of http t co 7alxg1axxe
-1	lt b gt telangana lt b gt orders culling of 1 45 lakh poultry birds the telangana government has http t co ltnt3shoeq
-1	risk of bird flu infection spreads the slow pace of the culling of birds infected by the h5n1 outbreak in http t co u6xgerqtyt
-1	3novices risk of bird flu infection spreads http t co ewkwpdoron the slow pace of the culling of birds infected by the h5n1 outbreak in
-1	3novices risk of bird flu infection spreads the slow pace of the culling of birds infected by the h5n1 outbreak in hayathnagar in ranga red
-1	i ve been culling my following list to weed out the stuff that doesn t make me feel great now i m bummed b c my feed seems emptier
-1	rt movetheworldus for just 5 you can protect puppies from inhumane culling due to the fear of rabies http t co ga0ffbs4y0 http t c
-1	rt scotwildlife find out why the trust and nine other wildlife conservation charities want a 3 year ban on culling mountainhares http
-1	peteswildlife i_am_a_leo i m so sick of culling anything anyone know what s culled the most in america
-1	rt highland_andy a clip on tonight s stv news on the proposal for a 3 year curtailment of m hare culling btw the hare footage mine ht
-1	rt podgardpechi the culling book http t co tzbbbi63nt
-1	say no to tvr culling we have been researching various aspects of the test vaccinate remove tvr concept which http t co j7yjkjfgbc
-1	rt movetheworldus for just 5 you can protect puppies from inhumane culling due to the fear of rabies http t co ga0ffbs4y0 http t c
-1	rt movetheworldus for just 5 you can protect puppies from inhumane culling due to the fear of rabies http t co ga0ffbs4y0 http t c
-1	rt movetheworldus for just 5 you can protect puppies from inhumane culling due to the fear of rabies http t co ga0ffbs4y0 http t c
-1	richardwhollid1 i m sure none of our supports approve of badger culling fox hunting or animals in the circus or political groups that do
-1	the culling of our flock continues bot
-1	ten wildlife and conservation organisations join forces to call for a three year ban on the culling of mountain hares on scotland s grouse
-1	dear diary more people die on the road than they do in the ocean maybe we should mull over culling cars instead of sharks
-1	bradproud graemerice contalito forbes we ve been culling hard no second chances for the cows
-1	culling our dinosaur herd at the loxton household today a family can accumulate a lot of bad plastic over a couple generations of kids
-1	rt movetheworld neutering can play a crucial part in managing dog populations one of the many humane and effective alternatives to culli
-1	rt movetheworldus mohamad brought his 4 month old puppy raja to the anti rabies clinic we help fund read more http t co 2fufgsxyb1 h
-1	toxinews no it s because the victims are white culling the herd to extinction going the way of the rhino
-1	rt movetheworldus for just 5 you can protect puppies from inhumane culling due to the fear of rabies http t co ga0ffbs4y0 http t c
-1	rt mancandlovingit vote tory amp they will speed up culling of the sick amp disabled vote labour amp it will continue at current pace some c
-1	the one i threw back i suggest you invest in a culling system hoorag fishing bass bassmaster https t co byuwwa6p2p
-1	rt mancandlovingit vote tory amp they will speed up culling of the sick amp disabled vote labour amp it will continue at current pace some c
-1	vote tory amp they will speed up culling of the sick amp disabled vote labour amp it will continue at current pace some choice hey
-1	jon_swindon charliewoof81 we can save children and foxes by culling the tories and the lib dems yellow tories now aint they
-1	how long until the stack rankings amp mckinsey style culling starts happening at this workplace http t co ex6rvswvxf
-1	rt movetheworldus mohamad brought his 4 month old puppy raja to the anti rabies clinic we help fund read more http t co 2fufgsxyb1 h
-1	rt movetheworldus for just 5 you can protect puppies from inhumane culling due to the fear of rabies http t co ga0ffbs4y0 http t c
-1	rt afp indian authorities order the culling of 150 000 birds after five chicks were found infected with h5n1 avian influenza http t co
-1	rt raphbiasuty the culling destiny review http t co wxoezunodg
-1	we should be helping the world not culling animals cull corrupt corporate politicians https t co qzsudcg7uu
-1	rt movetheworldus for just 5 you can protect puppies from inhumane culling due to the fear of rabies http t co ga0ffbs4y0 http t c
-1	aidan_kerr1 culling social housing stock has been detrimental the country should have been replenishing the stocks every party has fail
-1	watching the culling https t co 9wolqbbpj5
-1	south americans to come to the u s via mexico ethiopians come to saudi arabia via yemen culling by proxy https t co rabxhic86b
-1	rt suckma3 jokeocracy culling the weak is necessary to build a race of trolling ubermenschen
-1	rt femme1bella bluefoxcafh when tories gave the nod to badger culling it was the signal for indiscriminate killing of a protected specie
-1	bluefoxcafh when tories gave the nod to badger culling it was the signal for indiscriminate killing of a protected species it was expected
-1	jokeocracy culling the weak is necessary to build a race of trolling ubermenschen
-1	rt movetheworldus mohamad brought his 4 month old puppy raja to the anti rabies clinic we help fund read more http t co 2fufgsxyb1 h
-1	rt movetheworldus for just 5 you can protect puppies from inhumane culling due to the fear of rabies http t co ga0ffbs4y0 http t c
-1	rt fionaadamson next lmrg fitzgeralducsd speaking on his book culling the masses racistdemocracy tues apr 21 5 30pm 6 bedford sq http
-1	rt bordercrim culling the masses democratic roots of racist immigration policy in the americas seminar by d s fitzgerald 21 apr 5 30 6
-1	rt fitzgeralducsd culling the masses the democratic origins of racist immigration policy in the americas now at http t co ogsabfgsvo h
-1	rt fitzgeralducsd culling the masses the democratic origins of racist immigration policy in the americas now at http t co ogsabfgsvo h
-1	culling the masses democratic roots of racist immigration policy in the americas seminar by d s fitzgerald 21 apr 5 30 6 bedford sq london
-1	rt afp indian authorities order the culling of 150 000 birds after five chicks were found infected with h5n1 avian influenza http t co
-1	rt afp indian authorities order the culling of 150 000 birds after five chicks were found infected with h5n1 avian influenza http t co
-1	rt afp indian authorities order the culling of 150 000 birds after five chicks were found infected with h5n1 avian influenza http t co
-1	before culling the seagulls shouldn t we start first on the chavs and reptiles that are killing our town far more verminous than seagulls
-1	rt mammamumra darren_dazmav the rich inbreds feast on gormet food feed their fkn dogs better than kids are eating in this day and age or
-1	darren_dazmav the rich inbreds feast on gormet food feed their fkn dogs better than kids are eating in this day and age organised culling
-1	understanding sunk costs http t co bx2ndxqwwu e g if a cow preg checks late in the fall that is a sunk cost culling will not change that
-1	the ruling aristocracy require culling http t co qwtzopot78
-1	jam55king taximassive johnmal49537206 gotta love the yanks wrong way round culling circus and all the way round belgrave square
-1	david fitzgerald uc san diego will be speaking on his latest book culling the masses tues apr 21 5 30pm 6 bedford sq fitzgeralducsd
-1	what the heck happened to the cloudy skies came to escape culling megacon pix but it is like high noon https t co l1ddayqqhi
-1	the london migration research group lmrg presents culling the masses the democratic roots of racist http t co j2plfrh8cm
-1	you can stop the biggest wildlife killers of all http t co fkodolidms should be culling all evil greedy fraudulent corporate executives
-1	you can stop the biggest wildlife killers of all https biologicaldiversity salsalabs you should be culling politicians not animals scum
-1	topthird going to be a lot of culling of the poultry next few months
-1	i liked a youtube video http t co 7jcpgemogz gallipoli 1 culling the working man flower pot men and the time team analysis
-1	gallipoli 1 culling the working man flower pot men and the time team an https t co 9o38pr88tv via youtube
-1	the kings arm s with the girls
-1	horror time the culling https t co f4nsdh7r8l
-1	dark stars for lease in the divisible world at all hours culling a distemper of infinity
-1	the great culling natural news http t co fjpsvcuwmu
-1	the culling book http t co tzbbbi63nt
-1	another disturbing report on usda_aphis wildlife services amp its massive culling program 3 million animals in 2014 https t co qdn40h9k62
-1	rt afp indian authorities order the culling of 150 000 birds after five chicks were found infected with h5n1 avian influenza http t co
-1	the culling movie http t co fs7qylkyjk
-1	rt teamliquidpro are you ready liquid_hero going up against terminator in the gsl right now theculling http t co 8ut0tn3abc http
-1	halfon4harlowmp great politician but sadly supporting the failed badger culling
-1	rt gingbestgolme culling the weak remember us lyrics http t co viw7nf9pxt
-1	bushboywhotweet bikehikecamp oh gosh i have got in the habit of sorting and culling take a couple hundred at a time yay digital
-1	rt teamliquidpro are you ready liquid_hero going up against terminator in the gsl right now theculling http t co 8ut0tn3abc http
-1	rt travelmindset diving for a cause ridding the cayman_islands of lion fish one dive at a time http t co by3zbfdxy3 http t co cxg3y
-1	rt travelmindset diving for a cause ridding the cayman_islands of lion fish one dive at a time http t co by3zbfdxy3 http t co cxg3y
-1	mum i think the only way to fix men is by culling them honestly
-1	the badger culling http t co gcncqxi70b
-1	rt richardblogger jos21bell andyburnhammp what is the allowable culling ruling in the internet age culling of official docs makes
-1	the need to re evaluate reasons for monkey culling in singapore president of jgisingaore http t co sgv6l3xpgk janegoodallinst
-1	rt teamliquidpro are you ready liquid_hero going up against terminator in the gsl right now theculling http t co 8ut0tn3abc http
-1	rt teamliquidpro are you ready liquid_hero going up against terminator in the gsl right now theculling http t co 8ut0tn3abc http
-1	rt afp indian authorities order the culling of 150 000 birds after five chicks were found infected with h5n1 avian influenza http t co
-1	jos21bell andyburnhammp what is the allowable culling ruling in the internet age culling of official docs makes no sense
-1	rt afp indian authorities order the culling of 150 000 birds after five chicks were found infected with h5n1 avian influenza http t co
-1	rt teamliquidpro are you ready liquid_hero going up against terminator in the gsl right now theculling http t co 8ut0tn3abc http
-1	rt afp indian authorities order the culling of 150 000 birds after five chicks were found infected with h5n1 avian influenza http t co
-1	rt teamliquidpro are you ready liquid_hero going up against terminator in the gsl right now theculling http t co 8ut0tn3abc http
-1	rt teamliquidpro are you ready liquid_hero going up against terminator in the gsl right now theculling http t co 8ut0tn3abc http
-1	are you ready liquid_hero going up against terminator in the gsl right now theculling http t co 8ut0tn3abc http t co gqisipcpex
-1	rt afp indian authorities order the culling of 150 000 birds after five chicks were found infected with h5n1 avian influenza http t co
-1	rt afp indian authorities order the culling of 150 000 birds after five chicks were found infected with h5n1 avian influenza http t co
-1	rt scotwildlife find out why the trust and nine other wildlife conservation charities want a 3 year ban on culling mountainhares http
-1	rt afp indian authorities order the culling of 150 000 birds after five chicks were found infected with h5n1 avian influenza http t co
-1	it may break your heart to break her bones but someone s got to do the culling of the fold
-1	afp indian authorities order the culling of 150 000 birds after five chicks were found infected with h5n1 avian influenza 1 2
-1	rt afp indian authorities order the culling of 150 000 birds after five chicks were found infected with h5n1 avian influenza http t co
-1	rt afp indian authorities order the culling of 150 000 birds after five chicks were found infected with h5n1 avian influenza http t co
-1	rt afp indian authorities order the culling of 150 000 birds after five chicks were found infected with h5n1 avian influenza http t co
-1	rt afp indian authorities order the culling of 150 000 birds after five chicks were found infected with h5n1 avian influenza http t co
-1	rt gingbestgolme culling the weak remember us lyrics http t co viw7nf9pxt
-1	rt afp indian authorities order the culling of 150 000 birds after five chicks were found infected with h5n1 avian influenza http t co
-1	rt afp indian authorities order the culling of 150 000 birds after five chicks were found infected with h5n1 avian influenza http t co
-1	indian authorities order the culling of 150 000 birds after five chicks were found infected with h5n1 avian influenza http t co fyhyeotjpe
-1	rt afp indian authorities order the culling of 150 000 birds after five chicks were found infected with h5n1 avian influenza http t co
-1	rt afp indian authorities order the culling of 150 000 birds after five chicks were found infected with h5n1 avian influenza http t co
-1	rt afp indian authorities order the culling of 150 000 birds after five chicks were found infected with h5n1 avian influenza http t co
-1	rt afp indian authorities order the culling of 150 000 birds after five chicks were found infected with h5n1 avian influenza http t co
-1	rt afp indian authorities order the culling of 150 000 birds after five chicks were found infected with h5n1 avian influenza http t co
-1	rt afp indian authorities order the culling of 150 000 birds after five chicks were found infected with h5n1 avian influenza http t co
-1	rt afp indian authorities order the culling of 150 000 birds after five chicks were found infected with h5n1 avian influenza http t co
-1	rt afp indian authorities order the culling of 150 000 birds after five chicks were found infected with h5n1 avian influenza http t co
-1	rt afp indian authorities order the culling of 150 000 birds after five chicks were found infected with h5n1 avian influenza http t co
-1	rt afp indian authorities order the culling of 150 000 birds after five chicks were found infected with h5n1 avian influenza http t co
-1	rt afp indian authorities order the culling of 150 000 birds after five chicks were found infected with h5n1 avian influenza http t co
-1	rt afp indian authorities order the culling of 150 000 birds after five chicks were found infected with h5n1 avian influenza http t co
-1	rt afp indian authorities order the culling of 150 000 birds after five chicks were found infected with h5n1 avian influenza http t co
-1	rt afp indian authorities order the culling of 150 000 birds after five chicks were found infected with h5n1 avian influenza http t co
-1	rt afp indian authorities order the culling of 150 000 birds after five chicks were found infected with h5n1 avian influenza http t co
-1	indian authorities order the culling of 150 000 birds after five chicks were found infected with h5n1 avian influenza http t co 1izmnolcv4
-1	work was coo successful bid for dumping culling went through nigga will have the same hours but at least i get thurs fri off
-1	rt ouresderec the culling steven dos santos pdf http t co 8wq46rnucl
-1	the culling destiny review http t co wxoezunodg
-1	hughsfishfight is there anything you can do about the seal culling another big problem regarding stupid humans and fish
-1	rt bbcdavidmiller debate over the culling of mountain hares hear from tim baynes of scotlandestates and simon jones of scotwildlife h
-1	i really loved this single btw can t find the actual cd though moving and culling is so fun http t co lyt0aqc9aw
-1	rt scotwildlife find out why the trust and nine other wildlife conservation charities want a 3 year ban on culling mountainhares http
-1	enjoy d movie the culling with nina rahmadi and hesty https t co wdhssgthlr
-1	rt brtknr badger culling makes things worse spreading tb to cows outside the culling zone vaccine is more effective honourablefr
-1	scolded last night for only now culling a lot of the 2010 s best people to follow on twitter set it s like spring cleaning w o the dust
-1	seeing the girls today
-1	culling cats increases the feral population australian study finds http t co qjtby5ax10
-1	rt scotwildlife find out why the trust and nine other wildlife conservation charities want a 3 year ban on culling mountainhares http
-1	rt scotwildlife find out why the trust and nine other wildlife conservation charities want a 3 year ban on culling mountainhares http
-1	rt scotwildlife find out why the trust and nine other wildlife conservation charities want a 3 year ban on culling mountainhares http
-1	rt scotwildlife find out why the trust and nine other wildlife conservation charities want a 3 year ban on culling mountainhares http
-1	the great culling is underway
-1	rt scotwildlife find out why the trust and nine other wildlife conservation charities want a 3 year ban on culling mountainhares http
-1	rt scotwildlife find out why the trust and nine other wildlife conservation charities want a 3 year ban on culling mountainhares http
-1	badger culling makes things worse spreading tb to cows outside the culling zone vaccine is more effective honourablefriends greens
-1	walk on the wild side lou reed my last day of listening2music i want to listen too before glastonbury culling cunts http t co 0tv7oprm7x
-1	rt scotwildlife find out why the trust and nine other wildlife conservation charities want a 3 year ban on culling mountainhares http
-1	rt scotwildlife find out why the trust and nine other wildlife conservation charities want a 3 year ban on culling mountainhares http
-1	rt gallowaygrouse hares in context culling controversies vs the real issue of declining range and missing management http t co yz39n8o
-1	rt scotwildlife find out why the trust and nine other wildlife conservation charities want a 3 year ban on culling mountainhares http
-1	rt scotwildlife find out why the trust and nine other wildlife conservation charities want a 3 year ban on culling mountainhares http
-1	rt scotwildlife find out why the trust and nine other wildlife conservation charities want a 3 year ban on culling mountainhares http
-1	rt scotwildlife find out why the trust and nine other wildlife conservation charities want a 3 year ban on culling mountainhares http
-1	rt inropartcul chemtrails culling the useless eater population http t co ecycg2kb4g
-1	rt truemagic68 patongordon rippedoffbriton afneil the culling has been done move on and build for the future angst amp bile unattra
-1	watching the culling https t co viik1etrqa
-1	allydub i support the seal hunt culling good 4 ecosys for our bodies omega 3 fatty acids great for warm clothing and footwear renewable
-1	rt rogodwinw67 the act govt exposed for the lies it used to try amp justify culling kangaroos in 2013 amp they are now at it again http
-1	a better way in oak bay a citizens group says it has a better alternative to culling urban deer in the heart of http t co wlb7pgrsnb
-1	jebbush what are the fema camps for and what do you establishment politicians mean when you say the great culling is that mass murder
-1	the culling of our flock continues bot
-1	fmedic completed the quest culling the slogath fallensword
-1	the culling of strat turned me into a dwarve and i am not a happy camper despite the huge smile http t co xxpbpul2dx
-1	rt eshotahip the culling reading order http t co hadatanpp6
-1	matzav_com daf inspired culling gems of inspiration from the daf http t co 4lngzwrxz5
-1	daf inspired culling gems of inspiration from the daf http t co fmcvhzwfym
-1	rt rogodwinw67 the act govt exposed for the lies it used to try amp justify culling kangaroos in 2013 amp they are now at it again http
-1	who doesn t follow back who never rts who never links all that amp more at http t co urenukaxww culling the herd right now
-1	dontaskwhy2day realazzmador sexy_merchant kxshki it can also be found in any walmart the white herd is in desperate need of culling too
-1	rt ctvnewsvi video a citizens group says it has a better alternative to culling urban deer in the heart of oak bay http t co 6h81ltd
-1	video a citizens group says it has a better alternative to culling urban deer in the heart of oak bay http t co 6h81ltdlbk
-1	a better way in oak bay oak bay a citizens group says it has a better alternative to culling urban deer in the http t co ehxf56oenz
-1	it s a very serious matter indeed especially in the wake of walter scott s culling michael slager will burn for murdering him
-1	i just earned the the culling of stratholme achievement warcraft http t co jncgijqnbe
-1	rt iridium_blacker looks like it s culling day again expect more tangodown s getting announced within the next few hours
-1	me humans broke the predator prey circle lsucaligrl i guess we could use a good culling though she s very reassuring
-1	thekatvond lolita on my lips and the morphebrushes contour palette today me motd kvd makeup https t co r6esbqkd9v
-1	i m giving away the culling of the cows sammy steam card check it out http t co xb83zfslgn listia
-1	rt casehighprinc giving ts what they want celebrating their strengths by culling amp shaping the day in best way for all mssaachat https
-1	giving ts what they want celebrating their strengths by culling amp shaping the day in best way for all mssaachat https t co zl8gsdowxh
-1	rt rockstarrocky learning about the word culling but really i m thinking about cullencrest miss you gabriellaesor
-1	learning about the word culling but really i m thinking about cullencrest miss you gabriellaesor
-1	rt discovery in a new study culling failed to decrease the feral cat population it actually increased gt gt http t co iv5d3las1k http
-1	3 nightfalls done the culling red hand ix gjallarhorn 3 d
-1	titan loadout for nightfall venation iii plan c the culling
-1	video call to rethink hare culling environmental groups are calling for a three year ban on the culling of m http t co jdg4wv7rn7
-1	video call to rethink hare culling environmental groups are calling for a three year ban on the culling of m http t co gbbixeshan
-1	thinking of culling my non respondent followers you know who you are otherwise i m just talking to myself the first sign of madness
-1	made the mistake of googling chick culling my day is ruined im a vegan now
-1	rt discovery in a new study culling failed to decrease the feral cat population it actually increased gt gt http t co iv5d3las1k http
-1	rt rogodwinw67 the act govt exposed for the lies it used to try amp justify culling kangaroos in 2013 amp they are now at it again http
-1	rt a_kelly_ispca ah the old argument ad hominem lose argument attack person seaworld blasts ex trainer s character http t co vrqs
-1	just got my parents hooked on the100 cried during the culling episode again just can t get through it w o tears no matter times seen
-1	ah the old argument ad hominem lose argument attack person seaworld blasts ex trainer s character http t co vrqsk8xelu
-1	call to rethink hare culling the only things that need culling are tory mps http t co penz3tb5xj
-1	the act govt exposed for the lies it used to try amp justify culling kangaroos in 2013 amp they are now at it again http t co hubjugrdpr
-1	on ahbs rockingmonk is nowplaying after the culling by sacrilage on rock hard http t co p0qwe7or2e
-1	25 student discount on missguided at the moment
-1	rt highland_andy a clip on tonight s stv news on the proposal for a 3 year curtailment of m hare culling btw the hare footage mine ht
