-1	1 to 10 it worth eleven this mine is worth gold and the other are worth bronze
-1	ai weiwei s bronze zodiac animals set for wyoming display http t co 7qbyzchohu
-1	i liked thumbs up bronze in the digi app http t co guxncqdodn lol doing it for gold
-1	rt ilovehachi today a bronze statue of hachiko sits in his waiting spot outside the shibuya railroad station http t co exzkbauh
-1	rt beendinitas the bronze oklahoma city http t co xrkoldnzmi
-1	rt okkinderhookrg won a bronze medal in boxing at the 1984 olympics victim of a controversial disqualification http t co stwkkptuhn w
-1	we are polishing a bronze casting the mirror like polished finishing looks cool http t co fl3ji2nw34 http t co 692fwkettq
-1	won a bronze medal in boxing at the 1984 olympics victim of a controversial disqualification http t co stwkkptuhn waxmuseum
-1	rt arnaud400 lebogang phalula took silver and mandie brandt bronze behind semenya in the women s 800m
-1	v day here s a fossil from the bronze process the metal left an imprint in its ceramic shell https t co u0o5ittsxy
-1	forthvalleyds sam agnew amp jill henry with a gold amp bronze place finish in the 50m breast scottishswim http t co bdeucc5hfs
-1	i won 1st place in the bronze league in csr classics for android now you try http t co tb5r6iffma
-1	rt teamkauste some day soon we ll beat team_edin but today wasn t the day niklas made the draw to 4foot for the win and we ll face mich
-1	oh another mistake this is as bad as when jenny jones was siting in bronze at sochi we need aimee_fuller in the comm box
-1	rt shinken_dojo results from the ekf nationals jordan taylor kata 18 21 gold ben harrison kata 16 17 bronze
-1	mongols china and the silk road ancient bronze artifacts in alaska reveals trade with asia before columbus arrival http t co t9zxlkm9sg
-1	rt robertwatts_ well done our rentals team bronze award for best small letting agent yorkshire at the estas
-1	braegger wins the bronze medal with 14 941
-1	i love getting in on the latest trends my latest purchase bronze eyemakeup is amazing http t co cjunambdsi
-1	rt uegymnastics thomas gbr is the european champion on floor with 15 166 belyavskiy silver 15 066 and braegger bronze 15 941 congrat
-1	rt uegymnastics thomas gbr is the european champion on floor with 15 166 belyavskiy silver 15 066 and braegger bronze 15 941 congrat
-1	rt uegymnastics paseka rus is the european champion on vault with 15 250 steingruber is second 15 149 afanasyeva rus bronze 14 86
-1	rt uegymnastics paseka rus is the european champion on vault with 15 250 steingruber is second 15 149 afanasyeva rus bronze 14 86
-1	rt queensclassics nobody knows the truffles i ve seen one of odysseus men transformed into a pig bronze 5th bc walters_museum http
-1	rt uegymnastics thomas gbr is the european champion on floor with 15 166 belyavskiy silver 15 066 and braegger bronze 15 941 congrat
-1	rare early victorian bronze shop sign provisions just on the website mx http t co ogn6df0vuo
-1	thx tommy from pa the archives amp pics along with bronze statue are excellent the staff is very helpful and willing to answer questions
-1	thomas gbr is the european champion on floor with 15 166 belyavskiy silver 15 066 and braegger bronze 15 941 congrats echmontpellier
-1	rt teamgb well done purvisdanny as he claims all around bronze at the european gymnastics championships http t co fqoqhmyj3w
-1	rt hacksforgirls the body shop honey bronze shimmering dry oil wow http t co ddrlv3s6gl
-1	rt uegymnastics paseka rus is the european champion on vault with 15 250 steingruber is second 15 149 afanasyeva rus bronze 14 86
-1	rt uegymnastics paseka rus is the european champion on vault with 15 250 steingruber is second 15 149 afanasyeva rus bronze 14 86
-1	the bronze gallery http t co 93bylj0gjm
-1	enhance the color of your bronze http t co hyphqok6yq bronze sculpture
-1	rt uegymnastics paseka rus is the european champion on vault with 15 250 steingruber is second 15 149 afanasyeva rus bronze 14 86
-1	how columbus was beaten by the chinese bronze artefacts suggest east asia traded with the new world 2 600 years http t co t5dgmoelk9
-1	rayderley zapata esp go a do over and earned the fx finals bronze medal well deserved echmontpellier
-1	rt uegymnastics paseka rus is the european champion on vault with 15 250 steingruber is second 15 149 afanasyeva rus bronze 14 86
-1	rt uegymnastics paseka rus is the european champion on vault with 15 250 steingruber is second 15 149 afanasyeva rus bronze 14 86
-1	rt uegymnastics paseka rus is the european champion on vault with 15 250 steingruber is second 15 149 afanasyeva rus bronze 14 86
-1	bronze goddess by est e lauder is the best perfume ever i smell like a coconut
-1	rt uegymnastics paseka rus is the european champion on vault with 15 250 steingruber is second 15 149 afanasyeva rus bronze 14 86
-1	rt uegymnastics paseka rus is the european champion on vault with 15 250 steingruber is second 15 149 afanasyeva rus bronze 14 86
-1	rt uegymnastics paseka rus is the european champion on vault with 15 250 steingruber is second 15 149 afanasyeva rus bronze 14 86
-1	rt uegymnastics paseka rus is the european champion on vault with 15 250 steingruber is second 15 149 afanasyeva rus bronze 14 86
-1	paseka rus is the european champion on vault with 15 250 steingruber is second 15 149 afanasyeva rus bronze 14 866 echmontpellier
-1	results from the ekf nationals jordan taylor kata 18 21 gold ben harrison kata 16 17 bronze
-1	i m going to be stuck in fucking bronze the rest of my life
-1	rt niamhrippin this girl killed it elliedownie first ever senior europeans and absolutely smashed the all around bronze to make histo
-1	rt teamkauste some day soon we ll beat team_edin but today wasn t the day niklas made the draw to 4foot for the win and we ll face mich
-1	the bronze head of seuthes iii a tribal king of the thracians it is dated to the 4th 3rd centuries bc http t co mfunrkn3yh
-1	some day soon we ll beat team_edin but today wasn t the day niklas made the draw to 4foot for the win and we ll face michel in bronze game
-1	rt bbcsport ellie downie amp dan purvis have already won bronze medals watch the action from the european champs live on bbcone http t
-1	floyd mayweather s bronze medal amp its aftermath inside mayweather vs pacquiao talks to the supervising http t co ni55uizxvj
-1	rt iwrf congratulations to switzerland on winning bronze the iwrf european division b championship game between france http t co zp
-1	willow1871 our u19s junior team are also in action today 3 30pm in bronze medal match of the british wheelchair basketball junior league
-1	rt lululiebtmafuyu bennis blick so bitch please ahah bronze dahinter so omg he s so hoooot xbronzebeardx join_the_circle http t
-1	rt bbcsport ellie downie amp dan purvis have already won bronze medals watch the action from the european champs live on bbcone http t
-1	enroute chicago photo iconic bronze lions at the art by holeinthedonut 7 more http t co rxhgusdfzs ttot
-1	i won 1st place in the bronze league in csr classics for android now you try http t co xai0ic0yf4
-1	rt bbcsport ellie downie amp dan purvis have already won bronze medals watch the action from the european champs live on bbcone http t
-1	recording bass for the unnamed project today custom p bass gt sansamp gt hairballaudio bronze pre sounding gnarly
-1	rt digitour ticket update the last 9 bronze vip s at digifestma last 9 massachusetts gt http t co 7kksgzgkoc lt rt http t
-1	rt ruby_usat i got bronze at the u s open http t co 0bgzqjumh7
-1	rt digitour ticket update the last 9 bronze vip s at digifestma last 9 massachusetts gt http t co 7kksgzgkoc lt rt http t
-1	reggiecraigo nickrog83 boof08 i kim hagdorn believe you won that little prick hayden ballanytne 2nd with the bronze to boof08 haggers
-1	i came top of the bronze league in csr classics for android get it for free now http t co wmspqvu2m6
-1	rt hacksforgirls the body shop honey bronze shimmering dry oil wow http t co ddrlv3s6gl
-1	rt digitour ticket update the last 9 bronze vip s at digifestma last 9 massachusetts gt http t co 7kksgzgkoc lt rt http t
-1	rt teamgb history is made as elliedownie wins all around bronze at the european gymnastics champs huge congrats http t co vfbcpzzn2k
-1	rt janewthompson good luck to netballsa 17s amp 19s in their playoffs for bronze tomorrow tough week but in the mix
-1	claudia_frag congratulations for bronze n the all round final x
-1	earned 3 ps3 trophies 2 bronze and 1 gold in poker night at the inventory 2 http t co nmkktjqrtk
-1	queens of the stone age the bronze
-1	rt psst_heyhello ikon fanartupdate 9 fandom fandom yunhyeong will use bronze 4 the meantime http t co bfcn9hzsji ht
-1	rt psst_heyhello ikon fanartupdate 9 fandom fandom yunhyeong will use bronze 4 the meantime http t co bfcn9hzsji ht
-1	i beat the bronze league in csr classics for android get it free http t co mmjroto4mk
-1	check out the resident s matches results wk commencing 13th april here http t co ie5lmpdgkt
-1	rt psst_heyhello ikon fanartupdate 9 fandom fandom yunhyeong will use bronze 4 the meantime http t co bfcn9hzsji ht
-1	the thor heimdallr numen helmet ox head bronze pendant necklace for men fo1032 http t co mmeuntcgvu http t co fnzf3svqoc
-1	like bitch i just did the daily tower and got gold tier and got n a i got bronze on the hourly and got like 4000th in the world ffs
-1	fun at adultchamps15 in the kiss and cry with bronze solo dancers usfigureskating http t co nennwshiyn
-1	rt teamgb well done purvisdanny as he claims all around bronze at the european gymnastics championships http t co fqoqhmyj3w
-1	rt britgymnastics dan purvis so happy to be back in the all around medals european championship bronze medallist 2015euros http t co
-1	i m not sure how matchmaking works in league of legends but i feel like my team shouldn t have bronze players while the other has diamond
-1	rt purvisdanny so happy to get the bronze in the europeans all round competition today big battle and good luck to are guys in the final
-1	the martin amp co yeovil team at the estas yesterday winning silver voted by tenants and bronze voted by landlords http t co uhtkb4ea0d
-1	rt digitour ticket update the last 9 bronze vip s at digifestma last 9 massachusetts gt http t co 7kksgzgkoc lt rt http t
-1	rt bbcsport ellie downie amp dan purvis have already won bronze medals watch the action from the european champs live on bbcone http t
-1	rt bbcsport ellie downie amp dan purvis have already won bronze medals watch the action from the european champs live on bbcone htt
-1	bronzefox welcome to the club bronze i don t know either what to post
-1	rt hacksforgirls the body shop honey bronze shimmering dry oil wow http t co ddrlv3s6gl
-1	rt charsfavorite lion watch pendant pocket watch with bronze lion pottiteam https t co ac7xemtjsz http t co xfvqznp0fe
-1	rt bbcsport ellie downie amp dan purvis have already won bronze medals watch the action from the european champs live on bbcone http t
-1	rt digitour ticket update the last 9 bronze vip s at digifestma last 9 massachusetts gt http t co 7kksgzgkoc lt rt http t
-1	rt wildhindacor the bronze horseman pushkin summary http t co nczgt1riwm
-1	a bronze age hero appears as living data in an online game server to fight the devourer of millions http t co 0zytxkq2vk by gamesavant
-1	the pelican lamp by tarasboom for estuarydesign from russia is beautifully made of steel and bronze as well as http t co kcoficzx17
-1	the pelican lamp by tarasboom for estuarydesign from russia is beautifully made of steel and bronze https t co emqq2wyjrl
-1	rt bbcsport ellie downie amp dan purvis have already won bronze medals watch the action from the european champs live on bbcone http t
-1	rt bbcsport ellie downie amp dan purvis have already won bronze medals watch the action from the european champs live on bbcone htt
-1	rt digitour ticket update the last 9 bronze vip s at digifestma last 9 massachusetts gt http t co 7kksgzgkoc lt rt http t
-1	ccsawards pictures released the coleshilllc team picking up bronze watesgroup north_warks_bc empa_ii
-1	rt bbcsport ellie downie amp dan purvis have already won bronze medals watch the action from the european champs live on bbcone http t
-1	rt iwrf congratulations to switzerland on winning bronze the iwrf european division b championship game between france http t co zp
-1	rt iwrf congratulations to switzerland on winning bronze the iwrf european division b championship game between france http t co zp
-1	earned 11 ps3 trophies 2 bronze 4 silver 4 gold and 1 platinum in shadow of the colossus http t co kvojvkzkka
-1	rt hacksforgirls the body shop honey bronze shimmering dry oil wow http t co ddrlv3s6gl
-1	rt iwrf switzerland is the bronze medalist for the iwrf ecwr division b after the game against poland http t co ygzgupmewy
-1	the bronze wraith http t co 7fk4sojfff
-1	rt bbcsport ellie downie amp dan purvis have already won bronze medals watch the action from the european champs live on bbcone htt
-1	rt bbcsport ellie downie amp dan purvis have already won bronze medals watch the action from the european champs live on bbcone http t
-1	rt team_scotland gymnastics massive well done purvisdanny the new european all around bronze medallist what a performance http t co
-1	kris got the medals rolling now it s the girls turn erin with silver and orla with bronze in girls 400m free 13 amp 12 yrs events medals
-1	rt hacksforgirls the body shop honey bronze shimmering dry oil wow http t co ddrlv3s6gl
-1	rt vicky_austen and a bronze in the same 100 fly for beccaswims reddeercatalina swimalberta australiatour
-1	rt bbcsport ellie downie amp dan purvis have already won bronze medals watch the action from the european champs live on bbcone http t
-1	switzerland is the bronze medalist for the iwrf ecwr division b after the game against poland http t co ygzgupmewy
-1	rt bbcsport ellie downie amp dan purvis have already won bronze medals watch the action from the european champs live on bbcone http t
-1	earned 1 psn trophy 1 bronze in the binding of isaac rebirth http t co gwn6fsohce
-1	congratulations to switzerland on winning bronze the iwrf european division b championship game between france http t co zpgwtqiu5q
-1	rt niamhrippin this girl killed it elliedownie first ever senior europeans and absolutely smashed the all around bronze to make histo
-1	tornadoskings are in the bronze medal match at junior league after winning their quarter final 24 8 then losing the semi final match 30 18
-1	rt derventioexcel bronze in the 50m brs for vaseycakes in a new pb 31 12 to finish her 2015 british championships in style
-1	rt hacksforgirls the body shop honey bronze shimmering dry oil wow http t co ddrlv3s6gl
-1	ellie downie amp dan purvis have already won bronze medals watch the action from the european champs live on bbcone http t co 5w19ogwnvt
-1	rt hacksforgirls the body shop honey bronze shimmering dry oil wow http t co ddrlv3s6gl
-1	rt bbcsport ellie downie amp dan purvis have already won bronze medals watch the action from the european champs live on bbcone http t
-1	rt bbcsport ellie downie amp dan purvis have already won bronze medals watch the action from the european champs live on bbcone http t
-1	rt digitour ticket update the last 9 bronze vip s at digifestma last 9 massachusetts gt http t co 7kksgzgkoc lt rt http t
-1	seller revealed for christie s blockbuster giacometti bronze in the air art news amp gossip http t co d9dwaprnsd
-1	rt hacksforgirls the body shop honey bronze shimmering dry oil wow http t co ddrlv3s6gl
-1	2 2 new furniture motto crafted from the finest bronze
-1	rt bbcsport ellie downie amp dan purvis have already won bronze medals watch the action from the european champs live on bbcone http t
-1	rt teamgb my maths isn t the best but i knew i needed to end well on pommel purvisdanny http t co tbzviqf0k5 http t co ntgukr2ylb
-1	rt la2015 yesterday we unveiled the la2015 world games medals here they are in all of their gold silver amp bronze glory http t co 2n
-1	rt bbcsport ellie downie amp dan purvis have already won bronze medals watch the action from the european champs live on bbcone http t
-1	rt bbcsport ellie downie amp dan purvis have already won bronze medals watch the action from the european champs live on bbcone http t
-1	earned 18 ps3 trophies 16 bronze and 2 silver in where the wild things are http t co acxicm4sgv
-1	rt bbcsport ellie downie amp dan purvis have already won bronze medals watch the action from the european champs live on bbcone http t
-1	rt bbcsport ellie downie amp dan purvis have already won bronze medals watch the action from the european champs live on bbcone http t
-1	rt bbcsport ellie downie amp dan purvis have already won bronze medals watch the action from the european champs live on bbcone http t
-1	livebetsonline ellie downie amp amp dan purvis have already won bronze medals watch the action from the via http t co hlfwkaeuy7
-1	discover archaeological finds from the stone bronze and viking ages at stavanger archaeological museum at stop 8 regionstavanger
-1	rt bbcsport ellie downie amp dan purvis have already won bronze medals watch the action from the european champs live on bbcone http t
-1	rt bbcsport ellie downie amp dan purvis have already won bronze medals watch the action from the european champs live on bbcone http t
-1	kristian wins the first medal of the day with bronze in the boys 13yrs 400 free just edging out zach superb effort medals swlc15
-1	getting my bronze on ft the new aquatic treasures summer collection from clarins_uk gt gt http t co 39zlinug3s bbloggers lbloggers
-1	rt bbcsport ellie downie amp dan purvis have already won bronze medals watch the action from the european champs live on bbcone http t
-1	ellie downie amp dan purvis have already won bronze medals watch the action from the european champs live on bbcone http t co ednijzb9hz
-1	congratulations to pippabritton on wining a bronze plaquette amp john cavanaugh who won the 1st ever gold plaquette agbagm15 inspiring
-1	east asia traded with the new world 2 600 years ago according to bronze artefacts http t co mvywjgezzn
-1	east asia traded with the new world 2 600 years ago according to bronze artefacts an ancient bronze buckle http t co na2fkha8jk
-1	purvisdanny well done on the bronze medal x
-1	play with me please says the doggie i m frozen and stuck to the seat says the bronze statue http t co tnabhog6h7
-1	rt derventioexcel bronze in the 50m brs for vaseycakes in a new pb 31 12 to finish her 2015 british championships in style
-1	rt digitour ticket update the last 9 bronze vip s at digifestma last 9 massachusetts gt http t co 7kksgzgkoc lt rt http t
-1	there s no time like the present moment to make a serious dent more for scorpio http t co xgwg7pf1sy
-1	tech news east asia traded with the new world 2 600 years ago according to bronze artefacts http t co dna0boywqd
-1	i took part in the sun tanning olympics i got bronze tim vine
-1	rt britathletics ultrabritton reflects on world bronze and team gold at the iau 24h world and european champs http t co en51tbjea1
-1	ultrabritton reflects on world bronze and team gold at the iau 24h world and european champs http t co en51tbjea1
-1	find out here gt http t co zdhr4whvf4 how we have achieved the bronze zero waste award thank you to all your efforts recyclestratford
-1	rt iihfhockey dpr korea wins the division iii after beating host turkey in ot in the deciding game luxembourg takes bronze http t co
-1	cssp4 lol knowing yuzu can be manic and cheerful out of nowhere well it may be today his tension got low bcoz of the bronze haha
-1	rt faceyathletics elliot johnson qualifies for the badminton provs by capturing a silver medal in metro sr boys singles abby garner won
-1	valiant hearts the great war never forget bronze ps4share http t co oivwqr2v7y
-1	does being pregnant change your skin pigment i m beginning to see a bronze goddess in the mirror well a red one anyway
-1	what changed since the last season in the ladder formerly ranked gold now back to bronze via r starcraft http t co nk68r81ss5 el
-1	rt umich_be congrats to the future of bronze elegance introducing our 2015 2016 president christan worthy and vp ashley parker http
-1	earned 2 ps4 trophies 2 bronze in the last of us remastered http t co dbionnrcdv
-1	east asia traded with the new world 2 600 years ago according to bronze artefacts http t co qpggz72xuw
-1	l oreal 204 out of the blue wear infinite quad eye shadow blues brown bronze http t co qyavosv7wd http t co zpu7clx6qj
-1	i came top of the bronze league in csr classics for android get it for free now http t co w0x0vucrpw
-1	tucker dupree 07 day two of the 2015 idm berlin ipc swimming dupree claimed bronze in the 100m backstroke friday
-1	earned 5 ps4 trophies 5 bronze in lords of the fallen http t co dvidqa0n3s
-1	good luck to the heliosesu bronze dofe teams today nice sunny day for it very windy though https t co tnllr11bjy
-1	in my infinite wisdom while drinking last night it seems i edited a tip going for the bermagui bronze http t co o1mge3rgdu
-1	spectating cardboard division worse than bronze some of the worst players to touch lol http t co 1feelj6rpl
-1	broadshot please tell me the best time of the day then and watch all the bronze fucks feed my lane still
-1	3 antique bronze furniture embellishments from the treeantiques http t co xn4wkymjnk etsy
-1	rt digitour ticket update the last 9 bronze vip s at digifestma last 9 massachusetts gt http t co 7kksgzgkoc lt rt http t
-1	antique bronze furniture embellishments from the treeantiques http t co xx2xrrfwpz etsy
-1	bronze in the 50m brs for vaseycakes in a new pb 31 12 to finish her 2015 british championships in style
-1	full weekend coming up next week for ernulf dofe staff silver assessment in the peaks amp bronze practice walk in cambridgshire busy times
-1	the bronze casio watch
-1	coming soon a fabulous bronze by mackenzie thorpe titled on the dock of the bay watching the tide this is http t co kpll5nl8qo
-1	i beat the bronze league in csr classics for android get it free http t co qewbogm42j
-1	the latest mkx achievement it was easy mortal kombat x trophies dark future bronze perform 50 brutalities http t co sxfedvlz5u
-1	rt metmuseum in this work rimmer conveys the wounded warrior s physical stress in bronze http t co ogy1defxhk metviewpoints http
-1	rt dusty_daniels check out this item i just got reins of the bronze drake http t co fpzaxvvboa warcraft
-1	earned 2 ps3 trophies 1 bronze and 1 silver in star ocean the last hope international http t co amjr4cx1at
-1	earned 4 ps4 trophies 3 bronze and 1 silver in borderlands the pre sequel http t co gxklrbjtwz
-1	i liked a youtube video from officialhhi http t co eelfkbfdxo sol t shine japan varsity bronze medal winner at the 2014 hhi
-1	i beat the bronze league in csr classics for android get it free http t co wmspqvldkg
-1	rt byzantium1200 the first statue of the exhibition ready to be sent to bronze casting http t co iuxc314sk3
-1	the everyday life series books 1 3 old new stone bronze iron age roman britain http t co hsznogkyiw http t co blxiannbwj
-1	bloodborne blood gem contact bronze ah the sweet smell of progress bloodborne ps4share http t co 50po8ndyla
-1	east asia traded with the new world 2 600 years ago say scientists http t co hq0uto6sgc via mailonline
-1	rt kimmerghameh school s out although not forever for this expeditionary force hitting the dofe bronze trail sunnysaturday http t c
-1	i won 1st place in the bronze league in csr classics for android now you try http t co vqjzab8mqc
-1	booazizi mlkstudios stellerence joedouglas1 the philistines originated as bronze age mycenaean greek non semitic seafarers they are
-1	tehjos i m quite tan now and my tan is like uneven one damn ugly now it s not the bronze kind of nice tan i m 2 shades darker
-1	rt metmuseum in this work rimmer conveys the wounded warrior s physical stress in bronze http t co ogy1defxhk metviewpoints http
-1	well done purvisdanny on a brilliant performance yesterday in the all around well deserved bronze medal britgymnastics echmontpellier
-1	all white bronze with chrome lips all black champagne gold with chrome lips can t decide the colour for my lmgt1 s what would suit sil
-1	bronze lady bust the veiled bride solid marble base signed 35 5cm http t co 1yrrkk1uzz http t co io7egdzk3y
-1	i finished 1st at the bronze tournament in quiz run my username is damfqueen download this app to challenge me http t co 7z85wkdavi
-1	rt chocolatemswitt come and see us tomorrow livelymington to try the bronze award chocolate from acadofchocolate newforestmarque ht
-1	mr omang kumar director of mary kom wins the bronze horse for best film ages 9 11 at the stockholm junior film http t co ocyyoabvm5
-1	scoop 6 pethers moon i shot the sherriff belardo newstead abbey bronze angel al co
-1	mxrganhigginss nah my last comp forgot the most important move and walked away with bronze
-1	lesterftbarakat didn t get the gold as expected got the first bronze though
-1	rt ashpalbhogal k_randhawa90 yes for sure did u have fun congrats on the bronze medal lovely meeting you and your mom
-1	bronze and silver d of e on practice perfect weather for the weekend good luck to everyone broadwaternews http t co 9xfaafyltr
-1	artifact ancient roman bronze key ring the roman treeantiques http t co ecl4ghcozu etsy
-1	rt chocolatemswitt come and see us tomorrow livelymington to try the bronze award chocolate from acadofchocolate newforestmarque ht
-1	earned 6 ps3 trophies 6 bronze in sly cooper and the thievius raccoonus http t co nfhdtd71ob
-1	rt janewthompson good luck to netballsa 17s amp 19s in their playoffs for bronze tomorrow tough week but in the mix
-1	a bronze sculpture by artist matteo pugliese called la promessa the promise a fascinating con http t co bpgaievvpw
-1	rt byzantium1200 the first statue of the exhibition ready to be sent to bronze casting http t co iuxc314sk3
