-1	mr omang kumar director of mary kom wins the bronze horse for best film ages 9 11 at the stockholm junior film festival
-1	rt metmuseum in this work rimmer conveys the wounded warrior s physical stress in bronze http t co ogy1defxhk metviewpoints http
-1	amp fight for the prizes only 3 of them can get the 3rd prize in our contest is the bronze twig the second prize is the silver twig
-1	rt vicky_austen swimmingcanada juniors end the dolphinsaus agechamps15 with 11 gold 6 silver and 9 bronze medals fastswimming a
-1	a bronze age hero appears as living data in an online game server to fight the devourer of millions http t co eijocdbirz by gamesavant
-1	the bronze wedding photography package this package will cover 50 of your wedding day with the other 50 you http t co tmsdzp2rou
-1	hi here s the bronze lady again by valentine french 15 tall c1900 1750 tel 01423 530 484 http t co s37mcybfq9
-1	free ebay sniping rt http t co v0rnlkspce russia orthodox bronze icon virgin the joy 19th century please favorite amp share
-1	ebay bid last second rt http t co ns9dsarefh russia orthodox bronze icon saint john the baptist 19th century enameled please favo
-1	swimmingcanada juniors end the dolphinsaus agechamps15 with 11 gold 6 silver and 9 bronze medals fastswimming australiatour
-1	good luck to netballsa 17s amp 19s in their playoffs for bronze tomorrow tough week but in the mix
-1	the pfa has announced the women s player of the year nominees for the 2014 15 season eniola aluko lucy bronze karen carney jess
-1	the first statue of the exhibition ready to be sent to bronze casting http t co iuxc314sk3
-1	ebay snipe rt http t co upmi4cgwse russia orthodox bronze icon virgin the joy 19th century please favorite amp share
-1	last second outbid rt http t co dkek3agqsv russia orthodox bronze icon saint john the baptist 19th century enameled please favori
-1	rt digitour ticket update the last 9 bronze vip s at digifestma last 9 massachusetts gt http t co 7kksgzgkoc lt rt http t
-1	congratulations to nossbeerworks for receiving the siba bronze award for mew stone this weekend
-1	bronze medal for dunlevy and mccrystal huge congratulations from the team at first endurance uk http t co tvpfn1mtxn
-1	earned 8 ps4 trophies 6 bronze 1 silver and 1 gold in tennis in the face http t co nxiyej4rkv
-1	hurrah some barrows off the wiltshire chalk can we do some survey he_archaeology over north wiltshire to find the bronze age archwilts
-1	all 6 bronze teams now across the first ferry of the weekend sun is out but that wind is cooooold http t co j5ipoyaf4u
-1	last second outbid rt http t co ymwpfszzzd antique austrian vienna bronze whw hagenauer felix the cat statue sculpture please fa
-1	a bronze age hero appears as living data in an online game server to fight the devourer of millions http t co 6wksmjavv7 by gamesavant
-1	rt digitour ticket update the last 9 bronze vip s at digifestma last 9 massachusetts gt http t co 7kksgzgkoc lt rt http t
-1	running of the belmont bronze statue http t co ec2eeiwaus http t co jwk8dmc1fg
-1	running of the belmont bronze statue http t co ruc5ltboxu http t co kpw0ym8vha
-1	bronze figurine bell in the form of a man in an overcoat and hat http t co uqdqhimib1 http t co brngp3zypt
-1	congratulations to team japan for winning the bronze medal in wtt15
-1	a real cute bug this bronze shiny kind greetin happy free human feet touchin the land aaah 8 gt lt 8 springreenin lt 3 http t co uxkyub1xf4
-1	congratulations from the bsc aquastars to nottingham gymnast elliedownie on her bronze at the european championships xx
-1	i just earned the proving yourself bronze damage achievement warcraft http t co afwv4tik9c
-1	milk teeth remind me of all those bands from buffy the vampire slayer that played in the bronze
-1	auctions money official caravel bronze collection quincentennial of the discovery of america http t co gott4fh8k3 coins collections
-1	the birthplace of the vedas the global bronze age civilization of sanskrit gaelic spirituality ancestor worship https t co 8lo2flrtjq
-1	rt lpobryan a bronze age hero appears as living data in an online game server to fight the devourer of millions http t co r5qpsftwfl b
-1	rt digitour ticket update the last 9 bronze vip s at digifestma last 9 massachusetts gt http t co 7kksgzgkoc lt rt http t
-1	last second outbid rt http t co ulsy5u0gjm gorgeous antique genuine bronze medal by vachette the sacred heart of mary 1 please fa
-1	vintage german bronze cross crucifix the lord has risen christianity rare http t co nyziu2k0yy http t co zc7idymel1
-1	a bronze age hero appears as living data in an online game server to fight the devourer of millions http t co r5qpsftwfl by gamesavant
-1	rt spencerfreddie starting the day with a little bit of bronze https t co v7ly7gmwxo
-1	rt tom_gatti alan garner the stone age axe the space telescope amp my life in storytelling http t co mwbb5wos0m cc neilhimself http
-1	the bronze look princeton wv http t co muaqrvemhz
-1	a bronze age hero appears as living data in an online game server to fight the devourer of millions http t co qe6ufianib by gamesavant
-1	18 apr 1982 dublin darren sutherland born he won olympic bronze in men s middleweight boxing at the 2008 http t co td2umfflof
-1	a bronze age hero appears as living data in an online game server to fight the devourer of millions http t co 56ewlla5g7 by gamesavant
-1	bronze dofe groups still going strong despite the cold night good job the sun is back out http t co evhwe2ggs2
-1	rt tombristow2 yep can t do draw my life all i can think of is being born youtube and my bronze in the british for tae kwon do
-1	bronze bust of russian cosmonaut yuri gagarin hero of the soviet union http t co 999baznoqw http t co r6lch6noio
-1	bronze bust of russian cosmonaut yuri gagarin hero of the soviet union http t co 2vti5fnjkm http t co rrdgatsnc2
-1	rt digitour ticket update the last 9 bronze vip s at digifestma last 9 massachusetts gt http t co 7kksgzgkoc lt rt http t
-1	rt queensclassics nobody knows the truffles i ve seen one of odysseus men transformed into a pig bronze 5th bc walters_museum http
-1	the bronze trophy i made for the irish stable staff awards they were very happy with them and i am delighted http t co xd8vxi6ly5
-1	rt heather_jansch this bronze casting s better than the original dylan about to go to the green green grass of his new welsh home htt
-1	appointments made easy bronze now have their own app available in the app store right now you can book your http t co td8amhmmjj
-1	k_randhawa90 yes for sure did u have fun congrats on the bronze medal lovely meeting you and your mom
-1	a bronze age hero appears as living data in an online game server to fight the devourer of millions http t co tdhvt0gajq by gamesavant
-1	earned 5 ps3 trophies 2 bronze 2 silver and 1 gold in shadow of the colossus http t co kvojvkzkka
-1	earned 8 ps4 trophies 3 bronze and 5 silver in the walking dead season 2 http t co iffckzeqau
-1	rt superfyan i fucking give up on fut my players become fucking bronze players on the field
-1	united kingdom 55 solid bronze great hits remastered the beautiful south http t co lcryzorc6m music itunes iphone apple
-1	starting the day with a little bit of bronze https t co v7ly7gmwxo
-1	gold team usa silver team russia bronze team japan congratulations to all the winners o team japan omedetou gozaimasu
-1	i fucking give up on fut my players become fucking bronze players on the field
-1	rt purvisdanny so happy to get the bronze in the europeans all round competition today big battle and good luck to are guys in the final
-1	bronzefox gaminggoddess32 welcome back to the twitter verse bronze
-1	rt brodhurst outstanding day for bronze d of e in the cotswolds http t co dyzzpoblv0
-1	outstanding day for bronze d of e in the cotswolds http t co dyzzpoblv0
-1	rt nakediceblog team usa gets gold team russia the silver and team japan the bronze wtt15
-1	the way this comp is scored pretty much guarantees japan bronze as long as they send some decent singles skaters lol
-1	team usa gets gold team russia the silver and team japan the bronze wtt15
-1	i won 1st place in the bronze league in csr classics for android now you try http t co okhsky04mm
-1	a bronze age hero appears as living data in an online game server to fight the devourer of millions http t co ex1qat1ovl by gamesavant
-1	rt vicky_austen and a bronze in the same 100 fly for beccaswims reddeercatalina swimalberta australiatour
-1	cliveowen9 leetrundle10 in bronze with a statue outside the liberty magic daps legend
-1	2x gold bronze pirates of the caribbean jack sparrow aztec coin pendant necklace http t co xmxnhlg0rg http t co kyowgc89al
-1	finn o connor has won gold in the 200m breaststroke to go with his 400im medal emilie peterson has won bronze in the female event
-1	lebogang phalula took silver and mandie brandt bronze behind semenya in the women s 800m
-1	the senior men s competition tomorrow sees glasgow2014 bronze medallist markdry in action bertrammemorial http t co xpvq1qju0a
-1	rt teamgb well done purvisdanny as he claims all around bronze at the european gymnastics championships http t co fqoqhmyj3w
-1	my ranking changes from gold to bronze like all the time i still get matched with bitchassness vaingloryproblems http t co oayqiohcvt
-1	avengers and captain america bronze age issues captain america issues feature art by the legendary https t co 14px3k19rn
-1	craig_hughes_ sadiespooner jsmiller_ bronze statues outside the cathedral
-1	rt 2goodponies vintage collectible medal from the city of kobe japan bronze token solid bronze medal https t co fnjiukrsst etsymntt
-1	rt digitour ticket update the last 9 bronze vip s at digifestma last 9 massachusetts gt http t co 7kksgzgkoc lt rt http t
-1	rt digitour ticket update the last 9 bronze vip s at digifestma last 9 massachusetts gt http t co 7kksgzgkoc lt rt http t
-1	and a bronze in the same 100 fly for beccaswims reddeercatalina swimalberta australiatour
-1	just gone past watford on the train i see they still haven t got that bronze statue of simonnricketts erected at the station
-1	rt purvisdanny so happy to get the bronze in the europeans all round competition today big battle and good luck to are guys in the final
-1	rt la2015 yesterday we unveiled the la2015 world games medals here they are in all of their gold silver amp bronze glory http t co 2n
-1	clearing the attic pop 8 summer of 94 tbt soccer worldcampionship swe bronze lotsofbeer https t co xxwbjbkrcn
-1	rt youonlylutzonce up next is the 2015 worlds bronze medalist elena radionova wtt15
-1	rt youonlylutzonce up next is the 2015 worlds bronze medalist elena radionova wtt15
-1	up next is the 2015 worlds bronze medalist elena radionova wtt15
-1	126 96 puts wagner into 2nd next is the worlds bronze medalist elena radionova wtt15 b
-1	rt queensclassics nobody knows the truffles i ve seen one of odysseus men transformed into a pig bronze 5th bc walters_museum http
-1	doe was the most challenging time of my life and ive only done bronze haha
-1	rt 2goodponies vintage collectible medal from the city of kobe japan bronze token solid bronze medal https t co fnjiukrsst etsymntt
-1	earned 2 ps3 trophies 2 bronze in lego the lord of the rings http t co jcldjdxoq0
-1	year 10 bronze from marlborough going on the 25th please comment which your group are in out of snowdon scafell http t co ojlh8xnice
-1	prodnose that bronze fist in your house does is close the air vent in the chimney assuming an old house you have a chimney
-1	earned 1 ps4 trophy 1 bronze in the crew http t co oou12rycka
-1	earned 2 ps4 trophies 2 bronze in borderlands the pre sequel http t co kbleorxnwb
-1	i won 1st place in the bronze league in csr classics for android now you try http t co aukilend4z
-1	vintage collectible medal from the city of kobe japan bronze token solid bronze medal https t co fnjiukrsst etsymntt vintagemedallion
-1	rt southfieldhums dofe all groups away and walking here in the northants countryside on the first bronze expedition of 2015 more to
-1	dofe all groups away and walking here in the northants countryside on the first bronze expedition of 2015 more to follow mr monk
-1	shoppinglistsaturday item bronze gold silver share what you have that fits the theme run with it however http t co 4rn3wqntqq
-1	realdonaldtrump dmanhomee what it once was are you talking around the bronze age then
-1	the new york bronze medal for ekstra the bit player starring vilma santos congratulations ate vi http t co 2svyny8zik
-1	rt team_scotland gymnastics massive well done purvisdanny the new european all around bronze medallist what a performance http t co
-1	photo iconic bronze lions at the art institute of chicago http t co jquzakvxmn via holeinthedonut
-1	rt lululiebtmafuyu bennis blick so bitch please ahah bronze dahinter so omg he s so hoooot xbronzebeardx join_the_circle http t
-1	rt lululiebtmafuyu bennis blick so bitch please ahah bronze dahinter so omg he s so hoooot xbronzebeardx join_the_circle http t
-1	rt digitour ticket update 6 bronze vips left for digifest ma meet ur baes in the vip tent http t co lw1k1dvzd4 rt http t co
-1	little word bronze embodiment of the phrase garden sculpture or statue by anthony veale is now available from http t co plr8oxduz6
-1	the age of bronze auguste rodin 1875 at the v amp a http t co yly4mv2ipf
-1	rt proadstudio israel is not going away muslims need to get over it leave the bronze age move on to the 21st century http t co sdr0
-1	rt ewgardens muscari latifolium with bronze fennel an unexpectedly sophisticated plant combination in the https t co 3yvvisxani
-1	earned 6 ps4 trophies 4 bronze 1 silver and 1 gold in the wolf among us http t co o4cqjxqifn
-1	rt purvisdanny so happy to get the bronze in the europeans all round competition today big battle and good luck to are guys in the final
-1	corset of the day stunning steampunk gothic cotton corset black bronze steel boned http t co sh0rg12vq6
-1	i won 1st place in the bronze league in csr classics for android now you try http t co ibn2vqozei
-1	rt purvisdanny so happy to get the bronze in the europeans all round competition today big battle and good luck to are guys in the final
-1	earned 1 ps4 trophy 1 bronze in the shadow of new despair http t co 8yvfpeas1j
-1	excellent day at estas2015 yesterday lettings won silver amp bronze awards for south east for the best agency for tenants amp landlords wkd
-1	rt proadstudio israel is not going away muslims need to get over it leave the bronze age move on to the 21st century http t co sdr0
-1	sportsfreakconz good i like the details too bronze statue bricks from mt cook prison and it s working at night too
-1	rt queensclassics nobody knows the truffles i ve seen one of odysseus men transformed into a pig bronze 5th bc walters_museum http
-1	india s arpinder singh wins the bronze medal in men s triple jump event
-1	rt the_estas and silver runner up was lynks estate agents and the bronze went to logic estates
-1	rt proadstudio israel is not going away muslims need to get over it leave the bronze age move on to the 21st century http t co sdr0
-1	rt narendramodi in the midst of meetings with german ceos got the news about the bronze in azlan shah cup congratulations to the indian
-1	rt isu_reporter rank 4 day 2 wtt15 can with world bronze medalists weaverpoje who came 2nd in the free dance guess their music http
-1	hard candy glow all the way instant bronze gradual self tanner 438 deep tan x 2 http t co wqq4aqqjkq http t co 5hxpohaavc
-1	houseoffraser iam really shocked at the lack of response from hof i asked when el bronze goddess perfume will be released and no reply
-1	archangel saint michael defeating the devil 1951 belgian bronze medal http t co nauw1auv6p http t co jhsn3uwpfh
-1	britishmuseum metmuseum what s the provenance of the exquisite bronze figure loaned to the defining beauty exhibition think i missed it
-1	tnpkubz one day i d like the honor of playing a game with you if i may i know i m bronze but still would be cool d
-1	rt chiloopalliance the iconic cast bronze clocks on state street got a makeover this week http t co 6e0s5d2i7w http t co zbatgrffa4
-1	bevils1sg thanks for the bronze lt 3 lmfao
-1	we manufacturer brassearthingaccessories that has been made from the high quality material http t co jn5vcwgghn http t co x2oitvrtf2
-1	rt metmuseum in this work rimmer conveys the wounded warrior s physical stress in bronze http t co ogy1defxhk metviewpoints http
-1	rt proadstudio israel is not going away muslims need to get over it leave the bronze age move on to the 21st century http t co sdr0
-1	rt proadstudio israel is not going away muslims need to get over it leave the bronze age move on to the 21st century http t co sdr0
-1	bring your saturday morning fire to the entrancing tango 10 45 newcomer foxtrot amp tango 10 45 associate bronze tango http t co zuzzuj6fge
-1	rt digitour ticket update the last 9 bronze vip s at digifestma last 9 massachusetts gt http t co 7kksgzgkoc lt rt http t
-1	good luck to all of the pupils undertaking their duke of edinburgh bronze award expedition today
-1	rt digitour ticket update the last 9 bronze vip s at digifestma last 9 massachusetts gt http t co 7kksgzgkoc lt rt http t
-1	the bronze movie online http t co atdxdvdm3w
-1	the bronze medal http t co 8efqwjxmdb
-1	earned 3 ps4 trophies 1 bronze and 2 silver in dark souls ii scholar of the first sin http t co qv3wy5cjeu
-1	rt shane_casey great night for publicisdublin at the apmc_ireland star awards 4 golds 2 silvers 1 bronze and 3 category wins publ
-1	i saw harry smoke in my class inb4 i get in bronze b4 the season end i quit league
-1	rt sportsshs great to see ex surbiton high skiers dominating the podium at the british champs amp bella y11 bronze in u16 gs http t co d
-1	penn state administration removes bronze sculpture of the late joe paterno http t co cqyimkugeb bronze sculpture joepaterno
-1	the grand staircase at buckingham palace in london has balusters made of oak amp bronze casting the stairs were designed for king george iv
-1	dress rehearsal today especially the bronze to gold classical
-1	rt teamgb history is made as elliedownie wins all around bronze at the european gymnastics champs huge congrats http t co vfbcpzzn2k
-1	rt purvisdanny so happy to get the bronze in the europeans all round competition today big battle and good luck to are guys in the final
-1	guardian of the pride bronze statue http t co o6nlxu5syp http t co dfpqnxzofw
-1	on the trail bronze statue http t co hicnxvi5u5 http t co acpl0w2ujn
-1	rt robgreenlee watch the 10th annual podcast awards at 2015 nmx nab now gt http t co vgo7bilr1o bronze sponsored by spreaker podca
-1	rt purvisdanny so happy to get the bronze in the europeans all round competition today big battle and good luck to are guys in the final
-1	rt debconf the folks at univention http t co 4ziy29mhrm became bronze sponsors of debconf15 thank you very much http t co nwocouc
-1	rt hxppyalien almost all of the bronze zodiac signs have been restocked and a few of the silver ones have been too http t co zwroin
-1	rt metmuseum in this work rimmer conveys the wounded warrior s physical stress in bronze http t co ogy1defxhk metviewpoints http
-1	rt teamgb well done purvisdanny as he claims all around bronze at the european gymnastics championships http t co fqoqhmyj3w
-1	rt britgymnastics dan purvis so happy to be back in the all around medals european championship bronze medallist 2015euros http t co
-1	rt pasport purvisdanny holds nerve to win men s all around bronze at the european championships in montpellier http t co ck0t9xxraw
-1	rt team_scotland gymnastics massive well done purvisdanny the new european all around bronze medallist what a performance http t co
-1	interesting phd studentship on offer leidenarchaeo http t co ea2whmnpnh
-1	rt hxppyalien almost all of the bronze zodiac signs have been restocked and a few of the silver ones have been too http t co zwroin
-1	rt hxppyalien almost all of the bronze zodiac signs have been restocked and a few of the silver ones have been too http t co zwroin
-1	rt gymnasticswatch ellie downie makes history with bronze at european gymnastics championships the guardian http t co l41nz0hgqa
-1	rt hxppyalien almost all of the bronze zodiac signs have been restocked and a few of the silver ones have been too http t co zwroin
-1	rt siba01 coastal brewery takes overall bronze with merry maiden mild at the south west region beer competition 2015 http t co uckv7ppo
-1	rt hxppyalien almost all of the bronze zodiac signs have been restocked and a few of the silver ones have been too http t co zwroin
-1	rt hxppyalien almost all of the bronze zodiac signs have been restocked and a few of the silver ones have been too http t co zwroin
-1	bronze dofe all packed up and heading to the new forest dofexcited newforest
-1	i earned a bronze badge by donating 14 days of cpu time to the clean energy project phase 2 at wcg http t co yjsu9imc6k wcgrid
-1	bronze medal for alistairdonohoe at the cyclingaus pararoadnats itt behind the ever green mickeyg4444 and rollingkyle
-1	so today s the day where i swim in hatfield for the first competition of 2015 looking forward to some models gold silver and bronze
-1	rt tombristow2 yep can t do draw my life all i can think of is being born youtube and my bronze in the british for tae kwon do
-1	sciencetech east asia traded with the new world 2 600 years ago according to bronze artefacts an ancient br http t co vfykvrxxuc
-1	sciencetech east asia traded with the new world 2 600 years ago according to bronze artefacts http t co sitnif6iea
-1	rt isu_reporter rank 4 day 2 wtt15 can with world bronze medalists weaverpoje who came 2nd in the free dance guess their music http
-1	rt proadstudio israel is not going away muslims need to get over it leave the bronze age move on to the 21st century http t co sdr0
-1	rt gymnasticswatch ellie downie makes history with bronze at european gymnastics championships the guardian http t co l41nz0hgqa
-1	bronze artefacts suggest east asia traded with the new world 2 600 years ago http t co urqxonfzez archaeology
-1	rt marcbuzzard at least 7 ring ouzels by the bronze age copper mines great orme still stunning sun rise today http t co ediaaquvbt
-1	rt robgreenlee watch the 10th annual podcast awards at 2015 nmx nab now gt http t co vgo7bilr1o bronze sponsored by spreaker podca
-1	autumn leaves bronze and crystal earrings 22 when you love the hazy days and crisp mornings of autumn these http t co exgulhuzub
-1	rt robgreenlee watch the 10th annual podcast awards at 2015 nmx nab now gt http t co vgo7bilr1o bronze sponsored by spreaker podca
-1	rt teamgb history is made as elliedownie wins all around bronze at the european gymnastics champs huge congrats http t co vfbcpzzn2k
-1	photo iconic bronze lions at the art institute of chicago http t co hlkgotp2hl
-1	earned 1 ps4 trophy 1 bronze in dark souls ii scholar of the first sin http t co jo2fhcegdj
-1	at least 7 ring ouzels by the bronze age copper mines great orme still stunning sun rise today http t co ediaaquvbt
-1	the bronze oklahoma city http t co xrkoldnzmi
-1	rt chrishewitt oh my god i want to go to there and by there i mean wherever the hell this plane goes http t co bbijtwxrzb
-1	at http t co waayig3ovt gilt bronze decorative box a square gilt bronze decorative box with a red felt interior the top of the box
-1	watch the 10th annual podcast awards at 2015 nmx nab now gt http t co vgo7bilr1o bronze sponsored by spreaker podcasting
-1	aqua glow in the dark necklace collectible bronze chain findings 18in chain bonanza http t co yrdnfbh7av http t co vvcwlnzo4t
-1	every time i take a long look at my legs i just want to shave all the hair off just want that polished bronze pebble look ya feel me
-1	rt team_scotland gymnastics massive well done purvisdanny the new european all around bronze medallist what a performance http t co
-1	kes_dofe hope you ll let us plenty of updates about the boys on the bronze practice expedition this weekend so we know they re ok thanks
-1	rt purvisdanny so happy to get the bronze in the europeans all round competition today big battle and good luck to are guys in the final
-1	rt mab_jewing mortgage advice bureau southwest pick up bronze in the regional independent mortgage broker category at the estas
-1	earned 3 ps4 trophies 3 bronze in the evil within http t co 8rmqipgdet
-1	rt niamhrippin this girl killed it elliedownie first ever senior europeans and absolutely smashed the all around bronze to make histo
-1	rt sortingbot danymf_8 your buffalo is like a mist your bronze is like a fore your future lies with those inside the house of gryffindo
-1	rt rebeccamayguy a relatively normal pic with my crazy coach after a cheeky bronze in the 50m freestyle at the british https t co z3l4
-1	rt psst_heyhello ikon fanartupdate 9 fandom fandom yunhyeong will use bronze 4 the meantime http t co bfcn9hzsji ht
-1	earned 1 ps vita trophy 1 bronze in toukiden the age of demons http t co s4hvsn0cau
-1	rt britgymnastics she s done it elliedownie is the 2015 european championship all around bronze medallist historic result for gbr 20
-1	east asia traded with the new world 2 600 years ago according to bronze artefacts http t co m29saelu4u
-1	visiongirlcc oh yeah you know me i m always thwacking all the things missed you at the bronze the other night anything exciting happen
-1	rt navyhistorynews congressional gold amp bronze medals honors doolittle raiders and the usnavy s usshornet http t co c6nxnaclor http
-1	cleaning bronze formula inside and special treatment of the seats meguiars http t co ypjdeevywe
-1	check out bronze sculptor rube goldberg original chairman of the board 3 out of 12 signed http t co vslskq1rqy via ebay
-1	rt digitour ticket update the last 9 bronze vip s at digifestma last 9 massachusetts gt http t co 7kksgzgkoc lt rt http t
