-1	thank you amyschumer for letting us all know it s ok to be a trainwreck i was laughing non stop during your movie bc i m also a trainwreck
-1	amyschumer how many colleges are you visiting to promote trainwreck trainwreckcollegetour
-1	rt san_frances amyschumer trainwreckthemovie made us all feel like being a trainwreck is sometimes ok greatmovie
-1	amyschumer are you coming to minnesota to show trainwreck i really want to see it
-1	trainwreck city bravo brewers
-1	rt aveuaskew long distance relationships because everyone in your town knows you re a trainwreck
-1	amyschumer once again you re my kate upton trainwreck
-1	trainwreck such a great movie amyschumer i love you you re amazing
-1	rt san_frances amyschumer trainwreckthemovie made us all feel like being a trainwreck is sometimes ok greatmovie
-1	rt san_frances amyschumer trainwreckthemovie made us all feel like being a trainwreck is sometimes ok greatmovie
-1	rt san_frances amyschumer trainwreckthemovie made us all feel like being a trainwreck is sometimes ok greatmovie
-1	this pic trainwreck not always pretty but funny as hell amp the perf party trick thank u amyschumer trainwreckmovie http t co 3zf6l2zokm
-1	trainwreck is hilariously funny and true that s my fuckin life amyschumer
-1	amyschumer trainwreckmovie trainwreck killed it p s i m the one who asked u where you went for dinner
-1	rt aveuaskew long distance relationships because everyone in your town knows you re a trainwreck
-1	amyschumer congrats on trainwreck you crushed it so funny so well done blending in the serious elements and absurdist bits loved it
-1	i literally died laughing trainwreck osu ouab
-1	honestly one of the best movies i ve ever seen incredible job amyschumer trainwreck
-1	also kingjames was fucking hilarious trainwreck trainwreckmovie
-1	i love amyschumer more than i love councilman jamm amp lebron trainwreck
-1	rt aveuaskew long distance relationships because everyone in your town knows you re a trainwreck
-1	deep sweet and fucking hilarious trainwreck trainwreckcollegetour trainwreckmovie amyschumer is amazing
-1	amyschumer trainwreckthemovie made us all feel like being a trainwreck is sometimes ok greatmovie
-1	jeffculhane kbulg27 megbulger4 allow me to cut in uninvited and say that kate you re a trainwreck friendlyfatty
-1	rt aveuaskew long distance relationships because everyone in your town knows you re a trainwreck
-1	hey amyschumer you killed it in trainwreck spiritanimal
-1	this hits me like a fucking trainwreck into my face damn
-1	rt aveuaskew long distance relationships because everyone in your town knows you re a trainwreck
-1	rt aveuaskew long distance relationships because everyone in your town knows you re a trainwreck
-1	rt aveuaskew long distance relationships because everyone in your town knows you re a trainwreck
-1	rt aveuaskew long distance relationships because everyone in your town knows you re a trainwreck
-1	i know we re not everlasting we re a trainwreck waiting to happen
-1	rt trashnightvideo this tuesday steel yourself and submit to cgi animated trainwreck foodfight https t co so4jy6oftl https t co u
-1	rt kevinlandreth it s friday night almost time to put the funk back in dysfunction beringseagold trainwreck
-1	rt aveuaskew long distance relationships because everyone in your town knows you re a trainwreck
-1	donstugots trainwreck inside out and ted2 mad max it s going to be a busy summer
-1	poetryphan basically everyone would be a physical and emotional trainwreck
-1	there s a band playing at gibbys and they actually named themselves trainwreck
-1	me is sobbing and a trainwreck i feel so hgreat
-1	rt onlyjoshane trainwreck haha panaad fest with joshane a keyper s promise
-1	rt oddlyerin ok so minus the shitty title trainwreck it s cool to see a romantic comedy where the female lead is someone who has casual
-1	rt iamsimplychique onlyjoshane trainwreck haha panaad fest with joshane a keyper s promise
-1	rt wutevasocavy check out this exclusive scene from the new amy schumer movie trainwreck
-1	juddapatow if trainwreck is under 2hrs i ll be disappointed amp if the unrated blu ray version isn t at least 131mins i m flipping out
-1	rt trashnightvideo this tuesday steel yourself and submit to cgi animated trainwreck foodfight https t co so4jy6oftl https t co u
-1	rt trashnightvideo this tuesday steel yourself and submit to cgi animated trainwreck foodfight https t co so4jy6oftl https t co u
-1	tittyforman if we can only do audio then its fine i look like a trainwreck
-1	rt trashnightvideo this tuesday steel yourself and submit to cgi animated trainwreck foodfight https t co so4jy6oftl https t co u
-1	this tuesday steel yourself and submit to cgi animated trainwreck foodfight https t co so4jy6oftl https t co u5h4xpaujo
-1	nofilter trainwreck x lavender jones w the shatter blunt 4 20 in denver canarycheez https t co yzcawooesd
-1	rt onlyjoshane trainwreck haha panaad fest with joshane a keyper s promise
-1	marina amp the diamonds deserves megan trainwreck s fame and sales if we re being honest
-1	need to see the movie trainwreck
-1	onlyjoshane trainwreck haha panaad fest with joshane a keyper s promise
-1	well this movie is one trainwreck after another
-1	dlmchallenge 2 paul blart mall cop 2 8wordsorless so lackluster it s not even a riffable trainwreck dougbenson
-1	trainwreck haha panaad fest with joshane a keyper s promise
-1	it s friday night almost time to put the funk back in dysfunction beringseagold trainwreck
-1	ok so minus the shitty title trainwreck it s cool to see a romantic comedy where the female lead is someone who has casual sex instead
-1	trainwreck looks so good
-1	a woman that doesn t know what she wants and bonds with a man by going to sports games count me the fuck out formanyreasons trainwreck
-1	on air trainwreck 1979 by death from above 1979 http t co vizbybzyx2 nowplaying chom
-1	the movie train wreck looks so funny lol trainwreck
-1	if you think i m not gonna see trainwreck then you re very wrong my friend
-1	rt slutprobiems if u can t handle me at my worst then leave because i don t have a best i m literally always a trainwreck
-1	trainwreck ohmygosh i must see this movie sorelateble
-1	josukes quick find an old trainwreck
-1	youre so fucking weak its pathetic im glad youred out of my life cus im not watching that trainwreck again
-1	i think the next season of inside amy shumer will be outstanding i do however hope trainwreck is much better than its trailer
-1	rt slutprobiems if u can t handle me at my worst then leave because i don t have a best i m literally always a trainwreck
-1	trainwreck youtube http t co 6s4w6g4lff
-1	hidden treasure trainwreck http t co uwoxlcjep9 2steelgirls http t co hkoyk4ulja kickassmusic playitforward
-1	hindu kush afghan kush sour purp green crack blue dream trainwreck gscookies northern lights kush silver ha http t co kbxbkoswyb
-1	rt inhalexbieber38 jadabianchi and i make some awkward eye contact sometimes i forget to smile so then i probably look angry honestly s
-1	bisexualrobot thatonepersonot stares at trainwreck
-1	rt freakingtrue life goal feel as much inner peace as this chihuahua feels with his sombrero http t co evwk3m1iie
-1	in this week s lisa s desk episode lisa talks about a recent incident involving trainwreck actress amy schumer who is a size 6
-1	nowplaying death from above 1979 trainwreck 1979 tune in http t co qspqswslzn
-1	taeko_ludenberg hey lil miss muffet i am home now so whenever u wanna watch that trainwreck lemme know
-1	hi to all first post so high slh trainwreck thc bomb forum introduce yourself posted by blinkybill http t co w4h2rh4m1p
-1	rt trainwreckmovie i m just a modern chick who does what she wants amyschumer stars in trainwreck in theaters july 17 https t c
-1	rt 30secondscene trainwreck is lowkey gonna be a classic https t co yjzrfoe7s3
-1	grasscity wax strain suggestions hey iv been smoking some pretty decent wax made from trainwreck i m loo http t co pz2hoetqfd
-1	newsok baralheia govmaryfallin oh i can t wait for this trainwreck invests heavily in popcorn stocks
-1	death from above 1979 trainwreck 1979 http t co iajvtxq1dk nowplaying mauiradio
-1	you re a trainwreck but i wouldn t love you if you changed
-1	i want dawnofjustice to be good so badly but i can t shake the feeling it will be a trainwreck prove me wrong please
-1	rt jpughmi rob_flaherty going to be a trainwreck of epic proportions
-1	purple trainwreck feminised seeds purple trainwreck de humboldt seeds comes from the cro http t co lhxbtpkd38 marijuana cannabis
-1	photo clairtycounts with this afw afghan trainwreck highsociety medicalsupplies denver http t co vhrnhbd51w
-1	rt daisybuddysmom nefariousnewt i watched it it was a bit of a sad trainwreck i thought turns out the taser is strapped to the chest
-1	rt dottiedexx megalonyx_ yeah it was a trainwreck i made my first two videos they were bought and then passed along to people i
-1	megalonyx_ yeah it was a trainwreck i made my first two videos they were bought and then passed along to people i was pretty down
-1	chanyaciqueen its a trainwreck
-1	for the morbidly curious i ll be attempting ludumdare this weekend watch the trainwreck at https t co duysclybsm
-1	this is both awesome and a trainwreck at the same time https t co j02mov9vys
-1	you re a trainwreck but i wouldn t love you if you change
-1	brosofarty kavsdick vodjak omfgfgdjsj i ll bang your pipe if you know what i mean
-1	rt daisybuddysmom nefariousnewt i watched it it was a bit of a sad trainwreck i thought turns out the taser is strapped to the chest
-1	new kayne type beat trainwreck produced by thatsdopemusic https t co nmkm5z1p1s via youtube
-1	trainwreck a most solid if predictable comedy this is the summer comedy to see http t co jz87ntstoo
-1	rt reflectivity keleka24 chaseglorfield rivalsjeremy into a big sky assistant gig maybe ooh or the next vandal trainwreck
-1	now playing trainwreck 1979 by death from above 1979 http t co zgpzxcjsqh theedge
-1	rt trainwreckmovie i m just a modern chick who does what she wants amyschumer stars in trainwreck in theaters july 17 https t c
-1	train wreck elliott yamin http t co w0allldnkt itunes iphone trainwreck
-1	trainwreck og sativa thc 20 6 cannabinoids 25 3 terpenoids 1 5 happy 420 weekend from goe https t co qtpplmn2ca
-1	why is jauz so good
-1	just got into international falls for gig w trainwreck so far off the map i m in roaming
-1	batman v superman is either going to be a trainwreck or something great
-1	quick q amp a with those at the 7pm pre screening of amyschumer s new movie trainwreck trainwreckcollegetour http t co d04hnpbwul
-1	you re a trainwreck but i wouldn t love you if you changed
-1	rt bayliminer29 amyschumer is the funniest and most down to earth person so in love with her movie trainwreck and can t wait to see it
-1	rt reflectivity keleka24 chaseglorfield rivalsjeremy into a big sky assistant gig maybe ooh or the next vandal trainwreck
-1	what a trainwreck paulblartmallcop2
-1	keleka24 chaseglorfield rivalsjeremy into a big sky assistant gig maybe ooh or the next vandal trainwreck
-1	and i ve got work 9 till half 6 then trainwreck after
-1	rob_flaherty going to be a trainwreck of epic proportions
-1	also one of the few things i ve seen by deen that wasn t a giant trainwreck there was some noticable quality compared to first season tho
-1	jadabianchi and i make some awkward eye contact sometimes i forget to smile so then i probably look angry honestly such a trainwreck
-1	trainwreck this note is life https t co gdquf30wbt
-1	watching the ken burns thing on the roosevelts i want to patent a super energetic sativa strain called super teddy trainwreck og
-1	justin_fenton sounds like the prosecutors really vetted this case well what a trainwreck
-1	i m glad cooler heads prevailed and everyone in the ott mtl series said the right things but now i want the game to be a total trainwreck
-1	twodogszk i like that they re a trainwreck
-1	why the fuck do people like trainwreck so much
-1	rt teflontoven jrocloudz got some lambs bread killer queen mountain thunderfuck and purple trainwreck for now lls
-1	jrocloudz got some lambs bread killer queen mountain thunderfuck and purple trainwreck for now lls
-1	i am watching a trainwreck of a movie on netflix this is hilarious
-1	rt slutprobiems if u can t handle me at my worst then leave because i don t have a best i m literally always a trainwreck
-1	yasss her trainwreck story is getting old https t co xrjlinllfa
-1	amy schumer s trainwreck college tour http t co nbldtqz28h college
-1	just followed britt mchenry excited to watch the trainwreck this is going to be brittmchenry antitowtruck whodatblonde thatblondedoe
-1	rt slutprobiems if u can t handle me at my worst then leave because i don t have a best i m literally always a trainwreck
-1	being a nurse is a full time job when you live with your grandma trainwreck
-1	gamingandpandas calgaryexpo it was pretty awesome to see this trainwreck it started out well too with a post in kia
-1	people are so mad because they know their fave could never write songs like catch me and trainwreck at the age of 15 16
-1	trainwreck veg time http t co yqyk2idizt
-1	amyschumer trainwreck super hilarious i couldn t stop laughing the whole time i was watching my abs are sore help love from asu
-1	my sit down with the wonderful amyschumer this past week when she visited promoting her new movie trainwreck http t co po7yonhaza
-1	i met amyschumer today what did you do trainwreck https t co e31xwbar5e
-1	rt bluray365 amyschumer getting trouble maker tatted on my ass thanks a schu trainwreck
-1	rt daisybuddysmom nefariousnewt i watched it it was a bit of a sad trainwreck i thought turns out the taser is strapped to the chest
-1	my allergies have turned me into an emotional trainwreck and now i m just crying in frustration from not being able to stop sneezing
-1	quick but lovely meet up with amyschumer before a pre screening of trainwreck very cool day https t co eqg5per66o
-1	richardroeper ouch from the looks of it paulblartmallcop2 looks to be a trainwreck of a disaster eh
-1	rt bluray365 amyschumer getting trouble maker tatted on my ass thanks a schu trainwreck
-1	amyschumer getting trouble maker tatted on my ass thanks a schu trainwreck
-1	we love amy whatshername amyschumer trainwreck https t co wlbye1l81c
-1	diplo confirms that cl s upcoming album will include surefire trainwreck dr pepper http t co a0oq01v3ve http t co 0ailmnxolv
-1	lydiamulvey toodlescripts debbiebmoon scraphamster the idea has a trainwreck sort of horror fascination cantlookaway
-1	chaddukes we are a trainwreck society rubbernecking our way through life if it doesn t bleed their is no need cdvtw
-1	if you enjoy trainwreck humour you can play bingo with alex_woodukip twits mark a spot on every different racial slur he uses
-1	fun fact the scenes in the commercial for trainwreck are not in the actual movie like how is that allowed
-1	condolences to the unlucky sap dumb enough to stick his penis up your filthy cunt you trainwreck piece of shit luckily it aint me anymore
-1	season 6 of tvd is such a trainwreck smh
-1	runrunchilly we see her in person and that relationship is a trainwreck but for the facebook crowd it s a match made in heaven
-1	bring on the trainwreck i can t wait until cubs nation is crushed in spectacular fashion again https t co e0b0cp5nvw
-1	rt n8sutcliffe brad pitt is older than nigel farage let that sink in
-1	episode 85 was an emotional trainwreck hoooly shit
-1	actual footage from kris bryant s debut http t co xqqgjdpaf1
-1	silly_wally megan trainwreck and abigail breathstinks fucking brilliant i love it
-1	rt aveuaskew long distance relationships because everyone in your town knows you re a trainwreck
-1	marijuana medicinal and with names like trainwreck
-1	how do ppl just skip important classes im a trainwreck if i miss 1 day
-1	rt aveuaskew long distance relationships because everyone in your town knows you re a trainwreck
-1	you re a trainwreck but i wouldn t love you if you changed
-1	where there s a trainwreck sit on back and watch me crash kipmoore
-1	sean young is mad because she wasn t cast in blade runner 2 shit she dodged a bullet its gonna be a trainwreck
-1	trainwreck
-1	rt daisybuddysmom nefariousnewt i watched it it was a bit of a sad trainwreck i thought turns out the taser is strapped to the chest
-1	this carrie fisher panel is a trainwreck in the best possible way
-1	buehrlecat somehow they re a bigger trainwreck than the bears right now
-1	jump_this_ship you have no right to be ashamed when my comments are such a trainwreck
-1	rt aveuaskew long distance relationships because everyone in your town knows you re a trainwreck
-1	chunkeymonkey81 trainwreck
-1	i liked a youtube video http t co 0xsn8uayol lorrie morgan trainwreck of emotion
-1	april 17 2015 at 1 41 pm trainwreck 1979 by death from above 1979
-1	trainwreck official trailer 1 2015 lebron james bill hader movie hd http t co wp1satvdyj
-1	abcfamily stepping away from trashtalking trainwreck reality to focus on aspirational http t co vsjs3m5nrz immersiveyouth
-1	jryan_tweets i m about to go to a meet and greet with her tonight and then see her movie trainwreck
-1	i have to see this movie amyschumer we all know one trainwreck http t co szwisswesx
-1	rt trainwreckmovie i m just a modern chick who does what she wants amyschumer stars in trainwreck in theaters july 17 https t c
-1	rt the_cui we sat down with amyschumer comedian and star of the new trainwreckmovie http t co ovd1hhz2kp trainwreck http t co uq
-1	we sat down with amyschumer comedian and star of the new trainwreckmovie http t co ovd1hhz2kp trainwreck http t co uqtkmxjn1p
-1	i feel like it ll be a trainwreck but i want to karaoke noraebang with everyone
-1	so many good looking movies in the coming months the visit the gift sinister 2 insidious 3 poltergeist reboot trainwreck ptchperft 2
-1	not this fat bloated self harming trainwreck of a whale thinking he s better than me because he beat me in literature by one mark
-1	cl is gonna collab with og maco and riff raff the train hasn t even left the station and we ve already got a trainwreck happening
-1	angienugget lmao what a trainwreck
-1	i m coming out today i fell in love with amyschumer and i m gonna watch the hell out of trainwreck i bow to thee bold comedy genius
-1	little_kelfie trainwreck 4 gt
-1	rt trainwreckmovie i m just a modern chick who does what she wants amyschumer stars in trainwreck in theaters july 17 https t c
-1	back on got some trainwreck 10 a g fwm
-1	hindu kush afghan kush sour purp green crack blue dream trainwreck gscookies northern lights kush silver ha http t co lfrk0joegf
-1	omg the show botched is crazy so hard to look at but so hard to look away plasticsurgery trainwreck havemercy wtf
-1	the trainwreck tickets are almost gone come to the diner to get yours
-1	but i can t help it some days i feel fine but others are a real trainwreck and today is one of them
-1	trainwreck 1979 death from above 1979 crossonair nowplaying http t co 1jz20hvaml
-1	come to the north campus diner to grab some free trainwreck tickets
-1	ikari_gendo as someone said in that trainwreck of a forum thread they ve got a lot of cleaning to do if they want to enforce that
-1	tonight may be a hot mess yeah this may be really fun or just a trainwreck
-1	always said could do maxims talk w o slides almost had to could should have realized didn t want to ouch gremlins panic trainwreck
-1	rt aveuaskew long distance relationships because everyone in your town knows you re a trainwreck
-1	captainsparx dammit sparx this is a trainwreck
-1	rt aveuaskew long distance relationships because everyone in your town knows you re a trainwreck
-1	medreleafcanada most wanted strains jack herer god bud joftheislands silver haze trainwreck skunk 1 sensi seeds ak 47
-1	rt vote4wallace seanhannity we are generally allergic to reform yet favor traditional solutions however this leftist trainwreck n
-1	seanhannity we are generally allergic to reform yet favor traditional solutions however this leftist trainwreck now begs for reform
-1	geri50nico 750commentator and then they let you drive the golf cart about trainwreck
-1	man deadpool movie is aiming to be the either amazing or the most glorious trainwreck
-1	you re a trainwreck but i wouldn t love you if you changed
-1	rt xogiguvuzipi trainwreck the movie http t co 7aco8jz21m
-1	dear kellyann_wargo you are a genius and as you know i m just a trainwreck
-1	cripps_caroline trainwreck describes me perfectly
-1	cripps_caroline gots me some fruity pebbles and trainwreck
-1	trainwreck de judd apatow nouvel extrait lbdc http t co islbii4w1c
-1	that batmanvsuperman trailer i would just like the ensuing conversation to be about how we redeem the damage of a franchise trainwreck
-1	you motherfuckers can t be us or see us we motherfuckin thug life riders westside til we die hitemup
-1	beamiller trainwreck x demi lovato
-1	trainwreck 1979 death from above 1979
-1	lorischmidt he will be johnny football johnny clipboard or johnny trainwreck in 2 yrs hope its one of the first two
-1	kavsdick vodjak yes good i can see it omg lee is like why is this why is this happening this is soooo but he does it anyway
-1	hanslanda0351 jet79 people love a trainwreck
-1	julsburke literally season one was so bomb it totally took me by surprise and now it s like a slow motion trainwreck
-1	live now dj trainwreck all aboard dnb trance dubstep dutch nowplaying djs http t co 1t2d3ydlam virtualdjradio4
-1	fat ass trainwreck blunt stressreliefin4words
-1	this wig is a trainwreck and i don t know shit about hair cutting keeps chopping off hair anyway
-1	indianapolis starjuly movie preview terminator returnsindianapolis starstars drink up trainwreck bulk up sou channingtatum
-1	i just need to talk to someone about this episode of house hunters bc it was a trainwreck disaster
-1	tfwjonghyun not even that or lee hyun woo could save that trainwreck
-1	s o to my friends for keeping up with my trainwreck self yo
-1	is it me or are lunch interviews tacky i feel like i m watching a trainwreck as i m waiting for pork chili
-1	having taken a macabre interest in the bfc trainwreck for several months it is heartening to see the reaction to the oystonout campaign
-1	now playing trainwreck 1979 by death from above 1979 http t co zgpzxcjsqh theedge
-1	rhogossip what a surprise to hear about trainwreck i m sure she will try to blame someone else besides herself
-1	c_dubiel44 good lord please no dnw toronto south team s a trainwreck enough as is
-1	5 05 2014 demon resurrection reviewed on the bi weekly trainwreck podcast http t co dtpvuozkdm http t co sj1r3zjxs9
-1	i found episodes of rockoflove ondemand i am soooo happy about this trainwreck
-1	purple trainwreck http t co iargqqc1ft
-1	skepticalray ya i dont blame you its mind numbing but also entertaining in a trainwreck kind of way
-1	are we a trainwreck yes we are emilyostermann http t co gk5bgcdy8t
-1	rt joshtpm lawyers really need to have affirmative responsibility to zealously protect clients from trainwreck tv interviews http t co
-1	ff trainwreck fukeith henrycruz101 comedywreck times square nyc
-1	see the trainwreck of the week on walk of shame shuttle see the trainwreck of the week on walk of shame shuttl http t co rjcynkz6d9
-1	amyschumer is the university of oklahoma on your campus tour i can t wait for trainwreck
-1	purple trainwreck feminised seeds http t co bwetk7etgp http t co hbgymhlztc
-1	it s just amy schumer doesn t need to lose weight to star in her own movie http t co rruiggcwxa via takepart
-1	gryking i say good luck with that gonna look that trainwreck from far way while sipping my tea will you join me lol kennymack1971
-1	it s funny you said we d never make it and look how far we ve come you re a trainwreck but with you i m in love
-1	the things you say made me fall harder each day you re a trainwreck but i wouldn t love you if you changed
-1	depressiomeridi except the construction tool girls one its such a trainwreck that i nearly pissed myself laughing
-1	stcatron35 pie was a trainwreck though jeesh
-1	rt ditchtv amyschumer can t wait for trainwreck movie ditchtv https t co r24qsuvrgp insideamyschumer lyao tildaswinton https t
-1	amyschumer but like seriously though see trainwreck
-1	buzzyossarian i aim to please kind of disappointed you won t be reporting back on this trainwreck
-1	newageinsiders addean12 then 10 years later tna sign most of the old wcw talent amp their an even bigger trainwreck
-1	hilarious the baloteli won lfc player of the year award the person in charge of lfc s pr has to be a mufc fan their pr is a trainwreck
-1	rosiemarx that whole thing is a massive trainwreck
-1	rt mstiffany_jane family bonding cousins joints rolling raw papers wakenbake cali trainwreck http t co fyjw89fgvb
-1	trainwreck vs blue dream http t co mrzfv7yj9s
-1	rt melliemunchkin trainwreck so dude
-1	watch trainwreck trailer amy schumer stars in outrageous new comedy http t co vl56hi7cx6
-1	trainwreck so dude
-1	rt yonoaf suit ideat trainwreck wratchet party suit you only see out in public for 5 mins at night amp then in the morning in srs need
-1	thmwy right cause he s kinda crucial to their civil war situation if they re still following ultimate s lead still trainwreck lol
-1	janeb_soapfan splashdpow b amp b made the same mistake with taylor from heroine to trainwreck she lost her fanbase now off the show
-1	emilyostermann we re a trainwreck
-1	thmwy we all do like this spider man situation is about to be a trainwreck a beautiful trainwreck haha
-1	rt trainwreckmovie i m just a modern chick who does what she wants amyschumer stars in trainwreck in theaters july 17 https t c
-1	if someone picks up brand new d j entendu death from above 1979 trainwreck and the prodigy ibiza for me i ll pay you back
