-1	rt jen_to_go trainwreckmovie was so good amyschumer and bill hader were simply perfection i can t wait to see it again thanks gofob
-1	that epic moment when you recognize trainwreck as mexican sativa only to find out its a mexi cross
-1	rt pjstrikeforce whyimnotvotingforhillary hillary laws vs american law she follows no laws she s just another obamacare trainwreck htt
-1	realized today that i m basically amyschumer only less blonde boobs and sex trainwreck twins
-1	http t co koydrutbkv 8 reasons why hillary s campaign will be a train wreck
-1	coopersws_ you don t think it it s enough all in for another four years of trainwreck
-1	and batman v s superman continues to look like a trainwreck
-1	you re a trainwreck but i wouldn t love you if you changed
-1	trainwreck demi lovato
-1	when you watch the first episode of owari no seraph you kno the whole series is gonna be a trainwreck
-1	big summer movies i care about most mad max m i 5 trainwreck inside out
-1	star wars bvs i m re watching the trailer for amy schumer s trainwreck
-1	this is just a mini trainwreck
-1	rt railwaygazette japan s maglev train hits world record 590 kilometers per hour japan real time wsj http t co sfhur1cw6x
-1	trainspo i hope it s not concrete cement maybe
-1	rt ouresderec trainwreck in westport plaza http t co jpq0udvrjn
-1	blames social media for feelings of detachment friend posts honest weakness whoa what a trainwreck i wonder what s on youtube
-1	trainwreckmovie was so good amyschumer and bill hader were simply perfection i can t wait to see it again thanks gofobo trainwreck
-1	rt amyschumer here is the trailer for trainwreckmovie trainwreck we are very proud i hope you like it https t co sla2xmbgw2
-1	now playing trainwreck 1979 by death from above 197 http t co xzz8qkuqrq 989thedrive essentialalternative
-1	suit ideat trainwreck wratchet party suit you only see out in public for 5 mins at night amp then in the morning in srs need of a brushing
-1	gotta get down on friday
-1	in this week s lisa s desk episode lisa talks about a recent incident involving trainwreck actress amy schumer who is a size 6
-1	this is a trainwreck
-1	why the he ll am i getting notifications when patrickstump tweets whievenishe trainwreck
-1	trainwreck official trailer 1 2015 lebron james bill hader movie hd cfoxtyler http t co 6is0wuypte
-1	rt retrosynths hi volume retrosynths trainwreck original mix rich groove records by rich groove records http t co yliq2b82p1 on
-1	hi volume retrosynths trainwreck original mix rich groove records by rich groove records http t co yliq2b82p1 on soundcloud
-1	i liked a youtube video http t co 237kluvlrz trainwreck official trailer 1 2015 lebron james bill hader movie hd
-1	nowplaying death from above 1979 trainwreck 1979 tune in http t co qspqswslzn
-1	my mans kingjames is in a movie trainwreck multitalented
-1	sargon_of_akkad check this out for your next this week in stupid http t co b9hijf6i3d what a trainwreck
-1	from rihanna to the sound of music trainwreck faithfullyrandominfullforce
-1	amyschumer hosted the mtv movie awards now she s hosting you at a free screening of trainwreck with a q amp a http t co m2g1pd35ba
-1	kavsdick vodjak omg what a cute auuuu so who would be who is what i wanna know
-1	rt joshtpm lawyers really need to have affirmative responsibility to zealously protect clients from trainwreck tv interviews http t co
-1	as of right now the gop primary would be a total trainwreck the truncated schedule is the chief cause of that
-1	beaggalengold rebekkadunlap i forgot the title of the one where a lady is in a trainwreck with amnesia and can t remember her husband
-1	rt arsarophy trainwreck virginia http t co eeoejmtlel
-1	kouyuu_ yep that s also why we become an emotional trainwreck when having our periods we know that we re losing money
-1	rt aveuaskew long distance relationships because everyone in your town knows you re a trainwreck
-1	amyschumer ohiostate trainwreckmovie come see trainwreck pet a small pony
-1	rt aveuaskew long distance relationships because everyone in your town knows you re a trainwreck
-1	rt universalpicumd come out to the north campus diner at 3 30 to grab your trainwreck tickets we ll be there until they re all gone or
-1	come out to the north campus diner at 3 30 to grab your trainwreck tickets we ll be there until they re all gone or until 5
-1	when i get back from this cruise i might be living at the movie theater avengers and trainwreck
-1	rt miss_keeleyy trainwreck was indeed the funniest movie i ve seen lately lol i laughed the whole movie
-1	gooberzilla annzac i m kind of excited just to see how much of a trainwreck it ll be over under on it being worse than green lantern
-1	rt aveuaskew long distance relationships because everyone in your town knows you re a trainwreck
-1	rt aveuaskew long distance relationships because everyone in your town knows you re a trainwreck
-1	kylepinion well thanks to the trailer we know we re in for at least one trainwreck
-1	rt aveuaskew long distance relationships because everyone in your town knows you re a trainwreck
-1	trainwreck demi lovato lyrics http t co ctlnkqbr5v
-1	inthewoods2014 blownsp i m sure it will end well amp they ll live happily ever after they have lrh marriage tech trainwreck
-1	mouvvves i actually do want to see it for that reason or how off the mark it really is basically i want to see this trainwreck
-1	trainwreck was indeed the funniest movie i ve seen lately lol i laughed the whole movie
-1	johncena wweuniverse i m also looking forward to seeing your new movie trainwreck in july then i ll be seeing you sprintcenter raw kcmo
-1	hindu kush afghan kush sour purp green crack blue dream trainwreck gscookies northern lights kush silver ha http t co hqu35eo2ja
-1	wellllll this botched show is an interesting trainwreck to watch
-1	shuttuptanya that valentines was a trainwreck lmao
-1	rt joshtpm lawyers really need to have affirmative responsibility to zealously protect clients from trainwreck tv interviews http t co
-1	lawyers really need to have affirmative responsibility to zealously protect clients from trainwreck tv interviews http t co lcbv33a56i
-1	actoncomics1 i expect an utter bore at best a trainwreck at worst
-1	superherofeed is it ironic that when edgar wright left ant man everyone thought it would be a trainwreck then trailer 2 has a train wreck
-1	ugh today i feel like a trainwreck can t we just skip to happy hour
-1	it was almost a https t co jg1f7oucka except for hilarity a presentation i won t forget with too many people in the boardroom tgif
-1	my trainwreck cubicle mate is out today so i really have no reason to live today
-1	nefariousnewt i watched it it was a bit of a sad trainwreck i thought turns out the taser is strapped to the chest the gun to the hip 1
-1	rt 30secondscene trainwreck is lowkey gonna be a classic https t co yjzrfoe7s3
-1	http t co vfzmlh2ylc amyschumer trainwreck sets amy schumer on fast track 38
-1	friday sale hindu kush afghan kush sour purp green crack blue dream trainwreck gscookies northern http t co i4fbwpulsc
-1	i gave rhomelbourne a really good shot but would rather jam an ice pick in my skull it def has the trainwreck factor 0 aside from that
-1	rt concfolipa trainwreck amp clone http t co dhwhtcb7hd
-1	dumb dumb trainwreck
-1	now playing death from above 1979 trainwreck 1979 on all hits station
-1	rowbrinababes if you re a disaster i m a trainwreck
-1	rt blishy wow 25btls btlsradio this tuddle trainwreck radio is awesome
-1	heymynameiswill iron man 3 was supposed to be fun that movie was a trainwreck
-1	rt ouab trainwreck amyschumer s new movie http t co iziegxfc44 bill hader was on campus last year she ll be here tmrw http t co
-1	has itunes been drinking from the same punch bowl which gave us skype s ux trainwreck almost as bad as the photos app
-1	eeadele eveningexpress waste a vote on the lib dems to keep salmond out that s a cracking policy libdems trainwreck
-1	i want to see trainwreck
-1	this thing on toucherandrich has trainwreck written all over it fredtoucher kengriffeyrules
-1	rt klmastroianni i am a trainwreck
-1	wow 25btls btlsradio this tuddle trainwreck radio is awesome
-1	i am a trainwreck
-1	holy shit that one movie looks like a trainwreck
-1	michaelwhitney easily my favorite whole thing is a trainwreck http t co 28ixsuocae
-1	batman v superman looks like a trainwreck and aquaman and wonder woman are supposed to be in it too too dark to handle that much goof
-1	maueresspee man the browns reeeeeally mishandled manziel lel theyre like a trainwreck just cant stop watching
-1	on the outside asian suited up might as well be in stern on the inside still drunk from last night going to mun for 8hrs trainwreck
-1	i hear the trainwreck coming the batman v superman dawn of justice trailer has leaked http t co wbsczuuc4m via voxdotcom
-1	rt dharmicx dallas_penn combat_jack do you like gotham the wheels fell off on that trainwreck about 5 6 episodes in and never recover
-1	dallas_penn combat_jack do you like gotham the wheels fell off on that trainwreck about 5 6 episodes in and never recovered
-1	http t co dm6kfmtbnk trainwreck sets amy schumer on fast track 100 http t co cofsyzu9w0
-1	rt itsohsodemi demi lovato at the brisbane convention centre australia april 17th demiworldtour 34 http t co cxwuyjxatg
-1	the hillary trainwreck chugga chugga choo choo zonation http t co sjnspfit4m
-1	trainwreck music video david hasselhoff sings the theme of his new kung fu movie true survivor https t co mxwl3pc6y7
-1	i kinda know it will be a bit of a trainwreck because zack snider but we will see
-1	rt usacsmret 8 reasons hillary clinton s campaign will be a trainwreck http t co qyhprzde0l
-1	i think licking bbq sauce out of my hair is a new low even for me trainwreck
-1	8 reasons hillary clinton s campaign will be a trainwreck http t co qyhprzde0l
-1	my day has been a trainwreck and it s only 8am
-1	rt slutprobiems if u can t handle me at my worst then leave because i don t have a best i m literally always a trainwreck
-1	if wet tshirt contest is as much of a trainwreck in real life as they are on twitter then this is gonna be a breeze
-1	rt slutprobiems if u can t handle me at my worst then leave because i don t have a best i m literally always a trainwreck
-1	rt livegreenordie lust amp debauchery rule republicans led us house of representatives http t co nz6d8ie4ww pittsburghpg foxflashb
-1	xthefeistygeekx hopefully she s a trainwreck but she s also my mom
-1	it s funny you said we d never make it and look how far we ve come you re with a trainwreck but with you i m in love 2 2
-1	reading ew and getting so e cited for all the summer movies vacation entourage trainwreck
-1	adamschefter you re telling me jerry jones has control of the teams twitter too trainwreck
-1	i m an emotional trainwreck
-1	april 17 2015 at 4 36 am trainwreck 1979 by death from above 1979
-1	rt ytandtvfangirl dreamdadyesyesyesfinale baslexforever trainwreck
-1	rt independent 18th century sex toy found in polish toilet http t co absrlhpyat http t co tnerucfhs7
-1	dreamdadyesyesyesfinale baslexforever trainwreck
-1	rt uabatmsu tickets just came in pick up your tickets to the free advanced screening of trainwreck on april 23 in the uab office http
-1	rt begrudginglygf trainwreck made me laugh until i cried it also made me cry in general hilarious and smart thank you amyschumer for
-1	today is picture day in my school and i literally look like a freaking trainwreck hahahahaha
-1	marika_sophie decade the show is a narrative trainwreck decade the person is weird decade the rider is pretty cool
-1	trainwreck x headband http t co bgwrsvzift
-1	avatarjedi i didn t say the movie was a trainwreck but look at production wonder woman s director has walked man of steel was a disaster
-1	nick_gallacher trainwreck hahaha the movie hasn t even come out yet lol keep trying to justify your hate idiot haha
-1	avatarjedi happening now is a trainwreck
-1	now playing trainwreck 1979 by death from above 1979 http t co zgpzxcjsqh theedge
-1	bolverkgtm bleh i m just thankful i didn t hear of this trainwreck until you brought it up
-1	rt garovyketeny in this week s lisa s desk episode lisa talks about a recent incident involving trainwreck actress amy schumer who is
-1	thatkevinsmith finally watched tusk a testament to pure absurd whimsy following utterly ridiculous a precisely steered trainwreck bravo
-1	puta those pants are a trainwreck
-1	poetryphan so i m really sorry of you thought we had somethig going on but just talk to me and ahh idek i am a trainwreck
-1	rt ninksefordo haze trainwreck ultra http t co rhrktrl8vi
-1	you know beside the 2 month trainwreck i call jonas i ve been single for 3 4 years and idk it s not like i need someone
-1	gassymexican as fun as it was let s try to avoid making trainwreck thursday a regular thing
-1	brando_jt we have to see trainwreck from amyschumer like for realza balk status
-1	abeautifulnoire ive never seen such a trainwreck in my life
-1	i hope they put the actors in their costumes soon because i wanna see how much of a trainwreck this dialovers play is
-1	basically a trainwreck from the beginning instead of a rv like he wanted niall is met with a small rental car umm we can look back
-1	basically a trainwreck
-1	haze trainwreck ultra http t co rhrktrl8vi
-1	trainwreck is still ian and mickey by the way
-1	trainwreck virginia http t co eeoejmtlel
-1	can you believe she wrote trainwreck at the age of 15 or 16
-1	popoalu ur not invited to see this trainwreck
-1	death from above 1979 trainwreck 1979 http t co lvjroxksrh nowplaying listenlive
-1	christ this is terrible trainwreck of a game dk64
-1	rt ouab trainwreck amyschumer s new movie http t co iziegxfc44 bill hader was on campus last year she ll be here tmrw http t co
-1	digdis death from above 1979 trainwreck 1979 http t co nidbhohn4y nowplaying http t co mzjodgzdtf
-1	what a trainwreck http t co k3qkkoxijl
-1	rt derekobrosey this is the most accurate horoscope i ve ever gotten gemini funny loud and annoying emotional trainwreck that hides i
-1	oh god people actually consider that trainwreck waifu material http t co gntc5zd03q
-1	cannot wait to see amyschumer in trainwreck
-1	let s be clear i think these people can help with personal death closure but this is just a trainwreck murderedparents
-1	demizao vevodemil eu nao gosto de trainwreck
-1	almightyboob the mariners are a trainwreck right now but april is always fucked up
-1	i find the dumbest things funny
-1	kiyuiking this week was just a trainwreck tbh x x hold me wagfriend
-1	now playing trainwreck 1979 by death from above 1979 http t co zgpzxcjsqh theedge
-1	amyschumer saw the trailer for trainwreck it looks hilarious i almost fell out of my seat laughing congrats to you and all your success
-1	amyschumer today was amazing can t wait to see trainwreck again on july 17th so funny so much heart http t co dbqvcfqnrq
-1	finally saw the trailer for trainwreck amp i almost fell out my chair laughing hysterically congrats amyschumer i can t wait to see it
-1	maxchalmers90 what a completely predictable trainwreck that thread is
-1	gggiants yep he said that tomas could play 3b no problem haha he s a complete trainwreck at third below avg rf
-1	amyschumer 140 not enough characters to list the people who absolutely killed it in trainwreck so fucking good top to bottom well done
-1	amyschumer fyi i just watched ur movie trailer amp fell off my chair laughing didnt know that was possible thank you trainwreck worthit
-1	april 16 2015 at 10 39 pm trainwreck 1979 by death from above 1979
-1	trainwreck was amazing you re honestly such an inspiration amyschumer
-1	just saw trainwreck margogo_
-1	wow just saw amyschumer at an early showing of trainwreck great movie plus i got to ask her a question at the end awesome night
-1	i want to watch trainwreck when it comes out
-1	saw amyschumer s new film trainwreck and it was hilarious go see it this summer asu trainwreckcollegetour
-1	ugh why is sentai filmworks still dubbing anime that super sonico dub is gonna be a trainwreck with jesicca nigri being the mian
-1	palmpaii my face is a trainwreck
-1	trainwreck power transformer http t co 2chjdbe0jd
-1	rt rat_detail toshanshuinla he wrote the sriracha trainwreck it s his magnum opus
-1	toshanshuinla he wrote the sriracha trainwreck it s his magnum opus
-1	trainwreck og sativa thc 20 6 cannabinoids 25 3 terpenoids 1 5 goe https t co zrd6qfraly
-1	troylerkilos when tylers hair wasnt a trainwreck and troye looked 9 and a half
-1	rt triswelte katie_messner13 xgr33nx trainwreck
-1	katie_messner13 xgr33nx trainwreck
-1	rt xogiguvuzipi trainwreck the movie http t co 7aco8jz21m
-1	imsledgren you got him 2 out of 3 with sub zero niceee
-1	queenmadalena lmao season 6 was such a trainwreck i kinda wished dan would just lock everyone up in a building at the end and set the
-1	film114 trainwreck post a picture please lol
-1	didn t think i could fall in love with amyschumer more but after watching trainwreck and a q amp a with my favorite professor at asu i have
-1	thefilmrenegado at this point i d rather watch the infamous kevin smith jon peters superman film cuz that would be trainwreck hilarious
-1	amyschumer amazing job with trainwreck u r such an amazing person and i m so happy i got to hear u share ur thoughts and experiences
-1	rt cocotropila got to see the trainwreck movie premiere starring amyschumer with a q amp a hilarious go see this summer
-1	amyschumer can t wait for trainwreck oh no just had a premature decoupling trainwreck
-1	amyschumer is crashing my favorite comedians list trainwreck was fantastic and so relatable
-1	only watching trainwreck would have made this an amazing night but then amy schumer favorited my https t co fy1ltqjmzr
-1	audreyhacker it s so black amp white and so heavy on religious symbolism it s a trainwreck
-1	met amyschumer today saw her movie trainwreck its absolutely hilarious go see it lovedthegameofthronesreferences http t co 8penyaszao
-1	amyschumer is such an inspiration so glad i got to see her new movie trainwreck and laugh my ass off tonight lt 3
-1	ddlovato hi demi i hope you ll sing trainwreck when you come here in the philippines love you
-1	can t wait to watch trainwreck 1 000 more times when it comes out amyschumer is hilarious and sweet and gorgeous stillfangirling
-1	rt wesleykarlin trainwreck was even more perfect than i ever imagined shoutout to amyschumer for everything tonight trainwreckcollege
-1	rt bayliminer29 amyschumer is the funniest and most down to earth person so in love with her movie trainwreck and can t wait to see it
-1	rt emlaubster trainwreck by amyschumer was almost too perfect scary relatable and super on point i was laughing and crying in the sam
-1	rt myohmyitsrhy amyschumer s trainwreck was fantabulous http t co wdtwkiwd2r
-1	rt wesleykarlin trainwreck was even more perfect than i ever imagined shoutout to amyschumer for everything tonight trainwreckcollege
-1	trainwreck was even more perfect than i ever imagined shoutout to amyschumer for everything tonight trainwreckcollegetour
-1	just say trainwreck such a hilarious movie amyschumer http t co rabobjmapm
-1	amyschumer s trainwreck was fantabulous http t co wdtwkiwd2r
-1	akiracomplex really tho looking back the whole movie was a trainwreck and who the hell thought an animated movie of it was a good idea
-1	imsledgren twitch aye use my fav sub zero in this next one
-1	you was there when the money gone you ll be there when the money come
-1	trainwreck by amyschumer was almost too perfect scary relatable and super on point i was laughing and crying in the same five minutes
-1	allisonraybar whether civil war was an out of character trainwreck or the best crossover event ever
-1	amyschumer trainwreck was amazing it pretty much summed up how i feel right now thank you
-1	amyschumer is the funniest and most down to earth person so in love with her movie trainwreck and can t wait to see it again
-1	got to see the trainwreck movie premiere starring amyschumer with a q amp a hilarious go see this summer
-1	this is the cough film critic that criticized amyschumer s looks and weight jeez http t co f1hwjn7myq http t co absnouenks
-1	now playing trainwreck 1979 by death from above 1979 http t co 1infqtxuxk everythingthatrocks cjay92
-1	i learned about purple trainwreck
-1	indianapolis starjuly movie preview terminator returnsindianapolis starstars drink up trainwreck bulk up sou channingtatum
-1	trainwreck private screening funny movie amyschumer is f n hilarious she s a funny person in real life too http t co jurhivfpl4
-1	assnuglet wait fuck i thought this said attractive this is a trainwreck
-1	copywrite beautiful trainwreck
-1	uselessmoron like this is a goddamn trainwreck make no mistake
-1	can she skip let it go and thriller or swap them for trainwreck in case or fix a heart
-1	ayo nathankress remember me hmu son so we can smash on some hoes bruh http t co stlf2evpcd
-1	rt titowrestling that superman vs batman film is going to be a total trainwreck marvel took years building avengers amp yet dc wants just
-1	michalpruchnik we ve come full circle since this whole trainwreck started with oreos mic654 mrjallen15 leahrboss shaephoenix
-1	rt reaganlindy our prom group text is like a trainwreck on crack
-1	well brittmchenry you re famous now is it everything you dreamed it would be trainwreck futurerealitystar espn
-1	talespun that movie s gonna be a trainwreck they re trying to do too much with too little
-1	this is like watching a trainwreck made of bad american idol auditions and shame xmushito emiko_wisp sloshedtrain2 mochinegun
-1	rt devanhangsat711 dleifragoreos that video is a trainwreck
-1	my presentation has gone from being on one thing to another thing to both things to a huge mess all in one night trainwreck
-1	dleifragoreos that video is a trainwreck
-1	batman v superman is going to be the most hilarious trainwreck oh my god
-1	our prom group text is like a trainwreck on crack
-1	rt ryanchiarella i will own one some day this trainwreck amp was amazing tbt me annoying people at the brookdale https t co z3vpr66
-1	tensai yes i choose cubby talk over trainwreck 2016 right now xd
-1	i can t handle trainwreck all my favorite comedians in 1 movie this hasn t happened since tommyboy sweet jesus
-1	trainwreck paper towns maybe mission 5 vacation f four sleeping with o people ex machina and probably missing a ton more
-1	thu 23 28 trainwreck 1979 by deathfromabove1979 http t co eb6kz6ltee
-1	kingjames went to see advance showing of trainwreck tonight lebron james is hilarious in this movie
-1	rt angelafader43 hashtaggedbasic just spilled sparkling cider all over the stage trainwreck deservesanacademyaward
-1	johncena went to see advance showing of trainwreck tonight john cena is hilarious in this movie
-1	rt uuinsider we re screening trainwreck before it hits theaters come to hbc gifford at 9 30 or 11 00 pm on wednesday http t co d0tmyk
-1	some beautiful trainwreck
-1	any topchef challenge where the chefs have to make dessert trainwreck youdontknowwhatyouredoing
-1	my life is a total trainwreck
-1	we re a trainwreck
-1	fxnetworks thecomedians sometimes u watch a show that is a horrible trainwreck amp then they put a offensive trans character in it sheesh
-1	rt probperf the trainwreck that is gypsywedding on tlc is ridiculously entertaining
-1	so much kief in the grinder gotta keep saving till it overflows
-1	rt slutprobiems if u can t handle me at my worst then leave because i don t have a best i m literally always a trainwreck
-1	who wants a bubbler
-1	erineatsworld that movie is insane it s like a trainwreck tho lol you just have to keep watching
-1	i m never this heated but wow this is a trainwreck
-1	rt 30secondscene trainwreck is lowkey gonna be a classic https t co yjzrfoe7s3
-1	bluesravens jaz ist a trainwreck i can feel it my im dc trash and im so excited
-1	karlyfish rachel_fish88 sounds about right what a trainwreck am i rite
-1	i will own one some day this trainwreck amp was amazing tbt me annoying people at the brookdale https t co z3vpr66pxl
-1	the movie trainwreck is my life dammit
-1	oh no i can t stop listening to portsmouth sinfonia it s the best sort of trainwreck
-1	http t co pihkwcre0y trainwreck sets amy schumer on fast track 74 http t co ejxjl7dbfl
-1	hellaton it s honestly just a trainwreck of a fandom im glad i escaped
-1	rt angelafader43 hashtaggedbasic just spilled sparkling cider all over the stage trainwreck deservesanacademyaward
-1	death from above 1979 trainwreck 1979 david letterman http t co cbqdusbtla
-1	kaleido goggles i have to get
-1	my acc is a trainwreck rn i am so sorry
-1	rt ouresderec trainwreck in westport plaza http t co jpq0udvrjn
-1	rt aveuaskew long distance relationships because everyone in your town knows you re a trainwreck
-1	rt slutprobiems if u can t handle me at my worst then leave because i don t have a best i m literally always a trainwreck
-1	rt amyschumer thanks ucberkeley tomorrow showing trainwreck cuboulder thursday asu friday ohiostate trainwreckcollegetour http
-1	rt 2xrealcjsellers bbtn sportscenter as overrated as i think this dude is the cubs need all the help they can get lester is a trainwr
-1	rt kittygott ummmm why did nobody tell me the movie warrior existed tom hardy you emotional trainwreck of a babe meow http t c
-1	ummmm why did nobody tell me the movie warrior existed tom hardy you emotional trainwreck of a babe meow http t co oaak0lfsmi
-1	tmz tow truck company fires back at espn s britt mchenry http t co 5jgxhvfaae http tow co has a great employee espn has a trainwreck
-1	peterquills i know sims 4 is a trainwreck i only played it once and went straight back to 3
-1	rt 30secondscene trainwreck is lowkey gonna be a classic https t co yjzrfoe7s3
-1	bbtn sportscenter as overrated as i think this dude is the cubs need all the help they can get lester is a trainwreck call bryant up
