-1	everyone see trainwreck when it comes out this summer it s too funny
-1	domzabala amyschumer omg i am so jealous trainwreck looks hilarious lmk how it is
-1	rt apathyvii imnotnight hourtriipy this tweet convo is a trainwreck
-1	imnotnight hourtriipy this tweet convo is a trainwreck
-1	tweetdeck your search filtering is second to none but your mobile layout is a trainwreck what s the deal
-1	this is worse than the maryland helmets trainwreck clintau24 jotimeismoney http t co jidcjnmyd7
-1	trainwreck made me laugh until i cried it also made me cry in general hilarious and smart thank you amyschumer for being a real woman
-1	i wonder why when watching trainwreck reality shows stuff gets stuck in my head imma put the baddest heffas on the flo name that show
-1	oh look they finally made a movie about me trainwreck official trailer 2015 https t co ucrsk1cchg
-1	rt ythlansuheart trainwreck demi lovato chords http t co jieho7xzlo
-1	watch amyschumer s new movie trainwreck gt gt gt homework
-1	today was a trainwreck lol
-1	trainwreck is insanely hilarious
-1	rt aveuaskew long distance relationships because everyone in your town knows you re a trainwreck
-1	hashtaggedbasic just spilled sparkling cider all over the stage trainwreck deservesanacademyaward
-1	shaughn_a rollout is a trainwreck she must be spitting mad behind the scenes
-1	fkn trainwreck
-1	rt sicpisubpi trainwreck unrated trailer http t co fawmzj6m2g
-1	that superman vs batman film is going to be a total trainwreck marvel took years building avengers amp yet dc wants justice league in 1 film
-1	i think i have a weirdly sick obsession with americangypsywedding it s such a trainwreck but i can t look away
-1	rt rmaclean_writer chaucerbabe yes that is the job of any avant garde artform it forces you to see the trainwreck 10minnovelists nice
-1	chaucerbabe melinagillies yes that is the job of any avant garde artform it forces you to see the trainwreck 10minnovelists
-1	rt probperf the trainwreck that is gypsywedding on tlc is ridiculously entertaining
-1	dfa1979 trainwreck 1979 11 29
-1	rt eragacal trainwreck my life as an idiot cast http t co nngo8lcgze
-1	rt 30secondscene trainwreck is lowkey gonna be a classic https t co yjzrfoe7s3
-1	tillmanmaryanne grwoobie suzannah10gem wildchildwendy idk some crazy drunken tweet can t remember now she s a trainwreck
-1	rt dannypifer amyschumer saw a screening of trainwreck on monday i can t count how many times i laughed out loud i really loved it
-1	this is a trainwreck
-1	rt 30secondscene trainwreck is lowkey gonna be a classic https t co yjzrfoe7s3
-1	rt 30secondscene trainwreck is lowkey gonna be a classic https t co yjzrfoe7s3
-1	drinking a trainwreck ale by mtpbrewingco frank s hooch room http t co bbm8erbyzn photo
-1	saviorofcorona the travesty of it all i have to deal with it yet once again trainwreck
-1	new post see the trainwreck of the week on walk of shame shuttle http t co nfzqhmt2nh
-1	vjl_bball he is a super athlete and allegedly a gym rat he was bad as a rookie but i was expecting a compete trainwreck
-1	now playing trainwreck 1979 by death from above 1979 http t co zgpzxcjsqh theedge
-1	trainwreck cause i m going insane for ddlovato and this concert livenationoznz iwannameetdemi melbourne
-1	you re a trainwreck but with you i m in love
-1	trainwreck because i need preparation as i will be a trainwreck when its over livenationoznz iwannameetdemi melbourne
-1	rt maddiemuffinsss got a strain called lohan and it s trainwreck crossed with la confidential
-1	carmillalusta sooo i think imma be a masochist amp watch this trainwreck tonight
-1	rt slutprobiems if u can t handle me at my worst then leave because i don t have a best i m literally always a trainwreck
-1	rt ouab trainwreck amyschumer s new movie http t co iziegxfc44 bill hader was on campus last year she ll be here tmrw http t co
-1	rt ouab trainwreck amyschumer s new movie http t co iziegxfc44 bill hader was on campus last year she ll be here tmrw http t co
-1	bigdavesrants cfslawndart cali_1024 tarajmac i think us combined trainwreck we each bring our own gift
-1	amyschumer i m so excited for your movie trainwreck we have to wait until july though damn
-1	i really want to see amyschumer s new movie trainwreck because she s the shit
-1	amyschumer saw a screening of trainwreck on monday i can t count how many times i laughed out loud i really loved it trainwreck
-1	trainwreck because i need preparation as i will be a trainwreck when its over livenationoznz iwannameetdemi melbourne
-1	got a strain called lohan and it s trainwreck crossed with la confidential
-1	amyschumer trainwreck fucking awesome
-1	rt probperf the trainwreck that is gypsywedding on tlc is ridiculously entertaining
-1	kunaldes it s like a sunrise trainwreck
-1	i feel sick today s been a trainwreck
-1	you are freakin amazing amyschumer a true role model trainwreck was such a funny movie i can t wait to go see it again this summer
-1	princelypaws kenhinaiscanon this is so entertaining its like a trainwreck in slow motion and i cant look away
-1	rt ouab trainwreck amyschumer s new movie http t co iziegxfc44 bill hader was on campus last year she ll be here tmrw http t co
-1	trainwreck was fire amyschumer is on the up amp up amp up cool to have a real gal representing real galz thanks programcouncil
-1	rt ouab trainwreck amyschumer s new movie http t co iziegxfc44 bill hader was on campus last year she ll be here tmrw http t co
-1	rt ouab trainwreck amyschumer s new movie http t co iziegxfc44 bill hader was on campus last year she ll be here tmrw http t co
-1	rt 30secondscene trainwreck is lowkey gonna be a classic https t co yjzrfoe7s3
-1	trainwreck because i need preparation as i will be a trainwreck when its over livenationoznz iwannameetdemi melbourne
-1	rt 30secondscene trainwreck is lowkey gonna be a classic https t co yjzrfoe7s3
-1	rt probperf the trainwreck that is gypsywedding on tlc is ridiculously entertaining
-1	i look like a trainwreck from work i m guaranteed to run into my hot neighbor singlegirlprobems
-1	rt ouab trainwreck amyschumer s new movie http t co iziegxfc44 bill hader was on campus last year she ll be here tmrw http t co
-1	nyrvspit pierre mcguire lapierre created a trainwreck of a situation that s what he does trainwrecks p becauseitsthecup
-1	this is a trainwreck at this point and i ll gladly be the first to respectfully cptwigglefuffle steve_baltimore smt_yhvh eritachttv
-1	trainwreck amyschumer s new movie http t co iziegxfc44 bill hader was on campus last year she ll be here tmrw http t co qnhpdd8d6o
-1	it s like a trainwreck i have paused this damn thing no less than 5 times in the last half a minute
-1	you re a trainwreck but i wouldn t love you if you change
-1	trainwreck amp clone http t co dhwhtcb7hd
-1	on my way to catch an advance screening of trainwreck starring amyschumer amy will be attending https t co 7odiul2he6
-1	realalittlecat my entire feed is a trainwreck rn thanks a lot man
-1	trainwreck has a 100 rating on rotten tomatoes right now but my real question is how did they see it before me http t co xadpwmvd52
-1	ladymris chellemariak lucyappa obsession the laura tribute oh please let s not discuss that trainwreck
-1	thank god i work at 9 tonight so i don t have to see the rest of this trainwreck game
-1	now playing trainwreck 1979 by death from above 197 http t co xzz8qkuqrq 989thedrive essentialalternative
-1	huffingtonpost not surprised she seems to never be accountable trainwreck
-1	rt 30secondscene trainwreck is lowkey gonna be a classic https t co yjzrfoe7s3
-1	patiently waiting on trainwreck http t co crzuhgzfnr
-1	im_not_a_lizard they were the best thing that trainwreck of a show ever produced
-1	now playing trainwreck 1979 by death from above 1979 http t co myxxkl3vy4 bestrock thebear1003
-1	livenationoznz iwannameetdemi melbourne trainwreck will forever be one of the songs that gets me singing into a hairbrush
-1	trainwreck jerky http t co za5y2w0xpj
-1	missleslieg girl sad trainwreck
-1	trainwreck https t co ekz1rerd4n
-1	livenationoznz iwannameetdemi melbourne trainwreck will forever be one of the songs that gets me singing into a hairbrush
-1	rt aveuaskew long distance relationships because everyone in your town knows you re a trainwreck
-1	qualiathepurple haremprotag actually you can still watch it for being a trainwreck
-1	rt datura1979 i m probably just still jaded over the prequel trilogy trainwreck but the new starwars trailer has me like http t co m
-1	rt slutprobiems if u can t handle me at my worst then leave because i don t have a best i m literally always a trainwreck
-1	rt slutprobiems if u can t handle me at my worst then leave because i don t have a best i m literally always a trainwreck
-1	rt probperf the trainwreck that is gypsywedding on tlc is ridiculously entertaining
-1	rt slutprobiems if u can t handle me at my worst then leave because i don t have a best i m literally always a trainwreck
-1	real_deity i put on my best watching trainwreck reality tv horrified rictus and it seemed to stop that
-1	rt orignalcequeen face your problems head on that s stupid a trainwreck in the making i dodge those fuckers
-1	bibi appears balanced because nico looks like a first year printemps is a trainwreck
-1	the rdc ladies are half way through this trainwreck sofun terribleart wine and canvas in indianapolis in https t co yypg7ice8h
-1	just at the movies with my besties amyschumer and bobaultman seeing trainwreck early http t co y7yz274517
-1	tonight is the free screening of the hot new comedy trainwreck if you enjoyed bridesmaids you will love this movie
-1	rt probperf the trainwreck that is gypsywedding on tlc is ridiculously entertaining
-1	rt slutprobiems if u can t handle me at my worst then leave because i don t have a best i m literally always a trainwreck
-1	fleury is a fucking trainwreck every playoffs it never fails
-1	and so the trainwreck that is marc andre fleury begins
-1	the trainwreck that is gypsywedding on tlc is ridiculously entertaining
-1	hi lovatics lt 3
-1	rt slutprobiems if u can t handle me at my worst then leave because i don t have a best i m literally always a trainwreck
-1	death from above 1979 trainwreck 1979 http t co sgojmy8p71 lubbock altrock 1057lubbock
-1	boboloca that dude just blocked me for asking why how silly its trainwreck tv people
-1	rt nocontrol91 sophia hates the boys so much she couldn t even use her fashion major skills to save their trainwreck outfits
-1	randy_haas yes this person is it s trainwreck tv and they all signed up for it why wouldn t they bravo isn t pbs 4 christ sakes
-1	grunklefucker69 gonna watch this trainwreck the whole way
-1	make sure to come early to get a seat to see trainwreck before theaters tonight amc muncie 12 8pm http t co jawmbsgvcu
-1	rt nocontrol91 sophia hates the boys so much she couldn t even use her fashion major skills to save their trainwreck outfits
-1	all aboard the depression trainwreck last stop cookies
-1	icemoonpromo_gr virtualdjradio4 live now dj trainwreck lets trance electro dutch dnb dubstep dj nowplaying
-1	wowmanjack rt virtualdjradio4 live now dj trainwreck lets trance electro dutch dnb dubstep dj nowplaying
-1	trainwreck movie 2015 this is the new video trailer for the trainwreck movie 2015 enjoy http t co cvjdwxgmod
-1	livenationoznz trainwreck because that is my bestfriend amp i s song and we are getting matching lyric tattoos iwannameetdemi brisbane
-1	virtualdjradio4 live now dj trainwreck lets trance electro dutch dnb dubstep dj nowplaying http t co cylshdnic4 virt
-1	livenationoznz trainwreck because that is my bestfriend amp i s song and we are getting matching lyric tattoos iwannameetdemi brisbane
-1	rt virtualdjradio4 live now dj trainwreck lets trance electro dutch dnb dubstep dj nowplaying http t co 1t2d3ydlam vir
-1	lebronjames shows off comedic timing in latest trainwreck trailer http t co uogp2uj9al
-1	rt trainwreckmovie i m just a modern chick who does what she wants amyschumer stars in trainwreck in theaters july 17 https t c
-1	my sister decides to get all fancy amp dressed up for this show were going to while i look like trainwreck this is so rude im calling the cops
-1	can t wait to see the movie trainwreck just bc kingjames is in it
-1	wanderlust6190 but this is just a trainwreck this isn t easy for me not flirting doesn t in any way suggest that it is i think we
-1	no one can change this heart of mine trainwreck train station railway travel look instagood https t co hth3mojgqm
-1	but if you try to take that from me well i ll never be the same trainwreck that i am and i am what i am what i am what i am a trainwreck
-1	rt virtualdjradio4 live now dj trainwreck lets trance electro dutch dnb dubstep dj nowplaying http t co 1t2d3ydlam vir
-1	amyschumer replies to worst ever take on her trainwreck trailer http t co 1xzcfyky7i via thisisfusion
-1	icemoonpromo_us virtualdjradio4 live now dj trainwreck lets trance electro dutch dnb dubstep dj nowplaying
-1	bojackhorseman chelaland sorry bj after watching more eps i can safely say you are anything but pretty trainwreck
-1	virtualdjradio4 live now dj trainwreck lets trance electro dutch dnb dubstep dj nowplaying http t co xdyxqcouzk virt
-1	pre showing of the comedy trainwreck tonight at 7 at hollywood theaters get there early for some giveaways
-1	rt weedofig i m so done grease jewce medicated weedofig solventless trainwreck fullmelt hash claritycounts instag http t
-1	walkofshamevh1 i hope your shows getting good ratings cause it s hilarious amp i will be upset if it doesn t get a second season trainwreck
-1	a summary of research methods now that s a trainwreck
-1	livenationoznz trainwreck because that is my bestfriend amp i s song and we are getting matching lyric tattoos iwannameetdemi brisbane
-1	livenationoznz trainwreck because that is my bestfriend amp i s song and we are getting matching lyric tattoos iwannameetdemi brisbane
-1	livenationoznz trainwreck because that is my bestfriend amp i s song and we are getting matching lyric tattoos iwannameetdemi brisbane
-1	livenationoznz trainwreck because that is my bestfriend amp i s song and we are getting matching lyric tattoos iwannameetdemi brisbane
-1	livenationoznz trainwreck because that is my bestfriend amp i s song and we are getting matching lyric tattoos iwannameetdemi brisbane
-1	livenationoznz trainwreck because that is my bestfriend amp i s song and we are getting matching lyric tattoos iwannameetdemi brisbane
-1	livenationoznz trainwreck because that is my bestfriend amp i s song and we are getting matching lyric tattoos iwannameetdemi brisbane
-1	livenationoznz trainwreck because that is my bestfriend amp i s song and we are getting matching lyric tattoos iwannameetdemi brisbane
-1	rt bley_x my room is a mess therefore my life is a fucking trainwreck bc they correlate for some reason only god knows
-1	livenationoznz trainwreck because that is my bestfriend amp i s song and we are getting matching lyric tattoos iwannameetdemi brisbane
-1	livenationoznz trainwreck because that is my bestfriend amp i s song and we are getting matching lyric tattoos iwannameetdemi brisbane
-1	live now dj trainwreck lets trance electro dutch dnb dubstep dj nowplaying http t co 1t2d3ydlam virtualdjradio4
-1	livenationoznz trainwreck because that is my bestfriend amp i s song and we are getting matching lyric tattoos iwannameetdemi brisbane
-1	livenationoznz trainwreck because that is my bestfriend amp i s song and we are getting matching lyric tattoos iwannameetdemi brisbane
-1	livenationoznz trainwreck because that is my bestfriend and i s song and we are getting matching lyric tattoos iwannameetdemi brisbane
-1	rt 30secondscene trainwreck is lowkey gonna be a classic https t co yjzrfoe7s3
-1	rt podasygubuz in this week s lisa s desk episode lisa talks about a recent incident involving trainwreck actress amy schumer who is
-1	rt nocontrol91 sophia hates the boys so much she couldn t even use her fashion major skills to save their trainwreck outfits
