-1	just getting up about to roll up trainwreck
-1	the trainwreck on the hill holly fletcher s interviews with hospital leaders hollyfletcher drmikestthomas http t co 7r4et84brd
-1	back to the original time trainwreck tickets are here http t co tdq9grp512
-1	rt 30secondscene trainwreck is lowkey gonna be a classic https t co yjzrfoe7s3
-1	rt cakes4u tps_guy timhortons tsn1260 please hockeygods not the leafs trainwreck
-1	zavvi the only good thing about this trainwreck of a movie is tara reid
-1	trainwreck_34 hi i just got back
-1	rt cakes4u tps_guy timhortons tsn1260 please hockeygods not the leafs trainwreck
-1	maggies_kid well neither actually he s an asshole she s ridiculous ravenel is such a trainwreck though
-1	tps_guy timhortons tsn1260 please hockeygods not the leafs trainwreck
-1	i m blowing on the blueberry trainwreck
-1	restless yesterday s training was a trainwreck sweetscience
-1	rt 30secondscene trainwreck is lowkey gonna be a classic https t co yjzrfoe7s3
-1	airkaka87 ginad129 utahmomslife darci_cole it s a complete trainwreck
-1	lmaoo my snapchat story goes more and more trainwreck each picture
-1	you re a trainwreck but i wouldn t love you if you change
-1	goodmorning im going to delete all of my trainwreck tweets im sorry im such a mess
-1	was a trainwreck i don t know it sucks
-1	omar epps playing willie mays hayes is a trainwreck
-1	in this week s lisa s desk episode lisa talks about a recent incident involving trainwreck actress amy schumer who is a size 6
-1	tabftmgc i love it so much and i just watched the trailer while trying to watch the movie and i am a trainwreck
-1	rt bdazzle2233 sometimes people put up walls not to keep people away but to see who cares enough to tear those walls down http t c
-1	in honor of my birthday party tonight here s a 21st bday photo the phones the water the trainwreck enjoy http t co 3m2srxy2hf
-1	rt otreehill i wanted you to fight for me i wanted you to say that i m the one you want to be with and that you d rather be alone than
-1	pls sing trainwreck ddlovato
-1	rt otreehill one of the best quotes from one tree hill http t co go73w3isto
-1	dmregister iowacubs and the concession stands were a trainwreck
-1	rt dlsneymemories simba but you re not scared of anything mufasa i was today i thought i might lose you the lion king
-1	nafsnep 210darryl because malcolm subban was a trainwreck in net
-1	wtf is this trainwreck of a counterfeit http t co rqti9t3qin
-1	on air trainwreck 1979 by death from above 1979 http t co vizbybzyx2 nowplaying chom
-1	this season finale was just one big trainwreck like wow broadchurch
-1	itsunriel he will be in rva soon
-1	hacklasalle stevesignore acmilan7 markywolf compybaby retrobooking bpyles84 that s quite a long time before she was a trainwreck
-1	hidden treasure trainwreck http t co uwoxlcjep9 2steelgirls http t co hkoyk4ulja kickassmusic playitforward
-1	rt 3amfeels my feelings are a fucking trainwreck im worried sick or i dont care at all im a total sweetheart while also being an asshol
-1	firmbets he is a top 5 weirdo on here absolute trainwreck
-1	ctrent it s a trainwreck and walt has to step down the moves recently are puzzling
-1	theunlvbigguy wvsparkscasino i swear everything in sparks is a trainwreck that s where i lived in 05
-1	rt lastgangent exclusive for recordstoreday cdn label amp band for cdns only dfa1979 trainwreck 1979 10 picture disc for rsd15 http
-1	rt 30secondscene trainwreck is lowkey gonna be a classic https t co yjzrfoe7s3
-1	rt 30secondscene trainwreck is lowkey gonna be a classic https t co yjzrfoe7s3
-1	rt whooperstyles horans_gxrl ur layout reminds me of weed i love weed jk trainwreck demi lovato
-1	rt guardian sofi oksanen we know about british colonialism russian colonialism is not well known http t co 8wvnttjpgf
-1	horans_gxrl ur layout reminds me of weed i love weed jk trainwreck demi lovato
-1	nowplaying death from above 1979 trainwreck 1979 tune in http t co qspqswknnx
-1	this reminds me that my layout is currently an embarassing trainwreck
-1	rt ronsupportsyou ronsupportsyou mt fukeith trainwreck has an amazing lineup 8pm wednesday a http t co tpewdbgioo kremlintroll
-1	is out of a crisis now defined as moving from trainwreck to abject mediocrity some litmus test adz77 rossoneriblog
-1	mt fukeith trainwreck has an amazing lineup 8pm wednesday at the producers club https t co 0pywgeikak newyorkcity comedy
-1	where do i sign up for america s next top trainwreck
-1	so shelby_cyrus boyfriend is coming over and i look like a trainwreck dontevencare
-1	so excited for that lineup to drop monday
-1	now playing trainwreck 1979 by death from above 1979 http t co zgpzxcjsqh theedge
-1	death from above 1979 trainwreck 1979 http t co lvjroxksrh nowplaying listenlive
-1	just heard i m ready playing in the trailer of the new movie trainwreck coming out this summer didnt freak out or anything ajrbrothers
-1	exclusive for recordstoreday cdn label amp band for cdns only dfa1979 trainwreck 1979 10 picture disc for rsd15 http t co n13grouxzf
-1	april 18 2015 at 6 41 am trainwreck 1979 by death from above 1979
-1	rt jnellbg scrolls twitter funny rt awwww star eewwww block tits scroll vag joke scroll bahaha follow trainwreck follow and anot
-1	templesmith but have you seen the trailer for trainwreck
-1	rt bigxnose if someone picks up brand new d j entendu death from above 1979 trainwreck and the prodigy ibiza for me i ll pay you
-1	rt the_edge_music now playing trainwreck 1979 by death from above 1979 http t co zgpzxcjsqh theedge
-1	rt al3xwa5muht trainwreck 1979 death from above 1979
-1	rt thezoneplaylist april 17 2015 at 1 41 pm trainwreck 1979 by death from above 1979
-1	rt the_edge_music now playing trainwreck 1979 by death from above 1979 http t co zgpzxcjsqh theedge
-1	rt kaoifm death from above 1979 trainwreck 1979 http t co iajvtxq1dk nowplaying mauiradio
-1	rt corrosive_radio nowplaying death from above 1979 trainwreck 1979 tune in http t co qspqswslzn
-1	rt aveuaskew long distance relationships because everyone in your town knows you re a trainwreck
-1	rt radio1017 now playing trainwreck 1979 by death from above 1979
-1	rt 989thedrivetrax now playing trainwreck 1979 by death from above 197 http t co xzz8qkuqrq 989thedrive essentialalternative
-1	rt capitalaslash death from above 1979 trainwreck 1979 official audio https t co 0glurcvdtq via youtube
-1	rt kusatheeagle death from above 1979 trainwreck 1979 http t co zzrxztsk5t nowplaying listenlive
-1	rt 89xmusic now playing trainwreck 1979 by death from above 1979 http t co 7pqs4rshhb 89x
-1	rt titowrestling that superman vs batman film is going to be a total trainwreck marvel took years building avengers amp yet dc wants just
-1	this is a trainwreck
-1	i had trainwreck last night disgusting taste but i was 9 for a few hours
-1	rt cuddleholmes the brian quinn tag on tumblr is a trainwreck http t co py2tdwkvje
-1	watched a pre screening of trainwreck at ohio state last night kingjames i think you have a future in acting
-1	in this week s lisa s desk episode lisa talks about a recent incident involving trainwreck actress amy schumer who is a size 6
-1	rt cuddleholmes the brian quinn tag on tumblr is a trainwreck http t co py2tdwkvje
-1	the brian quinn tag on tumblr is a trainwreck http t co py2tdwkvje
-1	i had trainwreck last night disgusting taste but i was 9 for a few hours http t co u4slnbttq5
-1	rt burkvest buckhollywood ever addressed the trainwreck that is tidal tidalfornone http t co msao0clmha
-1	always end up a trainwreck when i drink in the sun lol lets av it x
-1	meghan trainwreck is stuck in the 15th century
-1	a whopping 25 of brits will be heading to the cinema to catch amyschumer in action in trainwreck vuecinemas http t co h8zll4jusw
-1	rt herzschlaege nowplaying trainwreck 1979 death from above 1979 http t co ydsfsou3up
-1	nowplaying trainwreck 1979 death from above 1979 http t co ydsfsou3up
-1	last night was a trainwreck of the highest degree though it started out well i need a handler
-1	rt deagesedes trainwreck demi lovato lyrics http t co ctlnkqbr5v
-1	what a knightmare ryanatlfpress has conjured voodoo blackmagic an all knights team of mapleleafs would be a trainwreck go hawks
-1	ursibae this movie is gonna be a fuckin trainwreck a trainwreck that makes millions
-1	birdkeiji a beautiful trainwreck
-1	faisalkamal 1jtking i thought j left brit he got rid of her oh amp kfed s big dick helped her she became a trainwreck thanks to the big dick
-1	i am an actual trainwreck im so fucfkeedf up
-1	emmalinebelle oh yeah well on a genderpolitical level it s a flaming trainwreck nightmare fair enough
-1	this is why i quit working in law i couldn t handle that anymore yet here i am watching this shit lmao i m a trainwreck
-1	kelan showing ng trainwreck sa phils
-1	rt morganastra gosh nothing like porting code to clojure to make you realize how much of a trainwreck ruby s library ecosystem is
-1	trainwreck 1979 on clammr clammrapp http t co c9fusfeyhc
-1	rt trainwreckmovie i m just a modern chick who does what she wants amyschumer stars in trainwreck in theaters july 17 https t c
-1	now playing trainwreck 1979 by death from above 1979 http t co 7pqs4rshhb 89x
-1	a bit of a trainwreck kind of series actually i need explanations o
-1	kurtzgallahad mecha_fish shit i meant waggles what a trainwreck
-1	trainwreck
-1	try to stop this trainwreck carcrashlander where to swim
-1	trainwreck official trailer hd https t co rteapihy8g
-1	gmehn tudorstuart thefingersofgod yup ditto there s a trainwreck fascination to it but got too much too quickly
-1	borderlands 2 all missions let the trainwreck begin http t co dtfse0ci8q
-1	rt morganastra gosh nothing like porting code to clojure to make you realize how much of a trainwreck ruby s library ecosystem is
-1	detectivehyde oh i do it s like a trainwreck you can t look away from also i have an erection for some reason
-1	cableracing111 me amp jay_trainwreck will hold you to that 2 sugars in mine
-1	trainwreck official trailer hd https t co rteapihy8g
-1	nowplaying death from above 1979 trainwreck 1979 tune in http t co qspqswslzn
-1	trainwreck by demi lovato
-1	now playing trainwreck 1979 by death from above 1979 http t co zgpzxcjsqh theedge
-1	leonidragozin he s been found according to varlamov https t co qdrcfskyuk
-1	death from above 1979 trainwreck 1979 http t co zzrxztsk5t nowplaying listenlive
-1	rt aveuaskew long distance relationships because everyone in your town knows you re a trainwreck
-1	might have to see trainwreck just for that john cena cameo lmao
-1	they cost like 400 for the vip 4 package but i worked all summer its so worth it im honesly an emtoinaly trainwreck
-1	rt remewinma trainwreck power transformer http t co 2chjdbe0jd
-1	death from above 1979 trainwreck 1979 official audio https t co 0glurcvdtq via youtube
-1	doing the 11 6 30 shift today with 4 hours sleep then we ve got trainwreck to go to tonight
-1	since nettie at coachella she will be probably hanging with the trainwreck tomorrow
-1	nowplaying death from above 1979 trainwreck 1979 on nacho radio s planet alt
-1	hxrmonia knarkse ahhhyes that trainwreck of an adventure good times
-1	trainwreck official trailer hd https t co rteapihy8g
-1	rt morganastra gosh nothing like porting code to clojure to make you realize how much of a trainwreck ruby s library ecosystem is
-1	rt san_frances amyschumer trainwreckthemovie made us all feel like being a trainwreck is sometimes ok greatmovie
-1	now playing trainwreck 1979 by death from above 197 http t co xzz8qkuqrq 989thedrive essentialalternative
-1	the weed i found was called trainwreck amp it s actually good 9 10 would recommend
-1	wanna go watch trainwreck
-1	rt rocdiphylbou trainwreck veg time http t co yqyk2idizt
-1	i am amyschumer in trainwreck expect i don t get laid truestory
-1	well folks this trainwreck is going to go walk it off take a shower and then chug a liter of cough syrup y all have a lovely night
-1	drunk watching inside amyschumer and wondering why she isn t coming to iowa state for the trainwreck tour
-1	quesozero yeah its a big trainwreck to me imo
-1	trainwreck official trailer hd http t co p4zdnyxiae
-1	thestanchion the whole scene was definitely entertaining i m not biased i called hartley a trainwreck earlier in several tweets
-1	trainwreck is hella smooth
-1	jkohlmann to be fair imap is a complete and unmitigated trainwreck but yeah i d say you re right about that and it s a bummer
-1	trainwreck
-1	rt remewinma trainwreck power transformer http t co 2chjdbe0jd
-1	i liked a youtube video http t co uvjkx18vne trainwreck official trailer 1 2015 lebron james bill hader movie hd
-1	amyschumer trainwreck and the college tour is the only reason i am 28 and regret not going to college can i enroll for a day
-1	i was born on a highway in a trainwreck
-1	rocksmoulder bb6mac k_r_y_s_7_a_l truefloridian biglohiphop what a fucking trainwreck down to 1 viewer how long does it take to reset
-1	phoebz4 i never dared i know it s a trainwreck let s not give it a chance to mesmerize me
-1	rt 30secondscene trainwreck is lowkey gonna be a classic https t co yjzrfoe7s3
-1	today was a trainwreck well yesterday see what i mean everything is colliding together and isn t making sense
-1	sat 02 22 trainwreck 1979 by deathfromabove1979 http t co eb6kz6ltee
-1	rt pornccountant watching the guru w themysticajadex and let me tell you how horrible it is and how we cannot look away trainwreck
-1	watching the guru w themysticajadex and let me tell you how horrible it is and how we cannot look away trainwreck winefriday
-1	nowplaying in the treehouse buffy replay of the trainwreck from 16 april tune in at http t co 9n5dbxqp9e
-1	nowplaying replay of the trainwreck with buffylive1968 http t co kfzpcrm6k8 or via our free apple app in appstore thradio
-1	rt morganastra gosh nothing like porting code to clojure to make you realize how much of a trainwreck ruby s library ecosystem is
-1	ur a trainwreck but i wouldnt love u if u change
-1	calgaryexpo help please desperate to find a pam true blood funk pop for her to sign do you happen to know if any booths have them
-1	ur a trainwreck but i wont love u if u change is this even correct
-1	neg_ative truth like i said i try to pretend it was a nightmare trainwreck
-1	kingjames is hilarious in trainwreck
-1	pretty_arrogant guh fuck that im an emotional trainwreck
-1	to call that stream a trainwreck is kind of unfair to trainwrecks i decided to leave the vod up but like probably don t watch it
-1	rt morganastra gosh nothing like porting code to clojure to make you realize how much of a trainwreck ruby s library ecosystem is
-1	wowemoncemore that whole episode is just the most amazing trainwreck
-1	rt 30secondscene trainwreck is lowkey gonna be a classic https t co yjzrfoe7s3
-1	my son is literally a trainwreck http t co lmpgkyfuhw
-1	trainwreck looks like it s gonna be a good movie
-1	rt slvrhwks super early review of the movie trainwreck http t co erslwvw5ks cinelinx trainwreckmovie
-1	can i go home now that this has been a trainwreck
-1	bill hader amp amy schumer are set to team up for trainwreckmovie amp here is a brand new clip http t co x8fxeoznro trainwreck movies
-1	rt morganastra gosh nothing like porting code to clojure to make you realize how much of a trainwreck ruby s library ecosystem is
-1	saw an advanced screening of trainwreck and i have to say it has become one of my favorite movies https t co dcgrpk717a
-1	super early review of the movie trainwreck http t co erslwvw5ks cinelinx trainwreckmovie
-1	super early review of the movie trainwreck http t co yn5ponhlie cinelinx trainwreckmovie
-1	babip_god lol fuck gallardo that d be a trainwreck like when we traded for jarrod washburn and our playoff spot evaporated
-1	rt morganastra gosh nothing like porting code to clojure to make you realize how much of a trainwreck ruby s library ecosystem is
-1	trainwreck
-1	rt morganastra gosh nothing like porting code to clojure to make you realize how much of a trainwreck ruby s library ecosystem is
-1	sara and i are a trainwreck i cannot stop laughing
-1	rt morganastra gosh nothing like porting code to clojure to make you realize how much of a trainwreck ruby s library ecosystem is
-1	gosh nothing like porting code to clojure to make you realize how much of a trainwreck ruby s library ecosystem is
-1	amyschumer just cn the trailer 4 trainwreck looks fucking amazing plz keep making us laugh u r the best thank u http t co kv8hso70qd
-1	rt nfl ziggy ansah jason jones haloti ngata all lions now this guy good luck blocking them http t co mvduratxaw http t co jw
-1	sixsecondcov the music https t co gyoizvdrs1 willborg_tori oh help me oh mah gawd
-1	wow the pre screening for trainwreck was so funny it s a must see
-1	rt sixsecondcov rt to bless your timeline https t co ulnpfcqgy3
-1	treehouse_radio these shows aren t archived i m interested particularly in the trainwreck
-1	trainwreck express clone for sale http t co ecniy62vgf
-1	sixsecondcov i want you oo ooooo https t co s4l85voz8u willborg_tori help
-1	tomorrow is supersize saturday come get 4 5g for the price of 3 5g for these strains blue widow trainwreck royal empress kibu kush
-1	wowfactz sometimes you have to do what s best for you and your life not what s best for everyone else
-1	well that was a trainwreck hawks
-1	vancanucks tell lack to stay in the crease and he won t get run over should of took his head off trainwreck
-1	kendallrichelle it s that whole trainwreck effect i know it well
-1	slickhawk12 you and zunino both trainwreck
-1	bamesjishop ahead of the game once again
-1	_missdesha this show sounds like a trainwreck which is why i wanna see a lil bit of the coonery
-1	ugh im going to sleep i got shit to do tomorrow to watch this trainwreck
-1	what a trainwreck
-1	just saw amyschumer trainwreck and it totally epitomizes my life as a mess i ve never laughed so hard in my life
-1	i missed trainwreck thursday this week
-1	just saw trainwreck and hands down the funniest movie i ve seen in a long time amazing job amyschumer i will be seeing this 100 times
-1	amyschumer killing it in trainwreck osu loves you
-1	trainwreck aaron calls amy clip official amy schumer bill hader http t co bovdjdhouu http t co t001d47emr
-1	galactaq oh yeah also turn 10 is working on forza 6 and i m interested to see how that turns out after the trainwreck that was forza 5
-1	nowplaying death from above 1979 trainwreck 1979 tune in http t co qspqswslzn
-1	rt treehouse_radio thismorning s replays from the top of the hour instant requests at the movies amp the trainwreck http t co kfzpcrm6
-1	thismorning s replays from the top of the hour instant requests at the movies amp the trainwreck http t co kfzpcrm6k8 thradio
-1	trainwreck
-1	rt itshvrdwoodtho stoked to watch kingmannyiv trainwreck on the decks like usual and then watch prodicvl actually dj a good set
-1	a_trainwreck already wearin em bruh
-1	rt bigdaddymerinar jeffculhane kbulg27 megbulger4 allow me to cut in uninvited and say that kate you re a trainwreck friendlyfatty
-1	kryptic minds trainwreck mix and some kush nostalgia
-1	trainwreck by demi lovato
-1	trainwreck crumbleeee
-1	rt aveuaskew long distance relationships because everyone in your town knows you re a trainwreck
-1	90scxlifornia yesss cant wait for this trainwreck to make it
-1	trainwreck was amazing and i m not just saying that because i want to marry colin quinn thanks for coming amyschumer
-1	rt _andimtamia my new favorite show
-1	waitin4thebeast haha will thanks bae but that doesn t mean i ll stop trying nobody can stop this trainwreck
-1	xanderdash folks tune in for the trainwreck then begin tuning out in droves
-1	do you enjoy bad fanfics i do enjoy traumatizing myself by reading the occasional trainwreck of a fic but i p http t co ckizyshdk6
-1	rt fucktvler when you start growing up http t co opgvipimal
-1	jgavillena i need your help hello
-1	bamesjishop where s the condoms for the groupies bruh
-1	i liked a youtube video http t co elod2l5ttf trainwreck official trailer hd
-1	im about to smoke trainwreck alien og and some 303 headband and cookies for your boy berner and corey wilson
-1	such a shame i wasn t born in like 1970 or something so i could have grown up listening to madonna looking at her now is like a trainwreck
-1	stoked to watch kingmannyiv trainwreck on the decks like usual and then watch prodicvl actually dj a good set
-1	agentmuke trainwreck j lt 3 http t co 5dn9lthkux
-1	the1975ftbea this whole week was a trainwreck i literally hate myself help
-1	jgavillena johhhhnnnn
-1	lostpoetb24 i d just rather be in heaven where i don t have to be an emotional wreck than on this earth where i m nothing but a trainwreck
-1	trainwreck okay it s gonna train wreck my mind
-1	there really should be a dumpster fire emoji maybe one for trainwreck too
-1	rt comedyandtruth i want my music so loud that i can t hear my life crashing and burning
-1	jgavillena john i need to message you
-1	rt cepmuluri trainwreck youtube http t co 6s4w6g4lff
-1	i thought i d get used to it by now but nope this new espn com site layout is a trainwreck
-1	rt waneasas youre a trainwreck
-1	rt aveuaskew long distance relationships because everyone in your town knows you re a trainwreck
-1	ethanmay4 haha yes he was a trainwreck jmark russell was a monstrosity and honestly i say bradford is in that category too thus far
-1	what trainwreck spawned that arm http t co whwuaugfly
-1	jkillinger no way i can dispute that trainwreck
-1	their relationship must have been a trainwreck
-1	train wreck elliott yamin http t co 57clpkkgna itunes iphone trainwreck
-1	now playing trainwreck 1979 by death from above 1979 http t co zgpzxcjsqh theedge
-1	that sentence was a trainwreck
-1	introvertpizza i saw paulblart mallcop2 it makes it spat look like citizen kane but it s so lackluster it s not a grownups2 trainwreck
-1	today was just a trainwreck
-1	sizzlerkistler i m interested in the potential mockability of the trainwreck
-1	demi lovato trainwreck
-1	demi lovato trainwreck
-1	demi lovato trainwreck http t co o7szg5ilrj
-1	deathtocardio trainwreck
-1	jaybeemcc i can t wait the whole justice league franchise is going to be a trainwreck unlike anything we ve seen before
-1	cant wait for trainwreck to come out biggest crush on amyschumer lesbianforamyschumer
-1	i wanna watch trainwreck the day it comes out
-1	jesus the leafs trainwreck of a season is just making me an asshole towards every other nhl team
-1	demi lovato trainwreck
-1	demi lovato trainwreck
-1	demi lovato trainwreck
-1	rt ddscouser nata_117 fuckyea same high five waits for inevitable trainwreck
-1	real friends don t let you go in public looking like a trainwreck unless they re doing it with you
-1	nata_117 fuckyea same high five waits for inevitable trainwreck
-1	ravepire or as much of a trainwreck as he is i have a feeling he would be really mad if anyone he cared about impaled themselves and shit
-1	rt profemothflat trainwreck vs blue dream http t co mrzfv7yj9s
-1	oh dear this could either be a trainwreck of full of awesome or both at the same time https t co wkye0habem nightflight
-1	we have some cheerleaders here anjelahjohnson amyschumer powerwomen comedy trainwreck https t co bwnszbdhkp
-1	he just gave me a lil sun sunnnm to get me right trainwreck
-1	school i ve been an emotional trainwreck don t get me wrong there have been tons of laughs and enjoyable moments between you and me
-1	amek kau rim 4 bengkok abes how the hell did i drive this trainwreck of a car repeatedly across the malacca kl highway i cannot fathom
-1	hollablackgirl ugh i am so sorry can i send you pictures of cute otters to distract you from that trainwreck of nasty racism
-1	rt gingbestgolme trainwreck or train wreck http t co 15cm74z8b2
-1	trainwreck yes trippyniggas
-1	omg the reds are a total trainwreck reds
-1	don t miss taking part in the trainwreckcollegetour amyschumer is hilarious talented and wears great shoes thanks ouab trainwreck
-1	so jealous of all the ouababes that got to see amyschumer s trainwreck today miss u undergrad
-1	this post is a trainwreck http t co 9f4nv3qmmm
-1	rt shadahasnolife i have hust been told that aizen from bleachis still fucking alive and i m glad i got out of that trainwreck
-1	i have hust been told that aizen from bleachis still fucking alive and i m glad i got out of that trainwreck
-1	the indians are my new favorite team what a trainwreck the browns are not the funniest team in cleveland
-1	trainwreck is such a great movie amyschumer is so funny thanks ouab for a great event trainwreckcollegetour trainwreck noregrets
-1	tired af
-1	amyschumer is basically my soulmate and i just want to be best friends with her trainwreckcollegetour trainwreckedmovie trainwreck
-1	rt slutprobiems if u can t handle me at my worst then leave because i don t have a best i m literally always a trainwreck
-1	now playing trainwreck 1979 by death from above 1979
-1	rt san_frances amyschumer trainwreckthemovie made us all feel like being a trainwreck is sometimes ok greatmovie
-1	rt aveuaskew long distance relationships because everyone in your town knows you re a trainwreck
-1	amyschumer btw shout out to billhader for his role in trainwreck
-1	dude amyschumer i saw trainwreck half an hour ago and i m still dying hahahahahahahaha
-1	thanks for coming to osu amyschumer we loved trainwreck can t wait to see it again this summer http t co rwbjti2izt
-1	rt san_frances amyschumer trainwreckthemovie made us all feel like being a trainwreck is sometimes ok greatmovie
-1	amyschumer said trainwreck is 40 her life well it s like 90 my life omg so funny could not stop laughing def gonna see it again
-1	nashville music city is doing this trainwreck of the national anthem again blake shelton not available blackhawks nhl nhlplayoffs
-1	i don t want to be a know it all or anything but kevin gausman is a fucking trainwreck as a middle reliever eraofinfinity
