-1	rt largewilliam photo meanwhilebackinthedungeon harry borgman confronting the brides http t co olgl39nw3v
-1	rt jawara318 photo meanwhilebackinthedungeon harry borgman the skull of dracula http t co dg8hmfcaur
-1	photo april 17 2013 dropkick murphys al barr at club nokia in los angeles ca photo by christy borgman http t co spd4ztyprr
-1	rt bsurecruits the bronco blitz is coming to socal this monday look out cali broncoblitz http t co nnhxlflb4b
-1	freakingwesley borgman is equally immersible but it depends are you up for surreal or suspense borgman is the former
-1	freakingwesley http t co 7k6txnni5o is definitely dutch
-1	freakingwesley if not borgman then oculus or the guest or you re next
-1	rt jessicaspicer3 why can t i just say no
-1	2 people followed me automatically checked by http t co ei51gewnq3
-1	sloan_lewis0523 hayden_borgman i m gonna make a come back next wow just sayin
-1	we are so thankful for our instructors cbi instructor harriet borgman is featured in this cadillac news article http t co 2ceogjsppf
-1	a good laugh for a friday for anyone who has teenagers or pre teens thanks to jerry scott and jim borgman http t co fv7cetjyjj
-1	repost cfcolleyville with repostapp meet our member of the month for april ben borgman how https t co yvvogo1a9n
-1	meet our member of the month for april ben borgman how long have you been doing crossfit 6 https t co m4ymvkzwuz
-1	rt nascarcountryus wedding goals http t co nkl591klqo
-1	rt littlemillilo last yr the borgman trailer i cut was generating some buzz a yr on amp it s been nominated for a goldentrailer http
-1	last yr the borgman trailer i cut was generating some buzz a yr on amp it s been nominated for a goldentrailer http t co vbeik8zumr
-1	are feelings just the caboose by brian borgman bible http t co 38kpuxzvvj via christianitycom
-1	photo april 16 2013 gary clark jr at the roxy in west hollywood ca photo by christy borgman http t co aevo5fxo9s
-1	lori borgman the best laid plans of mice and me http t co lmz1fegskj
-1	rt waltdisneyworld the boathouse at wdwdowntown opens today read more about this unique new restaurant http t co rqlflhxp4p http t
-1	the owler community added a new company profile steveborgman available here http t co q0tyyzj3xr
-1	mr borgman is a ass hole
-1	freak_in_nature you can let my bestie know momma borgman is busy in the kitchen today http t co ouavhklran
-1	rt brookelasseter7 why isn t it friday
-1	rt adoption_dp familylife today interviews brian borgman author of after they are yours adoption http t co cp7uvnnl1t
-1	that moment when robert_borgman picks you up and drops you on the gravel
-1	rt kayleylowder help i ve fallen into the feels and i can t get up
-1	rt bsurecruits the bronco blitz is coming soon to socal stay tuned broncoblitz http t co apxgoorwqp
-1	rt ninhtran09 welcome to the jungle http t co lj8ihqn4tw elwinborgman 500px trending urban exploration http t co 0av8qih8rm
-1	welcome to the jungle by elwinborgman http t co gjnvej5fhx http t co hneen7kdom
-1	welcome to the jungle http t co lj8ihqn4tw elwinborgman 500px trending urban exploration http t co 0av8qih8rm
-1	have you seen the amazing window display made by the even more amazing karen borgman we love it http t co fgq3tsidv3
-1	rt mattmeyer123 jcrowell88 tylerlange17 borgman_eric dwill_60 grags11 i like girls who like girls that attracts me
-1	jcrowell88 tylerlange17 borgman_eric dwill_60 grags11 i like girls who like girls that attracts me
-1	mattmeyer123 tylerlange17 borgman_eric dwill_60 grags11 haha must not be doin it right cuz my sisters gay lookin pretty stupid now
-1	jcrowell88 kaylie_rachelle tylerlange17 borgman_eric dwill_60 grags11 funny you say that cause lately my wishes turned to reality
-1	rt mattmeyer123 jcrowell88 kaylie_rachelle tylerlange17 borgman_eric dwill_60 grags11 just turned 22 yesterday brotha or should i
-1	mattmeyer123 kaylie_rachelle tylerlange17 borgman_eric dwill_60 grags11 hahaha your stupid keep wishin brutha
-1	jcrowell88 tylerlange17 mattmeyer123 borgman_eric dwill_60 take a wild guess chubbs lol codyribble
-1	grags11 jcrowell88 tylerlange17 borgman_eric dwill_60 i feel ya
-1	jcrowell88 tylerlange17 mattmeyer123 borgman_eric dwill_60 it s aight matt and chubbs yall both still ugla af lol
-1	jcrowell88 kaylie_rachelle tylerlange17 borgman_eric dwill_60 grags11 just turned 22 yesterday brotha or should i say brotha in law
-1	mattmeyer123 kaylie_rachelle tylerlange17 borgman_eric dwill_60 grags11 you have a girlfriend how old is she hahahahahaha
-1	rt jcrowell88 mattmeyer123 kaylie_rachelle tylerlange17 borgman_eric dwill_60 grags11 hahaha bruh your gonna end up an old and alo
-1	jcrowell88 kaylie_rachelle tylerlange17 borgman_eric dwill_60 grags11 i have a girlfriend bro wtf you ll be the sad soldier
-1	mattmeyer123 kaylie_rachelle tylerlange17 borgman_eric dwill_60 grags11 hahaha bruh your gonna end up an old and alone alcoholic
-1	jcrowell88 kaylie_rachelle tylerlange17 borgman_eric dwill_60 grags11 ha ha piss off
-1	mattmeyer123 kaylie_rachelle tylerlange17 borgman_eric dwill_60 grags11 matt stfu always talkin bout relationships hahaha
-1	rt mattmeyer123 kaylie_rachelle jcrowell88 tylerlange17 borgman_eric dwill_60 grags11 relationship goals af
-1	kaylie_rachelle jcrowell88 tylerlange17 borgman_eric dwill_60 grags11 relationship goals af
-1	jcrowell88 tylerlange17 mattmeyer123 borgman_eric dwill_60 grags11 he s still hot
-1	grags11 tylerlange17 mattmeyer123 borgman_eric dwill_60 hahaha i know that shits funny af
-1	rt grags11 jcrowell88 tylerlange17 mattmeyer123 borgman_eric dwill_60 u stoooopid i m dying rn that s hilarious u da man tyl
-1	jcrowell88 tylerlange17 mattmeyer123 borgman_eric dwill_60 u stoooopid i m dying rn that s hilarious u da man tylerlange17
-1	rt jcrowell88 when you hittin from the back and she calls you daddy tylerlange17 mattmeyer123 borgman_eric dwill_60 grags11 http t
-1	tylerlange17 jcrowell88 borgman_eric dwill_60 grags11 you re stupid
-1	jcrowell88 mattmeyer123 borgman_eric dwill_60 grags11 your stupid
-1	rt jcrowell88 when you hittin from the back and she calls you daddy tylerlange17 mattmeyer123 borgman_eric dwill_60 grags11 http t
-1	rt jcrowell88 when you hittin from the back and she calls you daddy tylerlange17 mattmeyer123 borgman_eric dwill_60 grags11 http t
-1	rt mattmeyer123 jcrowell88 tylerlange17 borgman_eric dwill_60 grags11 this man
-1	jcrowell88 tylerlange17 borgman_eric dwill_60 grags11 this man
-1	rt jcrowell88 when you hittin from the back and she calls you daddy tylerlange17 mattmeyer123 borgman_eric dwill_60 grags11 http t
-1	when you hittin from the back and she calls you daddy tylerlange17 mattmeyer123 borgman_eric dwill_60 grags11 http t co 1x2gvochmg
-1	rt dylangoinyard call her beautiful and take her fishing
-1	rt beccajadeharry robert_borgman i ll let sam_is_rocking know
-1	my top four teachers borgman azurdia baucham and white https t co cwbusvghjz
-1	rt abbywri48742643 note to self don t say deez nuts in class carltoncstephs http t co posqjg8i7e
-1	watching borgman https t co tiw2dfi98z
-1	beccajadeharry sam_is_rocking ight
-1	robert_borgman i ll let sam_is_rocking know
-1	beccajadeharry i m going to marry her
-1	robert_borgman is that you https t co 63p03eyp9i
-1	loving my max http t co 09rijnuqvi
-1	agostoemmanuel you had an amazing teacher i think
-1	honestly homework is the only thing keeping me up past 7 every night
-1	photo april 14 2013 stephen perkins at a drum clinic in culver city ca photo by christy borgman http t co juew6abqwa
-1	cold front movin in http t co 5dlzvhnto5
-1	check out justin borgman at our buckhead location tonight enjoy a delicious meal and some great music http t co apcidm5qnn
-1	birdman borgman the iceman
-1	check out mr william nightshade s review of the horror movie borgman at nightmarish conjurings link in bio http t co wk2hfrw3dt
-1	thejspice yeah i was in the dark
-1	xoxo_ashleyy_ you re
-1	mice lori borgman the best laid plans of mice and me the san luis obispo tribune http t co ocs5rizqth
-1	mcbain volunteer prefers to focus on others 04 14 2015 mcbain at 82 years old harriet borgman doesn t http t co miekjtpwot
-1	watching borgman with caw https t co aw3mfugbnv
-1	borgman is creepy wololo
-1	check out borgman s big data little data no data for sense and less hype http t co esqqyzvsdv
-1	anyone looking for a dematologist dr borgman got my skin on fleekkk 317 926 3739
-1	silver lake sophomore abigail borgman received 1st place at the 2015 nebraska state fbla leadership conference in http t co lcbk0of2qr
-1	photo april 13 2013 lake hollywood in hollywood los angeles ca photo by christy borgman http t co rzpojen4ec
-1	there is nothing care about less than this rt nycjim surveillance video captures hillary clinton buying chicken burrito bowl w guacamole
-1	if rubio or cruz get elected and you need to find me i ll be the one walking straight out into the pacific ocean
-1	rt country_voices sometimes the best dates are the cheapest http t co a6fc2acwhb
-1	rt jstobez the borgman poster seekandspeak amp i worked on was nom d for a golden trailer award this past weekend pretty cool http t c
-1	rt themegamo thoughts and positive vibes go out to jamiecranemauzy her family and friends
-1	rt gretegirl everyone please send out positive vibes to jamiecranemauzy here is a video from when i first got to ski with her http t
-1	data day keynote scitechprof christine borgman data is the new special collections watch live at http t co eydr6dufiz
-1	the borgman damn whattay movie
-1	the borgman poster seekandspeak amp i worked on was nom d for a golden trailer award this past weekend pretty cool http t co roammjlcgb
-1	rt steveborgman 5 intriguing autism dating articles you ll want to read scoopit http t co bznfej8s80
-1	pen and pencil drawing techniques harry borgman paperback new http t co hvzb1c74ft http t co 7ckwykqurh
-1	it s bath time by elwinborgman http t co tbgyykj99l http t co n1iuiwwjlz
-1	it s bath time http t co 5itwxkghzy elwinborgman 500px trending urban exploration http t co apauijdia4
-1	oh borgman how i adore the patiently escalating sinister whimsy of your wtf world
-1	when i was little everyone said i had long legs and i was always afraid of growing up and having mariah carey legs
-1	river road by c f borgman 1989 paperback gay interest plume book http t co medwxokblf http t co wtkdesjt2k
-1	rt tinymocrazy jamiecranemauzy did not wake up today when they took off the meds they need to open her skull put https t co jbmsnepi
-1	rt annasegal my thoughts are going out to jamiecranemauzy who sustained a serious head injury while competing in a slopestyle ski event
-1	i don t use a catchy phrase to promote my tal avern books i d rather let the books samples speak for themselves http t co sasbbajea8
-1	only a few have seen what lies behind the veil that covers our world do you dare to lift it the exiled trilogy http t co sasbbajea8
-1	rt love live music and sushi we ve got em both check out justin borgman at our virginia highland location http t co g6usoxu1g9
-1	love live music and sushi we ve got em both check out justin borgman at our virginia highland location tonight
-1	sean_borgman haha try not to laugh when you browse these selfies http t co vpirtafiec
-1	hillary2016 rt mobute like 50 of taxpayers i am hard working and i have a vagina but my vagina is also a taxpayer creator
-1	anna_borgman thank youuu
-1	parasite choi breakdown tim borgman as his best https t co yqglumgaos
-1	rt lifegoai retweet if u just wish u were at coachella http t co nzn0kzg0hd
-1	my heart for thy cause by brian borgman 2002 hardback http t co jfehioj2qw http t co fgxeqarcmo
-1	edward schillebeeckx a theologian in his history by eric borgman 2006 http t co adoqldpvxs http t co rkwfevvvhw
-1	rt jettjohnson824 dez caught it
-1	cyrussaatsaz haha scandal it s my new favorite show
-1	anna_borgman excuse me
-1	how presidential are my balls now cy shondarhimes
-1	brodyleven in bruge restrepo man on wire fargo snatch good will hunting 180 south i have a lot of free time these days
-1	brodyleven just head to the documentary section or watch anthony bourdain parts unknown
-1	a kiss is a lovely trick designed by nawure to stop speech when words become superfluous ingrid borgman
-1	rt dhumanities_rr a call to action for the humanities by christine l borgman http t co jkg0cgvent
-1	rt dhumanities_rr a call to action for the humanities by christine l borgman http t co jkg0cgvent
-1	lyw funk som agglomereras
-1	rt dhumanities_rr a call to action for the humanities by christine l borgman http t co jkg0cgvent
-1	bj_borgman tack
-1	rt dhumanities_rr a call to action for the humanities by christine l borgman http t co jkg0cgvent
-1	a call to action for the humanities by christine l borgman http t co jkg0cgvent
-1	the biggest surprise with zlatangate is that someone in france understood english zlatan shitcountry psg
-1	i can t breathe rt guyingreenwwe lana https t co gibquj0rkt if u learned anything tonight it s this from bob costas
-1	busted sketchbook 6 a zits collection by jerry scott and jim borgman http t co stpt0aztwh http t co 9jujimt4ai
-1	transcendence amp omnipotence of god by dr d a carson r c sproul dr dilday jonathanedwards charlesspurgeon http t co pvmljwsihe
-1	how about instead of charging me 50 to go to my 10 year high school reunion they give me 50 and i don t go hmm
-1	rt jumpcutcreative congrats to drafthousefilms amp seekandspeak for a goldentrailer nom for the borgman poster http t co sxzpudebri
-1	rt jumpcutcreative congrats to drafthousefilms amp seekandspeak for a goldentrailer nom for the borgman poster http t co sxzpudebri
-1	congrats to drafthousefilms amp seekandspeak for a goldentrailer nom for the borgman poster http t co sxzpudebri http t co xddgxltcwe
-1	congrats to drafthousefilms amp seekandspeak for a goldentrailer nom for the borgman poster http t co 5wghby8fng http t co rcytfw9prk
-1	thank you goldentrailer for my first 2 award nominations for drafthousefilms borgman amp vertigofilms monstersdarkcontinent overthemoon
-1	rt nochillposts im so weak http t co 8rsfgxuzr8
-1	rt carolinegym99 it s mr kulle s last day i m so sad i could cry
-1	borgman my mom played professional basketball me what team borgman a team called the all american redheads
-1	rt adelinekoh tanyaclement citing christine borgman s article digitalhumanists not trained in social science research http t co c66
-1	tanyaclement citing christine borgman s article digitalhumanists not trained in social science research http t co c66sid8zcx txdhc15
-1	i was a better mother before i had kids 1999 by borgman lori 0671027220 http t co uyw6fwofs6 http t co kboyusc9nb
-1	i was a better mother before i had kids 1999 by borgman lori 0671027220 http t co nhbb7vc3av http t co mhorfqmnyb
-1	my love for tig notaro knows no bounds http t co q5d5seqyie
-1	borgman was really fucking weird
-1	wow i actually finished that project
-1	rt footballscoop yup everyone will appreciate this video very well done https t co mrdt44krpa
-1	rt zach_barnett boise state s true blue video is a model for every program http t co s4op1atfqn
