-1	every secret thing trailer from a producer of foxcatcher starring diane lane elizabeth banks dakota http t co unpgtbakxk
-1	best movie in the last few months still has to be birdman next up is foxcatcher for which i have high hopes
-1	every secret thing trailer every secret thing trailer from a producer of foxcatcher starring diane lane e http t co 5dkrin4wsl
-1	rt highpost15 read regan guzik s article on foxcatcher and how coach tad harbert was involved http t co tas73xo6nq
-1	hot in the archive foxcatcher releases two new stills for carell tatum vehicle http t co c85goej8fw
-1	516 top 5 discoveries of 2014 foxcatcher tale of princess kaguya
-1	rt xyladumojuhe 516 top 5 discoveries of 2014 foxcatcher tale of princess kaguya
-1	went and saw foxcatcher today what a god awful film
-1	robdaveperry er is that dupont as in foxcatcher
-1	foxcatcher was not what i expected when i saw the trailer i thought it was a story about us olympi http t co 4qumsjixc5
-1	i think i m gonna watch foxcatcher tonight
-1	i m watching foxcatcher and the only thing i m taking away from it is that i want some ramen noodles
-1	joseph_salomone i think the pace rocky dialogue are making them think it s worse than it actually was like stuckmann s foxcatcher review
-1	foxcatcher full movie play now http t co b0hpfxyfsu more movie http t co lzobskkm4l click the link
-1	united states 35 foxcatcher bennett miller http t co l82qucfpkt movies itunes iphone apple
-1	my opinion of mark ruffalo as an actor has drastically changed after watching foxcatcher
-1	nw foxcatcher coz tatum
-1	mark schultz on how his brother s murder was turned into foxcatcher http t co zuotvv2cze via mailonline
-1	i added a video to a youtube playlist http t co d3l7hb9yu9 foxcatcher official trailer 1 2014 channing tatum steve carell
-1	see the film foxcatcher tonight at 6 30 p m wednesday apr 15 in meeting room a b free your snacks and http t co 8mxal6at2i
-1	foxcatcher is messing with my head right now creepy
-1	adamrubins yeah probably better on a bigger screen tbh go with foxcatcher then
-1	screenjabber not foxcatcher
-1	watching foxcatcher https t co odgoyypmaw
-1	which planefilm theory of everything selma exodus inherent vice horrible bosses 2 wild foxcatcher fury tough choice need two
-1	i new carell and ruffalo would deliver and now i have a newfound admiration and respect for channing tatum foxcatcher brilliantacting
-1	integraibirth tatum com o foxcatcher mcconaughey com o dallas buyer club etc
-1	books magazine time taylorswift keith haring channing tatum foxcatcher fergie zooey deschanel http t co qzerhfjl7t book bestseller
-1	eva longoria at foxcatcher premiere the 67th annual cannes film festival http t co drq69qleir
-1	foxcatcher full movie watch online free 2014 movies http t co gnbhnkxrwa http t co 4hw7vubxy1
-1	foxcatcher dvd 2015 steve carell channing tatum bennett miller http t co e6ngdduxqd sports
-1	man i watched that movie foxcatcher lastnight too intense but the acting is phenomenol by channing tatum steve carrell and mark ruffallo
-1	free films today the imitation game in eastgranby foxcatcher in colchester http t co mkjfdzehnu http t co kc6xpktwpu
-1	watching foxcatcher love holidays where i have no jobs to do
-1	watching foxcatcher at skya7x https t co kjf7pvudi0
-1	rt qasupupezulo 516 top 5 discoveries of 2014 foxcatcher tale of princess kaguya
-1	rt phillips watched foxcatcher on the flight and wow more than i thought it would be great movie
-1	did not even recognise stevecarell in foxcatcher watching it now it s excruciatingly painfully cringey brilliance
-1	foxcatcher http t co frksz8rpxd via mamiemissivory
-1	as iran are the world champions of wrestling and after that brilliant film foxcatcher i may take an interest in wrestling
-1	guardando foxcatcher
-1	foxcatcher http t co frksz8j0pb
-1	foxcatcher https t co rlbyjmpoei
-1	movie review foxcatcher 2014 http t co jlth8ch6hx grandshuckett
-1	foxcatcher was the worst movie ever produced stick to a comedy role that was garbage i want my money back stevecarell
-1	rt bharhydnegi true story of foxcatcher http t co 3qzynbn0gq
-1	516 top 5 discoveries of 2014 foxcatcher tale of princess kaguya
-1	foxcatcher full movie watch online free 2014 movies http t co oakslwcq4f
-1	review foxcatcher http t co lxmk98rion
-1	nw foxcatcher
-1	5wordmoneyproblems i muniplate people with wealth foxcatcher http t co q4c8hgpewp
-1	foxcatcher la claque absolue
-1	i only have to watch 6 hours of the office to cleanse those horrific images from my brain yay foxcatcher
-1	review foxcatcher http t co ka2q7cn77l via wordpressdotcom have just started a my own blog check out and have fun
-1	markruffalo is under rated foxcatcher begin again avengers the normal heart zodiac awardsnub whereisthelove keepacting fan
-1	foxcatcher is a comedy right
-1	this week in blu ray dvd releases foxcatcher mockingjay part http t co hehcatnbrt
-1	someone just insulted somehow my foxcatcher review had spoilers to him he then followed me he s also a bible thumper what a night
-1	steve carrell s performance in foxcatcher is bizarre not exactly in a good way
-1	rampaigerrob hey fuck you learn to use spoiler alerts in your reviews you ruined foxcatcher for me asshole
-1	foxcatcher is creepy af wtf is this movie
-1	the movie foxcatcher is one of the best movies i ve ever seen
-1	pensbeergeek also cue up the foxcatcher recreation of that one ufc bout note i have not watched that movie lol
-1	foxcatcher full movie https t co rl8dwf1c6x
-1	foxcatcher full movie https t co vgyeh8nvo2
-1	foxcatcher full movie https t co ibwbma1huq
-1	spinooti did you see foxcatcher he s real good in that movie too
-1	the mannerisms and posture of ruffalo and tatum in foxcatcher should have won all the oscars very ape like teamfoxcatcher
-1	optic_mboze optic_scumper i got a good one its foxcatcher i like it cause i m a wrestler but you will like it to either way it s based off
-1	foxcatcher 2014 full movie http t co i6exe64qnv
-1	foxcatcher most messed up and weird story ever
-1	profession that wears tights hmmm maybe wrestler markruffalo foxcatcher come on
-1	markruffalo watched foxcatcher last night a painful film to watch but in a good way if that makes sense
-1	i added a video to a youtube playlist http t co klhjevjazw foxcatcher movie clip psychological issues 2014 steve carell
-1	foxcatcher is serious
-1	markruffalo iamdoncheadle watched foxcatcher today pretty heartbreaking dave shultz seemed like the nicest guy
-1	nw foxcatcher
-1	rt andyrennecke he just saw foxcatcher http t co 2sdzrio5ae
-1	he just saw foxcatcher http t co 2sdzrio5ae
-1	foxcatcher is an amazing movie
-1	foxcatcher the imitation game and million dollar arm it s been a good 3 nights
-1	rt dasufokujoma 516 top 5 discoveries of 2014 foxcatcher tale of princess kaguya
-1	three oscar worthy performances in foxcatcher http t co t4jr0wcpa6
-1	a coach is the father a coach is a mentor a coach has great power on athlete s life from http t co hegrjqaoxs
-1	foxcatcher 2014 imdb getting ready to watch on video heard carrell is amazing http t co tgnrq6dw7j
-1	ganim_sara sara did u see cnn article foxcatcher by ann o neil interesting tie in to the sandusky affair via legal team homosex too
-1	watching foxcatcher wrestling
-1	really wanna watch foxcatcher too
-1	rt phillips watched foxcatcher on the flight and wow more than i thought it would be great movie
-1	movies2014 checking out foxcatcher starring stevecarell playing delusionaljohnedupont
-1	steve carrell foxcatcher and vincent d onofrio daredevil must have gone to the same speak haltingly school of annoying acting
-1	rt sojiwohumace 516 top 5 discoveries of 2014 foxcatcher tale of princess kaguya
-1	foxcatcher
-1	foxcatcher is emotionally icy and thus hard to love but it is still compellingly cold perfectly performed and affectingly ambiguous
-1	rt phillips watched foxcatcher on the flight and wow more than i thought it would be great movie
-1	rt shamlatrice34 new review up foxcatcher 2014 dark infectious brilliant http t co lkckt5ns8j via wtsfilms
-1	what it sold for megan ellison assembling a new compound on mt olympus foxcatcher american hustle her producer http t co ojr1a0zgme
-1	is it weird that just thinking about some of the scenes from foxcatcher make me chuckle especially the scenes with carrell
-1	torresfran markruffalo did you watch foxcatcher amazing performances
-1	rt phillips watched foxcatcher on the flight and wow more than i thought it would be great movie
-1	12 1 dying to see boyhood american sniper foxcatcher birdman the theory of everything hope i make it to em all only as left not bad
-1	can t believe i still haven t watched foxcatcher
-1	foxcatcher is a proper weird film
-1	in foxcatcher channing tatum did his best potato impression amc158 a_holcombe
-1	foxcatcher review http t co j7xjmdhwez
-1	kelly_baker18 anybody else watching foxcatcher 2014 at http t co maiv6ho1yl movie film streaming http t co shrpidioeb
-1	ejmiller25 sorry i dont just go with the consensus foxcatcher sucked
-1	rt wsimon626 gfoty live now watching foxcatcher 2014 at http t co 0wlfzr49qc movie film streaming http t co aeh8hveken
-1	it s oscar season in the williams household about to watch foxcatcher for the first time michaelscott
-1	rt phillips watched foxcatcher on the flight and wow more than i thought it would be great movie
-1	movies dvd foxcatcher dvd 2015 includes digital copy ultraviolet http t co 0uotygmlhb hot sale http t co xglutzdjdd
-1	rt phillips watched foxcatcher on the flight and wow more than i thought it would be great movie
-1	rt markruffalo foxcatcher is now available to own join me in a q amp a w itunes in support of its release https t co y7qrmvt7of http
-1	why would anyone pay good money to see steve carrell play someone so incredibly unpleasant to look at see or hear foxcatcher
-1	proteusxl this the best one movie foxcatcher 2014 at http t co ln8sdr33lp movie film streaming
-1	chris_hov biggest revelation on rewatching foxcatcher 2014 at http t co yd0ve5yxru movie film streaming http t co vdndtz8zd2
-1	sitemize dvd blu ray hunger video games mockingjay to be had friday foxcatcher out now konusu eklenmistir http t co b4vbefpfme
-1	news haberler dvd blu ray hunger video games mockingjay to be had friday foxcatcher http t co b4vbefpfme http t co 4eatzb8tx8
-1	stevecarell you transformed yourself in foxcatcher brother so great to see as a new actor visceral and intense thank you for that
-1	theshrillest have you seen foxcatcher it s like brooks thinks we re all john du pont levels of cozy with cops
-1	rt phillips watched foxcatcher on the flight and wow more than i thought it would be great movie
-1	jimnorton just saw mark schultz s review of foxcatcher john eagle dupont is the jerk of all jerks
-1	ver mira peliculas hd online gratis peliculas891 foxcatcher 2014 http t co qopzu3ku9w
-1	markruffalo how did you not guess wrestler for a profession that wears tights foxcatcher jimmykimmellive jimmykimmel avengersonkimmel
-1	whiplash foxcatcher her yvessaintlaurent at blockbustermx in tampico tamps https t co zj1mufkpak
-1	ryanlcooper tressiemcphd you clearly haven t seen foxcatcher
-1	rt phillips watched foxcatcher on the flight and wow more than i thought it would be great movie
-1	foxcatcher is a fantastic movie
-1	foxcatcher soundtrack arvo part fur alina https t co ltbjtijipl
-1	rt phillips watched foxcatcher on the flight and wow more than i thought it would be great movie
-1	rt phillips watched foxcatcher on the flight and wow more than i thought it would be great movie
-1	let me watch foxcatcher hope it lives up to the hype
-1	is foxcatcher a good movie does michael scott catch a lot of foxes thinking about watching it tonight
-1	marriagevelcro just finished watching foxcatcher 2014 at http t co 7zviqodqer movie film streaming
-1	caught up on a lot of great movies lately zodiac whiplash wild bunch foxcatcher can t wait to see the new mad max
-1	finally seeing foxcatcher
-1	ok now i m watching foxcatcher bc steve carell is bae
-1	yahoomovies foxcatcher
-1	rt phillips watched foxcatcher on the flight and wow more than i thought it would be great movie
-1	rt phillips watched foxcatcher on the flight and wow more than i thought it would be great movie
-1	rt phillips watched foxcatcher on the flight and wow more than i thought it would be great movie
-1	rt phillips watched foxcatcher on the flight and wow more than i thought it would be great movie
-1	rt phillips watched foxcatcher on the flight and wow more than i thought it would be great movie
-1	rt phillips watched foxcatcher on the flight and wow more than i thought it would be great movie
-1	rt phillips watched foxcatcher on the flight and wow more than i thought it would be great movie
-1	rt phillips watched foxcatcher on the flight and wow more than i thought it would be great movie
-1	rt phillips watched foxcatcher on the flight and wow more than i thought it would be great movie
-1	rt phillips watched foxcatcher on the flight and wow more than i thought it would be great movie
-1	sooo foxcatcher was extremely disturbing
-1	rt phillips watched foxcatcher on the flight and wow more than i thought it would be great movie
-1	rt phillips watched foxcatcher on the flight and wow more than i thought it would be great movie
-1	rt phillips watched foxcatcher on the flight and wow more than i thought it would be great movie
-1	rt phillips watched foxcatcher on the flight and wow more than i thought it would be great movie
-1	rt phillips watched foxcatcher on the flight and wow more than i thought it would be great movie
-1	rt phillips watched foxcatcher on the flight and wow more than i thought it would be great movie
-1	rt phillips watched foxcatcher on the flight and wow more than i thought it would be great movie
-1	rt phillips watched foxcatcher on the flight and wow more than i thought it would be great movie
-1	watched foxcatcher on the flight and wow more than i thought it would be great movie
-1	foxcatcher was amazing
-1	kateplusmy8 love watching these foxcatcher 2014 at http t co rzrwvfi6bd movie film streaming http t co qnugosijk9
-1	loud lady in cafe is spoiling the whole plot of foxcatcher shut up shut up shut up some of us haven t seen it yet spoileralert
-1	foxcatcher full movie watch now http t co teb1509cxh http t co 3q2llye2b0
-1	united states 30 foxcatcher bennett miller http t co l82qucxqjt movies itunes iphone apple
-1	melreinischh kyle_kh_trimble the foxcatcher is a phenomenal film
-1	rt tifezohacugi 516 top 5 discoveries of 2014 foxcatcher tale of princess kaguya
-1	watching foxcatcher https t co 1wne3mnwjw
-1	foxcatcher blu ray http t co e8tl7xtpgr http t co dyhiqofpac
-1	you ve probably taken one of those quizzes that lets you find out the nature of your spirit animal if so you http t co xf9fdtjelz
-1	foxcatcher https t co dzfbppvbq5
-1	http t co gtegvwqutb deals movies dvd bluray foxcatcher used dvd
-1	watching foxcatcher https t co 9fmenotaar
-1	rt the_millions you may know what your spirit animal is but what s your poet animal http t co vcaoe7fj6g
-1	rt the_millions you may know what your spirit animal is but what s your poet animal http t co vcaoe7fj6g
-1	nick_j_franklin cheesey_fries dude in 22 he was hella funny and foxcatcher he was pretty good
-1	516 top 5 discoveries of 2014 foxcatcher tale of princess kaguya
-1	rt the_millions you may know what your spirit animal is but what s your poet animal http t co vcaoe7fj6g
-1	rt the_millions you may know what your spirit animal is but what s your poet animal http t co vcaoe7fj6g
-1	rt the_millions you may know what your spirit animal is but what s your poet animal http t co vcaoe7fj6g
-1	rt the_millions you may know what your spirit animal is but what s your poet animal http t co vcaoe7fj6g
-1	you may know what your spirit animal is but what s your poet animal http t co vcaoe7fj6g
-1	foxcatcher you ve probably taken one of those quizzes that lets you find out the nature of your spirit animal http t co ldzxlmxsld
-1	listener dave jones says our foxcatcher review broke down pretty much every angle of the film i was thinking about http t co vihse6hovm
-1	today i m dressed like channing tatum in foxcatcher
-1	fred s impression of john henry sounds eerily similar to steve carell in foxcatcher toucherandrich http t co ubdd9nf72t
-1	couchpotato found 3 releases for foxcatcher before eta select and download via the dashboard
-1	review foxcatcher my review the reason i read foxcatcher is because of http t co sqh6qrflnj
-1	supertinytimo omg so many great films to watch whiplash the judge gone girl foxcatcher my coach journeys next week will be fun
-1	foxcatcher titulo original foxcatcher director bennett miller reparto channing tatum steve carell mark http t co c1k7k3tgha
-1	foxcatcher gives me the willies what a dark strange movie
-1	chason711 the greatest movie ever made foxcatcher 2014 at http t co iikb8fatej movie film streaming http t co dphysqri86
-1	true story of foxcatcher http t co 3qzynbn0gq
-1	rt cinephileactus foxcatcher avec steve carell et channing tatum annonc en blu ray en france http t co sxotk5qdhl blu ray
-1	rt cinephileactus foxcatcher avec steve carell et channing tatum annonc en blu ray en france http t co sxotk5qdhl blu ray
-1	foxcatcher avec steve carell et channing tatum annonc en blu ray en france http t co 0lc4zsw8j3
-1	if you like movies that leave you wondering when something is actually going to happen the entire film check out foxcatcher
-1	http t co 9oe2yj0dne foxcatcher http t co zrziqgy0hf carell channing drama foxcatcher official steve tatum trailer
-1	516 top 5 discoveries of 2014 foxcatcher tale of princess kaguya
-1	foxcatcher
-1	kevinkarlson if you hated foxcatcher that much save yourself a future 6 by not renting birdman best picture oscar winner but terrible
-1	rt qasupupezulo 516 top 5 discoveries of 2014 foxcatcher tale of princess kaguya
-1	qq i rly wanna watch foxcatcher tho
-1	rt dasufokujoma 516 top 5 discoveries of 2014 foxcatcher tale of princess kaguya
-1	foxcatcher was really good
-1	rt onitsukatigerus check out channing tatum in a pair of mexico 66 s in the movie foxcatcher photo courtesy of annapurna pictures http
-1	foxcatcher was crazy
-1	channing tatum looked like randy orton in foxcatcher justsaying
-1	wth did i just watch foxcatcher got me messed up
-1	just got around to seeing foxcatcher carell and tatum ascend above themselves in their roles very disturbing film watch on a rainy day
-1	watching foxcatcher https t co cfht7ujcmg
-1	news haberler dvd blu ray releases march starts out with foxcatcher and mockingjay http t co 10nuinr4dd http t co 4eatzb8tx8
-1	so on saturday i rented foxcatcher and didn t finish it b c of how boring it was then i forgot to return it on sunday worst 4 ever spent
-1	catherine and i just watched a really weird movie foxcatcher not sure either of us liked it very dark
-1	which character in foxcatcher are you https t co pcip6szabf
-1	i loved foxcatcher i just didn t understand it overmyhead deepermeaning ornaw
-1	marist red foxcatcher collegemovies midnight
-1	birdman and foxcatcher were both great if you like to watch a privileged misogynist having a midlife crisis
-1	watching foxcatcher https t co rv49pgkwes
-1	channingtatum foxcatcher was excellent you all were so good
-1	foxcatcher sucked
-1	why the fuck is channing tatum s jaw like that in foxcatcher lol
-1	omg this movie is so strange and weird it s as painful as foxcatcher
-1	that scene in foxcatcher when he asks them to call him golden eagle same
-1	is foxcatcher good or
-1	the trailers that play before a movie really can give you an idea of what you are getting into i m worried about foxcatcher
-1	rt mattlikesmovies true story slow foxcatcher prisoners pace but equally as captivating amazing characters cinematography amp directio
-1	true story slow foxcatcher prisoners pace but equally as captivating amazing characters cinematography amp direction 4 5 5
-1	foxcatcher 2 should depict the birdman amp lil wayne relationship
-1	stevecarell in foxcatcher is creepy as fuck
-1	i m watching foxcatcher 2015 https t co pnb4ppv6bu trakt
-1	steve carell makes me uncomfortable in foxcatcher
-1	bleeding edge film review foxcatcher is stupid
-1	foxcatcher http t co ljlnyxispi
-1	the foxcatcher a good ass movie
-1	also the way critics described steve carell in foxcatcher is how i think of vincent d onofrio in daredevil but way more deserved
-1	just popped in foxcatcher i hope it doesn t disappoint
-1	i just found out a guy i dated in college mark schultz was played by tatum channing in foxcatcher he was an olympic wrestler in college
-1	watch video steve carell gets creepy enough to win an oscar http t co mbvwqtsxye
-1	foxcatcher blu ray 2015 steve carell channing tatum bennett miller http t co jki9tybvzw sports
-1	516 top 5 discoveries of 2014 foxcatcher tale of princess kaguya
-1	foxcatcher is fucking weird so far well shot though
-1	rt travclark2 foxcatcher a tragic movie about mental illness was nom d for best shirtless perf at the mtv awards more reason to not ca
-1	foxcatcher a tragic movie about mental illness was nom d for best shirtless perf at the mtv awards more reason to not care about them
-1	just watched foxcatcher for the first time i never thought i d say i loved a steve carell movie wow still blow away by the flick
-1	foxcatcher is a desperately awkward movie like i know it s meant to be amazing or whatever but it s weird
-1	foxcatcher full movie play now http t co b0hpfxyfsu more movie http t co lzobskkm4l click the link
-1	sadly i had to give intersellar and foxcatcher a thumbs down interstellar was pointless and foxcatcher just dragged
-1	516 top 5 discoveries of 2014 foxcatcher tale of princess kaguya
-1	foxcatcher review http t co e8wntexp7x via wordpressdotcom
-1	rt twc stevecarell amp channingtatum star in foxcatcher the haunting story of wrestler mark schultz watch it on demand http t co x
-1	this foxcatcher movie is weird
-1	i can t stop telling everybody how much i love markruffalo and i can t stop pronounce foxcatcher word foxcatcher foxcatcher foxcatcher
-1	619sports haven t seen foxcatcher yet is it any good
-1	stevecarell amp channingtatum star in foxcatcher the haunting story of wrestler mark schultz watch it on demand http t co xjx1bduphd
-1	i love channing tatum i honestly do he was hilarious in jump street movies amp good in foxcatcher but i want more mattbomer in magicmikexxl
-1	american sniper the drop eller foxcatcher
-1	justin_klugh having just seen foxcatcher this reminds me of john du point hobnobbing with cops on his pa estate taking target practice
-1	markruffalo avengers what about the foxcatcher didn t see much promo for that looks interesting and unlike any of your other rolls
-1	foxcatcher pissed me off even more the second time
-1	foxcatcher and the hound unpopularanimatedmovies
-1	rt sonyclassics currently considering amyschumer for foxcatcher 2 http t co dpt06s6c62
-1	currently considering amyschumer for foxcatcher 2 http t co dpt06s6c62
-1	join us wednesday at the movies for foxcatcher starring steve carell in his oscar nominated role 4 15 1 p m
-1	united states 25 foxcatcher bennett miller http t co l82qucfpkt movies itunes iphone apple
-1	check http t co dstg9izydk channingtatum stevecarell
-1	rt waxaxutogude 516 top 5 discoveries of 2014 foxcatcher tale of princess kaguya
-1	hungryghoast gavinsaywhat john dupont did similar shit if foxcatcher is to be believed
-1	my favourite movies of 2015 uk release so far whiplash foxcatcher john wick big hero 6 and ex machina
-1	salardaapolinar watch foxcatcher 2014 at http t co rzkfuxqckh movie film streaming
-1	watching foxcatcher https t co sg5h9tt2e1
-1	nw foxcatcher
-1	john_doe_snow you definitely get points for including foxcatcher
-1	the disturbing true story behind foxcatcher http t co f2f98cxnld
-1	for the record i think people talked foxcatcher up way too much it was extremely mediocre
-1	so i watched foxcatcher and i lost 2hrs of my life i ll never get back
-1	you should watch foxcatcher wnterlscomlng
-1	i m going to be honest the best thing about the movie foxcatcher is that schultz is said about a billion times
-1	new dvds foxcatcher inward ultimately sad story of obsession and neglect superb acting by carell and ruffalo
-1	watching foxcatcher https t co jxxa08ixny
-1	rt burendasan to those who wonder if this could be real john e dupont the subject of foxcatcher also did this https t co wwwzy88ipv
-1	to those who wonder if this could be real john e dupont the subject of foxcatcher also did this https t co wwwzy88ipv
-1	channingtatum just finished foxcatcher had to praise your performance man your line what did i just say to markruffalo was epic
-1	jodiebee8 mood after watching foxcatcher 2014 at http t co fbfjeqhxds movie film streaming http t co wxdfyxplkj
-1	news haberler dvd tuesday powerful oscar nominee foxcatcher plus 3rd hunger games http t co ivupg0wx9r http t co 4eatzb8tx8
-1	stevecarell hey just want to say that i really loved your captivating performance in foxcatcher absolutely brilliant
-1	finished reading foxcatcher dave schultz seemed like such a nice guy a shame nothing was done sooner about the clearly insane dupont
-1	lmao foxcatcher auditions
-1	kubrick would have loved foxcatcher this moving and hypnotizing movie is easily on my 2014 top 3 list next boyhood
-1	poughkeepsie journallist who won mtv movie awards poughkeepsie journalchanning tatum foxcatcher magic mike xxl ac channingtatum
-1	the real john du pont foxcatcher http t co mjrqjjk6ak
-1	news haberler the week in advance the hunger video games mockingjay phase 1 http t co w1smcvh7t0 http t co 4eatzb8tx8
-1	now i wanna see foxcatcher
-1	holy shit that ending came out of no where foxcatcher
-1	rt mattdentler you know what 12 year olds love foxcatcher jokes mtvmovieawards
-1	foxcatcher feel sad for steve carell et al since even the boy a millennial stated he thot many folks didnt have iq to comprehend story
