-1	516 top 5 discoveries of 2014 foxcatcher tale of princess kaguya
-1	foxcatcher birdman john wick and the drop were some of the worst movies of 2014
-1	mosesmosesmoses no thank you foxcatcher is giving me a creepy enough vibe
-1	rt moviereviewsinc on movies john du pont in foxcatcher wrestling tragedy johndupont olympic gold medalist dave schultz daveschultz
-1	finally saw foxcatcher definitely one of the slowest moving and most depressing films i ve seen but amazing performances all around
-1	i rated foxcatcher 2014 7 10 imdb http t co axj5ki7r5z
-1	foxcatcher was good but kinda weird how they didn t catch any foxes it was all about wrestling thought they would ve caught at least one
-1	on movies john du pont in foxcatcher wrestling tragedy johndupont olympic gold medalist dave schultz daveschultz http t co lv1omliv0s
-1	a look at amp quot foxcatcher amp quot summerolympics http t co gyjhnde8cw
-1	a look at amp quot foxcatcher amp quot summerolympics http t co fitpb6eaht
-1	markruffalo can t wait till avengersageofultron foxcatcher was amazing
-1	this foxcatcher movie was interesting
-1	rt thebigfish79 foxcatcher definitely pissed me off
-1	foxcatcher definitely pissed me off
-1	rt lukerussert watched foxcatcher tonight overrated most impressive part of the film was mark ruffalo s gait
-1	jordan went to bed now i m drunk watching foxcatcher alone wondering when steve carell is going to take his nose off http t co aghwol848m
-1	well foxcatcher was a pretty good movie steve carrell officially scares me now though
-1	watching foxcatcher there s a crazy amount of slapping in this movie
-1	watching foxcatcher the acting is phenomenal and the story draws you in
-1	foxcatcher was not at all what i thought it would be
-1	foxcatcher
-1	foxcatcher was a good movie but what a depressing ending
-1	foxcatcher
-1	watching foxcatcher with ezra https t co 5ycrxxezqa
-1	so wanna watch foxcatcher again so much enjoyment in a psychologically gripping film
-1	markruffalo phenomenal job in foxcatcher i grew up in pa and wrestled you nailed it
-1	jiggamandre foxcatcher
-1	watching foxcatcher right now happy to see hollywood still willing to make big budget dramas that are over 2 hrs long hopeflosts
-1	foxcatcher http t co o6bmpvwsfy
-1	rt lukerussert watched foxcatcher tonight overrated most impressive part of the film was mark ruffalo s gait
-1	lukerussert what is the foxcatcher
-1	watched foxcatcher tonight overrated most impressive part of the film was mark ruffalo s gait
-1	foxcatcher gave me a new respect for channingtatum and thr s roundtable interview showed how humble he is respect ct
-1	jiggamandre home furious 7 foxcatcher
-1	finally saw foxcatcher today well worth the wait
-1	antonydelrio_ still got some foxcatcher birdman fury and whiplash are all good
-1	tonight s movie lineup foxcatcher whiplash wishiwashere prisoners 7 4 hours
-1	foxcatcher was definitely one of the worst movies i have ever seen wasteoftime
-1	this is because i m watching foxcatcher and trying to figure out whether channing tatum would be a good superman
-1	movie night at diaz residence foxcatcher channingtatum stevecarell markruffalo
-1	foxcatcher 2014 http t co kesy4gclcu
-1	rt _ryangosling amy pascal just saw foxcatcher channing tatum i hope it was good omg
-1	foxcatcher is a really good movie except for all of the goddamn man thighs
-1	amy pascal just saw foxcatcher channing tatum i hope it was good omg
-1	i ve been watching foxcatcher now for about 5 hours because i keep pausing it i just can t get into it foxcatcher
-1	i enjoyed foxcatcher more than birdman i believe hate me i m okay with it
-1	sardonicartery foxcatcher kind of stuff yep
-1	watching foxcatcher again bc idk
-1	finally watching foxcatcher
-1	i just realized 99 of why i didn t like foxcatcher was mark ruffalo s beard take that out and i liked it d
-1	i m watching foxcatcher cya
-1	watching foxcatcher
-1	it s time to watch foxcatcher
-1	so foxcatcher 7 10
-1	1 hour into foxcatcher super bored
-1	foxcatcher
-1	foxcatcher
-1	darkodalmata da grand budapest hotel la teoria del tutto imitation game the search latin lover still alice osage county foxcatcher
-1	foxcatcher rt5i full movie 2014 youtube http t co pe6tsrtbpx
-1	steve carell should play penguin in the next batman movie after seeing him in foxcatcher
-1	shahishtiaque i don t blame you man it s a great film i raved about foxcatcher for so long channing tatum was great in a serious role
-1	crazy to think how beautiful its outside and i will be taking roxy for a walk and start raking amp watching foxcatcher and getting some sleep
-1	kky_kuroky clementinator rich guy pays you money with little strings attached to be a professional athlete you know foxcatcher _
-1	rt authorhenshaw quote don t call me mr du pont we re friends now my friends call me eagle or golden eagle foxcatcher
-1	nw foxcatcher
-1	rt gyzuxusefyv 516 top 5 discoveries of 2014 foxcatcher tale of princess kaguya
-1	trailer foxcatcher http t co lohyk89aux
-1	foxcatcher
-1	movies i plan on watching this weekend hellboy2 foxcatcher thehobbit2 crank hotfuzz robocop i have a busy weekend lol
-1	_keator tainoeric foxcatcher is good one
-1	insessionfilm 90210blaze nototally thatmomentin awfulpodcast cinemajaw 1sttimewatchers no worries i gave your foxcatcher ep a plug
-1	how do you guys feel about these movies for thursdays and so it goes what if foxcatcher based on a true story hit by lightning
-1	foxcatcher is a must watch movie
-1	pit_master when you saw the movie foxcatcher do you cheer for dupont up until he commits murder
-1	1941 foxcatcher national cup winner corrigan jockey w s jones press photo http t co zpcsbvcpgm http t co zti7ibudo5
-1	a deceptive title a misleading poster a mesmerizing film foxcatcher awed by lead performances blown by stevecarell s portrayal
-1	i m an hour into foxcatcher and i m bored out of my mind
-1	foxcatcher
-1	just posted my foxcatcher poster on posterspy http t co ejbp3lvorl http t co awex3fechu
-1	1937 foxcatcher national cup steeplechase won by soldiers fate press photo http t co rb1cbra4yv http t co v7sadsdxjj
-1	via lathotproperty foxcatcher star channing tatum pins down another piece of real estate http t co wlylo5ouyj
-1	enjoy watching movies like foxcatcher story line runs soo deep you end up being immersed and in tune with the characters emotions
-1	steve carell marwencol foxcatcher star joins zemeckis next http t co akjvyaeavp via newsrepublicuk
-1	rt gicylimogeze 516 top 5 discoveries of 2014 foxcatcher tale of princess kaguya
-1	new post about sienna miller imsiennamiller in foxcatcher http t co mk76t0hpfe fashionbloggers fashion movie http t co ixqvf9bqii
-1	couchpotato found 5 releases for foxcatcher before eta select and download via the dashboard
-1	at this rate i ll have the opportunity to see star wars tfa and batman vs superman before i do foxcatcher
-1	sienna miller foxcatcher http t co 0fwsu9ysul
-1	foxcatcher is such a good but mind blowing movie
-1	watching foxcatcher
-1	rt tj_lovato foxcatcher was the worst movie ever produced stick to a comedy role that was garbage i want my money back stevecarell
-1	rt studentevents scpabatud s weekend movie is foxcatcher playing at 8p on fri amp sat 3 tix at trabant box office udel
-1	what s wrong with the world friday night foxcatcher and only 16 tickets sold i m losing faith in humanity http t co p3spggagx6
-1	did you know that foxcatcher takes place in delaware come check out the movie that showcases our small wonder state tonight 8pm
-1	john has graciously allowed our cameras into his home based on true events foxcatcher tells the dark and fas http t co rzmt9yslus
-1	that whole volunteer sheriff thing is eerily reminiscent of foxcatcher when he was paying cops to get guns for himself
-1	united states 60 foxcatcher bennett miller http t co l82qucfpkt movies itunes iphone apple
-1	scpabatud s weekend movie is foxcatcher playing at 8p on fri amp sat 3 tix at trabant box office udel
-1	mefi john has graciously allowed our cameras into his home the true crime film foxcatcher trailer fanfare st http t co 1k84deteij
-1	actual john du pont promotional film for foxcatcher farm https t co nenn0s38vc
-1	the true crime film foxcatcher trailer fanfare starred steve carell in an oscar nominated role as the self http t co l7xg5yclyf
-1	jr calls foxcatcher https t co vhxra30ktm
-1	she is too fond of books movie review foxcatcher http t co gsptahtjhx
-1	rt lakefrontrow today s movies in madison foxcatcher provincial actors a late night guest amp more http t co pft1wkdm5t http t co se
-1	rt lakefrontrow today s movies in madison foxcatcher provincial actors a late night guest amp more http t co pft1wkdm5t http t co se
-1	today s movies in madison foxcatcher provincial actors a late night guest amp more http t co pft1wkdm5t http t co sefqyhms7u
-1	movies hd http t co mizaldgt2a foxcatcher 2015 http t co axlcmjkxau
-1	channing tatum s frankenstein walk in foxcatcher is how i walk around after doing 8 push ups
-1	rt markruffalo foxcatcher is now available to own join me in a q amp a w itunes in support of its release https t co y7qrmvt7of http
-1	foxcatcher is so underrated
-1	westhamutd11 sound mate give us a shout tomorrow then get your head into it and i ll you ll win btw watched foxcatcher good film
-1	scpab ud presents foxcatcher at 8pm in trabant theater http t co blcuvx7rcz
-1	foxcatcher
-1	foxcatcher has me crying at work
-1	just saw foxcatcher wow if you re sienna miller s husband in a movie watch out foxcatcher americansniper
-1	just watched foxcatcher it was a pretty dope movie
-1	so far 1 boyhood 2 birdman 3 mommy 4 grand budapest hotel 5 nightcrawler 6 foxcatcher 7 under the skin 8 whiplash 9 ida 10 interstellar
-1	rt kitchlibrary this saturday s free flick at central is the intense chilling foxcatcher http t co z9eh7qowrv drop in at 2 pm amp byo s
-1	abby_blackwood did you watch foxcatcher
-1	markruffalo you were robbed foxcatcheruk theacademy goldenglobes sagawards bafta criticschoice foxcatcher amazing performance
-1	i added a video to a youtube playlist http t co pmdbtmqarh foxcatcher official trailer 1 2014 channing tatum steve carell
-1	foxcatcher 6 5 10
-1	rt colexizusofu 516 top 5 discoveries of 2014 foxcatcher tale of princess kaguya
-1	that officer foul just let him kill that man for nothing dude was doing him a favor foxcatcher
-1	rt foxcatcheruk what does it take to become the best in the world see foxcatcher in uk cinemas today http t co 77wlaqtg2w https t
-1	foxcatcher was such a good movie if you look up the real story behind it a it ll break your heart
-1	i think manpennywise should start calling me eagle or golden eagle or nikki foxcatcher
-1	judging by foxcatcher alone am i correct in assuming that cocaine use is an automatic r rating
-1	just watched foxcatcher i can see why steve carrell got nom for an oscar but most surprisingly was channing tatum he can act
-1	rt afmfilms one of the most awkward scenes in cinematic history is when john du pont s mother enters the gym foxcatcher masterpiece
-1	channing tatum uuuh foxcatcher https t co ubzf2c0ud5
-1	rt foxcatcheruk stevecarell markruffalo amp channingtatum star in the incredible foxcatcher in uk cinemas jan 9 2015 http t co b
-1	rt foxcatcheruk what does it take to become the best in the world see foxcatcher in uk cinemas today http t co 77wlaqtg2w https t
-1	every secret thing trailer from a producer of foxcatcher and based on the novel by new york times best sell http t co qucfrecy5p
-1	taxbrainjane have you seen this foxcatcher 2014 at http t co krjfmcgrnm movie film streaming http t co dvb6qepjvq
-1	jason_omara grand budapest hotel i m a fan of wes anderson foxcatcher carell and ruffalo were really good weird story
-1	watching foxcatcher
-1	just finished foxcatcher with adambrclarke we had to google the dupont_news family bc we couldn t believe the ending whaaaaattt
-1	the following is based on a true story foxcatcher https t co 0tjq5w9abq
-1	i can t stop thinking about foxcatcher not in a positive way very bad film disguised as a good one insipid middlebrow nonsense yay
-1	watching foxcatcher again idc
-1	516 top 5 discoveries of 2014 foxcatcher tale of princess kaguya
-1	foxcatcher though
-1	the foxcatcher crew xd http t co onapbcvgba
-1	i wasn t a fan of foxcatcher and almost fell asleep off and on while watching
-1	i channing tatum amp amp i wrestling even more but foxcatcher just wasn t what i thought it was still wished i had been that good tho
-1	foxcatcher and night crawler what the fuck you owe me 4 hours of my life back and 2 00 credited to red box
-1	alexxkittle i like his foxcatcher performance a ton but this seems so ugghhh
-1	alexxkittle they got steve carrell don t know if he s lead but if so it could be part of his srs actor oscar streak startin w foxcatcher
-1	foxcatcher a film made after my own heart
-1	steve carell s character in the foxcatcher is so pathetic but so well portrayed such a sad person in the film
-1	jimmychalk haven t seen the judge but all of the rest are exceptional foxcatcher might be a little slow for a red eye though
-1	rt trevor_mcgowan chase was right never watching foxcatcher again hallchase27
-1	chase was right never watching foxcatcher again hallchase27
-1	st vincent or foxcatcher
-1	this saturday s free flick at central is the intense chilling foxcatcher http t co z9eh7qowrv drop in at 2 pm amp byo snacks
-1	finally watching foxcatcher
-1	markruffalo you re truly a class act mark foxcatcher was amazing
-1	jimmychalk foxcatcher
-1	markhendricksen god no and having seen foxcatcher we will have a close eye on him if he continues
-1	steve carell marwencol foxcatcher star joins zemeckis next read all about the steve carell marwencol http t co ofncmo4cyj
-1	red eye should i watch the judge whiplash birdman foxcatcher or gone girl
-1	foxcatcher available dvd and bluray 18th may by eoneuk http t co v9pthzndh2
-1	steve carell to lead robert zemeckis drama marwencol fresh off his stellar turn in foxcatcher last year it a http t co nwx3giilsk
-1	rt nuholaxisaki 516 top 5 discoveries of 2014 foxcatcher tale of princess kaguya
-1	i m reading foxcatcher by mark schultz https t co oacfcpy9fx
-1	mum says i m glad i m not a professional wrestler otherwise foxcatcher might come to get me
-1	rt tazimexosuv 516 top 5 discoveries of 2014 foxcatcher tale of princess kaguya
-1	rt ashbenzo cannot wait foxcatcher https t co nki97znpvh meganeellison chelseabarnard annapurnapics
-1	whiplash foxcatcher lebowski not a bad week of film viewing
-1	insanityreport he s really good in foxcatcher
-1	didn t see foxcatcher but in the previews he seemed pretty dull but maybe he stepped up but again thats why he reached out to miller
-1	foxcatcher whatimwatching watchingnow
-1	igasu elmayimbe after foxcatcher it would be wise for tatum to work with miller
-1	best line from foxcatcher call me eagle or golden eagle what
-1	this foxcatcher film is pretty menswear
-1	rt xomocaqocok 516 top 5 discoveries of 2014 foxcatcher tale of princess kaguya
-1	finally about to watch foxcatcher
-1	if your a wrestler amp haven t seen foxcatcher yet then wow right now go get it at red box amp watch it dumbass
-1	foxcatcher http t co ffeiszytue
-1	two of my least favorite things rich people amp wrestling my new favorite movie foxcatcher you https t co sxzvalbar1
-1	watched foxcatcher on the way back from china now that s a dark dark film also cry freedom for the first time brilliant just brilliant
-1	anyone watched foxcatcher if so any good
-1	stevecarell what a great movie steve foxcatcher now head off to watch some theoffice theofficenbc
-1	i recently watched foxcatcher and it hit me stefan simchowitz is john dupont not his look or demeanor but the themes of his life
-1	rt moviereviewsinc on movies john du pont in foxcatcher wrestling tragedy johndupont olympic gold medalist dave schultz daveschultz
-1	rt moviereviewsinc on movies john du pont in foxcatcher wrestling tragedy johndupont olympic gold medalist dave schultz daveschultz
-1	on movies john du pont in foxcatcher wrestling tragedy johndupont olympic gold medalist dave schultz daveschultz http t co lv1omliv0s
-1	rt jonahhill foxcatcher is truly one of the best films i have ever seen in my life it is out today in la and ny your mind will be blown
-1	barneysversion book thevoices foxcatcher lucy boxtrolls just a reminder that i don t have time to fit you all in
-1	gonna see what this is all about foxcatcher https t co 4dtjsfrenu
-1	wow i just won this for free foxcatcher ultraviolet code flixster movie http t co kjz4eaxxuz listia
-1	united states 42 foxcatcher bennett miller http t co l82qucfpkt movies itunes iphone apple
-1	oh yeah i tried to watch the captive and the disc would not work also got foxcatcher but got too busy to watch it
-1	watching foxcatcher https t co bybnw7w6xn
-1	516 top 5 discoveries of 2014 foxcatcher tale of princess kaguya
-1	rt ronorisudes 516 top 5 discoveries of 2014 foxcatcher tale of princess kaguya
-1	rt yu_luck dave schultz murder by john du pont news breaks jan 26 29 1996 foxcatcher story http t co mnza31dntl
-1	rt sardoubleyou the actual documentary john du pont made fascinating amp eerie foxcatcher https t co vxkr3kqsyj
-1	watched foxcatcher last night with the bff it such a good movie
-1	today fepl spring story amp craft 6 pm 2 screening of foxcatcher centennial 6 30 pm tickets 3 knitting for kids crystal ridge 6 30
-1	win a copy of foxcatcher blu ray http t co swvnmman5y
-1	win a copy of foxcatcher blu ray http t co nkuwi65o8q
-1	watching foxcatcher https t co smqfs1kobd
-1	rt afmfilms one of the most awkward scenes in cinematic history is when john du pont s mother enters the gym foxcatcher masterpiece
-1	rt lobotom the real john du pont foxcatcher http t co mjrqjjk6ak
-1	channing tatum abang nya ariel tatum foxcatcher https t co pvbfivmob6
-1	nov 13 great memories in losangeles hollywood jonnybailey dolbytheatre redcarpet foxcatcher http t co eontwbnewf
-1	foxcatcher wrestling sweatshirt http t co xaflzktjom via fancy
-1	watched foxcatcher last night and i got to say i loved it any wrestler who wants to think a little about a movie watch it
-1	rt ronorisudes 516 top 5 discoveries of 2014 foxcatcher tale of princess kaguya
-1	this guy bates really reminds me of steve carell s character in foxcatcher
-1	516 top 5 discoveries of 2014 foxcatcher tale of princess kaguya
-1	eva longoria at foxcatcher premiere the 67th annual cannes film festival http t co 7cy8rilqqy
-1	movie review foxcatcher 2014 http t co jlth8ch6hx grandshuckett
-1	foxcatcher is one of the most aggravating movies i ve ever seen
-1	watching foxcatcher
-1	foxcatcher insane wow
-1	lola_foxx you gotta watch foxcatcher great movie
-1	foxcatcher is a great movie jared_powell4 wouldn t wouldn t know sleeping the whole time
-1	steve carell foxcatcher https t co ycomjdzxmw
-1	crawfordistoxic watching these foxcatcher 2014 at http t co en593dcfb7 movie film streaming
-1	nw foxcatcher
-1	ashleeymward foxcatcher
-1	is foxcatcher good
-1	foxcatcher amazon instant video http t co wmtothr5yu documentary
-1	watching foxcatcher but really feel like i m watching broke back mountain lolkiddingitsagoodmovie buttotallyserious
-1	i m only like 30 minutes but channing tatum deserves an award for the movie foxcatcher i can tell already
-1	watching foxcatcher f ken weird ass movie channingtatum stevecarell ya ll don t look right lol
-1	foxcatcher is actually kinda depressing
-1	ccpopculture nice i m seeing it follows tonight i m a big fan of foxcatcher
-1	after watching foxcatcher fell down google rabbit hole looking for stuff about du ponts and found this awful mess http t co 2qaauojun4
-1	saw foxcatcher finally i m convinced the really rich are way more screwed up than the poor thejinxhbo robertdurst duponts
-1	zzsmiller just viewed foxcatcher for the first time weekruined yeah i m not surprised
-1	just viewed foxcatcher for the first time weekruined
-1	mattmira loved you in foxcatcher glad to see wrestling got your weight down sorry bout the bald spot
-1	foxcatcher movie thoughts does it drag on and on
-1	foxcatcher is such a great movie foxcatcher
-1	you see the movie foxcatcher foxcatcher creeper https t co x8ust4flt3
-1	dailythoughtsin4words don t be like john foxcatcher http t co xr1urdeapd
-1	finally get to watch foxcatcher
-1	finally watching foxcatcher
-1	the ending the foxcatcher so fucked up
-1	foxcatcher is a weird ass movie
-1	so steve carell is basically wearing my nose watching foxcatcher
-1	foxcatcher with disha nadila and 8 others https t co zskblnwzld
-1	i can t imagine a friend telling me to call them eagle or goldeneagle foxcatcher
-1	venkmans_volvo 6 life itself 7 nightcrawler 8 we are the best 9 violette 10 foxcatcher
-1	charlie s referenced the imitation game and foxcatcher tonight so i hope she did well in her oscar pool supernatural
-1	mattleekhsbwlng foxcatcher look in the clan the leader is me my name is crazy dave we have like 14 people in it and our flag is dark purple
-1	lordservbot whiplash nightcrawler birdman gone girl edge of tomorrow boyhood foxcatcher lego movie lucy dotpota inherent vice
-1	steve carell s character in foxcatcher is giving me the heebie jeebies
-1	foxcatcher 2 rt pzfeed police great neck cardiologist wanted rival doctor killed ornate swords amp axes found story http t co 4pyiihzip2
-1	brianphickey replace bob knight with jon du pont and that is an actual line from foxcatcher
-1	holy cow the foxcatcher
-1	foxcatcher in the rye
-1	good movie http t co ejn3aiahx3 i recommend it weird real life situation well filmed http t co lzm8nvvqpk
-1	just watched foxcatcher too good ugh lost
-1	rt makeupartistmag oscar winner bill corso is keynoting imats vancouver his work on stevecarell in foxcatcher is incredible http t
-1	not bad watching foxcatcher
-1	nw foxcatcher 2014 imdb http t co nvgguqewzv
-1	channingtatum excellent performance in foxcatcher
-1	foxcatcher official trailer 2014 steve carrell channing tatum hd http t co rh7yxmqq7c
-1	zaeonn director of foxcatcher went to mine pretty cool
-1	rt channingtatum sending a huge congrats to stevecarell markruffalo foxcatcher bookoflifemovie and thelegomovie on today s golde
-1	ajm0013 foxcatcher ehhh
-1	rt foxcatcheruk stevecarell markruffalo amp channingtatum star in the incredible foxcatcher in uk cinemas jan 9 2015 http t co b
-1	rt foxcatcheruk what does it take to become the best in the world see foxcatcher in uk cinemas today http t co 77wlaqtg2w https t
-1	rt channingtatum congrats to markruffalo stevecarell bennett miller amp the entire talented crew on oscar noms honor to be on team fo
-1	rt channingtatum rt dmech06 bought the movie foxcatcher and i can see why there was so much buzz about it 140 characters doesn t do i
-1	rt channingtatum rt gingerjonathan channingtatum markruffalo stevecarell so excited to finally watch foxcatcher teamfoxcatcher ht
-1	bought the judge foxcatcher interstellar and whiplash today so i m set on movies for the moment
-1	wanna see russell crowe and pierremenard star in their own version of foxcatcher
-1	seeing steve carell as michael scott in season two of the office a few days after i saw foxcatcher is extremely weird
-1	foxcatcher 2014 http t co 7uxzpejc9l
-1	this foxcatcher review is off limits http t co pfouvfaghb
-1	516 top 5 discoveries of 2014 foxcatcher tale of princess kaguya
-1	rt yardhyperadio every secret thing 2015 movie trailer from a producer of foxcatcher and based on the novel by new york ti http
-1	rt yardhyperadio every secret thing 2015 movie trailer from a producer of foxcatcher and based on the novel by new york ti http
-1	every secret thing 2015 movie trailer from a producer of foxcatcher and based on the novel by new york ti http t co alpzetkji5
-1	every secret thing 2015 movie trailer from a producer of foxcatcher and based on the novel by new york ti http t co x1nuyeseas
-1	every secret thing 2015 movie trailer from a producer of foxcatcher and based on the novel by new york ti http t co ikucsmtpat
-1	every secret thing 2015 movie trailer from a producer of foxcatcher and based on the novel by new york ti http t co dxt7kvbbjl
-1	every secret thing 2015 movie trailer from a producer of foxcatcher and based on the http t co 8ugbvsmvky yardhype yardhype
-1	dancehalledge1 every secret thing 2015 movie trailer from a producer of foxcatcher and based o http t co p2nvoajk9a yardhype
-1	new post foxcatcher the true story of my brother s murder john du pont s madness and the quest for olympic gold http t co c7uqzityst
-1	from a producer of foxcatcher and based on the novel by new york times best selling author laura lippman every http t co hnuwhdwlhc
-1	rt phillips watched foxcatcher on the flight and wow more than i thought it would be great movie
-1	nancyodell markruffalo etnow avengers i hope the hulk wrestles in new avengers foxcatcher
-1	foxcatcher full movie http t co rrtngrzrhg via youtube
-1	disponible en farmadiscos foxcatcher https t co nsawn41hhg cine
-1	movie time foxcatcher
-1	andrew_shaw23 i think you amp i are the only folks who even saw foxcatcher liked it a lot i like all bennett miller s films seen moneyball
-1	i did read some really great comics on the plane and watched foxcatcher steve carrell creeped me the fuck out
-1	gmllgn thanks for your honesty last time i saw the guy he was glum tatum in foxcatcher so cheerier 22 appeals
-1	jrsbbq calls foxcatcher https t co vhxra3ilku
-1	cemre_baran edge of tomorrow enigma the theory of everything foxcatcher set fire to the stars gone girl nightcrawler
-1	foxcatcher still
-1	njh09 i got it lets take channing tatum from foxcatcher and make him want to do mma where he stumbles upon an old gym with a legend
-1	every secret thing trailer from a producer of foxcatcher starring diane lane elizabeth banks dakota fanning http t co hfrg6ganos
-1	that movie foxcatcher was good i love real event based movies
