-1	rt yuliluvstroyler when someone criticizes me for reading to much of kali s or ida s smut http t co mry5rnhy1l
-1	women s team results 1 ida 140 2 summerfield 108 3 britton deerfield 84 4 blissfield 75 5 clinton 49 6 foley 40 7 whiteford 7
-1	rt greenenergynews energy equality on earth day http t co uwx14sn8lt green
-1	have a nice day sayangkuuuuu meggabitta iddapariani have a nice day kak ida d
-1	one person unfollowed me automatically checked by http t co f2yhnyscbh
-1	ida_67425 so f n true
-1	hmm my very good friend ida blocked me cus i kept calling her fat smh it go me rough not that it wasn t true too smh
-1	iddapariani have a nice day kak ida d
-1	morning date with lontong supposed to run this morning but unexpectedly my left leg at warung encik ida https t co ctjmry5otk
-1	damn i still b thinkin bout that joint wiz threw in the crowd i wish ida caught that thang
-1	rt dd_alabama the 2nd southern regional ida conference great start with dr nancy mather elephant in the room what we http t co
-1	charmvivianne by nature i am cute happy friendly curious noughty i hope u like me and you will come to se http t co gmvmbtjp3t
-1	rt mooniiquue_ idaamariee ida for president
-1	rt nirylis flare ida pro script series applying function prototypes to indirect calls submitted by rolfr link 1 comment http t
-1	rt nirylis flare ida pro script series applying function prototypes to indirect calls submitted by rolfr link 1 comment http t
-1	i love u abang tersayang bangbily olgasyahputra82 makverazanobia http t co glkkvrajdg
-1	amen http t co jjgdcrbbkj
-1	rt aando_realtors makeoverbyida lsdpgn gq45 meldatingevents ericlekuwa ida don t rush into anything take your time this is
-1	when someone criticizes me for reading to much of kali s or ida s smut http t co mry5rnhy1l
-1	idaamariee ida for president
-1	rt beseenhere karinitaforyou karinitaforyou 22 girls age 22 height 175 weight 69 hair colour black http t co t0ytm91izv webcam
-1	rt aando_realtors is this good with you with ida amp her friend gq45 lsdpgn makeoverbyida meldatingevents ericlekuwa after
-1	nowplaying ida maria i m bad news on http t co wfzd1mfksz wsciradio
-1	rt itswillyferrell when you re using the bathroom but you forget to lock the door and someone opens it http t co mxtd9ly4ug
-1	energy supply will help cameroon develop why ida matters for cameroon http t co sprwpngdta
-1	rt tbhdaphne i m out here struggling to walk in heels meanwhile http t co o1upagiq3a
-1	sexshadesduo sexshadesduo 26 couples age 26 height 175 weight 70 hair colour black eye http t co cbrbbsuia5 webcams naked_cams
-1	jossetemilf jossetemilf 44 mature female age 44 height 174 weight 68 hair colour black http t co 1rzi870je1 webcams naked_cams
-1	karenine karenine 21 girls age 21 height 167 weight 52 hair colour black eye colour http t co 05slrwalyt webcams naked_cams
-1	hotnymph hotnymph 33 girls age 33 height 170 weight 56 hair colour black eye colour http t co teuidagbmq webcams naked_cams
-1	wickedhotx wickedhotx 32 ladies age 32 height 0 weight 0 hair colour eye colour http t co kczahdrerq webcams naked_cams
-1	hotmadam4u hotmadam4u 58 mature female age 58 height 170 weight 60 hair colour black http t co ap7tmh92vi webcams naked_cams
-1	eroticmyllena eroticmyllena 20 girls age 20 height 0 weight 0 hair colour eye colour http t co msyfey4r1n webcams naked_cams
-1	fetisqueen fetisqueen 31 fetish female age 31 height 170 weight 58 hair colour black http t co ek6lkojk5w webcams naked_cams
-1	ida movie trailer 2014 http t co jt99uqch2u
-1	nowplaying craveradio let me think about it promo only radio edit ida corr vs fedde le grand http t co 8sghoipash
-1	rt sayingsforgirls i may seem like a sarcastic asshole but deep down i m a good caring person and even deeper down i m still a sarcasti
-1	rt sayingsforgirls yes hello 911 i m bored you wanna chill or some shit
-1	rt sayingsforgirls im actually really nice until u annoy me
-1	rt sayingsforgirls i say idk alot but trust me i be knowin
-1	rt sayingsforgirls me what can possibly go wrong tho anxiety im glad you asked
-1	no more annual deer massacres in defense of animals https t co l1qzpgpbio
-1	rt sayingsforgirls my life in 2 words trust issues
-1	elephant spotlight in defense of animals https t co vz6ftjmnop
-1	rt sayingsforgirls dear god i ve tried my best but if today i lose my hope please tell me that your plans are better than my dreams
-1	oh seventh officer refuses to testify in trial of police officer michael brelo http t co snxikoll13 by ida lieszkovszky clevelanddotcom
-1	rt sayingsforgirls i just need a break from everything for a little while
-1	rt sayingsforgirls my hobbies switching between the same three apps for hours imagining myself in situations that will literally ne
-1	rt sayingsforgirls the worst thing is not knowing where you stand with someone
-1	rt accountingmy_ boss what do you think abt the new f amp f ida very good and touching movie boss boss i asked abt our new fixtures amp f
-1	rt sayingsforgirls my life is just one big _ _
-1	mrs tooke s students sharing their strategies on open response problem on friday morning
-1	rt sayingsforgirls if i m silent it s because there s thunder inside me or i m just chillin depends may the odds be ever in your favo
-1	mrs otis s class is so thankful and grateful for our new chromebooks today our class did research in partners http t co s8cebdrios
-1	seneca co ida seeking board members http t co 8edu3i4hbg
-1	may nothing but death do us part
-1	rt 5secondsofizzyx i think i m going to end up breaking my all time low future hearts cd simply by replaying it way too much
-1	it s been said before the buff ui needs to be fixed so i recently started using the convention of elements ring http t co f6s7kej30k
-1	ida just favorited my tweet omg ilysm idaandu
-1	honestly kroq is trying to send me to the hospital because of the fob feels
-1	thesunnewspaper nova_nda you must read it right now guys hahaha
-1	yes kroq two fob songs in a row
-1	gavinmc2000 real shit if i wasn t in school ida considered doing it
-1	rt 5sosupdateslive everyone reading the daily mail article like ida celebrityawards2015 5 seconds of summer http t co ug7r5btx1f
-1	free adult sexcam babexgirl http t co 2vyvy2u1be live now webcam
-1	good morning harry_styles have a nice day yeah what your activities now i
-1	ida smoke s weedy wonder is out http t co dsc6zq2odd stories via ourhotstockpick mtdukes gwengoregirl
-1	rt bitch_inc and it seems like yesterday was just dream but those days are gone they re just memories
-1	rt omgrelatabie why is every girl my age 1000 prettier than me
-1	rt wonkamore a real girlfriend doesn t complain while her boyfriend is on his xbox she sits there and yells kill that bitch
-1	kroq playing some great tunes falloutboy centuries
-1	rachelrussellclark made me a bookmark rj amp racheltakeover o ida international dance academy https t co a97ofwpfc0
-1	rt sorryimalex when u hug someone that recognize you and they get eyeliner on ur new shirt i love you tho http t co 62tafwfqrb
-1	rt commonbandgirl internet friendships are not real rt if this is a lie amp you ve made amazing friends on the internet
-1	kroq kroq just played tidal waves alltimelow markhoppus
-1	rt b1lisab kristinmatzkane intldyslexia lynpollard jeniferkastenaz dyslexia front amp center in the big apple really amazing ida rock
-1	and that s a wrap i m out finito it certainly was 20 very eventful hours ready to sleep for an eternity now ida out producerlife
-1	what do _lumension amaxinfotech amp rsasecurity have in common they all have offices in ireland whyireland rsac http t co aklgppe3ou
-1	jkingsavage no i m not you amp ida be bothering me amp you it
-1	rt taylaaaahh got the sweep against mount ida
-1	please check out this week s injury law newsletter http t co 8doyr2zouy
-1	today stats no new followers one unfollower via http t co z7qxutj9xo
-1	sexyyblonde sexyyblonde 24 girls age 24 height 165 weight 48 hair colour fair hair eye http t co wjlwunpajl webcams naked_cams
-1	hotkimx hotkimx 24 girls age 24 height 170 weight 55 hair colour black eye colour http t co jplffhdxu9 webcams naked_cams
-1	girlofyourdreams girlofyourdreams 24 girls age 24 height 171 weight 55 hair colour http t co vcyu3nahf4 webcams naked_cams
-1	lesformidables lesformidables 19 couples age 19 height 167 weight 55 hair colour http t co k36o8ukoac webcams naked_cams
-1	blondereine blondereine 21 girls age 21 height 168 weight 54 hair colour fair hair eye http t co dyqmnmmig0 webcams naked_cams
-1	fukmytitts fukmytitts 24 girls age 24 height 0 weight 0 hair colour eye colour http t co pbzqdmhwua webcams naked_cams
-1	vanesahot vanesahot 21 girls age 21 height 168 weight 45 hair colour russet red hair http t co hma2ag8go8 webcams naked_cams
-1	meganie meganie 20 girls age 20 height 166 weight 45 hair colour fair hair eye colour http t co wfnbj0t2c0 webcams naked_cams
-1	sexxdesire69 sexxdesire69 27 lesbians age 27 height 165 weight 60 hair colour brown http t co z7300ts1gc webcams naked_cams
-1	monsterida wait am i not your ultimate bias how can you share me omg ida
-1	got the sweep against mount ida
-1	that s what al qa ida said https t co nqs3jfq90o
-1	elephant spotlight in defense of animals https t co bgnlsvmiqp
-1	went to sleep listening to ida woke up listening to ida
-1	menu breakfast http t co vguqfy3nxb
-1	rt carmenmaraespin miraniad minelede alee_aleman edur75 ida_aurora loremgcastillo lolysdiaz luciacampos169 edithgonz1964 erikad
-1	no more annual deer massacres in defense of animals https t co i8llqxeenh
-1	pls sign and help the baby elephants in zimbabwe they are being kidnapped https t co kmkwmcndzf
-1	rt casey_mizell this is ida https t co upfrjkzm62
-1	the 2nd southern regional ida conference great start with dr nancy mather elephant in the room what we http t co xl0hvl1t1t
-1	new alpine genuine usb to ipod iphone conversion cable ida x100m ida x200 http t co fiqeutvbag http t co eh7isdeavf
-1	good morning have a wonderful day happy weekend everybody _ https t co 7t3ko9tic4
-1	ida_67425 cokeaddict how about both
-1	i m going to ida baker next year
-1	ida_67425 we want to stop that douchebag from procreating the planet already has a surplus of douchebags
-1	miraniad minelede alee_aleman edur75 ida_aurora loremgcastillo lolysdiaz luciacampos169 edithgonz1964 erikadiazd para tod s bend
-1	rt 5sosupdateslive gonna move to australia and go to cool room all the time so i can party with the boys ida celebrityawards2015 5 sec
-1	rt 5sosupdateslive gonna move to australia and go to cool room all the time so i can party with the boys ida celebrityawards2015 5 sec
-1	ida_67425 just him lol
-1	driving through mt ida same day as an old work retreat is for the pigeons dairyette neck amp backclinic
-1	rt 5sosupdateslive gonna move to australia and go to cool room all the time so i can party with the boys ida celebrityawards2015 5 sec
-1	elephant spotlight in defense of animals https t co lxieivaskr
-1	wither sweden ida and albin are a happy couple they set off to a cabin in the vast swedish woodlands to http t co pbulcyqvie
-1	ida_yuliyani zayn will soon be back to one direction read more http t co gna66lslsh http t co hczcg4uun5
-1	please sign and rt http t co yrmpgv7zig http t co hi02srsdp4
-1	oh amp i dislike bananas very much by the way
-1	online now hotsexalice http t co usigfwtllz free sex chat sex
-1	rt freja_petersen evimeuris pls sign rt no more annual deer massacres in defense of animals https t co lvrbz1pq62 http t co ppd4r
-1	donuts aren t supposed to have filings it s like eating ice cream with bananas no
-1	readyornot always be ready to go full out happy friday people dreambig chaseyourgoals lovemylife ida http t co x0kmrdlnny
-1	ida jean orlando pelletier august 12 1926 november 28 2007 was an internationally known psychi http t co zyza7wxjog
-1	your teachers at the 2nd ida southern regional conference http t co fzldxfivhg
-1	online now esmeraldamilf http t co rrvgnvrzpv free sex chat sex
-1	rt freja_petersen evimeuris pls sign rt elephant spotlight in defense of animals https t co e7oqev1owk http t co i2zynkzr0h
-1	drakehonkjr is ida going
-1	rt trever_wilcox my sister is such a better person then me ida beat everyone who thot they opinion was important ass already
-1	ida_67425 im sensitive lol youre just dumb trying to reason you i think you re smarter than what you want to make it look like
-1	rt 5sosupdateslive gonna move to australia and go to cool room all the time so i can party with the boys ida celebrityawards2015 5 sec
-1	yourstotake yourstotake 39 ladies age 39 height 169 weight 57 hair colour fair hair eye http t co o5ubg08too webcams naked_cams
-1	sarytahot sarytahot 23 girls age 23 height 12 weight 60 hair colour fair hair eye http t co eft8bco0ld webcams naked_cams
-1	ashleey ashleey 21 girls age 21 height 172 weight 51 hair colour russet red hair eye http t co e3j0znncwy webcams naked_cams
-1	hairyregine hairyregine 50 mature female age 50 height 174 weight 74 hair colour fair http t co vdibxmu7eh webcams naked_cams
-1	sunshinef sunshinef 19 girls age 19 height 170 weight 50 hair colour fair hair eye http t co inevlluhec webcams naked_cams
-1	thebestjulia thebestjulia 23 girls age 23 height 160 weight 58 hair colour fair hair http t co cfx6nyft9l webcams naked_cams
-1	hotnymph hotnymph 33 girls age 33 height 170 weight 56 hair colour black eye colour http t co 6pwihc0oke webcams naked_cams
-1	the making of losing the dark ida s short film on light pollution by carolyn petersen http t co megvvsfm1g http t co eepgtjjqae
-1	this is ida https t co upfrjkzm62
-1	free anal sexshow fuckchattefontain http t co etptbz0voj is live now nsfw
-1	chrisincport why wasn t nerd in back in 87 ida been all garvey up in that
-1	it s getting a little rowdy out there ida i hear u
-1	rolfing and physical reality ida p rolf new book http t co o6os0sfnbp http t co rqv5r6ob9j
-1	rt 5sosupdateslive gonna move to australia and go to cool room all the time so i can party with the boys ida celebrityawards2015 5 sec
-1	buccigross how about a rt for me hoping for a bucciovertimechallenge tonight from ida michigan http t co 3qisblsxmj
-1	the southern regional ida conference great start with dr nancy mather http t co lyclu1vqja
-1	yes fuck yea tearra and ida is throwing down for me in the kitchen
-1	rt 5sosupdateslive gonna move to australia and go to cool room all the time so i can party with the boys ida celebrityawards2015 5 sec
-1	rolfing and physical reality ida p rolf new book http t co 7wxiegd8ln http t co dpo8cbme8b
-1	rt greenenergynews this glorious snowboarding pug is the best thing you ll see all day http t co 0qt1bz1zba green
-1	rt 5sosupdateslive gonna move to australia and go to cool room all the time so i can party with the boys ida celebrityawards2015 5 sec
-1	we love this djtigerstyle vekked dj fong fong deejay irie http t co 4pfbdmdbv5
-1	rt 5sosupdateslive gonna move to australia and go to cool room all the time so i can party with the boys ida celebrityawards2015 5 sec
-1	just tell me beautiful lies i m sick of the truth
-1	rt 5sosupdateslive gonna move to australia and go to cool room all the time so i can party with the boys ida celebrityawards2015 5 sec
-1	rt sakura_yi good night3 break time http t co i5sj7gh4i3 illustration drawing cat https t co 5kssuimf5d
-1	rt christiand romance https t co dpxpy1j9jd
-1	ida_67425 you started it
-1	cant waitttt
-1	rt soompi yoo yeon seok and kang sora in adorable pre filming shots for agreeably warm http t co r7ebjwxz2g kdrama http t co zx2tk
-1	rt 5sosupdateslive gonna move to australia and go to cool room all the time so i can party with the boys ida celebrityawards2015 5 sec
-1	rt 5sosupdateslive gonna move to australia and go to cool room all the time so i can party with the boys ida celebrityawards2015 5 sec
-1	meligrey well thanks i was having a great day and now i m thinking about ida and isidor and now i m really bummed out
-1	lorennegrosseins sexy brunette smart kinky ready for fun http t co sfavhtfz9e
-1	rt 5sosupdateslive gonna move to australia and go to cool room all the time so i can party with the boys ida celebrityawards2015 5 sec
-1	rt dvdinfatuation though she plays a catholic nun in training the lead performer in this film is in reality a devout atheist http
-1	rt 5sosupdateslive gonna move to australia and go to cool room all the time so i can party with the boys ida celebrityawards2015 5 sec
-1	rt dvdinfatuation though she plays a catholic nun in training the lead performer in this film is in reality a devout atheist http
-1	divas divas returns just a quick send out for divas showclub nite fyi http t co pylg2c66ct
-1	rt 5sosupdateslive gonna move to australia and go to cool room all the time so i can party with the boys ida celebrityawards2015 5 sec
-1	rt mafermu12 leonesunsolocorazon micheillesoiferlaleona lions http t co aqkjrwrjvm
-1	rt almightykeybeom off 150414 jonghyun mbc blue night official site update with exo http t co g5utatotiq
-1	rt nirylis flare ida pro script series applying function prototypes to indirect calls submitted by rolfr link 1 comment http t
-1	rt dvdinfatuation though she plays a catholic nun in training the lead performer in this film is in reality a devout atheist http
-1	rt 5sosupdateslive gonna move to australia and go to cool room all the time so i can party with the boys ida celebrityawards2015 5 sec
-1	rt dvdinfatuation though she plays a catholic nun in training the lead performer in this film is in reality a devout atheist http
-1	i dipped a toe in the latest sony emails and ap suggested lupita n yongo for a role and called her ida lapino so many things wrong there
-1	kristinmatzkane intldyslexia lynpollard jeniferkastenaz dyslexia front amp center in the big apple really amazing ida rocks
-1	rt 5sosupdateslive gonna move to australia and go to cool room all the time so i can party with the boys ida celebrityawards2015 5 sec
-1	rt 5sosupdateslive gonna move to australia and go to cool room all the time so i can party with the boys ida celebrityawards2015 5 sec
-1	rt chase_ingdreams ida grove is a neat town
-1	rt 5sosupdateslive gonna move to australia and go to cool room all the time so i can party with the boys ida celebrityawards2015 5 sec
-1	rt 5sosupdateslive gonna move to australia and go to cool room all the time so i can party with the boys ida celebrityawards2015 5 sec
-1	ida_67425 i still cant believe people laugh at injuries i guess i understand lars eller s face was so funny when he was lying on the ice
-1	rt 5sosupdateslive gonna move to australia and go to cool room all the time so i can party with the boys ida celebrityawards2015 5 sec
-1	rt 5sosupdateslive gonna move to australia and go to cool room all the time so i can party with the boys ida celebrityawards2015 5 sec
-1	rt 5sosupdateslive gonna move to australia and go to cool room all the time so i can party with the boys ida celebrityawards2015 5 sec
-1	rt 5sosupdateslive gonna move to australia and go to cool room all the time so i can party with the boys ida celebrityawards2015 5 sec
-1	rt 5sosupdateslive gonna move to australia and go to cool room all the time so i can party with the boys ida celebrityawards2015 5 sec
-1	gonna move to australia and go to cool room all the time so i can party with the boys ida celebrityawards2015 5 seconds of summer
-1	though she plays a catholic nun in training the lead performer in this film is in reality a devout atheist http t co xhxwf7s2cz
-1	rt rpacherrez 100pre leon leonesunsolocorazon ida_vg15 eeg_los_leones estoesguerra_tv elcuyguerrero http t co xyju9ywzde
-1	ida uppercut this hoe to the moon https t co 5mcdcep9u3
-1	my sister is such a better person then me ida beat everyone who thot they opinion was important ass already
-1	flare ida pro script series applying function prototypes to indirect calls submitted by rolfr link 1 comment http t co f98iuqohqr
-1	rzochoa ida reportedly said i will not be separated from my husband as we have lived so we will die together
-1	y la ida heigh ho heigh ho it s off to work we go
-1	i watch therefore i am seven movies that teach us key philosophy lessons http t co 9axknesutn
-1	rzochoa ida straus then put her maid into a lifeboat and gave her her fur coat insisting that she would no longer need it
-1	dnazawa good ida
-1	learn about procedure my humble self box up not destroy yours ida and removed devices in keeping with exploitat
-1	adult webcam bruselle http t co 7lm8mwxxu2 is live now chat
-1	rzochoa isidor was offered a spot in a lifeboat but he refused as there were still women on board ida refused to leave without him
-1	rzochoa also known as ida and isidor straus owners of the macy s department store though they were last seen on the deck
-1	babegirl69 babegirl69 19 girls age 19 height 0 weight 0 hair colour eye colour http t co hfk15tod7h webcams naked_cams
-1	mayabrunettefontaine mayabrunettefontaine 21 girls age 21 height 167 weight 52 hair http t co uv0omudafr webcams naked_cams
-1	nahiiara nahiiara 18 girls age 18 height 191 weight 50 hair colour chestnut eye colour http t co zvocrrcd9e webcams naked_cams
-1	nyahchaude nyahchaude 20 girls age 20 height 170 weight 45 hair colour black eye http t co htcvzwarqg webcams naked_cams
-1	xtremelove xtremelove 26 fetish female age 26 height 170 weight 50 hair colour brown http t co 7iugom7ih5 webcams naked_cams
-1	adellsweet adellsweet 21 girls age 21 height 155 weight 45 hair colour russet red hair http t co qwnirvifye webcams naked_cams
-1	hotlucyy hotlucyy 21 girls age 21 height 165 weight 50 hair colour fair hair eye http t co obzbqzxfv0 webcams naked_cams
-1	planned to get more revision done for ida tomorrow but ive got wiener dog all day
-1	rt jrr_tolkie despair is only for those who see the end beyond all doubt
-1	rt fact don t confuse your path with your destination just because it s stormy now doesn t mean you aren t headed for sunshine
-1	missidadown i d better say night before you go blind sweet dreams ida xx
-1	rt alexcdewey veltri bought a versace ring a white sophomore in ida grove iowa meanwhile i have to pickpocket cheetos from lufts base
-1	congrats to motion sick dance company who won ida people s choice award at applause talent this year http t co itgceeis6q
-1	rt onedirection_id 1didphotoupdates zayn with shah rukh and naughty http t co 4zakdyednd
-1	rt 5sosupdateslive this edit is making me weak ida celebrityawards2015 5 seconds of summer http t co e34ru9vl35
-1	rt 5sosupdateslive the fuck is this ida http t co tvdwqqr4gr
-1	rt martinez_elin crpd13 incl the basic right 2 education young people who haven t been to school sr_disability ida_crpd_forum http
-1	westland 6 ua bears 9 top 7th 0 out 0 balls 0 strikes no one on p 14 ida kegley b 28 badilla
-1	the beautiful esplanade studios in new orleans recording video for my next ep songs for ida with https t co lsfn29snzd
-1	rt thedreamcioset lana del rey is such a goddess http t co fqdsogtccn
-1	elephant spotlight in defense of animals https t co u8cymzeiuk
-1	no more annual deer massacres in defense of animals https t co bw6ltucbej
-1	thesunnewspaper harry_styles what is it
-1	what a waste of a beautiful day work
-1	rt 5sosupdateslive calum with his mum s friend recently ida celebrityawards2015 5 seconds of summer http t co fx8rx70oaa
-1	rt 5sosupdateslive the fuck is this ida http t co tvdwqqr4gr
-1	ida anti fur literature to order for campaigns http t co o7ie2flwyc furfreefriday
-1	rebelhygienist enjoyed being part of it best wishes to the ida
-1	100pre leon leonesunsolocorazon ida_vg15 eeg_los_leones estoesguerra_tv elcuyguerrero http t co xyju9ywzde
-1	westland 6 ua bears 7 top 6th 0 out 0 balls 0 strikes no one on p 14 ida kegley b 00 spohn
-1	rt 5sosupdateslive how can they look this good after a 16 h long flight life s unfair ida celebrityawards2015 5 seconds of summer h
-1	kids today if i hiked my socks up to my knees when i was 11 ida got my ass kicked promptly
-1	rt 5sosupdateslive everyone reading the daily mail article like ida celebrityawards2015 5 seconds of summer http t co ug7r5btx1f
-1	lovellyfontaine http t co grfymlffie
-1	westland 6 ua bears 7 bottom 5th 0 out 0 balls 0 strikes no one on p 00 spohn b 14 ida kegley
-1	ida from http t co opsibh2rj2 melayu malay indo malaysia indonesia awek bogel muslim philippines dat http t co bqzknobyt5
-1	rt tania_prism ida1852 malouin220 rurisoumei ljiljanap74 arceduez patmartin91 marie_nassar ok sure ida keep smiling
-1	rt 5sosupdateslive calum with a fan in sydney tonight ida celebrityawards2015 5 seconds of summer http t co jhomelguqx
-1	ida1852 malouin220 rurisoumei ljiljanap74 arceduez patmartin91 marie_nassar ok sure ida keep smiling
-1	living in the city i great except for friday nights when people get drunk and start howling like wolves like wtf
-1	former northfielder chronicles transatlantic activism of ida b wells http t co kiiyhhysl5 http t co xmasjohnrf grainfreejoy
-1	former northfielder chronicles transatlantic activism of ida b wells http t co vv2rmckuww http t co gr3hjula2j rawfoodlivefood
-1	former northfielder chronicles transatlantic activism of ida b wells http t co j9tkfrm8xs http t co kyn9sr1lv3 grainfreesweets
-1	r u d e
-1	rt sincerelytumblr chubby bunny http t co eiep6iycza
-1	kalonzarry sixfootstyles oh and ida watch bachna ae haseeno
-1	westland 5 ua bears 7 top 5th 0 out 0 balls 0 strikes no one on p 14 ida kegley b 28 badilla
-1	sexinthepussy sexinthepussy 41 ladies age 41 height 172 weight 59 hair colour black eye http t co fo4bumf6pi webcams naked_cams
-1	anthonyax anthonyax 22 girls age 22 height 1 7 weight 54 hair colour black eye colour http t co 6zkzz2gpqn webcams naked_cams
-1	ladymistersx ladymistersx 19 fetish female age 19 height 170 weight 55 hair colour http t co qfpm362wfg webcams naked_cams
-1	debyanry debyanry 19 girls age 19 height 170 weight 50 hair colour fair hair eye http t co avufgm3cdi webcams naked_cams
