-1	rt intldyslexia the ida took over times square last week in case you missed it here s the youtube video special thanks to all http
-1	all i ever do is spam ida jungjunko1 http t co bdrw2cxosm
-1	follow my insta ig ida_150199
-1	maagda my show is very hot take my word for granted i am easy going and i am sure you will love that http t co gxae11ycj1
-1	billy_boi_90 ida wished you happy b day but the entire northeast ohio did it hey wait till u hit 40 shit changes but u b u while u can
-1	ida gargantuan deals quantized determination as far as sully the model crxhrv http t co jflacuxwqb
-1	iamsrk awwww love you so much
-1	rt scienceicon miss ida amal explain about microflora to the contestants scienceicon ls sgu indonesiaberkebun http t co ktf9kvyyn5
-1	rt iamsrk this kid is so cool may allah bless him dinner time at the asian awards http t co l0gv12n0kv
-1	ida_vanilla cher i played the bandaged cher on the nanny and sang bang bang lol
-1	rt ddtn13 dd tn co founder julyajohnson at ida conference in nashville with bluegrass star emi sunshine http t co kpbd5jtmcy
-1	twitter moves all non us traffic thru dublin to avoid nsa amp restrictions on monetizing user data idaireland wins http t co owuofkdoau
-1	ida put that second old man on his back nhnh if he ran up on me like that
-1	rt greenenergynews native hawaiians want to bring back environmentally friendly burial practices http t co gv4b64qrzj green
-1	ida_guinn well thanks for ruining my day
-1	nowplaying ida maria oh my god on http t co wfzd1mfksz wsciradio
-1	dear everyone read http t co nm8bfebxxj
-1	ida s relationship goals
-1	porn stars without makeup by melissa murphy brea bennett http t co kif62gdlro
-1	rt minelede d b family miraniad alee_aleman edur75 ida_aurora loremgcastillo lolysdiaz erikadiazd carmenmaraespin http t co
-1	mereputsss
-1	rt haydee_gru18 amen miraniad vianeyvaldez46 ida_aurora katychoto luciacampos169 espinalg25 alee_aleman bettypadillamtz http t
-1	aw the foh engineer is dancing to the band
-1	blueday chelsea http t co fixzsgknbq
-1	i hope the ida lupino directed episode has her finger prints on it and isn t just twilight zone house style
-1	rt minelede d b family miraniad alee_aleman edur75 ida_aurora loremgcastillo lolysdiaz erikadiazd carmenmaraespin http t co
-1	rt svsbham your teachers at the 2nd ida southern regional conference http t co fzldxfivhg
-1	rt scienceicon miss ida amal explain about microflora to the contestants scienceicon ls sgu indonesiaberkebun http t co ktf9kvyyn5
-1	today jeans with sneakers converse wisma pln bedugul https t co wqj7pn4bkv
-1	aiennaaaa owh get well soon okay
-1	rt shaxmanker got a free ticket from ida hawk fuck yeah
-1	live now hotsweetmary http t co 3ajn1ordlz free videochat porn
-1	live now lovelyfeet http t co 1q152lmxf8 free videochat porn
-1	miss ida amal explain about microflora to the contestants scienceicon ls sgu indonesiaberkebun http t co ktf9kvyyn5
-1	devyn and his date ida prom they look so good
-1	kca votejkt48id goodnewsmuse skyglow astrophotography book amp timelapse video series is popular on kickstarter ida darkskies light
-1	skyglow astrophotography book amp timelapse video series is popular on kickstarter http t co hg3lvz9gze ida darkskies lightpollution
-1	rt decroorodney rodney decroo trio w rare opening set by great aunt ida sat april 18 9 pm 20 at bozzini s or 604 792 0744 http t c
-1	goood morninggg
-1	rodney decroo trio w rare opening set by great aunt ida sat april 18 9 pm 20 at bozzini s or 604 792 0744 http t co lqs7xpzknz
-1	now playing funkerman feat ida corr unconditional love
-1	i like game night at ida dorm
-1	got a free ticket from ida hawk fuck yeah
-1	them nights where you have work in the morning but you re randomly up in your feelings ugggh
-1	cameron highland https t co 5z0vaqbp6r
-1	day 6 wearing khimar alila https t co ugqabdlxmo
-1	rt onedirection_id 1didinfo louis interview with the sun about his own record label 78 productions limited backed by sony http t c
-1	discussion section with miss ida amal from indonesia berkebun scienceicon ls sgu indonesiaberkebun http t co rdzvjdywur
-1	rt exoffical official 150417 exo l website update staff diary exo http t co pg4x7a6nr0 http t co mi1m4peao3 http t co 9no0oxcc
-1	rt exo_fanbase official 150418 mbc fm4u blue night website update exo http t co cejlz8aj0x http t co txhcwgzuyi
-1	passionhotforyou passionhotforyou 30 girls age 30 height 156 weight 52 hair colour http t co oggehx5a2d webcams naked_cams
-1	blondebeautyx blondebeautyx 26 girls age 26 height 172 weight 50 hair colour fair hair http t co dvlo4xq142 webcams naked_cams
-1	sexymarie sexymarie 45 ladies age 45 height 170 weight 56 hair colour chestnut eye http t co jk9nn2uw4s webcams naked_cams
-1	tyrafox tyrafox 21 girls age 21 height 168 weight 52 hair colour black eye colour http t co aubkgswvyy webcams naked_cams
-1	hottiexambra hottiexambra 26 girls age 26 height 167 weight 52 hair colour black eye http t co 5jl20mcllo webcams naked_cams
-1	amandaforu amandaforu 21 girls age 21 height 169 weight 52 hair colour fair hair eye http t co 7bcojg3stb webcams naked_cams
-1	hotlexxy hotlexxy 26 girls age 26 height 170 weight 50 hair colour fair hair eye http t co fyz238g0qi webcams naked_cams
-1	rt foreveranisz rude person will always be rude make me hate you more and more everyday
-1	with ida vania and 15 others pic https t co cvdxqqwkyo
-1	ida bout all dat https t co 9vcenukpt2
-1	usa the uk s number one adult bbw site welcomes wyatt from ida grove 51445
-1	rt 5sosupdateslive gonna move to australia and go to cool room all the time so i can party with the boys ida celebrityawards2015 5 sec
-1	triple dating love my bffs https t co ymhuhhofwq
-1	rt 5sosupdateslive dropdead s ig post about calum ida http t co 2mxhru0qvl
-1	so goooood morrnninng
-1	rt marisa_herrera ohio no more annual deer massacres in defense of animals https t co xuovj5pcaf
-1	rt marisa_herrera retire ruth the elephant at the buttonwood zoo in new bedford massachusetts in defense of animals https t co qg
-1	rt minelede d b family miraniad alee_aleman edur75 ida_aurora loremgcastillo lolysdiaz erikadiazd carmenmaraespin http t co
-1	rt minelede d b family miraniad alee_aleman edur75 ida_aurora loremgcastillo lolysdiaz erikadiazd carmenmaraespin http t co
-1	rt edjorgeprats i watch therefore i am seven movies that teach us key philosophy lessons http t co 2tqouup9tz
-1	rt minelede d b family miraniad alee_aleman edur75 ida_aurora loremgcastillo lolysdiaz erikadiazd carmenmaraespin http t co
-1	rt minelede d b family miraniad alee_aleman edur75 ida_aurora loremgcastillo lolysdiaz erikadiazd carmenmaraespin http t co
-1	d b family miraniad alee_aleman edur75 ida_aurora loremgcastillo lolysdiaz erikadiazd carmenmaraespin http t co ymgdube2ho
-1	http t co ycjl0wzplc films philosophy cool conceptual theory of a film lover perspective
-1	if this wasn t the number on all my business cards ida burn this chip
-1	morniiing
-1	what the fuck are me and ida doing
-1	womenon20s dancingavocado alice paul and harriet tubman were my top picks ida b wells also
-1	zacharyvenegas cant wait to catch up with you at the baton rouge dance makers convention i was the studio manager for ida
-1	rt decodingdyssc courtesy ida ga http t co x4peprihdl
-1	if you paid to be here could you please watch the band and not your s o pls and thank you
-1	rt 5sosupdateslive this edit is making me weak ida celebrityawards2015 5 seconds of summer http t co e34ru9vl35
-1	there is a tall couple making out in front of me icantbelievemyeyes barf thingsihate
-1	rt 100musiclove idalafontaine ida lafontaine shut up and kiss me set to release on april 20 http t co gt89jt9l1d http t co vp2fi
-1	80s 90s dance i need to embrace the scrunchy mountida mount ida college https t co n7vqe3yysu
-1	enhancing pleasure and orgasm during vaginal intercourse with sex toys http t co wysunimbde
-1	aliengrrri womenon20s alice paul should ve been on the 20 or ida b wells lucy burns women s rights suffragists
-1	online now missrenatta http t co gih8emydhu free sex chat sex
-1	rt carmenmaraespin miraniad minelede alee_aleman edur75 ida_aurora loremgcastillo lolysdiaz luciacampos169 edithgonz1964 erikad
-1	dejantubic cant wait to catch up with you at the baton rouge dance makers convention miss cali and ida so much hope you are well
-1	rt intldyslexia the ida took over times square last week in case you missed it here s the youtube video special thanks to all http
-1	rt intldyslexia the ida s annual conference for 2015 has been set for october 28 31 in grapevine texas book early last year http
-1	yes to doing all these free online things from home http t co 5kqtqvsu2q
-1	must watch one last chance to catch paul walker in his latest and final movie http t co 3e7fqrgycl
-1	congratulations to creative exchange member paul moore who has just received an ida individual disabled artist http t co pjsohub28p
-1	rt lordveronii ashly and ida be having me dead rollin
-1	rt worldofcocacola happiness is learning something new every day rt if you agree
-1	rt 5sosupdateslive this edit is making me weak ida celebrityawards2015 5 seconds of summer http t co e34ru9vl35
-1	current regrets wearing heels
-1	cherrycream69 cherrycream69 19 fetish female age 19 height 165 weight 55 hair colour http t co blutrjzswo webcams naked_cams
-1	dommelisa dommelisa 34 fetish female age 34 height 175 weight 60 hair colour black eye http t co ncvrkifraq webcams naked_cams
-1	tessglory tessglory 25 girls age 25 height 165 weight 50 hair colour fair hair eye http t co cpclxlcwei webcams naked_cams
-1	taylorsollange taylorsollange 24 girls age 24 height 167 weight 50 hair colour black http t co p53abd2aev webcams naked_cams
-1	mattforelise mattforelise 28 couples age 28 height 167 weight 53 hair colour chestnut http t co 1m6gazputo webcams naked_cams
-1	jossetemilf jossetemilf 44 mature female age 44 height 174 weight 68 hair colour black http t co mcfevod7cj webcams naked_cams
-1	meganie meganie 20 girls age 20 height 166 weight 45 hair colour fair hair eye colour http t co ejktppmzzx webcams naked_cams
-1	ofeliahot ofeliahot 18 girls age 18 height 162 weight 45 hair colour russet red hair http t co y7ejizgmiq webcams naked_cams
-1	maagda maagda 30 girls age 30 height 160 weight 50 hair colour russet red hair eye http t co 53wtsufiv1 webcams naked_cams
-1	amorettax amorettax 19 girls age 19 height 170 weight 50 hair colour fair hair eye http t co a87urgmg11 webcams naked_cams
-1	rt freakingtrue what did i just read http t co cjxjlfa27s
-1	sm_youth ida bdbndsmdk
-1	beautiful world blasterjaxx amp dbstf
-1	free anal sexshow bigtitss http t co dcrqygetax is live now nsfw
-1	4 people followed me automatically checked by http t co 3zbhdafgs5
-1	the ida nuryati daily is out http t co zcxaptrk3h stories via lenovo_id blendernation apk_file
-1	no more annualdeermassacres in ohio scottzody killorders indefenseofanimals savewildlife urbandeerrescue https t co iim4jwhidz
-1	oliviareed1752 ida did lose to summerfield in track soooo
-1	ashly and ida be having me dead rollin
-1	urrrka_88 tell ida quit creeping facebook she activates and deactivates it every day
-1	this weather has just been bullying me anyhow i get over my hay fever amp now i have a disgusting cold
-1	rt emrgencykittens big cats like bubbles http t co m4jg4ljrdv
-1	free anal sexshow secrettbela http t co sm3upra0ya is live now nsfw
-1	haphaphap with qisty and ida at fitness center rsui kustati surakarta https t co mviyec6dee
-1	elephant spotlight saveruth buttonwoodzoo captivitykills sanctuaryforelephants rescueruth indefenseofanimals https t co fp43rnpcpb
-1	rt koreanindo 3 mei 2015 super show 6 super junior world tour in jakarta promoted by synergism_ent http t co o8n5lxsgrg
-1	forget about nus or ntu go for mumbai university background story ida says mumbai university is a reputable http t co 00le86md26
-1	forget about nus or ntu go for mumbai university background story ida says mumbai university is a reputable http t co jbl0dohmmz
-1	rt robbiepoet autumn flight ida rentoul outhwaite http t co chwejdy3it
-1	rt edjorgeprats i watch therefore i am seven movies that teach us key philosophy lessons http t co 2tqouup9tz
-1	rt babyanimalpics just casually swimming with a lion http t co shs9yeelvg
-1	free adult sexcam passionhotforyou http t co gv2ycdg0nb live now webcam
-1	ida watched that rt drudge_report sony leak james carville s judge judy style show pilot http t co h07ilur1q6
-1	rt 100musiclove idalafontaine ida lafontaine shut up and kiss me set to release on april 20 http t co gt89jt9l1d http t co vp2fi
-1	walk the moon just opened with circle of life from the lion king
-1	i love theory ida b wells barnett audre lorde bell hooks bourdieu martineau addams cornel west
-1	rt bigmanceo girlposts when everyone randomly starts roasting you in a group chat http t co eo3bbfwzsb
-1	ida kicked some summerfield booty tonight
-1	twitch plays ida is almost equivalent to the last 3h of 24h static re
-1	idalafontaine ida lafontaine shut up and kiss me set to release on april 20 http t co gt89jt9l1d http t co vp2fivfiev
-1	rt ogtreez na why these niggas look like they fina rob the weenie hut general http t co 0hzxoyve8y
-1	one person followed me automatically checked by http t co 7a87ogul0k
-1	dispute over officer s text messages wraps up second week in the trial of cleveland police officer michael brelo http t co acyammmcey
-1	oldcitywes stopholusprime a guy ive played bball w for a long time that ida never thought was even a jags fan i saw wearin one last year
-1	ottawa get up wake up get your asses together
-1	rt ultrascanhumint ripped off by online romance scams could be funding deadly nigerian terror group boko haram linked to al qa ida http
-1	rt 5sosupdateslive gonna move to australia and go to cool room all the time so i can party with the boys ida celebrityawards2015 5 sec
-1	oliveriot great seeing ida from weyn upheavalmedia at techweekdet inspiring lady http t co gktes0txma
-1	rt missyknowles_ rahh real savage https t co w9ow5rz7dm
-1	griz stop trippin with ida hawk http t co qoxca00sxk via youtube
-1	since ida thinks mumbai university is a super solid university shouldn t it walk the talk by starting to offer http t co v59vi47rez
-1	rt mooniiquue_ idaamariee ida for president
-1	and that is how u slay ur haters go ida
-1	officially committed to mount ida
-1	for the next nine days i get to wake up and not think about school
-1	sahrulnaim betul
-1	rt king_lowkz hate when i can t sleep bare over thinking and shit
-1	rt ohteenquotes i need a morkie puppy http t co a8azz3pnup
-1	baby you re the best thing that s ever been mine
-1	oneangelface oneangelface 36 ladies age 36 height 170 weight 55 hair colour chestnut http t co pv2led5ien webcams naked_cams
-1	naughtyfetish naughtyfetish 22 fetish female age 22 height 91 weight 45 hair colour http t co vtsyirrwlk webcams naked_cams
-1	sexyhottigress sexyhottigress 20 fetish female age 20 height 165 weight 51 hair colour http t co je0scrmnqg webcams naked_cams
-1	maitressegeorgette maitressegeorgette 45 fetish female age 45 height 170 weight 45 hair http t co o8vkpyzisv webcams naked_cams
-1	amorettax amorettax 19 girls age 19 height 170 weight 50 hair colour fair hair eye http t co pzvqwqm003 webcams naked_cams
-1	sexyblondemadison sexyblondemadison 19 girls age 19 height 160 weight 45 hair colour http t co qshsrm6xzn webcams naked_cams
-1	paradishumide paradishumide 25 girls age 25 height 171 weight 50 hair colour russet red http t co pvgkraqctt webcams naked_cams
-1	did oba akiolu s threat work for ambode yes and no http t co h53jacjohw
-1	gotta cast a wider net
-1	rt ultrascanhumint ripped off by online romance scams could be funding deadly nigerian terror group boko haram linked to al qa ida http
-1	dear_brittney they re probs jealous
-1	nowplaying tonight i m your dj discotek extended remix ida corr amp fatman scoop http t co v5rftmyttt
-1	historic mount ida goes up for sale for 2 995m http t co ras9ufd1sl
-1	ameenzikril wekk hahaha okey thnksss cmne form 6 ok x
-1	slp homealone
-1	ida_norliana hahahah this is my id ameen1996
-1	courtesy ida ga http t co x4peprihdl
-1	rt haydee_gru18 amen miraniad vianeyvaldez46 ida_aurora katychoto luciacampos169 espinalg25 alee_aleman bettypadillamtz http t
-1	ripped off by online romance scams could be funding deadly nigerian terror group boko haram linked to al qa ida http t co 7qqfqiqwj1
-1	ida we don t care about riri my aunt is more relevant
-1	rt haydee_gru18 amen miraniad vianeyvaldez46 ida_aurora katychoto luciacampos169 espinalg25 alee_aleman bettypadillamtz http t
-1	hang so over bye
-1	rare antique victorian 1890 large ida waugh lithograph baby child http t co hpws6sgvvt http t co 5s8bqfikzu
-1	rt aando_realtors lola24k bonusbanque lsdpgn makeoverbyida gq45 meldatingevents ericlekuwa afterartescapes ida 24 karat is here
-1	rt haydee_gru18 amen miraniad vianeyvaldez46 ida_aurora katychoto luciacampos169 espinalg25 alee_aleman bettypadillamtz http t
-1	straight a ida is on thin ice up provision a openhanded los angeles earnest bonds movement sgwahz
-1	i m ready to blood donor pmi_dki_jakarta http t co mh1iydnws3
-1	rt haydee_gru18 amen miraniad vianeyvaldez46 ida_aurora katychoto luciacampos169 espinalg25 alee_aleman bettypadillamtz http t
-1	amen miraniad vianeyvaldez46 ida_aurora katychoto luciacampos169 espinalg25 alee_aleman bettypadillamtz http t co q0exiax8st
-1	rt garypalmersheim summer is calling have you booked your stay on beautiful lake ida yet http t co gud1dn0rut
-1	hi ida_sawyer we invite you to follow our community promoting world topics and connecting people http t co r5fesmwgio
-1	fcblda but ida you love zayn come on try it not even a little bit
-1	ida says i m closing this bitch down if anybody comes in tell them i m crying in the back
-1	therotomfactor oh ida killed the nigga but the talent needed to pull that off was fucking beautiful
-1	summer is calling have you booked your stay on beautiful lake ida yet http t co gud1dn0rut
-1	rt arasy2105 leeminho flashback 20130418 logo http t co ycp2qkzflt
-1	ohmanohmanohman if you can make it to a wethegriswolds show gogogogogo
-1	rt vianeyvaldez46 miraniad haydee_gru18 ida_aurora katychoto luciacampos169 amen http t co uonobtlct8
-1	a toast to you and all your friends
-1	ida i can talk about everybody can t get on me
-1	ida corr let me think about it nowplaying on http t co ehurnjbyp3 onair
-1	i always show what i wear to work this is what my husband wears to work whoworeitbest https t co jrzqe91hvn
-1	ainaa_athirah15 astro ke x
-1	rt carmenmaraespin miraniad minelede alee_aleman edur75 ida_aurora loremgcastillo lolysdiaz luciacampos169 edithgonz1964 erikad
-1	ida b wells on wikipedia share as image is very cool https t co uvwhq5on2w http t co qw8lzswppj
-1	must blame ida
-1	yay bone fractures sarcasm
-1	ida_masley followed back
-1	assenya assenya 20 girls age 20 height 0 weight 0 hair colour eye colour measurements http t co z5f8g7frli webcams naked_cams
-1	naughtyfetish naughtyfetish 22 fetish female age 22 height 91 weight 45 hair colour http t co wuc3vvgtc5 webcams naked_cams
-1	meganie meganie 20 girls age 20 height 166 weight 45 hair colour fair hair eye colour http t co hnr4vprgbs webcams naked_cams
-1	bodaciousxgirl bodaciousxgirl 30 mature female age 30 height 178 weight 53 hair colour http t co 4fcciyt6zj webcams naked_cams
-1	ofeliahot ofeliahot 18 girls age 18 height 162 weight 45 hair colour russet red hair http t co 27lepsuup2 webcams naked_cams
-1	sexinthepussy sexinthepussy 41 ladies age 41 height 172 weight 59 hair colour black eye http t co ils6knorfm webcams naked_cams
-1	lollyxpink lollyxpink 21 girls age 21 height 0 weight 0 hair colour eye colour http t co dd5pazogse webcams naked_cams
-1	ramone ramone 22 girls age 22 height 173 weight 50 hair colour black eye colour green http t co qkixcdvsdi webcams naked_cams
-1	celinedomme celinedomme 24 fetish female age 24 height 170 weight 55 hair colour fair http t co y3bcndd3jy webcams naked_cams
-1	lola24k bonusbanque lsdpgn makeoverbyida gq45 meldatingevents ericlekuwa afterartescapes ida 24 karat is here play it cool
-1	rt vianeyvaldez46 miraniad haydee_gru18 ida_aurora katychoto luciacampos169 amen http t co uonobtlct8
-1	spring break
-1	lowtheband remember the low secret stars ida show in nyc angel orensanz i have the setlist but we arrived the minute you finished
-1	yeah whatever ida lol
-1	kind of hard not to fall in love with that tbh
-1	nice transition from live this nightmare to mississippi
-1	judge dismisses new paltz lawsuit against ida citing earlier ruling in town s favor http t co mw1ocuud1c http t co 9ijs6p1lxg
-1	rt i0n1c making sure that ida python scripts from our training work with the ios84beta kernel binaries http t co f6ohogot6w
-1	training the power of value with ida anita and 2 others at menara peninsula hotel jakarta https t co fspvsr9dbt
-1	today stats one follower no unfollowers via http t co 79puf2mw1p
-1	rt maycee1d98 dj ida fuck boy deejaydakiddo
-1	looks for vans to wear at prom ida you re going to wear vans at prom why not flats me vans are flat ida you re so gay
-1	we belong we are young and we are free
-1	ainebip lol ida been sleeping ages ago if i was you gg yeh the wedding ringer it s got that funny black guy in it
-1	rt droneconf we re proud to have ida ireland idaireland joining us in santa cruz may 1 3 http t co izebyfu4dt droneconf whyirelan
-1	qa ida terrorist operations planner who was intimately involved in planning both the u p 93 http t co 6qeiqvxt3c
-1	rt dory immigrants don t steal your jobs they go out and get jobs while you re sitting on your sofa thinking you re too good for the world
-1	rt babyanimalpics when someone plays with my hair http t co y5daveplsf
-1	rt 5sosupdateslive calum with his mum s friend recently ida celebrityawards2015 5 seconds of summer http t co fx8rx70oaa
-1	rt 5sosupdateslive calum with his mum s friend recently ida celebrityawards2015 5 seconds of summer http t co fx8rx70oaa
-1	if you wanna stay only forever
-1	i m sketcher at wisma pln bedugul https t co yuvdsnmsqd
-1	theres enough room for all of yall skinny fat tall belive me ida seen it all
-1	mmmmm this wethegriswolds set is starting off on track
-1	breakfast familywekeend with ida fiji and 2 others at restareakm19 https t co s0jhg8xg8c
-1	today stats one follower no unfollowers via http t co rkpaukpbsw
-1	dd takes over nashville having fun at southeastern ida conference http t co lnsigjkwiq
-1	way ida networking chemical closet proffer aid yours holding company ickdnhcrq http t co v27yvuze3a
-1	dd tn co founder julyajohnson at ida conference in nashville with bluegrass star emi sunshine http t co kpbd5jtmcy
-1	nowplaying ida maria cold blooded on http t co wfzd1mfksz wsciradio
-1	online now foxyforu69 http t co laqtayqlhk free sex chat sex
-1	rt carmenmaraespin miraniad minelede alee_aleman edur75 ida_aurora loremgcastillo lolysdiaz luciacampos169 edithgonz1964 erikad
-1	online now babesquirtalot http t co fhu0hu2rkz free sex chat sex
-1	rt help retireruthnow idausa elephant campaign http t co qqerri2xqw video http t co ghctwzql4s event http t co fzt4weyx5p
-1	1kinkybrunette 1kinkybrunette 38 mature female age 38 height 170 weight 60 hair colour http t co g0hk2qfvb1 webcams naked_cams
-1	hornyjoybb hornyjoybb 31 girls age 31 height 170 weight 50 hair colour chestnut eye http t co 8tdzj97j09 webcams naked_cams
-1	seductivemelissa seductivemelissa 21 girls age 21 height 165 weight 55 hair colour http t co mabwv7hlzk webcams naked_cams
-1	naturallysexy naturallysexy 21 girls age 21 height 173 weight 57 hair colour black eye http t co qvy9ulsonh webcams naked_cams
-1	fabulousnsexy fabulousnsexy 19 girls age 19 height 170 weight 50 hair colour chestnut http t co hmgukbl3lv webcams naked_cams
-1	alexatoosexy alexatoosexy 39 ladies age 39 height 165 weight 55 hair colour black eye http t co gi9xayoqhk webcams naked_cams
-1	debyanry debyanry 19 girls age 19 height 170 weight 50 hair colour fair hair eye http t co hgjfbexqa4 webcams naked_cams
-1	hairdress test ida lupino the hard way 1943 https t co tdn4aqjqhe
-1	why now ida done whatever you wanted this winter
-1	rt adirarara sayang aurat tu this type of man is the type that i ve wanted my whole life amp thanks for existing
-1	rt zerosoldij premier colorectal surgery unit in singapore http t co rtareritww
-1	rt faithfug today all donations to stanford university will be matched dollar for dollar with http t co ubrbgix7cd
-1	bismillah with ugie yatim and ida at ilovetamanmini pic https t co a8l1m1obaz
-1	funnyjoke some people never go crazy what truly horrible lives they must live charles bukowski lt 3 ida m pan lt 3
-1	early morning at ida
-1	songs poems payeen to a twang derrida ore ida potato if you dared i d ask you to go dig up your ides under brown tubered 1 2
-1	see you again wizkhalifa ft charlieputh
-1	ida_67425 needs some e s ida d
-1	rt yuliluvstroyler when someone criticizes me for reading to much of kali s or ida s smut http t co mry5rnhy1l
-1	see ida been mad
-1	ida_67425 for 20 minutes and then hold again
-1	wnjr web stream http t co jb6ahli7ue right this minute great instrumental jazz from the film ida
-1	daddyvondoom what what no no what omg ida omg i m speechless
-1	rt b1lisab kristinmatzkane intldyslexia lynpollard jeniferkastenaz dyslexia front amp center in the big apple really amazing ida rock
-1	read italianonline http t co 4tm1k59i6u
-1	met bluegrass singer emi sunshine at southeastern ida conference in nashville julyajohnson http t co dbwjrkc9pr
-1	men s team results 1 summerfied 146 2 ida 144 3 clinton 115 4 blissfield 58 5 britton deerfield 36 6 foley 24 7 whiteford 10
-1	i want a nike
-1	at the southeastern ida conference in nashville http t co adwyxkvst9
-1	rt 5sosupdateslive gonna move to australia and go to cool room all the time so i can party with the boys ida celebrityawards2015 5 sec
