-1	fangirling feeeeeeelsssss thank you so much tita ida for this amazing gift merch pasalubong fresh https t co jbp26rcmbj
-1	rt biuestskies i won tickets to the 5sos show so it works http t co ibj5yeklqy
-1	ye5_ju5t1n adam amp ida was life and sasha slayed pretty hard too evilest set i saw was digweed
-1	a winchester rifle should have a place of honor in every black home ida b wells http t co z6ph1sxtyl
-1	rt lotsoflovelou silent tear http t co 9qs2wgxpwp
-1	rt nouirryy true fans aren t those who ve been here the longest but those who support and stays for them till the very end i salute you
-1	rt 5sosupdateslive this edit is making me weak ida celebrityawards2015 5 seconds of summer http t co e34ru9vl35
-1	rt 5sosupdateslive this edit is making me weak ida celebrityawards2015 5 seconds of summer http t co e34ru9vl35
-1	rt lhship they re special http t co ehnkgh3aje
-1	rt 1dstumblr harry panning his tweet about niall s fall like http t co y2cioyf7wc
-1	elephant spotlight http t co d49uvopggp http t co hqkvp6xnxc
-1	rt all1dfacts fablousfour louis bought back preston i seriously have so much respect amp love for louis atm i cant describe http t
-1	rt biondeart i love life http t co msr37tylck
-1	it s been a long day
-1	ida anti fur literature to order for campaigns http t co np5d8dokzv furfreefriday
-1	so tired
-1	rt clevelanddotcom rt ida_in_cle cleveland officer brelo s weapon traces to 49 shell casings at 2012 shooting scene
-1	nb song came on tv i almost throw up managed to control tho
-1	juicychaquore boldenuf_2doit ida been the first person there
-1	rt dagmaraguy i watch therefore i am seven movies that teach us key philosophy lessons http t co wy0cgrrsba
-1	rt kategoertzen nutrition should be central to sdgs says meera shekar wbg_health and good to think about how ida fits into financing t
-1	prumeru ida a mar shaka 7 simana di vida first trip to the beach shaka 7 weeks old http t co lut2c9enbx
-1	prumeru ida a mar shaka 7 simana di vida first trip to the beach shaka 7 weeks old http t co v515hrujog
-1	prumeru ida a mar shaka 7 simana di vida first trip to the beach shaka 7 weeks old http t co u5tkn1e0n8
-1	prumeru ida a mar shaka 7 simana di vida first trip to the beach shaka 7 weeks old http t co 7t3di5eyce
-1	shemale melaniets live live chat http t co ywrm9ryzga http t co ulapennrcn
-1	i watch therefore i am seven movies that teach us key philosophy lessons http t co k3ac09cqpf
-1	rt 5sosupdateslive this edit is making me weak ida celebrityawards2015 5 seconds of summer http t co e34ru9vl35
-1	nutrition should be central to sdgs says meera shekar wbg_health and good to think about how ida fits into financing that agenda agree
-1	rt nfldnewskevin a profile of an author w ties to northfield amp carletoncollege her book on ida b wells is out now on ugapress http
-1	rt lovemykaylor omfg http t co jqlmke9zib
-1	rt omglnsanetweets if you don t come home and immediately either take off your pants or change into pyjamas then i m sorry but you re liv
-1	rt sodamntrue does anyone else dream of their future dogs instead of their future family or is it just me
-1	ohh she looks so cute and grown up https t co fek0lklaia
-1	we didn t get in anymore but it was great fun watching the snowden livestream with ida at caf bagnoli ijf15 http t co 28jsxynxqb
-1	she looks happy as never before and hot af her boobs looks good she is truly happy and incredibly amazing i love her
-1	ida byrd hill upheavalmedia of uplift uplift is up now techweekdet
-1	rt ida_in_cle cleveland officer brelo s weapon traces to 49 shell casings at 2012 shooting scene http t co 5rqqnssyuu
-1	i watch therefore i am seven movies that teach us key philosophy lessons http t co eoay0a4hgs
-1	the fact that people even make a big deal about selena s body is embarrassing okey so maybe she gained a little but who the f cares
-1	cleveland officer michael brelo s weapon traces to 49 shell casings at 2012 shooting scene expert testifies http t co pp5e8jwxz5
-1	rt theehsbearcat forensics state qualifiers jessie amp janae ida allie amp jose ida janae and audra duet
-1	rt its_north_west khloe kardashian is fat can i be fat too pls http t co noznp9ndne
-1	zayn
-1	rt islayyou the fact that selena went out in a bikini again proves that she doesn t give a fuck about your opinion about her body
-1	meryl streep ida lupino julia roberts lena horne and hattie mcdaniel the first african american to ever win an oscar all women i adore
-1	curlsbringgurls yay for christmas in april
-1	rt curlsbringgurls merry christmas reggie dog http t co yrlwvgm2w6
-1	rt lipstainzayn he disappears for a month then comes back like britney spears
-1	elephant spotlight in defense of animals https t co f8jfseromx
-1	rt britneyspears this video gives me chills avrillavigne so beautiful what you re doing for specialolympics watch fly here http t
-1	rt avrillavigne thanks britneyspears i m glad you like my video for fly xo lots of love
-1	rt selenator_selg i love seeing selena s real smile she s not faking it she s truly happy and i m loving it http t co 2bxosptnyt
-1	rt honestfandom ariana s body is goals
-1	alianabella alianabella 44 ladies age 44 height 170 weight 50 hair colour black eye http t co wiwamundfc webcams naked_cams
-1	maagda maagda 30 girls age 30 height 160 weight 50 hair colour russet red hair eye http t co rg7orcm24u webcams naked_cams
-1	adelalive adelalive 20 girls age 20 height 172 weight 49 hair colour fair hair eye http t co 5abeb4wqng webcams naked_cams
-1	wendysquirtx wendysquirtx 28 girls age 28 height 170 weight 53 hair colour black eye http t co gsg8ynylc9 webcams naked_cams
-1	hotadelayde69 hotadelayde69 35 ladies age 35 height 167 weight 56 hair colour fair hair http t co aocqzxgvcb webcams naked_cams
-1	sweetdenise sweetdenise 29 girls age 29 height 175 weight 63 hair colour black eye http t co joyf9ba77k webcams naked_cams
-1	sensuelleanne sensuelleanne 30 girls age 30 height 160 weight 65 hair colour black eye http t co oje7pmlshf webcams naked_cams
-1	mistressiriss mistressiriss 25 fetish female age 25 height 169 weight 54 hair colour http t co x69trcvmy5 webcams naked_cams
-1	pinkyjenny pinkyjenny 24 girls age 24 height 165 weight 58 hair colour chestnut eye http t co cjyhtsrudz webcams naked_cams
-1	rheyyamartyn rheyyamartyn 19 girls age 19 height 172 weight 64 hair colour black eye http t co gjwapx464p webcams naked_cams
-1	rt loudedgunn not taking any risks http t co pcxbm4alzr
-1	rt dvdinfatuation originally the screenplay 4 this foreign film was written in english amp its title was sister of mercy http t co xh
-1	rt intldyslexia the ida s annual conference for 2015 has been set for october 28 31 in grapevine texas book early last year http
-1	rt lohanthony literally leaving for south america now it keeps slipping my mind that im going to ecuador my home country bring in the
-1	rt lohanthony hey from ecuador
-1	rt probchristian omfg http t co qz07tfucpx
-1	originally the screenplay 4 this foreign film was written in english amp its title was sister of mercy http t co xhxwf7s2cz
-1	rt timelessbieber if that s what society calls fat then i m out http t co 0tnyaug1jl
-1	rt freesexchatlive free anal sexshow maryex http t co 2lndgiveiz is live now nsfw
-1	rt gom3znerd omg madison liked http t co 105tlixa5m
-1	rt aleneart a few minutes late here s my cobaltturquoise fairy for colour_collective channelling ida rentoul outhwaite http t co
-1	rt sith_lordess quentin tarantino george lucas steven spielberg charlie chaplin ida lupino and orson welles all film makers that ch
-1	rt sleepilyhes zjmxhero holyhooran internetg0als fuck ida i dont have any words
-1	rt hoodauthority just how fast the night changes http t co qa5vjhmoia
-1	rt ziallhormones everyone was wondering how zayn was gonna style his hair no one thought that he would just go without
-1	rt factsofschool a collage of my daily facial expressions http t co cljokk255b
-1	rt jonaskrarup rasmuss representing foundersas and presenting dixie io at the insead entrepreneurship workshop ida dktech http t c
-1	rt zjmxhero holyhooran internetg0als sleepilyhes ida you made my day omg this is so cute i can t wait for tomorrow x
-1	rt factsofschool accurate http t co dtdtpdms3c
-1	rt factsofschool he is the type of guy you read about in math problems http t co hcd1u99rs1
-1	rt sleepilyhes zjmxhero holyhooran internetg0als fuck ida i dont have any words
-1	zjmxhero holyhooran internetg0als fuck ida i dont have any words
-1	rt cocainezayn mcxdaddy me vs you http t co wwqg0xkyic actually you re neither you re the loser behind a computer screen body sham
-1	rt jonaskrarup rasmuss representing foundersas and presenting dixie io at the insead entrepreneurship workshop ida dktech http t c
-1	rasmuss representing foundersas and presenting dixie io at the insead entrepreneurship workshop ida dktech http t co g6anedzgcu
-1	rt factsofschool current mood http t co cg8kgnqvto
-1	rt factsofschool how s life going for you http t co 40lykxpkle
-1	rt lifewithselg some people must be blind for real selena looks phenomenal and fortunately she knows it anyone s mean opinion is inval
-1	rt lifewithselg selena is such a role model to every girl out there we should all feel confident in our own skins and be proud of who we
-1	rt selenarusso adidasneolabel the queen working it http t co 5as4jbh722
-1	rt zjmxhero holyhooran internetg0als sleepilyhes ida you made my day omg this is so cute i can t wait for tomorrow x
-1	holyhooran internetg0als sleepilyhes ida you made my day omg this is so cute i can t wait for tomorrow x
-1	rt 5sosupdateslive this edit is making me weak ida celebrityawards2015 5 seconds of summer http t co e34ru9vl35
-1	rt 1dupdatesonline win an amazing trip to london with one direction https t co pdmldjlbpz
-1	the ida s annual conference for 2015 has been set for october 28 31 in grapevine texas book early last year http t co xgh8a0ndhp
-1	the screening of ida got canceled due to a lack of subtitles looks like i m catching up on other work this lunch
-1	hbcu money histronomics frederick douglass letter to ida b wells http t co xknjvecq3o
-1	rt blueeyeniall fockinglouis ok im crying http t co 7go6jwhag1
-1	elephant spotlight in defense of animals https t co mromzwvucr
-1	rt fastathome vysecurity mrexcessive plaidctf starts in 1h ida pro sharpened browser and nc warmed up food for 48h and sleepin
-1	this will not end well http t co tlqyglmhlj
-1	what hair just kidding https t co jwi2fiibbp
-1	rt aleneart a few minutes late here s my cobaltturquoise fairy for colour_collective channelling ida rentoul outhwaite http t co
-1	matz fruit barn ida red apple parfait buckwheat granola parsnip mousse apple jam by peter pietruniak foodcrush http t co nuvscfvxjh
-1	ida maria naked and stella https t co jdwom8giv3
-1	happy birthday to my grandma ida roseboro i love you and miss you so much continue to watch over me and your great grandson
-1	quentin tarantino george lucas steven spielberg charlie chaplin ida lupino and orson welles all film makers that changed my life
-1	honestfandom excuse me but hahaha wtf wonder who wrote this i honestly love his style but ok
-1	you re a real tough cookie with a long history of breaking little hearts like the one in me hitmewithyourbestshot
-1	rt nfldnewskevin a profile of an author w ties to northfield amp carletoncollege her book on ida b wells is out now on ugapress http
-1	rt lifewithselg loved how selena hit back to the haters body shaming her with this smoking hot shot amp the hashtag that shut them up http
-1	rt craicostyles zayn pulled a britney i should have seen it coming
-1	rt chenioves1d does it ever drive you crazy just how fast the night changes http t co rvy546uvgv
-1	rt aleneart a few minutes late here s my cobaltturquoise fairy for colour_collective channelling ida rentoul outhwaite http t co
-1	rt mbnationbb mt ida called expressing interest in nation 2016 sharpshooter zach mackinnon nationpride
-1	rt mbnationbb mt ida called expressing interest in nation 2016 sharpshooter zach mackinnon nationpride
-1	rt aleneart a few minutes late here s my cobaltturquoise fairy for colour_collective channelling ida rentoul outhwaite http t co
-1	rt mbnationbb mt ida called expressing interest in nation 2016 sharpshooter zach mackinnon nationpride
-1	vysecurity mrexcessive plaidctf starts in 1h ida pro sharpened browser and nc warmed up food for 48h and sleeping bag prepared
-1	sixfootstyles i love him so much ida
-1	live latin pornchat latinadream http t co nfyn7p0xo5 online now latino
-1	rt bangulo twins falls ida offensive lineman kole bailey lands first offer from nevada impressive junior film
-1	rt freesexchatlive transexual sexchat tsfountaincum http t co a4pmcjatbg is live now trans
-1	rt kriziatarantino ida and francesco scarcello original owners of st phillips bakery 1968 http t co vyipvf6egu
-1	ida lafontaine shut up and kiss me set to release on april 20 http t co xlamyudkdd
-1	a few minutes late here s my cobaltturquoise fairy for colour_collective channelling ida rentoul outhwaite http t co ktxktgrfuq
-1	ida will break a bitch
-1	they commented on tht video sayin ida s harmless buaha uhh naw
-1	mt ida called expressing interest in nation 2016 sharpshooter zach mackinnon nationpride
-1	had the strangest dream went to an antique mall show where a guy was selling the contents of ida lupino s apartment
-1	i watch therefore i am seven movies that teach us key philosophy lessons http t co 4fni6oo1jz film
-1	rt ellepuckett tryna get your attention like http t co nnl3xkgxk1
-1	adult webcam biannca http t co v4wnaxdkh9 is live now chat
-1	so mad ida got asked to prom the one day i wasn t in class
-1	np queen ida la bas two step 6music http t co lnxvakwqkt
-1	queen ida la bas two step http t co 4zrpkp1b50 nowplaying 6music
-1	rt dreamcha5er_ ling ling fucking ida hahaa
-1	hotmatrioshka hotmatrioshka 22 girls age 22 height 0 weight 0 hair colour eye colour http t co pbwspbqs8t webcams naked_cams
-1	linahoney linahoney 19 girls age 19 height 160 weight 50 hair colour brown hair eye http t co xlbtw1cfwh webcams naked_cams
-1	kanti kanti 22 girls age 22 height 170 weight 50 hair colour black eye colour chestnut http t co byumxhukri webcams naked_cams
-1	fuckfessegodefontain fuckfessegodefontain 38 ladies age 38 height 168 weight 50 hair http t co xjswb27lad webcams naked_cams
-1	lilyflores lilyflores 28 mature female age 28 height 170 weight 53 hair colour black http t co gpkynuzrw5 webcams naked_cams
-1	gracemature gracemature 51 mature female age 51 height 163 weight 62 hair colour black http t co thnnqy5jqs webcams naked_cams
-1	aneris aneris 22 girls age 22 height 169 weight 48 hair colour black eye colour black http t co chcxhajxkv webcams naked_cams
-1	coolpussy coolpussy 26 girls age 26 height 155 weight 44 hair colour black eye colour http t co eyvvdtznvb webcams naked_cams
-1	tonamoure tonamoure 25 girls age 25 height 165 weight 50 hair colour brown hair eye http t co vy1zo10lml webcams naked_cams
-1	rt 5sosupdateslive ashton with some family ida celebrityawards2015 5 seconds of summer http t co p0v83nciyb
-1	hotpoupeex hotpoupeex 43 ladies age 43 height 168 weight 55 hair colour black eye http t co h3xcqvaqmq webcams naked_cams
-1	rt 5sosupdateslive calum with a fan in sydney tonight ida celebrityawards2015 5 seconds of summer http t co jhomelguqx
-1	queen ida la bas two step http t co wdpnhdt1ma 6music nowplaying
-1	rt 5sosupdateslive this edit is making me weak ida celebrityawards2015 5 seconds of summer http t co e34ru9vl35
-1	rt mattifestation applying function prototypes to indirect calls https t co pcqpwytfx4 by fellow team members jay smith and _iphelix
-1	thanks to you ida ameelia
-1	rt mattifestation applying function prototypes to indirect calls https t co pcqpwytfx4 by fellow team members jay smith and _iphelix
-1	rt julesartvan and then asked ida thedailysketch postcardart http t co oxcd87jezd http t co y5cbowjgrg
-1	chennaiipl brilliant chase by csk dhajjia ida di macculum drsmith raina bravo ne mi ki awesome is short word sonymax eit20
-1	pole35147 geh und heirate ida
-1	i just got attacked by a wild turkey mean old bastard wish ida got it on snapchat fucker let me have it had to hit him w a stick
-1	la bas two step by queen ida http t co 3khkng1hry bbc radio6 np
-1	queen ida la bas two step nowplaying bbc6music
-1	queen ida la bas two step http t co bjrtet05bm nowplaying 6music
-1	la bas two step by queen ida nowplaying bbc6music
-1	la bas two step by queen ida http t co rrevobj4e5 nowplaying 6music
-1	sincerelytumbl so true
-1	craigperks it was nilo and ida all along the pair of bastards haha
-1	rt sincerelytumblr i wish my actual hair grew as fast at my leg hair
-1	now playing queen ida la bas two step queenida http t co wq9wvbg0ji
-1	jmstaats116 eastarwars game is going to be unreal ps google mount ida or hallett peak good hike options
-1	ff back likeworking andyatwn4u holisticpurp
-1	is ida setting a good example to singapore govt bodies and sinkies http t co bn7wnx8eay http t co vbrfp5y36x
-1	rt likeworking great peeps ff andyatwn4u holisticpurp ida_love94
-1	live now milagrace http t co ffifkcpato free videochat porn
-1	here http t co i2iddmseqi
-1	with jonathan thomas and ida at cheers cafe https t co jdexuxzu60
-1	ida_10 original trilogy hell yeah
-1	anogoraz httpstraub isacelliot ida loves him
-1	flare ida pro script series applying function prototypes to indirect calls http t co ipq6dfdgt6
-1	rt naughtybrent dying for some really poignant beautiful middle grade think keeper which i am actually rereading ida b rules m
-1	alexandria s historic mount ida goes on the real estate market http t co tsm7ohmknm alexandriava
-1	rt martaseilan golin_rg marcia_silva_m aliciagarciaga6 liause abril_hamdam kitty_sanrio1 ida_aurora claudia_1387 baldo0158 ff_s
-1	ida maria throw off your clothes everyone fridaynightjukebox https t co tttgcjauvj
-1	ida_icardwell women s engineering society is registered total giving donate direct to them http t co xuueixncn1
-1	spend a long time with pray and work fighting kak ida be a strong girl http t co wfyd3ydfda
-1	nice to see an ida county stop on the terrybranstad and kimreynoldsia 99countytour thanks for the time and effort kimtours99 iagov
-1	rt hypedupsneaks metallic red foams http t co jhmzco7yxw
-1	ida from http t co qw99qugvet melayu malay indo malaysia indonesia awek bogel muslim philippines dat http t co yuslile1vo
-1	respect fc vs fathletic club 1 parte ida youtube http t co 7cdfhd9rws
-1	energyyyyyy d and a big surprise for all of us dennis thomsen is here see you tomorrow urbhanizeeeeeee lt 3
-1	dilated to 5cm sharletta so unbothered bailey ida velma howard msmonica rob meka ms red anderson tina http t co iqt06br4dw
-1	now playing on greatest hits radio ida maria i like you so much better when you re naked http t co facu06tbqc 80s
-1	rt geniusfootball after the save hernandez walked up to me and asked how on earth that was even possible petrcech http t co 83or
-1	a profile of an author w ties to northfield amp carletoncollege her book on ida b wells is out now on ugapress http t co h1kxavflbs
-1	rt onemorejoke im always hungry
-1	rt scarlyh ida_aurora bettypadillamtz haydee_gru18 luciacampos169 daisyrodrguez espinalg25 miraniad alee_aleman katychoto amen
-1	playing at wild scallion in penticton tonite with great aunt ida show starts at 7 pm tonicrcrds jen_fritz markhaneybass
-1	rt colelai what issues should urban centers downtowns prepare for in the next few years last day to let ida know https t co fcijwb7
-1	stunninglady stunninglady 46 ladies age 46 height 172 weight 63 hair colour fair hair http t co 6xd96otv6x webcams naked_cams
-1	arctickiss arctickiss 19 girls age 19 height 169 weight 48 hair colour fair hair eye http t co pxvcgib22i webcams naked_cams
-1	angevanessa angevanessa 19 girls age 19 height 173 weight 50 hair colour chestnut eye http t co m2xihpcfnq webcams naked_cams
