-1	bellemystique bellemystique 29 girls age 29 height 155 weight 65 hair colour russet red http t co kka6i9oyvl webcams naked_cams
-1	lovedayana lovedayana 21 girls age 21 height 165 weight 56 hair colour chestnut eye http t co vyin6qgcud webcams naked_cams
-1	natashadivine natashadivine 27 girls age 27 height 168 weight 60 hair colour brown hair http t co fttxwqdosm webcams naked_cams
-1	hotlorinaonthebeach hotlorinaonthebeach 22 girls age 22 height 1 weight 70 hair colour http t co 7t0gh2jt05 webcams naked_cams
-1	kinkyhotfetish kinkyhotfetish 26 girls age 26 height 170 weight 55 hair colour black http t co zbjkizth2g webcams naked_cams
-1	lovellydya lovellydya 23 girls age 23 height 175 weight 50 hair colour brown hair eye http t co jfkcwgfjga webcams naked_cams
-1	colabaway rclbeauty101 video ida is some sort of prank olivia rocks diy or something related to makeup
-1	i m a bad influence on ida she no longer knows how to properly reject guys she doesn t wanna date smdh rip
-1	isabelwilkerson on my commute home i rode the same stretch of tracks as i read the passage where ida mae arrived haunting synchronicity
-1	finally home now i just wanna sleep
-1	ida ergonomics but the workplace it s not a leukorrhea pertinent to in consultation addition faultless xpboeouh
-1	null ida_setyowati18 followback yaa alicious
-1	rt ltwli442 les twins masterclass re cap ida hollywood http t co 3bhyrppanv
-1	rt kategoertzen nutrition should be central to sdgs says meera shekar wbg_health and good to think about how ida fits into financing t
-1	happy to be representing knox county schools at the ida conference http t co fwwuudfq4s
-1	win 1 of 5 100 amazon gift cards in the ore ida findyourbold at dinner time giveaway ends 4 25 javajohnz http t co lvjmvp05c8
-1	rt recipes___ today recipes nectarines cocktail http t co xd7cm1lksd nectarines cocktail recipes ancymonki http t co yerdlwkq
-1	ida anti fur literature to order for campaigns http t co fphu3ggh4y furfreefriday
-1	i watch therefore i am seven movies that teach us key philosophy lessons http t co lx9fwj8gff
-1	check this out truesoul true1248 adam beyer amp ida engberg you know truesoul http t co jhp8g5cvnr
-1	we team work big mall samarinda https t co 1l2qkxhfms
-1	rt sincerelytumblr should i wear all black or all black today
-1	just posted a photo https t co hii71p6dip
-1	westland 4 ua bears 5 top 4th 0 out 0 balls 0 strikes no one on p 14 ida kegley b 7 sturgell
-1	now on a33playdance dj lbr vs ida corr you got me open radio edit
-1	rt ellenreaction when you want to sleep during class http t co cggimynspl
-1	rt saharniki i love sunny days and warm weather
-1	ida_setyowati18 follback
-1	rt commonbandgirl plot twist i can afford to buy all the merch i want
-1	rt teresiyo leonesunsolocorazon rt go leones
-1	ireland is an ideal base of operations to do business with the members of the european union mcafee s mike decesare whyireland rsac
-1	man get chu ida here https t co kqvuvhy6hn
-1	rt muellertimo congo amnesty international issues a public statement on latest spree of arrests in drc https t co nyjsu33xab cc
-1	les twins masterclass re cap ida hollywood http t co 3bhyrppanv
-1	smells like ida
-1	nice one nysc newyorkcity pennstation nyc newyork manhattan stairs loseweightnow calories https t co iqklui41jd
-1	hahaha wena o ida tuduetsomoloi plomatic_101 hides ne ya fela then switched to southern comfort ya dumpi jaanon no more alcohol
-1	i m at geneva in narva ida viru county https t co p4q6pkyvpo
-1	rt relatablequote finals are next month http t co j0agfmxjmz
-1	rt shanitasam no dee fav solo rt please leonesunsolocorazon
-1	ad slick ida james romance on the beat 3598 16 http t co ch1sosp2mj http t co etfxewvp67
-1	ad slick ida james romance on the beat 3598 14 http t co zyhrbucvca http t co rauhto1rq2
-1	ida grove is a neat town
-1	rt miraniad bellas imgns ida_aurora katychoto luciacampos169 vianeyvaldez46 haydee_gru18 espinalg25 anafer3127 bndcns amgs http
-1	not feeling well
-1	rt lnsanetweets when bae lies to u but u have screenshots http t co kzwfpdqa6v
-1	patent ida rehabilitation cvwht
-1	rt lilkittten boys like i prefer less makeup ok so wear less makeup tf does that have to do with me
-1	roberta69 charming and aggressive at the same time i m very compatible hard working very appealing and have http t co xtwgod5xva
-1	free lesbian chat kinkyhotloversx http t co r8te2m3lg0 is online now
-1	veltri bought a versace ring a white sophomore in ida grove iowa meanwhile i have to pickpocket cheetos from lufts basement
-1	miraniad haydee_gru18 ida_aurora katychoto luciacampos169 amen http t co uonobtlct8
-1	missteacher missteacher 24 girls age 24 height 1 7 weight 52 hair colour fair hair eye http t co teujigj5cy webcams naked_cams
-1	taylorsollange taylorsollange 24 girls age 24 height 167 weight 50 hair colour black http t co xapubkph3d webcams naked_cams
-1	almahottie almahottie 25 girls age 25 height 0 weight 0 hair colour eye colour http t co nlv3zcek83 webcams naked_cams
-1	fannie fannie 39 ladies age 39 height 163 weight 48 hair colour chestnut eye colour http t co av907ubnht webcams naked_cams
-1	pinkprincesslove pinkprincesslove 29 girls age 29 height 150 weight 40 hair colour http t co sid6cuxtdx webcams naked_cams
-1	kittybeau kittybeau 45 ladies age 45 height 170 weight 55 hair colour black eye colour http t co u4of0svx1j webcams naked_cams
-1	missdana missdana 25 girls age 25 height 170 weight 54 hair colour chestnut eye colour http t co ogtxnvnfbh webcams naked_cams
-1	allynee allynee 37 ladies age 37 height 168 weight 65 hair colour black eye colour http t co wzfpunbae8 webcams naked_cams
-1	wildlife pls sign no more annual deer massacres in metroparks ohio hunting opfunkill littledicksclub https t co ylwxsmhbyq
-1	rt dvdinfatuation this 2013 film has no background score the only music present is what the characters themselves are listening to htt
-1	today stats one follower one unfollower via http t co iwbtqozttt
-1	westland 4 ua bears 1 top 3rd 0 out 0 balls 0 strikes no one on p 14 ida kegley b 10 hoy
-1	rt kieumii you don t understand how embarrassing it is to get involved with someone who doesn t know how to act after a breakup
-1	friday 4 17 6pm msilas23 7pm dangviet 8pm amountboykanec ida idahollywood
-1	pls sign relocate ruth the elephant from buttonwoodzoo in massachusetts wildlife boycottthezoo https t co lntfasckcb
-1	rt s_gabriela never forget leonesunsolocorazon http t co opauygm5bu
-1	rt henri_zuber miss ida nightingale cape of good hope h zuber 1865 drawing priv coll http t co q6hxtdghfe
-1	westland 4 ua bears 1 bottom 2nd 0 out 0 balls 0 strikes no one on p 00 spohn b 14 ida kegley
-1	rt decroorodney playing at wild scallion in penticton tonite with great aunt ida show starts at 7 pm tonicrcrds jen_fritz markhaneyb
-1	ida scott dies alone
-1	doctor just about to leave ida to die alone klaxon
-1	cwt u k airfares drop as clients clamp down on premium class travel business travel news http t co sbyf064z1s
-1	missidadown thanks ida
-1	rt martinez_elin crpd13 incl the basic right 2 education young people who haven t been to school sr_disability ida_crpd_forum http
-1	put a care package in a vs bag for wethegriswolds my mom didn t think it was as funny as i did
-1	rt lordveronii that moment ida family know my family
-1	ciuffysrise flare ida pro script series applying function prototypes to indirect calls http t co 8giaw9kgaz infosec cybersecurity
-1	rt vigilanteartist 1 vigilanteartist thanks ecmiami april 2015 top 100 twitter users http t co 7imupo1uct miami art twitter ht
-1	rt ismokethentweet the way to right wrongs is to turn the light of truth upon them ida b wells
-1	westland 3 ua bears 1 top 2nd 0 out 0 balls 0 strikes no one on p 14 ida kegley b 7 sturgell
-1	aendsleff why did they steal our thing xd https t co rx0ncwtenc
-1	http t co 4vnpbe6w6x spielte when love comes to town feat ida sand von torsten goods welovesmoothjazz nowplaying
-1	flare ida pro script series applying function prototypes to indirect calls http t co 2o4coytf0k infosec cybersecurity cybernews
-1	mariettagrace shoulda called ida brought you home
-1	that moment ida family know my family
-1	ida_wolter no problem
-1	rt radityadiiikan rencana tuhan pasti indah because allah always listening and always understanding
-1	mukesnugget thank you so much
-1	exhibited for the first time in our booth at aipad2015 are the works of carlotta corpron ida https t co 7uiofbwc9g
-1	sampepper already did 24 weeks
-1	rt lordveronii ida got me dead
-1	ida got me dead
-1	rt radityadiiikan i m fine because i m strong
-1	rt ahteennotes i think the perfect hugs are when someone hugs me without me asking
-1	rt alex_komulainen g nightya ll
-1	ida was such a poignant film
-1	rt isacelliot omg how many got up on stage they just pulled me out amazing you are the best http t co oafrcqperw
-1	rt ctmrecordings ida says its friday so it s time for techno irishbecks drumecode https t co d1clljjpn2
-1	dollykiara dollykiara 23 girls age 23 height 0 weight 0 hair colour eye colour http t co dln1kblbef webcams naked_cams
-1	jessydiaz jessydiaz 27 girls age 27 height 170 weight 60 hair colour black eye colour http t co 49htdut5ha webcams naked_cams
-1	yougotmeforever yougotmeforever 26 mature female age 26 height 172 weight 54 hair http t co eyddokmpgn webcams naked_cams
-1	gabriellafoxy gabriellafoxy 25 girls age 25 height 10 weight 65 hair colour black eye http t co dmokw4ofyv webcams naked_cams
-1	taylorjannett taylorjannett 21 girls age 21 height 55 weight 167 hair colour brown hair http t co uajyna3ipn webcams naked_cams
-1	priscillahotmature priscillahotmature 44 mature female age 44 height 173 weight 58 hair http t co l3p07qvxbp webcams naked_cams
-1	sexyblondemadison sexyblondemadison 19 girls age 19 height 160 weight 45 hair colour http t co 4bn6fpbamc webcams naked_cams
-1	flexiblerita flexiblerita 19 girls age 19 height 165 weight 50 hair colour black eye http t co qwu2x6bsum webcams naked_cams
-1	juicylizz juicylizz 21 girls age 21 height 160 weight 50 hair colour brown hair eye http t co dymlk9nbsq webcams naked_cams
-1	sexxdesire69 sexxdesire69 27 lesbians age 27 height 165 weight 60 hair colour brown http t co jspyyhyux9 webcams naked_cams
-1	rt isacelliot love it good night love my fans http t co 6m8ow0xbch
-1	rt sincerelytumblr fight for her http t co apwzwtlv9m
-1	idabarattaa fuck off ida
-1	seneca co ida seeking board members http t co bws52kubfu
-1	rt lnventlons solar powered usb charger http t co q4ai64ddff
-1	rt rickypdillon rickypdillon what i don t remember tweeting this i think i butt tweeted it
-1	rt missrebel17 rt si eres candylover leonesunsolocorazon
-1	https t co koujbymnaj is looking for a cyber security manager send resumes to resumes ida org
-1	rt rojasrodi_02 a rugir lions leonesunsolocorazon http t co c91hdcrig4
-1	ida_wolter from what ive heard others say who went to the concert it s this http t co tezevey2p1
-1	deals_uk shoes_kids http t co slzvu0tgsy new girls clarks ida heart first cruising shoes in cotton leather si http t co up8axd0xra
-1	the first 15 mins of adam vs ida at ultra really do give me life
-1	mukesnugget what is it
-1	rt 5sosworldalerts 5sosworldalerts i second this y all are fabulous and we love you marissa
-1	new alpine original usb to ipod conversion cable for ida x305 idax305 genuine http t co chta4e6cjz http t co 8e359hguuw
-1	rt diane_andrews10 rwandan and dutch students commemorate kwibuka21 in netherlands http t co 917uabivca kagame
-1	rt 5sosupdateslive this edit is making me weak ida celebrityawards2015 5 seconds of summer http t co e34ru9vl35
-1	rt 5sosworldalerts ooh this one is for julz marissa http t co roeu0kbbnb
-1	horny happy hour every friday at 3 00 pm cst to 6 00 pm cst beginning feb 27 thru apr 17 come join the fun as t http t co tjnyer6pjc
-1	rt sincerelytumblr it s a mark of maturity when someone hurts you and you try to understand them
-1	the way to right wrongs is to turn the light of truth upon them ida b wells
-1	it s been said before the buff ui needs to be fixed so i recently started using the convention of elements ring http t co hq4mc2ijr5
-1	wow make a lot of gold during children s week with a little preparation http t co ncppoyl6oq
-1	it s time for kindergarten registration our registration process will begin online this year parents please go http t co e7w46sulp9
-1	2nd grade field trip postponed til monday second grade s heifer project field trip has been rescheduled we http t co ubeizidhww
-1	rt asassywhale i love sarcastic people with large vocabularies
-1	rt itstumblrposts 6 things we say in school 1 i m tired 2 i m cold 3 i don t get it 4 i m hungry 5 what time is it 6 i
-1	goes outside looks at sun me make me tan
-1	new dividend announcements for april 16th bx cwl gs hiw ida jbl pbct ppg srv un swk http t co mtzodz3t5h
-1	rt morningsimon ida cannot do business as usual for sdgs says justinforsyth must leave no one behind and catalyse domestic resources
-1	i posted a new photo to facebook http t co gnc4wjucmg
-1	i posted a new photo to facebook http t co xzv83ba5x4
-1	ida__99 that was a good one lmao
-1	rt dvdinfatuation this 2013 film has no background score the only music present is what the characters themselves are listening to htt
-1	rt dvdinfatuation this 2013 film has no background score the only music present is what the characters themselves are listening to htt
-1	rt allkpop producer drops first poster with kim soo hyun gong hyo jin iu and cha tae hyun http t co yl3ckdwsj9 http t co seanyah
-1	alvinandcats at my parents house lol jk right infront of ida jew
-1	exalt pecs three companionway in consideration of guess flatcar other word for word pecs ida
-1	i can t wait to see marie ida and finja tomorrow omg i m soooooo excited ahhhh
-1	rt wviff kicking off our spring festival with some oscar winners ida best foreign language 6 30 amp citizenfour best doc 8 30 311
-1	this 2013 film has no background score the only music present is what the characters themselves are listening to http t co xhxwf7s2cz
-1	rt omglnsanetweets college is thousands of dollars but pizza is only like ten so what is the obvious choice here
-1	rt patrickhurley2 this sunday icalondon are welcoming ida director pawe pawlikowski to present two of his early documentaries q amp a htt
-1	the fact that i don t have to search for lookscreens anymore bc i ll meet marie ida and finja tomorrow and we ll take pics makes me happy
-1	analsweets analsweets 19 couples age 19 height 175 weight 79 hair colour chestnut eye http t co 6vzwwjashw webcams naked_cams
-1	treshumide treshumide 38 ladies age 38 height 160 weight 54 hair colour black eye http t co j3bipqcsvb webcams naked_cams
-1	gisellevip gisellevip 28 girls age 28 height 162 weight 50 hair colour black eye http t co d8k445rv6s webcams naked_cams
-1	sensualsarrah sensualsarrah 21 girls age 21 height 165 weight 50 hair colour black eye http t co ekazn07zzs webcams naked_cams
-1	liiaa liiaa 38 ladies age 38 height 57 weight 0 hair colour fair hair eye colour black http t co mxndnnffw3 webcams naked_cams
-1	sweetsex4u sweetsex4u 41 ladies age 41 height 165 weight 56 hair colour black eye http t co fzz0ojdn1w webcams naked_cams
-1	nympholinda nympholinda 27 girls age 27 height 165 weight 55 hair colour black eye http t co ioetbrq2lp webcams naked_cams
-1	ramone ramone 22 girls age 22 height 173 weight 50 hair colour black eye colour green http t co f5nheoi7y4 webcams naked_cams
-1	spicystarletbb spicystarletbb 25 girls age 25 height 170 weight 73 hair colour chestnut http t co dmyz2x8c2i webcams naked_cams
-1	annamirers annamirers 25 girls age 25 height 162 weight 52 hair colour black eye http t co kv1umg9k5l webcams naked_cams
-1	rt nutellaxhemmo is naughtyboy influencing zayn no he s doing what he wants http t co xfi8zbqjho
-1	thanks to everyone who came along to our screening of the fantastic ida tonight what a film see you all again soon
-1	rt 5sostumblrx 5sos baby calum just went to sleep haha lukey http t co brgxotfdmy can we talk about how luke is holding cal up wit
-1	rt michael5sos somebody help me with this counter strike case opening addiction
-1	rt jackmatthew ready for a new video rt my next tweet
-1	kicking off our spring festival with some oscar winners ida best foreign language 6 30 amp citizenfour best doc 8 30 311 d st so chas
-1	rt 5sosupdateslive this edit is making me weak ida celebrityawards2015 5 seconds of summer http t co e34ru9vl35
-1	rt lexkrasny i watch therefore i am seven movies that teach us key philosophy lessons http t co 7rpt8sy9bc
-1	macbby11 macbby11 underwarrior savetheundies love u it would mean alot if i won
-1	rt kaintuckeean ida lee willis award nominations are due to kyshpo i just saw a former winner at st thomas http t co xffjuscsod
-1	this nigga stepped his whooole foot on my shoe lastnight mane if ida had the whites ida killed buddy smh
-1	rt ctmrecordings ida says its friday so it s time for techno irishbecks drumecode https t co d1clljjpn2
-1	macbby11 macbby11 underwarrior savetheundies and i would love to have one my b day is in 6 days and im not only saying that
-1	benedict cumberbatch on his oscar nomination http t co asqvr8nvou health allergy http t co bjmtzuaznc
-1	idaaalind 100 ida you ll love it
-1	vw empi red pro street weber ida velocity stack covers http t co cd90wlqrcw http t co zaeskpgyrc
-1	rt kategoertzen nutrition should be central to sdgs says meera shekar wbg_health and good to think about how ida fits into financing t
-1	macbby11 macbby11 savetheundies underwarrior the only thing im missing is a polaroid i want to have one but my parents dont let me
-1	vw empi red pro street weber ida velocity stack covers http t co hrvjnb9d11 http t co l8s3uxbrvk
-1	rt 5sosworldalerts day 3 starts soon
-1	macbby11 macbby11 savetheundies underwarrior i always have floral things like you i just love perfumes that smell like flower
-1	rt 5sosworldalerts day 2 of trials done
-1	rt decroorodney playing at wild scallion in penticton tonite with great aunt ida show starts at 7 pm tonicrcrds jen_fritz markhaneyb
-1	vw empi red pro street weber ida velocity stack covers http t co 2e6gy7jvev http t co 2qnjbgsaxx
-1	rt 5sosupdateslive this edit is making me weak ida celebrityawards2015 5 seconds of summer http t co e34ru9vl35
-1	rt sodamntrue my parents are lucky i was too lazy to go through a rebellious phase
-1	rt grannywinkle rt if this picture turned you on http t co ciexvtprdm
-1	see you again
-1	thinking about starting a business in the hornell area the ida is a great place to start http t co wplawxhlry
-1	rt itstumblrposts don t talk act don t say show don t promise prove
-1	rt sincerelytumblr me deciding what to wear http t co fuwr0m3m3n
-1	rt greenenergynews farmer grows gigantic 33 pound turnip all is turnt in the world http t co iyryigsyuc green
-1	rt hypolytaviola elephant spotlight http t co d49uvopggp http t co hqkvp6xnxc
-1	im meeting marie ida and finja tomorrow im so excited and happy to see them finally
-1	rt btnonline cwt u k airfares drop as clients clamp down on premium class travel http t co 4sdfst80aj
-1	nowplaying ida corr vs fedde le grande let me think about it
-1	rt 9gag this will never not be funny http t co nhu6q0o6ti
-1	nvm glad thats over i think i m done with ida for 4 year is there any ida in 5th year
-1	ida well my anxiety builds up when that mic is catching up everything even my breath so got mixed up
-1	online now nathashaklauss http t co snyfcawc3v free sex chat sex
-1	rt btnonline cwt u k airfares drop as clients clamp down on premium class travel http t co 4sdfst80aj
-1	rt ctmrecordings ida says its friday so it s time for techno irishbecks drumecode https t co d1clljjpn2
-1	online now alexaasweet http t co za7f4spadh free sex chat sex
-1	rt aba_sumayah martyrdom of adel radi al habri after more then 10 years in jihad wanted by the saudi and the us governments may allah a
-1	disco volante by ida engberg is nowplaying in the cellar bar download it now at http t co g1pe0e0efs
-1	online now rubyhottx http t co 75ohmaafnb free sex chat sex
-1	rt enrique__f omfg i cant believe someone did this to my mirror wtf http t co dwgrjmyiuj
-1	daisylove daisylove 29 girls age 29 height 176 weight 68 hair colour fair hair eye http t co ysugseugqo webcams naked_cams
-1	paradishumide paradishumide 25 girls age 25 height 171 weight 50 hair colour russet red http t co ujzzrkieg6 webcams naked_cams
-1	hottyprincess69 hottyprincess69 22 girls age 22 height 165 weight 45 hair colour http t co cunfanmpjo webcams naked_cams
-1	morenalove morenalove 19 girls age 19 height 178 weight 56 hair colour black eye http t co eupbxrpfut webcams naked_cams
-1	senssuallelorene senssuallelorene 28 girls age 28 height 0 weight 0 hair colour eye http t co 8wkj1iddle webcams naked_cams
-1	matureanais matureanais 47 mature female age 47 height 168 weight 70 hair colour brown http t co ykr8heql1x webcams naked_cams
-1	sexysmileforyou sexysmileforyou 23 girls age 23 height 167 weight 55 hair colour black http t co 7pgkbl5ays webcams naked_cams
-1	plaisirlora plaisirlora 19 girls age 19 height 174 weight 57 hair colour chestnut eye http t co 7amormzucx webcams naked_cams
-1	babebrown babebrown 20 girls age 20 height 158 weight 58 hair colour black eye colour http t co 7hfxjmv9ib webcams naked_cams
-1	rt relatablequote me being bitchy when i m 80 http t co lraaxzqknr
-1	t_fife333 ok are you gonna come ida iahrice4
-1	i watch therefore i am seven movies that teach us key philosophy lessons http t co 7rpt8sy9bc
-1	rt simonjacktoday 2015 hurricane names pt 1 which sounds nasty ana bill claudette danny erika fred grace henri ida joaquin kate larry
-1	rt clevelanddotcom rt ida_in_cle cleveland officer brelo s weapon traces to 49 shell casings at 2012 shooting scene http t co 5rqqnss
-1	halo ahmad_ida edb5450084f4452 bondax will be perform at kampoengjazz may 2nd 2015 at unpad dipatiukur http t co 01myo3tpqn
-1	certify uber use among business travelers approaches critical mass http t co r19mxwscrg
-1	free anal sexshow jesikhot http t co ew7mgswrla is live now nsfw
-1	rt kaintuckeean ida lee willis award nominations are due to kyshpo i just saw a former winner at st thomas http t co xffjuscsod
-1	misssarahk79 the tan yes but the figure ida definite no wishitwas xx
-1	alienvault established a centre in cork to tap into the immense tech talent that ireland has to offer barmak meftah ceo whyireland rsac
-1	what to watch tonight ida 2 days 1 night top gun
-1	rt baminter find our complete metaslim line at southgate guardian ida guardian metaslim webbernaturals http t co m5oqn6hkei
-1	ida says its friday so it s time for techno irishbecks drumecode https t co d1clljjpn2
-1	winner of hrblockcanada win 100 certificate for tax filing on my blog is ida lubelei of yyc red mile branch http t co 8kuk5bgiz3
-1	free anal sexshow fannie http t co pzpocqdn9k is live now nsfw
-1	ida lee willis award nominations are due to kyshpo i just saw a former winner at st thomas http t co xffjuscsod
-1	hektiksound if ida been there i wud have smashed the phone and stopped the filming ol bean ass head talking to rocky like that
-1	rt ismokethentweet a winchester rifle should have a place of honor in every black home ida b wells http t co z6ph1sxtyl
-1	rt retweetdetroit ida byrd hill uplift of uplift the things that stays beyond memory are the things that you made upheavalmed
-1	rt bvb bvb is starting a wifi enabled stadium and new match day application bvb http t co stqhzpztjp http t co cydsnda2an
-1	beautiful friend 2 ida http t co lviyc8feaj
-1	rickypdillon it so awesome me and my best friend aendsleff when the shopping it s was fun and nice yours
-1	rt maddislifee just a girl in a tub day1 http t co y9p3kbtete
-1	ida byrd hill uplift of uplift the things that stays beyond memory are the things that you made upheavalmedia techweekdet
-1	no more deer massacres http t co tx5hoypqya http t co eciv6j9chu
-1	rt sodamntrue im literally tired 30 hours a day
-1	rt mattifestation applying function prototypes to indirect calls https t co pcqpwytfx4 by fellow team members jay smith and _iphelix
-1	interested in relocating your growing business to suffolkcounty ida_suffolk can help http t co n9sijqsakf
-1	rt jillianmichaels i complain about being tired yet i stay up late for no reason sigh
-1	carolineflowerr carolineflowerr 20 girls age 20 height 166 weight 55 hair colour brown http t co jxfskwtnog webcams naked_cams
-1	steelle steelle 28 girls age 28 height 172 weight 55 hair colour black eye colour http t co nhljrv9sxl webcams naked_cams
-1	nightrose nightrose 23 girls age 23 height 1 7 weight 55 hair colour chestnut eye http t co 1jzdu5rwim webcams naked_cams
-1	hotloveone hotloveone 20 girls age 20 height 0 weight 0 hair colour eye colour http t co obcuxtiyx9 webcams naked_cams
-1	lovedayana lovedayana 21 girls age 21 height 165 weight 56 hair colour chestnut eye http t co 0ncwvsdsh4 webcams naked_cams
-1	catahott catahott 36 ladies age 36 height 168 weight 56 hair colour fair hair eye http t co zp3tojcjnd webcams naked_cams
-1	sallyhotone sallyhotone 48 ladies age 48 height 10 weight 70 hair colour fair hair eye http t co vwhw3nctzb webcams naked_cams
-1	karenine karenine 21 girls age 21 height 167 weight 52 hair colour black eye colour http t co a0hkvke8an webcams naked_cams
-1	triojoy triojoy 21 threesome age 21 height 168 weight 58 hair colour black eye colour http t co 6icycmrhi5 webcams naked_cams
-1	fangirling feeeeeeelsssss thank you so much tita ida for this amazing gift merch pasalubong fresh from uk omg haha http t co emnundprru
-1	rt mattifestation applying function prototypes to indirect calls https t co pcqpwytfx4 by fellow team members jay smith and _iphelix
-1	rt maddislifee i will truly never understand why people waste their time leaving me hate because i couldn t care any less than i already
