-1	i liked a youtube video from p4ulawilliams http t co fm7dawvjbl joe mcelderry human frome acoustic show evolution tour
-1	rt tmz selena gomez i m making hits not hit boy in mexico http t co rjkoeyygxb
-1	rt tmz selena gomez i m making hits not hit boy in mexico http t co rjkoeyygxb
-1	rt atinayah learning without barriers using open educational resources in paris sageparisassembly http t co uak9bbw60n
-1	st joe s star natash cloud on cloud nine after being selected in the wnba draft http t co uneoo6vf1g
-1	selena gomez i m making hits not hit boy in mexico http t co dt32ggvpug via tmz
-1	rt thedudeinsf rt shaunking meet officer joe byars this is the man who told a dying ericharris fuck your breath http t co fqqqiv1y
-1	rt tmz selena gomez i m making hits not hit boy in mexico http t co rjkoeyygxb
-1	but it went straight away after i saw the joe dirt 2 trailer
-1	rt witheridgeafc this afternoon witheridgeafc travel to launcestonafc in the swpleague premier division ko from pennygillam 3pm wit
-1	rt tmz selena gomez i m making hits not hit boy in mexico http t co rjkoeyygxb
-1	rt tmz selena gomez i m making hits not hit boy in mexico http t co rjkoeyygxb
-1	rt tmz selena gomez i m making hits not hit boy in mexico http t co rjkoeyygxb
-1	rt tmz selena gomez i m making hits not hit boy in mexico http t co rjkoeyygxb
-1	rt tmz selena gomez i m making hits not hit boy in mexico http t co rjkoeyygxb
-1	all i hear if board and fake
-1	rt tmz selena gomez i m making hits not hit boy in mexico http t co rjkoeyygxb
-1	idk i just found this picture on vine joe_sugg http t co aprviusgw2
-1	rt tmz selena gomez i m making hits not hit boy in mexico http t co rjkoeyygxb
-1	rt tmz selena gomez i m making hits not hit boy in mexico http t co rjkoeyygxb
-1	eeddieherrera cack or pass http t co yvhennzdxl
-1	my sixth time seeing joe tonight
-1	rt tmz selena gomez i m making hits not hit boy in mexico http t co rjkoeyygxb
-1	rt tmz selena gomez i m making hits not hit boy in mexico http t co rjkoeyygxb
-1	nilhan_evkuran thefollowingfan i_kill_for_joe hugheschris30 hypolytaviola antoniacarilla amypeck2011 abecesi wonderful xx
-1	rt tmz selena gomez i m making hits not hit boy in mexico http t co rjkoeyygxb
-1	rt jordanfranklin joemcelderry91 see you tonight joe i can t wait
-1	rt tmz selena gomez i m making hits not hit boy in mexico http t co rjkoeyygxb
-1	rt tmz selena gomez i m making hits not hit boy in mexico http t co rjkoeyygxb
-1	rt tmz selena gomez i m making hits not hit boy in mexico http t co rjkoeyygxb
-1	kristinmartini_ islandwoman_ happy birthday church
-1	rt tmz selena gomez i m making hits not hit boy in mexico http t co rjkoeyygxb
-1	i_kill_for_joe hugheschris30 thefollowingfan nilhan_evkuran mariaciobanu2 antoniacarilla amypeck2011 abecesi gm angels xxx
-1	ticklesam not only that will smith has just come on the radio nowitssummer summersummersummertime
-1	rt tmz selena gomez i m making hits not hit boy in mexico http t co rjkoeyygxb
-1	rt laxnoreos the whole point of dating is to get the 2 for 20 deal at chili s
-1	no sign yet that the 2015 budget will save tones and joe auspol
-1	rt tmz selena gomez i m making hits not hit boy in mexico http t co rjkoeyygxb
-1	rodgers it is games like that where you write your name in the stars as a player the big games
-1	rt tmz selena gomez i m making hits not hit boy in mexico http t co rjkoeyygxb
-1	rt jeff_roy9 can t be friends with joe tho seriously the most boring kid i ve ever met
-1	he got down on one knee and tied my shoe feat parker joe looking at the booty http t co vnjgn6louv
-1	rt tmz selena gomez i m making hits not hit boy in mexico http t co rjkoeyygxb
-1	joe_daviez buzzing my nipple hairs off
-1	rt tmz selena gomez i m making hits not hit boy in mexico http t co rjkoeyygxb
-1	rt tmz selena gomez i m making hits not hit boy in mexico http t co rjkoeyygxb
-1	rt tmz selena gomez i m making hits not hit boy in mexico http t co rjkoeyygxb
-1	http t co wxhz5a7ona music epiphone joe bonamassa les paul goldtop w ohsc limited edition
-1	rt tmz selena gomez i m making hits not hit boy in mexico http t co rjkoeyygxb
-1	rt tmz selena gomez i m making hits not hit boy in mexico http t co rjkoeyygxb
-1	rt tmz selena gomez i m making hits not hit boy in mexico http t co rjkoeyygxb
-1	rt tmz selena gomez i m making hits not hit boy in mexico http t co rjkoeyygxb
-1	today stats one follower no unfollowers and followed 2 people via http t co wtng0vqqkz
-1	rt tmz selena gomez i m making hits not hit boy in mexico http t co rjkoeyygxb
-1	nilhan_evkuran thefollowingfan i_kill_for_joe hugheschris30 hypolytaviola antoniacarilla amypeck2011 abecesi gm sweetie xxx
-1	rt tmz selena gomez i m making hits not hit boy in mexico http t co rjkoeyygxb
-1	joe_mackenzie i work full time
-1	rt tmz selena gomez i m making hits not hit boy in mexico http t co rjkoeyygxb
-1	rt tmz selena gomez i m making hits not hit boy in mexico http t co rjkoeyygxb
-1	rt darrelljordan_ congrats to my boy joe got that phone call from the detroit lions today if anybody deserved it it was bro
-1	selena gomez i m making hits not hit boy in mexico http t co rjkoeyygxb
-1	http t co bbpowswrio music epiphone joe bonamassa les paul goldtop w ohsc limited edition http t co 8ebvsfsk6g
-1	tofuugaming thank you joe
-1	rt marcusbutler off to france with the boys joe_sugg pointlessblog caspar_lee and jimstweetings for a few days
-1	wurzel260654 happy caturday sweetie enjoy your day joe s back in bed xx
-1	real niggaz do real things salute shad_dagod joe_mclaren_5se hustlegang cbnfamily https t co afihnvxp8i
-1	jacobchivers1 bristol city s having a partyyyyy
-1	on way to tranmere good luck let s enjoy alexmacca11 joe_skarz mulls17 callumodowda pahoban10 roofe39 samlong_22 jruffels93 coyy
-1	rt mfstevehere harmonygrits that screenplay is titled the stalker across the hall named joe or joel or something like that the force a
-1	rt joedotie video stunning drone footage captures just how beautiful ireland looks in fine weather http t co ul3bjkp74r http t co vb
-1	rt wakacacagarcia i think i m pregnant
-1	rt benaffleck that s how it starts rt zacksnyder batmanvsuperman notblurry notpirated https t co obcsccpe5a officialtrailer
-1	daniellasworld_ swear down where do you get all this money from
-1	i m drink as fuck right now
-1	all of a sudden u get sleepy
-1	rt proceduraljoye all other sentences just pale in comparison i may use it to replace kind regards in my emails robotic arm catches d
-1	rodgers you have to seize the moment it s not a final but it s a semi final with an opportunity to come back
-1	rt uknewse http t co 7dymwqrtyv joe millionaire reemerges percy sledge passes away 61 http t co fwuldiu7yl
-1	godolphin hi how is elite army and will we see him on a track anytime soon
-1	joe_daviez just blare it fuck it up the boys
-1	last season was fekitoa this season its waisake naholo the blues must really regret letting both of them go foolish
-1	salopskyblue tickets are a little tough to get hold of and if joe can go with a true afcb fan i m happy
-1	rt vauxhall_wales rt amp follow vauxhall_wales to win a 2014 fawales shirt signed by joe allen comp ends 23 59 19 04 15 t amp cs http t c
-1	always feeling out of place
-1	featured book mash up by joe klingler http t co nwsb7fbpqy
-1	joe_weber100 yo that shit actually worked
-1	nowplaying job 3 1 26 why was i born wednesday 07 02 14 pastor joe marquez http t co s9zyicbnga
-1	halligan_joe lilt does say summer i agree
-1	cozy_crime alas poor yorick i knew him horatio but that was before he ate joe s pies a theatrical murder http t co 9iioko5uzd
-1	senatorlankford saw your segment on morning_joe you seem to know more than all the gop candidates put together you should run in 2016
-1	biawntriz deina_joe ardeeel just bought my 1000 followers try this twltterpromo1
-1	joe__snipes hell no
-1	rt retroempireuk joe danger makes the death defying leap from psn to android via googleplay amp ouya with full gamepad support https t
-1	rt uknewse http t co 7dymwqrtyv joe millionaire reemerges percy sledge passes away 61 http t co fwuldiu7yl
-1	rt uknewse http t co 7dymwqrtyv joe millionaire reemerges percy sledge passes away 61 http t co fwuldiu7yl
-1	joe moore as a nation we are dedicated to keeping physically fit and parking as close to the stadium as possible
-1	rt uknewse http t co 7dymwqrtyv joe millionaire reemerges percy sledge passes away 61 http t co fwuldiu7yl
-1	rt uknewse http t co 7dymwqrtyv joe millionaire reemerges percy sledge passes away 61 http t co fwuldiu7yl
-1	joe satriani cryin guitar cover by adamleeguitar lt 3 https t co rkp3vjzfre
-1	rt char_rosewell joe_carey1 i hate this photo but thank you joe xxxxxxx
-1	ohzayncrews ive got both of alfie s now i need connor s marcus s joe s amp dan amp phil s
-1	rt daveplu 4 months ago sbs6 me doing a song of joe cocker on tv https t co uay2lmk9y9
-1	me gust un video de youtube http t co s7ixehsrbp joe bonamassa steal your heart away live from beacon theatre
-1	rt bakersfieldjam congratulations to joe jackson on being named 2015 nbadleague most improved player bakersfieldproud http t co cu2r
-1	edward733 janetnestor thalaberatung 1203camp frankies_style joe_1122 judy_cockerton mfreudenborg shellieblum saturday love
-1	selena gomez i m making hits not hit boy in mexico selena gomez s trip south of the border is strictly p http t co sz76hphejc
-1	joe s kid if you have an ios device you should download our app too http t co gl3tn2udnd
-1	joejuniorr thank you joe x
-1	can t be friends with joe tho seriously the most boring kid i ve ever met
-1	rt wyverntheatre great review of joemcelderry91 in essentiallypop http t co y6o3xgcaqi excited for his show here on wed 17 june ht
-1	rt scott_pearce1 thebodycoach protein waffles with banana and honey you have to make these joe leanin15 http t co kskgdhlt9p
-1	rt chelseafc a memorable goal scored by joe cole in our 3 0 victory over man utd at the bridge in 2006 cfc https t co mmmjts4rl4
-1	rt starwars linkinpark joehahnlp may the force be with you joe
-1	rt tiffany_garcia_ i m really hungry
-1	rt crucial i hate it when i think i ve found someone that will never leave me but yet they do in the end
-1	joeyessex_ have fun joe
-1	majinbuunny jarvan with 38 assists i dont
-1	mora_attractive that foo mad loved search amp destroy lol
-1	rt lifecheates before you give up think about why you held on for so long
-1	had about 2 hours sleep this coughs getting worse
-1	joe cocker with unchain my heart live cityfm classicrock nowplaying listen now at http t co heaiifx76e
-1	joe rated us 5 out of 5
-1	now playing deep purple hey joe on aps radio
-1	i don t like money actually but it quiets my nerves joe e lewis quote otg overtimegrind
-1	huddersfield briony_moloney
-1	joe__snipes i d cack
-1	i m hurtin
-1	rt jilliantindall1 retweet follow all who rt followback gain with me rt now superjunior ff love news j
-1	joe_finni not bothered mate not so sure
-1	rt starwars linkinpark joehahnlp may the force be with you joe
-1	rt danetteparsley joe johnson equity without excellence is just mediocrity excellence without equity is an oxymoron yes aera15 educ
-1	rt bitchkraftx sorry buuuuut i dont thank a god for my successes and opportunities i thank me cus im the leader of my life amp i choose m
-1	reading back over my work at the start of uni compared to now is embarrassing
-1	rt thedudeinsf rt shaunking meet officer joe byars this is the man who told a dying ericharris fuck your breath http t co fqqqiv1y
-1	joe much
-1	louisowow i m very proud of that too joe arpaio
-1	if someone wanted to tell me their life s story right now i d probably listen
-1	joe_honeybadger fuck sergio sometimes no it was just mostly us 3 lmfao
-1	the great joe williams everybody https t co fy01yhteku
-1	joe_selva1 love true vah true love nah thappu pannah thiruthanum ippadi kevala padutha kudathu brother karunaiimalar
-1	potomantogh unforgotten legacy
-1	rt youblades joe strummer 1984 http t co amfd3lllhq
-1	my name is joe and i work at a button factory
-1	ticklesam i m going to drink lilt that says it s hot
-1	aloha fat joe pleasure p and rico https t co edgfodcyou
-1	this nigga hlonilehoko_22 iamgee_yhwh e joe pls hala me with your sister s new numbers
-1	rt superherofeed best part of the trailer batmanvsuperman http t co pvi18zn1mb
-1	rt unesco jazz is today a force for social transformation it tells a story of freedom that all people share http t co m6klu0xzql intl
-1	i really do roast and shit on joe a lot but the more i roast you the more i love you believe that
-1	turn off the light nigga ain t no one tryna see all that
-1	joe_mighty russt i am terribly sorry for the delay guys can you dm me your emails so we can arrange the trip to dddsouthwest thanks
-1	rt dancintina finding joe patrick takaya solomon http t co yztefv0u9r documentary nowplaying documentary top new movies on dvd
-1	joe_rod ya got shit on kid
-1	rt dancintina finding joe patrick takaya solomon http t co yztefv0u9r documentary nowplaying documentary top new movies on dvd
-1	i liked a youtube video from heatworld http t co 9fzri7sf9k caspar lee and joe sugg play mr and mrs
-1	rt retweetthesongs rt if you love joe jonas http t co g0pfkiiypo
-1	so glad joe garner took the penalty and scored last night 21leaguegoals pnefc
-1	jamessmurray owenbenjamin stevebyrnelive jfharris_comedy wildwestcf we re sexy and we know it joe looks possessed
-1	joe s 28 tomorrow
-1	4 days until my birthday and i would love it if joe_sugg and kianlawley followed me followmeformybirthday
-1	benny banks amp joe black know me from stormzy remix music video sbtv http t co thrttzvvxx mrbennybanks seriously hardddd
-1	http t co oxysriedqw epiphone joe bonamassa les paul goldtop w ohsc limited edition http t co visur2pmak
-1	you re the missing piece i need the song inside of me this is me by demi lovato amp joe jonas https t co vzeukycztv
-1	rt geniusfootball so true http t co qjx5qn3pst
-1	callertune14 hi i saw you follow joe vitale and thought you might like this https t co qrhivtwzyj links in my bio
-1	lmao joe looks so fuckin bomb
-1	joe_beef r u talking abt my eating habits rn
-1	i don t like money actually but it quiets my nerves joe e lewis quote otg
-1	retweet follow all who rt followback gain with me rt now ff love news gameinsight 5n
-1	rt 6965_gabmsgkotv gain followers rt this must follow me i follow back follow everyone who rts gain onedirection ff gameinsight
-1	joe is one of the best things that s happened to me my nigga for life
-1	what just happened http t co ukvmzqoet8
-1	i can t stand liers and fake people
-1	rt paperwash reporter what do you think of hilary running biden well rn we think it s obama joe no biden an obamanation spikes
-1	sxgglets joe_sugg what day do joe_sugg posted this i dont even see this
-1	rt trixistreasures johnnyrocksone how ru xo kyuseok_love joe_1122 christheeagle1 vana2buru thecarlweathers yo4ma33942 sw7018 hci
-1	something like 3 4 briefs in week 1 and 4 5 deadlines btwn wk 5 and 6 with a test in wk 3 4 wowzers nervouslyexcited trustingingod
-1	rt marcusbutler off to france with the boys joe_sugg pointlessblog caspar_lee and jimstweetings for a few days
-1	joeselkirk69 good luck tonight joe good to see ye back
-1	i liked a youtube video from p4ulawilliams http t co 1ziodmeclu joe mcelderry i m gonna make you mine frome acoustic show
-1	http t co 9op3ywdwde juno violet temple bottomless body from killer joe nudescene
-1	featured free book mash up by joe klingler http t co odp01uayuu
-1	joe always manages too cheer me up
-1	yamgishi hi i saw you follow joe vitale and thought you might like this https t co t3ypdncjdo links in my bio
-1	rt uknewse http t co 7dymwqrtyv joe millionaire reemerges percy sledge passes away 61 http t co fwuldiu7yl
-1	skynews the driver must have been misbeehaving at the wheel
-1	yasmine_xxmfc smoke
-1	rt nikonupdate watch the joe mcnally nikon school live lighting seminar video amateur photographer http t co xyqmk4y2tz
-1	brittmichaelian hi i saw you follow joe vitale and thought you might like this https t co 9zwiaxkkt0 links in my bio
-1	rt mufcdevilupdate match day come on united mufc
-1	http t co lhhzl4iapv 1950 s autographed picture of joe payne liverpool f c ap117 premierleague mufc u http t co iicfjzehqj
-1	nowplaying rocknroll radio little joe amp the thrillers peanuts tunein http t co 2ffe28imqx
-1	rt starwars linkinpark joehahnlp may the force be with you joe
-1	airing now on rctbestmix at 101 2 rctfm tune in
-1	mora_attractive who else was it
-1	http t co hyz75bgwvv epiphone joe bonamassa les paul goldtop w ohsc limited edition
-1	the joe public people aren t into sport sooooooo i get em to change the channel from mtv or whatever to ss
-1	cate_a_moore discretion is a word not used that often when family describe interactions with officers across the pond joe
-1	xml is just data with that internet shit wrapped around it joe romello by way of steve sapovits
-1	mora_attractive serio me you bobby the homie darth vader breathing all up on the mic n shit good times
-1	65k joe_sugg s follow
-1	halligan_joe ha you bellend
-1	rt joe_sugg joe_weller_ i was chuckling to myself on the plane for a good 3 minutes http t co 5rcvmpsy3i
-1	rt acekicker_19 chris17050 joebartnick foxsports your dirty coked up mistress joe lol
-1	on page 104 of 152 of locke amp key vol 4 by joe hill http t co qrmps3or0e
-1	joe strummer 1984 http t co amfd3lllhq
-1	zzz with sofyan rahmat and joe at dw coffe and chocolate https t co piz6topi31
-1	rt nicolelina12 i had the right of way joe_sexxy9
-1	rt redhotsquirrel yougov nowcast has ukip as high as 34 9 in runnymede_and_weybridge vote for joe branco voteukip2015
-1	sorry i thought this was joe hockey preparing the budget oh wait it is http t co 0zlnmjriqv
-1	rt hiphopvancouver apr 29 fatjoe is at venuelive with ghostmusic604 dkaysixoh4 juvidizzle billionaire_b http t co echwtjlizg
-1	lookgamertv good night joe lt 3
-1	my lower back fucking kills rn
-1	joe _ the love scene
-1	sonny is his name but joe is his nickname v whaaaa
-1	joe_ryder02 still a few more hours to go yet it closes in 11 hours amp once that s done i ll announce it either tonight or tomorrow morning
-1	rt sundayleaguefc jamie redknapp offers a rare insight into the mind of joe hart http t co qk73g4qbzm
-1	miss those late freshmen nights on xbox with my boy joe_honeybadger gotta get back on that grind
-1	katielmgray you most definitely do was going to rt but i couldn t
-1	rt nicolelina12 joe_sexxy9 fake
-1	2014 topps strata football 66 joe flacco baltimore ravens http t co mci3oevu6r baltimore ravens baltimoreravens
-1	im not sorry for my joe spam
-1	interview dr joe gallenberger manifestation healing amp mind over matter listen live http t co fv2solh3ok also on itunes
-1	profedune2 hi i saw you follow joe vitale and thought you might like this https t co 7sjui11w0a links in my bio
-1	2014 score hot rookies hobby foil 294 joe flacco baltimore ravens http t co b5t5fxbdbk baltimore ravens baltimoreravens
-1	rt vauxhall_wales rt amp follow vauxhall_wales to win a 2014 fawales shirt signed by joe allen comp ends 23 59 19 04 15 t amp cs http t c
-1	2014 score hot rookies hobby foil 15 joe flacco baltimore ravens http t co h5zcgov0ml baltimore ravens baltimoreravens
-1	http t co n2wcjocyru epiphone joe bonamassa les paul goldtop w ohsc limited edition
-1	mmmhh i like this converse http t co iizkoudemw
-1	2014 topps platinum blue sapphire parallel 47 joe flacco baltimore ravens http t co syzh2whhed baltimore ravens baltimoreravens
-1	awww so cute photo joe sartore orangutans cuties animallovers http t co usncqyx5c9
-1	rt redhotsquirrel yougov nowcast has ukip as high as 34 9 in runnymede_and_weybridge vote for joe branco voteukip2015
-1	i clicked i liked i rt i got it for free that simple from average joe https t co bshwty6ias avejoe iamrevolution reallyrics
-1	rt sxgglets this needs to happen thatcherjoecoversong joe_sugg https t co vdky4aregq http t co da8wamvrum
-1	rt hiphopvancouver apr 29 fatjoe is at venuelive with ghostmusic604 dkaysixoh4 juvidizzle billionaire_b http t co echwtjlizg
-1	rt caspar_lee meanwhile joe_sugg is next to a nice looking french fella http t co et1j0g84f4
-1	so in love with joe tf http t co y2p1sq7vf3
-1	grantinnes9 chairman joe was a great horse u had was he a tasmanian
-1	apr 29 fatjoe is at venuelive with ghostmusic604 dkaysixoh4 juvidizzle billionaire_b http t co echwtjlizg blueprintevents
-1	joe_sexxy9 fake
-1	i beg you too on my bended knees to show me mercy letters from anne boleyn http t co mvmg5ljdqv
-1	can t fucking wait to see joe tonight
-1	danc3m hi i saw you follow joe vitale and thought you might like this https t co bybo3xfftz links in my bio
-1	http t co 7dymwqrtyv joe millionaire reemerges percy sledge passes away 61 http t co fwuldiu7yl
-1	rt paperwash reporter what do you think of hilary running biden well rn we think it s obama joe no biden an obamanation spikes
-1	nicolelina12 what are u talking about
-1	listen to dr joe gallenberger http t co otyl2vujxm brain balancing techniques create luck amp abundance through meditation
-1	rt creightonsmithh joe dirt http t co pxpigdxeqj
-1	i must admit joe carroll is brilliant
-1	rt bakersfieldjam congratulations to joe jackson on being named 2015 nbadleague most improved player bakersfieldproud http t co cu2r
-1	rt ylwshs12 l joe to juniel don t get close to niel and do work only junhee ya https t co nfezfmfiwy
-1	new meet joe black captain corelli s mandolin double feature jeffrey tambo http t co hygdm1qgkh http t co 167crwejtl
-1	rt bbcgetinspired james anderson 384 test wickets getinspired to play cricket via http t co l6nkpqy9gw http t co b4fha4ygfa
-1	rt bakersfieldjam congratulations to joe jackson on being named 2015 nbadleague most improved player bakersfieldproud http t co cu2r
-1	joe_honeybadger okay bby girl
-1	rt you don t have to be big you have to be remarkable joe pulizzi quote via italimabelas
-1	i had the right of way joe_sexxy9
-1	tiendaverde13 hi i saw you follow joe vitale and thought you might like this https t co flsdch8bcd links in my bio
-1	rt joe_sugg kingftjoe joe_sugg you re near to reaching 4m thatcherjoeto4m http t co jjy3tfh9zr
-1	joe_lfz hahah i ll dm you our pictures okay
-1	charyj9 joe ya ve
-1	rt sunshinenickj ok so we all know demi joe nick miley and selena smoked weed but the real question is did kevin
-1	rt starwars linkinpark joehahnlp may the force be with you joe
-1	boxofficemojo filmtvdiversity yay now gimmie g i joe 3 gijoe americanhero
-1	we are all wired to react with anger sadness or fear dr joe rubino http t co yi5euqrjej
-1	joe danger makes the death defying leap from psn to android via googleplay amp ouya with full gamepad support https t co 8vjirhthrj
-1	yougov nowcast has ukip as high as 34 9 in runnymede_and_weybridge vote for joe branco voteukip2015
-1	rt vauxhall_wales rt amp follow vauxhall_wales to win a 2014 fawales shirt signed by joe allen comp ends 23 59 19 04 15 t amp cs http t c
-1	moanim daddy o e you mean joe
-1	rt ausretrogamer this joe is so comical sms segamarkiii retrogaming http t co 1yxrbxvuts
-1	fat joe 03 fat joe victim http t co 6icnwil41i wmskgrind nowplaying live
-1	nfl 49ers cards 2014 panini black gold joe montana shadowbox base legend sp 15 99 49ers hof http t co q2h2utuiz5 card football
-1	abctv abciview go joe
-1	joe_sugg mate change your bio instead of oli write oli the cactus or caspar
-1	rt handsomestjoe dear money i would like to aquire you in a manner that is not demeaning lots of joe
-1	marydealmada hi i saw you follow joe vitale and thought you might like this https t co hla2aovvhp links in my bio
-1	rt meezytk when the squad says we out to the club but you were just born 4 minutes ago http t co c06rjmeu81
-1	rt wellbelove they no campaign want to take it down but since they have tried more will see it http t co engfn5aizv yesequality http
-1	rt bryce_gotuzzo anselmo diving header goal from his own 6 yard box jogs back
-1	lascano_joe why you don t want anyone knowing who s house you going to
-1	http t co vbgkkwgc6g epiphone joe bonamassa les paul goldtop w ohsc limited edition http t co 8bhcmeorbd
-1	lucky she didn t smash into my mf car that day i would of beat her ass
-1	photography camera art 19168 http t co 8jk0prxnq9 snow joe 40 volt ecosharp lithium ion battery 119 99 159 99 1000 availabl
-1	e joe shapa through ball coolieseitshiro
-1	rt traxfmsmg rockafterschool np ugly kid joe everything about you
-1	rt starwars linkinpark joehahnlp may the force be with you joe
-1	jazmatazzz_ happy birthday spend it well 3 hunnit soza
-1	janetnestor thalaberatung 1203camp edward733 frankies_style joe_1122 judy_cockerton mfreudenborg shellieblum saurday love
-1	rt lmolodichenko cup of joe with wcw http t co qfoisvi2j1
-1	if there is any egg in the basket that deserves a chic broc combo it s salerno_joe
-1	gallent oscar yes tom man with van drop out joe amp wise tantrum teamoscarforever scottishgrandnational wee_oscar
-1	rikerr5 rossr5 rockyr5 rydelr5 ratliffr5 is r5 all day all night coming out on dvd if so will it be in the uk xx
-1	rt caspar_lee meanwhile joe_sugg is next to a nice looking french fella http t co et1j0g84f4
-1	please explain this why does it say alfie deyes brother in law when i look up joe pointlessblog joe_sugg zozeebo http t co 55t0iy5qzu
-1	sharmaalok74 hi i saw you follow joe vitale and thought you might like this https t co l7zjnapbqf links in my bio
-1	p4ulawilliams yes will be then great mary getting to see joe again thanks for posting videos as well xxxx
-1	enter to win bazooka joe bubble gum from realbazookajoe on twoclassychics blog ends 5 04 giveaways ad http t co alu5lscmdr
-1	rt csnne redsox pitcher joe kelly pitched well friday but he was lifted early after too many pitches sean_mcadam http t co nnfoy8g
-1	joe rogan talks sex dating amp suicide http t co nbnyv2bnit
