-1	joe s gonna be pissed af whenever i make my way home a fucking gain and try to crawl in bed and break everything
-1	rt joedotie video stunning drone footage captures just how beautiful ireland looks in fine weather http t co ul3bjkp74r http t co vb
-1	so sad joe is out of survivorworldsapart he was my fav sigh
-1	fake ass thot
-1	rt raynoriginals ambient revival panel at leaf with joe muggs mixmaster morris mica levy mr mitch amp mira calix by boiler room http
-1	rt joe_sugg finally met this blaaaaady legend the other night joe_weller_ http t co il5zsj6mtx
-1	rt laxnoreos my generation in 60 years http t co 58hxnlwxsi
-1	the blacker the berry
-1	finding joe patrick takaya solomon http t co yztefv0u9r documentary nowplaying documentary top new movies on dvd
-1	tanjaplayner_ hi i saw you follow joe vitale and thought you might like this https t co somdxud8cl links in my bio
-1	mtaruso go to bed
-1	mora_attractive text me hunk
-1	wow downloaded course syllabus nervously excited but with god all things are possible declaring that this aint hell sem haha
-1	listen to dr joe gallenberger http t co 0j0mbf4acj brain balancing techniques create luck amp abundance through meditation
-1	caspar_lee joe_sugg jaspar love is in the air idk i just feel like saying that
-1	mora_attractive deez nuts
-1	rt alisonsbread jonjohnson_1 coolcoolpete36 randlight honestly how can they keep flogging that one especially as joe doubled th debt
-1	rt joedotie video remember neil back s number being leaked on twitter it was all a brilliant prank http t co zu5bcoyoyb http t co 7
-1	rt justjared aw see the sweet moments that sofiavergara amp joemanganiello shared on stage last night http t co xtbwivjkgf http t c
-1	rt laxnoreos my generation in 60 years http t co 58hxnlwxsi
-1	it has been our pleasure to support the smart ride program joe priesmeyer scheppers distributing http t co y4oecczheu
-1	reporter joe biggs rambobiggs shares talk w fbi about isis in mexico ready to attack u s https t co bt4h0fcrsk http t co utzibhgjqu
-1	lascano_joe smh i might be the asshole roast master but at least deez nutz are clean
-1	rt brookefiona 247razz yaba daba doooooooooooooooooooooo http t co 3frmlzffmx joe hockey is in
-1	caspar_lee joe_sugg marmottons ski lift at grands montets in chamonix
-1	joe_hulmes sherlock holmes
-1	rt joedotie video nike s brilliant ad for the masters features a tiger woods inspired young rory mcilroy http t co 6txa9b8eji http t
-1	now on rtv8 joe bonamassa driving towards the daylight np listen http t co iz7rpu8otd
-1	joe_blankson brother
-1	joe danger mod amp normal apk joe danger mod amp normal apkjoe danger mod amp normal apk one of the greatest http t co x9jrluyydi
-1	rt katyperry fruit sister is here
-1	i liked a youtube video http t co 8yzw5iapc6 how joe broke his leg
-1	rt mattalvidrez14 these farts right now are no bueno
-1	rt marcusbutler off to france with the boys joe_sugg pointlessblog caspar_lee and jimstweetings for a few days
-1	rt joe_sugg teddysheerio_ joe_sugg are you doing the bandaid thing by any chance bc this looks like you slightly http t co eenpcnoo
-1	timtom_it timtom_it news joe danger arriva anche su android a due anni dalla versione ios se ave http t co qkzxydyyfo tecnologia
-1	in 3 still wake up in the hour of 8 hate body clocks
-1	1992 hasbro toys g i joe mega monsters monstro viper http t co ommv6oynji http t co gkklzdv7m8
-1	biiishops bruhhh
-1	luvyah joe http t co vag7kyiyv6
-1	rt shianne__faith forreal https t co iu9gtzjr0a
-1	rt mamadebcrowe good design is obvious great design is transparent joe sparano
-1	syaibanamalik awwww we will miss you
-1	rt notexplained the sarah joe mystery http t co jxappzlvoq
-1	our e cigarettes research was discussed in the nytimes op ed yesterday peering through the haze http t co fqj2uch8d0 ecigs wales
-1	docklanders just wondering throughout the whole career mode who was your favourite gk ben foster joe hart or lloris foster was mine
-1	just lit the kamado joe to cook some breakfast http t co bukvdnvwze
-1	joe walsh all night long http t co whc4ygcval nowplaying listenlive
-1	rt joedotie video stunning drone footage captures just how beautiful ireland looks in fine weather http t co ul3bjkp74r http t co vb
-1	thepopfeedweb rt yourmusicpress isabel rose sets joe s pub show for 5 12 with paige tu http t co kbad3jtkth http t co nkjzosofqu
-1	nowplaying shawn brock where s joe tune in http t co yqad1y5yks
-1	i would like to introduce you to a top notch photographer fellow full time rver and friend joe schofield amp on http t co 69b3rclubg
-1	what a silly debate regarding sp prices for the national it s part of horse racing do you think joe public cares channel4racing
-1	damon grows new screenshot joe montana football 16 http t co im2reg8dc9
-1	nicolelina12 smh nephew
-1	rt phaggots cop do you know how fast you were going vegan no but i do know that im a vegan
-1	2014 score hot rookies hobby foil 294 joe flacco baltimore ravens http t co zf6bvsz5kv http t co wwfyf2ybso
-1	rt usasoccerguy here s my pregame preview of man unity s trip to london this weekend for joe_co_uk http t co g4xiricvep soccer
-1	rt rt2eat vip music promotion deepsteppz_ joe gulliver http t co 0rnd4nqgxf news rt2eat twitwhizz https t co 9at
-1	rt joe_sugg britneygibo6416 i wonder how joe_sugg s grow your own girlfriend is going http t co hcwa90otbl i ll tweet her prog
-1	better get my ass out of bed and get to the gym
-1	rt brookefiona 247razz yaba daba doooooooooooooooooooooo http t co 3frmlzffmx joe hockey is in
-1	yankees cards 1951 bowman joe page 217 new york yankees ex se386 http t co moauvj64xc mlb card deals
-1	rosaaahh_ keep it one hunnid bangbang
-1	rt caspar_lee when you fall asleep on your bae joe_sugg http t co giwaebvgy8
-1	rt kabetes just imagine khalwale in a cabinet meeting then mumias sugar scandal and kidero s name surfaces for deliberations that will
-1	rt retrounited the fact fellaini has been described as our danger man in today s papers highlights just how influential lvg has been an
-1	rt joedotie video stunning drone footage captures just how beautiful ireland looks in fine weather http t co ul3bjkp74r http t co vb
-1	check out royals bassline lorde syntax remix by djmotionsicness http t co jqyyd72jlr mom http t co ffbat85bp5
-1	rt starwars linkinpark joehahnlp may the force be with you joe
-1	rt joe_sugg do you ever just sit there and wish you were as cool as joe sugg http t co ixt4ndq9kv
-1	biden s still biding http t co pqhpixbdtl http t co edfcy9td2m
-1	joe riley bury can break flying jinx with victory at portsmouth http t co j2jpwfwjcf buryfc
-1	rt zunderwood615 i m just balling with them birds like jamal crawford and joe johnson
-1	joe from chichester you bellend https t co 5c3fljntzu
-1	rt chelseafc joe cole s superb individual goal v man utd at stamford bridge in 2006 cfc https t co mmmjtsmscc
-1	rt woridstarvideos this woman http t co xgdjrludbc
-1	rt kabetes another scenerio at khalwale s cabinet meetings then william ruto s name features on land grabbing in langata waah that wil
-1	rt retrounited how much credit fellaini deserves for his recent performances he s been superb http t co clvdbj8aoj
-1	kca votejkt48id ameliaaa951 joseph_day16 yes it was a book worm eating a book then it turned into a butterfly joe im so annoyed
-1	rt brookefiona 247razz yaba daba doooooooooooooooooooooo http t co 3frmlzffmx joe hockey is in
-1	a cliche answer when cochran asked who joe thinks the biggest threat left in the game
-1	joe gage sex files 14 by ray dragon http t co qlhtvvusa5 http t co 8hibbsgflu
-1	butlin97 earthposts joe_picton thomedwards97 rossgould18 rhysdickens simonrhodri keep thom away from the dolphins
-1	ticklesam i just opened doors and walked on the balcony and my legs have burned it s that hot my legs are now high gloss jet black ha ha
-1	rt benaffleck that s how it starts rt zacksnyder batmanvsuperman notblurry notpirated https t co obcsccpe5a officialtrailer
-1	jonjohnson_1 coolcoolpete36 randlight honestly how can they keep flogging that one especially as joe doubled th debt his earliest opp
-1	hey joe_meka toy bricks mixing business with pleasure http t co s6fxsm0ibb
-1	retweet follow all who rt followback gain with me rt now emabiggestfans1d kca follow j
-1	from the reverbnation catalog of average joe aka avejoe breathe http t co dyp7qcjrp1 have you heard 478
-1	http t co kyznuh8jft music epiphone joe bonamassa les paul goldtop w ohsc limited edition
-1	joseph_day16 yes it was a book worm eating a book then it turned into a butterfly joe im so annoyed
-1	imagine dean martin amp joe namath out on the town
-1	why am i awake already
-1	rt fa anything can happen says joe cole as he sets sights on adding to his three facup medals http t co r0nlvu2yw6 http t co ujekv
-1	rt joedotie video a guy kayaking in dingle gets within touching distance of a huge basking shark http t co svrmo7vtzb http t co wzyo
-1	i have a feeling that frankie is in the coachella with joe
-1	joe_honeybadger thanks for lending me your rocket ship amigo and caring about my lens real one
-1	manchester city players have let pellegrini down says manchester city goalkeeper joe hart http t co rivtf1qigw
-1	joe goes to canada vancouver https t co uy37jgk4y2 via youtube so fucking funny
-1	another photo of the new boy teammoth http t co gl5id4bix6
-1	joe allen how we turned it around at liverpool after a rocky start to http t co lipjmxnggi
-1	rt warriors 12 hours strengthinnumbers http t co xgharfhdnt
-1	good luck to my mates at krsport at the o plate in rowrah wish i was with you karting ftw
-1	my jamm now jessejagz x iceprincezamani http t co xegu4pqsrb
-1	taz s angels snapchat story is fucking sick
-1	earthposts joe_picton thomedwards97 robertstimmy rossgould18 rhysdickens simonrhodri guys i think i ve found a new activity
-1	rt joedotie video stunning drone footage captures just how beautiful ireland looks in fine weather http t co ul3bjkp74r http t co vb
-1	i liked a youtube video from tomascdiaz http t co bik38sftqx joe rogan on how to truly enjoy your life
-1	joeyraj93 thanks joe and yeah ageing well though haha
-1	moving to a new apartment sigh
-1	spotthearts fineart painter multimedia artist usa joe yeno usa http t co rsezkmcz6z http t co iqjg9thtbl http t co ykstsx95wd
-1	rt joe_co_uk video batman v superman dawn of justice the official hq trailer is here http t co h28giecadp http t co jbcbco8sfb
-1	jjviney tell him joe
-1	manchester city players have let pellegrini down says manchester city goalkeeper joe hart http t co jvk0uj2c1c
-1	rt retweetthesongs rt if you love joe jonas http t co g0pfkiiypo
-1	kevin_hilman like it
-1	joe hart manchester city players have let down manuel pellegrini http t co 8ymvpem6ap mcfc
-1	you don t have to be big you have to be remarkable joe pulizzi quote
-1	jjtromans hayden711 halesowencc you should open the bowling joe
-1	joe and the juice http t co qxi6zv4ror
-1	can car loan shopping hurt your credit score http t co jl8rxbmqzg phoenix http t co a97zaztzlf
-1	rt showdownjoe proud to announce i am the newest member of the award winning mma junkie usa today team my first video is up http t co
-1	ha joe romero victor faz looks like something we would have done in high school http t co kh7l1xuewo
-1	joe s coffee house beaded bookmark null http t co kb1jyvdvqn via amazon http t co ndsoiproeh
-1	scott brown hillary clinton will make a better president than barack obama but so would joe the plumber no big deal statement
-1	rt yebosfaye greetings all lt autumn colours mt wilson joe cartwright 2014 http t co obqd0pdlx8
-1	rt vauxhall_wales rt amp follow vauxhall_wales to win a 2014 fawales shirt signed by joe allen comp ends 23 59 19 04 15 t amp cs http t c
-1	leeleeresh hi i saw you follow joe vitale and thought you might like this https t co ifjp1xsgep links in my bio
-1	fresnobee joe_schmucc so half of what san francisco spends with a much larger population
-1	rt yourmusicpress isabel rose sets joe s pub show for 5 12 with paige turner rose sizzles with her jaw dropping wardro http t co q5
-1	rt joedotie video stunning drone footage captures just how beautiful ireland looks in fine weather http t co ul3bjkp74r http t co vb
-1	i liked a youtube video from p4ulawilliams http t co x4jhpe4gny joe mcelderry i look to you how we love frome acoustic show
-1	rt vauxhall_wales rt amp follow vauxhall_wales to win a 2014 fawales shirt signed by joe allen comp ends 23 59 19 04 15 t amp cs http t c
-1	fitness joe s fat book weight losing game that challenges you to follow as suggested for 21 days win by losing http t co tjrcaglpf8
-1	joe s fat book weight losing game that challenges you to follow as suggested for 21 days win by losing http t co t4inw4wjkc
-1	lascano_joe how was the softball game
-1	rt a_ldoi__sert_ag retweet follow all who rt followback gain with me rt now gain followtrick gameinsight
-1	joe returns benny john pedals alice mrs mcgregor encourages soo lee
-1	and that the movie scarred me
-1	who would win in a fight you or romell asktgfbro
-1	if we go into the game today with the mentality that it will be a walk over then we won t win got to be at our best afc
-1	rt sportive23_ jose mourinho worked under van gaal as his assistant manager at barcelona for three years in 1997 http t co veoscgheze
-1	unfriended teaches you posting the wrong things can get you in a lot of trouble
-1	up since early getting msignite demos ready posh making life very easy gt simple code reuse
-1	rt mtaruso tell me why my best guy friends are such sluts
-1	joe_gatto go joe you legend http t co kozkm5ikpr
-1	joe_nicholson96 yes your goalkeeper picking up a loose ball completely unchallenged then going down pathetic
-1	now playing haul away joe from the clancy brothers on http t co kwafz1xzdp stream http t co efodm7ikmy
-1	rt paperwash reporter what do you think of hilary running biden well rn we think it s obama joe no biden an obamanation spikes
-1	new species in the trap this morning can anyone id thanks teammoth springmothing http t co uh4xggbpki
-1	solbinxahn sure teentop s l joe already follow you back
-1	jeanmcewan check out joe ridgwell s blog as his chapbooks are absolute beauties https t co 5dpjlxzdl4
-1	joe s eyes have never been redder http t co l8lbbqdqad
-1	photoshoot day with gary morris today looking forward to getting some great shots up in clumber
-1	rt storm joe stimson opens the scoring for the thunderbolts on the right edge converted by mack mason and we take a 6 0 lead purplepri
-1	rikerr5 rockyr5 rossr5 rydelr5 ratliffr5 is r5 all day all night comin out on dvd is so will it be in the uk
-1	rt caspar_lee like in the parent trap joe and oli put me in the pool while i was asleep and i woke up like this http t co dtx6nihdpb
-1	the huffpost show takes on peta and its controversial partner joe arpaio http t co wehpxdgikm
-1	jutson666 is so in love
-1	corey crawford emerging as chicago blackhawks achilles heel vs predators chicago blackhawks head coach joe http t co zrqgu5aqvf
-1	rt ramon_adam retweet follow all who rt followback gain with me rt now staystrongexo retweet ipad ndj
-1	money is a strange thing it ranks with love s our greatest source of joy and with deathnas our greatest source of anxiety joe moore
-1	rt oliwhitetv oh shuuuuuuut up joe_sugg http t co amg8itsopq
-1	no one else comes close by joe https t co lifuexpqjd
-1	rt mmuehletheodori retweet follow all who rt followback gain with me rt now bestfanarmy votadulcemaria 9
-1	i have decided that i was a part of vietnam
-1	rt bakersfieldjam congratulations to joe jackson on being named 2015 nbadleague most improved player bakersfieldproud http t co cu2r
-1	whatcha know bout that beardproducts https t co ohvtj8b1fp
-1	bike life was to funny
-1	can car loan shopping hurt your credit score http t co yvku6rxtt0
-1	joe_sugg good skiing at the grands montets yesterday
-1	rmariaperva gato_del_amor rtmiii1958 r04349352 adrymmp parisbakerangel emma_2233 joe_bbm cdawk1 shout out
-1	joea_yoo thanks joe
-1	ty 4 helping perf_ninja3 caisoch whoisbrenda urkadelicious curticules theallyvalley kmart91798 joe amp chouaib http t co ljlr1ndq5z
-1	thatjmcalister text nope joe
-1	rep joe kennedy iii talks about family legacy
-1	rt joowweey anselmo scores thirty yard scissor gets up and jogs back to half
-1	rt enfieldtusc think all the parties represent a privilaged westminster elite tusc is different vote joe simpson in enfieldnorth http
-1	please follow me if u love joe sugg rt this tweet if u love dove cameron fav if u love laura marano
-1	rt vauxhall_wales rt amp follow vauxhall_wales to win a 2014 fawales shirt signed by joe allen comp ends 23 59 19 04 15 t amp cs http t c
-1	rt bryce_gotuzzo yess anselmo
-1	halligan_joe he is a div and will say it s not cold but it s freezing i m going to wear my coat today
-1	ljoeljoe1123 l joe ah i don t need a reason for loving you lt 3
-1	rt joowweey get into that tackle anselmo
-1	ria_747 do you write kate s jokes too
-1	i liked a youtube video from therealrtu http t co uyh8t7wcon angry joe s twitter fight with ign editor who was wrong
-1	joe garner burslem s most despised footballer
-1	idc who u r salerno_joe is a saint
-1	it s almost time for therealrussellp at the o2 tonight somebody joe_simmons1 almostfamousworldtour
-1	gallent oscar yes tom man with van drop out joe amp wise tantrum teamoscarforever scottishgrandnational
-1	rosaaahh_ you already kno
-1	i m soo addicted to joe_sugg vlogs
-1	joe_sugggs hello joe im one of you subscribeers love u so much i will scream my head of if i saw u in person you the best x
-1	rt joe_sugg misslah123 ohmygodnessgrasheanious joe_sugg http t co qy5hfdnjvx why are my heart shape attempts so bad
-1	rt joyrider_ke ever slept with a stammerer you d think she s laughing not knowing she s tryna tell u harder u d hear hahahahaha come
-1	brand new release dj jammin joe available on itunes we number one http t co pwvc771b67 play my song a ohh
-1	joemontana why you gotta toy with us joe joemontanafootball16 rumor joemontananflfootball16
-1	justin is in love
-1	what a greaaaaaat day may even be time for a couple of pig ears for joe_kelly3 playoff match bighitsson killsomeonejk
-1	rt rtbands_bcv96 rt if you like billie joe armstrong http t co v8cv5hi020
-1	joe_nuzz fgm is everyone s problem but here are some of the the feminists http t co yysjpegq5f fgmstatement
-1	rt fa anything can happen says joe cole as he sets sights on adding to his three facup medals http t co r0nlvu2yw6 http t co ujekv
-1	rt ldreytumblr lana del rey for billboard magazine by joe pugliese 2015 http t co wwcgdzcnvu
-1	i liked a youtube video from joe_weller_ http t co omrabls4kj ultimate wrestlemania fan experience
-1	lol checkthis 1 20 joe rogan comedy clip abt adulthood there s better talk abt ancestors passing down misinformation http t co v0pjlotyqo
-1	rt _ladyboners joe is so done with this http t co okesy9gulo
-1	calif woman crashes car into trader joe s injuring 5 cops http t co ntcbu7udyn newyork
-1	calif woman crashes car into trader joe s injuring 5 cops http t co 5b1k8kx9vd newyork
-1	rt vauxhall_wales rt amp follow vauxhall_wales to win a 2014 fawales shirt signed by joe allen comp ends 23 59 19 04 15 t amp cs http t c
-1	we be choppin blades
-1	studying who study s for anything nowadays
-1	sleeping with the light on tonight
-1	rt toniawwe scallahanglobal joe_weller_ callahanmusic_ marlonroudette thank you its really good lt 3 i loved sam on xfactor
-1	joe s jeans the brixton denim womens 34 x 33 http t co p5jdd7kbfj http t co okvqkrwbgi
-1	rt metrofmsa good morning early birds the real phat joe and pearl thusi are with you until 9 00am
-1	rt thall_27 joe_abi12 too_unorthodox_ when she said that i was like bruh
-1	a wild joe_sugg amp caspar_lee spotted in cardiff http t co gjmjkdfjek
-1	bayleeshorttt i bet joe is telling a trilogy
-1	i still think it s cute she s friends with l joe and jeongmin
-1	kmart joe boxer commercial christmas jingle bells show you https t co ebgd9hw2m1
-1	joe is all over my tl raghad
-1	has practice test tomorrow still doesn t care to rest
-1	oakv_dealfinder hi i saw you follow joe vitale and thought you might like this https t co b2tkprvarr links in my bio
-1	clarion broad farce in the joe orton tradition with stellar performances from greg hicks amp clare higgins janetstreetporter independent
-1	bent
-1	officialjoe___ thanks father landlord joe
-1	throw sumo
-1	joe went at that cupcake boi
-1	first rule never open your mouth until you know what the shot is
-1	joe is mad
-1	rt footballvines joe hart knows how to stop ronaldo http t co fyb2jds7mx
-1	note to self never stay in uni accommodation again the fire alarm went of twice
-1	rt jilliantindall1 retweet follow all who rt followback gain with me rt now superjunior ff love news j
-1	rt afl 3qt essendonfc 14 6 90 leads carltonfc 7 12 54 joe daniher s kicked three aflbluesdons http t co ke552jtcd4
-1	dear money i would like to aquire you in a manner that is not demeaning lots of joe
-1	ticklesam is it bollocks wake ste up and ask him is it cold he s a deane lad he will prop fire bbq up roasting
-1	joe_schmoee chrisyanke16 ily guys
-1	isabel rose sets joe s pub show for 5 12 with paige turner rose sizzles with her jaw dropping wardro http t co q5txn9zrij musicnews
-1	watch xavier amp rachael price tell me all about it at joe s pub 2 13 13 on youtube https t co uh2mwokuv4
-1	rt joe_sugg troyesivan joe_sugg and i getting our blue steel on http t co igywhbwsef
-1	cup of joe boys and girls
-1	kasie morning_joe joenbc so he has effectively endorsed scott brown the entire party is comprised of whack jobs
-1	emilyer one year on st pat s my dog went missing for an hour because drink at home joe let her out the front door without noticing
-1	there he is again says joe
-1	abdulgreen206 avatarayub slow ass joe johnson random ass russian players inconsistent deron willams bruh weakkk
-1	donnie amp joe emerson baby https t co zjwloo8cvv via youtube oh yea
-1	joe amp mia
-1	i hate to be sick can t breathe through my nose and i ve a really sore throat but i m watching joe_sugg videos so it s kind of okay
-1	mikeruffles hi i saw you follow joe vitale and thought you might like this https t co ddbmflpcfq links in my bio
-1	rt zacksnyder here s a real picture of the batmobile http t co 47beazqr6f http t co ez1ila8jee
-1	rambobiggs joe have you seen this photo i believe it was taken by a professional photographer at the wtc http t co 83xihmslvg
-1	if they re really going to reboot bazooka joe are they finally going to explain what the heck happened to his eye
-1	hello arthur t shirt are named by you order now http t co az3l2cjsox thank joe_briefcase http t co 0iapdbmyc5
-1	thanks to joe sugg i am still in this world breathing and smiling https t co 4jaqtfqery
-1	rt joedotie video stunning drone footage captures just how beautiful ireland looks in fine weather http t co ul3bjkp74r http t co vb
-1	rt thatssocarson totes just saw joe jonas http t co fmxliaxduw
-1	rt thall_27 joe_abi12 too_unorthodox_ when she said that i was like bruh
-1	rt chelseafc a memorable goal scored by joe cole in our 3 0 victory over man utd at the bridge in 2006 cfc https t co mmmjts4rl4
-1	rt thrllerr shoutout to katherine and joe for not using a condom and creating a legend http t co ynce1jwf9y
-1	rt p4ulawilliams joe mcelderry i look to you how we love frome acoustic show http t co 8org8ujiva via youtube
-1	joe is on this normal person sleep schedule and im about to go to bed and he s gonna be getting up soon
-1	jbattaino ryandoc7 thanks joe i appreciate it
-1	well then seems as if people in the betting shops have shifted opinion slightly since i last checked ge2015 http t co mfibpnmfw2
-1	maryrob30409209 i can t think of a better way 2 spend my b day than watching u watching joe after all this time see u soon my friend xx
-1	rt justjulyo never judge someone without knowing the whole story you may think you understand but you don t
-1	joe_abi12 too_unorthodox_ when she said that i was like bruh
-1	rt vauxhall_wales rt amp follow vauxhall_wales to win a 2014 fawales shirt signed by joe allen comp ends 23 59 19 04 15 t amp cs http t c
-1	joe root is so cute
-1	rt joe_sugg nickmillerza you can order youtubers via this magical lift featuring joe_sugg https t co cu2ksuyqzg haha
-1	joe cole cars collection 2015 youtube http t co y51itmtyqy
-1	rt starwars linkinpark joehahnlp may the force be with you joe
-1	joe johnson boutta go off mark my words
-1	joe brooks
-1	joe s eyeballs are rolling to the back of his skull
-1	omg joe is so cute
-1	rt aviationtweet1 joe engle talks aviation history the daily courier http t co 0lnlxhefor
-1	i think i m gonna try some geordie words with joe later hope it sounds good cause of my welsh accent joemcelderry91
-1	scottybee_ hi i saw you follow joe vitale and thought you might like this https t co cv9kzjvic5 links in my bio
-1	too_unorthodox_ thall_27 she said guys please don t act ghetto
-1	rt falloutboyinfo life goal joe trohman in fobumathurman music video
-1	oscdd ohhhhh danny joe dunbar doesn t like it when people get personal with him but he has no problem attacking others
-1	nobody knows how it felt when my true love steve got replaced by joe on blues clues how did i feel such pain at a young age why lord why
-1	rt wyp_rpu did you know that insurance companies do not pay out if you re convicted of drink driving this bfd driver blew 92 http t c
-1	rt daisychristo will big data transform education http t co qt1s7zelqg
-1	henryvalantine sayerseve i ll take something cold but i m not sure i can move
-1	rt eurocrat this is hilarious man tries to burn eu flag which won t burn due to eu fire safety rules http t co jodedx6hzs http t c
-1	rt myboycrush nick and joe jonas http t co s2vsflzgb1
-1	i m just balling with them birds like jamal crawford and joe johnson
-1	good judgement come from experience which comes from bad judgement
-1	they should make a lifetime movie about joe budden s downfall
