-1	corieebee_24 corieebee is so coco
-1	rt lfc revealed congratulations to jhenderson who is lfc s standard chartered player of the month for march http t co hkzbdvvoto
-1	listen to dr joe gallenberger http t co 2smspuruzd brain balancing techniques create luck amp abundance through meditation
-1	shit crazy like joe casey
-1	free books featured free book mash up by joe klingler featured free book book is free from 04 18 2015 until http t co 2bctuxdnr1
-1	borleyrose j0eruns firman_77_ irarainey flingrace joe it s a shame kate isn t running it as she tends to carry all you d need
-1	lowandslow_joe ogbobbytownsend franrebelcis follow me rn
-1	featured free book mash up by joe klingler featured free book book is free from 04 18 2015 until 04 20 2015 if http t co px5kann7x8
-1	now playing joe reese through your mind s eye new music in english spanish and hits of all time http t co 1x7iug89j2
-1	heylovebrooklyn nice crowdfunding campaign let s work together to boost it up call me anytime today at 800 307 8104
-1	flashdrivex64 o sounds like joe is a lovely person
-1	selena gomez i m making hits not hit boy in mexico selena gomez s trip south of the border is strictly prof http t co ev2yvmzfj7
-1	i feel like she licks yr buthole and u giggle like a little girl opening a present and she gets a cabbage patch type of giggle wtf
-1	rt sbtvonline mrbennybanks amp joeblackuk are back doing videos together sbtvexclusive gt gt http t co pnlrvb1vg0 http t co 9xwuzhslua
-1	high_life_joe boy shut up
-1	kiofficial hi i saw you follow joe vitale and thought you might like this https t co zfowudiw71 links in my bio
-1	ign this is all sorts of awesome
-1	outside the hotel was actual good because nobody mobbed them but because joe leaked the hotel they ll probs get mobbed
-1	rt _thereal_nick college is all about how well you can finesse a class
-1	joe5jackson yes mr joe it s a promise god bless you and your family http t co qy2uodbafs
-1	rt redhotsquirrel yougov nowcast has ukip as high as 34 9 in runnymede_and_weybridge vote for joe branco voteukip2015
-1	joe_clws skyfootball i hope you re being sarcastic lad
-1	joe_elway best of luck
-1	come on today leciester big 3 points today we close the gap to survial lcfc officialfoxes
-1	joecadge michaelpearceeu livblundellxo kthopkins clare_cave ok joe joe prick
-1	joe_weller_ i fucking love ur croatians ronaldo video damn man ur the king slaute
-1	can t think of a better day to be playing cricket
-1	s line news selena gomez i m making hits not hit boy in mexico http t co 6bdvkyduir
-1	rt abdashsoul word on the skreet you reap what you sow
-1	rt newlook_men there s still time to enter simply follow rt for a chance to win 2 tickets to new look wirelessfest competition
-1	flashdrivex64 not sure which joe ya are talking about but sure lol
-1	perfect family pleaser you will love how simple from scratch sloppy joe s are you ll family will love the taste http t co v9kggomfeo
-1	ticklesam i can t do gardening got hay fever good luck getting ste to do it i m off for my al fresco breakfast
-1	hbmutungi hi i saw you follow joe vitale and thought you might like this https t co qvvz9usru2 links in my bio
-1	rt nytimes joe biden to attend israeli event in an attempt to cool tensions http t co nhcfotgzzq
-1	hayahhh drop it like martin garrix by dj jacky joe https t co juerwgsdlu
-1	rt lifestillgucci still up
-1	oir molotov cocktail 185 with joe mesmar gt http t co gmjd9dkdri
-1	oir molotov cocktail 185 with joe mesmar gt http t co 68m6i3oooz
-1	rt thalaberatung morning cheers so edward733 1203camp frankies_style janetnestor joe_1122 judy_cockerton masonandroid mfreudenbo
-1	rt thatssocarson totes just saw joe jonas http t co fmxliaxduw
-1	some one hmu
-1	florida sexy models selena gomez i m making hits not hit boy in mexico http t co zkezvcislf
-1	danniijohnstone do you remember that night you and joe were clueless http t co zwipy9v7mj http t co xyu8nrpslg
-1	livescifi good show
-1	selena gomez i m making hits not hit boy in mexico selena gomez s trip south of the border is strictly http t co kcujnheexs
-1	glad we connected lets stay in touch _juniorestrada sleeplessinswl chiyambachimuka joe_yb
-1	calico joe by john grisham rs 99 0 books music and movies http t co vt5oj1yhjt
-1	officiaihue im also gonna play with joe wanna join us
-1	days are getting longer
-1	gazmik stu_zanone joe_mant bustersmissen byrnsie2606 is never ok to get beat but we accept you may run out of time now and then
-1	audiearagon lol yeah i d put all of it on joe
-1	listen to dr joe gallenberger http t co a305hduaua brain balancing techniques create luck amp abundance through meditation
-1	rt joe_uk_football jamie redknapp and thierry henry square up to each other in boxing stylee http t co 2jv0pth8bm http t co rsv49b
-1	ellacyclingtips and 2 2 joe martin stage race http t co 0cyfnl0vwu
-1	selena gomez i m making hits not hit boy in mexico selena gomez s trip south of the border is strictly prof http t co k27cllflql
-1	coach ali news selena gomez i m making hits not hit boy in mexico http t co 28ff4ykhrp
-1	bloemhof54 hi i saw you follow joe vitale and thought you might like this https t co mzng6ouigv links in my bio
-1	rt melodiesharry joe jonas singing trap queen my life has been made http t co fqxuogn6f5
-1	imstevewalther hi i saw you follow joe vitale and thought you might like this https t co evekncjbgq links in my bio
-1	slow down gto joe louis walker
-1	hay have a blessed weekend eddie amp shari lacy j dalton joe spotted bear emilyn roberts kelly rush http t co fdmv609b1t
-1	decoo314 my money on joe
-1	niachavez23 it s ok
-1	rt supadupaachris he s wondering what he and madonna are now onlyhiphopfacts what s drake thinking about http t co ncghoxxysg
-1	good run by our former horse inflatable miss at goulburn today very close up 3rd well done to joe cleary and new owners
-1	rt miss_illa1 he that beats the drum for the mad man to dance is no better than the mad man himself afrosquad
-1	gatto was nutz at the party last night in murrs periscope joe_gatto jamessmurray
-1	rt __igetbuckets__ marcus already took off but this was the squad donaldson_bill westonbordis jcast_4 joe rj devon charlie to http
-1	rt yungkaylah finally home and im about to knock out
-1	selena gomez i m making hits not hit boy in mexico selena gomez s trip south of the border is strictly http t co qvqqpsky90
-1	up early again to tell the capital district how f cked we are news wise this morning 6 10 with joe gallagher on http t co otrtfg33ae
-1	mbu selena gomez i m making hits not hit boy in mexico http t co xzwvozzogq
-1	artthedoor hi i saw you follow joe vitale and thought you might like this https t co 71t0s50zne links in my bio
-1	joey_l4 sloanemegan1 joeeeeee joe
-1	rt joe5jackson ok i will be back with you all soon be the best you can be to make the world a better place love joe realjoe
-1	5 reasons why joe anglim s elimination is a good thing for http t co mlcnm7ejor amazon
-1	rt imonlyafox joe rogan on invisible aliens string theory amp collective dmt dreams https t co 9ur2bfp37v this is great you should wat
-1	rt andersonsaxe ed_miliband while ur on wirral 2day have a word with joe anderson we need answers kudosgate dont u care about liverpool
-1	rt raynarvaezjr lllllllllllllet s stop lt 3
-1	audiearagon glass joe vs mayweather
-1	rt arappersaid that jada and that will love j cole http t co 7htwhcnstp
-1	rt thisisgmc joe s gmc sierra is ready for its professionalgrade close up http t co 8fgjly14gc
-1	http t co rx9lal0yem now playing joe feat nas get to know me zartheanr tunein player http t co udbr1zfpg5
-1	oldathers joe great initiative in setting up the fund to help frank knight
-1	rt tmz selena gomez i m making hits not hit boy in mexico http t co rjkoeyygxb
-1	k indemand news selena gomez i m making hits not hit boy in mexico http t co cnebthjhds
-1	a goal should scare you a little and excite you a lot joe vitale quote
-1	rt chadjordan23 when girls say i have too many hoes http t co mfelk77wrx
-1	no1drug again ok no1drug is sniffing solvent now that s strong stuff
-1	rt car_porns rt if you want a gtr http t co eoqlypk4xr
-1	listening to joe gilder better this way romans 6 11 remix by how to avoid art howtoavoidart on soundcloud np https t co pvq5uw5drc
-1	rt demishree crew love http t co xaq2vg48tb
-1	souljahofdadub hi i saw you follow joe vitale and thought you might like this https t co zxoflgrqdj links in my bio
-1	rt aussiesugglet00 can we all just take a minute to appreciate joe_sugg s body http t co 4g4rkd7m6b
-1	rt tmz selena gomez i m making hits not hit boy in mexico http t co rjkoeyygxb
-1	ya boy done lost his own bet buy me food now joe monsta
-1	latest news selena gomez i m making hits not hit boy in mexico http t co o6hiondr9h
-1	selena gomez i m making hits not hit boy in mexico http t co xyxvviwcmy via tmz
-1	damon grows new screenshot joe montana football 16 http t co kb1uvuwzn7
-1	rt rachkinsinger so fun getting together with joe and kinsie and meeting their adorable puppy sophie sophietheplayfulpup http t co w
-1	joe dis be how i dey tire oooo https t co uptxr7cxfv
-1	irony you support a team with joe garner in it there s your cheat look a little closer to home glasshouses https t co prybu9trge
-1	rt thatssocarson totes just saw joe jonas http t co fmxliaxduw
-1	joe_sugg i know there s a 1 in a million chance but my number is 864 437 7659 i love you so much
-1	lolz wena wae frostana di deng ben_modise malumthabo lmao hao thibege joe
-1	thebodycoach hey joe is a fasted hiit session a hiit session where you haven t eaten a thing before doing it
-1	rt __igetbuckets__ marcus already took off but this was the squad donaldson_bill westonbordis jcast_4 joe rj devon charlie to http
-1	rt redhotsquirrel yougov nowcast has ukip as high as 34 9 in runnymede_and_weybridge vote for joe branco voteukip2015
-1	camera phone tablet http t co zh1tpfocbx 29 snow joe 40 volt ecosharp lithium ion battery http t co pv9lfvzxlz
-1	tru town films selena gomez i m making hits not hit boy in mexico http t co laagltbllo
-1	mb_drums joemcelderry91 hope to see you at joe s next acoustic show matt xx
-1	i liked a youtube video from p4ulawilliams http t co qwtyc0zzhb joe mcelderry canta della terra frome acoustic show
-1	rt maxinevolker joe_simon_says 30 seconds after offering to make tea http t co gidp3kadcl
-1	video batman v superman dawn of justice the official hq trailer is here http t co fhgqzdvzqo http t co j5e0xgfoke
-1	my homies a foo
-1	rt starwars linkinpark joehahnlp may the force be with you joe
-1	why are you doing this to me joe don t you dare show me those pic it makes me cry
-1	tvb entertainment news smooth talker series is joe ma s last tvb series temporarily http t co gxe50yppdt
-1	hugheschris30 i_kill_for_joe mariaciobanu2 nilhan_evkuran antoniacarilla amypeck2011 abecesi clara210367 all good ty c just a lot on
-1	don t forget the wedding fayre tomorrow 19th april joe our venue decorator is hereof you want a chat and so is http t co al2owfg4ga
-1	selena gomez i m making hits not hit boy in mexico selena gomez s trip south of the border is strictly prof http t co y4ie8rozd2
-1	joematsav thanks joe
-1	selena gomez i m making hits not hit boy in mexico selena gomez s trip south of the border is strictly prof http t co po6vrb7qjh
-1	ticklesam will be for me umpaumpapapa
-1	tmz selena gomez i m making hits not hit boy in mexico http t co yroqliurc0
-1	rt theladbible he had no other choice http t co l00dqofov2
-1	selena gomez i m making hits not hit boy in mexico selena gomez s trip south of the border is strictly pro http t co 4yjuybi8nh
-1	joe joe miggie eva and chapo didn t let me fight those girls
-1	motivateexpert hi i saw you follow joe vitale and thought you might like this https t co 9cjbvhkuux links in my bio
-1	selena gomez i m making hits not hit boy in mexico http t co tqo4tur8jb
-1	if joe mixes before going back on his mish he owes me food he said it not me
-1	i just called joe and he said he s been sitting at the tim hortons drive thru speaker for over 5 minutes now uh leave desperatefordonuts
-1	rt idiotolympics bruh http t co i7gqn5loel
-1	rt __igetbuckets__ marcus already took off but this was the squad donaldson_bill westonbordis jcast_4 joe rj devon charlie to http
-1	selena gomez i m making hits not hit boy in mexico selena gomez s trip south of the border is strictly prof http t co 3wycbcvpnb
-1	inthetallgrass i was spot on short and not so sweet fishy stephenking joe_hill
-1	rt survivor_tweet all the proof that he s not your averagejoe survivor http t co x13skjq2xw http t co isgfy7pa0c
-1	nice joe boxer tracker band rewards users for doing nothing http t co wg0hkfg31z
-1	rt helpfrankknight we have had support from trevor sinclair matt le tissier bret ormerod scott taylor michael chopra bill joe saunde
-1	rt thando_v01 i must admit joe carroll is brilliant
-1	selena gomez i m making hits not hit boy in mexico http t co lwvotyqvha celebrity
-1	selena gomez i m making hits not hit boy in mexico http t co 49oqbbfnur http t co gwylegq8xc
-1	selena gomez i m making hits not hit boy in mexico http t co q1aktuonz6
-1	rt craighermit friday carlisle saturday dumfries targetwrestling is bringing amazing shows ft projectsabin joe_coffey amp more http
-1	skyfootball best pundit on tv
-1	rt tmz selena gomez i m making hits not hit boy in mexico http t co rjkoeyygxb
-1	i brew a wicked cup of joe
-1	selena gomez i m making hits not hit boy in mexico http t co mzns320dta
-1	selena gomez i m making hits not hit boy in mexico http t co roso3y46nh celebrity gossip
-1	rt mysteryreads featured book mash up by joe klingler http t co nwsb7fbpqy
-1	have you heard molotov cocktail 185 with joe mesmar by d2techno on soundcloud np https t co 0iclz5xlr3
-1	rt chadjordan23 when she follows me back http t co zs2cokb8mj
-1	good morning sarah joe and waseem are your tweeters until 6pm
-1	rt brookefiona 247razz yaba daba doooooooooooooooooooooo http t co 3frmlzffmx joe hockey is in
-1	ljlpc hi i saw you follow joe vitale and thought you might like this https t co i4onlgkw92 links in my bio
-1	rt theoddsbible breaking charles n zogbia wears my nan s curtains http t co knrhtnq5xs
-1	hypolytaviola i_kill_for_joe hugheschris30 thefollowingfan nilhan_evkuran antoniacarilla amypeck2011 abecesi gm saucy xxx
-1	joe blow money at really
-1	joeburgess123 na joe i actually feel ill with what everyone s telling me i m honestly debating drinking tonight i just can t do this again
-1	watched the finale of justified with joe last night sad to see it end
-1	who will our end of year play be about pirate joe or trevor truelove perhaps uppernorwood selsdon drama kids http t co plshuf3eih
-1	joe is the absolute best because he lets me put my freezing cold feet on him it s tru lov
-1	rt football__tweet brooklyn beckham tries to brag about having 1 million followers on facebook before his dad puts him in his place http
-1	when you gotta beat ur dick in the silence of the night
-1	joe nichols hard to be cool http t co n8x42orsiy countrymusic nowplaying
-1	supertortolano hahaha class joe mon the cabbage
-1	i can t be gay i could never have sex with something i respect
-1	rt factsofschool nailed it http t co oj6n6mali5
-1	rt sugar_rae_ some of the little shit adam says is the funniest
-1	rt chelseafc joe cole s superb individual goal v man utd at stamford bridge in 2006 cfc https t co mmmjtsmscc
-1	marcus already took off but this was the squad donaldson_bill westonbordis jcast_4 joe rj devon charlie to http t co mmjlijzegn
-1	vickyfinney_ we did stay up for a while and bill told me it was luke and joe
-1	rt soompi teentop ljoe tries to seduce narsha with 19 comment on matchmadeinheavenreturns http t co 1zqde9hp9q http t co bwwkm
-1	transhumanisticpanspermia deepcried bowserfucker do you think joe biden has ever texted obama a meme http t co np1hehloif
-1	beth hart amp joe bonamassa i d rather go blind etta james cover http t co quh626k4vj
-1	selena gomez i m making hits not hit boy in mexico http t co yzbrcv3e7m
-1	joe hart has admitted mcfcs players have let down under pressure boss manuel pellegrini this season
-1	sarina fake
-1	the divas on wrestling on samoa joe
-1	jcrowther4 past your bed time joe
-1	joe trying to spit game geeeeeet it
-1	sawadeeteahouse hi i saw you follow joe vitale and thought you might like this https t co 86nt1iu3s3 links in my bio
-1	there is an army of people out there trying to do what they can to save these babies each day joe lovethybully http t co lvr8waywhe
-1	i can t complain but sometimes i still do joe walsh
-1	ibanez js24p joe satriani signature electric guitar candy apple http t co agvlwqmiab
-1	faulty shower replacement before amp after
-1	halligan_joe poor mates legs on show and lager its not going to be a good day
-1	rt tmz selena gomez i m making hits not hit boy in mexico http t co rjkoeyygxb
-1	rt starwars linkinpark joehahnlp may the force be with you joe
-1	garypeskett kthopkins she hasn t won nothing she doesn t stand for average joe s
-1	rt stevestfler reasons i don t go to the mall http t co lulm8bhnno
-1	the shocking lies about jfk marilyn monroe elizabeth taylor and joe dimaggio http t co polhg4ulsx http t co fqhfkdtj0h
-1	joe_weller_ well all i can say is your sc storie is on point today we can be vest buddies http t co y4idlrabcz
-1	rt zozeebo happy 18th to my brother joe suggy888 xxx
-1	rt fascinatingvids just a skidding horse and rider http t co sofyfzxzpe
-1	rt redhotsquirrel yougov nowcast has ukip as high as 34 9 in runnymede_and_weybridge vote for joe branco voteukip2015
-1	the shocking lies about jfk marilyn monroe elizabeth taylor and joe dimaggio http t co xvamjriohf http t co idsagdlolx
-1	evenflow71 jackybambam933 how about a little billy idol my friend flesh for fantasy and blue highway i m just sayin joe doubles xo
-1	nowplaying joe ft kelly rowland love amp sex pt 2 clean tune in http t co luhz4uthih
-1	joevinson hey joe have you heard about our upcoming fundraiser event at heaven nightclub gayrugby http t co 1vcnigg7m3
-1	i hope you get a paper cut
-1	hi joe_sugg god bless you always still hoping that you ll follow me back iloveyousosomuch please come to the philippines
-1	ticklesam i m going to my mates bbq today shorts on for me
-1	barclayrae stuartrance stephenmann i ve got one on servicedesk360 http t co gmcpndwcp5
-1	gamespot i will own all of these
-1	rt phill_ie s o to borgore for taking a picture with a soldier in the army literally made my year so much love and respect http t
-1	heading to many irish weddings this year this is how much they re going to cost you a lot http t co ca4au8rfkw http t co 6q4namgbvh
-1	why tf were me and joe wide awake at half eight this morning yet struggle to be up for 11 on college days
-1	rt vauxhall_wales rt amp follow vauxhall_wales to win a 2014 fawales shirt signed by joe allen comp ends 23 59 19 04 15 t amp cs http t c
-1	listen to dr joe gallenberger http t co boa3kg2tkn brain balancing techniques create luck amp abundance through meditation
-1	why the fuck would you think that hammering into corrugated iron was a good idea at 9 in the pissing morning
-1	hugheschris30 antoniacarilla thefollowingfan nilhan_evkuran hypolytaviola i_kill_for_joe amypeck2011 abecesi thank you dear
-1	_joefeehan_ aw thanks joe hate you too
-1	link removed interview dr joe gallenberger manifestation healing amp mind over matter listen live link removed
-1	joe__snipes cack
-1	rt sextaik you re seriously all i want
-1	malumthabo lmao hao thibege joe
-1	been in the restroom for 3 hours now lol
-1	bombshell_joe over
-1	fat joe we thuggin feat r kelly http t co s1wt1njidi nowplaying listenlive
-1	rt maltarfu morning folks and what a day it is in israel game day 2pm kick off maltese time watch the game live http t co p0dbucubix
-1	link removed interview dr joe gallenberger manifestation healing amp mind over matter listen live link removed
-1	i liked a youtube video from joe_weller_ http t co tcn13supwu stop parents doing this
-1	link removed rt 4125_joe_llen_n followtrick retweet follow all who rt followback gain today onedirectio
-1	j0eruns irarainey flingrace you don t know what tablet is you are missing a trick there joe basically just a lump of pure sugar
-1	please tell me why there still learning don t they have people that do countless hours research already https t co fy5ba9gc4h
-1	get rewarded to relax with the joe boxer inactivity tracker take time to chillhard sp http t co b62axdggld
-1	special mention to dannywgibbs amp joe lewis who will make their 1st xi debuts today awscl
-1	rt tmz selena gomez i m making hits not hit boy in mexico http t co rjkoeyygxb
-1	rt tmz selena gomez i m making hits not hit boy in mexico http t co rjkoeyygxb
-1	rt tmz selena gomez i m making hits not hit boy in mexico http t co rjkoeyygxb
-1	i can t take fucking more
-1	rt tmz selena gomez i m making hits not hit boy in mexico http t co rjkoeyygxb
-1	rt tmz selena gomez i m making hits not hit boy in mexico http t co rjkoeyygxb
-1	akashhsharmaa well if that s the case with me i don t think il be graduating
-1	rt tmz selena gomez i m making hits not hit boy in mexico http t co rjkoeyygxb
-1	rt tmz selena gomez i m making hits not hit boy in mexico http t co rjkoeyygxb
-1	rt tmz selena gomez i m making hits not hit boy in mexico http t co rjkoeyygxb
-1	rt tmz selena gomez i m making hits not hit boy in mexico http t co rjkoeyygxb
-1	me and joe finally have internet so happy we ve got sky tv too
-1	hugheschris30 thefollowingfan nilhan_evkuran i_kill_for_joe hypolytaviola antoniacarilla amypeck2011 abecesi clara210367 ty love
-1	joe_sugg hope you re having fun in france
-1	joe id hate to be your pants mate
-1	joe budden ordinary love keep running clean http t co lsjau1xgb8 egr
-1	joeholland9 cheers joe but we all know that she s your girl can t take her away from you
-1	rt tmz selena gomez i m making hits not hit boy in mexico http t co rjkoeyygxb
-1	rt tmz selena gomez i m making hits not hit boy in mexico http t co rjkoeyygxb
-1	you don t have to be big you have to be remarkable joe pulizzi quote
-1	rt authorgialee joeeliseon teodorflonta frostiemoss eve lindleye lmontanad voracious_steve hey joe hope your weekend is off t
-1	rt tmz selena gomez i m making hits not hit boy in mexico http t co rjkoeyygxb
-1	rt tmz selena gomez i m making hits not hit boy in mexico http t co rjkoeyygxb
-1	rt nflnetwork greatest maybe amazing that s an understatement joe montana s top 5 plays of all time http t co 3ax8kfcsac http t
-1	rt tmz selena gomez i m making hits not hit boy in mexico http t co rjkoeyygxb
-1	nowplaying fat joe another round ft chris brown flowjamz hiphop fatjoe http t co t36ynvjltw http t co hhzk25x1rk
-1	rt tmz selena gomez i m making hits not hit boy in mexico http t co rjkoeyygxb
-1	rt tmz selena gomez i m making hits not hit boy in mexico http t co rjkoeyygxb
-1	rt tmz selena gomez i m making hits not hit boy in mexico http t co rjkoeyygxb
-1	halligan_joe i might not wear my coat might stick with the cardigan
-1	rodgers so when it comes you have got to be ready to take it and that s something that i know the players are waiting and ready for
-1	http t co uxteavtldf music epiphone joe bonamassa les paul goldtop w ohsc limited edition http t co ohz25ftfqb
-1	banana vinyl from record shop day 2014 https t co qaqnpj3dc6 free to download for today proberecords
-1	gain followers rt this must follow me i follow back follow everyone who rts gain votalali staystrongexo love j
-1	rt tmz selena gomez i m making hits not hit boy in mexico http t co rjkoeyygxb
-1	producerjoseph megcross get it joe
-1	rt tmz selena gomez i m making hits not hit boy in mexico http t co rjkoeyygxb
-1	rt tmz selena gomez i m making hits not hit boy in mexico http t co rjkoeyygxb
-1	rt paytonsorensen1 he got down on one knee and tied my shoe feat parker joe looking at the booty http t co vnjgn6louv
-1	rt tmz selena gomez i m making hits not hit boy in mexico http t co rjkoeyygxb
-1	rt disneywords love does things for reasons that reason cannot understand joe the princess diaries 2
-1	rt tmz selena gomez i m making hits not hit boy in mexico http t co rjkoeyygxb
-1	rt tmz selena gomez i m making hits not hit boy in mexico http t co rjkoeyygxb
-1	lt drunk af
-1	rt tmz selena gomez i m making hits not hit boy in mexico http t co rjkoeyygxb
-1	rt tmz selena gomez i m making hits not hit boy in mexico http t co rjkoeyygxb
-1	rt tmz selena gomez i m making hits not hit boy in mexico http t co rjkoeyygxb
-1	rt tmz selena gomez i m making hits not hit boy in mexico http t co rjkoeyygxb
-1	rt tmz selena gomez i m making hits not hit boy in mexico http t co rjkoeyygxb
-1	rodgers you can t take it for granted you just never know in your life and professional sport when the opportunities arise again
-1	hugheschris30 nilhan_evkuran i_kill_for_joe hypolytaviola antoniacarilla amypeck2011 abecesi clara210367 thank you sweet chris
-1	rt tmz selena gomez i m making hits not hit boy in mexico http t co rjkoeyygxb
-1	now on http t co 7vr38klwke joe dolan make me an island lonestar radio 60 s good vibes
-1	rt dradamfletcher our e cigarettes research was discussed in the nytimes op ed yesterday peering through the haze http t co fqj2uc
-1	matchday mufc manutd mufclive premierleague chemun
-1	rt tmz selena gomez i m making hits not hit boy in mexico http t co rjkoeyygxb
-1	rt tmz selena gomez i m making hits not hit boy in mexico http t co rjkoeyygxb
-1	joedotie video stunning drone footage captures just how beautiful ireland looks http t co e8jskvurij http t co rfovzldbmb
-1	annafrancisx joe_johnson9 she looks like what i used to feed my snakes when she was born
-1	rt tmz selena gomez i m making hits not hit boy in mexico http t co rjkoeyygxb
-1	rt tmz selena gomez i m making hits not hit boy in mexico http t co rjkoeyygxb
-1	rt tmz selena gomez i m making hits not hit boy in mexico http t co rjkoeyygxb
