-1	henryvalantine joe_l_whiting please please do henry
-1	jazz joe ingles mutually interested in new deal http t co bfz4fe2tjv nba utahjazz
-1	cassidyguitars hi i saw you follow joe vitale and thought you might like this https t co fkzeswhwab links in my bio
-1	rt markgkirshner thanks to my top interactors joe_1122 top_member tripletsfan19 kankichiryotsu oda_f via http t co d6g4mks5ca
-1	biden s still biding via politico for ios http t co cfmypog5yz
-1	rt bakersfieldjam congratulations to joe jackson on being named 2015 nbadleague most improved player bakersfieldproud http t co cu2r
-1	rt sprinklesyt youcantseeme42 happy birthday brotha joe have a good one
-1	joe_third trust me it s beyond bad over here lmao i just need a little push
-1	man crush amp woman crush it needs to be said joe_sugg milakunis http t co aw8erqp2qm
-1	joe brooks lt 3
-1	rt fa anything can happen says joe cole as he sets sights on adding to his three facup medals http t co r0nlvu2yw6 http t co ujekv
-1	ellabalotellix well at least you can pick anywhere in the whole stadium
-1	nowplaying i d rather have a love by joe on bsoulradio
-1	i clicked i liked i rt i got it for free that simple from average joe http t co fptag5qxjf iamrevolution spitter
-1	rt vauxhall_wales rt amp follow vauxhall_wales to win a 2014 fawales shirt signed by joe allen comp ends 23 59 19 04 15 t amp cs http t c
-1	joe_honeybadger we re going on a trip in our favorite rocket ship
-1	joe_lfz hahahahaha if only it was that simple
-1	rt substrate doctor do u smoke drink are u sexually active do u ever get nervous are you single i heard u fucked ur girl is it true
-1	such a great night
-1	big shout out to team cloudgridorg way to kick butt in rome and take home the prize nsc15 nextstepchallenge
-1	what ever happened to cotton eye joe like what did they do to him
-1	joe murfin thanks for following me http t co rdtinmwyd4
-1	i know what you want to hear
-1	disini lagie kitee with marlone joe prisilia and prisilia at the urban gym pic https t co aunacqrjmy
-1	haven t heard this song in a while
-1	rt kinharris_cfc joe cole made united defenders plain shit what a great goal 2005 06 season
-1	rt vauxhall_wales rt amp follow vauxhall_wales to win a 2014 fawales shirt signed by joe allen comp ends 23 59 19 04 15 t amp cs http t c
-1	rt bbcbreaking cricketer james anderson overtakes ian botham s record to become england s top wicket taker http t co stwpzq5zz3 http
-1	fat joe ft troy ave 01 how u luv dat clean http t co 7ls1zge1f1 nueramedia
-1	rt bakersfieldjam congratulations to joe jackson on being named 2015 nbadleague most improved player bakersfieldproud http t co cu2r
-1	techarazi hi i saw you follow joe vitale and thought you might like this https t co skfwhgfubl links in my bio
-1	cigarettes on cigarettes my momma think i stank
-1	joe s jeans the brixton denim womens 34 x 33 http t co kdc1givtsx http t co c1ruqgbcsp
-1	rt skycricket bob willis urges jimmy9 to aim for 500 test wickets after breaking beefybotham s record http t co jmn36ptsbm http t
-1	jeffprobst yes please bring joe back he deserves it
-1	marsbennett mehh
-1	joe jones will call http t co t19fxykj8n nowplaying listenlive
-1	selfie or normal photo with joe tonight i m going into the venue on my own so i could ask someone to take the photo i suppose
-1	rt tumbierposts you okay babe yeah fine http t co pptobgpwjj
-1	hey but what s hard times without the people you love
-1	breakmysoulties i thought i had it bad over here
-1	rt clifba sorry i yelled finish him at your wedding
-1	biosgraphy hi i saw you follow joe vitale and thought you might like this https t co lcf0n1gzad links in my bio
-1	rt brent_dave jduffyjoe hullcricketclub great to see joe
-1	joe budden the person and joe budden the rapper are two completely different people and i prefer the rapper i do like his podcast though
-1	rt dwiskingbeef s o to my bros aaroncamper pudgetribbett musiqboy3 adrape582 curtworld smashin joe s pub right now
-1	rt vauxhall_wales rt amp follow vauxhall_wales to win a 2014 fawales shirt signed by joe allen comp ends 23 59 19 04 15 t amp cs http t c
-1	merely measuring something has an uncanny tendency to improve it joe kraus founder of excite
-1	rt leagueacs if it flies it dies malta s hunters get green light for bird slaughter http t co zfwlqqsien new blog by leaguejoe
-1	joe_weller_ great banter internetmelt http t co kncdrrks2l http t co wiyojpzx11
-1	mcelderrylover tonight is joe mcelderry night
-1	joe murfin thanks for the follow feel free to drop by http t co a46qc3nykk
-1	tbigggs janglim21 i made a tweet to jeff about getting joe back it got 35 retweets it s not a lot but i think he noticed it lol
-1	rt vauxhall_wales rt amp follow vauxhall_wales to win a 2014 fawales shirt signed by joe allen comp ends 23 59 19 04 15 t amp cs http t c
-1	rt garykiro7 bonney lake scene is a confirmed suicide murder gathering more now http t co rcfdcthxuk
-1	rosaaahh_ dont trip i got a rocket ship
-1	joe chase that dream man
-1	rt troll__football psg have a new logo via joe_co_uk http t co ld2awmqaqf
-1	rt myrtlelyn714 i added a video to a youtube playlist http t co llicjfepws joe nichols brokenheartsville
-1	shit i forgot i have to wake up early tomorrow
-1	any team with christophe berra at centre half can be beaten on the day itfc wwfc
-1	all these bitches ask joe blow can i please be yo bitch nah you can be my hoe
-1	jameshartill wake joe up pls
-1	leblancpatricia hi i saw you follow joe vitale and thought you might like this https t co leluwsi8iq links in my bio
-1	all the things your man won t do joe http t co yexbubjxrt itunes iphone
-1	this cb danialandika said i can be a bass with only one note hahahahah fak u
-1	mertenhou but decapitation is barbaric joe sixpack
-1	joe_honeybadger yeah it was bc when my friend hugged me she accidentally hit my glasses and my lens disappeared to another world and shit
-1	rt bakersfieldjam congratulations to joe jackson on being named 2015 nbadleague most improved player bakersfieldproud http t co cu2r
-1	rt vauxhall_wales rt amp follow vauxhall_wales to win a 2014 fawales shirt signed by joe allen comp ends 23 59 19 04 15 t amp cs http t c
-1	rt vauxhall_wales rt amp follow vauxhall_wales to win a 2014 fawales shirt signed by joe allen comp ends 23 59 19 04 15 t amp cs http t c
-1	joemcelderry91 g day joe hope the sun is shining down there in somerset and safe travel to wsm laters a day nearer to me seeing you xxx
-1	rt therealavejoe avejoe iamrevolution teamavejoe 478 spitter press play from average joe http t co fptag5qxjf
-1	i want a friendship like danisnotonfire amp amazingphil joe_sugg amp caspar_lee kianlawley amp jccaylen
-1	bitch u got me fucked up i ain t no side nigga
-1	rt starwars linkinpark joehahnlp may the force be with you joe
-1	markbenhall pathetic wes hoolahan s dive was pathetic norwich dominated but we defended incredibly boro believe
-1	rt thrllerr shoutout to katherine and joe for not using a condom and creating a legend http t co ynce1jwf9y
-1	joejoneill hi joe follow us maybe
-1	rt sfnewsnow 6 injured as driver smashes trader joe s in los altos http t co i3cx1lni2f sanfrancisco http t co sopldekv03
-1	i liked a youtube video from hiphopgamer http t co 9c6ogqj67k joe montana football 16 confirmed to be triple a budget title
-1	that s why dad named you joe dirt instead of nunamaker
-1	crazy joe smoothie amp juice bar https t co 8nf35wbawp
-1	arupatesolin hi i saw you follow joe vitale and thought you might like this https t co lj8u9n36o9 links in my bio
-1	damon grows new screenshot joe montana football 16 http t co bjxcvu3tn3
-1	torrecioffi joefcc right torre the patriots dont suck you suck joe
-1	rt starwars linkinpark joehahnlp may the force be with you joe
-1	rt p4ulawilliams joe mcelderry i look to you how we love frome acoustic show http t co 8org8ujiva via youtube
-1	confirmed i can still eyeball a joe s cup white russian that osu education is paying dividends
-1	conceiving a duet between joe dolce and midge ure what sa matter you it means nothing to me why you looka so sad it means nothing to me
-1	tbigggs janglim21 joe will play again
-1	sayerseve joe_l_whiting it might be cold by the time it gets to you shall i wrap it in tin foil
-1	rt camilacabello97 the stunning confident magical woman standing next to me is named camila joe i met her during a https t co zkpsr
-1	mizzblueshirt douche killed her or joe weider with his dick i m scrambling
-1	katiekat189 awwww murray haha i m okay with it but i think i d have the balls of joe idgaf what people think
-1	amy_wolves321 joe sugg is ugly
-1	1960 topps 562 all star joe cunningham ex mt a37132 http t co vsrbzoxcgd http t co pr4o7sdzfy
-1	hello joe defleppard joeelliott http t co iyqlkzsamk
-1	syaibanamalik stay in rp then you wont miss them hahahahahah
-1	rt mrpaulaitken stand up and be counted ge2015 votesnp snp http t co arynclkqhu
-1	ride wit me astonmartin astonmartinjakarta astonmartin latepost beverly hills california https t co h8htysqwks
-1	rt kabetes uhuru cannot appoint serious sons from luhya nation like hon bonny khalwale to the cabinet coz he fears competition and indep
-1	orica greenedge looks to continue classics momentum in ardennes http t co 6zqhwmugqo
-1	rt chelseafc joe cole s superb individual goal v man utd at stamford bridge in 2006 cfc https t co mmmjtsmscc
-1	i ve seen joe campos for the past 5 days in a row what
-1	halligan_joe it s bloody freezing
-1	spichael1964 hi i saw you follow joe vitale and thought you might like this https t co 67plzudmiu links in my bio
-1	free ebay sniping rt http t co gnyuxpldyz vintage g i joe adventure team shark 2 gray 1 black squid king cobra snake l please fav
-1	if you would like to hear joe i was beginning when joe got up and cancelled my ride so i d get charged i m 15 minutes from him wtf
-1	free ebay sniping rt http t co bfeqpjugsu gi joe 25th target exclusive 5 python patrol vipers 3 75in figures please favorite amp sh
-1	rt therealavejoe avejoe iamrevolution teamavejoe 478 spitter press play from average joe http t co fptag5qxjf
-1	joe_sugg smoking if you loved him so much you would let him have fun
-1	killer whale killer whale killer whale killer whales
-1	lascano_joe you won t them tho
-1	when you had one too many drinks and drop that nay nay joe_chea katra lounge 217 bowery st https t co x2audd7xhx
-1	free ebay sniping rt http t co 4aejus3lby gi joe vintage cobra rattler 100 complete with wild weasel please favorite amp share
-1	rt f3o3a3r tell that woman she s beautiful and tell those children that they can do anything
-1	rt grandenlovato twatcharli 3 without the love is about a break up but the guy was still singing her love songs the guy aka joe jonas c
-1	joe_l_whiting henryvalantine make me breakfast too please henry this is serious
