-1	kennedylryan borderlinefemme every time i watch life itself i have to consciously avoid sobbing unless i m alone then i let it out
-1	if you lead your life the right way the karma will take care of itself the dreams will come to you randy pausch
-1	life is not meaningful to us unless serving an end beyond itself unless it is of value to someone else abraham j herschel
-1	rt xx0lea not only do we need to pray for the family but we need to pray for life itself
-1	rt ascottstories katewurtele loves lettuce more than life itself
-1	rt futurestyles94 harry_styles if i get 300 rts will you follow me you mean the world to me i love you more then life itself please
-1	rt xx0lea not only do we need to pray for the family but we need to pray for life itself
-1	life itself is way too creepy
-1	rt joeydiggsjr life is and always will be stressful its all about how you handle stress itself
-1	lynncinnamon themoongyrl and fate life itself
-1	listen to life itself by mariovinuela np on soundcloud https t co s7zjykjcvw
-1	love these people more than life itself thank yall for celebrating this moment with me love you https t co yawumwfxqy
-1	i love jimmy fallon more than i love life itself
-1	remember just because someone has money doesnt mean their life is perfect allah is testing them differently having money is a test itself
-1	rt ascottstories katewurtele loves lettuce more than life itself
-1	rt thefugard cabaret is oozing with life visiting the fugard is a theatrical experience in itself it feels like http
-1	life living is a challenge itself getting through all kind of experiences but still staying true https t co s0liherl4p
-1	i love food more than life itself
-1	rt joeydiggsjr life is and always will be stressful its all about how you handle stress itself
-1	it is crazy how fast tables can turn all it takes is a blink of an eye
-1	rt mofanon many speakers touched on how knowledge production is divorced from real life somali reality itself cadaanstudies
-1	rt mobydickatsea he toiled away as if toil were life itself and the heavy beating of his hammer the heavy beating of his heart
-1	laurengiraldo tweets will teach you more about life than life itself
-1	i love my cats more than life itself http t co jjxliko1qx
-1	to love a woman is to never ever abandon her abandon the woman u love more than life itself and u will lose yourself i can promise u that
-1	when you look back at when you thought your life was over now you re just so content with life itself
-1	rt kh_king_queen klayley is my love and i love it more than life itself josephmorgan 1phoebejtonkin http t co kdky4soeqd
-1	silverladyqueen anyone let alone the one he loves more than life itself my love what more could i say about you you are the reason
-1	love booty more than life itself http t co lbjagf8bzv
-1	i this girl more than life itself my http t co mxhumzj61u
-1	i think he had changed n hv been changed all bout his life amp its obvious changed in n of itself isnt it goodtoseeyouzayn
-1	not only do we need to pray for the family but we need to pray for life itself
-1	there is nothing more beautiful in life than life itself sit back and enjoy the ride
-1	rt rrrrrrachelhawk life itself is just a blessing and a half
-1	procrastination is just fear disguising itself due to not knowing the cards life will deal it poetry
-1	shadymelih true but it s cool to see more real life ish pokemon in the anime the game itself is great we can t leave that aside
-1	my life motto if my dream is to be a successful artist then i will work to change music itself
-1	life wastes itself while we are preparing to live ralph waldo emerson
-1	rt kh_king_queen klayley is my love and i love it more than life itself josephmorgan 1phoebejtonkin http t co kdky4soeqd
-1	omardontcare absolutely it s not like its essential to life itself at all
-1	i am getting so close
-1	i cannot for the life of me eat garlic mayo by itself
-1	life itself is the most wonderful fairytale of all 4 17 2015 https t co tv2fne6lhm
-1	life itself is a risk
-1	rt kh_king_queen klayley is my love and i love it more than life itself josephmorgan 1phoebejtonkin http t co kdky4soeqd
-1	emilyjanequinn i m going to bed love you more than life itself xxxxx
-1	bluebloodraptor theliluminatii pay better attention cause you were wrong hah anyways i worship nothing but life itself deal with it
-1	daviduzumeri kate upton is ruining life itself she s so boring yet i guess i have to care because she s attractive
-1	i love you more than life itself https t co huzody13v7
-1	katewurtele loves lettuce more than life itself
-1	rt iamch0pper analyze and examine the events in your life until that lesson reveals itself to you then apply what you have learned amp mov
-1	writing like life itself is a voyage of discovery http t co el0oczohfp
-1	rt delpradoreagle i love bemmccon more than life itself
-1	to my country who i love more than life itself https t co tkinefezln
-1	life itself is just a blessing and a half
-1	sometimes in life your situation will keep repeating itself until you learn your lesson brigitte nicole
-1	rt annrae education is not preparation but education is life itself iddo oberski tedxqmu2015
-1	rt brain_the_tool purpose the vitality of life itself
-1	i love bemmccon more than life itself
-1	imagination is the soul revealing of itself eternal wonders let imagination run away with you in joy the life natural pleasures
-1	i don t believe in fighting for ppl life in itself is already a fight a struggle for survival you wanna b here good if not good
-1	life wastes itself while we are preparing to live ralph waldo emerson
-1	rt cancerterms love a cancer amp she will love you more than life itself betray a cancer amp she will never let you forget it
-1	rt thehopecatcher many parents hate their kids abuse abandon them amp even murder them many love their children more than life its
-1	our duty is wakefulness the fundamental condition of life itself
-1	rt kh_king_queen klayley is my love and i love it more than life itself josephmorgan 1phoebejtonkin http t co kdky4soeqd
-1	rt iamch0pper analyze and examine the events in your life until that lesson reveals itself to you then apply what you have learned amp mov
-1	we like miracles life itself is a miracle feel connected to the source u can do wonder u have that strength jai gurudev _ _
-1	many parents hate their kids abuse abandon them amp even murder them many love their children more than life itself but are separated
-1	rt gnarlykenz 666houseplant awww girlfriend ur so cute i love u more than life itself
-1	666houseplant awww girlfriend ur so cute i love u more than life itself
-1	analyze and examine the events in your life until that lesson reveals itself to you then apply what you have learned amp move forward
-1	about sleep it was life itself in sleep format patiencerandle
-1	rt tandrade6 i love sara shevlin more than life itself bae
-1	rt kh_king_queen klayley is my love and i love it more than life itself josephmorgan 1phoebejtonkin http t co kdky4soeqd
-1	i love sara shevlin more than life itself bae
-1	all i wanted to do was go eat and chill with you instead i m home by myself because life itself is a joke
-1	we are all little more than ticks sucking on life itself enjoy it whilst you can because one day you will be full
-1	you need to learn to hate life to the point where you want to get revenge on existence itself
-1	i ve suddenly realised that what i am writing is itself ruining the game of life
-1	rt joeydiggsjr life is and always will be stressful its all about how you handle stress itself
-1	rt joeydiggsjr life is and always will be stressful its all about how you handle stress itself
-1	i love abbey more than life itself
-1	jacobwhitesides i love you more than life itself
-1	rt kh_king_queen klayley is my love and i love it more than life itself josephmorgan 1phoebejtonkin http t co kdky4soeqd
-1	i m so exhausted from life itself that i think i ve given up entirely
-1	i love this woman more than life itself lord knows i wouldn t be here without her one of the https t co essnztjaju
-1	rt joeydiggsjr life is and always will be stressful its all about how you handle stress itself
-1	rt loveand_betrey i look forward to genuinely sharing myself with someone again experiencing and enjoying life together a bond that
-1	rt brianheadwelch jesus said i am the one who brings people back to life amp i am life itself those who believe in me will live even if
-1	rt kh_king_queen klayley is my love and i love it more than life itself josephmorgan 1phoebejtonkin http t co kdky4soeqd
-1	rt kh_king_queen klayley is my love and i love it more than life itself josephmorgan 1phoebejtonkin http t co kdky4soeqd
-1	i love my big more than life itself reunited perfect10 wedontgiveafuck https t co 0rnpmk1pou
-1	rt iamjessikac i love my mother more than life itself amp that s a fact
-1	klayley is my love and i love it more than life itself josephmorgan 1phoebejtonkin http t co kdky4soeqd
-1	why does life continue to insist upon itself
-1	rt veganfoodrecipe poor animals how jealously they guard their bodies for to us is merely an evening s meal but to them is life itself
-1	don t even think of that there s no compare dubai is the life itself https t co zqeprm97yl
-1	rt sadhgurujv your education your family your home and whatever else are just accessories the most valuable thing in life is life its
-1	rt intmf when dogmas and beliefs fall away what remains is a strength a certainty of love and faith in life itself http t co 5beid
-1	today an abandoned rottweiler puppy crossed the road by itself and it made me so fucking sad that i couldn t rescue it life isn t fair
-1	rt loveand_betrey i look forward to genuinely sharing myself with someone again experiencing and enjoying life together a bond that
-1	i knew i loved you more than life itself
-1	that willow bitch from the kardashian game angers me more than life itself
-1	rt kayla_xoxo11 love these girls more than life itself forever amp always my sisters idk what i would do with out them http t co uud
-1	if living is searching and seeking for love itself then is that enough reason to continue living i don t feel love is worth your life
-1	rt joeydiggsjr life is and always will be stressful its all about how you handle stress itself
-1	life itself is miracle
-1	he hides himself away in the angles of air outlined by his knack for believing that this life it s gonna work itself out
-1	999happyhops i m like that glowing tree thing in avatar and my tweets are like spores of life itself http t co mnqfmhg387
-1	insouthflorida that i have life itself
-1	rt joeydiggsjr life is and always will be stressful its all about how you handle stress itself
-1	rt fifthharmony daily reminder we love you more than life itself
-1	life is not about goals itself life is about the journey we all have to travel and the amount of passion we have http t co pmhnj8lyke
-1	what is the most important thing for itself even money isn t also the life i notice after something really important is missing
-1	passion is an energy force all by itself and when you apply it to vision you attract the time money and expertise you need in your life
-1	rt psycho__quotes fortunately analysis is not the only way to resolve inner conflicts life itself still remains a very effective therapi
-1	life hack if you leave the gas door open on your car just drive so fast it shuts itself
-1	life isn t fair and that in itself is as fair as can be
-1	georgiaar5 i dunno like life itself is at such a standstill it s weird
-1	i love you more then life itself http t co 1kysb8pzjl
-1	rt mobydickatsea he toiled away as if toil were life itself and the heavy beating of his hammer the heavy beating of his heart
-1	have no expectations life itself is a total surprise amwriting writerslife
-1	rt mattiehunter22 yasmineileen love you more than life itself i m so lucky to have your encouragement
-1	yasmineileen love you more than life itself i m so lucky to have your encouragement
-1	tonys pizza i love you more than life itself lol
-1	life itself gives you a true test of patience with the lords help you ll do great
-1	pinkiaceiouis you are prettier than my life itself
-1	swirj it s the fate itself it s the life itself once you have consider concrage others on trying colour the world
-1	my baby had crazy hat day at her school today i love this little girl more than life itself https t co dwx1tmy9cl
-1	ashley_mathews1 my bestfriend love her more than life itself
-1	part of the happiness of life consists not in fighting battles but in avoiding them a masterly retreat is in itself a vict
-1	rt expherience the flower of life amp life itself http t co dfbzmuo6mg
-1	i love hideyoshi nagachika more than life itself honestly
-1	life itself by c brown
-1	everyone can be your friend only when you remember life itself would end
-1	i love my bed more than life itself
-1	rt joeydiggsjr life is and always will be stressful its all about how you handle stress itself
-1	rt suitandtieix it spreads like a virus disrupts the whole system to the core the life itself loses its very meaning the chaos within
-1	don t you know you re life itself like a leaf clings to a tree oh my darling cling to me
-1	rt obexitas sometimes i m bad at expressing my feelings because i d been hurt in the past i don t want to see life repeating itself like
-1	life is a delicate balancing act friday night is when you become the act itself http t co s6975uezzi
-1	without duty life is sort of boneless it cannot hold itself together joseph joubert
-1	rt mariah_duffy colleenparisi i love you more than life itself we need to celebrate my turning 17
-1	rt joeydiggsjr life is and always will be stressful its all about how you handle stress itself
-1	jus bout life itself
-1	i m still learning and experiencing life by itself for rn i don t need a religion until i have someone to teach it to
-1	rt mredz018 seeing how god works is the most amazing thing in this life besides his love and salvation itself
-1	to love a woman is to never abandon her abandon the woman you love more than life itself amp you will lose yourself i promise you that
-1	seeing how god works is the most amazing thing in this life besides his love and salvation itself
-1	diversamusic same man same that city has life itself in that beautiful complex
-1	rt grind4_god learn to appreciate what you have life itself is a blessing be thankful to god for everything he gives you
-1	queerhipster yeah but what life exist without the cosmos itself
-1	rt mayalouu_ i love my mother more than life itself and that s a fact
-1	this ufo show has me contemplating life itself
-1	rt suitandtieix it spreads like a virus disrupts the whole system to the core the life itself loses its very meaning the chaos within
-1	rt woodlandschurch your unfailing love is better than life itself how i praise you i will praise you as long as i https t co sjtuipb
-1	i think our society should transform itself from monolingual one to bilingual one we should use both japanese and english in daily life
-1	your unfailing love is better than life itself how i praise you i will praise you as long as i https t co sjtuipbum1
-1	not life itself but the circumstances that i m in
-1	rt __justise i love you more than life itself http t co zes7gckfpu
-1	iamebunoluwa this baby boy life won t live itself you know
-1	life goal liberland_org liberland prides itself on personal and economic freedom of its people brilliant
-1	rt nanoelorfy bookqtss life is like a multiple question sometimes the choices confuses you not the question itself that s so accur
-1	make good decisions and life will take care of itself
-1	rt tammleigh focus on your own life and everything else around you falls into place nicely by itself
-1	rt iamjessikac i love my mother more than life itself amp that s a fact
-1	rt joeydiggsjr life is and always will be stressful its all about how you handle stress itself
-1	rt wonderofbeing and life itself is grace in silence it speaks who are you it asks you who i have sought for so long who htt
-1	__ blending workout sessions into a hectic life can be an art in itself you need to know your limits
-1	when i was 14 years old i wanted a lamborghini countach more than life itself i m glad i grew out of that
-1	onion bhaji on pizza is the best thing since life itself
-1	life itself chris brown ft kevin mccall
-1	always be happy not because life is full of reasons to smile but because your smile itself is a reason for others to smile
-1	rt grind4_god learn to appreciate what you have life itself is a blessing be thankful to god for everything he gives you
-1	i love you more than life itself http t co zes7gckfpu
-1	rt hadeswhore jessquanas nudes gt life itself
-1	rt bookqtss life is like a multiple question sometimes the choices confuses you not the question itself
-1	jessquanas nudes gt life itself
-1	chris brown life itself
-1	bookqtss life is like a multiple question sometimes the choices confuses you not the question itself that s so accurate i m gonna cry
-1	rt mobydickatsea he toiled away as if toil were life itself and the heavy beating of his hammer the heavy beating of his heart
-1	life itself is a privilege but to live life to the fullest well that is a choice andy andrews
-1	rt haleshalogen love this dork more than life itself http t co bepstfglp6
-1	rt haleshalogen love this dork more than life itself http t co bepstfglp6
-1	rt haleshalogen love this dork more than life itself http t co bepstfglp6
-1	80 life will bring pain itself your responsibility is to create alegr a milton erickson
-1	my whole heart in one picture i love you more than life itself rest in paradise baby http t co pssdl1k8yt
-1	oxygenproducers i ve been really off here and life itself my apologies thanks for missing me though
-1	silence rarer than life itself
-1	rt xxbarbiexo my life would be a lot easier if my hair and makeup would just do itself
-1	so tired of life itself
-1	mikewhiteatcj something cannot create itself law of science life does not come from chemistry amino acids cannot randomly produce life
-1	rt grind4_god learn to appreciate what you have life itself is a blessing be thankful to god for everything he gives you
-1	rt grind4_god learn to appreciate what you have life itself is a blessing be thankful to god for everything he gives you
-1	your past itself holds the key to know your life path god was with you then like is with you now ankush modawal
-1	rt grind4_god learn to appreciate what you have life itself is a blessing be thankful to god for everything he gives you
-1	learn to appreciate what you have life itself is a blessing be thankful to god for everything he gives you
-1	rt islwyn_izzy i have always preferred the reflection of life to life itself fran oistruffaut quote life http t co jwjl3ne24p
-1	i swear to god i love her more than life itself https t co hdy6wcgfhx
-1	aside from the amazing singing itself the way velvetgh0st amp hobbiestuart look at eachother gave me feels beyond life pls just be together
-1	check out my review of the wonderful documentary life itself ebertmovie on the latest ep of reelsnobs http t co zxj5nhw1ja
-1	rt iamjessikac i love my mother more than life itself amp that s a fact
-1	rt obexitas sometimes i m bad at expressing my feelings because i d been hurt in the past i don t want to see life repeating itself like
-1	i love my mother more than life itself amp that s a fact
-1	life will bring you pain all by itself your responsibility is to create joy milton erickson
-1	education is not preparation for life education is life itself
-1	rt haleshalogen love this dork more than life itself http t co bepstfglp6
-1	rt hadweyy happy birthday homeslice ily u more than life itself http t co g9mrsj4etu
-1	js1 i loved bakugan more than life itself
-1	my life is just an awkward moment itself tbh
-1	i love my mom more then life itself and that s a fact
-1	rt officialneurot stevevontill track in your wings from solo lp a life unto itself now streaming classicrockmag http t co pyod5ocxxz
-1	happy birthday homeslice ily u more than life itself http t co g9mrsj4etu
-1	rt sadhgurujv your education your family your home and whatever else are just accessories the most valuable thing in life is life its
-1	rt luxuriouslijah conversations about reality or curiosity of life itself are so much better than a typical humorous one i like when peo
-1	nataliejortsman pbmc2 is really a narrative about the existential nature of life itself
-1	the_vy2 it s odd but life itself is odd just got to live with it he nods
-1	rt jaydavis39 peachyfiend that s not life creating itself that s scientists adding to pre existing cells that s not creation that s m
-1	your daily reminder that representation while important does not automatically make racism go away by itself http t co w3zluydlx4
-1	rt philosopherk1ng life itself is one big synchronistic event
-1	rt haleshalogen love this dork more than life itself http t co bepstfglp6
-1	rt _elixabethh17 done with people and life itself just going to be by myself from now on really don t have time for negative thing
-1	rt nyeka_ my life is falling apart so bad but re building itself at the same time
-1	rt a_everitt no thing more beautiful than life itself
-1	the revolutionary artist is the face of the struggle his art transcends mere pictorial representation it is a vision of life itself
-1	focus on your own life and everything else around you falls into place nicely by itself
-1	rt haleshalogen love this dork more than life itself http t co bepstfglp6
-1	preach itsvictrey it seems man is more interested in developing the quality of life while having no regard for life itself
-1	poor animals how jealously they guard their bodies for to us is merely an evening s meal but to them is life itself vegan
-1	rt haleshalogen love this dork more than life itself http t co bepstfglp6
-1	thomas szasz he who does not accept and respect those who want to reject life does not truly accept and respect life itself respect
-1	rt joeydiggsjr life is and always will be stressful its all about how you handle stress itself
-1	love this dork more than life itself http t co bepstfglp6
-1	life itself chris brown
-1	rt nyeka_ my life is falling apart so bad but re building itself at the same time
-1	i love blink182 more than life itself
-1	rt xsteveroque life itself is truly amazing and i m absolutely thankful to be apart of it
-1	chatterbury nope it is half of a potential person not murder at all only the women body that prepares itself for life
-1	i want answers but what is life but a question infinitely within itself
-1	rt killharrystyle harry styles is the demon king he has risen from hell itself i m doing you all a favour by ending his damn life
-1	rt f7yub everything you encounter in life whether it s from people or life itself is only allah s gods way to prepare you for when
-1	rt xsteveroque life itself is truly amazing and i m absolutely thankful to be apart of it
-1	rt xsteveroque life itself is truly amazing and i m absolutely thankful to be apart of it
-1	my life is falling apart so bad but re building itself at the same time
-1	rt godscheckmate a true religion gives you an ethical identity that respects life itself under the laws of the higher power that begins
-1	i need to be the man this city needs i love dramatic vigilantes more than life itself
-1	rt joeydiggsjr life is and always will be stressful its all about how you handle stress itself
-1	i love my mother more than life itself and that s a fact
-1	nimbusdome i love your freckles fiercely more than life itself
-1	rt itsvictrey it seems man is more interested in developing the quality of life while having no regard for life itself
-1	fortunately analysis isn t the only way to resolve inner conflicts life itself still remains a very effective therapist karen horney
-1	what you seek is also seeking you keep expanding and trusting and let life reveal itself to you
-1	rt aalexandruhh happy birthday 2 my woe bae beautiful best friend i love you more than life itself amp glad i got to see you today http
-1	rt bautistafund education is not preparation for life education is life itself johndewey
-1	raetastic mealford gotta admit that i love you more than life itself coming from a fox did make my little girl heart pitter patter ha
-1	done with people and life itself just going to be by myself from now on really don t have time for negative things anymore
-1	it seems man is more interested in developing the quality of life while having no regard for life itself
-1	rt mikaila education family home and whatever else are just accessories the most valuable thing in life is life itself sadhgurujv q
-1	rt joeydiggsjr life is and always will be stressful its all about how you handle stress itself
-1	just gotta enjoy these next 8 months at home life itself is too precious to stress about the future
-1	life itself still remains a very effective therapist karen horney
-1	rt joeydiggsjr life is and always will be stressful its all about how you handle stress itself
-1	oh please so tired of hearing the good guy with a gun crap there s no good guy with a gun just the gun obsessed scared of life itself
-1	noticing weird similarities in my life to last time we were going to wembley history repeating itself all over the place winthistimevilla
-1	rt cerseilannistr one of the joys in life watching your entire twitter feed set itself on fire over lena headey amp nikolaj coster waldau
-1	grateful this friday good friends good family good health three of the most important things in life the rest will figure itself out
-1	rt joeydiggsjr life is and always will be stressful its all about how you handle stress itself
-1	rt anitarenate i left the rest for the others it was you and nothing else you felt so good to me baby good as life itself http t co
-1	sometime when u try to control ur life too much you put it in a chokehold cutting itself off from the oxygen it needs to grow
