-1	rt suitandtieix it spreads like a virus disrupts the whole system to the core the life itself loses its very meaning the chaos within
-1	because joe is better than u and life itself joe_sugg http t co lv5n4nyfhk
-1	jacobwhitesides i love you more than life itself
-1	rt mayalouu_ i love my mother more than life itself and that s a fact
-1	rt mayalouu_ i love my mother more than life itself and that s a fact
-1	once had a bitch tell me to stay in my lane as if the internet and life itself was in her name
-1	it is your reaction to adversity not the adversity itself that determines how your life s story will develop
-1	rt kayla_xoxo11 love these girls more than life itself forever amp always my sisters idk what i would do with out them http t co uud
-1	rt mobydickatsea he toiled away as if toil were life itself and the heavy beating of his hammer the heavy beating of his heart
-1	i was genuinely moved last night by in transit both by the wonderful film itself but also the celebration of albert maysles and his life
-1	rt kayla_xoxo11 love these girls more than life itself forever amp always my sisters idk what i would do with out them http t co uud
-1	rt kayla_xoxo11 love these girls more than life itself forever amp always my sisters idk what i would do with out them http t co uud
-1	rt kayla_xoxo11 love these girls more than life itself forever amp always my sisters idk what i would do with out them http t co uud
-1	and just like in life we go through many complex evolutions and transformations it is a system in itself
-1	offtheteejr teaches the same life lessons as golf itself respect honesty growthegame http t co gjcbuvcn2s
-1	love these girls more than life itself forever amp always my sisters idk what i would do with out them http t co uudrafghlp
-1	reading life itself wattpad spiritual http t co krcev6rly3 http t co naziof2v4i
-1	reading life itself wattpad spiritual comment what u think http t co krcev6rly3 http t co m4lcvq5vgf
-1	could we change our attitude we should not only see life differently but life itself would come to be different katherine mansfield
-1	perfect_itself cheer up although life may not be easy now in the end it s all worth it
-1	reading life itself wattpad spiritual what do u think http t co krcev6rly3 http t co egvcdlmmun
-1	skymarshallxo i love you more than life itself
-1	eskilogistics this blocked nose keeps bluetooth ing itself from one nostril to the other that s been my life since the day i was born
-1	the one i can run to when i m feeling down life is all good when you re around ain t nobody of my friends is beating you right now
-1	run away isolations reflectivetape i love this hoop more than life itself truelove sacredcircle https t co 5qxaq02uzb
-1	rt mayalouu_ i love my mother more than life itself and that s a fact
-1	rt mayalouu_ i love my mother more than life itself and that s a fact
-1	rt mayalouu_ i love my mother more than life itself and that s a fact
-1	alexheavens1 just live a regular life and if necessary gently ease itself into it the main purpose is to be happy it s a long life
-1	otakyoushi lol your life is already gone with xenoverse right now new leaf can fuck itself
-1	rt mayalouu_ i love my mother more than life itself and that s a fact
-1	i love zayn more than life itself
-1	rt tweetsimoneee i love my mother more than life itself and that s a fact
-1	rt giambalvogaby my life itself is bipolar
-1	talking about the future n life itself used to leave me feeling empowered n inspired now it just leaves me depressive n powerless
-1	rt mobydickatsea he toiled away as if toil were life itself and the heavy beating of his hammer the heavy beating of his heart
-1	rt sabotagetimes what would you do if you were at the zoo and this happened http t co 5u8r2yf1rv http t co ujhbxgijlw
-1	rt giambalvogaby my life itself is bipolar
-1	just like life itself
-1	thevikaskhanna congrates chef for the greatest utsav of life is life itself and its continuation enjoy the lovely magic of utsav
-1	online tonight for some hangout fun i feel like my life is slowly pulling itself together and then surgery wednesday haha lovely
-1	rt giambalvogaby my life itself is bipolar
-1	rt giambalvogaby my life itself is bipolar
-1	my life itself is bipolar
-1	rt mofanon many speakers touched on how knowledge production is divorced from real life somali reality itself cadaanstudies
-1	happy birthday to the most amazing pops in the world i love you more then life itself been through so much as a family and made it xxx
-1	always be happy always wear a smile not because life is full of reasons to smile but because ur smile itself is a reason for many others
-1	rt mofanon many speakers touched on how knowledge production is divorced from real life somali reality itself cadaanstudies
-1	i love my mother more than life itself and that s a fact
-1	love my meetings with missnickyreid you help me improve my life and your reputation speaks for itself foreverloyal
-1	rt omgcarmo could not fully express my hate for life itself
-1	rt omgcarmo could not fully express my hate for life itself
-1	could not fully express my hate for life itself
-1	rt cancerterms love a cancer amp she will love you more than life itself betray a cancer amp she will never let you forget it
-1	rt scottoliphint the maker of man was made man that strength might be weakened that health might be wounded and that life itself might
-1	thevikaskhanna the greatest utsav of life is itself life and its continuation bestest bio
-1	rt sherman029 amandaaastine you should already be an infinitely happy gal because we are on this planet to live and love life and life i
-1	amandaaastine you should already be an infinitely happy gal because we are on this planet to live and love life and life itself s a miracle
-1	rt tolstoysaid everything that appears to be a barrier in life is a wide step that offers itself to your feet so that you may ascend
-1	rt mofanon many speakers touched on how knowledge production is divorced from real life somali reality itself cadaanstudies
-1	sometimes in life your situation will keep repeating itself until you learn your lesson
-1	many speakers touched on how knowledge production is divorced from real life somali reality itself cadaanstudies
-1	laying next to him makes my whole world change i love him more than life itself
-1	reel snobs ep 25 5 snobbie short life itself http t co jg0maccq9h
-1	guess sometimes we should let life unfold itself
-1	rt shinovene watched the documentary life itself moving story cc joaomatthews_
-1	everything that appears to be a barrier in life is a wide step that offers itself to your feet so that you may ascend
-1	many of us fear change yet the only constant in life is change nothing last forever but ironically life itself
-1	what would you do if you were at the zoo and this happened http t co 5u8r2yf1rv http t co ujhbxgijlw
-1	watched the documentary life itself moving story cc joaomatthews_
-1	rt mobydickatsea he toiled away as if toil were life itself and the heavy beating of his hammer the heavy beating of his heart
-1	rt mobydickatsea he toiled away as if toil were life itself and the heavy beating of his hammer the heavy beating of his heart
-1	dtyler40dt mohammad1hasan that person is an aberration of life itself no one person can represent a nation he is very sick
-1	i love clubbercise more than life itself sweat glowsticks pumpingtunes fatburner http t co urjlqdyui6
-1	i love my grandmother more than life itself
-1	rt annrae education is not preparation but education is life itself iddo oberski tedxqmu2015
-1	why can t my senior thesis write itself writing 25 pages about the consecrated life is harder than i thought senioritisisreal
-1	rt bautistafund education is not preparation for life education is life itself johndewey
-1	a self sufficient thing then we take to be one which by itself makes life desirable and in no way deficient
-1	most people treat the present moment as if it were an obstacle that they need to overcome since the present moment is life itself it is
-1	jessieharvey19 i love you more than life itself
-1	rebeccafrancis1 like many confused destroy life for fun yet query death threats why when you are a threat to life itself vile beast you are
-1	thevikaskhanna awesome bio chef the greatest utsav of life is life itself and its continuation wishing u super success for the book
-1	rt bywarriorpoet his heart a wery travelr protectd by th promethean efforts 2assuage th real amp imagined injuries of life itself was her a
-1	bautistafund education is not preparation for life education is life itself johndewey playisaction
-1	life itself is your teacher an you are in a state of constant learning
-1	rt moniquehohnberg the heart has a life of its own often it is unseen but every so often makes itself known riseregardless
-1	_ blending workout sessions into a hectic life can be an art in itself you need to know your limits
-1	rt mobydickatsea he toiled away as if toil were life itself and the heavy beating of his hammer the heavy beating of his heart
-1	rt mobydickatsea he toiled away as if toil were life itself and the heavy beating of his hammer the heavy beating of his heart
-1	your children are not your children they are the sons and daughters of life s longing for itself kahlil gibran
-1	rt mobydickatsea he toiled away as if toil were life itself and the heavy beating of his hammer the heavy beating of his heart
-1	rt mobydickatsea he toiled away as if toil were life itself and the heavy beating of his hammer the heavy beating of his heart
-1	rt mobydickatsea he toiled away as if toil were life itself and the heavy beating of his hammer the heavy beating of his heart
-1	rt mobydickatsea he toiled away as if toil were life itself and the heavy beating of his hammer the heavy beating of his heart
-1	rt mobydickatsea he toiled away as if toil were life itself and the heavy beating of his hammer the heavy beating of his heart
-1	he toiled away as if toil were life itself and the heavy beating of his hammer the heavy beating of his heart
-1	how you can possibly stop loving someone you once would have chosen over life itself
-1	destinyjoaquin love you more than life itself
-1	rt amyjogoddard so you want to be a sex goddess a sex goddess goes for it she does not withhold from life for she is life itself http
-1	rt moniquehohnberg the heart has a life of its own often it is unseen but every so often makes itself known riseregardless
-1	wisdom does not show itself so much in precept as in life in firmness of mind and a mastery of appetite it teaches u lt nmyrlb gt ahiquotes
-1	what is life it is the little shadow which runs across the grass and loses itself in the sunset native american blackfoot 19260
-1	rt bautistafund education is not preparation for life education is life itself johndewey
-1	rt suitandtieix it spreads like a virus disrupts the whole system to the core the life itself loses its very meaning the chaos within
-1	kokilsubhas my theory is everybody s life is complex nuanced endeavour that in itself is nothing prashantktm anurag_acharya
-1	rt ruach321 how i long for the days when american men loved their country more than life itself god bless you brave patriot http t c
-1	rt psychologquotes fortunately analysis is not the only way to resolve inner conflicts life itself still remains a very effective therap
-1	diannabooher it s my pleasure that apologies comment manifested itself in my life that very evening it s nice to virtually meet you
-1	could we change our attitude we should not only see life differently but life itself would come to be different katherine mansfield
-1	rt lukethesama every since sex changes became possible iv e been fearing life itself
-1	blueprint for future life on mars xtu architects imagine a city that creates itself from the natural environment http t co lncmtojirj
-1	rt bautistafund education is not preparation for life education is life itself johndewey
-1	my review of life itself 2014 on letterboxd http t co ndgelqsshj
-1	life itself isn t a bed of roses so says my testament
-1	htagnewsreader isn t life going to b so much better after the us destroys itself ashes to ashes
-1	fbf last year in nyc love these kids more than life itself family love ny nyc holiday santa https t co tsrqizeltl
-1	for wall street itself the tax break on stock market losses is simply a fact of life photo a go http t co kmsqrqm9qg
-1	happy birthday to my one amp only love you more than life itself https t co snczrjnhst
-1	rt tarynmariapoe sorry for that rant i think that everyone should feel beautiful because every single person is beautiful life itself i
-1	you don t want fifty years to go by and then realize that you let the love of your life get away callie advice returning to itself
-1	sorry for that rant i think that everyone should feel beautiful because every single person is beautiful life itself is such a beauty
-1	if you lead your life the right way the karma will take care of itself the dreams will come to you randy pausch
-1	rt bautistafund education is not preparation for life education is life itself johndewey
-1	over concentration on one s own life can quickly become a problem in amp of itself take time to step out of self amp focus on helping others
-1	rt byjennings money could determine happiness but life itself should make you happy
-1	life will bring you pain all by itself your responsibility is to create joy milton erickson http t co izzbwodjap
-1	rt bautistafund education is not preparation for life education is life itself johndewey
-1	i love my mother more than life itself amp that s a fact
-1	rt bautistafund education is not preparation for life education is life itself johndewey
-1	the most important thing in your life is life itself nothing else matters once you die nobody will care about what you had or didn t have
-1	education is not preparation for life education is life itself johndewey
-1	forevermylittleone amp foreverspeedy i love yall more than life itself watch over me
-1	rt bksmith16 love you more than life itself http t co tvuno6kqri
-1	rt suitandtieix it spreads like a virus disrupts the whole system to the core the life itself loses its very meaning the chaos within
-1	it spreads like a virus disrupts the whole system to the core the life itself loses its very meaning the chaos within
-1	so you want to be a sex goddess a sex goddess goes for it she does not withhold from life for she is life itself http t co xwccdyzl79
-1	see the sprouts emerging and the life beginning to assert itself thats is what life is all about say yes to life http t co 7sysph48yi
-1	the real truth of a literal image can t be seen directly matter itself is not the reality your life purpose is the sun not fire amp hot gas
-1	jax_inurbox yea i been to waldorf and it is far from life itself lol but it got its own high school and shit so family wise it s cool
-1	thevikaskhanna the greatest utsav of life is life itself and its continuation all ur thoughts are as pure as like ur heart best bio
-1	rt mikaila education family home and whatever else are just accessories the most valuable thing in life is life itself sadhgurujv q
-1	every since sex changes became possible iv e been fearing life itself
-1	rt grumpierredneck indigocolossus to be fair life is satirizing itself these days it s difficult to discern the diff between parody a
-1	life itself is our canvas temporary beautiful notforsale http t co cu2aqikpq3
-1	indigocolossus to be fair life is satirizing itself these days it s difficult to discern the diff between parody and reality ya know
-1	misery loves company
-1	i hate life now i m going to nap in a room more heated up that fucking hell itself
-1	pause for just a moment to be nowhere but now here jeanette amlie http t co qf3uqxaenw
-1	rt farrahokk saudis love kebsa more than life itself i am not joking it s sooooooooo good too
-1	rt mikaila education family home and whatever else are just accessories the most valuable thing in life is life itself sadhgurujv q
-1	love you more than life itself http t co tvuno6kqri
-1	rt mikaila education family home and whatever else are just accessories the most valuable thing in life is life itself sadhgurujv q
-1	saudis love kebsa more than life itself i am not joking it s sooooooooo good too
-1	we don t have the power of life in our hands and science will never succeed in it life itself is a miracle http t co 9jbuwh2a6k
-1	my life needs to get itself together
-1	i don t care how good the acting is drama is what you don t want on your life stage avoiding that awards itself marinate
-1	rt longo_connor life figures itself out in times of trouble just fuck it
-1	mortal mind human is a limited version of life itself holy union
-1	when my life seems to be meaningless it is life itself that makes me full
-1	education is not preparation for life as real education is life itself
-1	if you lead your life the right way the karma will take care of itself the dreams will come to you randy pausch
-1	rt shekharkapur lessons of life throw yourself into the turmoil and chaos of life let it engulf you in its whirl so you become life it
-1	rt caleb_davi5 tori_abraham i love you more than life itself
-1	yabamena rehellinen i needed this moe than life itself
-1	sometimes in life your situation will keep repeating itself until you learn your lesson brigitte nicole
-1	the stitching and quilting process itself is social work that suzanne undertakes in the midst of her family s life http t co tksklrjxhp
-1	tori_abraham i love you more than life itself
-1	what makes a hotel five star or seven star in some parts of the world a hotel ranks itself in oth http t co vzosxoi6c6 travel
-1	becoming conscious and aware is a journey itself and we all struggle in that journey we call life instead of http t co bluihgujj6
-1	rt mikaila education family home and whatever else are just accessories the most valuable thing in life is life itself sadhgurujv q
-1	becoming conscious and aware is a journey itself and we all struggle in that journey we call life instead of http t co le9ufveyf4
-1	becoming conscious and aware is a journey itself and we all struggle in that journey we call life instead of http t co wugjzralvw
-1	becoming conscious and aware is a journey itself and we all struggle in that journey we call life instead of http t co ykjnqdhaan
-1	becoming conscious and aware is a journey itself and we all struggle in that journey we call life instead of http t co qj6xquokpy
-1	thevikaskhanna the greatest utsav of life is life itself and its continuation ur bio is very touching loving it ji god bless you
-1	rt evelynfleckdonm iddo oberski tells us education is not preparation for life it is life itself nhsborders tedxqmu2015 tedxqmu2015
-1	clevor_trevor yessss sitar was life itself today nice meeting you man
-1	my joburg bestie lt 3 her more than life itself mynumberone loveyousissa http t co 4jarniyruh
-1	life has a meaning only if one barters it day by day for something other than itself antoine de saint exupery
-1	rt hierophant1985 peyotecoyotea according to terencemckenna_ this is how a truly advanced life form will disguise itself because it has
-1	in societies where modern conditions of production prevail all of life presents itself as an immense http t co pkssgbvvxf
-1	rt supriyadabas gurmeetramrahim msg1stsuperhit2015 after getting your divine blessings zest boost in our life itself msgtruebloodpum
-1	rt shekharkapur lessons of life in a desperate search for meaning 2 our lives we forget life itself we forget to live this moment wh
-1	nanthugift shreyaghoshal always her smile itself is a source of joy in life
-1	bethany mota on youtube is actually life itself
-1	brotha puts on some j cole and all of a sudden i can see through life itself spittin out quotes
-1	rt legrant101 life will contradict itself to such a degree that you ll wonder what you really know about it
-1	i love my mother more than life itself
-1	rt mikaila education family home and whatever else are just accessories the most valuable thing in life is life itself sadhgurujv q
-1	its your reaction to adversity not the adversity itself that determines how your life story will develop
-1	i love gustavo fring more than life itself
-1	life will bring you pain all by itself your responsibility is to create joy milton erickson
-1	some people studied books to be smart in life me i studied life itself to learn it and its so easy when you figure it out
-1	nothing to fear but fear itself is that a good thing fear life family society https t co eeuyncnybz
-1	life is full of experience so start your journey from today itself
-1	education is not preparation for life education is life itself john dewey http t co 7uik8q08oy http t co qbkzxyweah
-1	what makes a hotel five star or seven star in some parts of the world a hotel ranks itself in other count http t co mbneshui14
-1	life wastes itself while we are preparing to live ralph waldo emerson
-1	rt l3xandthecity at some point during these 1000 comments a line was crossed but we kept going love this class more than life itself htt
-1	money could determine happiness but life itself should make you happy
-1	rt greatestquots life wastes itself while we are preparing to live ralph waldo emerson
-1	smartcenters sells to calloway reit and renames itself to smartreit is the new name friendlier what do you http t co krhwow4c6p
-1	travel is my religion my ideology and life itself https t co qhofjehrjk
-1	tomorrow is the most important thing in life comes into us at midnight very clean it s perfect when it arrives and it puts itself 1 2
