-1	alyssawrah she is larger than life itself cannot even say this enough
-1	love never claims it ever gives love never resents never revenges itself where there is love there is life hatred leads to destruction
-1	rt flyersociety_ rt _jusskenniese i tell my daughter i love her more then life itself a hundred times a day i wish she could http
-1	rt flyersociety_ rt _jusskenniese i tell my daughter i love her more then life itself a hundred times a day i wish she could http
-1	show up with takeout and all of sudden your friends love you more than life itself
-1	rt _jusskenniese i tell my daughter i love her more then life itself a hundred times a day i wish she could http t co iyatrjooas
-1	i tell my daughter i love her more then life itself a hundred times a day i wish she could say it back i can t wait for them days
-1	life really needs to uncomplicate itself bc i can t do it
-1	rt joeydiggsjr life is and always will be stressful its all about how you handle stress itself
-1	now lets move forward
-1	i love my niece more than life itself
-1	i think i like his hoodies more than life itself
-1	i don t like the way my life is playing itself out rn
-1	immortal_writer sonihere life itself is a circle the beginning and ends is created by us only
-1	rt wooser69 i genuinely believe that nazis are good they are the last remaining good in this world and if you reject them you reject lif
-1	rt pxpassion about sleep it was life itself in sleep format patiencerandle
-1	when the words in a letter are almost as sentimental as life itself thankyouelderjk https t co zcj626j1ax
-1	rt wooser69 i genuinely believe that nazis are good they are the last remaining good in this world and if you reject them you reject lif
-1	rt twittblaster character develops itself in the stream of life goethe process journey moulding experiences integrity goodness htt
-1	rt futurestyles94 harry_styles if i get 300 rts will you follow me you mean the world to me i love you more then life itself please
-1	our friendship is greater than life itself lmao http t co jzfbo2idnt
-1	sometimes in life your situation will keep repeating itself until you learn your lesson brigitte nicole
-1	makiinley dick is life by itself
-1	watch life itself on netflix it s a touching doc on the life of roger ebert i almost cried moviesthatmatter
-1	byrnekatie22 thank you so much i love you more than life itself
-1	cornik soaked in vinegar for dinner i love it more than life itself
-1	i genuinely believe that nazis are good they are the last remaining good in this world and if you reject them you reject life itself
-1	rt futurestyles94 harry_styles if i get 300 rts will you follow me you mean the world to me i love you more then life itself please
-1	a bucket list approach to life is itself a hedonic treadmill the more you get the more you end up where you started
-1	life wastes itself while we are preparing to live ralph waldo emerson
-1	when i think of my individual life being sad i think of people with worse lives and life itself becomes sad
-1	b e c o life is round and round everything repeats itself as we move along the http t co nwcruqnith
-1	rt tifffanknee i think i love philycia more than life itself
-1	rt jennix3jenni i love my mother more than life itself and that s a fact
-1	remember how edge of tomorrow completely retitled itself after it was released in theaters i wanna do that but with my life instead
-1	love a cancer and she will love you more than life itself betray a cancer and she will never let you forget it
-1	rt lyricsreallidoe dreams be more real than life itself sometimes
-1	logically one cannot sleep when one is dead as death in itself is cessation of life and renders sleep unnecessary spockquestionssonglyrics
-1	rt twittblaster character develops itself in the stream of life goethe process journey moulding experiences integrity goodness htt
-1	rt cceyonceee i love my mother more than life itself amp that s a fact
-1	i think atheists have a harder time than christians living life everyday feeling that you re not goin nowhere in the end is a burden itself
-1	rt twittblaster character develops itself in the stream of life goethe process journey moulding experiences integrity goodness htt
-1	a mischievous waitress a wounded gi and a doting mother http t co jtqkmuxyuc ten dark tales free for kindleunlimited subscribers
-1	history repeating itself is the most terrifying irony of life
-1	rt cceyonceee i love my mother more than life itself amp that s a fact
-1	if only life could explain itself to me i could understand a lot better
-1	i hate cancelled plans more than life itself
-1	i love tacos more than life itself
-1	rt heyoulaura funny how life sorts itself out if you just let it be
-1	your children are not your children they are sons and daughters of life s longing for itself they https t co 8rnpryhmkr
-1	rt mayalouu_ i love my mother more than life itself and that s a fact
-1	rt erikschroeder2 i love gregclerkin more than life itself
-1	i love my mother more than life itself amp that s a fact
-1	no but on god i love celexeia more than life itself and she knows that
-1	bc i love you more than life itself
-1	rt joeydiggsjr life is and always will be stressful its all about how you handle stress itself
-1	hi luke hemmings from 5sos ur my sunshine and i love u more than life itself it would be pretty cool if you follow me luke5sos x3430
-1	hi luke hemmings from 5sos ur my sunshine and i love u more than life itself it would be pretty cool if you follow me luke5sos x3429
-1	hi luke hemmings from 5sos ur my sunshine and i love u more than life itself it would be pretty cool if you follow me luke5sos x3428
-1	rt mayalouu_ i love my mother more than life itself and that s a fact
-1	hi luke hemmings from 5sos ur my sunshine and i love u more than life itself it would be pretty cool if you follow me luke5sos x3427
-1	hi luke hemmings from 5sos ur my sunshine and i love u more than life itself it would be pretty cool if you follow me luke5sos x3426
-1	rt tessyloew katie_ross04 when you re contemplating life itself toriproost http t co kkdkvvktwt
-1	katie_ross04 when you re contemplating life itself toriproost http t co kkdkvvktwt
-1	rt mayalouu_ i love my mother more than life itself and that s a fact
-1	ice can even stop the time of life itself so you ll never be able to catch up for eternity quotes
-1	rt mayalouu_ i love my mother more than life itself and that s a fact
-1	i love gregclerkin more than life itself
-1	rt hackiejagan life has a funny way of working itself out
-1	rt kh_king_queen klayley is my love and i love it more than life itself josephmorgan 1phoebejtonkin http t co kdky4soeqd
-1	rt sigg_loso i love my mother more than life itself amp that s a fact
-1	exposedyounow _itstrey__ ummm execute itself and go get a life plz trey doesn t need anymore crazy fans i could tell ur in love with him
-1	rt warmone2 mikewhiteatcj something cannot create itself law of science life does not come from chemistry amino acids cannot randomly
-1	i am life itself
-1	my boyfriend has taught me so much about myself and life itself
-1	i love my mother than life itself and that s a fact
-1	rt salahxdd we are looking for a permanent things and life itself is temporary
-1	we are looking for a permanent things and life itself is temporary
-1	rt twittblaster character develops itself in the stream of life goethe process journey moulding experiences integrity goodness htt
-1	i think i m dying right now you re dying every second of the day every day of your life what are you dying of life itself
-1	rt twittblaster character develops itself in the stream of life goethe process journey moulding experiences integrity goodness htt
-1	i love halesbaless92 more than life itself
-1	your children are not your children they are the sons and daughters of life s longing for itself http t co 3qbxgu9d2u
-1	rt sydney_durant sometimes u just have to sit back and wait while life works itself out _ _
-1	rt bbuuddha understanding life and death free to come and go free from fear of death no need to look for worthiness it will arise of
-1	caught up with the ebert doc steve james life itself highly recommended
-1	rt bbuuddha understanding life and death free to come and go free from fear of death no need to look for worthiness it will arise of
-1	understanding life and death free to come and go free from fear of death no need to look for worthiness it will arise of itself rinzai
-1	the law implicates itself in its denial of the life that would help explain the gaps and the general incongruity of life now
-1	sir_bmed u were like fuck my life ina hop on mine craft and fuck bitches and then u threw up all over itself
-1	tammypope97 megshepp u_go_jenncoco jes_sea_ca rhondaelfiky love yall more than life itself
-1	nothing in life is as good as the marriage of true minds between man and woman as good it is life itself http t co yknqzg6b74
-1	katiescarlett94 this might tell you a lot about where i m coming from but i need an hdmi cord more than life itself
-1	sometimes u just have to sit back and wait while life works itself out _ _
-1	rt twittblaster character develops itself in the stream of life goethe process journey moulding experiences integrity goodness htt
-1	fbf to last saturday coachella2015 i love this girl more than life itself hatgame kinggriffeyjr https t co jbnstmpxky
-1	rt heyoulaura funny how life sorts itself out if you just let it be
-1	rt goodnessaidan if you re at all interested in n american colonialism amp biopolitics amp indigenous ppl i v much recommend this book http
-1	could we change our attitude we should not only see life differently but life itself would come to be different katherine mansfield
-1	tharealk3v thank you babe that helps a hell of alot and i love you more than life itself
-1	people think im so funny but the reality is i mostly talk about my life but my life is pretty much a joke in itself soz
-1	rt khaifa_knows850 sometimes you don t like things but just gotta live your life and hope they resolve itself or just keep chuggin
-1	your children are not your children they are the sons and daughters of life s longing for itself you http t co aiyfejjpep
-1	i would give up life itself if it meant spending my soul with yours
-1	nothing better than getting fuck right up the ass by life itself
-1	rt sureshmkothari nothing in nature is for itself rivers don t drink water trees don t eat fruit sun doesn t use heat living for othe
-1	i pray for my mother everyday i owe more than life itself
-1	what is going on with life itself
-1	you ll get punished if you throw away a food flyer ad that means life itself girl s day sojin the star interview
-1	missing my partner in crime more than life itself sessylexii
-1	rt cancerterms love a cancer amp she will love you more than life itself betray a cancer amp she will never let you forget it
-1	rt twittblaster character develops itself in the stream of life goethe process journey moulding experiences integrity goodness htt
-1	rt grind4_god learn to appreciate what you have life itself is a blessing be thankful to god for everything he gives you
-1	graciepeirce23 miss you more than life itself
-1	frickin miss them all more than life itself http t co eku7eoprkn
-1	this is my life more than life itself https t co 7raxaygqqb
-1	life is bigger than the person itself
-1	throwback the only constant in life is change itself nofilter thuggin allaboutthatlife https t co vog053cs4h
-1	sometimes you don t like things but just gotta live your life and hope they resolve itself or just keep chuggin
-1	always be happy not because life is of reason to smile but because we smile itself a reason for https t co qe851i5jud
-1	baby chris pt2 life itself https t co ek3pof8hrf
-1	rt cookiem0nster_ life has a weird way of working itself out
-1	rt aristtotle what is the good for man it must be the ultimate end or object of human life something that is in itself completely sati
-1	baby chris killing this song life itself pt1 https t co srcr4akwbw
-1	this lady damn near fifty amp on had boyfriends more than a nigga on seen life itself
-1	rt twittblaster character develops itself in the stream of life goethe process journey moulding experiences integrity goodness htt
-1	the journey itself is what makes life not the outcome
-1	part of the happiness of life consists not in fighting battles but in avoiding them a masterly retreat is in itself a vict
-1	rt joeydiggsjr life is and always will be stressful its all about how you handle stress itself
-1	i love my baby girl more than life itself
-1	rt mindalivee because my vicbae slayed tonight and i love this group of people more than life itself http t co izjbzge1hr
-1	love her more than life itself http t co suwtcjbgza
-1	cardinals mattcarp13 i love the more than life itself my cards are soaring brandonblewmarpflew stlcards
-1	rt joeydiggsjr life is and always will be stressful its all about how you handle stress itself
-1	my life gives me full blown mental breakdowns every two weeks and i just want to sleep until it fixes itself
-1	rt dsabelhaus time like life itself has no inherent meaning we give our own meaning to time as to life jonathan lockwood huie
-1	rt joeydiggsjr life is and always will be stressful its all about how you handle stress itself
-1	without duty life is sort of boneless it cannot hold itself together joseph joubert
-1	have you ever felt like your life was going no where like everyday was repeating itself like you don t know what your doing
-1	the art continued to apply changes according the times and human life itself revolutionart art pabolpicaso
-1	education is not preparation for life as real education is life itself
-1	gentlebruise i have seen twitter tackle the greater questions of life and beauty but then i ve also seen it vomit all over itself
-1	rt claudssg sometimes in life you just have to stop giving so many fucks and start enjoying life itself
-1	sometimes in life you just have to stop giving so many fucks and start enjoying life itself
-1	rt taylor_byas jasmine_cierraa i love you more than life itself and i m so happy for you you re going to love it
-1	jasmine_cierraa i love you more than life itself and i m so happy for you you re going to love it
-1	best gift god ever blessed me with besides life itself happy bday baby girl da world is yours https t co zavsm82rns
-1	happy birthday becca ily more than life itself beccatymeck
-1	tomturkey972 i love you more than life itself baby
-1	rt cheridouglas lord fill us with such love that we love you and serving you more than life itself godslovechats godsprayerroom gods
-1	rt revjenn life itself is a haphazard untidy messy affair dorothy day quote
-1	she means more than life itself to me there s nothing i wouldn t do for her she s my happiness http t co lsewa1srpi
-1	rt joeydiggsjr life is and always will be stressful its all about how you handle stress itself
-1	rt revjenn life itself is a haphazard untidy messy affair dorothy day quote
-1	even life itself
-1	zari_beasley i don t know if this is supposed to be good or bad but i still love you more than life itself
-1	what is the good for man it must be the ultimate end or object of human life something that is in itself completely satisfying
-1	bruh why it seems like events in my life just repeats itself
-1	i d do anything for my sister i love her more than life itself and i will do anything to make sure she always gets what she wants
-1	im just over life itself at this point
-1	rt cheridouglas lord fill us with such love that we love you and serving you more than life itself godslovechats godsprayerroom gods
-1	life itself is a miracle
-1	i love my icon more than i love life itself
-1	rt mindalivee because my vicbae slayed tonight and i love this group of people more than life itself http t co izjbzge1hr
-1	lol i loved that girl more than life itself
-1	life is like a jigsaw puzzle one piece at a time till the picture completes itself within the duration given
-1	lord fill us with such love that we love you and serving you more than life itself godslovechats godsprayerroom godspraiseroom
-1	rt johnnynopolis this life ain t gonna ruin itself
-1	_victoriajade women give life that s a blessing in itself i jus glad i can be a part
-1	it s the little things that truly make me appreciate the position i m in right now that make me fall in love with life itself
-1	survival paraphrases life more than living itself
-1	rt hayley_mower i you more than life itself http t co q4crp0t0kk
-1	if you lead your life the right way the karma will take care of itself the dreams will come to you randy pausch
-1	life itself is the most wonderful fairy tale
-1	rt giambalvogaby my life itself is bipolar
-1	rt mindalivee because my vicbae slayed tonight and i love this group of people more than life itself http t co izjbzge1hr
-1	rafter09 scarred me for life guess the diplomat turned itself into the wrong lane oh i think i should be over there
-1	they re both beautiful not only visually but thematically celebrations of life and of the medium itself
-1	education is not preparation for life education is life itself
-1	love you more than life itself https t co cuzpdbvct6
-1	my heart in human form i love you more than life itself baby boy http t co orkt9gaigd
-1	thevikaskhanna cheffu loving your bio the great utsav of life is life itself and it s continuation so true http t co qoraxwu3bi
-1	rt twittblaster character develops itself in the stream of life goethe process journey moulding experiences integrity goodness htt
-1	worstraplyrlcs _thelastdragon_ bruhhh im literally hanging on to dear life itself right now
-1	rt divabusiness without trust words become the hollow sound of a wooden gong with trust words become life itself unknown
-1	rt mindalivee because my vicbae slayed tonight and i love this group of people more than life itself http t co izjbzge1hr
-1	because my vicbae slayed tonight and i love this group of people more than life itself http t co izjbzge1hr
-1	theafifahazam what i m saying is the combination of atoms eventually led to microscopic life it is not the same as a phone making itself
-1	rt healthculture book forum lisa stevenson s life beside itself imagining care in the canadian arctic http t co vjqxikhjd4 eraikhel
-1	love this woman more than life itself can you believe this woman turned 50 in dec i least i know https t co htmtnebgs9
-1	rt brianheadwelch jesus said i am the one who brings people back to life amp i am life itself those who believe in me will live even if
-1	i you more than life itself http t co q4crp0t0kk
-1	rt randomquotes25 to ask if it is the real life or fantasy is indeed a paradox in itself how could one possibly know the difference spo
-1	rt randomquotes25 to ask if it is the real life or fantasy is indeed a paradox in itself how could one possibly know the difference spo
-1	rt jennix3jenni i love my mother more than life itself and that s a fact
-1	sulavbaj i had been looking for that spark in my life forgetting my life itself is a spark of a firecracker fro http t co wovsvssdfo
-1	silverladyqueen help but kiss her back as he loves her more than life itself and kissing her lips has always been a treat for the
-1	i liked a youtube video http t co jlmq2zrkzh how i felt about life itself roger ebert documentary
-1	rt randomquotes25 to ask if it is the real life or fantasy is indeed a paradox in itself how could one possibly know the difference spo
-1	rt ruach321 how i long for the days when american men loved their country more than life itself god bless you brave patriot http t c
-1	rt twittblaster character develops itself in the stream of life goethe process journey moulding experiences integrity goodness htt
-1	sew in tighter than life itself
-1	rt goshdangitluke hi luke hemmings from 5sos ur my sunshine and i love u more than life itself it would be pretty cool if you follow me
-1	hi luke hemmings from 5sos ur my sunshine and i love u more than life itself it would be pretty cool if you follow me luke5sos x3425
-1	hi luke hemmings from 5sos ur my sunshine and i love u more than life itself it would be pretty cool if you follow me luke5sos x3424
-1	hi luke hemmings from 5sos ur my sunshine and i love u more than life itself it would be pretty cool if you follow me luke5sos x3422
-1	hi luke hemmings from 5sos ur my sunshine and i love u more than life itself it would be pretty cool if you follow me luke5sos x3421
-1	to ask if it is the real life or fantasy is indeed a paradox in itself how could one possibly know the difference spockquestionssonglyrics
-1	hi luke hemmings from 5sos ur my sunshine and i love u more than life itself it would be pretty cool if you follow me luke5sos x3420
-1	idec nomore too many problems in my life by itself
-1	hi luke hemmings from 5sos ur my sunshine and i love u more than life itself it would be pretty cool if you follow me luke5sos x3419
-1	hahahaha set to go bed and 200 finds itself on my cock love life
-1	happy anniversary to the man of my dreams it s been the best year of my life i love you more than life itself http t co hhuc85vyyy
-1	character develops itself in the stream of life goethe process journey moulding experiences integrity goodness http t co 0oiuc8kctv
-1	rt jennix3jenni i love my mother more than life itself and that s a fact
-1	rt jennix3jenni i love my mother more than life itself and that s a fact
-1	education is a social process education is growth education is not a preparation for life but is life itself john dewey
-1	chrisleible e_lipsman anthonydicomo tell him to youtube wendy s commercials see if he can make it through before he hates life itself ha
-1	i found a loophole in my life today the fabric of the universe parted it could mend itself soon meanwhile i ll enjoy it
-1	rt joeydiggsjr life is and always will be stressful its all about how you handle stress itself
-1	stacie_sweetx but a boss or a client can say it to you anytime too careers doesn t guarantee an happy life by itself nor does a loved one
-1	jvplive benjaminnorton only fact of life so b4 history repeats itself they shud treat others the way they want 2 b treated in the future
-1	rt jennix3jenni i love my mother more than life itself and that s a fact
-1	love nicole more than life itself
-1	rt jennix3jenni i love my mother more than life itself and that s a fact
-1	literally i do not wanna leave so my life better put itself together real quick
-1	i hate not doing shit all day its a waste of life itself
-1	i look huge bc i am but i love you more than life itself http t co oz59vozwxj
-1	rt respirited i m so stressed about everything life needs to calm itself
-1	i m so stressed about everything life needs to calm itself
-1	the greatest lesson in life is that life itself is a lesson mb30 millionaireby30 famoent mme gogetit
-1	where the wind sucks away the color of life itself to the point it makes your lungs crumble from inside out
-1	i had been looking for that spark in my life forgetting my life itself is a spark of a firecracker from my mom happymothersday
-1	just watched life itself laughing crying missing the brilliant ebert
-1	rt eyevolving analyze and examine the events in your life until that lesson reveals itself to you then apply what you have learned amp mov
-1	rt xx0lea not only do we need to pray for the family but we need to pray for life itself
-1	life will bring you pain all by itself your responsibility is to create joy milton erickson
-1	rt eyevolving analyze and examine the events in your life until that lesson reveals itself to you then apply what you have learned amp mov
-1	rt jennix3jenni i love my mother more than life itself and that s a fact
-1	happy birthday to my amazing 10 year old isaiah i love you more than life itself god gave https t co rob5eo3dyo
-1	rt iquote life will bring you pain all by itself your responsibility is to create joy milton erickson m d
-1	rt jennix3jenni i love my mother more than life itself and that s a fact
-1	rt lyfeharris i value anything genuine and real more than life itself
-1	rt jennix3jenni i love my mother more than life itself and that s a fact
-1	rt ascottstories katewurtele loves lettuce more than life itself
-1	rt jennix3jenni i love my mother more than life itself and that s a fact
-1	rt futurestyles94 harry_styles if i get 300 rts will you follow me you mean the world to me i love you more then life itself please
-1	i love carli s car more than life itself
-1	rt proudffaalumni this ponytail isn t gonna pull itself are we flirting yet
-1	rt abbyzimmerman34 i love paige more than life itself
-1	stressreliefin4words life is itself joy
-1	money is a tool to help you live a life that is valuable to you any emotion around it has more to do with your beliefs than money itself
-1	life hacks not feeling like your stomach has destroyed itself or your brain is malfunctioning on a daily basis
-1	i love you more than life itself i even love you like a fat kid loves cat eh
-1	rt ascottstories katewurtele loves lettuce more than life itself
-1	if an opportunity presents itself take it what is life without change
-1	i love my girlfriends more than life itself really excited for a night with jessifine and our other 2 gfs
-1	no church model will produce god s life in you it works the other way around our life in god shared expresses itself as the church
-1	i think i like cars more than life itself
-1	rt futurestyles94 harry_styles if i get 300 rts will you follow me you mean the world to me i love you more then life itself please
-1	rt futurestyles94 harry_styles if i get 300 rts will you follow me you mean the world to me i love you more then life itself please
-1	kennedylryan have you seen life itself
-1	rt ruach321 how i long for the days when american men loved their country more than life itself god bless you brave patriot http t c
-1	rt obeythetweet_xx when you look back at when you thought your life was over now you re just so content with life itself
