-1	watching live die repeat edge of tomorrow storming the beach https t co ubqwe4wfut
-1	ganteng bener live die repeat edge of tomorrow weapons of the future https t co b8pdzf9gxn
-1	watching live die repeat edge of tomorrow weapons of the future https t co l97ulkryxg
-1	live die repeat edge of tomorrow blu ray 2014 region free 8 00 http t co 8txsjrlbak
-1	edge of tomorrow live die repeat dvd 2014 tom cruise amp emilyblunt http t co fk2opectwh lipsyncbattle
-1	rt ktnelson94 edge of tomorrow is also known as live die repeat not sure i like that one any better though lmc3214g
-1	edge of tomorrow is also known as live die repeat not sure i like that one any better though lmc3214g
-1	most popular bestbuy http t co kjketjct2k live die repeat edge of tomorrow blu ray disc 2014 only best buy http t co m98zisdi5u
-1	most popular bestbuy http t co xf4ua9sa8k live die repeat edge of tomorrow blu ray disc 2014 only best buy http t co nqvexs3eeg
-1	live die repeat edge of tomorrow blu ray 3d blu ray 2014 region free 13 30 http t co vreyqu6vjz
-1	tipis tengah malam live die repeat edge of tomorrow storming the beach at rumah kusut https t co jjn5azcnhi
-1	live die repeat edge of tomorrow used dvd tom cruise bill paxton http t co gfwyjanywp book
-1	daaapp eh makan sambil cuci mata live die repeat edge of tomorrow storming the beach https t co y47cly9wr0
-1	rt mccanner a post it note next to the tv saying edge of tomorrow and live die repeat are the same movie is the only way i ll learn
-1	rt mccanner a post it note next to the tv saying edge of tomorrow and live die repeat are the same movie is the only way i ll learn
-1	rt mccanner a post it note next to the tv saying edge of tomorrow and live die repeat are the same movie is the only way i ll learn
-1	a post it note next to the tv saying edge of tomorrow and live die repeat are the same movie is the only way i ll learn
-1	esta_x i liked edge of tomorrow live die repeat tom cruise stars in it i watched the latest godzilla film but thought it rubbish
-1	live die repeat edge of tomorrow 2014 is a monumental movie a ahimoviereviews lt nmwst3 gt
-1	tomcruise dvd sealed live die repeat edge of tomorrow bluray dvd 2 disc set tom cruise nr http t co kjb6hlu8m2 forsale onsale
-1	tomcruise movies sealed live die repeat edge of tomorrow bluray dvd 2 disc set tom cruise nr http t co 2i2mrjdptj deals bargains
-1	live die repeat edge of tomorrow blu ray dvd 2014 2 disc set includes http t co fh4pqh5ghz http t co 2oj665izwc
-1	live die repeat edge of tomorrow blu ray 2014 region free 7 10 http t co 8txsjrlbak
-1	bestbuy http t co mo9d5gz6ra live die repeat edge of tomorrow blu ray 2014 brand new factory sealed http t co 8q8g9ac4li
-1	bestbuy http t co 5j1klickjk live die repeat edge of tomorrow blu ray 2014 brand new factory sealed http t co yumv1uyxat
-1	watching live die repeat edge of tomorrow creatures not of this world https t co f7wsbvbhks
-1	live die repeat edge of tomorrow blu ray 3d blu ray 2014 region free 13 30 http t co vreyqu6vjz
-1	beardmonger need a new print run live die repeat previously published as edge of tomorrow previously published as all you need is kill
-1	rt ryankeane728 so what does everyone think is the best name for the film edge of tomorrow live die repeat or all you need is k
-1	so what does everyone think is the best name for the film edge of tomorrow live die repeat or all you need is kill lmc3214g
-1	watching live die repeat edge of tomorrow weapons of the future https t co h5thwepexz
-1	a lot of people hated the title edge of tomorrow so if you re looking for it it might be under the title live die repeat
-1	live die repeat edge of tomorrow storming the beach https t co hxvl6u197h
-1	nonton ini aja dah pagi2 live die repeat edge of tomorrow storming the beach https t co temqj4qwau
-1	currently watching edge of tomorrow or live die amp repeat or whatever they called it in the end
-1	emily blunt live die repeat edge of tomorrow plus bonus features http t co uixkp8gqzt
-1	live die repeat edge of tomorrow blu ray 2014 region free 7 10 http t co 8txsjru0jc
-1	live die repeat edge of tomorrow blu ray 3d blu ray 2014 region free 13 30 http t co vreyqtpklp
-1	kali kali nonton live die repeat edge of tomorrow storming the beach https t co 42mapbceka
-1	watched edge of tomorrow live die repeat last night really enjoyed it was a lot of fun and emily blunt looked smoking hot
-1	they should have just called it all you need is kill live die and repeat the edge of tomorrow
-1	tomcruise dvd edge of tomorrow live die repeat tom cruise dvd http t co sccbaccswj forsale onsale
-1	tomcruise movies edge of tomorrow live die repeat tom cruise dvd http t co nzyhmydxwm deals bargains
-1	tndressler maze runner the adjustment bureau big here 6 the heat fave live die repeat edge of tomorrow
-1	live die repeat edge of tomorrow blu ray 3d ultraviolet digital copy http t co ari9erwybr bestbuy deals
-1	froonding_loom parva_x also are we calling it edge of tomorrow live die repeat or what
-1	emily blunt live die repeat edge of tomorrow blu ray dvd an alien race undefeatable by any existing military http t co t16n9zo1nf
-1	emily blunt live die repeat edge of tomorrow http t co u8fxmttdig
-1	andai bisa mengulang waktu live die repeat edge of tomorrow storming the beach https t co upwzgkoo0f
-1	http t co 8hfowij89p live die repeat edge of tomorrow blu ray digital hd ultraviolet 12 action action chri http t co dlgbe4w2qf
-1	watching live die repeat edge of tomorrow weapons of the future https t co si6kcr1hk2
-1	live die repeat edge of tomorrow dvd 2014 widescreen edition http t co jb4oeptaxk http t co g3hgspwqrd
-1	live die repeat edge of tomorrow blu ray 2014 region free 7 10 http t co 8txsjru0jc
-1	lovewokemeup probably edge of tomorrow it may be under live die repeat in the u s do it
-1	tomcruise dvd movie blu ray live die repeat tom cruise edge of tomorrow great war http t co vcmdy176gn forsale onsale
-1	tomcruise movies movie blu ray live die repeat tom cruise edge of tomorrow great war http t co zhqjwdxe75 deals bargains
-1	tomcruise dvd movie dvd live die repeat tom cruise edge of tomorrow great http t co 8cvnali8xu forsale onsale
-1	tomcruise movies movie dvd live die repeat tom cruise edge of tomorrow great http t co wom0tdoczs deals bargains
-1	tom cruise looks good with that exo suit in in edge of tomorrow live die repeat
-1	auctions bidnow live die repeat edge of tomorrow blu ray 3d blu ray dvd digital hd pg 13 new http t co orcscp9xjl bidding deals
-1	live die repeat edge of tomorrow movie review http t co segfqjvwxz movie trailers movies http t co sbitbyenor
-1	tomcruise dvd live die repeat edge of tomorrow used dvd tom cruise bill paxton http t co ipyq62izng forsale onsale
-1	tomcruise movies live die repeat edge of tomorrow used dvd tom cruise bill paxton http t co 0ykqaupreu deals bargains
-1	sendiri aja live die repeat edge of tomorrow storming the beach at kretek wonosobo https t co gi4fx55yzq
-1	watching live die repeat edge of tomorrow weapons of the future https t co uwiaqoxunb
-1	emily blunt live die repeat edge of tomorrow plus bonus features http t co uixkp8gqzt
-1	watching live die repeat edge of tomorrow operation downfall adrenaline cut https t co 0icix1lchb
-1	watching live die repeat edge of tomorrow weapons of the future at komplek puri tanjung sari https t co tckmjbzgbe
-1	live die repeat edge of tomorrow dvd 2014 http t co twpdo7iyfo http t co 3twcyvc33p
-1	live die repeat edge of tomorrow blu ray 2014 region free 7 10 http t co 8txsjru0jc
-1	watching live die repeat edge of tomorrow weapons of the future https t co 7kqqp0utzz
-1	live die repeat edge of tomorrow https t co wdz64cjxsc
-1	jomblo bingitssss live die repeat edge of tomorrow weapons of the future https t co amie88rkgd
-1	live die repeat edge of tomorrow weapons of the future https t co 3gidmjelp7
-1	i liked a youtube video http t co 8v1riiq98t live die repeat edge of tomorrow movie review
-1	live die repeat edge of tomorrow blu ray dvd 2014 2 disc set includes http t co bop5grm6it http t co gcmehfw6f5
-1	live die repeat edge of tomorrow blu ray dvd 2014 2 disc set includes http t co gnkxtbvyfy http t co s0kikgawdq
-1	live die repeat edge of tomorrow blu ray dvd 2014 2 disc set includes http t co 6luwarzada http t co a6ktdyq5nr
-1	live die repeat edge of tomorrow blu ray dvd 2014 2 disc set includes http t co zfqjrqaks4 http t co drqszctfet
-1	http t co t2txbaptff deals movies dvd bluray live die repeat edge of tomorrow dvd 2014 new sealed
-1	edge of tomorrow live die repeat dvd tom cruise emilyblunt sci fi war aliens http t co izufvlvz1j lipsyncbattle
-1	edge of tomorrow live die repeat dvd 2014 tom cruise amp emilyblunt http t co wpgmm5fsjr lipsyncbattle
-1	emily blunt live die repeat edge of tomorrow blu ray dvd an alien race undefeatable by any existing military http t co t16n9zo1nf
-1	emily blunt live die repeat edge of tomorrow http t co u8fxmtlezo
-1	mumpung libur hajaarrrrrr live die repeat edge of tomorrow storming the beach https t co voikjnn693
-1	replay from edge of tomorrow live die repeat http t co 9mlv4pgrnb via youtube
-1	edge of tomorrow is the new blinged up groundhog day live die repeat
-1	bestbuy http t co xf4ua9sa8k live die repeat edge of tomorrow blu ray disc 2014 only best buy http t co 30tdqcdvok
-1	live die repeat edge of tomorrow https t co psfc0i5zjl
-1	live die repeat edge of tomorrow dvd only tom cruise emilyblunt http t co snzkmqyrix lipsyncbattle
-1	live die repeat edge of tomorrow tom cruise emilyblunt b paxton new sealed dvd http t co 8xkavrkfzx lipsyncbattle
-1	tomcruise movies live die repeat edge of tomorrow dvd only tom cruise emily blunt http t co peisojxsbi deals bargains
-1	live die repeat edge of tomorrow blu ray 2014 region free 7 10 http t co 8txsjrlbak
-1	kstar1785 oh man i didn t know emily blunt was involved i ve had such a huge crush on her since edge of tomorrow live die repeat
-1	tomcruise dvd live die repeat edge of tomorrow dvd only tom cruise emily blunt http t co nae7jxyzom forsale onsale
-1	live die repeat edge of tomorrow blu ray 3d blu ray 2014 region free 13 30 http t co vreyqtpklp
