-1	rt pauljhilton the indian national park helping to save the one horned rhino in pictures http t co wmtia14sfp http t co urfpd6gstd
-1	rt pauljhilton indian national park helping to save the rhino in pictures http t co wmtia1m3nt humanesociety wildlifeasia13 http
-1	outside the national gallery of art reminds me of the louvre in paris https t co f1ynddzudx
-1	rt pauljhilton indian national park helping to save the rhino in pictures http t co wmtia1m3nt humanesociety wildlifeasia13 http
-1	rt pauljhilton the indian national park helping to save the one horned rhino in pictures http t co wmtia14sfp http t co urfpd6gstd
-1	rt nicole_gabri leonardodavinci ritratto di donna 1474 76 washington national gallery artninja artwit twitart art http t co owx
-1	rt the_hindu photo gallery bara imambara a tale of riches and poverty http t co qla0pqu4a3 http t co ymnx1ddcse
-1	rt nicole_gabri leonardodavinci ritratto di donna 1474 76 washington national gallery artninja artwit twitart art http t co owx
-1	rt newportarts arts amp cultural alliance fundraiser for muse frederic wiseman s national gallery jane pickens http t co mk5yodcgci
-1	celebrating national library week w free cake stop by the schmidt gallery before 4 pm we have chocolate and vanilla http t co 0e4ahdmk4p
-1	stephen colbert portrait set to leave national portrait gallery http t co psndi1ewl5 via rollcall
-1	your take readers explore our national parks http t co ywnswbr5lc
-1	today i got completely lost inside the national gallery of art
-1	rt savills celebrate uk national open gardens day with our gallery of homes for outdoor living http t co xwhbx7vmbr http t co 2lymis
-1	disaster in the national tate gallery s men s http t co gw0nakfw9m
-1	rt whichfoto gallery of time city architecture photo image http t co 75j1gddksd saidjmanohar harshsavla93 hunterxiaojian http t co
-1	rt djsarahlove the national portrait gallery we re so spoilt in london highest concentration of galleries amp museums in the world amp al
-1	at http t co u9wmt10oa9 charles edward stuart called bonnie prince charlie scottish national portrait gallery in edinburgh charle
-1	piero di cosimo retrospective premieres at national gallery of art http t co ddusvnxwsv pls rt seb_kirby
-1	charles edward stuart called bonnie prince charlie scottish national portrait gallery in edinburgh https t co hx8e71ymi5
-1	sometimes i forget how amazing the us national parks are http t co zsnccipbjp
-1	james abbott mcneill whistler james greaves xixth century national portrait gallery london uk http t co vtormy2ybx
-1	beautifull deserved and surely a very good thing for the caribbean http t co ec5pqaugyi
-1	fountain of truth national portrait gallery smithsonian institution https t co aiervexjfk
-1	we are so grateful to our amazing volunteers at garden gallery happy national volunteer week http t co kg747cuqmn
-1	rt seb_kirby piero di cosimo retrospective premieres at national gallery of art http t co doi7leaado pls rt seb_kirby
-1	hope you get to visit one of these national parks this weekend http t co mrg26paokc nationalparks http t co u7favrlugi
-1	piero di cosimo retrospective premieres at national gallery of art http t co doi7leaado pls rt seb_kirby
-1	win tickets to the national gallery and a luxury hotel stay http t co dwjp8bqfib
-1	cocoabutterbabe the national gallery i think like 3 london museums have his work but ive always been too lazy to get off my butt and go
-1	save 10 prestigeflowers on flowers inspired by paintings in the national gallery in via http t co dxb2aeovj3 http t co r3riqm4qtv
-1	gallery of time city architecture photo image http t co 75j1gddksd saidjmanohar harshsavla93 hunterxiaojian http t co g0p8nhnbaj
-1	congrats holly bynoe of arcthemagazine chief curator appointed at the national art gallery of the bahamas nagb http t co 2s1norxedj
-1	skate girl shortlisted for the national portrait gallery s major international taylor wessing phot http t co pz4zmxzufs
-1	the national art gallery in manila houses the famous spolarium painting by juan luna http t co eapoie1stn
-1	the national art gallery in manila houses the famous spolarium painting by juan luna http t co csr0blqpod
-1	t e lawrence by jeremy wilson national portrait gallery illustrated big 1988 1st http t co oatfajtnkj http t co nkc7m0uydd
-1	nationalgalleryofart washingtondc national gallery of art https t co e7miuf033i
-1	ibata_2 amazing nationalgalleryofart national gallery of art https t co v8bucdzew8
-1	t e lawrence by jeremy wilson national portrait gallery illustrated big 1988 1st http t co g5fgsjynrj http t co kxebd34lbv
-1	t e lawrence by jeremy wilson national portrait gallery illustrated big 1988 1st http t co ucw1n5pwmp http t co opnzoqdu93
-1	18th 26th april national parks week in the u s a check out these absurdly beautiful national parks photos http t co nzwfadvor9
-1	just looking at some da vinci s work at the national art gallery with the prime minister of italy nbd
-1	rt alliedearie a closer look lisahfitz artatozsocial durer national gallery of art https t co uhxtzfpkeh
-1	i m at national gallery of art sculpture garden ngadc in washington dc https t co qdharxpwjs
-1	rt savills celebrate uk national open gardens day with our gallery of homes for outdoor living http t co xwhbx7vmbr http t co 2lymis
-1	rt arranqh a rare evening edition of the how to read a painting talk tour thurs 23rd 6 8pm nat gal http t co ezvsbqdhsz http t
-1	rt gweisenbeis nfl star wars helmet redesigns shaweet https t co nagy0siuf1
-1	i need to take more museum trips i want to go back to the national gallery of art to see my fav thomas cole paintings
-1	rt aalonzokcbj this is a less offensive name than washington s current nickname though https t co dv2fijf7gz starwars http t co cqp
-1	assignment 211 national parks http t co t0gpzxhud8 http t co wxejlqywz6
-1	national pet day your best buddies http t co tg9aulnasy via sharethis
-1	rt aafg_uk call to rally outside the national gallery london 3pm sunday 19th april in support of greek antifascists https t co ig0xy
-1	rt aafg_uk call to rally outside the national gallery london 3pm sunday 19th april in support of greek antifascists https t co ig0xy
-1	nfl star wars helmet redesigns shaweet https t co nagy0siuf1
-1	the week in 40 photos http t co cgaopwy6z6
-1	the week in 40 photos http t co jqfgdpxgzf
-1	rt prison_health hundreds of maldives inmates display artwork at national gallery http t co 75ejg0z1sw mt minivannews http t co uzj
-1	hundreds of maldives inmates display artwork at national gallery http t co 75ejg0z1sw mt minivannews http t co uzj1h3tztb
-1	this is a less offensive name than washington s current nickname though https t co dv2fijf7gz starwars http t co cqpgyk3sug
-1	vote for the portrait of this beauty the dame 2014 national portrait gallery http t co dx1fpnildd
-1	weekend whipper ground fall in grampians national park australia after two bomber bits of gear pop http t co 08u8ij24dm
-1	just posted a photo galeria komb tare e arteve national gallery of arts https t co i58czezoqf
-1	rt debeauvoirassn help openschooleast neilarise create a film documenting hackney in pictures opencinema supported by ace_national h
-1	chief curator appointed at the national art gallery of the bahamas nagb art agenda http t co dpabpqi1p4
-1	a closer look lisahfitz artatozsocial durer national gallery of art https t co uhxtzfpkeh
-1	rt nicole_gabri musica alle tuileries edouard manet 1862 national gallery londra artninja artwit twitart art http t co wthw1zml
-1	rt themasters look at all 18 holes of augusta national as they were in 1935 http t co j4ffptrtta mastersmemories themasters http
-1	national gallery
-1	help openschooleast neilarise create a film documenting hackney in pictures opencinema supported by ace_national http t co ehtau76xlq
-1	rt natgeotravel sunlight peers over st mary lake in glacier national park montana http t co ngiy0apf9m http t co cvplrzxxnv
-1	watteau vs escher drawing hands artatozsocial ngadc national gallery of art https t co yjfl1t7of4
-1	artatozsocial phoebecoleman capturing rodin s hand of god sculpture nationalgallery national https t co iculca5nbs
-1	leonardo da vinci study sheet artatozsocial ngadc national gallery of art west wing https t co 9pb0afjawb
-1	photo wonder woman in dc at national gallery of art http t co xi91cmg01m
-1	cayman reporter cine club to explore coming of age films my brother is an only child film the national gallery http t co 16fkphk6x9
-1	rt kalabashmedia how you can become a source of news and quality content thehubzw april 21st bulawayo at national gallery with tvyangu
-1	in the prints and works on paper room escher hands artatozsocial ngadc national gallery of art https t co 0tekrlqopw
-1	19 april 2015 calendar national gallery of canada http t co 0rrmuxzxkj
-1	voucher code 10 off at prestige flowers at prestige flowers http t co ptepetna0y 10 off all national gallery f
-1	behind the scenes at ngadc artatozsocial national gallery of art https t co cq6q5adcr4
-1	expressive hands ngadc artatozsocial national gallery of art https t co f3nsoyuv6j
-1	dj_citric thanks for celebrating national grilled cheese month with themelt check your cheesy entry here http t co avuhi2uaqi
-1	call for artists secret national juried exhibition at arc gallery deadline 9 13 gt http t co r7wyzenp32
-1	live music amp shows http t co vrqu56zmvh rt nickedharris i ll be playing here in the national portrait gallery at 6 30 this evening
-1	rt savills celebrate uk national open gardens day with our gallery of homes for outdoor living http t co xwhbx7vmbr http t co 2lymis
-1	nydia sculpture artatozsocial instameetup national gallery of art https t co vjcneq4hdo
-1	once he had taken her to the national gallery come close lose yourself in the paint forget the figures hs http t co er6tzoxt3v
-1	just starting to cull and post process my photos from dc and had to share this one taken at the national gallery http t co s5romllpvw
-1	rt nickedharris i ll be playing here in the national portrait gallery at 6 30 this evening and it s free entry not bad http t co a1u
-1	national museaum of nature mineral gallery with samples id d http t co goctudc43q http t co ipmk0vsxne
-1	rt pcs_union support monday s pcs strike against privatisation nationalgallery write director nicholas penny pcsculturegroup http t
-1	rt occupiedtimes call to rally outside the national gallery london 3pm sunday 19th april in support of greek antifascists http t co
-1	rt wpxi thursday was national high five day celebrities who love a good five http t co mhwvg1h6vy http t co naxeeuytoo
-1	call for artists secret national juried exhibition at arc gallery deadline 9 13 gt http t co 8velacpfqx
-1	matteo renzi italian pm just mentioned national gallery of art exhibit painting in renaissance florence from white house east room ngadc
-1	rt arranqh a rare evening edition of the how to read a painting talk tour thurs 23rd 6 8pm nat gal http t co ezvsbqdhsz http t
-1	i ll be playing here in the national portrait gallery at 6 30 this evening and it s free entry not bad http t co a1ugdrazer
-1	marriage defined at the national gallery oslo visitoslo national gallery https t co 83h1oh7ilm
-1	liz ldiament discussing the martyrdom of st bartholomew by jusepe de ribera national gallery of art https t co pmljzwfyia
-1	at ngadc for the artatozsocial event nationalgallery national gallery of art https t co zd42izzhv9
-1	if you re an italian prime minister matteo renzi groupie he basically just said he s now heading to the national gallery of art ngadc
-1	1830 5 vol national portrait gallery illustratated rare antique leather book http t co nj0neiyqku http t co mraunpk1yo
-1	1830 5 vol national portrait gallery illustratated rare antique leather book http t co gzloxwgs3q http t co 2hsyff0vdo
-1	1830 5 vol national portrait gallery illustratated rare antique leather book http t co isdx6oi39u http t co nrhrb4jwas
-1	hands holding the reins bernardo cavallino artatozsocial ngadc national gallery of art https t co cxpxqro9eh
-1	rt pcs_union support monday s pcs strike against privatisation nationalgallery write director nicholas penny pcsculturegroup http t
-1	it s just a dream giovan battista moroni the tailor il tagliapanni 1565 1570 national gallery london http t co zvxupadctt
-1	rt eisunion eisunion support pcs_union campaign opposing privatisation of jobs amp services nationalgallery add your support at http
-1	a rare evening edition of the how to read a painting talk tour thurs 23rd 6 8pm nat gal http t co ezvsbqdhsz http t co x797zum5yo
-1	rt nnimhaoileoin quick someone get to the national gallery and paint over this monument of inequality liveline marref http t co art
-1	national portrait gallery by pltgs mr soon chan koh chankoh gmail com 44 7405880294 many thanks http t co 8covduxnrv
-1	call to rally outside the national gallery london 3pm sunday 19th april in support of greek antifascists https t co ig0xy6ueim
-1	rt tessanorton cause of death chewed through headphone cable and electrocuted listening to nicki minaj in front of the canalettos in the
-1	check out how to read a painting evening tour 6pm 8 10pm national gallery of ireland http t co ezvsbqdhsz via eventbriteie
-1	cause of death chewed through headphone cable and electrocuted listening to nicki minaj in front of the canalettos in the national gallery
-1	my favorite rooms at the national art gallery impressionism nationalmall dc http t co hwhlbg9w0r
-1	sir william huggins 1824 1910 famous astronomer 1905 john collier portrait from national gallery http t co jfzmcnaeij
-1	rt robertmarawa leaders shuld be in the forefront when major national issues erupt amp not only when it s convenient at the goodman gallery
-1	national portrait gallery by pltgs mr soon chan koh chankoh gmail com 44 7405880294 many thanks http t co iwxxtkuzv2
-1	the rotunda has been defloraled ngadc national gallery of art https t co xyc7ntcfv3
-1	for the record the national gallery of art is incredible
-1	wallpaper national geographic for 50 greatest photographs wallpaper gallery http t co xbhijkibpp via natgeo
-1	watch real life stories from prevention programs across the nation visit the national child abuse prevention http t co jdcqybbwpo
-1	talented artist was a brush stroke from showcasing his work at national portrait gallery http t co ftupcp5net http t co acbm2pmesm
-1	rt savills celebrate uk national open gardens day with our gallery of homes for outdoor living http t co xwhbx7vmbr http t co 2lymis
-1	talented artist was a brush stroke from showcasing his work at national portrait gallery http t co teztghahtr http t co ot983muzmr
-1	rt occupiedtimes call to rally outside the national gallery london 3pm sunday 19th april in support of greek antifascists http t co
-1	the national gallery at cph had me hooked for over 3 hours and i could have stayed the whole day as i captured danish art thru ages
-1	rt kalabashmedia how you can become a source of news and quality content thehubzw april 21st bulawayo at national gallery with tvyangu
-1	nfl helmets redesigned for the starwars universe the seahawks wattos win the nfc https t co 7ldjcism3n
-1	national portrait gallery mentioned again http t co 2cpd4nma4t rt kaylapetty13 trafalgarsquare london lovethiscity dusk favou
-1	frugaltraveler on the beaten path smithsonian my favorites portrait nat l gallery hirshhorn am hist tidal basin national mall
-1	national geographic s photo competition try and beat these for our bluewater one photocomp2015 growithbluewater http t co rsgwnzot1g
-1	mysteries of metalpoint technique revealed in 1st comprehensive exhibit national gallery of art via finebooks news http t co 5yq5vecf9z
-1	rt luciatassan ginevra de benci leonardo 1474 8 national gallery of art washington museoideale bgiorno asamsakti n2312neagoe http
-1	national park week april 18 26 amazing us national parks in pictures http t co bhn4m5eenv
-1	rt savills celebrate uk national open gardens day with our gallery of homes for outdoor living http t co xwhbx7vmbr http t co 2lymis
-1	rt the_hindu photo gallery bara imambara a tale of riches and poverty http t co qla0pqu4a3 http t co ymnx1ddcse
-1	rt savills celebrate uk national open gardens day with our gallery of homes for outdoor living http t co xwhbx7vmbr http t co 2lymis
-1	celebrate uk national open gardens day with our gallery of homes for outdoor living http t co xwhbx7vmbr http t co 2lymisxah8
-1	national gallery again ok let s go
-1	rt tiagoaparicio otto dix germany 1891 1969 neuesachlichkeit expressionism painting twitart national gallery london http t co v
-1	rt springwellcc students currently enjoying the sights of london trafalgar square and the national gallery http t co sucvsidzxd
-1	students currently enjoying the sights of london trafalgar square and the national gallery http t co sucvsidzxd
-1	trafalgarsquare london lovethiscity dusk favouritetimeofday national portrait gallery https t co zsrgufjovk
-1	rt jackiem23 the lads in the national gallery better hide this so marref http t co lvqt17fagi
-1	artist stan kar prepares for an exhibition gallery art http t co ws9clpj7c0 national gallery london new york tate royal academy
-1	the lads in the national gallery better hide this so marref http t co lvqt17fagi
-1	chronopup back2stonewall logicalvulcan timotah4485 dukeofvinings arty moooooos from the national gallery of art
-1	rt nnimhaoileoin quick someone get to the national gallery and paint over this monument of inequality liveline marref http t co art
-1	nationalgallery well there are some amazing paintings in an amazing national collection impossible to choose i kept favoriting everyone
-1	a warning against greed by hieronymus bosch at the national gallery of art arsmoriendi https t co orcexstpgr
-1	why go to a gallery full of empty frames http t co neivcokv7h
-1	porte bagage sanaa s proposal for new national gallery ludwig museum in budapest http t co vhvfaixy8w http t co xktvtckozn
-1	national gallery of canada s covillengc is opening soon and we are looking forward to it http t co heohqcf6bw
-1	river of fog zhangjiajie national park china amazing photo by allapetropavlovska check out her gallery for mo http t co bhkuub0miw
-1	nfc star wars helmets https t co sghnj90nhr http t co xrbhihhqra
-1	in celebration of nationalparkweek http t co plj43pfvvr nationalparks nature beauty outdoors outdoorfriday http t co p1xhx6x7ac
-1	i m at national gallery of art sculpture garden ngadc in washington dc https t co iddxxxii0l
-1	fotoset kahlo kid saw my babe monet at the national gallery today http t co okk4lt9jvj
-1	rt joeturone i did an interview with sirenfm recently and spoke about things it s live now so check it out http t co 12r2t4hrjv
-1	rt nnimhaoileoin quick someone get to the national gallery and paint over this monument of inequality liveline marref http t co art
-1	rt nnimhaoileoin quick someone get to the national gallery and paint over this monument of inequality liveline marref http t co art
-1	rt nnimhaoileoin quick someone get to the national gallery and paint over this monument of inequality liveline marref http t co art
-1	rt nnimhaoileoin quick someone get to the national gallery and paint over this monument of inequality liveline marref http t co art
-1	rt nnimhaoileoin quick someone get to the national gallery and paint over this monument of inequality liveline marref http t co art
-1	rt nnimhaoileoin quick someone get to the national gallery and paint over this monument of inequality liveline marref http t co art
-1	rt nnimhaoileoin quick someone get to the national gallery and paint over this monument of inequality liveline marref http t co art
-1	wallpaper national geographic for photo gallery erosion and weathering http t co l2xxuoilyn via natgeo
-1	national museum to display centuries of clothing in first curated fashion gallery from across the http t co ydoywuvjrj
-1	quick someone get to the national gallery and paint over this monument of inequality liveline marref http t co artoe7j7qd
-1	just posted a photo national gallery of indonesia https t co ytjcqfavih
-1	life is a choice and we must dare to choose national gallery of indonesia https t co up99v4fr2g
-1	rt uaf this sunday solidarity with greek anti fascists jail golden dawn http t co 3oldz3v3hi
-1	lincoln s quote exhibited n the national portrait gallery cld ve been said 2day amp wld b relevant blacklivesmatter http t co xv9vj29th1
-1	rt pcs_union support monday s pcs strike against privatisation nationalgallery write director nicholas penny pcsculturegroup http t
-1	travelhistory us national parks in all their glory nationalparkweek via guardiantravel http t co z35pjrpdfz http t co zuhvyeohht
-1	the force is strong with this designer he made star wars inspired nfl helmets afc https t co rotin7jhfq nfc https t co 9j0ofmmlcz
-1	thursday was national high five day celebrities who love a good five http t co mhwvg1h6vy http t co naxeeuytoo
-1	the national gallery and some ants walking around london england vscocam lifeonthego https t co juyecegvu6
-1	national math festival http t co zehas4t7av http t co jzlk94caui
-1	managed to blag myself into the national gallery of modern art as an indian citizen saving 140 https t co 8cufniwrwo
-1	joeturone here s your interview on siren fm http t co x8vrrltibv
-1	rt zeren15 scienzaescuola claude monet ladies in flowers 1875 the national gallery in prague http t co usbkeflgex
-1	rt zeren15 scienzaescuola claude monet the artist s garden in argenteuil 1873 national gallery of art http t co st3dnuvdgx
-1	pcs_union noprivatisationatnationalgallery support candy udwin no to money grabbers national gallery not for sale workers unite
-1	photo national gallery dreamy cornucopia of creepy hands babies amazing http t co 0dyl5risi1
-1	rt morpholioapps a publicly accessible roof rises from the ground proposal by snohetta design archdaily http t co h5pcx2z5jn htt
-1	rt luciatassan ginevra de benci leonardo 1474 8 national gallery of art washington museoideale bgiorno asamsakti n2312neagoe http
-1	rt ukweatherstory check out this easter sunday double page interview with author patrick nobbs in scotland s national the sunday post ht
-1	rt ferdistam john constable wivenhoe park essex 1816 national gallery of art washington art painting landscape artwit http t
-1	wyldfamtravel london national gallery has so many famous paintings kids will love science museoum and natural history museum all free
-1	rt k_vanvoorhees new york george bellows 1911 national gallery of art washington http t co 6bks6bcgdi
-1	rt zeren15 scienzaescuola claude monet the artist s garden in argenteuil 1873 national gallery of art http t co st3dnuvdgx
-1	rt tiagoaparicio claude monet interior after dinner 1868 9 national gallery of art washington dc twitart painting http t co
-1	what s the name of that ridiculously large and beautiful landscape painting at the end of one hallway in the national portrait gallery
-1	rt scienzaescuola paul gauguin the bathers 1897 national gallery of art http t co r5lqkxhdn2
-1	visitlondon the national gallery museum
-1	rt svnraven photo gallery 10 insights on the industrial sector national real estate investor scoopit via dtzstlouis http t co re
-1	rt storiedellarte william merritt chase a friendly call 1895 national gallery of art washington d c oil on canvas conversation http
-1	rt altperspective national geographic photo contest winners people http t co cgt0917pb4 photography nationalgeographic winners htt
-1	rt scienzaescuola camille pissarro the gardener 1883 1895 national gallery of art http t co vs47tbeifj
-1	rt juhyunghan robert seldon duncanson african american 1821 72 still life with fruit and nuts 1848 national gallery of art http
-1	rt scienzaescuola claude monet bridge at argenteuil on a gray day c 1876 national gallery of art http t co hl2zqwzirz
-1	rt scienzaescuola claude monet argenteuil c 1872 national gallery of art http t co hpv7xycmia
-1	rt luciatassan ginevra de benci leonardo 1474 8 national gallery of art washington museoideale bgiorno asamsakti n2312neagoe http
-1	rt 2013_therese street in venice 1882 john singer sargent national gallery of art streets http t co j1rziivwbf
-1	rt btekeyan fascinatingart vincent van gogh autoritratto 1889 national gallery of art washington d c http t co qdmyibbflf
-1	rt scienzaescuola claude monet sainte adresse 1867 national gallery of art http t co 3brvzgrbfz
-1	rt scienzaescuola vincent van gogh flower beds in holland c 1883 national gallery of art http t co spf2o9jhrd
-1	rt rosapiccolo68 by caravaggio taking of christ 1602 national gallery of ireland dublino painting art italy artlovers http
-1	rt mcquiabelho planturs closeup of van gogh s green wheat fields auvers from the national gallery of art art http t co bj5quuzloe
-1	rt jeannewmanglock spring ngadc washington dc s majestic national gallery of art perfect spot today http t co 2oflijzyce http t
-1	rt scienzaescuola pierre auguste renoir flowers in a vase c 1866 national gallery of art washington http t co 1srd4exhrd
-1	rt scienzaescuola camille pissarro two women chatting by the sea st thomas 1856 national gallery of art washington http t co o7z
-1	rt scienzaescuola vincent van gogh the olive orchard 1889 national gallery of art http t co rb9r1ks1pu
-1	rt leafautumn2013 theater 1879 mary cassatt national gallery of art washington rt biagio960 http t co rcmmfm7rp2
-1	rt mamogiack art twitart paul gauguin dal mare fatata te miti 1892 national gallery of art washington http t co zqugpr9tsu
-1	rt 2013_therese ships riding on the seine at rouen 1873 claude monet national gallery of art washington http t co 6mdj1hc2j6
-1	rt scienzaescuola edgar degas horses in a meadow 1871 national gallery of art http t co txllcoz0tr
-1	rt tvagabondtales the national gallery of art on a gorgeous day washingtondc travel http t co 6s82wgcb5w
-1	latest from tmpb going down national museum manila http t co 8glzicgaoz mobilephotography
