-1	yowww national gallery of indonesia https t co 63refwvbig check this out http t co nyhblebtbt schlyzer
-1	yowww national gallery of indonesia https t co iqzihkhtzj
-1	rt nationalgallery all levels of ability are welcome at our watercolour workshop on 13 may http t co zyvcv6nxcm http t co ikbh1ogsx6
-1	liveline just phoned national art gallery to ask they remove paintings which depict love between men women might sway people towards no
-1	national museum to display centuries of clothing in first curated fashion gallery http t co ju4bm6ghql
-1	happy 58th birthday brecon beacons national park http t co vc1yyojsfn
-1	rt occupiedtimes call to rally outside the national gallery london 3pm sunday 19th april in support of greek antifascists http t co
-1	rt occupiedtimes call to rally outside the national gallery london 3pm sunday 19th april in support of greek antifascists http t co
-1	rt occupiedtimes call to rally outside the national gallery london 3pm sunday 19th april in support of greek antifascists http t co
-1	no privatisation at national gallery ken loach addresses rally https t co vtxnohbcuc thanks alisonsye
-1	rt occupiedtimes call to rally outside the national gallery london 3pm sunday 19th april in support of greek antifascists http t co
-1	the robert and jane meyerhoff collection co published withthe national gallery http t co z1tapmjuir http t co v0u3voqllh
-1	rt zeren15 scienzaescuola claude monet ladies in flowers 1875 the national gallery in prague http t co usbkeflgex
-1	rt zeren15 scienzaescuola claude monet the artist s garden in argenteuil 1873 national gallery of art http t co st3dnuvdgx
-1	ha another mention for the national gallery http t co mynhmledfo rt hba_london im pei s beautifully crafted east building at nati
-1	rt the_hindu photo gallery bara imambara a tale of riches and poverty http t co qla0pqu4a3 http t co ymnx1ddcse
-1	sid and joe and the national portrait gallery http t co 21dwbwvyfd
-1	check out my latest podcast http t co ftshz1ark5 on podbean
-1	stop the privatisation of services at the nationalgallery sign the petition now thanks alisonsye https t co 9gzxbuks3r via 38_degrees
-1	rt zipyrich amp just so you nfc types don t feel left out https t co jgzdastjkg
-1	scenesfromthemall ngadc cherryblossoms dc goodpeople goodtymes national gallery of art https t co lvcd34fsd8
-1	rt nicole_gabri musica alle tuileries edouard manet 1862 national gallery londra artninja artwit twitart art http t co wthw1zml
-1	what kind of content can influence opinion thehubzw april 21st bulawayo at national gallery with kubatana amp zimbojam
-1	rt pcs_union support monday s pcs strike against privatisation nationalgallery write director nicholas penny pcsculturegroup http t
-1	rt pcs_union support monday s pcs strike against privatisation nationalgallery write director nicholas penny pcsculturegroup http t
-1	glory charles national gallery gold gilding sometime the http t co zlwsbtf0de
-1	national portrait gallery in washington pays touching tribute to robin williams
-1	rt armgenocide100 khoren der harutian genocide the bed of euphrates 1930s national gallery of armenia http t co mu5ejjsub4
-1	rt guardianeco buttes and beasts amazing us national parks in pictures http t co sinusmnhfi
-1	there is still room for ten more students for a field trip to the national gallery to look at sculptures of you want to go with me next fri
-1	rt armgenocide100 khoren der harutian genocide the bed of euphrates 1930s national gallery of armenia http t co mu5ejjsub4
-1	im pei s beautifully crafted east building at national gallery of art in washington masterful http t co bhsiuhymgw
-1	a publicly accessible roof rises from the ground proposal by snohetta design archdaily http t co h5pcx2z5jn http t co scefm68hhy
-1	rt kalabashmedia how you can become a source of news and quality content thehubzw april 21st bulawayo at national gallery with tvyangu
-1	vivjcarter nationalgallery i once came to the gallery especially to see this amp it was on loan elsewhere have seen it since though
-1	rt zipyrich amp just so you nfc types don t feel left out https t co jgzdastjkg
-1	latergram sculpture garden whilst visiting jamesturrell at nga national gallery of australia https t co ssspyxf13k
-1	rt kalabashmedia how you can become a source of news and quality content thehubzw april 21st bulawayo at national gallery with tvyangu
-1	rt kalabashmedia how you can become a source of news and quality content thehubzw april 21st bulawayo at national gallery with tvyangu
-1	what are you looking at national gallery of indonesia https t co czz9fknnno
-1	rt pcs_union support monday s pcs strike against privatisation nationalgallery write director nicholas penny pcsculturegroup http t
-1	rt pcs_union support monday s pcs strike against privatisation nationalgallery write director nicholas penny pcsculturegroup http t
-1	rt pcs_union support monday s pcs strike against privatisation nationalgallery write director nicholas penny pcsculturegroup http t
-1	support monday s pcs strike against privatisation nationalgallery write director nicholas penny pcsculturegroup http t co jgrdysk96a
-1	rt travelspotshots national gallery front http t co fwixkwcbeo
-1	the national gallery of art on a gorgeous day washingtondc travel http t co 6s82wgcb5w
-1	amp just so you nfc types don t feel left out https t co jgzdastjkg
-1	how you can become a source of news and quality content thehubzw april 21st bulawayo at national gallery with tvyangu amp radiodialoguefm
-1	the national gallery of victoria in melbourne has the largest stained glass cieling on earth http t co fjshkbdf5d
-1	sanaa s proposal for new national gallery ludwig museum in budapest http t co v4z0pd0aad http t co hls5txjw4g
-1	how you can become a source of news and quality content thehubzw april 21st bulawayo at national gallery with tvyangu amp radiodailoguefm
-1	buttes and beasts amazing us national parks in pictures http t co fwq3idh2eo
-1	the lost gardens of manchester celebrated in a national trust installation at the main art gallery anyone seen http t co aoi6dflagb
-1	rt maaria_waseem study of a ironer c 1840 drawing natural pigments opaque watercolour source national gallery of australia http t co
-1	rt maaria_waseem study of a cook c 1840 ascribed to shaykh muhammad amir of karraya bengal india source national gallery of australia ht
-1	world s coolest new buildings architecture website architizer has just announced the winners of its 3rd annu http t co qcbyfpx02r
-1	world s coolest new buildings architecture website architizer has just announced the winners of its 3rd annu http t co xufsefbgea
-1	rt luciatassan ginevra de benci leonardo 1474 8 national gallery of art washington museoideale bgiorno asamsakti n2312neagoe http
-1	photo pintoras rosa bonheur french 1822 1899 a stag 1893 via national gallery of ireland http t co rhltnweymk
-1	in the scottish national gallery specifically to see 2 of my favourite paintings this is one http t co ekhbtdjyky
-1	amazing photography for national park week showing dramatic wildlife http t co qs4br3jzng photography guardian http t co zidspgarus
-1	rt kalabashmedia hub unconference thehubzw on april 21st in bulawayo at national gallery content creators in arts amp media invited ad
-1	rt gmbsisters greatgranddaughter of a slave 93yo betty is natparkservice s oldest ranger after wkg fr usboilermakers union in ww2 http
-1	greatgranddaughter of a slave 93yo betty is natparkservice s oldest ranger after wkg fr usboilermakers union in ww2 http t co 5fdfuf2h2t
-1	rt britainmagazine get a taster of the upcoming nationaltrust exhibition lyons teashop lithographs mottisfontnt w our image gallery
-1	rt photossmh best of the world photo gallery online now photossmh smh photography photossmh http t co nzfbkshqra http t co 0uclj
-1	rt zeren15 scienzaescuola claude monet ladies in flowers 1875 the national gallery in prague http t co usbkeflgex
-1	18 18 everything you can imagine is real pablo picasso national gallery of indonesia https t co brv3eu3k8f
-1	linking linking arms open at the bothy in scottish national gallery of modern art fri sun 10 5 come on down http t co 2uw3f0w58d
-1	rt eisunion eisunion support pcs_union campaign opposing privatisation of jobs amp services nationalgallery add your support at http
-1	rt storiedellarte william hogarth hogarth painting thalia the muse of comedy 1757 c nationalgallery gallery london painting htt
-1	buttes and beasts amazing us national parks in pictures http t co 4hxfbirdtj
-1	rt storiedellarte william hogarth hogarth painting thalia the muse of comedy 1757 c nationalgallery gallery london painting htt
-1	the national art gallery in manila houses the famous spolarium painting by juan luna http t co nxr0iqzhzk
-1	rt ferdistam pieter de hooch 1629 1684 a woman drinking with two men 1658 the national gallery london art interior http t co
-1	manet to picasso the national gallery national gallery london 2007 185709333x http t co hsdrsr8eqs http t co i7alavah6p
-1	rt girlfuturist henri rousseau tiger in a tropical storm surprised 1891 national gallery london http t co 4jeb5d713p rt ferdistam
-1	manet to picasso the national gallery national gallery london 2007 185709333x http t co lqoptqwdcb http t co bm4ptyjugc
-1	national portrait gallery what s on http t co b9tgmyqhqh
-1	national gallery what s on http t co wo6qkygnhj
-1	rt alisonsye please take a moment to look at this blog dedicated to saving the national gallery from privatistaion http t co kykd6k
-1	please take a moment to look at this blog dedicated to saving the national gallery from privatistaion http t co kykd6kadvr
-1	talented artist was a brush stroke from showcasing his work at national portrait gallery http t co vi8oqhkh3l googlealerts
-1	hub unconference thehubzw on april 21st in bulawayo at national gallery content creators in arts amp media invited admission free
-1	rt 750motorclub and raceteamimages gallery can be found here http t co fuif03iv2b
-1	rt luciatassan ginevra de benci leonardo 1474 8 national gallery of art washington museoideale bgiorno asamsakti n2312neagoe http
-1	and raceteamimages gallery can be found here http t co fuif03iv2b
-1	http t co 0z0mv0ll4h love at first sight at the market by national gallery of paris http t co hv6usgyl2u
-1	rt luciatassan ginevra de benci leonardo 1474 8 national gallery of art washington museoideale bgiorno asamsakti n2312neagoe http
-1	rt britainmagazine get a taster of the upcoming nationaltrust exhibition lyons teashop lithographs mottisfontnt w our image gallery
-1	rt luciatassan ginevra de benci leonardo 1474 8 national gallery of art washington museoideale bgiorno asamsakti n2312neagoe http
-1	photography love at first sight at the market by national gallery of paris http t co hikqwjgyle http t co 0vsrr2x5vj
-1	http t co j22h4axjmx photography love at first sight at the market by national gallery of paris http t co fquulznp2s
-1	rt giuliacambieri absolutely stunning pics of some of the best us national parks can t wait to explore that beautiful crazy country ht
-1	photoshop gt gt http t co xn0qiwydpc love at first sight at the market by national gallery of paris http t co 2rrneuqtmb
-1	photoshop http t co ra3vz7uxoj love at first sight at the market by national gallery of paris http t co 4s1gsoqcwi
-1	photoshop http t co gxdcfnrclu love at first sight at the market by national gallery of paris http t co g637ha0f3t
-1	kca votejkt48id igenehenry 500px love at first sight at the market by national gallery of paris http t co 2pakx5mugk
-1	500px http t co cwcobmtitz love at first sight at the market by national gallery of paris http t co kspdbvxtgu
-1	instagram love at first sight at the market by national gallery of paris instaration photography photooftheday http t co w2skyqjt4w
-1	rt photossmh best of the world photo gallery online now photossmh smh photography photossmh http t co nzfbkshqra http t co 0uclj
-1	buttes and beasts amazing us national parks in pictures http t co wqy7dep1vz
-1	photos of the week photo gallery photossmh smh photography photossmh fairfaxphotos http t co vbr0chlrot http t co 2xrisjjpih
-1	best of the world photo gallery online now photossmh smh photography photossmh http t co nzfbkshqra http t co 0ucljujwjg
-1	stunning stunning photographs http t co zutvvfgqrr
-1	have a good day everybody national gallery https t co yvhvdbyjks
-1	washington national gallery of art http t co afu8fbctin
-1	buttes and beasts amazing us national parks in pictures http t co 4oqmdcnhe8
-1	rt gj_arts project acquisition assistant london national portrait gallery http t co 1uisypoue3
-1	rt luciatassan ginevra de benci leonardo 1474 8 national gallery of art washington museoideale bgiorno asamsakti n2312neagoe http
-1	amazing us national parks in pictures http t co s7oaudlpqt
-1	rt luciatassan ginevra de benci leonardo 1474 8 national gallery of art washington museoideale bgiorno asamsakti n2312neagoe http
-1	rt luciatassan ginevra de benci leonardo 1474 8 national gallery of art washington museoideale bgiorno asamsakti n2312neagoe http
-1	art appreciation the supper at emmaus by the italian baroque master caravaggio amp in the national gallery in london http t co 5wgfx3umzr
-1	rt storiedellarte william hogarth hogarth painting thalia the muse of comedy 1757 c nationalgallery gallery london painting htt
-1	dardanteurope this is one of my fave pictures in the nationalgallery too i always go and see it if i m in the gallery
-1	rt luciatassan ginevra de benci leonardo 1474 8 national gallery of art washington museoideale bgiorno asamsakti n2312neagoe http
-1	rt storiedellarte william hogarth hogarth painting thalia the muse of comedy 1757 c nationalgallery gallery london painting htt
-1	rt irihapeta nationalgallery there are many i have to see when i happen to be in london your gallery one is the execution of lady ja
-1	get a taster of the upcoming nationaltrust exhibition lyons teashop lithographs mottisfontnt w our image gallery http t co l2r5kjcvj1
-1	william hogarth hogarth painting thalia the muse of comedy 1757 c nationalgallery gallery london painting http t co ycqgtdzhnn
-1	eisunion support pcs_union campaign opposing privatisation of jobs amp services nationalgallery add your support at http t co qbhypvqahq
-1	your body is a wonderland national gallery of indonesia https t co 4xys2zxoxp
-1	absolutely stunning pics of some of the best us national parks can t wait to explore that beautiful crazy country http t co fhu8aw219c
-1	new national gallery app puts art history in your kids hands via pinterest http t co osvft3dktf
-1	nationalgallery one of mine hanging in your gallery now that would be must see lol
-1	rt ramanewdelhi the energy amp creativity of new private museums offer lessons to govt ones http t co d85ivkhcp4 rembhopalmuseum nutsha
-1	rt luciatassan ginevra de benci leonardo 1474 8 national gallery of art washington museoideale bgiorno asamsakti n2312neagoe http
-1	rt luciatassan ginevra de benci leonardo 1474 8 national gallery of art washington museoideale bgiorno asamsakti n2312neagoe http
-1	rt the_hindu photo gallery bara imambara a tale of riches and poverty http t co qla0pqu4a3 http t co ymnx1ddcse
-1	rt mistysilver3 the first display of cornelius johnson charles i s forgotten painter is at npglondon here s my exhibition review http
-1	rt luciatassan ginevra de benci leonardo 1474 8 national gallery of art washington museoideale bgiorno asamsakti n2312neagoe http
-1	rt armgenocide100 khoren der harutian genocide the bed of euphrates 1930s national gallery of armenia http t co mu5ejjsub4
-1	peace national gallery of indonesia https t co c9yzpxfjbf
-1	rt levitatenaija national arts theatre lagos1 http t co ys4eo17h6k via levitatenaija celebratenaija register and share amazing videos
-1	gallery gallipoli youth cup launch the clay courts at melbourne park s national tennis centre became http t co 8iymx8xcad tennis
-1	rt girlfuturist henri rousseau tiger in a tropical storm surprised 1891 national gallery london http t co 4jeb5d713p rt ferdistam
-1	rt luciatassan ginevra de benci leonardo 1474 8 national gallery of art washington museoideale bgiorno asamsakti n2312neagoe http
-1	rt irihapeta nationalgallery there are many i have to see when i happen to be in london your gallery one is the execution of lady ja
-1	rt luciatassan ginevra de benci leonardo 1474 8 national gallery of art washington museoideale bgiorno asamsakti n2312neagoe http
-1	the national gallery
-1	nationalgallery there are many i have to see when i happen to be in london your gallery one is the execution of lady jane grey
-1	rt luciatassan ginevra de benci leonardo 1474 8 national gallery of art washington museoideale bgiorno asamsakti n2312neagoe http
-1	fotoset thenudecity the national gallery of australia s mind bending exhibition james turrell a http t co jorbbvjsi1
-1	fotoset thenudecity the national gallery of australia s mind bending exhibition james turrell a http t co sf7nqv3ypq
-1	national arts theatre lagos1 http t co ys4eo17h6k via levitatenaija celebratenaija register and share amazing videos amp pics of nigeria
-1	rt the_hindu photo gallery bara imambara a tale of riches and poverty http t co qla0pqu4a3 http t co ymnx1ddcse
-1	a beautiful morning in london national gallery https t co ozn5o6lvq5
-1	rt guardiantravel buttes and beasts amazing us national parks in pictures http t co zrukt9iyoc
-1	rt thehindu photo gallery bara imambara a tale of riches and poverty http t co wuyjwvw8x0 http t co 8hsjyafiy6
-1	rt armgenocide100 khoren der harutian genocide the bed of euphrates 1930s national gallery of armenia http t co mu5ejjsub4
-1	rt the_hindu photo gallery bara imambara a tale of riches and poverty http t co qla0pqu4a3 http t co ymnx1ddcse
-1	lv label victim national gallery of indonesia https t co qgxkbf7mat
-1	dizzyjb you have to see these pics buttes and beasts amazing us national parks in pictures http t co 5bjhmdnilm
-1	buttes amp beasts amazing us national parks in pictures http t co v5umfcq7wx photography cc npca
-1	rt the_hindu photo gallery bara imambara a tale of riches and poverty http t co qla0pqu4a3 http t co ymnx1ddcse
-1	rt thehindu photo gallery bara imambara a tale of riches and poverty http t co wuyjwvw8x0 http t co 8hsjyafiy6
-1	rt the_hindu photo gallery bara imambara a tale of riches and poverty http t co qla0pqu4a3 http t co ymnx1ddcse
-1	rt thehindu photo gallery bara imambara a tale of riches and poverty http t co wuyjwvw8x0 http t co 8hsjyafiy6
-1	rt the_hindu photo gallery bara imambara a tale of riches and poverty http t co qla0pqu4a3 http t co ymnx1ddcse
-1	rt mmwlawtaos buttes and beasts amazing us national parks http t co vt3lewz2qk
-1	rt the_hindu photo gallery bara imambara a tale of riches and poverty http t co qla0pqu4a3 http t co ymnx1ddcse
-1	rt the_hindu photo gallery bara imambara a tale of riches and poverty http t co qla0pqu4a3 http t co ymnx1ddcse
-1	rt thehindu photo gallery bara imambara a tale of riches and poverty http t co wuyjwvw8x0 http t co 8hsjyafiy6
-1	buttes and beasts amazing us national parks http t co vt3lewz2qk
-1	rt thehindu photo gallery bara imambara a tale of riches and poverty http t co wuyjwvw8x0 http t co 8hsjyafiy6
-1	photo gallery bara imambara a tale of riches and poverty http t co wuyjwvw8x0 http t co 8hsjyafiy6
-1	ianstreet67 i would like to get to the national portrait gallery next time i m in london dailyquestion
-1	dmc national gallery cross stitch kits http t co 6w7uvflvuh
-1	abstrak pictoftheday gallery nasional indonesia jkt national gallery of indonesia https t co ihpyfkue8f
-1	rt occupiedtimes call to rally outside the national gallery london 3pm sunday 19th april in support of greek antifascists http t co
-1	rt chris_hassall hetti perkins is dead right australia needs a museum dedicated to aboriginal and torres strait islander cultures http
-1	the real fear is when you not believe in yourself national gallery of indonesia https t co kkbvupjmps
-1	filosofi national gallery of indonesia https t co l5dugo1fqb
-1	rt occupiedtimes call to rally outside the national gallery london 3pm sunday 19th april in support of greek antifascists http t co
-1	rt nicole_gabri musica alle tuileries edouard manet 1862 national gallery londra artninja artwit twitart art http t co wthw1zml
-1	andrea mantegna the agony in the garden 1450ish tempera on wood 80 x 63 cm national gallery london http t co uxla1gltjh
-1	rt nicole_gabri musica alle tuileries edouard manet 1862 national gallery londra artninja artwit twitart art http t co wthw1zml
-1	rt wittier milky way at phu hin rong kla national park phitsanulok thailand by sripfoto wittier s astronomy gallery http t co
-1	tree climbing lion taking a rest queen elizabeth national park uganda by david hobcote http t co hwdlbnihsi http t co avu2ngvlys
-1	call to rally outside the national gallery london 3pm sunday 19th april in su http t co bjmyvdk5q9
-1	rt occupiedtimes call to rally outside the national gallery london 3pm sunday 19th april in support of greek antifascists http t co
-1	call to rally outside the national gallery london 3pm sunday 19th april in support of greek antifascists http t co npdjfshqxr
-1	rt luciatassan ginevra de benci leonardo 1474 8 national gallery of art washington museoideale bgiorno asamsakti n2312neagoe http
-1	rt wittier milky way at phu hin rong kla national park phitsanulok thailand by sripfoto wittier s astronomy gallery http t co
-1	rt wittier milky way at phu hin rong kla national park phitsanulok thailand by sripfoto wittier s astronomy gallery http t co
-1	rt wittier milky way at phu hin rong kla national park phitsanulok thailand by sripfoto wittier s astronomy gallery http t co
-1	rt wittier milky way at phu hin rong kla national park phitsanulok thailand by sripfoto wittier s astronomy gallery http t co
-1	rt wittier milky way at phu hin rong kla national park phitsanulok thailand by sripfoto wittier s astronomy gallery http t co
-1	rt wittier milky way at phu hin rong kla national park phitsanulok thailand by sripfoto wittier s astronomy gallery http t co
-1	buttes and beasts amazing us national parks in pictures http t co pu7imh7k9y
-1	how fabulous the national gallery of victoria honouring those who died at war http t co ohm5oobcvu
-1	milky way at phu hin rong kla national park phitsanulok thailand by sripfoto wittier s astronomy gallery http t co 1p14k7o1gi
-1	the national gallery in connection with the background upon nerja adds straight a crossbones discovered good un
-1	rt maaria_waseem study of a ironer c 1840 drawing natural pigments opaque watercolour source national gallery of australia http t co
-1	rt luciatassan ginevra de benci leonardo 1474 8 national gallery of art washington museoideale bgiorno asamsakti n2312neagoe http
-1	rt maaria_waseem study of a cook c 1840 ascribed to shaykh muhammad amir of karraya bengal india source national gallery of australia ht
-1	monroe fabian joseph wright american artist national portrait gallery 1985 http t co xyhbj0z6vm http t co otzaydtqmv
-1	photoset ecstasymodels national gallery of art thank you zoe arku designs for this gorgeous gown to http t co b2zwc5eegt
-1	national gallery denmark oinomaos http t co tycmsfqx7b http t co fmuvkvljze
-1	rt therematrix exquisite fretwork by polymath khadambi asalache 575 wandsworth rd ldn http t co hskeccgwrr great to meet cevannemus
-1	rt luciatassan ginevra de benci leonardo 1474 8 national gallery of art washington museoideale bgiorno asamsakti n2312neagoe http
-1	rt luciatassan ginevra de benci leonardo 1474 8 national gallery of art washington museoideale bgiorno asamsakti n2312neagoe http
-1	houseofcards house of cards chardin national gallery of art washington dc art postcard timtebow_fans fans http t co s3nplahwzj
-1	the autopsies lives in bkk the national gallery bangkok apr 2 30 http t co 4ogqrtcn8r
-1	monroe fabian joseph wright american artist national portrait gallery 1985 http t co o7ym6rasna http t co knyxtikb38
-1	rt apollo_magazine frames weren t always a marginal art form nationalgallery puts them back in the spotlight http t co neivcokv7h htt
-1	rt ramanewdelhi the energy amp creativity of new private museums offer lessons to govt ones http t co d85ivkhcp4 rembhopalmuseum nutsha
-1	national art gallery hosts exhibition to raise funds for critically ill tony figueiro http t co nyodzsdgkx via youtube
-1	rt luciatassan ginevra de benci leonardo 1474 8 national gallery of art washington museoideale bgiorno asamsakti n2312neagoe http
-1	ginevra de benci leonardo 1474 8 national gallery of art washington museoideale bgiorno asamsakti n2312neagoe http t co ygjzikxjcy
-1	citi ft citi ingenuity awards 2013 national portrait gallery d c http t co 2suddw4lxv
-1	the energy amp creativity of new private museums offer lessons to govt ones http t co d85ivkhcp4 rembhopalmuseum nutshal nityanandjraman
-1	fans houseofcards house of cards chardin national gallery of art washington dc art postcard http t co t2b0utbioa auction ebay
-1	buttes and beasts amazing us national parks in pictures http t co n9qk2t1t0l
-1	buttes and beasts amazing us national parks in pictures http t co xmtcvbeo46
-1	lastest post national gallery of victoria http t co tlmzfj1sn7 just a short walk from treasury on collins toc ngv
-1	10 off all national gallery flowers https t co ogvfnpebvo
-1	sanaa s proposal for new national gallery ludwig museum in budapest http t co s6bpzauskk via aasarchitecture
-1	westminster england the national gallery hollie is touring me in the westminster http t co ozhegkr6pf
-1	these pictures from the us national parks are splendid especially this moose http t co wyjkpbvunb http t co blma9i35fw
-1	sanaa s proposal for new national gallery ludwig museum in budapest http t co v4z0pd0aad http t co psppidpv4e
-1	buttes and beasts amazing us national parks in pictures travel the guardian http t co wt3asezxc9
