-1	another mention for national gallery of victoria http t co 10obbvv2qm rt mikejonesmelb tonight i m seeing the frederick wiseman do
-1	ngv unfurls john herbert s age worn moses with fitting reverence michael varcoe cocks the national gallery of http t co nhn8w4wrhq
-1	ngv unfurls john herbert s age worn moses with fitting reverence michael varcoe cocks the national gallery of http t co julqkavpiw
-1	ngv unfurls john herbert s age worn moses with fitting reverence michael varcoe cocks the national gallery of http t co csrl4a1fbo
-1	buttes and beasts amazing us national parks in pictures http t co i92yibxtqs
-1	rt harvardancer video i am not a test score via sosmarch national gallery of artful resistance http t co phwnogavxb saveourschools
-1	scottish national gallery of modern art we actually had to wait for the sun to set before they could https t co 1lvfhucqak
-1	tonight i m seeing the frederick wiseman documentary about the national gallery in london 3hrs of art coming up film galleries glam
-1	skyspace jamesturrell nga with mscchandler white national gallery of australia https t co b5qecqjpro
-1	new strikes at national gallery after bosses refuse to budge over privatisation http t co 6wzqrt9kge http t co asf3mq37uy
-1	also grabbed a bit of national gallery of scotland saw gin alley and beer street and a blake print on the book of job
-1	gruesome treatments from medicine s past a thousand year old anglo saxon potion has been shown to be effectiv http t co nvipm5rl8k
-1	gruesome treatments from medicine s past a thousand year old anglo saxon potion has been shown to be effectiv http t co s5lefx94di
-1	bbc news national gallery staff to stage second five day walk out http t co t7cqmgpd1v
-1	friday s national newspaper front pages http t co 9aqvnl2kzu snp labour generalelection
-1	friday s national newspaper front pages http t co 9aqvnl2kzu generalelection snp labour
-1	friday s national newspaper front pages http t co 9aqvnl2kzu conservatives generalelection
-1	amazing us national parks http t co q3e1prcnbf
-1	friday s national newspaper front pages http t co 9aqvnl2kzu voteukip
-1	srius ko rt windy_puspita nostalgic national gallery of indonesia https t co n45a3jliid
-1	the national art gallery in manila houses the famous spolarium painting by juan luna http t co 8h3ibzkbrt
-1	buttes and beasts amazing us national parks in pictures http t co cjkmylz3zg
-1	rt maaria_waseem study of a ironer c 1840 drawing natural pigments opaque watercolour source national gallery of australia http t co
-1	rt maaria_waseem study of a ironer c 1840 drawing natural pigments opaque watercolour source national gallery of australia http t co
-1	study of a cook c 1840 ascribed to shaykh muhammad amir of karraya bengal india source national gallery of australia http t co pgoa41yzj0
-1	rt maaria_waseem study of a ironer c 1840 drawing natural pigments opaque watercolour source national gallery of australia http t co
-1	rt stelygs scienzaescuola pierre auguste renoir gladioli in a vase 1874 5 the national gallery london http t co xvukxj1sji
-1	study of a ironer c 1840 drawing natural pigments opaque watercolour source national gallery of australia http t co 8ak0tfanw7
-1	rt theage_photo photo today s picture editor s choice gallery http t co p6d8bsw5df http t co tlsh6qedga
-1	photo asylum art your portrait tetsumi kudo 1963 andrea rosen gallery at the national museum of art http t co nzqr79g9vh
-1	national gallery dvd 2015 frederick wiseman http t co ebe1r30tan documentary
-1	latepost national gallery of indonesia https t co rb6wegaf2f
-1	national gallery of victoria ngv whv melbourne australia national gallery of victoria https t co 6ryaaaedjp
-1	rt robertmarawa leaders shuld be in the forefront when major national issues erupt amp not only when it s convenient at the goodman gallery
-1	buttes and beasts amazing us national parks in pictures http t co tb6a18pxta
-1	what a shot 36 amazing sports photos http t co tu5ixfgfzx
-1	national gallery of art washington new and revised edition 1000 masterpieces http t co tes8ptznxd http t co zosb2vxsgn
-1	rt mlucascir rt adrianacioci agnolo bronzino virgin and child and s johannes part 1540 national gallery london http t co flrtc3v
-1	nostalgic national gallery of indonesia https t co 7o5doujdny
-1	drmonachew i ve got one more ticket to the tour of the national gallery singapore please join me http t co lffw39llyk
-1	rt robertmarawa leaders shuld be in the forefront when major national issues erupt amp not only when it s convenient at the goodman gallery
-1	rt theage_photo photo today s picture editor s choice gallery http t co p6d8bsw5df http t co tlsh6qedga
-1	rt animekittens dude we are in the national gallery look at real van gogh paintings
-1	nationalpost these paintings should be added to the national gallery
-1	gallery durban xenophobic riots bdlive http t co xctnje5z5t via bdlivesa
-1	cheetahs are just giant house cats i took this in the maasai mara national reserve on my http t co 6nvbax5yuk http t co hhdhxlrz7j
-1	buttes and beasts amazing us national parks in pictures http t co a1ekwphua7
-1	1527 expo 74 national gallery of art picture post card http t co ia3evxsgvu http t co 0l5gcaybzt
-1	buttes and beasts amazing us national parks in pictures travel the guardian http t co 11nk5guhof
-1	rt theage_photo photo today s picture editor s choice gallery http t co p6d8bsw5df http t co tlsh6qedga
-1	1444 christmas national gallery of art picture post card http t co 0ugi3hbs3r http t co moe5zoyf5q
-1	1321 christmas madonna national gallery of art picture post card http t co 4orfkrcpoh http t co pshrbln365
-1	rt arpadlukacs london s national gallery at trafalgar square captured at night https t co qi060xx56y nationalgallery london
-1	hooray we are at the national gallery http t co qo0mzkz6cq
-1	the us s national parks offer up some of the most dramatic scenery in the world to celebrate national park http t co zfr9bika3s
-1	rt theage_photo photo today s picture editor s choice gallery http t co p6d8bsw5df http t co tlsh6qedga
-1	edo art in japan 1615 1868 by national gallery of art u s robert t singer http t co riuifngknn http t co gs1is2skv7
-1	rt theage_photo photo today s picture editor s choice gallery http t co p6d8bsw5df http t co tlsh6qedga
-1	rt theage_photo photo today s picture editor s choice gallery http t co p6d8bsw5df http t co tlsh6qedga
-1	rt theage_photo photo today s picture editor s choice gallery http t co p6d8bsw5df http t co tlsh6qedga
-1	rt theage_photo photo today s picture editor s choice gallery http t co p6d8bsw5df http t co tlsh6qedga
-1	that s god damn glorious it should be in the damn national gallery n_raymond21
-1	rt specialenews j m w turner dutch boats in a gale 1801 oil on canvas 163 x 221 cm national gallery london http t co nkhlnmd2uo
-1	photo today s picture editor s choice gallery http t co p6d8bsw5df http t co tlsh6qedga
-1	thapich gloria fletcher ao dhaynagwidh people eran national gallery of australia https t co hej4dtamgk
-1	no caption national gallery of indonesia https t co zmio5ejcli
-1	the feast of the gods 1514 giovanni bellini national gallery of art laserdisc http t co vqpkiwj53b http t co 4dahq0lqcx
-1	rt donnadeau rt glarestomper stunning us national parks in pictures http t co wkxp9damzs http t co fpcgmj54pp
-1	rt glarestomper stunning us national parks in pictures http t co wkxp9damzs http t co fpcgmj54pp
-1	sidney nolan the trial national gallery of australia https t co ndod0dhqre
-1	sidney nolan death of sergeant kennedy at stringybark creek national gallery of australia https t co jm0btbqf2q
-1	rt apollo_magazine let s stop forgetting about the frames http t co neivco2tih nationalgallery celebrates an overlooked artform http
-1	i d love to do a national park tour http t co e4pyboi4pz thoughtswhilestudying summerfever
-1	also the art team took a stoned trip to the national gallery and ran into big homie jerrysaltz at bojangles http t co hqw1ni0r9h
-1	cigar store indian postcard xix century national gallery of art washington d c 5 99 http t co imaq83cyay rare http t co vlvn32qsxk
-1	london art tweet national gallery official site the national gallery houses one of the greatest collections http t co zcz0ooizw1
-1	happy high five day here s who celebrated http t co mq9cxjqvqe
-1	rt rockandice scs 2015 open national championships highlights are out louderthan11 usaclimbing http t co 8x1tc5lywn http t co imre
-1	rt aandimagazine celebrate nationalgardeningweek with our green fingered gallery http t co fz9hohn3ul art http t co xizy9hptwd
-1	a look at georgia s national parks http t co u21v6nra5f
-1	rt wittier buttes and beasts amazing us national parks in pictures travel the guardian http t co c9wesvokao
-1	rt wittier buttes and beasts amazing us national parks in pictures travel the guardian http t co c9wesvokao
-1	rt wittier buttes and beasts amazing us national parks in pictures travel the guardian http t co c9wesvokao
-1	rt wittier buttes and beasts amazing us national parks in pictures travel the guardian http t co c9wesvokao
-1	rt wittier buttes and beasts amazing us national parks in pictures travel the guardian http t co c9wesvokao
-1	rt wittier buttes and beasts amazing us national parks in pictures travel the guardian http t co c9wesvokao
-1	mick namarari tjapaltjarri pintupi people birth of the sun national gallery of australia https t co pltj9w1i3i
-1	rt themasters look at all 18 holes of augusta national as they were in 1935 http t co j4ffptrtta mastersmemories themasters http
-1	buttes and beasts amazing us national parks in pictures travel the guardian http t co c9wesvokao
-1	rt themasters look at all 18 holes of augusta national as they were in 1935 http t co j4ffptrtta mastersmemories themasters http
-1	perceptualselfie national gallery of australia http t co 2cuziu1sod
-1	national portrait gallery mint stamp cards phq 298 2006 http t co ka2v2fisjw stampcollecting british stamps http t co ner6uqd8th
-1	photo gallery star shots best photos of april 16 2015 a roundup of the best local national and world http t co xesaas6ge2
-1	rt uaf jail golden dawn solidarity rally with greek anti fascists this sunday london http t co wi6icsa5hu
-1	rt wittier milky way long exposure at phu hin rong kla national park phitsa by sripfoto wittier s astronomy gallery http t co
-1	rt wittier milky way long exposure at phu hin rong kla national park phitsa by sripfoto wittier s astronomy gallery http t co
-1	rt wittier milky way long exposure at phu hin rong kla national park phitsa by sripfoto wittier s astronomy gallery http t co
-1	rt wittier milky way long exposure at phu hin rong kla national park phitsa by sripfoto wittier s astronomy gallery http t co
-1	rt wittier milky way long exposure at phu hin rong kla national park phitsa by sripfoto wittier s astronomy gallery http t co
-1	milky way long exposure at phu hin rong kla national park phitsa by sripfoto wittier s astronomy gallery http t co pmtwf4wyc0
-1	rt courierjournal gallery national wheelchair basketball association championships http t co sjqi9fgfse http t co ochyxdxrjt
-1	melbourne art book fair national gallery of victoria http t co ilthlhfzsn
-1	gallery national wheelchair basketball association championships http t co sjqi9fgfse http t co ochyxdxrjt
-1	rt tvcniagara katecarnegie tvcniagara is fortunate to say you ve been a part of the picture watch kate s greeting here http t co g
-1	christmas usa fra filippo lippi national gallery old stamp 1063 from united states philately http t co auinaygwfw
-1	i was getting stegosaurus vibes from a ridge in glacier national park bc these mountains http t co a9i7k4tsta https t co 0pzxeyicb5
-1	the ceiling in the courtyard of the national portrait gallery and yes the ceiling is entirely made https t co jq8ujeilcl
-1	woot http t co t0d8lzdxnp
-1	photo of the day can t choose http t co 8kvzqmd5od
-1	the esperson gallery exhibits highly collected and emerging texas artists as well as national http t co ugzxaul5fa
-1	it s almost climbing season national gallery of canada https t co frxbit0wwt
-1	rt guardianeco buttes and beasts amazing us national parks in pictures http t co sinusmnhfi
-1	camille pissarro self portrait 1852 1854 oil on canvas 31 x 28 5 cm national gallery of denmark http t co x8dcvgf26x
-1	travel buttes and beasts amazing us national parks in pictures http t co qvmi5zfhzt
-1	rt rockandice scs 2015 open national championships highlights are out louderthan11 usaclimbing http t co 8x1tc5lywn http t co imre
-1	moh pi national gallery
-1	so sweeeeeeeet alaskan mooooose http t co jdnebzdddk http t co zhaun1knmb
-1	national gallery london detail of the boys from the vendramin family group portrait by titian 15 http t co gamgqmfqid
-1	photo one man and a circle soothingview resting richardlong at national gallery of art east http t co zfllbwtygh
-1	rt trflyingforfree national geographic traveller picks 2015 s best travel photos http t co ulz1ptl3zw http t co iiorxb9bc9
-1	rt trflyingforfree national geographic traveller picks 2015 s best travel photos http t co ulz1ptl3zw http t co iiorxb9bc9
-1	rt michellegregor beautiful visitor to sf from scotland s national gallery by titian deyoungmuseum scotlandcollection arthistory http
-1	rt michellegregor beautiful visitor to sf from scotland s national gallery by titian deyoungmuseum scotlandcollection arthistory http
-1	beautiful visitor to sf from scotland s national gallery by titian deyoungmuseum scotlandcollection arthistory http t co ehwc1bltzt
-1	jasper national park alberta canada beautiful photo by taylormichaelburk check out his gallery for more detai http t co ccespwxs3i
-1	lot of 300 prints most 11x14 national gallery of art washington art series class http t co jtwxtxskaj http t co 9jhgrzv1xq
-1	scienzaescuola claude monet the artist s garden in argenteuil 1873 national gallery of art http t co st3dnuvdgx
-1	scienzaescuola claude monet ladies in flowers 1875 the national gallery in prague http t co usbkeflgex
-1	rt scienzaescuola claude monet ships riding on the seine at rouen 1872 73 national gallery of art http t co sxefutyivk
-1	photo arsvitaest george bellows men of the docks 1912 oil on canvas the national gallery london http t co wjsqyz2sgy
-1	if you haven t been to see national gallery of victoria s superb exhibition a golden age of china qianlong http t co baorgvktbm
-1	rt therematrix exquisite fretwork by polymath khadambi asalache 575 wandsworth rd ldn http t co hskeccgwrr great to meet cevannemus
-1	cupola established 1991 has four exhibition spaces the gallery stocks over 300 local national and international artists cupolagallery
-1	cupola established 1991 has four exhibition spaces the gallery stocks over 300 local national and international artists cupolagallery
-1	cupola established 1991 has four exhibition spaces the gallery stocks over 300 local national and international artists cupolagallery
-1	cupola established 1991 has four exhibition spaces the gallery stocks over 300 local national and international artists cupolagallery
-1	cupola established 1991 has four exhibition spaces the gallery stocks over 300 local national and international artists cupolagallery
-1	cupola established 1991 has four exhibition spaces the gallery stocks over 300 local national and international artists cupolagallery
-1	cupola established 1991 has four exhibition spaces the gallery stocks over 300 local national and international artists cupolagallery
-1	cupola established 1991 has four exhibition spaces the gallery stocks over 300 local national and international artists cupolagallery
-1	cupola established 1991 has four exhibition spaces the gallery stocks over 300 local national and international artists cupolagallery
-1	cupola established 1991 has four exhibition spaces the gallery stocks over 300 local national and international artists cupolagallery
-1	cupola established 1991 has four exhibition spaces the gallery stocks over 300 local national and international artists cupolagallery
-1	cupola established 1991 has four exhibition spaces the gallery stocks over 300 local national and international artists cupolagallery
-1	cupola established 1991 has four exhibition spaces the gallery stocks over 300 local national and international artists cupolagallery
-1	cupola established 1991 has four exhibition spaces the gallery stocks over 300 local national and international artists cupolagallery
-1	cupola established 1991 has four exhibition spaces the gallery stocks over 300 local national and international artists cupolagallery
-1	cupola established 1991 has four exhibition spaces the gallery stocks over 300 local national and international artists cupolagallery
-1	cupola established 1991 has four exhibition spaces the gallery stocks over 300 local national and international artists cupolagallery
-1	cupola established 1991 has four exhibition spaces the gallery stocks over 300 local national and international artists cupolagallery
-1	cupola established 1991 has four exhibition spaces the gallery stocks over 300 local national and international artists cupolagallery
-1	cupola established 1991 has four exhibition spaces the gallery stocks over 300 local national and international artists cupolagallery
-1	cupola established 1991 has four exhibition spaces the gallery stocks over 300 local national and international artists cupolagallery
-1	cupola established 1991 has four exhibition spaces the gallery stocks over 300 local national and international artists cupolagallery
-1	cupola established 1991 has four exhibition spaces the gallery stocks over 300 local national and international artists cupolagallery
-1	mhs students at national gallery of art saw raphael s madonna amp only davinci painting in us earth w o art is eh http t co pgjzdojsiz
-1	rt glarestomper stunning us national parks in pictures http t co nysiesztkz http t co bqh2cmzwye
-1	rt glarestomper stunning us national parks in pictures http t co nysiesztkz http t co bqh2cmzwye
-1	stunning us national parks in pictures http t co nysiesztkz http t co bqh2cmzwye
-1	trafalgar square nataliemarchant posted a photo smallest police station outside the national gallery in http t co yqzjcgj2cu
-1	rt coffeetographer record store day is coming a look back with blackgoldbkln sweetleaflic pacificsocial http t co hwrlkf538i coffe
-1	exquisite fretwork by polymath khadambi asalache 575 wandsworth rd ldn http t co hskeccgwrr great to meet cevannemusic there today
-1	rt radicalwales an artist led bring n buy fayre to raise money for the striking staff at london s national gallery please donate http
-1	tummylirry she lost me in the national art gallery and texted me also i tried to make an origami flower it did not work
-1	rt radicalwales an artist led bring n buy fayre to raise money for the striking staff at london s national gallery please donate http
-1	peter paul rubens marchesa brigida spinola doria detail 1606 national gallery of art washington d c http t co 2vdbauguth
-1	cezanne at the national gallery https t co ewtmixn8w8
-1	published a new blog entry texas us national mototrials 2015 photo gallery in auto appraisers and appraisals den https t co e8ekkkeour
-1	rt marisabeloyo douard manet the masked ball at the opera 1873 national gallery of art washington dc usa art http t co n1jtddp
-1	scs 2015 open national championships highlights http t co 8zvfklghmv
-1	ngci attends regional art conference by delisa hernandez the national gallery pushes ahead http t co skgciklsag yournews gmu
-1	scs 2015 open national championships highlights are out louderthan11 usaclimbing http t co 8x1tc5lywn http t co imrexuhymo
-1	today i went to the national gallery and saw van gogh paintings in the flesh for the first time in my https t co yfcfh6pmb4
-1	rt k_vanvoorhees new york george bellows 1911 national gallery of art washington http t co 6bks6bcgdi
-1	mixing my photos national gallery of art congress building washingtondc http t co kbh0t4d5tp http t co lhz5vk1mrg
-1	rt patriciadamiano cecil beaton by curtis moffat ca 1928 national portrait gallery http t co n34xgh9dwe http t co vvz1ecaoje
-1	rt patriciadamiano cecil beaton by curtis moffat ca 1928 national portrait gallery http t co n34xgh9dwe http t co vvz1ecaoje
-1	rt writinginfo poetry at harlow the harlow gallery will celebrate national poetry month with a special guest at thei http t co eidq
-1	rt kelliecnn great pics cnn national park week 2015 http t co iznfyrroid
-1	an artist led bring n buy fayre to raise money for the striking staff at london s national gallery please donate http t co yau965zkjb
-1	rt lambo2126 new college signing to report bobsingernj congrats to marianna singer photo of her signing in this photo gallery http
-1	great pics cnn national park week 2015 http t co iznfyrroid
-1	rt writinginfo poetry at harlow the harlow gallery will celebrate national poetry month with a special guest at thei http t co eidq
-1	antonello da messina saint jerome in his study ng1418 the national gallery london http t co z2blyozyhl
-1	rt nicole_gabri musica alle tuileries edouard manet 1862 national gallery londra artninja artwit twitart art http t co wthw1zml
-1	this cute guy took me to the national portrait gallery because he wanted me to see his favourite https t co coyqieqcog
-1	rt writinginfo poetry at harlow the harlow gallery will celebrate national poetry month with a special guest at thei http t co eidq
-1	national wildlife gallery is out http t co gg1x8sos1n
-1	visited the national gallery this week and everything blew me away from floor to ceilin http t co bvgs8edjcb http t co stztiwje6h
-1	rt seven_days celebrate national poetry month at phoenixbooksvt today and help pick the next vt poet laureate http t co lckw1td15p
-1	tpw photoedu buttes and beasts amazing us national parks in pictures the guardian http t co qekfznptk2
-1	on the wall between some bathrooms at the national portrait gallery stephenathome laureldoesdc http t co crvx20h6hz
-1	rt writinginfo poetry at harlow the harlow gallery will celebrate national poetry month with a special guest at thei http t co eidq
-1	ma_rylou national gallery it s the louvre of london
-1	national gallery of art washington world of art world of art paperback http t co ambe4tpo24 http t co mupqlqfwo3
-1	the grand national in pictures http t co nkaqj1ivlz
-1	rt marc_haegeman a new gallery on for ballet lovers only of het nationale ballet dutch national ballet in john neumeier s lady http
-1	portrait of stephenathome npg heading back to comedycentral hope they have a good archivist http t co iu580kluxk
-1	virtual gallery of things to do in chicago get hype for fia83 national convention http t co o6rbnymbuj register http t co jdbhggo1u6
-1	virtual gallery of things to do in chicago get hype for fia83 national convention http t co mvka3ddndk register http t co wedepii11u
-1	virtual gallery of things to do in chicago get hype for fia83 national convention http t co 5bncqodsbr register http t co srkpeg2bvy
-1	rt resistunite further strikes at the national gallery 20 24 april and 1 may http t co qsocybkyh1 pcs pcs_union reinstatecandy nopr
-1	rt guardianjessica america you are beautiful in spring yes you are http t co 71dzxwxelk http t co w1f5suktl5
-1	national gallery of art dc http t co s5lgapa8ac
-1	buttes and beasts amazing us national parks in pictures http t co rtlwh4wknd
-1	tate britain or national gallery i have to decide because there isn t enough time
-1	katecarnegie tvcniagara is fortunate to say you ve been a part of the picture watch kate s greeting here http t co gbh5kgr3nh
-1	tiffanybrookes1 dallascowboys starwars helmet more afc https t co fhyooonsyg nfc https t co 0mvglvirgt http t co bc8cncefm5
-1	rt mlucascir rt adrianacioci agnolo bronzino virgin and child and s johannes part 1540 national gallery london http t co flrtc3v
-1	and now for something completely different a bit of beauty in the world us national parks in pictures http t co takggrwcxr
-1	starwars nfl helmets afc https t co jz19mt6qbk nfc https t co zubbemnach ep 7 trailer http t co xyxyzqc3xv http t co hgrgge3kj2
-1	rt resistunite further strikes at the national gallery 20 24 april and 1 may http t co qsocybkyh1 pcs pcs_union reinstatecandy nopr
-1	selfie central tonight at the petsinportraits book lunch npglondon national portrait gallery https t co 0lnt5ioarf
-1	rt resistunite further strikes at the national gallery 20 24 april and 1 may http t co qsocybkyh1 pcs pcs_union reinstatecandy nopr
-1	buttes and beasts amazing us national parks in pictures http t co a2auxnwp2k
-1	buttes and beasts amazing us national parks in pictures http t co rx1ueper7n
-1	angietheo14 national gallery of art in washington dc
-1	buttes and beasts amazing us national parks in pictures http t co ovajpe3the lovely
-1	enjoyed this at the national gallery yesterday http t co o0bgthddlh
-1	gallery 37 in milford to host national poetry month event april 18 http t co orydyzs6rm
-1	rt noelmcardle national gallery of ireland ngi stpatricksday http t co v3xr7lhyik
-1	in the frame nationalgallery celebrates an overlooked art form cf http t co guvmdlm4xs via apollo_magazine
-1	rt themasters look at all 18 holes of augusta national as they were in 1935 http t co j4ffptrtta mastersmemories themasters http
-1	lovely vincent van gogh van goghs hehehe tbt to last summer the national gallery nationalgallery https t co h7bbnv4vkz
-1	rt tvcniagara brittanygogo tvcniagara is fortunate to say you ve been a part of the picture watch brittany s greeting here http t
-1	rt leicester_merc pictures ukbff national bodybuilding chamionships at leicester s de montfort hall http t co pkupxy4bmu http t co
-1	brittanygogo tvcniagara is fortunate to say you ve been a part of the picture watch brittany s greeting here http t co j33jowpumb
-1	southern miss recently hosted national history day check out the photo gallery at a amp l now http t co b3mzmjvjcm http t co zzuq1eaog0
