-1	ntu and the national gallery to shed new light on old master paintings http t co vltufwsbdn
-1	rt ferdistam charles conder herrick s blossoms 1888 national gallery of australia canberra art painting landscape http t co q3
-1	national gallery of victoria http t co bujyfofkro
-1	kates_clothes i wished she would have recycled that blue emiliawickstead npg cocktail dress http t co 9ziuv1u2tu
-1	rt antiausterityuk rally against the greek fascist golden dawn sunday 19 april 3pm national gallery trafalgar square greeksolidarity h
-1	inventing impressionism the national gallery should have the integrity to give this exhibition an honest title http t co dnfsefee0s
-1	rt antiausterityuk rally against the greek fascist golden dawn sunday 19 april 3pm national gallery trafalgar square greeksolidarity h
-1	national gallery of modern art jaipur house new delhi overwhelmed http t co 5iq8drpy6m
-1	rt travelguidedc national portrait gallery american art museum http t co qpn9yn99s3
-1	rt travelguidedc national gallery of art the japanese footbridge claude monet 1899 dc http t co 4poaczwtae
-1	just posted a photo national gallery of indonesia https t co xhayrjwqod
-1	rt nicole_gabri leonardodavinci ritratto di donna 1474 76 washington national gallery artninja artwit twitart art http t co owx
-1	rt wmag a small new york gallery is staging monumental installations http t co papfceywpt http t co rywmr6h16z
-1	link removed rt ferdistam charles conder herrick s blossoms 1888 national gallery of australia link removed
-1	rt ferdistam charles conder herrick s blossoms 1888 national gallery of australia canberra art painting landscape http t co q3
-1	rt ferdistam charles conder herrick s blossoms 1888 national gallery of australia canberra art painting landscape http t co q3
-1	rt mvlanaphy i m so excited to go to the national gallery with elle seriously it s gonna be so cute and i get to see my favourite painting
-1	rt ferdistam charles conder herrick s blossoms 1888 national gallery of australia canberra art painting landscape http t co q3
-1	rt ferdistam charles conder herrick s blossoms 1888 national gallery of australia canberra art painting landscape http t co q3
-1	just finished my brother s art history education ngma vscocam art national gallery of modern https t co f3diyjwwhv
-1	rt wmag a small new york gallery is staging monumental installations http t co papfceywpt http t co rywmr6h16z
-1	s t r i p e s national gallery of indonesia https t co lnmf3wksdx
-1	charles conder herrick s blossoms 1888 national gallery of australia canberra art painting landscape http t co q3mkllutot
-1	rt photossmh food trucks unite photo gallery online now photossmh smh photography photossmh http t co 3zvyuzqqbr http t co bjdn
-1	entrance display at ngvmelbourne pumice nice national victorian gallery https t co g9msxhazsb
-1	the so mode on route to synthesize la terror bringing diapositive national gallery upon thy website zvzpc
-1	selfie outside the national gallery of australia http t co lgnmruvtxa
-1	buttes and beasts amazing us national parks in pictures the guardian http t co 1qzcv3iufp
-1	rt ellenkopstad from the scottish national gallery kids look cuter these days http t co ns4hm1cc9t
-1	rt photossmh online now portrait gallery of world war two red army veterans smh photossmh http t co mrxvpucmkl http t co dfs31aln
-1	rt photossmh food trucks unite photo gallery online now photossmh smh photography photossmh http t co 3zvyuzqqbr http t co bjdn
-1	rt photossmh food trucks unite photo gallery online now photossmh smh photography photossmh http t co 3zvyuzqqbr http t co bjdn
-1	rt photossmh food trucks unite photo gallery online now photossmh smh photography photossmh http t co 3zvyuzqqbr http t co bjdn
-1	national gallery of victoria russian winter masterpieces exhibition slammed herald sun http t co anvhhogmib
-1	food trucks unite photo gallery online now photossmh smh photography photossmh http t co 3zvyuzqqbr http t co bjdna1gxsh
-1	review elaine de kooning comes to the national portrait gallery http t co nghfvzutzn
-1	review elaine de kooning comes to the national portrait gallery http t co otbqqceuda http t co 00tzm2xixb
-1	online now portrait gallery of world war two red army veterans smh photossmh http t co mrxvpucmkl http t co dfs31aln9o
-1	czech national gallery in prague i love this place architecture simplicity nationalgallery https t co 8qlaabpeda
-1	rt armgenocide100 khoren der harutian genocide the bed of euphrates 1930s national gallery of armenia http t co mu5ejjsub4
-1	national portrait gallery beatles to bowie the 60s exposed http t co 769txotw1j
-1	vincent van gogh at the smithsonian national gallery of arts dc http t co iqmihbcp1j
-1	the national art gallery in manila houses the famous spolarium painting by juan luna http t co nkxnvufqef
-1	the national art gallery in manila houses the famous spolarium painting by juan luna http t co agqqqfdlxv
-1	miguel covarrubias caricatures by cox national portrait gallery pics 1985 1st http t co g9zdjwhwu4 http t co 0apepr1ama
-1	top story cornelius johnson charles i s forgotten painter at the national por http t co 9ohwhych1v see more http t co jkgwv7ayo7
-1	cherry blossom is really good and national gallery is wonderful http t co itubxdni5x
-1	rt mirrorroyal kate wore a necklace loaned by the queen for her npglondon visit last night more pics here http t co 71i1e1yk19 http
-1	event photo gallery hanami tour shinjuku gyoen national garden amp hanazono shrine 20150402 http t co l1w5y70hmq
-1	rt antiausterityuk rally against the greek fascist golden dawn sunday 19 april 3pm national gallery trafalgar square greeksolidarity h
-1	rt scienzaescuola claude monet bridge at argenteuil on a gray day c 1876 national gallery of art http t co hl2zqwzirz
-1	autumn national gallery of victoria https t co tbi4ghnriw
-1	nature week 8 gallery national geographic photo contest 2011 http t co ppmchemigv
-1	tate national gallery royal academy pop power politics thatcherism oil on paper by artist from london http t co 6zalnllqnq
-1	skatch_minivan contact the national art gallery i see a big fat cheque in your future
-1	who is madonna and why is she all over the national gallery of art
-1	via overseasattract national portrait gallery http t co gfyiau56cb travel tban
-1	cornelius johnson charles i s forgotten painter at the national portrait gallery exhibition review http t co nltxjpxitu
-1	cornelius johnson charles i s forgotten painter at the national portrait gallery exhibition review http t co fv9tccjt0c
-1	rt antiausterityuk rally against the greek fascist golden dawn sunday 19 april 3pm national gallery trafalgar square greeksolidarity h
-1	nationalgalleryofart impressivetwits pauldurandruel painting timeoutlondon love this degas national gallery http t co ugurjhncnc
-1	internship minnesota archives and library intern the walker art center apply by unspecified http t co ifkawwlzhm artinternship art
-1	internship singapore internships national arts council singapore apply by unspecified http t co ifkawwlzhm artinternship art
-1	internship new york summer internship artnet apply by unspecified http t co ifkawwlzhm artinternship art
-1	internship new york fall internship metropolitan museum of art http t co ifkawwlzhm artinternship art
-1	internship ireland education graduate internship national gallery of ireland http t co ifkawwlzhm artinternship art
-1	photo gallery best photos of april 17 2015 a roundup of the best local national and world photographs from the http t co sltyotmdqy
-1	national gallery with my princess national gallery of victoria https t co qnwtzubded
-1	the new national gallery and ludwig museum budapest http t co bbe7oppcpf
-1	rt burberry a rain soaked view of the national gallery captured in london this morning http t co srjcfvtl1d burberryweather http t
-1	rt capitaljizzm we were trying to hail a cab by the national gallery while the man with the tax the 1 sign shot himself in front of th
-1	great article photo gallery world s best guided tours national geographic traveler http t co fwnofegkqg via natgeotravel
-1	we were trying to hail a cab by the national gallery while the man with the tax the 1 sign shot himself in front of the capitol
-1	rally against the greek fascist golden dawn sunday 19 april 3pm national gallery trafalgar square greeksolidarity http t co wasua41shp
-1	check out photos of coach dvorak in europe with usa national team http t co v0mw33okfz
-1	top 10 things to do in hawaii national geographic this photo gallery will have you adding hawaii to your bucket list in no time this ph
-1	flash photo gallery update alaska2014 paddle into the wild kayak in glacier bay national park gt http t co q12hxoodue alaska photo
-1	buttes and beasts amazing us national parks in pictures http t co yabphlsah8
-1	chief curator appointed at the national art gallery of the bahamas nagb art agenda http t co srsxs9vs8a
-1	just chilling in the national gallery of art cultured sophisticated notreally washington dc https t co uirmo3g0jd
-1	rt saedhindash jordan brand classic boys national game is underway http t co 4rewsnd1dl j_schneider jordanclassic jbc njhoops http
-1	buttes and beasts amazing us national parks in pictures gt http t co uttdwgljtu via guardian photos travel http t co hu0vt2tluo
-1	photo gallery best photos of april 17 2015 a roundup of the best local national and world photographs from the http t co 1xvvuak5ps
-1	joan sebastian zamora from columbia english national ballet http t co tys0y6jvgm http t co kmmrp3c05b
-1	round two of our birthday competition starts now you could win a membership to the national gallery of victoria http t co 4cvdvwgsbh
-1	rt climamgta consoltation lakes banff national park canada amazing photo by paulzizkaphoto check out his gallery for more http
-1	rt climamgta consoltation lakes banff national park canada amazing photo by paulzizkaphoto check out his gallery for more http
-1	consoltation lakes banff national park canada amazing photo by paulzizkaphoto check out his gallery for more http t co w5mpnt3mgy
-1	pierre auguste renoir marie murer at national gallery of art washington dc flickr photo sharin http t co jqjainmdyj
-1	rt saedhindash jordan brand classic boys national game is underway http t co 4rewsnd1dl j_schneider jordanclassic jbc njhoops http
-1	jordan brand classic boys national game is underway http t co 4rewsnd1dl j_schneider jordanclassic jbc njhoops http t co rtglpeb7ky
-1	robert sapolsky about his study of the keekorok baboon troop from national geographic s stress portrait of a killer http t co w4e23vcbfg
-1	rt wmag a small new york gallery is staging monumental installations http t co papfceywpt http t co rywmr6h16z
-1	fantastic announcements in caribbean artnews holly bynoe chief editor founder of arcthemagazine is now chief http t co 4eztofxwqd
-1	inked tattoo jay s latest sketch repost ailuroamare with repostapp we went to the national gallery and it http t co ubkejfcgzv
-1	chief curator appointed at the national art gallery of the bahamas nagb art agenda http t co 0zneg7hnnp
-1	it s been a while but we are back outside of the national gallery on st kilda road serving up from 11 30 8 30 today and 11 30 tomorrow
-1	saw some pretty cool things today at the museum national gallery of art https t co urxag8qpay
-1	i m so excited to go to the national gallery with elle seriously it s gonna be so cute and i get to see my favourite painting
-1	happened to me at the national gallery bawl like a girl https t co jel0pqzznk
-1	rt wmag a small new york gallery is staging monumental installations http t co papfceywpt http t co rywmr6h16z
-1	me and george so happy to have 45 minutes to go see my favorites at the national gallery of art https t co bwuosklh15
-1	piero di cosimo retrospective premieres at national gallery of art http t co doi7leaado pls rt seb_kirby
-1	buttes and beasts amazing us national parks in pictures http t co vkd7eozz7c googlealerts http t co ze5saqsiqd
-1	the national gallery opens a major impressionist art exhibition http t co ltyglkm7vs via huffpost http t co rqsvuatcai
-1	rt armgenocide100 khoren der harutian genocide the bed of euphrates 1930s national gallery of armenia http t co mu5ejjsub4
-1	rt armgenocide100 khoren der harutian genocide the bed of euphrates 1930s national gallery of armenia http t co mu5ejjsub4
-1	american characters selections from the national portrait gallery accompanied http t co h1smnrxdux http t co n4rv4cc2xp
-1	antarctica photo gallery ice shelf pictures glaciers wallpaper national geographic http t co hhujujuiyu via natgeo
-1	some people admire art we take pictures underneath it national gallery of art sculpture garden https t co vhihukwmfa
-1	armgenocide100 khoren der harutian genocide the bed of euphrates 1930s national gallery of armenia http t co z7xs92inox
-1	rt armgenocide100 khoren der harutian genocide the bed of euphrates 1930s national gallery of armenia http t co mu5ejjsub4
-1	john c anderson apartments aia national awards 2015 http t co xqdq3mgrtt
-1	murder at the national gallery vol 13 by margaret truman 1997 paperback http t co rzbaen7qkf http t co 9fltbcfb2r
-1	la casa permanent supportive housing architect magazine aia national awards 2015 http t co d65crm7baq
-1	terri has two images in the allegany national photographic competition amp exhibition at the saville gallery 9 https t co opikzqtisy
-1	truetwit at the national gallery of art washington dc miro the farm 1921 http t co bu1fdes6v9
-1	star wars national football league on behance https t co cf8tybwgtr via behance
-1	rt scienzaescuola claude monet bridge at argenteuil on a gray day c 1876 national gallery of art http t co hl2zqwzirz
-1	rt rifuture a beautiful photo gallery of yesterday s fightfor15 march in pvd http t co wnjxyovykw
-1	rt luciatassan ginevra de benci leonardo 1474 8 national gallery of art washington museoideale bgiorno asamsakti n2312neagoe http
-1	henriquezmelisa national gallery of art in dc
-1	uhuru exhibition at bulawayo gallery the national art gallery in bulawayo is set host an art exhibition in ho http t co l4botbxj0b
-1	the national art gallery in manila houses the famous spolarium painting by juan luna http t co rpwjhmzi9a
-1	the national art gallery in manila houses the famous spolarium painting by juan luna http t co 7ihdojmlbf
-1	jeanssimmons he works at the national portrait gallery and i went the other day and was scared he would appear haha
-1	the national art gallery in manila houses the famous spolarium painting by juan luna http t co 7kv4tofafl
-1	rt wmag a small new york gallery is staging monumental installations http t co papfceywpt http t co rywmr6h16z
-1	rt wmag a small new york gallery is staging monumental installations http t co papfceywpt http t co rywmr6h16z
-1	sanaa s proposal for new national gallery ludwig museum in budapest http t co v4z0pd0aad http t co pqsvaqy05p
-1	saw this in the national gallery today amp noticed that the gentleman in this painting looks a lot like david cameron http t co shb6yqau3n
-1	robert sapolsky about his study of the keekorok baboon troop from national geographic s http t co 30lbkb7ebj https t co ax73bmdszy
-1	10 off all national gallery flowers https t co cafszqdqpw
-1	we can t even take the nation s capital seriously national gallery of art https t co ylo68bnfon
-1	rt scienzaescuola claude monet bridge at argenteuil on a gray day c 1876 national gallery of art http t co hl2zqwzirz
-1	buttes and beasts amazing us national parks in pictures http t co nw1hnycaxr parks travel beauty fridayphotos us
-1	met the guy who ran the national portrait gallery for over 12years today ohh the interesting customers we get in everyday
-1	rt greeksolidarity jail golden dawn for their crimes rally 3pm sunday 19 april 3pm national gallery trafalgar sq
-1	michael landy saints alive sculpture development the national gallery london this film follows the nati http t co cdpm8i8kiw
-1	regram from flyguy0716 spending a little time together at the national gallery of art bae https t co dnwoc5kcqz
-1	happy 58th birthday brecon beacons national park http t co olab8htw5f
-1	national gallery f rias2015 http t co zpx6arnylx
-1	that was a long day buckingham palace whitehall the houses of parliament and five hours or so in the national gallery ouch
-1	hrhkateblog wwkd_official jesire to the national portrait gallery
-1	rt scienzaescuola claude monet bridge at argenteuil on a gray day c 1876 national gallery of art http t co hl2zqwzirz
-1	jack bush gets his due in national gallery retrospective http t co wgwcrv19u3
-1	the tiles at the national gallery never cease to bore me to be honest 2 3 thisislondon http t co uttfdonh6c
-1	so to cap off what hasn t been a great week i have now been officially rejected by the national portrait gallery oh well
-1	my pov on art national gallery of ireland https t co aky6mmv9d0
-1	rt khaph fan of both http t co 6pxtwmj7ls
-1	fan of both http t co 6pxtwmj7ls
-1	rt matteristblog poetry at harlow the harlow gallery will celebrate national poetry month with a special guest at their april http
-1	bicycle national gallery http t co c8wkamhiuc http t co 0jamasoxcg
-1	national wildlife gallery is out http t co vlpv8ao5ep
-1	marina mabrey mmabrey1 during the jordanclassic girls national game photo gallery http t co edqx3quqsm http t co haxhl45ayl
-1	1890 a popular handbook to the national gallery edward t cook third edition http t co rianyvbrm6 http t co xyfuum5ijl
-1	kwistie thanks for celebrating national grilled cheese month with themelt check your cheesy entry here http t co 4c5mblclec
-1	1890 a popular handbook to the national gallery edward t cook third edition http t co v5wticltwu http t co kdpbsdml0g
-1	jail golden dawn for their crimes rally 3pm sunday 19 april 3pm national gallery trafalgar sq
-1	and a few minutes to kill so visit the national gallery to see savaldo s mary magdalene entrancing http t co khei5l2mlm
-1	some images from the workshop i gave today at the national craft gallery ireland in kilkenny my thanks to the http t co yi0tplli2q
-1	link removed museum galleries updates dalhousie art gallery amp national museum bloemfontein link removed
-1	rt scienzaescuola claude monet the beach at trouville 1870 the national gallery london http t co zbsd8cf5bw
-1	rt scienzaescuola edgar degas the dance lesson c 1879 national gallery of art http t co iw3ltmep8e
-1	rt scienzaescuola claude monet argenteuil c 1872 national gallery of art http t co gobaqmm3ln
-1	rt scienzaescuola claude monet bridge at argenteuil on a gray day c 1876 national gallery of art http t co hl2zqwzirz
-1	rt scienzaescuola claude monet ships riding on the seine at rouen 1872 73 national gallery of art http t co sxefutyivk
-1	smk smkfriday whatshappening fortidenerfeministisk feminism national gallery of denmark https t co ziz3ekq7mf
-1	museum galleries updates dalhousie art gallery amp national museum bloemfontein south africa http t co c6b15vlkmo
-1	national gallery of victoria http t co af9gzaisgk
-1	rt scienzaescuola claude monet bridge at argenteuil on a gray day c 1876 national gallery of art http t co hl2zqwzirz
-1	rt scienzaescuola claude monet bridge at argenteuil on a gray day c 1876 national gallery of art http t co hl2zqwzirz
-1	rt scienzaescuola claude monet bridge at argenteuil on a gray day c 1876 national gallery of art http t co hl2zqwzirz
-1	rt scienzaescuola claude monet bridge at argenteuil on a gray day c 1876 national gallery of art http t co hl2zqwzirz
-1	rt scienzaescuola claude monet bridge at argenteuil on a gray day c 1876 national gallery of art http t co hl2zqwzirz
-1	rt scienzaescuola claude monet bridge at argenteuil on a gray day c 1876 national gallery of art http t co hl2zqwzirz
-1	rt scienzaescuola claude monet bridge at argenteuil on a gray day c 1876 national gallery of art http t co hl2zqwzirz
-1	rt scienzaescuola claude monet bridge at argenteuil on a gray day c 1876 national gallery of art http t co hl2zqwzirz
-1	rt scienzaescuola claude monet bridge at argenteuil on a gray day c 1876 national gallery of art http t co hl2zqwzirz
-1	rt scienzaescuola claude monet bridge at argenteuil on a gray day c 1876 national gallery of art http t co hl2zqwzirz
-1	colbert portrait leaving the national portrait gallery submitted by drmajormccheese link http t co sxdx5x7g1s reddit dc
-1	rt sofiaorden the civil war national portrait gallery smithsonian institution http t co 1h62ysxqnw history free history http
-1	rt sofiaorden the civil war national portrait gallery smithsonian institution http t co 1h62ysxqnw history free history http
-1	rt sofiaorden the civil war national portrait gallery smithsonian institution http t co 1h62ysxqnw history free history http
-1	rt sofiaorden the civil war national portrait gallery smithsonian institution http t co 1h62ysxqnw history free history http
-1	rt sofiaorden the civil war national portrait gallery smithsonian institution http t co 1h62ysxqnw history free history http
-1	rt sofiaorden the civil war national portrait gallery smithsonian institution http t co 1h62ysxqnw history free history http
-1	rt sofiaorden the civil war national portrait gallery smithsonian institution http t co 1h62ysxqnw history free history http
-1	rt sofiaorden the civil war national portrait gallery smithsonian institution http t co 1h62ysxqnw history free history http
-1	rt sofiaorden the civil war national portrait gallery smithsonian institution http t co 1h62ysxqnw history free history http
-1	rt art_agenda new chief curator appointed nagbahamas http t co vwj005pdmc http t co x22yet53bm
-1	rt sofiaorden the civil war national portrait gallery smithsonian institution http t co 1h62ysxqnw history free history http
-1	rt sofiaorden the civil war national portrait gallery smithsonian institution http t co 1h62ysxqnw history free history http
-1	rt sofiaorden the civil war national portrait gallery smithsonian institution http t co 1h62ysxqnw history free history http
-1	star wars national football league a project on behance http t co jzsntwscft via behance
-1	rt sofiaorden the civil war national portrait gallery smithsonian institution http t co 1h62ysxqnw history free history http
-1	rt sofiaorden the civil war national portrait gallery smithsonian institution http t co 1h62ysxqnw history free history http
-1	rt sofiaorden the civil war national portrait gallery smithsonian institution http t co 1h62ysxqnw history free history http
-1	rt sofiaorden the civil war national portrait gallery smithsonian institution http t co 1h62ysxqnw history free history http
-1	rt sofiaorden the civil war national portrait gallery smithsonian institution http t co 1h62ysxqnw history free history http
-1	rt sofiaorden the civil war national portrait gallery smithsonian institution http t co 1h62ysxqnw history free history http
-1	rt sofiaorden the civil war national portrait gallery smithsonian institution http t co 1h62ysxqnw history free history http
-1	rt sofiaorden the civil war national portrait gallery smithsonian institution http t co 1h62ysxqnw history free history http
-1	rt sofiaorden the civil war national portrait gallery smithsonian institution http t co 1h62ysxqnw history free history http
-1	rt sofiaorden the civil war national portrait gallery smithsonian institution http t co 1h62ysxqnw history free history http
-1	rt sofiaorden the civil war national portrait gallery smithsonian institution http t co 1h62ysxqnw history free history http
-1	by 3 hr layover i meant my flight got cancelled turns out i did have time to go to the holocaust museum amp the national gallery womp
-1	grayson perry works attract record crowds to national portrait gallery http t co igdlnpi5g2
-1	buttes and beasts amazing us national parks in pictures http t co pzd5bfhdza americanumber1
-1	rt d_eklund national gallery walkway hyperlapse dc https t co lbgeseozyv
-1	onthetudortrail i felt the same way when i visited the national portrait gallery in london
-1	national gallery walkway hyperlapse dc https t co lbgeseozyv
-1	rt nicole_gabri musica alle tuileries edouard manet 1862 national gallery londra artninja artwit twitart art http t co wthw1zml
-1	star wars national football league a project on behance http t co ynaoxwrwej via behance
-1	from bodeans to the national portrait gallery when you know people innit
-1	photos oklahoma city bombing 20 years later http t co oxrvr741lo
-1	family portrait national portrait gallery https t co lbqjmyncux
-1	this city what a place national gallery https t co lmgl47qdvw
-1	rt terothe stephen colbert portrait set to leave national portrait gallery http t co psndi1ewl5 via rollcall
-1	photoset kahlo kid saw my babe monet at the national gallery today http t co efjmyhhcfj
-1	myra hess plays mozart k 453 in the national gallery london with the https t co p86ztu3lh8 via youtube
-1	something to do on the weekend nationalgallery london http t co crd9t2ajmi
-1	rt ferdistam pieter de hooch 1629 1684 a woman drinking with two men 1658 the national gallery london art interior http t co
-1	lindsayberra took the boys to the national portrait gallery today look who s in the gallery of champions http t co enidwgjhxo
-1	rt nicole_gabri leonardodavinci ritratto di donna 1474 76 washington national gallery artninja artwit twitart art http t co owx
-1	rt islandztours welcome hollybynoe chief curator appointed at the national art gallery of the bahamas nagb art agenda http t
-1	welcome hollybynoe chief curator appointed at the national art gallery of the bahamas nagb art agenda http t co ybf4cxz9s2
-1	washington national gallery of artt http t co woxnrskx1x
-1	24x34 poster breezing up a fair wind by winslow homer 1873 national gallery art http t co qhtinrcupx http t co rl4iup4txx
-1	royal mail presentation pack 386 national portrait gallery july 2006 p7 06 http t co 7yczju55zz http t co dky4q8bdai
