-1	rt cc_rosebud my pride is tripping right now but i miss you
-1	rt maca1986 alibrownlee nmaddo after years decades even for me the boys have brought the pride back into my club believe http t co
-1	today i consider myself the luckiest man on the face of the earth 13 lou gehrig gary cooper the pride of the yankees 1942
-1	first maruti 800 owner never upgraded the car http t co i25gfimtts those days of maruti gt pride in owning it http t co etm6dgrkde
-1	food banks one million britons will soon be using them according to trussell trust http t co 2hbvqha9fe disgusting in uk 2015 no pride
-1	do you feel your heart bloating with pride like i do vinethra01 asianawards kumarsanga2 http t co vrj6gcdku9
-1	totebags totebag pride and prejudice jane austen out of print canvas tote bag navy http t co 7vihwtpp0h bargains forsale
-1	rt cemonde worldheritageday whs 6 chola temples pride of south http t co ijny68zgyi
-1	rainbow gay lesbian pride bangle watch bracelet lgbt glbt by moonshinegems via etsy http t co otxtjolfkd via etsy
-1	rt drpayal_1289 food comes from farm these farms make country charm our country s pride is hidden in farms possible bcz of of farmers
-1	i think ya pride is just in the way
-1	if ruby rose goes to pride again this year i swear to god i will shit my pants and kiss her feet and then cry
-1	rt northern_pride 3 mins pride 4 0 devils what a start mcgilvray with a superb no look over the head pass for tadulala to score in cor
-1	take pride in how far you ve come and have faith in how far you can go
-1	rt piscesareus pisces dont ever want to be a burden to the people around them is it pride or is it legitimately caring
-1	pride bracelet by moonshinegems via etsy http t co rdxqrcosse via etsy
-1	rt rippaco800 i can t picture me workin a 9 to 5 gotta put in overtime to survive can t suck up my pride
-1	rt kayburley whatever your politics this is heartwarming nicolasturgeon parents on pride at their daughter s achievements https t co
-1	the 2015 darwin pride festival is run by the community for the community we can t wait to announce this years http t co 4uuv81in3w
-1	how y all take pride in hoes they make you feel lonelier than when you was alone
-1	rt mckennaraemac my pride leaves such a bitter taste but i m still wanting more i m always wanting more
-1	always wear your war paint with pride via r funny http t co 9einmsco8g funny http t co 4yvmilcpof
-1	rt northern_pride kick off pride 0 0 devils and we re under way here at the jungle let s go boys intrustsupercup
-1	rt misseyjanexxx i don t break easy i have my pride but if you need to be satisfied i ll do anything you please
-1	ghurdil unbelievable you subject name here must be the pride of subject hometown here
-1	rt northern_pride kick off pride 0 0 devils and we re under way here at the jungle let s go boys intrustsupercup
-1	pride come before a fall
-1	its ok pain is just temporary but pride is forever
-1	why are you so negative its disgusting really patriotism yako iripi sense of pride of being
-1	took an l but the experience was worth getting sick and driving out i take so much pride in being a texan samside
-1	rt virgo_horoscop virgos take pride in their good taste high standard challenging nature and thoughtfulness
-1	horanxdonvts but dramione is always perf bc it says that love can kill prejudice and pride and its beautiful http t co yq4tgmbt8z
-1	3 mins pride 4 0 devils what a start mcgilvray with a superb no look over the head pass for tadulala to score in corner intrustsupercup
-1	pride lacrosse falls to morgantown http t co yhckly0yy0
-1	rvaidya2000 narendramodi pmoindia why do we have to resort to secularism to gain acceptance of the west and non hindus no pride or what
-1	poferries pride of hull sailing up the river humber into dock river was like a mill pond this morning http t co w67y2jkwjy
-1	rt chrisprodromou i bet she s looking down with great pride right about now rip anne williams xxx ynwa96 http t co uy3raisknr
-1	by b737mech working on the pride of our freighter fleet tonight boeing 737 classic aircraftmaintenance aviati http t co nuywvp3kgv
-1	rt subodhverma539 food comes from farm these farms make country charm our country s pride is hidden in farms possible bcz of of farmers
-1	i m not very good at asking for help i pride myself on self sufficiency and my ability to go about business with http t co qh1vpl1a0z
-1	my pride n joy my young sunflower http t co vx6elby5k0
-1	rt drpayal_1289 food comes from farm these farms make country charm our country s pride is hidden in farms possible bcz of of farmers
-1	rt spoonia777 food comes from farm these farms make country charm our country s pride is hidden in farms possible bcz of of farmers ms
-1	my pride and joy my reason for breathing my love my life i love this lil man http t co qciqvgoymy
-1	rt chrisprodromou i bet she s looking down with great pride right about now rip anne williams xxx ynwa96 http t co uy3raisknr
-1	rt leicester_merc know a local hero vote for them in the pride of leicestershire awards leicspolice http t co fspvv3kwoz http t co
-1	let your love be my companion in the war against my pride long to break all vain obsession till you re all that i desire
-1	rt eoneanz fabica81 winner congrats you have won a dvd copy of pride dm us your name address amp prize amp we ll send next week
-1	rt chrisprodromou i bet she s looking down with great pride right about now rip anne williams xxx ynwa96 http t co uy3raisknr
-1	simoneboinays filmklipp https t co a7doavdalb got to love this pure happiness pride happy animal saturday
-1	rt danielsahyounie i want this top aussie pride http t co 6aomvd11vq
-1	philippine pride
-1	rt cityyearuk corps members from all three cities firedup at today s unity rally spirit discipline purpose pride http t co rfbvu3
-1	rt milaneye rui costa i arrived at a time where the focus was always to win to be part of that milan team was a tremendous pride
-1	cheer4auburn listen to him amp make it right for once lose your pride not the guy my god i ve seen the way he looks at you don t let that go
-1	rt nmcgivney i see michael noonan has a second job gigging with charley pride now good for him green shoots and so on latelate http
-1	rt myvaranasi pride of kashi gt singh sisters akankshasingh4 divyasingh04 prashanti14 pratimasinghbb http t co mhkh5mfyih http
-1	rt crystal_medal in a world where there is pride and prejudice let me be an instrument of peace
-1	the engine pride and things i learnt this in this week 0 is something words cant describe
-1	rt mghainsie prostateuk mgmotor polcomheritage 635register looking forward to pride of longbridge this weeked in cofton park weather
-1	cslewisdaily pride is spiritual cancer it eats up the very possibility of love or contentment or even common sense cslewis me
-1	rt thegooglefact sometimes you ve got to shut up swallow your pride and accept that you re wrong it s not giving up it s called growin
-1	my pride tho
-1	pride s purge police release extraordinary statement on lord janner this animal is still http t co wpdzehu3nk
-1	rt lexiimccarthy wanna text you but you see the way my pride is set up
-1	rt maca1986 alibrownlee nmaddo after years decades even for me the boys have brought the pride back into my club believe http t co
-1	rt chrisprodromou i bet she s looking down with great pride right about now rip anne williams xxx ynwa96 http t co uy3raisknr
-1	rt hiindustanii rahul gandhi inspires amp instils hope in farmers to live a respectful life in dignity and pride proud of rg https
-1	rt askproperty you beauties boro pride of teesside let s keep it going http t co iawphoctcr
-1	rt umaruruno say something i m giving up on you and i will swallow my pride you re the one that i love and i m saying goodbye
-1	congraduations citta suni devi my pride goes to you amp i m waiting for your personal boutique https t co q5rpxy8oqu
-1	st josemaria reject all pride be compassionate show charity help each other with prayer and sincere friendship http t co v8i3trqejz
-1	effieaustralian winner congrats you have won a dvd copy of pride dm us your name address amp prize amp we ll send next week
-1	rt bringotbunting had a big sort out in little miss bunting s room her spotty dotty print now pride of place lt 3 https t co byo1tktctb
-1	pride and joy the running start referring to owning la display case pornographic film goafj
-1	rt babudubeyindia together we will bring back the pride and joy of living in kolkata bjp4bengal vote4bjpbengal missionkmc http
-1	girl take pride on what you wanna do even if that means a new man every night inside of you
-1	rt leicester_merc know a local hero vote for them in the pride of leicestershire awards leicspolice http t co fspvv3kwoz http t co
-1	rt myvaranasi pride of kashi gt singh sisters akankshasingh4 divyasingh04 prashanti14 pratimasinghbb http t co mhkh5mfyih http
-1	now the race is one and here comes pride in the back stretch heartaches going to the inside
-1	i bet she s looking down with great pride right about now rip anne williams xxx ynwa96 http t co uy3raisknr
-1	i take so much pride and joy during off season teaching younger generations the amazing game of https t co oun1m7fceg
-1	intuitfinance winner congrats you have won a dvd copy of pride dm us your name address amp prize amp we ll send next week
-1	kick off pride 0 0 devils and we re under way here at the jungle let s go boys intrustsupercup
-1	rt bigdaddieh03 swallowing my pride
-1	bonimtetezi you will die without ever being a minister coz of your pride amp jelous will finish you if you think you are big enough then vie
-1	i am suuuuuuper not looking forward to the battle with the pride demon i maaaaaay be playing on nightmare maybe
-1	rt hiindustanii rahul gandhi inspires amp instils hope in farmers to live a respectful life in dignity and pride proud of rg https
-1	jjashea winner congrats you have won a dvd copy of pride dm us your name address amp prize amp we ll send next week
-1	always wear your war paint with pride via r funny http t co ajdynnfnr8
-1	rt danielsahyounie i want this top aussie pride http t co 6aomvd11vq
-1	had a big sort out in little miss bunting s room her spotty dotty print now pride of place lt 3 https t co byo1tktctb
-1	rt ifaptalouis i don t even know louis personally and i m about to burst with pride i wonder if johannah is still alive
-1	rt leicester_merc know a local hero vote for them in the pride of leicestershire awards leicspolice http t co fspvv3kwoz http t co
-1	rt adh_glazing readcricketclub all the best to all concerned at read cricket club for the 2015 season wear the a d h shirt with pride
-1	a portrait of the sicilian woman pride as well as a baronial haughtiness jealousy forces of love and hatred
-1	let go of your dam pride alfredo fuck
-1	rt maca1986 alibrownlee nmaddo after years decades even for me the boys have brought the pride back into my club believe http t co
-1	i hate crying in front of people it s my pride i hate to show weakness we ll really it s not weakness it just shows that i m human
-1	id go after what i want but there s too much on the line like my pride lol
-1	jordsykes winner congrats you have won a dvd copy of pride dm us your name address amp prize amp we ll send next week
-1	rt adh_glazing readcricketclub all the best to all concerned at read cricket club for the 2015 season wear the a d h shirt with pride
-1	jalalabad be modest it is the kind of pride least likely to offend
-1	fabica81 winner congrats you have won a dvd copy of pride dm us your name address amp prize amp we ll send next week
-1	rt annikabaum aud2good s_page_ hey you and i were the best dancers out there i take great pride in that
-1	obyezeks cg d pride of d perpetrators d weakness of gej i love politics
-1	virgos take pride in their good taste high standard challenging nature and thoughtfulness
-1	stonebwoyb we got ur back bro up and running pride of ansco pride of ashaiman pride of ghana pride of africa pride of the world bhim
-1	rt papithoba never kill a woman s self esteem and pride you might be making someones daughter a hoe thats how some girls deal with hea
-1	explore new multimedia geo_tourist http t co edjjayputd baku15 sport4betterworld boost world class sports pride
-1	ride with pride dude https t co x9hcbwmbw8
-1	deli owner hangs white pride sign in window promptly goes out of business http t co 0vcfdb7gbx
-1	pride foundation pink ribbon deeds now watching at khar punya dewangggg
-1	well the big day has arrived good luck team aber in the big varsity competition up in bangor wear your rainbow laces with pride
-1	reelm_abeid maybe if you s as players tried 100 and showed any pride in the shirt people would sympathise but you don t and they don t
-1	it is a surreal feeling says world no 1 mirzasania http t co przvoyfdrp worldtennis pride http t co bbsiibm5wa
-1	rt sexualgifs_ i grew out of i never text first phase since i realized nothing was wrong with showing someone you care about them more
-1	rt cyrenelovette put the pride to the side for the sake of love folks not worth losing the people you love over petty issues get over
-1	photoset bandmonkey beyond any sadness what i feel the most is pride gerard way my chemical romance http t co 8vkqigavy6
-1	forget about winning and losing forget about pride and pain
-1	rt maca1986 alibrownlee nmaddo after years decades even for me the boys have brought the pride back into my club believe http t co
-1	rt manantwinflames let us be the constant while you win back pride for your grandmother of smiles and companionship lt 3 http t co 5qw
-1	rt ldagger8 preparation passion pride performance play with the belief and confidence you have as a team go crusaders kentcrusadersbb
-1	i think you re pride is just in the way
-1	rt manantwinflames a girl who carries pride of her family a girl who loves someone wid all her heart a girl of virtue a heart of a lover
-1	damn it i missed charley pride on the late late show last night it has been a long time since i have heard http t co tffbocqhjy
-1	miss him more and more every day my pride and joy http t co px3iqwjg2n
-1	mparmo i pride myself on my ability to entertain so i thought i d liven things up a bit
-1	rt fabenavides please be careful driving home samhoustonhs texans thank you so much for the pride amp support u have given samtexansocce
-1	rt joannebalebale supporting connor morley through pride of the isle winner from raffle 100 vouchers from coop cleethorpes thank you htt
-1	its funny how people give away their pride to win prizes in tv programmes
-1	how can you fuck with someone heavy then fall back and be so indifferent about them it s crazy what pride does to a person
-1	just put your pride to the side for me
-1	rt umaruruno say something i m giving up on you and i will swallow my pride you re the one that i love and i m saying goodbye
-1	rt stoneeyy_ i love my pride
-1	rt spoonia777 food comes from farm these farms make country charm our country s pride is hidden in farms possible bcz of of farmers ms
-1	rt itsyogirl_samie being dumped is horrible shem
-1	this year s playoff bracket friends and i got pride on the line this time http t co muxi7ebbxw
-1	rt crystal_medal in a world where there is pride and prejudice let me be an instrument of peace
-1	pride amp assumptions kill relationships
-1	https t co vdmi4yvwdo shinola great example of pride and industry
-1	rt jasmindrk i hate when i m giving someone an out a less painful and humiliating one for both all parties but their pride stops them f
-1	paldhous profbriancox maxcroser the book of mormon teaches us about the pride cycle where as a nation prospers they turn away from god
-1	rt marchingdotcom top 3 after ind world semi finals scv onyx pride wgi2015 scvanguard onyxcolorguard prideofcincy wgitweets htt
-1	rt googlefacts an ethiopian girl was kidnapped and attacked until a pride of lions chased her attackers off and stayed to defend her unti
-1	put your pride aside and talk to me already
-1	i m at the pride of longbridge rally this morning where drivers are about to set off from the bmw plant in cowley http t co 8myodc4ffo
-1	put the pride to the side for the sake of love folks not worth losing the people you love over petty issues get over yourself
-1	rt the_navy_seals feel my fear know my pride for god and country i ll end your life http t co 0wfajr9vl8
-1	rt forever_lexiiii my pride is so much stronger than my feelings i could think of you 24 7 and you still wouldn t hear from me
-1	jennfrerk stride of pride
-1	link removed alibrownlee nmaddo after years decades even for me the boys have brought the pride back link removed
-1	rt dvrgntseries pride is what killed al and it is the flaw in every dauntless heart it is in mine
-1	frandrescher please share let everyone know to come celebrate ncypride and hang with me rosie o donnell http t co ixplymoyyp
-1	i m sure all the pictures are on facebook __
-1	whoismuhammad yusha evans islam give us pride http t co lpmt5bqyos islam muslims muslim
-1	i just finished the movie pridemovie i highly recommend this movie to anyone the end brought me to tears gay union pride
-1	do you see the pain hidden in my pride the guilt beneath my shame misunderstood no just trying not to be noticed
-1	400m_pride what
-1	in my airbnb bedroom in an artist s house a paint splattered smock takes pride of place http t co ylnkefxftx
-1	wish ladies took more pride in having something other than a pretty face or a nice body to offer the world
-1	rt diablo always wear your warpaint with pride http t co cfaw2kwbab
-1	rt sanwal22 what is lost by pride does not recover with tears
-1	our little princess our pride amp joy looking more beautiful each day as she grows we will https t co 54dcjimejv
-1	rt paperchasindre_ you can t have pride in a relationship factual
-1	rt made_yuh_look maw gu reach the top it s just taking longer cuz i m bringing my pride integrity and morals with me
-1	rt sexualgifs_ i grew out of i never text first phase since i realized nothing was wrong with showing someone you care about them more
-1	rt sexualgifs_ i grew out of i never text first phase since i realized nothing was wrong with showing someone you care about them more
-1	in a world where there is pride and prejudice let me be an instrument of peace
-1	aud2good s_page_ hey you and i were the best dancers out there i take great pride in that
-1	kinkyguy666 standing in pride get on your knees and respect it http t co e6tkoc7pzn the only thing missing is a boy on the end of it
-1	i hate when i m giving someone an out a less painful and humiliating one for both all parties but their pride stops them from taking it
-1	i love my pride
-1	rt rehans_shamim mqm is honour dignity pride love humanity therefore na246belongstomqm azizabadi qureshimuzammil kaleemaltafi s
-1	rt forever_lexiiii my pride is so much stronger than my feelings i could think of you 24 7 and you still wouldn t hear from me
-1	guardian of the pride bronze statue http t co o6nlxu5syp http t co dfpqnxzofw
-1	rt benrobertssmith leaving brisbane and starting the journey to gallipoli such a privilege to be going there for the anzaccentenary
-1	rt googlefacts an ethiopian girl was kidnapped and attacked until a pride of lions chased her attackers off and stayed to defend her unti
-1	martynmole is a man with style and wears themanclub pendant with pride quality of these doesn t get any better http t co 6dritkcg3l
-1	today is the match of the premier league the pride of london chelsea vs the red devils of manchester manchester united may the best win
-1	pictures minnie_matika pride_mousse most of em gorgeous
-1	rt kijomba if we have kdfinfo as our pride do they even have a publicmuseumorlibrary to promote societal coexistence questionskenyan
-1	rt stayfxnny letting go of my pride http t co ivfjcxo4yq
-1	rt hiindustanii rahul gandhi inspires amp instils hope in farmers to live a respectful life in dignity and pride proud of rg https
-1	rt joeyvictorino letting go of my pride http t co zrm6joqapj
-1	pride and prejudice is so beautiful
-1	come on today you bucks keep up this recent form pride tweetmygoal3
-1	rt fabenavides please be careful driving home samhoustonhs texans thank you so much for the pride amp support u have given samtexansocce
-1	rt benrobertssmith leaving brisbane and starting the journey to gallipoli such a privilege to be going there for the anzaccentenary
-1	rt jaxlibbaseball jackson liberty at jackson memorial tomorrow at 10 am in strike out autism baseball challenge pride autismawarness j
-1	always wear your war paint with pride
-1	i m listening to pride and joy by stevie ray vaughan on pandora http t co jjnq3zsn4z
-1	inner pride
-1	arseblog amylawrence71 ha ha turntable repaired pride of place in office be having a blast later thankfully mislaid captain beaky
-1	i think i compare too often too much that it becomes the root of lowering my self confidence and pride
-1	rt danielsahyounie i want this top aussie pride http t co 6aomvd11vq
-1	always wear your war paint with pride via r funny reddit
-1	alibrownlee nmaddo after years decades even for me the boys have brought the pride back into my club believe http t co rsgurghbmc
-1	rt cityofderbysc good luck cityofderbysc diddy leaguer s tonight wear you hat with pride https t co zarpqjojoi
-1	rt peterbeads it s impossible said pride it s risky said experience it s pointless said reason give it a try whispered the h
-1	rt benrobertssmith leaving brisbane and starting the journey to gallipoli such a privilege to be going there for the anzaccentenary
-1	rt umaruruno say something i m giving up on you and i will swallow my pride you re the one that i love and i m saying goodbye
-1	rt googlefacts an ethiopian girl was kidnapped and attacked until a pride of lions chased her attackers off and stayed to defend her unti
-1	some times when u let your pride and ego down that s when thing really start to get better
-1	btw owners pride neighbors envy situation kerala will call for bandh soon tn first and now k taka stealing its thunder karnatakabandh
-1	already getting the pride gear ready and it s only april d
-1	rt snajua be a woman with pride let a man love you not just by claiming he loves you but the ones who value you your privacy and your
-1	u2 pride in the name of love http t co whc4ygcval nowplaying listenlive
-1	pride or ariel
-1	i know dat is hurts it hurs ur pride
-1	always wear your war paint with pride
-1	rt danielsahyounie i want this top aussie pride http t co 6aomvd11vq
-1	rt arlingtonrivera samtexansoccer you ve inspired a city amp renewed samhoustonhs pride for a new generation congratulations on incredib
-1	kingtysheen yes i lose the g on many things thats just so y all can hear me say it in ya heads
-1	rt diablo always wear your warpaint with pride http t co cfaw2kwbab
-1	rt amitinsan20 food comes from farm these farms make country charm our country s pride is hidden in farms possible bcz of of farmers m
-1	rt danielsahyounie i want this top aussie pride http t co 6aomvd11vq
-1	rt papi_vicc ashlee_avenue fuck pride if it s for a good cause
-1	the gorgeous miss pride available at http t co vvl0w9e2nk it is all about the detail with this https t co la7qvn59sy
-1	let your fvcking pride go down
-1	rt dussedaddy just got word that you missed me but i won t get my hopes up as a man i got pride amp its my job to give no fucks
-1	400m_pride bruh ima fuck around and drive to san jose and no fucks will be givin givin
-1	ibimone shit i m a woman with pride you don t do shit like that
-1	ashlee_avenue fuck pride if it s for a good cause
-1	rahul gandhi inspires amp instils hope in farmers to live a respectful life in dignity and pride proud of rg https t co 0ycrvqjli4
-1	kim_sarim you should ve sucked the nigga dick for free
-1	the biggest threat in the world today russia and china amp whether they seek more territory out of nationalist pride http t co q9xsqhwqoe
-1	kbuddz_pb saber team together pride
-1	ready to roll to the pride of longbridge from the cowley plant
-1	my pride didn t let me go apologize to him
-1	rt sanwal22 what is lost by pride does not recover with tears
-1	pride greed lust wrath sloth envy gluttony
-1	at their johannesburg concert u2 played a clip of a speech by nelson mandela during their performance of pride never forget that moment
-1	rt danielsahyounie i want this top aussie pride http t co 6aomvd11vq
-1	rt jhasminerabara i feel so smarty arty reading pride and prejudice remember when london tipton watched the movie and maddie read the boo
-1	rt prayerofthelord pride of london __kgothatso forever blue
-1	rt rbdx_ only a fool get caught up in his own pride
-1	my pride is stronger than my feeling don t try 2 play me i could tink abt u 24 7 and u still wouldn t ear from me
-1	rt benrobertssmith leaving brisbane and starting the journey to gallipoli such a privilege to be going there for the anzaccentenary
-1	rt prayerofthelord pride of london __kgothatso forever blue
-1	rt ldagger8 preparation passion pride performance play with the belief and confidence you have as a team go crusaders kentcrusadersbb
-1	rt t_man_15482 mrpradio pride its lucas radebe
-1	rt sanwal22 what is lost by pride does not recover with tears
-1	rt sexualgifs_ i grew out of i never text first phase since i realized nothing was wrong with showing someone you care about them more
-1	rt drpayal_1289 food comes from farm these farms make country charm our country s pride is hidden in farms possible bcz of of farmers
-1	rt fuckuharold i knew louis would make it far but that far i am overwhelmed by pride
-1	rt typicalfeminist sorry i did that bad thing i won t do it again is just as easy to say it just requires less pride
-1	rt kagisure1 pride is a very dangerous disease
-1	i have no pride in being a singaporean not at all
-1	he did the most classic double take i ve ever seen and then glowed pinkly with pride
-1	claudianus pride sullies the noblest character yep
