-1	stevie ray vaughan amp double trouble pride and joy live at montreux 1982 http t co vswhayhj4z
-1	u2 pride in the name of love official live video hd https t co nvrmc0rjmw
-1	i feel so smarty arty reading pride and prejudice remember when london tipton watched the movie and maddie read the book i am maddie rn
-1	rt afcbrazil our club is all about children amp hence the thought of helping to give a child an education amp hopefully a better life bursts
-1	rt beautifulxtayy 400m_pride sorry charlie you would ve been the 5th wheel lol
-1	beautifulxtayy i got friends
-1	rt yeahcozier thrilled for jaseholder98 pride of wandererscc and the entire caribbean what a composed innings in a high pressure si
-1	nmcgivney mcj66 charley pride is the best great entertainer
-1	rt fcc_totnes a week today sat 25 april pride 15 details including link to trailer http t co pgj7as7hyk totnes http t co 0a
-1	rt sanwal22 what is lost by pride does not recover with tears
-1	teej_mac porn and pride performances
-1	zonazooofficial with pride
-1	rt kbaviking a huge term of competitions ahead are you ready to step up and show the pride you have for your house vikingpride http
-1	400m_pride sorry charlie you would ve been the 5th wheel lol
-1	pride of london __kgothatso forever blue
-1	rt poldarked here s a look at poldark from australia where it first aired last sunday http t co f4kb8gulw4 photo via chronicle http
-1	americas proud ignorance is a example of shameful pride in lowest common denominator social policys that has finished us as a world power
-1	high heel is fany s pride
-1	the pride of youth is in strength and beauty the pride of old age is in discretion democritus
-1	rt spydalbimen jailhouse rock elvis lyrics http t co viiknxslda
-1	i knew louis would make it far but that far i am overwhelmed by pride
-1	rt kbaviking an awesome display of house pride by our primary vikings kbuccleucha kbavikingpride http t co j8jqovo99g
-1	if you up put your pride aside and text me first
-1	spirit week spirit bowl such fun i definitely love showing my school pride golancers ghouse classof2017 http t co bp1vb3yn5z
-1	bruh ima fuck around and drive to san jose and no fucks will be givin
-1	rt hollytreetrans your package our pride we re your commercial same day courier uk and europe http t co 3bvogntkka http t co sy
-1	at dwremovals we take pride in each job we undertake fully insured professional team get in touch today derby http t co sdflsh9wua
-1	rt nohead4u i wanna text you but you ain t worth dropping my pride for
-1	rt thefathereffect u cannot b the dad god called u 2 be living with pride anger amp unforgiveness thefathereffect
-1	and when my pride grows bigger than my love for you ya allah please remind me it is your air that i breathe
-1	i got history when it comes to relationships been in every kind n the only thing i can say ruined it was pride miscommunication and lies
-1	playing pride by amy macdonald
-1	rt danielsahyounie i want this top aussie pride http t co 6aomvd11vq
-1	rt snajua be a woman with pride let a man love you not just by claiming he loves you but the ones who value you your privacy and your
-1	i pride myself on being an independant woman but to that guy in the black x trail aaz12m who bought his wine http t co zwceozg7z7
-1	rt drpayal_1289 food comes from farm these farms make country charm our country s pride is hidden in farms possible bcz of of farmers
-1	nmcgivney mcj66 pride amp noonan dont mix well scum fits better
-1	15 mins to ko two late changes for pride semi tadulala and dean mcgilvray debut in for the injured codey http t co aiar4igumx
-1	always wear your war paint with pride http t co jdos5owowu funny http t co imnlkoq9dq
-1	mrpradio pride its lucas radebe
-1	always wear your war paint with pride http t co jdos5owowu funny
-1	my bacteria called derp just wiped out the world in 1362 days plagueinc http t co zocccthyhg http t co pdnq7z6yk8
-1	rainbow cz gay lesbian pride couple stainless steel band ring size 11 2162a http t co ze8rqkv9ud http t co xyqdhbvhkm
-1	rt karinarfarias don t fuck a good thing up bc you have too much pride goodnight
-1	to be a muslim is a pride
-1	rt umaruruno say something i m giving up on you and i will swallow my pride you re the one that i love and i m saying goodbye
-1	rt angdatingdaantv watch why broelisoriano is a true pride of the philippines https t co cdgbydczu3 bes5decades
-1	just got word that you missed me but i won t get my hopes up as a man i got pride amp its my job to give no fucks
-1	rt westendsensei it may not be important to you but my pride is important to me i take no pride in working for someone who s giving them
-1	adidasph wear your supercolor with pride and show the world who you are adidasoriginals http t co si120z4svz this is ugly tbh
-1	rt pyramidmedicine anomamohamed wolfnile eaglemasr1 hesham100573 wa6ani_1 strength n pride happy to have your follows http t co
-1	rt chantellekayann takes it s toll one s foolish pride how long before i see the light i have waited for you to lay me down
-1	is a pride ov africa https t co b27v5f6fyb
-1	rt u11thc the lads won 50 0 tonight vs hindley playing great rugby at the moment and defending with great pride and passion unlike saint
-1	rt instapraying if you believe in yourself have dedication pride and that never quit attitude you ll be a winner
-1	rt instaprayers if you believe in yourself have dedication pride and that never quit attitude you ll be a winner
-1	rt expandamp sometimes you gotta shut up swallow your pride and accept that you re wrong it s not giving up it s called growing up
-1	despite rain mobile pride has a lot 2 celebr8 on saturday mobilepride pridecelebration prideparade http t co 06vbx4noyx
-1	i kill pride i hurt feelings
-1	rt kingtysheen danielj_christ pussy nigga i leave you drad and call it dedication drad
-1	rt aaronisbuilding great that his worship mayor don atchison was able 2 attend the buildyxe gala he spoke of the pride in the industry
-1	flags active support unit is proud to be supporting birmingham pride this year and would love for you to get http t co ajb4uvuvwt
-1	we fight because of pride but we end it up because of love
-1	rt joeyvictorino letting go of my pride http t co zrm6joqapj
-1	rt joslynnnn10 i m a good girl take pride in that
-1	rt poldarked here s a look at poldark from australia where it first aired last sunday http t co f4kb8gulw4 photo via chronicle http
-1	iamsrk u r our pride sir lt 3
-1	vote for pride kca votejkt48id
-1	rt kagisure1 pride is a very dangerous disease
-1	madonna living for love edson pride unreleased mix vibe connexion http t co daaupnx8ae via vibeconnexion
-1	chenery expresses his pride in the way bury players finishing bury free press bury http t co ne4hn3ntk4
-1	rt aaronisbuilding great that his worship mayor don atchison was able 2 attend the buildyxe gala he spoke of the pride in the industry
-1	rt umaruruno say something i m giving up on you and i will swallow my pride you re the one that i love and i m saying goodbye
-1	always wear your war paint with pride via r funny http t co 9einmsco8g funny
-1	rt tashelectric it s your throw back on the hour every hour osunlade ft nadika shakur pride ngwakosa jozimradio soundofweekend ad
-1	don t forget to follow hot music artist awol2020 biggdave312 new music pride in stores worldwide 4 15 15 hiphop rt music
-1	rt africarevolt south africa is supposed to be the pride of africa in terms of brotherhood
-1	rt danielsahyounie i want this top aussie pride http t co 6aomvd11vq
-1	flintbedrock we live with pride inside our hearts as we all stand to build our nation zim35
-1	shaelagray fkhadija_ it s ok you be a pootenany with pride
-1	rt niallofficial for such a small country small population the power that the irish name carries around the world is unbelievable p
-1	pride is a very dangerous disease
-1	this pedophile who s adding all the girls on facebook has way too much pride in his cock
-1	madonna living for love e thunder amp edson pride intro dub vibe connexion http t co u4zbzzizui via vibeconnexion
-1	rt ughwhatevs_ strip away your pride and speak to me honestly
-1	rt yeoldetripnott ezekialbone experiencenotts nottinghamcamra bosher16 palkaye real ale festival nottingham pride camraagm http t
-1	so i turn my head to the north swallow that pill that they call pride that old me is dead and gone but that new me will be alright
-1	here s a look at poldark from australia where it first aired last sunday http t co f4kb8gulw4 photo via chronicle http t co 5aoogjvnnl
-1	rt kingtysheen niniheartss l it s okay though
-1	nathansykes wishing you a wonderful birthday you re the pride of our tw fanmily ily happy22ndbirthdaynathansykes http t co dtfsvg4qec
-1	rt rpurvis44 pride will be the last thing to ruin a opportunity for me sometimes taking the back seat is better it ll prepare for a bet
-1	dat chick dumb ass stupid go ahead and try and picture that happening tf would there be a sense of police if its legal to kill ya dumb ass
-1	madonna living for love e thunder amp edson pride dub vibe connexion http t co fbgq48j1jb via vibeconnexion
-1	rt danielsahyounie i want this top aussie pride http t co 6aomvd11vq
-1	rt africarevolt south africa is supposed to be the pride of africa in terms of brotherhood
-1	rt gunsandcrayons i take pride in being a man let me fix your flat tire let me fix your sink let me put together the new bed frame you ju
-1	shaheed ghulam mustafas brother remembers him with pride and love http t co rudzljb6vt
-1	first reminder saturday 28th 29th day of jumaadal aakhir the evilness of arrogance and pride bismillahir http t co w5nnz3xy9s
-1	and so it s true pride comes before a fall i m telling you so that you won t lose all i m a loser
-1	rt zodiacfacts despite their pride leos don t give up easily on a good relationship or friendship
-1	rt joeyvictorino letting go of my pride http t co zrm6joqapj
-1	rt snajua be a woman with pride let a man love you not just by claiming he loves you but the ones who value you your privacy and your
-1	her pride remains unbeaten
-1	narendramodi thnx for registering d presence of india in d world infusing d pride in every indian living in any corner of world
-1	rt corinnegarnier_ why isn t there a white history month why isn t there straight pride why don t people take meninism seriously
-1	mywifir0mance you already know u can t go to 2016 pride i m so sorry
-1	rt yvonneheward the pride of nursing awards praise for the paediatric icu ward at birmingham children s hospital birmingham mail http
-1	really trying to take pride in not eating meat
-1	when you go for a fight fight for a win when you lose lose with a pride https t co yvpurhci0g
-1	rt umaruruno say something i m giving up on you and i will swallow my pride you re the one that i love and i m saying goodbye
-1	rt kingtysheen niniheartss nah cole one of my favs i said wale is trash lol
-1	rt danielj_christ 400m_pride niniheartss ralphie_flores your ass my balls ralphies hairy vag
-1	readcricketclub all the best to all concerned at read cricket club for the 2015 season wear the a d h shirt with pride good luck
-1	rt ralphie_flores danielj_christ niniheartss 400m_pride d all the above
-1	rt niniheartss danielj_christ ralphie_flores 400m_pride none wtf
-1	ralphie_flores danielj_christ niniheartss all until the point you said that thing
-1	creepgoddess ur an instigator a protagonist for all the wrong reasons using your pride evil instead of good i could go on but i m drunk
-1	400m_pride niniheartss ralphie_flores your ass my balls ralphies hairy vag
-1	santossatpathy _durdana kashmirs are islamic by birth by blood by arrogance by pride we bow to allah only and none
-1	rt niniheartss danielj_christ ralphie_flores 400m_pride none wtf
-1	rt ralphie_flores danielj_christ niniheartss 400m_pride d all the above
-1	rt nmcgivney i see michael noonan has a second job gigging with charley pride now good for him green shoots and so on latelate http
-1	rt mermaidprinsus some of yall will let a good ass person walk out ur life bc you wont put ya pride aside bc they hurt you first or simpl
-1	photo kikkimicki collar for my sissy i ll wear that with pride http t co cnhh9m2z5m
-1	danielj_christ ralphie_flores 400m_pride none wtf
-1	their witless bigotry is overshadowed by the pride and gaiety they take in demonstrating it change anjiecast
-1	danielj_christ niniheartss 400m_pride d all the above
-1	pride and glory with kaminari arashi
-1	pride in lineage since no one is able to select the family they are born into no one has a right to boast about their lineage
-1	rolanduy walk over to them and be like shift while you still have your pride
-1	400m_pride i got on level 4 in two days i m stuck now fuck that upside down shit
-1	family pride family roots family roots that matter for all family http t co mveaynbah9 gifts military coatofarms jewelry
-1	mother in law should be a verb for will bending and pride swallowing
-1	we are all the children of adam so there is no need or basis to look down upon other people allah dislikes pride equality
-1	niniheartss ralphie_flores danielj_christ perfect ingredients add chicken ass with hawk talons with bull ball juice
-1	rt tashelectric it s your throw back on the hour every hour osunlade ft nadika shakur pride ngwakosa jozimradio soundofweekend ad
-1	we are all the children of adam so there is no need or basis to look down upon other people allah dislikes pride equality
-1	rt ringmagazine the pride of the fighting matthysses part two http t co 6glhvntigm boxing lucasmatthysse morillaboxing hboboxing
-1	i never had the power to swallow my pride and integrity for the chance to let someone in and share some of the weight on my mind and heart
-1	just loved latin pride divas tuesday night show april 14 2015 by chancletarod on mixcloud https t co aavxiztrzb
-1	rt danieljwebbuk i love the work countthekicks do everyday to save baby s lives i may be a man but i wear my wristband with pride htt
-1	niniheartss ralphie_flores 400m_pride how much of this relates to you
-1	rt therixhestjoe that s one thing i pride myself on is that i can admit my wrongs like my attitude and some traits lovegrowing dontun
-1	rt niniheartss ralphie_flores danielj_christ 400m_pride i m so done reading this convo lol
-1	rt niniheartss ralphie_flores danielj_christ 400m_pride i m so done reading this convo lol
-1	rt njlahori shaheed rashid minhas ke older brothers speak w love amp pride say w pride if we can serve our country again we will http t
-1	that kid in the jfk islands pride day lol
-1	ralphie_flores danielj_christ 400m_pride i m so done reading this convo lol
-1	rt updateslagu my pride my ego my needs and my selfish ways caused a good strong woman like you to walk out my life bruno mars when
-1	pride of baltimore by frank nicolette http t co rcvdgjwq70 http t co ascyrlz3jn
-1	pride in lineage since no one is able to select the family they are born into no one has a right to boast about their lineage
-1	niniheartss its a nevermind im on 9
-1	rt ralphie_flores danielj_christ 400m_pride niniheartss penis cheese
-1	that s one thing i pride myself on is that i can admit my wrongs like my attitude and some traits lovegrowing dontunderstand
-1	my pride is stronger than my feelings
-1	sometimes you gotta shut up swallow your pride and accept that you re wrong it s not giving up it s called growing up
-1	rt ralphie_flores danielj_christ 400m_pride niniheartss penis cheese
-1	rt niniheartss 400m_pride wtf you re lying there s no level 47
-1	400m_pride wtf you re lying there s no level 47
-1	ralphie_flores well im 400 for a reason
-1	danielj_christ 400m_pride niniheartss penis cheese
-1	rt femcocks looking at her precious asset with pride shemale tranny ladyboy http t co 0ojeaxen2m
-1	rt danielj_christ 400m_pride ralphie_flores niniheartss or penis cheese with ear wax
-1	rt sincerelytumblr i grew out of i never text first phase since i realized nothing was wrong with showing someone you care about them m
-1	400m_pride ralphie_flores niniheartss or penis cheese with ear wax
-1	my black is beautiful my black is beautiful i m filled with pride rare like a pearl washed from https t co bvaf8ljoyq
-1	400m_pride i didn t get insurance hey charge you like 400 if you lose it
-1	rt niallofficial for such a small country small population the power that the irish name carries around the world is unbelievable p
-1	rt momosoto6 shaye0721 jarred_hedrick nothing can save his pride
-1	rt finnegans spring has sprung baseball is finally here show us your mntwins and finnegans pride tweet us pics of you amp your finnega
-1	rt westside_do you could spend the entire day with your girl amp the moment you tell her you re about to leave she s like http t co qj
-1	rt cslewisdaily pride is spiritual cancer it eats up the very possibility of love or contentment or even common sense cslewis
-1	i need pride and prejudice in my life like on a flash drive or something help
-1	shaye0721 jarred_hedrick nothing can save his pride
-1	400m_pride what level are you
-1	rt danielsahyounie i want this top aussie pride http t co 6aomvd11vq
-1	world pride unique soft warm indoor pet puppy sofa house bed m size http t co qwgsz5rhze http t co npapjtuino
-1	rt danielsahyounie i want this top aussie pride http t co 6aomvd11vq
-1	rt danielsahyounie i want this top aussie pride http t co 6aomvd11vq
-1	forms on her lips at the compliment thank you roaringpride she has to inhale slowly when he mentions the pride she couldn t help
-1	rt danielsahyounie i want this top aussie pride http t co 6aomvd11vq
-1	it may not be important to you but my pride is important to me i take no pride in working for someone who s giving themself away on the tl
-1	rt yudhaprast13 it s not only about pride but also about the truth surabayamelawan savepersebaya1927 bekukanpssi https t co w6aeh
-1	i always put pride into people i care about
-1	rt njlahori shaheed rashid minhas ke older brothers speak w love amp pride say w pride if we can serve our country again we will http t
-1	rt forever_lexiiii my pride is so much stronger than my feelings i could think of you 24 7 and you still wouldn t hear from me
-1	niniheartss been had it
-1	rt danielsahyounie i want this top aussie pride http t co 6aomvd11vq
-1	rt danielsahyounie i want this top aussie pride http t co 6aomvd11vq
-1	rt ralphie_flores 400m_pride danielj_christ niniheartss or just nietani s green coochie slime
-1	rt danielsahyounie i want this top aussie pride http t co 6aomvd11vq
-1	rt nataliethegod i hate not knowing whether to put my pride aside to text you or not
-1	rt msnikih help us to be unselfish soften our hearts lord and break our pride take whatever separates us from you o god myprayer
-1	ralphie_flores i wanna sell my iphone 6 plus for the or just report it lost after i put my icloud on it and i ll pay the insurance cost
-1	close some doors today not because of pride incapacity or arrogance but simply because they lead you nowhere pc
-1	new blog post mountain goat s lesson in pride http t co w8snzzxkbu
-1	seventhsinpride pride against his chest
-1	400m_pride danielj_christ niniheartss or just nietani s green coochie slime
-1	seventhsinpride as i do for you pride i like you more than i thought and i would be sad if you leave me alone he sighed and pulled
-1	drajoykumar shehzad_ind full of pride amp self respect aren t you doctor i hope you will not gormandize with what modi brings from abroad
-1	take pride in your work
-1	rt bedecrasnich erinrileyau dress codes etc frustrating as it is it s something western society use to take pride in
-1	rt njlahori shaheed rashid minhas ke older brothers speak w love amp pride say w pride if we can serve our country again we will http t
-1	remy 50 50 for chelsea fc against united the pride of london mufc
-1	rt tashelectric it s your throw back on the hour every hour osunlade ft nadika shakur pride ngwakosa jozimradio soundofweekend ad
-1	explore your weekend with pride amp passion collection by dndexecution visit yogurtapparelstore https t co miuwfeilzp
-1	rt paperchasindre_ you can t have pride in a relationship factual
-1	my pride is tripping right now but i miss you
-1	help us to be unselfish soften our hearts lord and break our pride take whatever separates us from you o god myprayer
-1	well spank my ass and call me charles if it ain t you
-1	at momentverify we take pride in having helpful representatives who are enthusiastic about helping our customers online
-1	rt danielsahyounie i want this top aussie pride http t co 6aomvd11vq
-1	rt hornyfacts i grew out of i never text first phase since i realized nothing was wrong with showing someone you care about them more t
-1	aishwarya rai bachchan miss world 1994 indian actress ndia s pride http t co fqhfacfsll
-1	willow1871 mr bond no a very suave ade presenting the pride of bracknell awards last night readingfc nic itm http t co hzgkg6brzk
-1	pride pub gangtok polish off the excellent bengali rations over cgmfwv http t co r7eth77sxl
-1	rt pridemaspalomas the maspalomas pride 2015 live artists on the yumbo main stage http t co 4wzneh1hkx
-1	rt africarevolt south africa is supposed to be the pride of africa in terms of brotherhood
-1	charley pride is anybody goin to san antone http t co 12jjl1rqra nowplaying listenlive
-1	you can t have pride in a relationship factual
-1	erinrileyau dress codes etc frustrating as it is it s something western society use to take pride in
-1	pride and happy to announce mike s next out coming http t co wu2pw7g4ea
-1	rt peterbeads it s impossible said pride it s risky said experience it s pointless said reason give it a try whispered the h
-1	rt raring2golisa it s pride of longbridge tomorrow at cofton park at longbridge a must see and do event if you like the history http
-1	jarred_hedrick does that save your pride
-1	rt checkpoints559 checkpoint westbound ashlan at marks in fresno designateddriver nodui
-1	rt nataliedowse caravangallery great to see sunderland pride of place project up and running 18 fawcett street fantastic http t co
-1	rt googlefacts an ethiopian girl was kidnapped and attacked until a pride of lions chased her attackers off and stayed to defend her unti
-1	no matter what the economy of the jungle is i can never eat grass it s not pride it s just who_i_am http t co m1snbgt4ze
-1	rt goodtre puritan s pride vitaminc 1000 potent antioxidant support one of the leading vitamins for immune support http t co jpq4gx
-1	fuck that pride shit you cute you beautiful you smart and hilarious as fuck so keep doing what you doing baby girl cause i noticed
-1	sometimes you gotta shut up swallow your pride and accept that you re wrong it s not giving up it s called growing up rich simmonds
-1	i really don t give people to much room like that 3 in a row and now my pride is gonna take control
-1	rt forever_lexiiii my pride is so much stronger than my feelings i could think of you 24 7 and you still wouldn t hear from me
-1	rt redstratuss new social media revamp for faze_pride he asked for lions so here you go d retweets and favorites are appreciated http
-1	danielj_christ ralphie_flores niniheartss or some toe fungus with a slight touch of dirty finger nails
-1	maggie is ready for pride of longbridge http t co w8wnahfos2
-1	rt arlingtonrivera samtexansoccer you ve inspired a city amp renewed samhoustonhs pride for a new generation congratulations on incredib
-1	the feeling of unbridled joy and pride when you see your loved ones in your mont vert home http t co iclrhgpzxj http t co lbekxet7vj
-1	rt africarevolt south africa is supposed to be the pride of africa in terms of brotherhood
-1	we are all the children of adam so there is no need or basis to look down upon other people allah dislikes pride equality
-1	rt nataliedowse caravangallery great to see sunderland pride of place project up and running 18 fawcett street fantastic http t co
-1	rt danielj_christ ralphie_flores 400m_pride niniheartss you mix together a nice concoction of neck sweat ass juice vagina crust and t
-1	xcampbell79 essendonfc we are proud and look forward to the huge game next week will be there with pride
-1	watching your son be a successful athlete must be like watching him getting the hottest chick in the bar so much pride that s my boy
-1	rt faithclubdotnet jesus truth proverbs16 18 pride leads to destruction and arrogance to downfall
-1	bigbardafree bigbardafree little florida things friend finds a vhs of the lion king 2 simba s pride on http t co whqefowlip
-1	rt umaruruno say something i m giving up on you and i will swallow my pride you re the one that i love and i m saying goodbye
-1	rt demwildboys_509 this is a phenomenal team it has been an incredible season and we are overwhelmed with pride what a year of growth
-1	ima let my pride get in the way with this one
-1	lesbian girl scouts leader starts new troop in a gay pride center the girl scouts are opening a troop at a ga http t co 8e5zcnx1bg
-1	rt muftimenk don t let pride get the better of you amp walk around showing off your good deeds to think you ve done more than others is a
-1	rt seishunrc make akashi the captain he really is a good kid akashi s confident but he s worried about nijimura s pride kurobas http
-1	truth god forever dont trust riches pride peace always jesus is my trust and rock https t co hqzzma2gsg
-1	one man come in the name of love pride u2 http t co yrt0g44ewy
-1	rt ihaydenstewart sometimes you gotta put your pride to the side fellas and show her you care http t co qthgvu6tux
-1	_angelmacias_ you real you real that s what s popular huh that s cool dont you dare start your bull shit
-1	rt youlovetay_ we need more boys like this niggas got too much pride amp be letting they gay ass friends influence them http t co ege
-1	rt soundofweekend throwbackat9 recordsyoruba pride with ngwakosa tashelectric thesoundofweekendradio on jozimradio
