-1	lifeaseva in your new video you showed your pride and prejudice and your jane eyre book where did you get them the covers are so pretty
-1	mecha_zoraru recall 1
-1	all a nigga really got is my respect and pride
-1	shaheed rashid minhas ke older brothers speak w love amp pride say w pride if we can serve our country again we will http t co rxn6einlhz
-1	we just two petty ass people with too much pride
-1	i love zues cause he defeated solomon amp his jews amp monkey muslims amp christians amp restored my self pride http t co 1pl5khvj9k
-1	rt thisismillwall all we asked for was to go down with a bit of pride bomber amp the players have been giving us even more than we could v
-1	whenever i see you i ll swallow my pride and byte my tongue
-1	aishwarya rai bachchan miss world 1994 indian actress ndia s pride http t co woczdyjxtp
-1	1896 sheet music pride of the yankees composed by wm h plass a national hit http t co pchtcjnyoy http t co 3c21dk7cna
-1	whaddupdeven 5s t mobile already
-1	rt africarevolt south africa is supposed to be the pride of africa in terms of brotherhood
-1	rt i_am_jonel21 pride is just 5 letters word that may kill a long spelled relationship
-1	niniheartss fuck karl
-1	400m_pride what phone
-1	rt tashelectric it s your throw back on the hour every hour osunlade ft nadika shakur pride ngwakosa jozimradio soundofweekend ad
-1	whaddupdeven idk 150 its in perfect condition like has the screen protector still and everything
-1	rt soundofweekend throwbackat9 recordsyoruba pride with ngwakosa tashelectric thesoundofweekendradio on jozimradio
-1	rt fcc_totnes a week today sat 25 april pride 15 details including link to trailer http t co pgj7as7hyk totnes http t co 0a
-1	rt forever_lexiiii my pride is so much stronger than my feelings i could think of you 24 7 and you still wouldn t hear from me
-1	400m_pride danielj_christ niniheartss that s some sick shit
-1	rt danieljwebbuk i love the work countthekicks do everyday to save baby s lives i may be a man but i wear my wristband with pride htt
-1	rt youlovetay_ we need more boys like this niggas got too much pride amp be letting they gay ass friends influence them http t co ege
-1	rt thrvsherj_ marissaamermaid just a heart full of pride a mouth full of gold
-1	rt tashelectric it s your throw back on the hour every hour osunlade ft nadika shakur pride ngwakosa jozimradio soundofweekend ad
-1	pride in lineage since no one is able to select the family they are born into no one has a right to boast about their lineage
-1	ralphie_flores danielj_christ niniheartss nah bruh nothings better then some fresh dingle berries it adds the texture and flava
-1	rt xemilysmile stop making excuses for your intentional sinning throw away your pride and take up your cross
-1	rt soundofweekend throwbackat9 recordsyoruba pride with ngwakosa tashelectric thesoundofweekendradio on jozimradio
-1	it s your throw back on the hour every hour osunlade ft nadika shakur pride ngwakosa jozimradio soundofweekend adolf_sa verona_vee
-1	throwbackat9 recordsyoruba pride with ngwakosa tashelectric thesoundofweekendradio on jozimradio
-1	magusxix totally agree with the hyped up pride basic is all about tearing you down and rebuilding you in the organization s image
-1	rt danielsahyounie i want this top aussie pride http t co 6aomvd11vq
-1	rt ibipolartweet some mfs are just so stubborn they be willing to lose a good mf just for they pride smh
-1	rt kayburley whatever your politics this is heartwarming nicolasturgeon parents on pride at their daughter s achievements https t co
-1	400m_pride how much
-1	rt youlovetay_ we need more boys like this niggas got too much pride amp be letting they gay ass friends influence them http t co ege
-1	rt wgicolorguard pride of cincinnati wgi2015 iwsemisud http t co n7dvfav9pb
-1	rt haexoxo lao gan ma better have yixing as their newest endorser bcs he takes so much pride w his lao gan ma grilled beef that he cooks
-1	rt ralphie_flores 400m_pride danielj_christ niniheartss quim juice son
-1	nelsormensch fullbright nah most ubisoft games have so much pride in animation fidelity that responsiveness slips
-1	sometimes you gotta shut up swallow your pride and accept that you re wrong it s not giving up it s called growing up rich simmonds
-1	rt libra_horoscop libra pride themselves on being truthful
-1	congratulations india is very proud of you mr modi you are india s pride amp pakistan taliban secularists isis amp presstitutes envy
-1	rt ralphie_flores let alone i m dating his cousin wonder where that sauce going to come from
-1	400m_pride danielj_christ niniheartss quim juice son
-1	jadeserotica they re my pride and joy
-1	rt nidoqueens you don t look queer sorry im not wearing the pride flag as a cape and fucking your sister
-1	rt ashleeferrara im filled with so much pride tonight kegrat taylor_kast94
-1	rt youlovetay_ we need more boys like this niggas got too much pride amp be letting they gay ass friends influence them http t co ege
-1	whaddupdeven i do but its icloud lock unless you know how to bypass that bitch
-1	pride is a destroyer
-1	_benng we were generally hyped up to have so much pride in who we were after basic of course but basic was part of that process too
-1	i got pride you can t hold your breath
-1	sometimes you gotta shut up swallow your pride and accept that you re wrong it s not giving up it s called growing up rich simmonds
-1	rt snajua be a woman with pride let a man love you not just by claiming he loves you but the ones who value you your privacy and your
-1	nomoozlie the jobs that these foreigners do are the same jobs that they ve been offered but because of pride
-1	paperhegemony i pride myself on being boring as far as food goes i m bloody interesting elsewhere
-1	generosity is giving more than you can and pride is taking less than you need http t co yknqzg6b74
-1	pride in lineage since no one is able to select the family they are born into no one has a right to boast about their lineage
-1	ralphie_flores danielj_christ niniheartss sprinkle some ass juice and blam
-1	jimforscotland who knew how to appeal to the pride and arrogance the romanticism and the obscurantism of magyar nationalism
-1	also when i type lg it tries to correct me to lgbt go samsung lgbt pride etc
-1	rt kamkitty8 singer composer footballer businessman definition of pride proudoflouistomlinson proudoflouis http t co kcdcac1nzr
-1	distantcities sorry to hear about your teeth their state of disrepair used to be a matter of quiet pride for you iirc now accidental
-1	rt forever_lexiiii my pride is so much stronger than my feelings i could think of you 24 7 and you still wouldn t hear from me
-1	rt ichetangupta vote4bjpbengal mamta n b4 her cpi killed bengali pride lalu made bihari a slang word naveen though good lacks ideas
-1	rt snajua be a woman with pride let a man love you not just by claiming he loves you but the ones who value you your privacy and your
-1	rt ifaptalouis i don t even know louis personally and i m about to burst with pride i wonder if johannah is still alive
-1	rt ibipolartweet some mfs are just so stubborn they be willing to lose a good mf just for they pride smh
-1	rt nikewomen if it was really no sweat everyone would do it http t co pf8t61tojh
-1	rt forever_lexiiii my pride is so much stronger than my feelings i could think of you 24 7 and you still wouldn t hear from me
-1	pride s what s only left for me labyuuuuuuuu
-1	my pride leaves such a bitter taste but i m still wanting more i m always wanting more
-1	rt youlovetay_ we need more boys like this niggas got too much pride amp be letting they gay ass friends influence them http t co ege
-1	rt totalfratmove understated state pride tfm http t co g2pyug0d8f
-1	rt danielj_christ ralphie_flores 400m_pride niniheartss just throw some hot coochie sauce on it bruh
-1	rt babudubeyindia together we will bring back the pride and joy of living in kolkata bjp4bengal vote4bjpbengal missionkmc http
-1	rt yusuke_mld today pride we fight together tour final https t co oule3k9zpj
-1	some mfs are just so stubborn they be willing to lose a good mf just for they pride smh
-1	libra pride themselves on being truthful
-1	rt diablo always wear your warpaint with pride http t co cfaw2kwbab
-1	rt snajua be a woman with pride let a man love you not just by claiming he loves you but the ones who value you your privacy and your
-1	rt niniheartss when you first meet bae vs after ya ll been dating a couple months http t co gegmsmdjcx
-1	rt fhslax nice ot win against boulder knight pride http t co q3qqn6q6cd
-1	do not let your pride blind you
-1	ralphie_flores 400m_pride niniheartss just throw some hot coochie sauce on it bruh
-1	rt staiconmeliam proudoflouis proudoflouis proudoflouis proudoflouis you re my pride http t co nl5qgo6qkx
-1	pride brings a person low but the lowly in spirit gain honor
-1	rt goughbw we re wearing our football shirts with pride to raise money for the bobbymoorefund footballshirtfriday http t co q0xu3a2ovc
-1	whoismuhammad yusha evans islam give us pride http t co jczahh42bt islam muslims muslim
-1	a daughter is a mother s greatest pride how do you express love to her notetodaughter http t co 7h54ytu066
-1	ralphie_flores niniheartss this man is speaking my language
-1	who s got tattoo this is so recomended 24 tattoo ideas for wearing your pride on your sleeve tattooart http t co e1zib7xz73
-1	today i consider myself the luckiest man on the face of the earth ___lou gehrig gary cooper the pride of the yankees 1942
-1	rt liljackie__ 400m_pride delete this
-1	rt youlovetay_ we need more boys like this niggas got too much pride amp be letting they gay ass friends influence them http t co ege
-1	rt staiconmeliam proudoflouis proudoflouis proudoflouis proudoflouis you re my pride http t co nl5qgo6qkx
-1	rt officialkally can people actually fucking put their fucking pride aside
-1	rt raring2golisa it s pride of longbridge tomorrow at cofton park at longbridge a must see and do event if you like the history http
-1	rt ralphie_flores niniheartss 400m_pride with some sweet baby rays bbq sauce it s over
-1	a week today sat 25 april pride 15 details including link to trailer http t co pgj7as7hyk totnes http t co 0aaclj0kco
-1	rt youlovetay_ we need more boys like this niggas got too much pride amp be letting they gay ass friends influence them http t co ege
-1	chaplinez70 can t keshi just quit isn t it now obvious they don t want him or there s no little pride left in him anymore
-1	do you let your pride in the way all of the time http t co cclnzxgxki
-1	niniheartss 400m_pride with some sweet baby rays bbq sauce it s over
-1	rt niniheartss 400m_pride i want a promposal
-1	never let ur pride interfere with ur heart
-1	cannot wait for long beach pride
-1	rt officialkally can people actually fucking put their fucking pride aside
-1	dandeliontiger is this the pride issue or what u bij
-1	rt diablo always wear your warpaint with pride http t co cfaw2kwbab
-1	proudoflouis proudoflouis proudoflouis proudoflouis you re my pride http t co nl5qgo6qkx
-1	rt thewolf916 danny at 2715 demonstrating pride and ownership amazing brand drew_arrington garadasimmons brianhaskins1 http t co
-1	rt lyricdailydrake looking back on it at least my pride is intact cause we said no strings attached and i still got tied up in that
-1	colin00007 sadly you saw it from the utopia end i was working at the grimy pick up the pieces end source of pride to family glasgow yup
-1	noluthando_ban sihlemonica hater13434755 we must all make a royal complain
-1	rt meloniemarie__ niggas pride be in the way
-1	rt liljackie__ 400m_pride delete this
-1	rt niniheartss 400m_pride you already know
-1	rt dogsnasadea pride prejudice ebook free download http t co olpwdafypw
-1	the pride looking to string back to back wins together for the first time this season while the devils are just as hungry for a win
-1	niniheartss you got it dude
-1	first soccer game all and lost 22 neil we lost pride and the game
-1	rt 69_suavekid ain t nothing sexy like a girl with pride keep your pride baby girl
-1	400m_pride you already know
-1	400m_pride delete this
-1	rt dawnzpost a modern day warrior mean mean stride today s tom sawyer mean mean pride rush
-1	niggas pride be in the way
-1	gottivictoria i was a real gambino god what happened to my self made pride my goal was to be up there to victoria gotti made it trust
-1	rt oddfknday i love when a person sends me a long message like yes put your pride aside and tell me how you feel make my talkative a
-1	rt afcbrazil our club is all about children amp hence the thought of helping to give a child an education amp hopefully a better life bursts
-1	400m_pride i want a promposal
-1	rt mariac_035 prouder then ever samtexansoccer the amount of pride and joy ya gave us is indescribable thank you for putting your heart
-1	rt joslynnnn10 i m a good girl take pride in that
-1	rt taylorgraced pride most often comes before a fall remain humble kindness matters
-1	we re the pride of south australia adelaide_fc adelaide_fc gocrows
-1	marissaamermaid just a heart full of pride a mouth full of gold
-1	my pride my ego my needs and my selfish ways caused the good strong woman like you to walk out my life
-1	learning to put your pride aside for your relationship is hard but it s worth it
-1	guess we re gonna get high on bp tonight yeah blender s pride
-1	something that i always take pride in when i think of my home country australia afl australianfootballleague http t co evn79rwdad
-1	your pride will ruin you
-1	niniheartss oh thats perfect thats all a nigga need is some tapatio
-1	rt danielsahyounie i want this top aussie pride http t co 6aomvd11vq
-1	jesus truth proverbs16 18 pride leads to destruction and arrogance to downfall
-1	rt islamandlifeofc 25 it serves as a metaphor for constantly observing worship anonymity is a saviour from arrogance and pride kibr
-1	rt swifttay_lyrics this is me swallowing my pride standing in front of you saying i m sorry for that night
-1	swallowing pride is the hardest part sigh winedrunk
-1	rt niniheartss 400m_pride and maybe some hot sauce
-1	looking at her precious asset with pride shemale tranny ladyboy http t co 0ojeaxen2m
-1	rt joslynnnn10 i m a good girl take pride in that
-1	rt updateslagu my pride my ego my needs and my selfish ways caused a good strong woman like you to walk out my life bruno mars when
-1	400m_pride and maybe some hot sauce
-1	xrl___ it s all pride and games but vice versa not all guys are like that
-1	niniheartss will you go to prom with me
-1	watch tommy shannon stevie ray vaughan and double trouble perform pride amp joy video http t co yuwb3ln5eh guitar
-1	deja_fuentes king_ivyy why u gotta ruin a mans pride
-1	some of y all pride ain t neva been that real gonna leave y all hoes old lonely n bitter lol
-1	good afternoon from a very wet barlow park in cairns for this intrustsupercup clash btwn northern pride and norths devils k off in35 mins
-1	rt antonio_lokote pride amp confidence
-1	you chose your pride you chose your ego you chose your paranoia you chose your enemies you chose your consequences
-1	yeah i have pride probs and would never hit you up first even if i care about you a lot ig that s meeee srry
-1	eddielack congrats on a huge win tonight and your first playoff win can t imagine the pride your dad must have hearing 20 000 people
-1	my bonnie back den we slay yall ass straight robbed everybody for their pride that night http t co jsycs1cdni
-1	rt patricecagwapa i m gonna swallow my pride say i m sorry stop pointing fingers the blame is on me
-1	rt danielsahyounie i want this top aussie pride http t co 6aomvd11vq
-1	rt afcbrazil our club is all about children amp hence the thought of helping to give a child an education amp hopefully a better life bursts
-1	rt le_saritaah i hold on to my pride too much even if im wrong in my eyes in right and i ll never apologize or open up until the other
-1	rt jcyoung24 here s a little secret about the pack pride we re omnipotent we see hear amp know practically everything we re everywhere
-1	pride of london
-1	when i put my pride aside i be doing the most because i don t wanna be without ya
-1	niniheartss i guess that ll do
-1	rt milaneye rui costa i arrived at a time where the focus was always to win to be part of that milan team was a tremendous pride
-1	rt _misha_mish don t ever fuck wit my pride realtalk
-1	rt banneroftruth the fundamental issue is not is he one of us but is he one of christ s http t co 5lml2gy3x9
-1	rt thefathereffect u cannot b the dad god called u 2 be living with pride anger amp unforgiveness thefathereffect
-1	400m_pride only salt
-1	rt kibaliciousfang wolfninjaqueen he smiles loving to be around her she was his pride and joy his better half his everything
-1	regretted pride
-1	rt niniheartss 400m_pride only salt
-1	rt markthomasinfo bought this martinrowson cartoon going up in living room or above kitchen table not sure but pride of place http
-1	niniheartss no lemon any pepper some onions
-1	loveedinburgh it s not the walk of shame it s the stride of pride
-1	rt hereisnathaniel every kid is someone s pride and joy or wants to be someone s pride and joy please treat them that way don t kill th
-1	dont you dareeeee rt xomiszcarla when your tempted to text someone but you re pride amp friends won t let you
-1	i added a video to a youtube playlist http t co rkvoxssmnj blue exorcist core pride english cover 1st op natewantstobattle
-1	rt umaruruno say something i m giving up on you and i will swallow my pride you re the one that i love and i m saying goodbye
-1	williamalexan30 shows pride in own culture heritage and identity as a filipino u what did you even do to have them mark it u haha
-1	every kid is someone s pride and joy or wants to be someone s pride and joy please treat them that way don t kill them don t molest them
-1	400m_pride only salt
-1	rejection makes you defensive so you protect your pride with your reflexes
-1	destroy the doctrine what they thought you about women and set yourself free after that work on yourself to have pride when you look into
-1	rt updateslagu my pride my ego my needs and my selfish ways caused a good strong woman like you to walk out my life bruno mars when
-1	looking back on it at least my pride is intact cause we said no strings attached and i still got tied up in that
-1	rt eminnnnnem you never slow the momentum at any moment i m about to blow you ll never take my pride
-1	rt kingucheodoh i spend way too much time face timing my friends in nigeria than going out in the real world to meet people lol
-1	rt googlefacts an ethiopian girl was kidnapped and attacked until a pride of lions chased her attackers off and stayed to defend her unti
-1	rt mr_leadership those who take pride in being brutally honest are typically more interested in being brutal than they are in being hon
-1	rt officialkally can people actually fucking put their fucking pride aside
-1	rt thefathereffect u cannot b the dad god called u 2 be living with pride anger amp unforgiveness thefathereffect
-1	13 love to the 13 pride been so long since i been on twitter had to reset everything life is good 13
-1	rt danielsahyounie i want this top aussie pride http t co 6aomvd11vq
-1	bottomho that is my shawol pride song ur truly alone hanna
-1	got pride you can t hold your breath we ll crash down like an avalanche look out now don t take one more step
-1	rt drpayal_1289 food comes from farm these farms make country charm our country s pride is hidden in farms possible bcz of of farmers
-1	rt mermaidprinsus some of yall will let a good ass person walk out ur life bc you wont put ya pride aside bc they hurt you first or simpl
-1	rt niniheartss 400m_pride eat this http t co jfgyfo44dn
-1	niniheartss you got seasoning
-1	thanaetos i i know i can hold my phone with pride now
-1	mrsfunnybones i hv made a song based on sardaar s pride and it s has a x factor which will be best suited to sib only one of 5 min pls
-1	rt mermaidprinsus some of yall will let a good ass person walk out ur life bc you wont put ya pride aside bc they hurt you first or simpl
-1	here s what will be left by the time i can get inside air a piece of cardboard and my pride rsduk roughtrade rsd15
-1	400m_pride eat this http t co jfgyfo44dn
-1	photoset bandmonkey beyond any sadness what i feel the most is pride gerard way my chemical romance http t co rlvyh9v7tb
-1	we still have that bean upon hearing nack say that they have to keep their professional pride sonic the hedgehog 268
-1	rt autoshi112 zayn he hasn t forgotten one direction he always makes my heart swell with pride proudofzayn proudoflouis http t
-1	i m so over these ungrateful trying to play hard with a a pride that s too big ass niggas
-1	i cant take that shit anymore
-1	rt nflnetwork icymi danny_shelton55 stopped by to show us why he thinks he s the best dt in the draft http t co x7ozxckhus http t
-1	don t let your pride get the best of you lol i once did but won t again
-1	review pride and pleasure by sylvia day http t co hkeu0ojupa
-1	rt siecklogan college of daily pride pumped to see what s in store tomorrow for doanetf
-1	rt teamvcfl vcfl watch our player online at http t co t0m6mojat8 valley pride we played them first lt 3 http t co gelibqbvdi
-1	marsthoughts apparently i have kids i didn t know about too but they ain t mine thats it im done
-1	zayn he hasn t forgotten one direction he always makes my heart swell with pride proudofzayn proudoflouis http t co 9icpzgtwcb
-1	this is me swallowing my pride standing in front of you saying i m sorry for that night
-1	my pride rn gt gt gt gt gt
-1	rt tinyboyiwt i am really proud of him to be honest he has achieved so many things in his short life time he is truly my pride proud
-1	we received another great review today we take pride that our customer service and our quality of work is top http t co fpzoofxryt
-1	lindsgrill too much memphis pride http t co ibqpes5oad
-1	uverworld core pride live http t co 4oh8sfrusk
-1	rt tinyboyiwt i am really proud of him to be honest he has achieved so many things in his short life time he is truly my pride proud
-1	the pride that we have for our country just amazing congress is just trying to be relevant by shaming the pm https t co uqhy9b8gme
-1	pmoindia narendramodi we need patriotic spirit to do things that bring pride to our nation lat us imbibe this spirit among all indians
-1	rt ichetangupta bjp4bengal together we will bring back the pride and joy of living in kolkata vote4bjpbengal
-1	charlie pride biography country singer http t co b8c1jjc9qu
-1	tinkizee imamdimam when u hold someone dear 2 your heart amp your hurt move on with pride amp confidence carry yourself high wait amp 4 outcome
-1	rt msnikih the desires of the flesh and the desires of the eyes and pride of life is not from the father but is from the world 2 john
-1	ima put my pride to the side from now on
-1	shithouse performance no heart no pride ridiculous injuries can t be our excuse anymore depth needs to show their worth nrltitanspanthers
-1	i hold on to my pride too much even if im wrong in my eyes in right and i ll never apologize or open up until the other person does
-1	rt tinyboyiwt i am really proud of him to be honest he has achieved so many things in his short life time he is truly my pride proud
-1	rt tinyboyiwt i am really proud of him to be honest he has achieved so many things in his short life time he is truly my pride proud
-1	reagarvey maggsgarvey only 64 left until bonn kunstrasen oml pride i m counting days http t co e3rxupngmb
-1	my pride means more to me then my feelings justsaying
-1	rt danielsahyounie i want this top aussie pride http t co 6aomvd11vq
-1	rt 8badgeboy if school hasn t made you think about dropping out and start trappin then i think you re doing it wrong
-1	pride going make me lose a lot of ppole bc i promise you i m not finna beg not reach out to anyone im just not thts dead been a fool befo
-1	rt zayn_onfleek zayn gets the most shit because of his muslim background and he takes it with his head held high and takes pride in his c
-1	ronan fanning on why sinn f in only get to borrow 1916 works for me http t co yjzzj9wsiw
-1	rt kenarkiare u2 pride in the name of love https t co igyyxvpqn3 via youtube
-1	the pride of youth is in strength and beauty the pride of old age is in discretion democritus
-1	rt worldsbids good luck buckeye cheer elite pride ss5 bcecats at w rlds a dream is a wish your heart makes worlds2015 usasf http
-1	i added a video to a youtube playlist http t co tfm0flfqxa 2014 pride vlog day 3 boat cruise
-1	i added a video to a youtube playlist http t co vvfdczhnh0 2014 pride vlog day 5 drag show amp party
-1	rt aktravel_uk wow what a welcome to the mara from sanctuaryret lion pride and masai welcome dancing and jumping ceremony kenya http
-1	photo beautiful rainbow tree of life rainbow trees witch wiccan pagan gay lesbian pride http t co zsvseigzo2
-1	i added a video to a youtube playlist http t co x0tiv0u9jb 2014 pride vlog day 2 roller derby amp drag show
-1	i added a video to a youtube playlist http t co nin7wodzee 2014 pride vlog day 1 drag show
-1	i added a video to a youtube playlist http t co mhd3oxekj7 2014 pride vlog day 4 drag baseball game
-1	i added a video to a youtube playlist http t co cjv6zebq9c 2014 pride vlog day 6 beer garden fun
-1	you never slow the momentum at any moment i m about to blow you ll never take my pride
-1	rt msnikih the desires of the flesh and the desires of the eyes and pride of life is not from the father but is from the world 2 john
-1	rt forever_lexiiii my pride is so much stronger than my feelings i could think of you 24 7 and you still wouldn t hear from me
-1	off to pride of longbridge in cofton park birmingham photos from last year pride of longbridge 2014 cars https t co 6ek0vzhdjl
-1	rt tinyboyiwt i am really proud of him to be honest he has achieved so many things in his short life time he is truly my pride proud
