-1	with pride pittsburgh steelers uk man of steel http t co t3ljqreios
-1	rt philademusic reduce thirst people have some pride
-1	marin is the site this weekend for great chefs of marin annaul fundraiser top chefs pride mountain of course amp the auction for lifehouse
-1	knees two knees
-1	the desires of the flesh and the desires of the eyes and pride of life is not from the father but is from the world 2 john 1 16
-1	meet nash the boxer 01jimboss s pride and joy such a handsome pooch aussiepups downundertour2015 https t co vrdnh83mls
-1	rt donsapagully rt africarevolt south africa is supposed to be the pride of africa in terms of brotherhood
-1	rt gunsandcrayons i take pride in being a man let me fix your flat tire let me fix your sink let me put together the new bed frame you ju
-1	rt tinyboyiwt i am really proud of him to be honest he has achieved so many things in his short life time he is truly my pride proud
-1	it s not just a competition about medals it s a competition about pride
-1	rt cristiano our badge our colours our pride put your name on the new national team jersey http t co x08dd2egkl http t co yazdgg4
-1	rt dallasmavs head over to the plazahangar amp get your free yard sign amp show your mffl pride mavsareone http t co pbnt7qzo07
-1	rt philademusic reduce thirst people have some pride
-1	preshka_pride hi please check out my song angelo part2 http t co rlqyo2lsxx your support would be highly appreciated thank you
-1	niniheartss buy me food plz
-1	rt tinyboyiwt i am really proud of him to be honest he has achieved so many things in his short life time he is truly my pride proud
-1	my heart swells with pride as to how trans men but more specifically myself are treated at the holy ground
-1	don t fuck a good thing up bc you have too much pride goodnight
-1	rt kamleshksingh the small minority that felt pride in paying their taxes envy the tax thieves today minimum government maximum governa
-1	rt cheesey45 nufcthemag another patsy to tow the company line where s the pride and passion boycottspurs
-1	jimforscotland who have nothing but their pride to lose
-1	rt hornyfacts i grew out of i never text first phase since i realized nothing was wrong with showing someone you care about them more t
-1	whoever in pride 348 can you calm dee fuck down
-1	rt snajua be a woman with pride let a man love you not just by claiming he loves you but the ones who value you your privacy and your
-1	rt tinyboyiwt i am really proud of him to be honest he has achieved so many things in his short life time he is truly my pride proud
-1	rt nbangaa_ i have to much pride
-1	what is lost by pride does not recover with tears
-1	rt marklenkennedy richardhealy1 it wasn t the end it was just the beginning every day was like living inside of a history lesson pri
-1	rt avaliveradio la singer songwriter nina paolicelli destined for music american pride magazine http t co z8azb9hglz
-1	rt chrislt_ niniheartss 400m_pride braces add points
-1	gotta learn to put my pride to the side sometimes
-1	jimforscotland the snp are like the magyars are sustained by that violent intensity of pride which is found in people
-1	inter v ac milan preview giants look to salvage pride inter v ac milan both inter and ac milan will enter the d http t co owvhifia6e
-1	rt tinyboyiwt i am really proud of him to be honest he has achieved so many things in his short life time he is truly my pride proud
-1	zayn gets the most shit because of his muslim background and he takes it with his head held high and takes pride in his culture proudofzayn
-1	rt yusuke_mld today pride we fight together tour final https t co oule3k9zpj
-1	niniheartss 400m_pride braces add points
-1	i have to much pride
-1	1974 new york pride parents come out in support
-1	when he whip it out and its bigger than expected http t co bduwk1h80z
-1	rt the_navy_seals feel my fear know my pride for god and country i ll end your life http t co 0wfajr9vl8
-1	rainbow heather_peevers http t co 8ytvlknqyp http t co kboopnhjbb
-1	lisabi festival the pride of egbaland http t co 18qxgld88n
-1	rt islamandlifeofc 25 it serves as a metaphor for constantly observing worship anonymity is a saviour from arrogance and pride kibr
-1	rt africarevolt south africa is supposed to be the pride of africa in terms of brotherhood
-1	and i swallow my pride
-1	hate when boys can t put their pride aside and tell you how they are feeling
-1	i am really proud of him to be honest he has achieved so many things in his short life time he is truly my pride proudoflouis
-1	rt kiraaaababy too much pride
-1	rt niniheartss anything higher than a 5 and i m cool https t co ylawulziyv
-1	pride and prejudice unabridged jane austen http t co dj0gz5gghq classics audiobook classics great audiobook
-1	so much pride assistantdirector directorjoys openingnight
-1	kangnamedjay welcome
-1	another severed head to pride upon my mantle piece
-1	when i put my pride aside i ll be doing the most yeah i ll be drunk texting you
-1	400m_pride thanks
-1	i pride myself on the fact that no matter how bad i get hurt i never let it make me bitter
-1	try to explain how i m feeling but my pride is the one to blame
-1	rt kayburley whatever your politics this is heartwarming nicolasturgeon parents on pride at their daughter s achievements https t co
-1	pride week need to hurry tf up im to stoked abt tht shit
-1	uverworld core pride live http t co 1gp8pk3kls uver
-1	my pride before anyone screwyou
-1	lao gan ma better have yixing as their newest endorser bcs he takes so much pride w his lao gan ma grilled beef that he cooks in korea lol
-1	we are all the children of adam so there is no need or basis to look down upon other people allah dislikes pride equality
-1	you a 10 fucks you mean
-1	rt cheesey45 nufcthemag another patsy to tow the company line where s the pride and passion boycottspurs
-1	rt evnian so when is marina gonna have a straight pride parade
-1	rt carmel_dulce entering pride is like entering a weed farm
-1	gracegealey i have been involved with koda camp for 10 years for people like us we teach kids to have pride in our deaf parents and 1 2
-1	aphrothighty i didn t even have a prom date she flaked on me been nine years and it still hurts my pride
-1	vintage polyester tie pride of america bicentenial 1776 navy blue eagles http t co a7aozciusl http t co fwrg8thec8
-1	rt dhanushkraja here is the trailer of our production house s pride kaakkamuttai bestchildrenfilm littlegems https t co vw3mpruxxj
-1	hinsdale illinois plumbers differently setup the starboard tack pride izigef
-1	lvhbic_ i was literally just looking at your snap wanting to cry pride this year and we better still be going to warped
-1	so when is marina gonna have a straight pride parade
-1	rt cslewisdaily pride is spiritual cancer it eats up the very possibility of love or contentment or even common sense cslewis
-1	rt moodytilianoo i wanna text you but you ain t worth dropping my pride for
-1	standing with pride _______________________________ popart pride malaysian malaysia https t co eahvfwiwlb
-1	niniheartss you a coo 8 jkjk
-1	rt myprideofficial good afternoon everyone it s time for keep the pride for your right prideanddestroy
-1	rt lexiimccarthy wanna text you but you see the way my pride is set up
-1	sooo hard but im not losing my pride because of yours darling https t co 3csns2gujw
-1	but why would you take pride in spreading negativity so you re a pessimist is that really something to brag about
-1	good afternoon everyone it s time for keep the pride for your right prideanddestroy
-1	rt arema_en happy birthday to perselafc pride of lamongan https t co xx354vkgsk
-1	and this is the real hero of bubarkanpssi original from surabaya arek bonek 1927 pride wani pic https t co xl7fmlbelk
-1	rt ebook_romance love her or walk away w his pride hard landing by marliss melton nook romance military read navyseals http t co
-1	mwo faction pride cockpit item sale 2015 http t co gwt2lrooi3 mechspecs
-1	rt meechisdead foolish pride
-1	rt the_navy_seals feel my fear know my pride for god and country i ll end your life http t co 0wfajr9vl8
-1	durutti74 well i have handy andy s tool belt found it in oxfam pride n joy
-1	rt donsapagully rt africarevolt south africa is supposed to be the pride of africa in terms of brotherhood
-1	you shouldn t be afraid to defend yourself when people are treating you like trash pride
-1	rt flintbedrock we live with pride inside our hearts as we all stand to build our nation zim35
-1	rt drpayal_1289 food comes from farm these farms make country charm our country s pride is hidden in farms possible bcz of of farmers
-1	capricorn proud you can tolerate anything but betray you and damage your pride betrayals faces are paid
-1	rt _vztweet_ sometimes you have to shut up swallow your pride and accept that you re wrong it s not giving up it s called growing up
-1	sometimes u hv got to shut up swallow ur pride amp accept that u r wrong itz not giving up itz called growing up goodmorning quote
-1	too much pride
-1	rt gunsandcrayons i take pride in being a man let me fix your flat tire let me fix your sink let me put together the new bed frame you ju
-1	rt forever_lexiiii my pride is so much stronger than my feelings i could think of you 24 7 and you still wouldn t hear from me
-1	rt africarevolt south africa is supposed to be the pride of africa in terms of brotherhood
-1	rt civicprideross delighted you ve reached the civic pride website https t co mihostpwel
-1	rt tackyz people are snakes tho i remember when gooners were tweeting wenger out now the same tweeps are posting the log table in pride
-1	put your pride behind you and keep it real with me
-1	rt tombiersdorfer what s this odd feeling it might be pride happy to say i m a mets fan it s been awhile hoping this summer nyc is a
-1	remember your weakness then you will be more cautious and you will submit to the thoughts of pride and false glory which may attack you
-1	rt mermaidprinsus some of yall will let a good ass person walk out ur life bc you wont put ya pride aside bc they hurt you first or simpl
-1	goodnight
-1	rt danielsahyounie i want this top aussie pride http t co 6aomvd11vq
-1	rt nmcgivney i see michael noonan has a second job gigging with charley pride now good for him green shoots and so on latelate http
-1	swallow your pride kid
-1	warriors fever grips peninsula show us your blue and gold pride http t co usmvz4avwg
-1	hope my humility can outlast my pride
-1	i miss her but pride a mf
-1	rt snajua be a woman with pride let a man love you not just by claiming he loves you but the ones who value you your privacy and your
-1	rt thegooglefact sometimes you ve got to shut up swallow your pride and accept that you re wrong it s not giving up it s called growin
-1	rt kinkyguy666 standing in pride get on your knees and respect it http t co pa0yujdb6l
-1	baby girl you need to stop it with all that pride and self esteem
-1	rt nisfornneka he also told me he was proud of me and that i was his pride and joy i was stunned i told him i needed to hear stuff like
-1	last top stories heroes shine at derbyshire times s pride awards http t co imuhh7qzry
-1	don t let your pride come between your happiness
-1	how many floors are in inaba pride exhibit
-1	when you miss him amp don t know how to tell him cause you can t put your pride to the side
-1	i seen this old school regular of mine get dissed by some 20 yr olds i ve never seen a man with his pride taken from him til today
-1	i love 05 pride amp prejudice with all my heart i haven t stopped internally screaming since i finished it for like the 5th time in my life
-1	rt sanwal22 what is lost by pride does not recover with tears
-1	rt patricecagwapa i m gonna swallow my pride say i m sorry stop pointing fingers the blame is on me
-1	video blackhaiirstyles domdadonwon emgeerassohl you ll protect your feelings and pride but not your http t co c4n4u3ybux
-1	a new favorite rooftop t dance party live miami beach pride dj jalil z by dj jalil z https t co 383rmxxtdm on soundcloud
-1	too much pride
-1	rt theybeonher hate when ppl be like im not hating what you got to hate on bitch pride success loving ppl surrounding me my look
-1	rt joslynnnn10 i m a good girl take pride in that
-1	i swear lol sometimes when my pride kicks in i hate it bc i could have something right in front of me and won t even say nothing
-1	rt zilanyaman pride over everything
-1	rt pyramidmedicine anomamohamed wolfnile eaglemasr1 hesham100573 wa6ani_1 strength n pride happy to have your follows http t co
-1	rt hamdi_ramli i predict 1 3 to man utd cfc mufc man utd will go all out tdy to redeem their pride glory glory man united
-1	i pride myself on what i know
-1	rt umaruruno say something i m giving up on you and i will swallow my pride you re the one that i love and i m saying goodbye
-1	kellystrona pride season is around the corner gives me the itch to come out of retirement again big girl granny misses cheer pca
-1	rt africarevolt south africa is supposed to be the pride of africa in terms of brotherhood
-1	he also told me he was proud of me and that i was his pride and joy i was stunned i told him i needed to hear stuff like that more often
-1	i m gonna swallow my pride say i m sorry stop pointing fingers the blame is on me
-1	rt redstratuss new social media revamp for faze_pride he asked for lions so here you go d retweets and favorites are appreciated http
-1	he caught me hard man i gotta leave though my life aint suit for it anymore http t co ln1gpkzego
-1	i m so bay area you know that green and yellow black and orange pride
-1	get over that pride send a message
-1	rt danielsahyounie i want this top aussie pride http t co 6aomvd11vq
-1	takes it s toll one s foolish pride how long before i see the light i have waited for you to lay me down
-1	hailzcheeeze pride and prejudice
-1	rt ebook_romance love her or walk away w his pride hard landing by marliss melton nook romance military read navyseals http t co
-1	rt jonwonder4life sometime you just have to lay down that pride and ask for help it doesn t hurt to ask for an assist
-1	isaac5_pride you re the reason for it
-1	rt americanpridemg new jersey songwriter allie harte releases no more american pride magazine http t co ptzuaxbktz indiemusic indie
-1	rt drpayal_1289 food comes from farm these farms make country charm our country s pride is hidden in farms possible bcz of of farmers
-1	rt sexualgifs_ i grew out of i never text first phase since i realized nothing was wrong with showing someone you care about them more
-1	what s this odd feeling it might be pride happy to say i m a mets fan it s been awhile hoping this summer nyc is a mets town
-1	i think your pride was just in the way
-1	argumatronic ok so we agree on the bitch part you are correct on pride and lonely
-1	nufcthemag another patsy to tow the company line where s the pride and passion boycottspurs
-1	i take pride amp dignity in having my own mind not everyone can think for themselves
-1	pride is spiritual cancer it eats up the very possibility of love or contentment or even common sense
-1	rt rehans_shamim mqm is honour dignity pride love humanity therefore na246belongstomqm azizabadi qureshimuzammil kaleemaltafi s
-1	i m a good girl take pride in that
-1	kim_sarim slide them to me when finished
-1	rt mzvikky_ prinzgbemi preach baby mzvikky_ e no concern you wekeepstriving prinzgbemi mzvikky_ you don take her pride she
-1	pinoy pride returns to dubai cebu sports the freeman sections the freeman http t co rcmauwd1pp http t co zdeh0fc4tf
-1	rt danielsahyounie i want this top aussie pride http t co 6aomvd11vq
-1	bets malone stars in pride and prejudice world premiere opening http t co uquwptpyam
-1	rt di_chi3f i know she likes me just like i like her but both our pride broken dat shit hard to fix i ll wait for her
-1	rt theybeonher hate when ppl be like im not hating what you got to hate on bitch pride success loving ppl surrounding me my look
-1	rt mermaidprinsus some of yall will let a good ass person walk out ur life bc you wont put ya pride aside bc they hurt you first or simpl
-1	mqm is honour dignity pride love humanity therefore na246belongstomqm azizabadi qureshimuzammil kaleemaltafi shariqa_ahmed
-1	rt girlideas i grew out of i never text first phase since i realized nothing was wrong with showing someone you care about them more
-1	rt mermaidprinsus some of yall will let a good ass person walk out ur life bc you wont put ya pride aside bc they hurt you first or simpl
-1	if you believe in yourself have dedication and pride and never quit you ll be a winner
-1	rt mermaidprinsus some of yall will let a good ass person walk out ur life bc you wont put ya pride aside bc they hurt you first or simpl
-1	pride and pride can t work
-1	but i notice how other people talk around me and take pride in the fact that i don t do that people probably expect me to
-1	wayne rooney admits that manchester united will be playing for pride as well as three points when his team face premier league rivals
-1	rt prinzgbemi preach baby mzvikky_ e no concern you wekeepstriving prinzgbemi mzvikky_ you don take her pride she no get any aga
-1	prinzgbemi preach baby mzvikky_ e no concern you wekeepstriving prinzgbemi mzvikky_ you don take her pride she no
-1	rt thecubstpl tpl4 14 days to defend the title be champions again do it for the pride http t co diojssnmnw
-1	rt mermaidprinsus some of yall will let a good ass person walk out ur life bc you wont put ya pride aside bc they hurt you first or simpl
-1	your package our pride we re your commercial same day courier uk and europe http t co 3bvogntkka http t co sybhfjyoar
-1	i ll be damned if i give up every last bit of my pride
-1	rt umaruruno say something i m giving up on you and i will swallow my pride you re the one that i love and i m saying goodbye
-1	flashback to pride a few years back with this crazy chick ka3rah fbf gaypride2010 https t co jigz2cq4a3
-1	sailing this ship with all its glory and pride http t co u3soyuea0b
-1	rt mjthegreatsd don t let your pride get in the way of your blessing http t co eh0jsm8tui
-1	now playing trail of tears denail and pride on rpmc radio
-1	rt rtelatelateshow crystal chandeliers with charley pride latelate http t co xsvchrvk4x
-1	rt lifeteen it was pride that changed angels into devils it is humility that makes men as angels saint augustine http t co txo3sd
-1	rt dpcwood what an amazing weekend in north wales fundraising for uk homes4heroes pride amp passion
-1	some of yall will let a good ass person walk out ur life bc you wont put ya pride aside bc they hurt you first or simply just bc ur stubborn
-1	rt nathansykes us boys at the pride of britain awards the other night such a great humbling experience http t co ejhyfqom
-1	nintendo ds accessories thine pride optimal gqxzn http t co pgpmghrxbj
-1	every party when it come to all you can eat my pride always at stake
-1	i love you without knowing how or when or from where i love you simply without problems or pride irrcne
-1	rt _deejayeem my pride is at an all time high
-1	rt redstratuss new social media revamp for faze_pride he asked for lions so here you go d retweets and favorites are appreciated http
-1	msfinesse247 n my pride is strong so that tweet was for myself as well
-1	rt thecubstpl tpl4 14 days to defend the title be champions again do it for the pride http t co diojssnmnw
-1	power chair pride jet 2 price 350 00 united states conyers http t co 1iiel9qmae
-1	rpfostex yeah but somteimes it s only pride keeping you lonely
-1	eaststigers what do the numbers on the players backpacks represent loving the pride with which uniform incl bags is being worn
-1	rt erictucker2 my pride will be the death of me lol
-1	it s not a pride thing with me it s just a idc not into the games over your bs thing trixareforkids
-1	got a text tonight saying you take pride in being a bitch maybe
-1	rt niallofficial for such a small country small population the power that the irish name carries around the world is unbelievable p
-1	argumatronic lonely is always boring and a bitch regardless of pride
-1	justiphied_ace it is choosing to learn from them is especially if pride is in the way
-1	rt _deejayeem my pride is at an all time high
-1	rt drpayal_1289 food comes from farm these farms make country charm our country s pride is hidden in farms possible bcz of of farmers
-1	xenophobicattack sa s please read on leviticus 19 vs 33 37 especially those who pride themselves as christians weareafrica
-1	happy is the soul that has something tq look backward to with pride and something to look fomward to with hope oliver g wilson
-1	rt tacaraaaa_ pride too strong
-1	rt bickprincess nothing wrong with being white and proud it s the fact that y all suddenly show your pride when other cultures are tryin
-1	rt jonwonder4life sometime you just have to lay down that pride and ask for help it doesn t hurt to ask for an assist
-1	rt benrobertssmith leaving brisbane and starting the journey to gallipoli such a privilege to be going there for the anzaccentenary
-1	my family my pride
-1	big gay day tomorrow usual saturday routine of washing car amp self followed by picking up girl friend pride in the park date and sleepover
-1	rt johnpfinch u cannot b the dad god called u 2 be living with pride anger amp unforgiveness thefathereffect
