-1	chelsa dens hey now snowpiercer was legit cool actions scenes and sick set costume design
-1	i know snowpiercer is bullshit because it only took 11 hours on my plane for the common people to completely disregard class priorities
-1	lovely friday night finally checking out snowpiercer gotta say i like it so far
-1	http t co lcd6izhcv1 snowpiercer official us http t co 4wfynnsokz chris evans movie official release snowpiercer trailer
-1	watched snowpiercer tonight i think it was my third viewing it is a great achievement of filmmaking
-1	i don t think dens realizes he being trolled when people tell him to watch movies like idiocracy and snowpiercer
-1	qubaisiiii snowpiercer
-1	miraclebiebs snowpiercer
-1	speaking of trolling nice shade snowpiercer graphics novel publisher people via http t co bp4bh7hewk http t co kkqabbshu5
-1	rt dnhills 1 for having a storyboard artist named zoddd snowpiercer
-1	rt dnhills 1 for having a storyboard artist named zoddd snowpiercer
-1	1 for having a storyboard artist named zoddd snowpiercer
-1	sourcitruslady snowpiercer is great off the wall imaginative
-1	oh man that was a great movie just what i needed today snowpiercer
-1	snowpiercer is a fever dream it is orwell writing doctor who it is swinton in prosthetics it s fucking good
-1	watched snowpiercer and why is everyone not watching this movie right now
-1	alexisdolin snowpiercer
-1	chrisevans i know you re knee deep in avengers stuff right now but wow amazing work on snowpiercer
-1	rt dnhills tilda swinton truly makes this movie snowpiercer
-1	rt rosstinmurphy our adventurejam game a parody of snowpiercer called slaughtertrain http t co nkyopmlzxr lmichet kentsutherland
-1	tilda swinton truly makes this movie snowpiercer
-1	bluejowalton well except for snowpiercer
-1	rt rosstinmurphy our adventurejam game a parody of snowpiercer called slaughtertrain http t co nkyopmlzxr lmichet kentsutherland
-1	our adventurejam game a parody of snowpiercer called slaughtertrain http t co nkyopmlzxr lmichet kentsutherland gamedev
-1	rt dnhills oh snowpiercer you are a fantastic movie so far
-1	oh snowpiercer you are a fantastic movie so far
-1	did not realize snowpiercer starred ryannagle
-1	i love movies with deep meaning behind them like classism and marxism and some other ism lol snowpiercer is freaking amazing
-1	op_israel youranonnews intifada reminds me of snowpiercer where an uprising was created to lower population palestine
-1	stevenzanga rewatching snowpiercer right now to calm my got craving a bit
-1	copperbadge bolto a snowpiercer thomas the tank engine crossover http t co 48naeist8h
-1	rt humonlazydiva watched snowpiercer and i still don t get why they were so shocked they were eating bugs isn t that pretty normal in mo
-1	rt suspirialex bay of blood bava 1971 the fall tarsem 2006 helter skelter ninagawa 2012 snowpiercer bong joon ho 2013 http t co
-1	daddybearcub attack the block snowpiercer and edge of tomorrow surprisingly good i m sure there are more too
-1	so checked out the first vol of the comic for snowpiercer really liking it and the film adaptation but for very different reasons
-1	rt sarahevonne there are more than the two back cars of this train trust me move forward an nj transit conductor or a rebel leader o
-1	just learned that snowpiercer was initially a comic book i will now subtract 6 of its cool points
-1	there are more than the two back cars of this train trust me move forward an nj transit conductor or a rebel leader on snowpiercer
-1	bay of blood bava 1971 the fall tarsem 2006 helter skelter ninagawa 2012 snowpiercer bong joon ho 2013 http t co gbwdasozdo
-1	omg they have snowpiercer holy shit ive wanted to watch that for so long i now know what happiness is
-1	rt ichthala finding a seat on the amtrak regional today was much like living in snowpiercer
-1	finding a seat on the amtrak regional today was much like living in snowpiercer
-1	rt asifstark snowpiercer has one of the best production design in the cinematic history there i said it
-1	contrarah do you know when snowpiercer s released in the uk can t find it anywhere and it s been on my list for ages
-1	dear people watch snowpiercer is probably one of the best movies ever created so smart and so human http t co 2uqszovqgk
-1	of course you watch it now and see how much debt the fight scenes in snowpiercer owe to it forward forward https t co nkqxax2nmn
-1	i m in oporto watching snowpiercer
-1	rt oneperfectshot snowpiercer 2013 director of photography kyung pyo hong director joon ho bong http t co rkcdrdnmfh
-1	if any of you haven t seen snowpiercer make it your next movie to watch on netflix it is great
-1	ep 59 fluxtaposed netflixation snowpiercer shout outs to multiplayingnet and thenoyse 3
-1	rt humonlazydiva watched snowpiercer and i still don t get why they were so shocked they were eating bugs isn t that pretty normal in mo
-1	rt asifstark snowpiercer 2014 director of photography kyung pyo hong director joon ho bong oneperfectshot http t co a7qfx9hprp
-1	snowpiercer 2014 director of photography kyung pyo hong director joon ho bong oneperfectshot http t co a7qfx9hprp
-1	watched snowpiercer and i still don t get why they were so shocked they were eating bugs isn t that pretty normal in most of the world
-1	http t co lov7hnrqef snowpiercer official http t co o1f1anpgw3 chris evans movie official release snowpiercer trailer
-1	audrey kupferberg snowpiecer people are talking about a 2013 feature called snowpiercer by south korean filmmaker http t co gixzemqsq2
-1	snowpiercer 2014 director of photography kyung pyo hong director joon ho bong oneperfectshot http t co ddkc5afomk
-1	snowpiercer 2014 director of photography kyung pyo hong director joon ho bong oneperfectshot http t co es1fnktdwg
-1	rt oneperfectshot snowpiercer 2013 director of photography kyung pyo hong director joon ho bong http t co rkcdrdnmfh
-1	rt oneperfectshot snowpiercer 2013 director of photography kyung pyo hong director joon ho bong http t co rkcdrdnmfh
-1	rt oneperfectshot snowpiercer 2013 director of photography kyung pyo hong director joon ho bong http t co rkcdrdnmfh
-1	it s a really dope film asifstark snowpiercer has one of the best production design in the cinematic history there i said it
-1	rt asifstark snowpiercer has one of the best production design in the cinematic history there i said it
-1	snowpiercer has one of the best production design in the cinematic history there i said it
-1	belenasri snowpiercer
-1	what should we watch tonight it s snowpiercer vs midnight in paris asktwitter
-1	snowpiercer on blu ray gets better on second viewin this movie is absolutely nuts more like insane tests the moral standards of humanity
-1	snowpiercer is so fucking good okay
-1	snowpiercer full movie play now http t co uhfk7pskha watch in hd http t co ppsguz3awp
-1	if u didn t see our adventurejam entry look here http t co egp8eevtfj a game for everyone who had a strong opinion about snowpiercer
-1	buy a new car and drive it around the lot non stop snowpiercer style so it retains its value forever
-1	wired snowpiercer is happening
-1	wired snowpiercer is not a how to foodie movie
-1	lrt snowpiercer anyone
-1	new upload torrent movies snowpiercer 2013 720p brrip x264 aac5 1 amp 2 0 cknz eng subs amp dual audio mkv 999 57 mb ltti
-1	rt lmichet do you want to play a magnificent game about violence on a train in the spirit of snowpiercer well here is one http t
-1	fiffilino grym i puncture the iceman och snowpiercer
-1	femalesanluxury snowpiercer
-1	watch snowpiercer 2013 full movie streaming online free hd the post watch snowpiercer 2013 full movie str http t co jlw8spd18f
-1	rt banishedtopen all aboard snowpiercer podcast discussion with tylersnotes fuqtheheck amp bleeinternets right here http t co fq
-1	rt tylersnotes i made my podcast debut to talk about snowpiercer with fuqtheheck and bleeinternets for banishedtopen http t co e2zou
-1	rt tylersnotes i made my podcast debut to talk about snowpiercer with fuqtheheck and bleeinternets for banishedtopen http t co e2zou
-1	all aboard snowpiercer podcast discussion with tylersnotes fuqtheheck amp bleeinternets right here http t co fq2a8bawpr
-1	rt dafewikoluli 499 snowpiercer top 5 magic realism moments mood indigo
-1	rt tylersnotes in which i directly compare snowpiercer to willy wonka and the chocolate factory and drop the mic around 49 minutes in
-1	rt tylersnotes in which i directly compare snowpiercer to willy wonka and the chocolate factory and drop the mic around 49 minutes in
-1	in which i directly compare snowpiercer to willy wonka and the chocolate factory and drop the mic around 49 minutes in
-1	i made my podcast debut to talk about snowpiercer with fuqtheheck and bleeinternets for banishedtopen http t co e2zouc6x6i
-1	rt dafewikoluli 499 snowpiercer top 5 magic realism moments mood indigo
-1	i think i have an inkling though grim as it may be snowpiercer
-1	something occurs to me as i watch snowpiercer finally if the world is frozen how have they been fueling the train
-1	chrisevans just watched snowpiercer good unique movie stand up performances cap
-1	snowpiercer bluray nicht skipbare trailer justsaiyan
-1	nostamal snowpiercer eh
-1	rt camillehugret wow snowpiercer is a very cool and stylistically different movie the train is the world we the humanity
-1	nickelcity justinvl now that the snowpiercer weather is gone we can start talking engagement photos i will be sans pants for these too
-1	menjalani hobby snowpiercer https t co tfq4popzbn
-1	rt driedpond i m still snowpiercer trash af
-1	i m still snowpiercer trash af
-1	499 snowpiercer top 5 magic realism moments mood indigo
-1	nowwatching snowpiercer
-1	rt sofuxenuwani 499 snowpiercer top 5 magic realism moments mood indigo
-1	rt fabianrangeljr remember in snowpiercer when they ate those really dark gross protein blocks batman v superman y all
-1	hellstrawberry bnokj thecasualheroes archaia snowpiercer is the next book i ve been considering
-1	banished to the pen mop up duty the off topic podcast snowpiercer http t co iwiwowkjfy
-1	nw snowpiercer
-1	which movie do you think is overrated snowpiercer http t co 8qosyoxwiz
-1	mahahahahahaha please watch snowpiercer
-1	kgbwrites evans also did the loosers amp snowpiercer both comic books
-1	3 tilda swinton snowpiercer she s totally different person in this film she s fucking bravura she should be nominated for an oscar
-1	chris evans has the worst time on trains captainamerica snowpiercer http t co vaeqcqtvgx
-1	499 snowpiercer top 5 magic realism moments mood indigo
-1	watching snowpiercer at arifhmzhh https t co haqfpps1rs
-1	watching snowpiercer https t co w9ut2xprpd
-1	rt lmichet do you want to play a magnificent game about violence on a train in the spirit of snowpiercer well here is one http t
-1	snowpiercer film trailer auckland guide to http t co t27qhbzlf9
-1	snowpiercer is the best fucking move i ever saw in my life
-1	rt lmichet do you want to play a magnificent game about violence on a train in the spirit of snowpiercer well here is one http t
-1	snowpiercer the most interesting and thought provoking movie that i have watched since fight club so under rated so freaking good
-1	this bobs burger episode based on snowpiercer
-1	do you want to play a magnificent game about violence on a train in the spirit of snowpiercer well here is one http t co egp8eevtfj
-1	rt psnancylp i want the snowpiercer dvd that airungarky amp chrisefangirls are giving away http t co ljjn3ix1t8 contest
-1	cowb0ybebop carrie the giver snowpiercer world war z warm bodies
-1	everybadgirl if he was the snowpiercer fairy then i guess i can go a little easier on him
-1	lost in translation take shelter moon o snowpiercer
-1	the fact snowpiercer hasn t been released in the uk is a national tragedy amp should be at the heart of at least one party s manifesto
-1	colorfulhue okok already saw snowpiercer loved it so much
-1	51nful i forgot if i told you to watch me nobody yet but if not watch it or i origins snowpiercer big fish or hesher
-1	remember in snowpiercer when they ate those really dark gross protein blocks batman v superman y all
-1	snowpiercer has scarred me
-1	cdir is snowpiercer any good looks a bit different
-1	jinnyboy having worked on snowpiercer what are your thoughts on asian cinema
-1	so i m working on a snowpiercer title sequence for one of my classes and i got bored and http t co apujvon2qz http t co ypium0sb9a
-1	need to get hands on snowpiercer graphic novel
-1	nw snowpiercer http t co yffbus4ieu
-1	i want the snowpiercer dvd that airungarky amp chrisefangirls are giving away http t co ljjn3ix1t8 contest
-1	fcbarceleona snowpiercer
-1	my dad and brother didn t like furious 7 so i made it up to them by having them watch snowpiercer with me just now
-1	hayleyhitchcock so gone girl into the woods or snowpiercer all really good
-1	rt exoimplosion go fucking watch snowpiercer rt cerements go watch snowpiercer
-1	rt dafewikoluli 499 snowpiercer top 5 magic realism moments mood indigo
-1	go fucking watch snowpiercer rt cerements go watch snowpiercer
-1	hayleyhitchcock gone girl imitation game into the woods snowpiercer theory of everything as above so below i work in a movie store
-1	bluedevillair i couldn t stay awake during snowpiercer
-1	bluedevillair serious http t co zwjjerho5n
-1	bluedevillair snowpiercer
-1	jaflanagan as should snowpiercer
-1	chapel3929 you do hate alot of things i still can t wrap my head around snowpiercer but yes daredevil exceeded my quite high expectations
-1	besides if you average out captain america and his character snowpiercer chris evans has basically played tom joad already
-1	rt z0e_marie snowpiercer needs more recognition for being such an amazing movie
-1	snowpiercer needs more recognition for being such an amazing movie
-1	snowpiercer no axn black
-1	watching snowpiercer https t co pwvcja88st
-1	adymeyer watch snowpiercer on netflix and you ll see yourself on the silver screen
-1	rt kam_uran everyone go watch snowpiercer on netflix
-1	captainbarns dude snowpiercer is such a good movie i cry
-1	chris evans in snowpiercer whew what even let me have you with your stupid axe swingin and intensity and lionheartedness
-1	nw snowpiercer
-1	_emdaddy snowpiercer on netflix its scifi though lol
-1	i forgot how depressing snowpiercer is
-1	this dude in snowpiercer is speaking korean and i only understand the curse words lmfao
-1	it was supposed to be snowpiercer but this happened
-1	everyone go watch snowpiercer on netflix
-1	this scene inspired snowpiercer captainamerica tennightsofmarvel
-1	snowpiercer the chilling tale of jonsnow amp the fickle heart that beat w in his chest lt gots5e1 50shadesofsnow gt http t co 19spczjtbh
-1	mulegirl wait is snowpiercer coming true
-1	this thing s heavy yo my beautiful and big and heavy snowpiercer the graphic novel portuguese edition http t co ot2ow7zq7u
-1	snowpiercer though
-1	alex_groux snowpiercer
-1	watching snowpiercer after having a very frustrating fb conversation is oddly gratifying
-1	on the plus side i watch snowpiercer or kill bill
-1	welshmatt i m not even answering that because i told you later that i was doing snowpiercer
-1	welshmatt pretty sure i ve said that i would be doing snowpiercer
-1	nazaniin_ snowpiercer
-1	rt jansengray_jo snow piercer https t co eekj3cc73n all uk shud watch this before ge2015 uk see exactly what ur leaders think of you
-1	basedonika beatriceca well that s okay at least u watched snowpiercer
-1	snowpiercer have you seen
-1	snowpiercer http t co kxjsxofpm3
-1	he_le_na_ whiplash gonegirl secretlifeofwaltermitty dallasbuyersclub faultinourstars snowpiercer nebraska
-1	rt basquiatball fivefifths if the snowpiercer train can make the change from expensive delicious human to crickets i m sure we can
-1	fivefifths if the snowpiercer train can make the change from expensive delicious human to crickets i m sure we can
-1	amandinechb snowpiercer ma douce
-1	_c0ughsyrup snowpiercer
-1	we talked about which movies we were going to write about in philosophy and i was surprised at how many people recognized snowpiercer
-1	chrisevans hey man snowpiercer was awesome keep up the good work brother
-1	rt chrisevans thank you to everyone that went out and saw snowpiercer i have some wonderful supporters and i hope they know they re appr
-1	rt chrisevans snowpiercer this weekend if you re looking for something different check it out rotten tomatoes has our back
-1	snow piercer https t co eekj3cc73n all uk shud watch this before ge2015 uk see exactly what ur leaders think of you snowpiercer
-1	so the train film was snowpiercer as i trundle my way home i have a similar idea a train wobbles through a kent landscape of bungalows
-1	freethestones snowpiercer and ish
-1	if spider man had twitter he d be like it s so hot in new york chris evans just agreed to do a snowpiercer sequel just to cool off
-1	atomicrunning captain america should grow a beard in fact captain america should just copy the snowpiercer aesthetic mmmm
-1	watch snowpiercer f u l l_m o v i e in hd 1080p to watch full movie http t co kdfhmpgboc http t co sfkpiszw6n
-1	in other news i still have no idea what snowpiercer was trying to tell me amp i watched it over 12 hours ago
-1	photoset imagine cinema snowpiercer 2013 dir joon ho bong submitted by theseburningskies http t co icwxqtlous
-1	11 seats per row i d rather ride in the back of snowpiercer http t co tf0b3gsryv http t co ndy5qobmia
-1	snowpiercer https t co zjfcypelf6
-1	my contibution too snowpiercer i used to have a great job http t co ueuf9rjav6
-1	adamshaftoe i dig it it s just that snowpiercer attempts to do a lot more than most lots of avenues to explore there
-1	adamshaftoe like snowpiercer can mean lots of things more movies w class commentary w repulsive tilda swinton w trashing ayn rand
-1	i don t care if you judge me for saying it but we need more movies like snowpiercer
-1	snowpiercer
-1	rt andrewmalemojo office mood today snowpiercer
-1	oh shit snowpiercer is on tv but i have to leave soon
-1	u know its bad when u see pics of chris evans in snowpiercer unshowered covered in dirt and youre still like ya http t co njowxbdvt8
-1	office mood today snowpiercer
-1	kitarocarr yeah fuck it kept me pretty entertained watch snowpiercer too weird af but i liked the idea lol
-1	rt bafeldman just realized that snowpiercer absolutely ripped off supertrain http t co s2kwu6kiry http t co 19igj950bm
-1	bernietb railbus is your home now it s like a really low budget snowpiercer
-1	ho ly fetch watch snowpiercer if you want your mind blown such a good movie
-1	i can t wait til the 30 years in the future snowpiercer sequel when hipsters are making artisanal protein blocks
-1	rt beardchaser just watched snowpiercer and i got to say i was not impressed
-1	just watched snowpiercer and i got to say i was not impressed
-1	bingecast snowpiercer official us release http t co xjffqvcu1s chris evans movie official release snowpiercer trailer
-1	honestly times like these thinking of the train crash at the end of snowpiercer provides me great comfort it does sorry if perplexes
-1	499 snowpiercer top 5 magic realism moments mood indigo
-1	watching snowpiercer with a friend and not spoiling anything but wtf is going on in this movie even
-1	i know this is way late but my top 3 films of 2014 were 1 the babadook 2 whiplash 3 snowpiercer scharrystories iauura gabriellegrape
-1	petition for skelequin to get words tattooed all over his body like the badass kid in snowpiercer so he can point to them to communicate
-1	brendanfrasers yochevedke oakttree bittyjack chris evans is so fucking rank in snowpiercer like he http t co aofklchxtq
-1	evan_kaplan go snowpiercer it s the perfect blend of action and trippy
-1	evan_kaplan two movies my way and snowpiercer
-1	did he like snowpiercer https t co yq4g2hkmoi
-1	snowpiercer is a two hour long john wick fight club scene
-1	snowpiercer 2013 full movie http t co jpyh7wck1f god s not dead 2014 full movie http t co cmitse5fpa
-1	hey snowpiercer is still awesome the 5th time around
-1	being john malkovich take shelter snowpiercer o drive
-1	snowpiercer is a cool movie
-1	snowpiercer is a metaphor for technology the engine must be powered by any means if you re not with it you freeze to death
-1	owlandish_ snowpiercer if its still tehre
-1	christinapaik making a cameo in snowpiercer she looking good in that mink coat though
-1	photoset autisticzukos get to know me meme 6 6 movies snowpiercer 2013 my friend you suffer http t co yromdvmufw
-1	tv und digital 01 55 sky cinema 24 snowpiercer science fiction action cz 2013 http t co av9mb3hsm7 tv news free
-1	whoa snowpiercer was actually good
-1	rt rmlt1005 and the train rolls on earloframsey snowpiercer
-1	and the train rolls on earloframsey snowpiercer
-1	now that i m done watching snowpiercer look at what i m starting vannadear http t co c5xsnmhyzt
-1	i m losing my mind dying on the inside snowpiercer is such a poignant display of humanity a little bit of good a whole lotta bad sigh
-1	thomas_william9 so have you watched snowpiercer yet
-1	jesus christ snowpiercer amp chrisevans were absolutely brilliant what an astounding movie dark beyond words i wasn t ready for that
-1	completo snowpiercer the explorers https t co 3f4kea5rz8
-1	rt psnancylp i want the snowpiercer dvd that airungarky amp chrisefangirls are giving away http t co ljjn3ix1t8 contest
-1	soarflush_ snowpiercer
-1	ag_conservative scottlincicome what is this snowpiercer
-1	i feel like this movie is fucking with my mind for some reason snowpiercer
-1	australia 98 snowpiercer joon ho bong http t co vczzmtusld movies itunes iphone apple
-1	rt goxadovusoq 499 snowpiercer top 5 magic realism moments mood indigo
-1	the movie snowpiercer is soo good how did i never hear about this movie
-1	just watched snowpiercer for the most part a medicore action film with some interesting elements and a really thought provoking ending
-1	had to see snowpiercer because cinemasins always gushes over dammit he was right
-1	499 snowpiercer top 5 magic realism moments mood indigo
-1	rt ahalida snowpiercer is a unique style adventure film with a very pessimistic image at the ending nevertheless a brilliant wild ride
-1	rt ahalida snowpiercer is a unique style adventure film with a very pessimistic image at the ending nevertheless a brilliant wild ride
-1	rt nitocuqopudo 499 snowpiercer top 5 magic realism moments mood indigo
-1	darrencriss darren have you seen snowpiercer i m stressed rn
-1	eonline this guy chrisevans snowpiercer http t co qjt0ldkuh0
-1	snowpiercer https t co mxvetgzhki
-1	watching snowpiercer and tilda swinton s character is killing me
-1	rt qamynimobog 499 snowpiercer top 5 magic realism moments mood indigo
-1	go movie http t co tgvgkz1uxr snowpiercer 2013 http t co y47xt3qzbt
-1	they ve got no bullets lol snowpiercer
-1	snowpiercer is kinda neat so far
-1	beckycloonan beatonna mckelvie davaja i thought becky lived on the comics version of the snowpiercer train
-1	kmasterson532 can i ask you few questions about snowpiercer i told you before i am writing my master thesis about science in the movie
-1	rmeiselman talking about snowpiercer in my div
-1	i think i will finally watch snowpiercer tonight
-1	what was the last gift you gave somebody snowpiercer on dvd http t co f8lquwl14v
-1	pattonoswalt daredevil reminded me of snowpiercer beautiful scene
-1	ccp_sharq ccp_punkturis ccp snowpiercer i ve only seen pictures of that bike surrounded by snow
-1	pinkdisney1994 i wasn t leaving without that photo i had him sign my snowpiercer dvd for me too wasn t letting my son get all the glory
-1	hurdyiv corey_milne ksheely opens roof hatch of train car snowpiercer was kind of shite
-1	david ve la de snowpiercer loco
-1	aymlouise_ benjiminskin97 snowpiercer
-1	wow snowpiercer is a very cool and stylistically different movie the train is the world we the humanity
-1	obat snowpiercer with christina https t co yg8itrspz8
-1	snowpiercer was one trippy movie incredible set design
-1	499 snowpiercer top 5 magic realism moments mood indigo
-1	themeatly it s called snowpiercer
-1	snowpiercer might just be the most interesting and genius future vision movie i ve seen in ages lt 3 snowpiercerus
-1	snowpiercer is really fucked up
-1	thanks cbgirl19 for the recommendations watching snowpiercer night crawler and the babadook
-1	snowpiercer
-1	snowpiercer is really interesting
-1	jw snowpiercer
-1	fact everything sounds better than these fucking promos for stuff before snowpiercer
-1	snowpiercer is not a train it is a fucking roller coaster of emotions
-1	chrislamberth evans has been in 2 top franchises plus the overrated but somehow cult loved snowpiercer so what does that mean
-1	rt goxadovusoq 499 snowpiercer top 5 magic realism moments mood indigo
-1	snowpiercer
-1	commissnrjordan are we saying snowpiercer instead of cool now
-1	rt dannyaston1 is snowpiercer a vision of a hideously warped dystopian future or a literal depiction of how it feels using public transpo
-1	rt yaboytdash watching snowpiercer
-1	rt yaboytdash watching snowpiercer
-1	rt yaboytdash watching snowpiercer
-1	rt yaboytdash watching snowpiercer
-1	rt yaboytdash watching snowpiercer
-1	rt yaboytdash watching snowpiercer
-1	rt yaboytdash watching snowpiercer
-1	rt yaboytdash watching snowpiercer
-1	rt yaboytdash watching snowpiercer
-1	rt yaboytdash watching snowpiercer
-1	rt yaboytdash watching snowpiercer
-1	rt yaboytdash watching snowpiercer
-1	rt yaboytdash watching snowpiercer
-1	rt yaboytdash watching snowpiercer
-1	rt yaboytdash watching snowpiercer
-1	rt yaboytdash watching snowpiercer
-1	rt yaboytdash watching snowpiercer
-1	rt yaboytdash watching snowpiercer
-1	rt yaboytdash watching snowpiercer
-1	rt yaboytdash watching snowpiercer
-1	rt yaboytdash watching snowpiercer
-1	rt yaboytdash watching snowpiercer
-1	rt yaboytdash watching snowpiercer
-1	rt yaboytdash watching snowpiercer
-1	rt yaboytdash watching snowpiercer
