-1	watching snowpiercer with ali mohammed and abdullah at nizar s palace https t co tergyarrxi
-1	if you haven t seen snowpiercer drive no one lives or the guest remedy that business my fave actions movies this decade 4real
-1	about to watch snowpiercer
-1	ye gods the snowpiercer review will be over 10k views by the end of the month did that many people even see it http t co zyqkc0tg4m
-1	filmsum2015 20 elysium blomkamp s great style tramples all over any substance for class warfare it s still better than snowpiercer
-1	snowpiercer does what elysium did but better
-1	guys you have to watch snowpiercer it s fantastic
-1	palancaaaa snowpiercer
-1	csyzle snowpiercer
-1	once again watching snowpiercer
-1	fshknn this is the other movie i was talking about it is called snowpiercer
-1	theraph_ snowpiercer
-1	mydivergentstar snowpiercer
-1	just finished watching snowpiercer good movie chrisevans
-1	snowpiercer 2013 mason s speech https t co hilwv4bvym via youtube
-1	an amazing movie to thrill the senses is snowpiercer from calm to whoa in 2 5
-1	izlenecek filmler listende neler var gone girl snowpiercer cloud atlas pacific rim kill your darlings two nig http t co jhzjcqpt2t
-1	so snowpiercer is really good but i think i m scared for life now
-1	i just saw snowpiercer and chris evans is the fucking bomb i have to admit it s a weird ass movie but it s so good
-1	i watched the movie snowpiercer today and wow what was that
-1	rt waxaxutogude 499 snowpiercer top 5 magic realism moments mood indigo
-1	ruchasharma snowpiercer
-1	itsvyforshort here we go snowpiercer 2013 at http t co x4ttv8sq8f movie film streaming http t co ofyiuo5v8l
-1	snowpiercer 2013 http t co rxq24ww7bj
-1	rt cinemasins high octane action amp heist y fun can be done without great stupidity see ghost protocol oceans series snowpiercer the r
-1	budwainright great time watching snowpiercer 2013 at http t co s5yebtwic3 movie film streaming http t co 0j24kxzyjm
-1	i have netflix and i m going to use it until my free trail runs out now time to watch snowpiercer
-1	a lot of friends have told me how great a film called snowpiercer is so that is my sunday night me and netflix
-1	rt voqesutyvyb 499 snowpiercer top 5 magic realism moments mood indigo
-1	snowpiercer is now 660 out of 1754 movies on my flickchart http t co xuiqltmgns via flickchart
-1	rt _thatgirlsadako arrrk_ watch snowpiercer its pretty good
-1	snowpiercer 2013 http t co jes4zo92vt fantastic snowpiercer
-1	now watching snowpiercer
-1	e_film_blog yeah freakin weinstein snowpiercer is amazing one of the best sci fis of the last few years
-1	thanks in movie http t co tgvgkz1uxr snowpiercer 2013 http t co vfpg8geayq
-1	e_film_blog snowpiercer
-1	ended my night yesterday with snowpiercer i hightly recommend it snowpiercer intense
-1	what s your opinion of this movie snowpiercer imdb movienight movies comments
-1	rt dendydirect snowpiercer the best weirdest action movie of 2014 we couldn t agree more marcfennell http t co iomnw84xko http
-1	after watching snowpiercer and interstellar i ve been interested in the future of food production let s eat bugs http t co c7h760fdbl
-1	rt dendydirect snowpiercer the best weirdest action movie of 2014 we couldn t agree more marcfennell http t co iomnw84xko http
-1	snowpiercer sure was an unexpected core workout i am very much against any child feeling that helplessness of a parent hurting them
-1	rt dendydirect snowpiercer the best weirdest action movie of 2014 we couldn t agree more marcfennell http t co iomnw84xko http
-1	rt dendydirect snowpiercer the best weirdest action movie of 2014 we couldn t agree more marcfennell http t co iomnw84xko http
-1	rt dendydirect snowpiercer the best weirdest action movie of 2014 we couldn t agree more marcfennell http t co iomnw84xko http
-1	rt dendydirect snowpiercer the best weirdest action movie of 2014 we couldn t agree more marcfennell http t co iomnw84xko http
-1	michaelneale snowpiercer was not a dystopian future but merely one where such a machine got stuck on
-1	rt dendydirect snowpiercer the best weirdest action movie of 2014 we couldn t agree more marcfennell http t co iomnw84xko http
-1	rt dendydirect snowpiercer the best weirdest action movie of 2014 we couldn t agree more marcfennell http t co iomnw84xko http
-1	rt dendydirect snowpiercer the best weirdest action movie of 2014 we couldn t agree more marcfennell http t co iomnw84xko http
-1	snowpiercer the best weirdest action movie of 2014 we couldn t agree more marcfennell http t co iomnw84xko http t co yyrhc9sebf
-1	watched this last night dystopian metaphor worth a watch snowpiercer rotten tomatoes http t co o4sms9wysc
-1	for realz snowpiercer is weinstein mischief but not sure what happened to the one i love ambercropp
-1	rt ambercropp bristol52 yep so annoying same with snowpiercer doh
-1	bristol52 yep so annoying same with snowpiercer doh
-1	watching snowpiercer tilda swinton is so brilliant wow lt 3
-1	avoiding_bears snowpiercer has some lovely moments the film but your dream sounds better
-1	i don t even watch downton abbey well a couple of christmas specials under serious duress and i ve never read seen snowpiercer
-1	woke up late after a very involved dream about a post apocalyptic all star downton abbey taking place on a train like snowpiercer
-1	shadeoffh snowpiercer
-1	madridistazazo watching snowpiercer watch if you haven t already
-1	brown_skin334 the greatest movie ever made snowpiercer 2013 at http t co tppnyljxki movie film streaming http t co hyqzolbyp1
-1	snowpiercer phew
-1	it was snowpiercer that was a good movie it was entertaining
-1	recomendaci noc rompenieves snowpiercer de bong joon ho en la filmotecacat a las 19h http t co fwwvj1ev1z http t co rom293kggs
-1	watching snowpiercer at riedsinvincible https t co prwjfyghss
-1	snowpiercer is on netflix
-1	snowpiercer was awesome sauce that movie was sick
-1	movie review snowpiercer winter is coming
-1	just finished watching snowpiercer surprisingly cool and interesting movie
-1	i want the snowpiercer dvd that airungarky amp chrisefangirls are giving away http t co ljjn3ix1t8 contest
-1	marveleuxqueen me too i mean he said like superhero horror or soe sjit but idk what that means still gonna watch it tho snowpiercer 2 0
-1	watching snowpiercer https t co fowe3hc9o3
-1	timp it was actually le_transperceneige a k a snowpiercer i missed a few syllables
-1	holy crap y all weren t kidding about that hallway fight in e2 of daredevil that was some snowpiercer level crap right there
-1	just watched snowpiercer it s a really effed up willy wonka story where charlie overtakes the factory
-1	watched snowpiercer earlier amp it s true dystopian bleak movie so if that s your thing you ll like it
-1	seriously snowpiercer is weird af
-1	arrrk_ watch snowpiercer its pretty good
-1	lotsoflea attack the block snowpiercer the tale of the princess kaguya inherent vice the grandmaster only 130 min chinese cut though
-1	snowpiercer is a good movie if you have netflix you should watch it
-1	snowpiercer is one of the best movies on netflix nbs
-1	eh snowpiercer a better movie than dredd if you talking action and going through different floors levels challenges
-1	_aquemini yourfavtweeter_ watch snowpiercer on netflix best movie i ve seen in awhile
-1	499 snowpiercer top 5 magic realism moments mood indigo
-1	dougbenson i know this might be old but snowpiercer blew my mind amazing action film
-1	atheistraven whiplash is better now that i realize it s a horror movie and fletcher is the monster snowpiercer is about income inequality
-1	cullene i watched snowpiercer on netflix a while ago it was so weird i couldn t stop thinking about it for several days
-1	snowpiercer is the best movie the second best movie is the second time you watch snowpiercer
-1	dougbenson check out snowpiercer man
-1	rt xoaydee dee19__ snowpiercer
-1	dee19__ snowpiercer
-1	eldritchgirl sblackmoore it s like snowpiercer instead of a train everyone just lives in their cars and goes nowhere
-1	just caught snowpiercer on netflix amazing job octaviaspencer 1jamiebell and a dirty bearded chrisevans hawt
-1	oh man two great holy shit movies today snowpiercer and the guest defs recommend them
-1	dougbenson snowpiercer was a pleasant surprise
-1	what the fuck snowpiercer
-1	snowpiercer 2013 http t co hcik2cbnxh
-1	i think one thing snowpiercer managed to do is steer away from muddy colors even though it clearly has a dark palette
-1	just watched snowpiercer ehh
-1	snowpiercer ends in whitegenocide thus recommended
-1	admitreckless snowpiercer
-1	don t watch snowpiercer if you love yourself
-1	maniacalmom indubitably snowpiercer
-1	brianmhays sitting there watching snowpiercer 2013 at http t co oezocuzutz movie film streaming http t co lgqui3v3u0
-1	deanosupreme snowpiercer
-1	learningb4 i ve watched the switch snowpiercer guardians of the galaxy and now lone survivor i m a lazy ass today
-1	saroshrizvi check out snowpiercer from 2013
-1	snowpiercer is a weird weird movie
-1	straycomet omg i loved snowpiercer i could totally watch it again
-1	oh my god this episode of bob s burgers is snowpiercer
-1	follow to watch snowpiercer 2013 movie free online watch movie free vidwiz 60 vidwizmovies http t co h1d0dywjde
-1	rt yeloson convos w aki_hearts_cake fly snowpiercer airlines it ll cost you an arm and a leg but it won t cost you money
-1	hst0417 watching this movie snowpiercer 2013 at http t co mqyq9l9khb movie film streaming http t co vnbxutqho1
-1	have netflix watch snowpiercer
-1	justmelann lilmamacitadont jhwilliamsiii fight scene at the end of ep 2 blew me away reminded me of snowpiercer
-1	snowpiercer is one of the best movies recently
-1	pewdiepie still better than snowpiercer
-1	rt mgraybenson telepathicsign thinking about someone while watching snowpiercer 2013 at http t co zvnmjkz3ad movie film streaming
-1	without intending to i m watching back to back films scored by beltrami but this isn t the only hinge between snowpiercer and the homesman
-1	interesante understanding art house snowpiercer via theenerdwriter http t co 8cx1qn3rcu
-1	rt nitocuqopudo 499 snowpiercer top 5 magic realism moments mood indigo
-1	chrishemsworth avengers chrisevans robertdowneyjr mr evans seems to have just walked off snowpiercer set
-1	snowpiercer falling on cedar rapids add3filmstogether
-1	late80_s snowpiercer brokeback mountain
-1	just finished watching this snowpiercer amazing high concept great cast never even heard of it http t co oobpaskv1w
-1	snowpiercer is a bloody good film so it is
-1	theres a cookie run parody for a trailer of the movie snowpiercer
-1	everyone who likes cult classics snowpiercer and agirlwalkshomealoneatnight are instants watch em up
-1	snowpiercer 2 5 filmtajm
-1	misteresoteric snowpiercer is better than all the marvel movies not called captain america 2
-1	corbinasmith prequel to snowpiercer
-1	some marvel loonie compared ant man to snowpiercer lol
-1	mikeisernie now snowpiercer is in my netflix que noturningback
-1	rt aahildayani holy shit ant man looks phenomenal that train sequence is on par with snowpiercer and unstoppable and any other movie wi
-1	mikeisernie i have gone this long with out watching snowpiercer amp then you show me that every frame a painting as an example leftorright
-1	holy shit ant man looks phenomenal that train sequence is on par with snowpiercer and unstoppable and any other movie with a train xd
-1	renigada i missed this tweet and i love you for it i had such a hard time with snowpiercer
-1	amiinamohammed snowpiercer
-1	snowpiercer is one mind boggling lame movie i really don t get the movie rating system never gonna watch a high rated one again
-1	haley guydebort we stream the f amp f movies fault in our stars snowpiercer with surfbordt yelix amp dogswithhats on rabbit
-1	telepathicsign thinking about someone while watching snowpiercer 2013 at http t co zvnmjkz3ad movie film streaming
-1	26 reasons snowpiercer is the best movie you ve never seen or why you should see it tix
-1	demain j me retappe snowpiercer fyi
-1	fangirljeanne i just love him i need to watch snowpiercer again
-1	sieaterkinney you ve gotta have a spare 3 hours its super long oh i remember talkin about snowpiercer amp funny games they re good
-1	snowpiercer is such a good movie but don t watch it if you get too attached to characters too fast bc you won t survive it like me lol
-1	lucapasqualino love you in snowpiercer one of my favorite movies
-1	and before i can go on let me said that this is not as good as snowpiercer but snowpiercer is only a hair better than ex machina
-1	djeddielynn btupinit out if what i see on netflix i recommend django chef snowpiercer if you want gory action or billy madison
-1	remember snowpiercer
-1	sapphirescribe i ve seen push losers fierce people snowpiercer recently number amp fantastic four forever ago need to rewatch soon
-1	thyunique snowpiercer
-1	have any of you seen snowpiercer bc oh my god
-1	499 snowpiercer top 5 magic realism moments mood indigo
-1	i rated snowpiercer 2013 9 10 imdb http t co p8xrnxnsfq
-1	snowpiercer is an absolutely riveting movie
-1	nw snowpiercer
-1	lucapasqualino i know your mentions are a hot mess but i gotta shout you out for snowpiercer most brilliant film amp i cried for 2 weeks
-1	ajbouvin snowpiercer is really good and it s on netflix
-1	the last film i watched twice in such quick succession was snowpiercer
-1	herts_lioness relaxing in bed watching snowpiercer 2013 at http t co cdx0kbio3t movie film streaming http t co zwaxh1igzh
-1	snowpiercer the strangest film i ve seen in quite some time chrisevans
-1	pacingpete just finished watch snowpiercer 2013 at http t co u10icovrfm movie film streaming
-1	ccole72 that scene reminded me of the happy new year scene in snowpiercer wait till you see fisk d onofrio is great
-1	lucapasqualino i just watched snowpiercer for the 100th time for you and i died again
-1	rt sweetestsara reminder there is a v intense moment in snowpiercer where a dude slips on a fish
-1	is helen listening to my snowpiercer mix
-1	motherfuckin snowpiercer
-1	had an awesome ride through snow and trees on a train thankfully not called snowpiercer snowpiercerus http t co vlnysstdku
-1	the first episode of daredevil was okay but the second one was actually pretty amazing that ending fight scene reminded me of snowpiercer
-1	snowpiercer is overrated
-1	i had no idea captain america was also the snowpiercer guy
-1	t_h3n5 keres81 tgilbt sharethis thomas_william9 breaking_karma ccrobyn1 have you seen snowpiercer my oldest said it was good
-1	daniisok keres81 tgilbt sharethis thomas_william9 breaking_karma ccrobyn1 snowpiercer is on netflix odd thomas is a neat movie too
-1	t_h3n5 keres81 tgilbt sharethis thomas_william9 breaking_karma ccrobyn1 actually i m thinking snowpiercer or there is a swedish one
-1	snowpiercer
-1	rt joshvisser if you take mcdonalds on to a train you deserve to be in the back of the snowpiercer train
-1	if you take mcdonalds on to a train you deserve to be in the back of the snowpiercer train
-1	nw the snowpiercer
-1	meechieduzit just finished watch snowpiercer 2013 at http t co tjchtqdsyu movie film streaming
-1	drlawyercop jrothenberg and the train wreck is snowpiercer not the 100 wrong show the100
-1	kyothekishi also don t forget snowpiercer chris pine sassy koreans
-1	moms gonna watch snowpiercer nyeheheheh
-1	lauraratcliff probably star wars snowpiercer is awesome one of the best movies i ve seen in a while
-1	bogo_lode what movie we are going to watch snowpiercer tonight some people say it s even better than interstellar
-1	drethelin snowpiercer plague year
-1	i heard that was the stupidest movie ever made vicky vs snowpiercer berlinersachs2k15
-1	rt nitocuqopudo 499 snowpiercer top 5 magic realism moments mood indigo
-1	rt sweetestsara reminder there is a v intense moment in snowpiercer where a dude slips on a fish
-1	thanks in movie http t co tgvgkz1uxr snowpiercer 2013 http t co vjobnf6yov
-1	snowpiercer was an interesting movie
-1	finally got around to watching snowpiercer worth the wait hmmmm waggles hand up and down
-1	rt voqesutyvyb 499 snowpiercer top 5 magic realism moments mood indigo
-1	499 snowpiercer top 5 magic realism moments mood indigo
-1	duncanrobinson ertraeglichkeit snowpiercer plan
-1	huertaperla22 watching this movie snowpiercer 2013 at http t co erykwlv9ri movie film streaming
-1	watching snowpiercer and it s blissfully quiet
-1	thatmovieguyuk i didn t know snowpiercer hasn t had a uk theatrical run yet
-1	snowpiercer http t co urugnhwzux
-1	snowpiercer http t co urugnhwzux http t co wlivdxqzgg
-1	snowpiercer cover vcd front ccrediti_image scarica la copertina in alta qualit amp agrave http t co kz923w3u2k
-1	nowdownloading snowpiercer https t co uzidsx9lo5 movies recommended
-1	bookshopgirl212 that s how snowpiercer started out
-1	end of daredevil ep 2 gets to join the genre of my favorite fights hallway mayhem like the raid oldboy and snowpiercer daredevil
-1	rt sweetestsara reminder there is a v intense moment in snowpiercer where a dude slips on a fish
-1	watching snowpiercer https t co tp74g3q0vd
-1	nw snowpiercer
-1	greyjamiedornan back to watching snowpiercer 2013 at http t co 6ixcj8g6j1 movie film streaming http t co djoycdqx4v
-1	rt thesublemon gabrielduquette so basically it s snowpiercer but vertical
-1	gabrielduquette so basically it s snowpiercer but vertical
-1	watched snowpiercer and yeah man humanity
-1	finished watching snowpiercer disappointed and a little confused
-1	rt mark_hobin grand budapest hotel snowpiercer trainwreck tilda swinton is like bacon she makes everything better
-1	olgakay snowpiercer turns head slightly right
-1	snowpiercer so glad i finally got to watch it
-1	watching snowpiercer https t co alf9pxishd
-1	snowpiercer captain america hunger games mario frozen wizard of oz kill bill do yourself a favor by watching this movie
-1	rt problemchvld snowpiercer is good so far wishing my baby was enjoying it with me tho
-1	andrewjcoe kharden7398 and snowpiercer is just the name of a train
-1	rt sweetestsara reminder there is a v intense moment in snowpiercer where a dude slips on a fish
-1	jaedoee snowpiercer
-1	im so underwhelmed by snowpiercer but it gets better
-1	thor is at the head of the train fuck yeah snowpiercer ageofultron
-1	chris evans and chris hemsworth being interviewed together remains the best thing ever also this interviewer asking about snowpiercer
-1	understanding art house snowpiercer http t co bjbhlsoqyg bong joon ho
-1	well everyone died snowpiercer
-1	if you haven t seen snowpiercer change that shit best movie i ve seen in a while
-1	rt sweetestsara reminder there is a v intense moment in snowpiercer where a dude slips on a fish
-1	he s at the engine now and my mind is blown fuck this fuck this whole movie snowpiercer
-1	saw snowpiercer all i can say s that if it was the great princeatari revolution we would ve made it to the engine room in 1 2 the time
-1	on the real this movie is so fucked up and chris evans is so tragic and fucked up and i can t rn snowpiercer
-1	my poor baby is so saddd snowpiercer
-1	rt sweetestsara reminder there is a v intense moment in snowpiercer where a dude slips on a fish
-1	beldonstevens is snowpiercer any good
-1	what the fuck is the rave in the middle of the train snowpiercer
-1	rt sweetestsara reminder there is a v intense moment in snowpiercer where a dude slips on a fish
-1	where the fuck did te guns come from what snowpiercer
-1	there is still an hour left oh my god snowpiercer
-1	rt sweetestsara reminder there is a v intense moment in snowpiercer where a dude slips on a fish
-1	yasssss they brought fireeee snowpiercer
-1	does this movie have a happy ending i need to know snowpiercer
-1	the fucking tunnel fuck this fuck everything snowpiercer
-1	i really don t like snowpiercer
-1	what happens at the bridge what i happening i m happy fucking new year are you shitting me snowpiercer
-1	i m not okayyyyy snowpiercer
-1	itsjustjosh_ old boy snowpiercer
-1	rt sweetestsara reminder there is a v intense moment in snowpiercer where a dude slips on a fish
-1	oh my god their food is oh my god im vomiting snowpiercer
-1	abbey_moses your dad needs to get his crap together snowpiercer is top tier
-1	look at my babyyyyy snowpiercer
-1	im so anxious snowpiercer
-1	ericnamofficial watching snowpiercer for the first time man this movie tough to watch at some parts but gorgeous how s the sandwich
-1	what did they do to his arm oh my god snowpiercer
-1	what are they doing to the children snowpiercer
-1	rt sweetestsara reminder there is a v intense moment in snowpiercer where a dude slips on a fish
-1	rt sweetestsara reminder there is a v intense moment in snowpiercer where a dude slips on a fish
-1	rt sweetestsara reminder there is a v intense moment in snowpiercer where a dude slips on a fish
-1	rt sweetestsara reminder there is a v intense moment in snowpiercer where a dude slips on a fish
-1	reminder there is a v intense moment in snowpiercer where a dude slips on a fish
-1	my aunt and uncle have seen snowpiercer i don t know anyone outside of twitter tumblr who have seen snowpiercer life is good
-1	under the skin amp snowpiercer back to back alternate history black widow amp captain america marathon with odd wintry resonant mise en scenes
-1	hmmm watch the jinx or just rewatch snowpiercer for the umpteenth time
-1	they talked about snowpiercer
-1	snowpiercer is a quality film 9 10
-1	just saw snowpiercer my life has been changed gamechanger
-1	photoset 2014 the best of film 15 25 15 snowpiercer http t co geltxsrd2a
-1	tastybooktours best one movie snowpiercer 2013 at http t co h5hubzgaxb movie film streaming
-1	girlsday_dai5y_ love watching these snowpiercer 2013 at http t co ptouogfsde movie film streaming http t co p6vczq1sb3
-1	snowpiercer is an interesting movie although quite possibly a little too weird for me
-1	superherohype i love watch snowpiercer 2013 at http t co gqnjisxqr4 movie film streaming
-1	ebugamer snowpiercer
-1	katrina_araujo snowpiercer
-1	bmharder anybody else watching snowpiercer 2013 at http t co lygxcqesey movie film streaming http t co pstcb1ns29
-1	trailers from hell boards snowpiercer http t co keo41j33xl
-1	stcom here we g0 snowpiercer 2013 at http t co jhzk97lcay movie film streaming
-1	finally watching snowpiercer tonight i may livetweet but i m a super spotty live tweeter so it probs won t be that bad p
-1	for anyone looking for a movie to watch i highly recommend snowpiercer
-1	convos w aki_hearts_cake fly snowpiercer airlines it ll cost you an arm and a leg but it won t cost you money
-1	snowpiercer is also a good korean movie if it counts since it s mostly in english
-1	rt maki_ksh0216 photo movie snowpiercer premiere 5 fanpic cr pic kimsoohyun http t co 6lpqqojiiz
-1	rt maki_ksh0216 photo movie snowpiercer premiere 5 fanpic cr pic kimsoohyun http t co 6lpqqojiiz
-1	rt maki_ksh0216 photo movie snowpiercer premiere 6 fanpic cr pic kimsoohyun http t co iq6flpfquo
-1	psa snowpiercer is a horrible movie whiplash is a fantastic one
-1	finishing off snowpiercer
-1	blackmagicolive snowpiercer
-1	jeramywainwrigh this is the same way i watched snowpiercer and it ruined that
-1	being on this train really hammers home how unrealistic snowpiercer was
-1	reason why there won t a snowpiercer 2 no train no gain
-1	watching snowpiercer
-1	why have i waited this long snowpiercer is just phenomenal
-1	watching snowpiercer and it s blissfully quiet
-1	so snowpiercer is still as good as i remember it to be
-1	has tonight watched a fil um called snowpiercer
-1	remingtonwild thefirstpaige i had snowpiercer in mind for this one
-1	so after watching snowpiercer and now that new pic chris evans is going on my listttttt
-1	snowpiercer is a fucking masterpiece http t co flsfok159h
-1	jwwlancaster but honestly if snowpiercer is on there i recommend it
-1	understanding art house snowpiercer https t co epdaoop0l0 via youtube
-1	avengermama i m watching what s your number then snowpiercer just ordered punture off of amazon
-1	ericvespe scotteweinberg which movie no bs the snowpiercer commentary is one of the best i ve listened to you guys say smart things
-1	now i know how the people in the back of the train felt in snowpiercer http t co clj75vxfy5
-1	cine snowpiercer 2013 http t co xtwgvynisi en cinemaforum
-1	cine snowpiercer 2013 http t co mvwfcgtatl en cinemaforum
-1	cine snowpiercer 2013 http t co owwtyudslu en cinemaforum
-1	gabrielecapo aright im done watching snowpiercer 2013 at http t co dhb3yt3mx3 movie film streaming http t co euqukcmi6r
-1	snowpiercer man thinks he can control nature nature squashes him like a tiny tiny bug many spoilers http t co 37ocdthqem
-1	snowpiercer is really good
-1	thewife101 jealous wish i had time to watch snowpiercer and chrisevans right now drowning in studies for the next four weeks
-1	my apologies fgw i take it the sequel to snowpiercer is being film on the train either that or i m stuck in a dystopian future fgwkmc
-1	499 snowpiercer top 5 magic realism moments mood indigo
-1	the broadcast version of snowpiercer has horrrrrible subtitles lmao lmao i cant i cant this is too much
-1	the snowpiercer axe fight scene is so freaking good
-1	photoset valyrianswords get to know me meme 2 10 favorite female characters yona snowpiercer http t co o9hiwtjrac
-1	watching snowpiercer again chrisevans is beyond brilliant and the rest of the cast absolutely incredible http t co qfdlcweefj
