-1	dcqs15 stranger by the lake french queer film on neflix rec d by fawwaz
-1	stranger by the lake in 4 minute long out of the woods
-1	stranger by the lake blu ray stranger by the lake blu ray patrick d assum ao actor http t co 3xuhkt0afb gay lesbian dvd
-1	stranger by the lake blu ray stranger by the lake blu ray patrick d assum ao actor http t co dyo5rcfme8 gay lesbian dvd
-1	stranger by the lake blu ray stranger by the lake blu ray patrick d assum ao actor http t co jxcmlvgjhp gay lesbian dvd
-1	rt acswear22 mattbuehler stranger by the lake no joke it s like a wierd suspenseful comedy
-1	rt acswear22 mattbuehler stranger by the lake no joke it s like a wierd suspenseful comedy
-1	rt acswear22 mattbuehler stranger by the lake no joke it s like a wierd suspenseful comedy
-1	mattbuehler stranger by the lake no joke it s like a wierd suspenseful comedy
-1	just watched a super intense homoerotic thriller on netflix stranger by the lake watch it if you re looking for a sexy slowburner
-1	blu ray best sellers in gay amp lesbian 7 stranger by the lake blu ray http t co psqo3xg3w2 http t co 9wyorreurh
-1	stranger by the lake
-1	rt amosposner maybe not the most sensitive reaction to a body being found in lake mendota but i d love a uw madison based stranger by th
-1	rt amosposner maybe not the most sensitive reaction to a body being found in lake mendota but i d love a uw madison based stranger by th
-1	my problem with stranger by the lake is that the protagonist chose attraction over survival instincts that makes sense with college kids
-1	maybe not the most sensitive reaction to a body being found in lake mendota but i d love a uw madison based stranger by the lake remake
-1	stranger by the lake 2013 http t co x1xsqzc145
-1	bnowalk i mean stranger by the lake that was just such an experience
-1	infernaldante58 i liked ausente a bit but i don t think it s half as potent or observant as stranger by the lake or in the house
-1	stranger by the lake https t co riyhg1cyrl
-1	the first few minutes of stranger by the lake has had more dick shots than i ve seen in every other film combined which is bizarre
-1	finally a mainstream film with male nudity only the male form re emerges as in ancient greece stranger by the lake https t co cb54bgnqvc
-1	rt wydubawuqavu she drowned and was found several hours later by a stranger walking near the lake
-1	went to a midnight screening of stranger by the lake unsurprisingly at midnight on a friday night in nyc i was the only one to show up yolo
