-1	20 1624 airplane kits 1 48 mitsubishi ka 14 ghibli the wind rises fine molds http t co jevsunavjf http t co b9kakwic7h
-1	wanna see it watching the wind rises
-1	the kingdom of dreams and madness might actually be better than the wind rises the movie they re making in the doc in terms of depth
-1	if you re thinking of watching the wind rises don t because it ll make you sad for a thousand years
-1	478 the lego movie the wind rises top 5 miyazaki characters
-1	rt beckyjaee i really need to get howl s moving castle and the wind rises on dvd already
-1	i really need to get howl s moving castle and the wind rises on dvd already
-1	48john she doesn t dislike them she went with me to see the wind rises on campus the other day and seemed to like it
-1	and with that i finally watched the wind rises it felt like the right time to
-1	idk how to feel about the wind rises it really wasnt what i expected at all
-1	rt freshairfarmer blue sky amp no wind as the hay dust slowly rises above the mixer beautiful day farm365 http t co og22mqv4ox
-1	until the sun rises in west and sets in the east until the rivers run dry and the mountains blow in the wind like leaves
-1	we rented whiplash and the wind rises i need to be held
-1	don t know what i m going to do after the wind rises finishes and the studio ghibli season ends on film4
-1	the wind rises is making me so emo
-1	with 2 somewhere between paprika and the wind rises idgaf about live action films
-1	wish my sisters room wasn t right next to lounge because then i could be watching the wind rises right now
-1	watches anime during the breaks of the wind rises because im too weeaboo to handle
-1	i forgot how happy the wind rises makes me
-1	fitting to see the wind rises on the hotel tv whilst i pack my suitcase for tomorrows departure amechibi http t co oulbe0cb6z
-1	the wind rises film4 studio ghibli season drawing to an end http t co f0qcqeeaaq
-1	finally getting to see the wind rises thank u film4
-1	the wind rises 2013 is about to start on film4 http t co xclevjqosh
-1	rt film4 our late night highlight at 1 30am is hayao miyazaki s aeronautical biopic the wind rises studioghibliseason https t co ykeb
-1	i told ciara that jiro from the wind rises was my dad but she got confused of which meaning of dad i meant
-1	as if the wind rises is on in half an hour
-1	rt keyykitty morgan s about to drug her mum so she can watch the wind rises with me couplegoals http t co 2kn9f7766q
-1	morgan s about to drug her mum so she can watch the wind rises with me couplegoals http t co 2kn9f7766q
-1	lisa_jakub gt spirited away the wind rises etc perfect for sick days in my opinion
-1	rt film4 our late night highlight at 1 30am is hayao miyazaki s aeronautical biopic the wind rises studioghibliseason https t co ykeb
-1	rt bangumi_uk tonight 1 30am film4 the wind rises 2013 miyazaki s swansong rounds off film4 s studioghibliseason http t co irwyb9xl
-1	the wind rises is on should i watch it and cry all over again or remain okay as i am now
-1	until the sun rises in the west and sets in the east until the rivers run dry and the mountains blow in the wind like leaves
-1	whose gonna watch the wind rises with me at 1 30 pm on film4 please it my first time watching im v fragile
-1	the wind rises 2013 is on film4 at 1 30am http t co suuhdxxzia
-1	iwillvoteforhillarywhen the sun rises in the west and sets in the east the seas go dry amp mountains blow in the wind like leaves
-1	rt film4 our late night highlight at 1 30am is hayao miyazaki s aeronautical biopic the wind rises studioghibliseason https t co ykeb
-1	rt film4 our late night highlight at 1 30am is hayao miyazaki s aeronautical biopic the wind rises studioghibliseason https t co ykeb
-1	the wind rises 2013 cursed dreams http t co vgi79ne9oh http t co j4n2v3pxba
-1	a kite rises higher against the wind not with it
-1	rt film4 our late night highlight at 1 30am is hayao miyazaki s aeronautical biopic the wind rises studioghibliseason https t co ykeb
-1	rt film4 our late night highlight at 1 30am is hayao miyazaki s aeronautical biopic the wind rises studioghibliseason https t co ykeb
-1	rt film4 our late night highlight at 1 30am is hayao miyazaki s aeronautical biopic the wind rises studioghibliseason https t co ykeb
-1	rt film4 our late night highlight at 1 30am is hayao miyazaki s aeronautical biopic the wind rises studioghibliseason https t co ykeb
-1	rt film4 our late night highlight at 1 30am is hayao miyazaki s aeronautical biopic the wind rises studioghibliseason https t co ykeb
-1	rt film4 our late night highlight at 1 30am is hayao miyazaki s aeronautical biopic the wind rises studioghibliseason https t co ykeb
-1	rt film4 our late night highlight at 1 30am is hayao miyazaki s aeronautical biopic the wind rises studioghibliseason https t co ykeb
-1	studio ghibli s the wind rises is on film4 at 1 30am and stock up on more anim magic here http t co vr4wxw1asa http t co dglge77jfk
-1	rt sashavanhoven we will watch when the sun rises in the west and sets in the east seas go dry amp mountains blow in the wind like leaves
-1	we will watch when the sun rises in the west and sets in the east seas go dry amp mountains blow in the wind like leaves leakofthrones
-1	rt film4 our late night highlight at 1 30am is hayao miyazaki s aeronautical biopic the wind rises studioghibliseason https t co ykeb
-1	rt film4 our late night highlight at 1 30am is hayao miyazaki s aeronautical biopic the wind rises studioghibliseason https t co ykeb
-1	rt film4 our late night highlight at 1 30am is hayao miyazaki s aeronautical biopic the wind rises studioghibliseason https t co ykeb
-1	rt film4 our late night highlight at 1 30am is hayao miyazaki s aeronautical biopic the wind rises studioghibliseason https t co ykeb
-1	rt bangumi_uk tonight 1 30am film4 the wind rises 2013 miyazaki s swansong rounds off film4 s studioghibliseason http t co irwyb9xl
-1	tonight 1 30am film4 the wind rises 2013 miyazaki s swansong rounds off film4 s studioghibliseason http t co irwyb9xlwt
-1	the wind rises is such an amazing film especially the sound design god hot dang it s so crisp and detailed
-1	seosamhhurley awesome glad you liked it the wind rises is less fantasy more historical but lots of similarly stunning sequences
-1	holly_mce yep we ve shown both language versions of the wind rises before
-1	rt film4 our late night highlight at 1 30am is hayao miyazaki s aeronautical biopic the wind rises studioghibliseason https t co ykeb
-1	rt film4 our late night highlight at 1 30am is hayao miyazaki s aeronautical biopic the wind rises studioghibliseason https t co ykeb
-1	rt film4 our late night highlight at 1 30am is hayao miyazaki s aeronautical biopic the wind rises studioghibliseason https t co ykeb
-1	the wind rises is an absolutely beautiful film
-1	rt film4 our late night highlight at 1 30am is hayao miyazaki s aeronautical biopic the wind rises studioghibliseason https t co ykeb
-1	rt film4 our late night highlight at 1 30am is hayao miyazaki s aeronautical biopic the wind rises studioghibliseason https t co ykeb
-1	rt film4 our late night highlight at 1 30am is hayao miyazaki s aeronautical biopic the wind rises studioghibliseason https t co ykeb
-1	rt film4 our late night highlight at 1 30am is hayao miyazaki s aeronautical biopic the wind rises studioghibliseason https t co ykeb
-1	rt film4 our late night highlight at 1 30am is hayao miyazaki s aeronautical biopic the wind rises studioghibliseason https t co ykeb
-1	rt film4 our late night highlight at 1 30am is hayao miyazaki s aeronautical biopic the wind rises studioghibliseason https t co ykeb
-1	rt film4 our late night highlight at 1 30am is hayao miyazaki s aeronautical biopic the wind rises studioghibliseason https t co ykeb
-1	rt film4 our late night highlight at 1 30am is hayao miyazaki s aeronautical biopic the wind rises studioghibliseason https t co ykeb
-1	rt film4 our late night highlight at 1 30am is hayao miyazaki s aeronautical biopic the wind rises studioghibliseason https t co ykeb
-1	our late night highlight at 1 30am is hayao miyazaki s aeronautical biopic the wind rises studioghibliseason https t co ykeblqyvrl
-1	rt qulahehubac 478 the lego movie the wind rises top 5 miyazaki characters
-1	it might be late but it might be worth it the wind rises in original japanese tonight on film4 01 30am
-1	wow i had no idea that hideaki anno was the voice of jiro in the wind rises what
-1	when the sun rises in the west and sets in the east when the rivers go dry and mountains blow in the wind like leaves ahi te recibir s
-1	imdb the wind rises http t co jr1ak5wj07 cw
-1	rt sweetcovet do not fear adversity remember a kite rises against the wind rather than with it bmrtg
-1	rt sweetcovet do not fear adversity remember a kite rises against the wind rather than with it bmrtg
-1	do not fear adversity remember a kite rises against the wind rather than with it bmrtg
-1	i m watching the wind rises again my heart can t take this
-1	parn83 disney no need to ask i do as well picking up the wind rises today
-1	rt philreinhardt don t be afraid of opposition remember a kite rises against not with the wind
-1	atento estoy viendo the wind rises
-1	kaze no tachinu the wind rises en cinemaxla
-1	could wind turbine high rises be the future of high density living here s one designer s vision for the f http t co hmgzaxakff
-1	do not fear the winds of adversity remember a kite rises against the wind rather than with it unknown author
-1	en instantes por canalmaxla estoy viendo i m watching the wind rises 2013 https t co u48bw09lnj trakt
-1	hoy dan the wind rises en max
-1	the wind rises 2 breaking wind unlikelysequels
-1	could wind turbine high rises be the future of high density living here s one designer s vision for the futur http t co n1iqawfflo
-1	rt freshairfarmer blue sky amp no wind as the hay dust slowly rises above the mixer beautiful day farm365 http t co og22mqv4ox
-1	watching the wind rises https t co edrnlxvzly
-1	rt freshairfarmer blue sky amp no wind as the hay dust slowly rises above the mixer beautiful day farm365 http t co og22mqv4ox
-1	rt freshairfarmer blue sky amp no wind as the hay dust slowly rises above the mixer beautiful day farm365 http t co og22mqv4ox
-1	the wind rises 2013 http t co ejngaecvqz biography in form of animation jiro horikoshi not so fun 7 10
-1	the wind rises is so good and such a tearjerker
-1	rt freshairfarmer blue sky amp no wind as the hay dust slowly rises above the mixer beautiful day farm365 http t co og22mqv4ox
-1	rt freshairfarmer blue sky amp no wind as the hay dust slowly rises above the mixer beautiful day farm365 http t co og22mqv4ox
-1	rt qulahehubac 478 the lego movie the wind rises top 5 miyazaki characters
-1	a wind that rises in the daytime lasts long but a night breeze soon falls
-1	the wind rises is the only hayao miyazaki film i haven t seen yet
-1	rt freshairfarmer blue sky amp no wind as the hay dust slowly rises above the mixer beautiful day farm365 http t co og22mqv4ox
-1	blue sky amp no wind as the hay dust slowly rises above the mixer beautiful day farm365 http t co og22mqv4ox
-1	rt asagikurosagi the wind rises is fucking amazing
-1	after the sun rises in the west and sets in the east after the seas go dry and mountains blow in the wind like http t co 2rolro2ryc
-1	in my head if this was hayao miyazaki final masterpiece than why did it not win the 2013 academy award for http t co 29tfgnk22f
-1	laputa on film4 now and the wind rises on later tonight at a ungodly hour
-1	so ready to watch the wind rises but i don t wanna not actively watch sigh
-1	478 the lego movie the wind rises top 5 miyazaki characters
-1	rt cinematribute the wind rises 2013 directed by hayao miyazaki inspiration unlocks the future http t co uqb6h8kf0x
-1	rt vehoqucehaz 478 the lego movie the wind rises top 5 miyazaki characters
-1	explainyourusername the wind rises by studio ghibli
-1	478 the lego movie the wind rises top 5 miyazaki characters
-1	rt bangumi_uk last day of film4 s huge studioghibliseason 1pm castle in the sky 1986 amp 1 30am the wind rises 2013 http t co irwyb9
-1	i think i ll watch kiki s delivery service or the wind rises in a bit
-1	rt bangumi_uk last day of film4 s huge studioghibliseason 1pm castle in the sky 1986 amp 1 30am the wind rises 2013 http t co irwyb9
-1	the wind rises 3 5 more grave of the fireflies than spirited away it s lovely but i wonder why did the story have to be animated miyazaki
-1	if you re in the uk laputa castle in the sky is on film4 at 1pm while the wind rises is on a 1 30am tonight ghibliseason
-1	last day of film4 s huge studioghibliseason 1pm castle in the sky 1986 amp 1 30am the wind rises 2013 http t co irwyb9xlwt
-1	oh and i did watch the wind rises and it was ok but
-1	the wind rises is fucking amazing
-1	rt craigisonfire don t forget there s more hayao miyazaki on film4 tonight the wind rises on at 1 30am with voice talent from hit
-1	is the wind rising japanese boy miyazaki thewindrises
-1	don t forget there s more hayao miyazaki on film4 tonight the wind rises on at 1 30am with voice talent from hitrecordjoe
-1	the wind rises
-1	now watching hayao mizayaki s farewell masterpiece the wind rises
-1	the wind rises
-1	today marks the finale of the film4 studioghibliseason laputa the castle in the sky 1 00pm amp the wind rises 1 30am
-1	what a great story the wind rises hayao miyazaki s masterpiece
-1	rt calebfreeken watching the wind rises
-1	rt hemingway873 if the wind rises it can push us against the flood when it comes
-1	if the wind rises it can push us against the flood when it comes
-1	rt calebfreeken watching the wind rises
-1	watching the wind rises
-1	just finished watching the wind rises the ending was so sad c http t co qmz1bjgqrc
-1	the wind rises we must attempt to live an yo seob kmhm
-1	beefalo tacos syrah and miyazaki s as the wind rises this is how you do weekends
-1	time to watch the wind rises
-1	lotsoflea well you already have holy motors and the wind rises lined up so jealous of you there but for others
-1	i watcged the wind rises so damn emotional
-1	if you don t know what it is it s the documentary about studio ghibli that chronicles the making of the wind rises
-1	also will always hate and truly hate frozen for beating the wind rises at the oscars but that s a side issue
-1	a pile of children before family movie time the wind rises https t co a14zhjzmxw
-1	10000spirits i found an english dubbed version of the wind rises was as enjoyable as the japanese version also watched exodus new one
-1	don t be afraid of opposition remember a kite rises against the wind
-1	the wind rises is a fine swansong for miyazaki although it is very bittersweet the film is typically poignant accomplished and inspiring
-1	the wind rises is such a beautifully made movie
-1	soul_perception this is me with this song and http t co 9db2cygxnc from the wind rises
-1	finally got around to seeing the wind rises unsurprisingly it s fucking fantastic
-1	gengarsedible it s not as bad as the wind rises loosing to frozen cringes
-1	now watching the wind rises official trailer http t co risk2s2ij4
-1	rt cixewybytyta 478 the lego movie the wind rises top 5 miyazaki characters
-1	until the sun rises in the west and sets in the east until the rivers run dry and the mountains blow in the wind like leaves
-1	the wind rises http t co 4rt5mlbq0b
-1	fucking anno s voice in the wind rises killed me
-1	do not fear the winds of adversity remember a kite rises against the wind rather than with it
-1	nj_ rootsofjustice spacemanhardy it s the wind rises all over again
-1	rt sygisapilizy 478 the lego movie the wind rises top 5 miyazaki characters
-1	rt xosejapypyf 478 the lego movie the wind rises top 5 miyazaki characters
-1	could wind turbine high rises be the future of high density living here s one designer s vision for the f http t co ruykz8mupc
-1	don t be afraid of opposition remember a kite rises against not with the wind
-1	could wind turbine high rises be the future of high density living here s one designer s vision for the f http t co rlczg7a7ne
-1	could wind turbine high rises be the future of high density living here s one designer s vision for the f http t co nsyxedlxzs
-1	until the sun rises in the west and sets in the east until the seas goes dry and mountains blow in the wind like seas
-1	if you are as i am interested in aerospace at all you owe it to yourself to see the wind rises also if you like studio ghibli films
-1	could wind turbine high rises be the future of high density living here s one designer s vision for the future http t co bupswfql30
-1	could wind turbine high rises be the future of high density living here s one designer s vision for the f http t co buvkgan6si
-1	watched the wind rises again so many feels withdominicmeow lt dom wanted me to put this not funny dom
-1	the wind rises official us trailer https t co almer7a41n
-1	rt siaranx the wind rises ost journey dreamy flight by maxk nguyen on soundcloud np https t co q4lcqgoitc
-1	the wind rises ost journey dreamy flight by maxk nguyen on soundcloud np https t co q4lcqgoitc
-1	the main character of the wind rises is just fans self
-1	the wind rises hits you right in the feels
-1	still salty about the oscars snubbing hayao miyazaki last year frozen is a farce compared to the wind rises ugh it will never be ok
-1	rt mozellkrips don t be afraid of opposition remember a kite rises against not with the wind
-1	the wind rises
-1	the wind rises english dub full movie https t co fx9cfdxiai via youtube
-1	rt mozellkrips don t be afraid of opposition remember a kite rises against not with the wind
-1	don t be afraid of opposition remember a kite rises against not with the wind
-1	the last movie from hayao miyazaki san satnitemovie malemminggu the wind rises at tandiassa recidence https t co h6picj1gsm
-1	the wind rises
-1	natasha73 certainly right there watched the wind rises last night great one for miyazaki to bow out on
-1	the dark knight wind rises up add3filmstogether
-1	478 the lego movie the wind rises top 5 miyazaki characters
-1	ukyotachibana do high rises in chicago sway in the wind in a way you can feel when inside them
-1	when the sun rises in the west and sets in the east when the seas go dry and mountains blow in the wind like leaves
-1	478 the lego movie the wind rises top 5 miyazaki characters
-1	blu ray best sellers in military amp war 3 the wind rises 2 disc blu ray dvd combo pack http t co hki5wxnsv4 http t co io25vp7pkl
-1	the earthquake scene in the wind rises just blew my mind miyazaki
-1	the wind rises was beautiful and amazing and i adored the sound design
-1	thai take out sitting down to watch miyazaki s the wind rises missed it in theaters officially calling it an end to the week
-1	i m stuck in this nausea rut where i should have cried during the wind rises but didn t cause i didnt wanna be a bitch baby in front of my
-1	jason6167 if animation works barefoot gen grave of the fireflies the wind rises education for death video games cod metal gear solid
-1	i think i mentioned it but the german dialog in the wind rises was partially overdubbed in the german theatric release o_o
-1	blu ray best sellers in romance 5 the wind rises 2 disc blu ray dvd combo pack http t co hki5wxnsv4 http t co qprftls42f
-1	rt mckenzie_anne the wind rises is beautiful but i don t even know why i m acknowledging this because all studio ghibli movies are
-1	the wind rises is beautiful but i don t even know why i m acknowledging this because all studio ghibli movies are
-1	watching the wind rises not sure how long i ll be able to stay awake
-1	rotoscopers the wind rises d
-1	rotoscopers the wind rises
-1	the wind rises english dub full movie https t co qp2ygv9oq7 via youtube
-1	the wind rises english dub full movie https t co qp2ygusdrx via youtube
-1	rt cornellhawks 4 10 18 39 br rises and adjusts her position a little as the wind begins to pick up again here in cornellhawks land
-1	4 10 18 39 br rises and adjusts her position a little as the wind begins to pick up again here in cornellhawks land
-1	jonathan128k did you watch the wind rises on monday
-1	ohmonah tell me how u feel about the wind rises after you watch it
-1	rt andiblair1492 the wind rises on film4 anyone thewindrises studioghibliseason studioghibli zero pearlharbor justsayin d http
-1	i just watched the wind rises by studio ghibli and i m still crying about it
-1	pretty sure a lot of people forgot the wind rises in their lil top of the 10 s glares condescendingly
-1	rt oneperfectshot the wind rises 2013 director hayao miyazaki see imdb for complete list of animators http t co thuji95ocb
-1	until the sun rises in the west and sets in the east until the rivers run dry and the mountains blow in the wind like leaves
-1	who wants to see a traditionalist review of miyazaki s _the wind rises_ keep your eyes open it s coming soon http t co hg3pyvlnub
-1	followback top ten reasons why the wind rises is the best animated film ever made http t co zvh3fia5vy folowwwback
-1	followback top ten reasons why the wind rises is the best animated film ever made http t co brf49ldqdr folowwwback
-1	followback top ten reasons why the wind rises is the best animated film ever made http t co e59vlslhes folowwwback
-1	could wind turbine high rises be the future of high density living here s one designer s vision for the futu http t co doanbdmcre
-1	could wind turbine high rises be the future of high density living here s one designer s vision for the future http t co po0gbicrsy
-1	could wind turbine high rises be the future of high density living here s one designer s vision for the futu http t co zceyppaiep
-1	could wind turbine high rises be the future of high density living here s one designer s vision for the futur http t co sohegnznru
-1	could wind turbine high rises be the future of high density living here s one designer s vision for the f http t co 0urxrgu7mg
-1	could wind turbine high rises be the future of high density living here s one designer s vision for the future http t co h07m53dbda
-1	could wind turbine high rises be the future of high density living here s one designer s vision for the f http t co tlsxczjdoc
-1	rt bldvlhumanities mon apr 13 chowleen co convener of dukestorylab intro s oscar nominated the wind rises dukeami cine east http
-1	watched the wind rises it was pretty good though some of the sound effects felt eerie
-1	thenamesirfan omg u should watch the wind rises
-1	watched the wind rises with my nan by far my favourite film by studio ghibli
-1	rt bldvlhumanities mon apr 13 chowleen co convener of dukestorylab intro s oscar nominated the wind rises dukeami cine east http
-1	mon apr 13 chowleen co convener of dukestorylab intro s oscar nominated the wind rises dukeami cine east http t co vcimxgfn7y
-1	i can t stop crying staph me the wind rises ending song vapor trail https t co clnefft6ug via youtube
-1	http t co yivtylxdtt orchestra muzakawasaki the asahi shimbun the award ceremony for the 68th mainichi film awards where the prizes
-1	the wind is rising we must try to live thewindrises plane https t co 5qs4b5rvqb
-1	thewindrises it was such a nice anime i liked it the wind is rising we must try to live nakashi27 http t co yvyogs3plc
-1	478 the lego movie the wind rises top 5 miyazaki characters
-1	namely that the wind rises isn t as good as it was made out to be by everyone else or uncritical adulation according to brown j
-1	amp miyazaki s final masterpiece the wind rises
-1	the wind rises os http t co a8xw9dqano
-1	when the sun rises in the west and sets in the east when the mountains blow in the wind like leaves https t co h36dptxl0w
-1	i know i m biased with ghibli but i am honestly still pissed that the wind rises didn t win best animated feature and frozen did
-1	rt gen_ghibli el viento se levanta the wind rises de miyazaki nominada a los saturn awards http t co apx8xve3zk via zerudah http
-1	tokyoreporter ryuganji also very strange to say uncritical reviews when the right wing japanese press were appalled at wind rises
-1	tokyoreporter ryuganji subjective ofc but on the wane simply ignorant nonsense wind rises is his magnum opus
-1	actually come to think of it it sounds a lot like the wind rises too
-1	estoy viendo the wind rises kaze tachinu http t co ktmwrjpkfw via pelispediatv
-1	humanicators screen society next week mon 4 13 the wind rises tue 4 14 the punk singer wed 4 15 not http t co h8gvscnuvt
-1	478 the lego movie the wind rises top 5 miyazaki characters
-1	also need to see the wind also rises since it s miya s last movie i think plus anno plays the main character
-1	karleysoup how to train your dragon 1 amp 2 the wind rises and interstellar p
-1	until the sun rises in the west and sets in the east until the rivers run dry and the mountains blow in the wind like leaves shit
-1	misanoob yeah i haven t seen princess kaguya or the wind rises yet
-1	i haven t cried this much since the wind rises
-1	1kyungsoo and nothing watching tv with my mom but about to go watch the wind rises lt 3
-1	who wants to hang out watch the wind rises and distract me from my fleeting youth
-1	por fin va a ver the wind rises
